post_id,author,body,score,created_utc,date
1jvbmvb,Allyzayd,I just want it to swing to a dollar so I can exit for my mental health.,3,1744232934.0,2025-04-09 21:08:54
1jvbmvb,killakat96,Average down to get out sooner. It works well,2,1744234164.0,2025-04-09 21:29:24
1jvbmvb,Raynman90,Crazy how the entire crypto market revolves around BTC,3,1744240341.0,2025-04-09 23:12:21
1jvbmvb,Ulrich453,Always has,3,1744291301.0,2025-04-10 13:21:41
1jvbmvb,Jute-loves-tacos,buying dips and selling rips!!!!!!,3,1744236390.0,2025-04-09 22:06:30
1jvbmvb,not_into_that,it really should make people start thinking when the S&amp;P 500 looks like a crypto chart.   I mean...,2,1744238005.0,2025-04-09 22:33:25
1jvbmvb,TellMeMore_1111,i wish it could be like this everyday in a month.,2,1744240150.0,2025-04-09 23:09:10
1jvbmvb,Queasy_Albatross_743,Not just crypto,2,1744246855.0,2025-04-10 01:00:55
1jvbmvb,Eazy-E-40,Not really. They barely even hit where they were a week ago.,2,1744251310.0,2025-04-10 02:15:10
1jvbmvb,Fun-Pomegranate6563,Insider traders must be having a ball,2,1744256954.0,2025-04-10 03:49:14
1jvbmvb,jgarcya,I hope Trump keeps the tariff word out of his mouth for the next three months ...  I was expecting alt season in May.... Hopefully we're still on..  I'll be selling long before we crash back down in 90 days ..  If he's gonna keep manipulating the market... At least he gave us a heads up ..  I guess this is the new market.... Trump mentions tariffs... It crashes .. buy .. then sell before he says they start up again.,3,1744228154.0,2025-04-09 19:49:14
1jvbmvb,not_into_that,LOL,1,1744238103.0,2025-04-09 22:35:03
1jvbmvb,Cmill810,I’m sure they will reverse the same way by tomrw morning 😂,4,1744222184.0,2025-04-09 18:09:44
1jvbmvb,jgarcya,Seems to be the thing this last year.... We can never hold gains.,1,1744228211.0,2025-04-09 19:50:11
1jvbmvb,God-Emperor-Pepe,"As I’ve said before, we are very closely mirroring 2021 patterns. Everyone back then was saying the exact same doomer bs. Yes, the Tariffs are a problem; but a. They’re being paused so trade deals can take place; and b. Crypto cycles are going to crypto cycle.",4,1744230022.0,2025-04-09 20:20:22
1jvbmvb,DankShibe,"If this mirror of 2021, then it is only down for now until 2028 (except for BTC) . It is better if this is a mirror of 2017 instead (so that doge gets a bull run  end of the year)",-1,1744231232.0,2025-04-09 20:40:32
1jvbmvb,Jew_Man_Chu,The U.S. president found his medication.,3,1744220796.0,2025-04-09 17:46:36
1jvbmvb,Sad_Detail404,Why don’t you have Litecoin?,1,1744237538.0,2025-04-09 22:25:38
1jvbmvb,Whoisyourfactor,"Man, after reading this I took my 5k gain and waiting for the next 14C drop. I wonder what the next step will be.",1,1744246113.0,2025-04-10 00:48:33
1jvbmvb,lefthandedgypsy,Look at a great time to buy post and a 90 day pause post.   Not sure if that was coincidence or what.,1,1744258125.0,2025-04-10 04:08:45
1jvbmvb,Extension-Lie-3272,"Crypto is going down. Bitcoin, doge and xrp are my last holdouts. Everything else is down 50 60 70 80 percent. It's going to be really rough over the next 4 years. Remember how people thought this time period was gonna be huge? Maybe a huge sale.",1,1744302112.0,2025-04-10 16:21:52
1jvbmvb,Global_Lifeguard688,"Get your bitcoin up, it should be your main hold",1,1744326053.0,2025-04-10 23:00:53
1jvbmvb,Mountain_Plan_4608,Time travel to December 2017.,1,1744330424.0,2025-04-11 00:13:44
1jvbmvb,Legitimate-Space-279,I’m enjoying it,1,1744361126.0,2025-04-11 08:45:26
1jvbmvb,GM-B,"That's because it's an imaginary, unregulated farce.  But good fodder for schemers and dreamers.",1,1744396498.0,2025-04-11 18:34:58
1jvbmvb,Odd_Stick_3042,The last pump in 2025…,1,1744224987.0,2025-04-09 18:56:27
1jvbmvb,DankShibe,"Nah, there is the Christmas rally.",3,1744231080.0,2025-04-09 20:38:00
1jvbmvb,Odd_Stick_3042,The whole year to wait??,2,1744231421.0,2025-04-09 20:43:41
1jvbmvb,OrgyAtPOD6,Im sure you’d like that,2,1744226195.0,2025-04-09 19:16:35
1jvbmvb,Odd_Stick_3042,I’m not sure about that tbh…,2,1744226255.0,2025-04-09 19:17:35
1jvbmvb,DrawMore27,Should we sell!? I have a feeling it’ll drop hard.,1,1744233363.0,2025-04-09 21:16:03
1jvbmvb,killakat96,Yes,1,1744234187.0,2025-04-09 21:29:47
1jvbmvb,Puzzleheaded_Web_603,"Switch to MOG coin, they are at 33% gain today and going",0,1744240727.0,2025-04-09 23:18:47
1jvbmvb,Creepy_OldMan,Just as I decide to buy the dip 😡,-2,1744223720.0,2025-04-09 18:35:20
1jvbmvb,killakat96,It’ll be down again soon,-2,1744234051.0,2025-04-09 21:27:31
1jvbmvb,duzz_dee,poopin mah pants currently with the way this market is railin meh,-2,1744220941.0,2025-04-09 17:49:01
