post_id,author,body,score,created_utc,date
1k5ihj9,Southern-Young-2389,FOMO kicking in,3,1745358602.0,2025-04-22 21:50:02
1k5ihj9,MrEklipze,"Dangerous territories at this point. Unless you are planning on holding long term, this sudden spike can also be followed by a quick drop.",4,1745359238.0,2025-04-22 22:00:38
1k5ihj9,lbvl0mc,Nah. I ain’t selling anymore whatsoever.,1,1745359424.0,2025-04-22 22:03:44
1k5ihj9,ScullingPointers,Same. If anything I'm buying more if the price does in fact fall !,2,1745360912.0,2025-04-22 22:28:32
1k5ihj9,MrEklipze,Up to you. Not everybody has the same perspective. When doge was dipping lots of people just wanted to recover their money and sell. I personally prefer quick spikes/drops. I make that quick money and reinvest it.,1,1745360229.0,2025-04-22 22:17:09
1k5ihj9,lbvl0mc,Definitely. Thing is hopefully we all profit.,2,1745360996.0,2025-04-22 22:29:56
1k5ihj9,[deleted],[removed],1,1745359167.0,2025-04-22 21:59:27
1k5ihj9,I-Respect-You,Evolve your existence to sustain without throwing feces; always remember to D.O.G.E.,-1,1745360654.0,2025-04-22 22:24:14
1k5ihj9,I-Respect-You,"It was about bitcoin, so I reported it for relevance. Have a great day!",1,1745360757.0,2025-04-22 22:25:57
1k5ihj9,lbvl0mc,You’re the imposter.🤣🤣🤣 revealed yourself.,1,1745361042.0,2025-04-22 22:30:42
1k5ihj9,I-Respect-You,![gif](giphy|jH6KlJgmTT2VXbWWnk|downsized),1,1745361384.0,2025-04-22 22:36:24
1k5ihj9,I-Respect-You,I've heard of AI... but A.unI.?,1,1745361617.0,2025-04-22 22:40:17
1k5ihj9,lbvl0mc,🤷‍♂️,1,1745361652.0,2025-04-22 22:40:52
1k5ihj9,Southern-Young-2389,More like $0.12c,1,1745467187.0,2025-04-24 03:59:47
1k5ihj9,Boon_Rebu,Only .20? why so low.,-1,1745358998.0,2025-04-22 21:56:38
1k5ihj9,lbvl0mc,I’m being optimistic,3,1745361017.0,2025-04-22 22:30:17
1k5ihj9,GJustGotaBag,"I agree with Boon surprisingly, your target goal should be much higher… Evaluate using your own trading skills &amp; don’t read media. This is a gold mine that you stumbled upon.",1,1745532429.0,2025-04-24 22:07:09
1k5h149,horseradish13332238,Aw,9,1745355065.0,2025-04-22 20:51:05
1k5h149,Hoov_34,this thing has went up another 2% while you're thinking about it!😵‍💫,7,1745358820.0,2025-04-22 21:53:40
1k5h149,Brilliant-Ad4710,You are right ? I feel like it is headed to at least 30. I am about to get in,5,1745359842.0,2025-04-22 22:10:42
1k5h149,Maleficent-Ad560,Always a good time. It helps the cause. Thank you for your service.,3,1745367713.0,2025-04-23 00:21:53
1k5h149,AlexandersGhost,Probably $.21. You should have bought last week though.,2,1745357743.0,2025-04-22 21:35:43
1k5h149,tjf311,"Time in the market is better than timing the market, the best time to invest is yesterday, the second best is today.  With $500 in you should hit your goal in not too long.",2,1745369397.0,2025-04-23 00:49:57
1k5h149,PhraseTypical2428,![gif](giphy|HCTfYH2Xk5yw),2,1745370400.0,2025-04-23 01:06:40
1k5h149,Hoov_34,Doge ETF's start in may so hopefully everything is uphill from here some analysts are saying it could uptrend until october so it just depends on when you want to jump aboard.,1,1745356086.0,2025-04-22 21:08:06
1k5h149,Brilliant-Ad4710,What do you mean DOGE etf ‘s? I don’t know what that is ?,2,1745356147.0,2025-04-22 21:09:07
1k5h149,Hoov_34,"you can literally google doge etf, there are like 72 crypto currencies applications for ETF's or google what is ETF but basically its a way you can own a mix of cryptocurrencies or bonds or stocks to make them less risky.",1,1745356975.0,2025-04-22 21:22:55
1k5h149,GlitteringJob9248,Damn I havnt bought enough,1,1745357695.0,2025-04-22 21:34:55
1k5h149,PastaVeggies,All in eh?,1,1745358124.0,2025-04-22 21:42:04
1k5h149,Neukted,its up 8000 percent since conception.,1,1745363453.0,2025-04-22 23:10:53
1k5h149,Igotitdawg,Now is the time. Its following bitcoin trend pattern,1,1745368273.0,2025-04-23 00:31:13
1k5h149,EyeStrange9592,"Don't think. Just invest. You could lose your money in 15 minutes. Get use to the cycle. It goes up, then down, then up and down again.",1,1745372146.0,2025-04-23 01:35:46
1k5h149,Cocaineisgr8,"50% chance it goes up, 50% chance it goes down",1,1745373004.0,2025-04-23 01:50:04
1k5h149,Maleficus-Malus,I just want my money back. Lololol.,1,1745373080.0,2025-04-23 01:51:20
1k5h149,AlphaHouston1,like the last 4 months wasnt good enough smh....,1,1745375184.0,2025-04-23 02:26:24
1k5h149,lbvl0mc,Up,1,1745375471.0,2025-04-23 02:31:11
1k5h149,kickbubbles,Best time to invest is always yesterday.,1,1745377254.0,2025-04-23 03:00:54
1k5h149,Southern-Young-2389,Invest half now and other half when drops to 12c,1,1745467255.0,2025-04-24 04:00:55
1k5h149,Zbinxsy,"Cute.... Put it in BTC, more secure and it's lower right now. I feel like this 500 might be something you cant lose. Also doge is up like 15 % it will probably pull back and drop 10% or something stupid. Idk, just buy some spy$ or voo$.",1,1745368311.0,2025-04-23 00:31:51
1k5h149,Brilliant-Ad4710,So it’s a mutual fund basically but can be traded during the day . Interesting . I guess I’ll never k ow a good time to buy . It’s never going past a dollar anyways .,0,1745357057.0,2025-04-22 21:24:17
1k5h149,Hoov_34,"Well assuming were in an up trend, they usually last 2-3 months followed by a cooling off period that last about 100 days to 174 at the longest before the next up trend. So you can Jump in at any point but the trick is jumping out before the Whales jump out.",4,1745358332.0,2025-04-22 21:45:32
1k5h149,Brilliant-Ad4710,Not what I asked . I asked when is a good time to get in . No one who got in at less than Lenny is holding it still,0,1745364492.0,2025-04-22 23:28:12
1k5h149,Latter-Conference-88,Probably best to invest into ethereum instead but if the bull run is about to peak why not I'm back with doge with only $20 AUD invested,0,1745373515.0,2025-04-23 01:58:35
1k5h149,Brilliant-Ad4710,I was only looking to make $200 to be honest . And it is NEVER going to a $1 . Ever,-2,1745364426.0,2025-04-22 23:27:06
1k4d0ng,Ir0nman123,Very true,2,1745241917.0,2025-04-21 13:25:17
1k4a8cj,Kiragalni,It looks suspiciously similar to cardiogram of an average dogecoin investor.,18,1745238151.0,2025-04-21 12:22:31
1k4a8cj,liquid_at,![gif](giphy|CkYl1qlzkxPRbklfXx),20,1745231674.0,2025-04-21 10:34:34
1k4a8cj,Odd_Stick_3042,And what does it mean??,4,1745232448.0,2025-04-21 10:47:28
1k4a8cj,Gloomy_Setting5936,"THE NUMBERS MASON, WHAT DO THEY MEAN?",4,1745248185.0,2025-04-21 15:09:45
1k4a8cj,Odd_Stick_3042,Exactly!,3,1745249901.0,2025-04-21 15:38:21
1k4a8cj,Rshellnizzle,Tomorrow,2,1745234450.0,2025-04-21 11:20:50
1k4a8cj,snorlaxtubbs,Ahahaha very interesting chart,2,1745245719.0,2025-04-21 14:28:39
1k4a8cj,Dougielong,I actually have no idea… everyone out there that knows? M,1,1745232493.0,2025-04-21 10:48:13
1k4a8cj,Ir0nman123,It’s happening!,1,1745232755.0,2025-04-21 10:52:35
1k4a8cj,kmookie,These are death rattles. Often mistaken as if there’s still life.,1,1745288332.0,2025-04-22 02:18:52
1k4a8cj,Sturdily5092,It's circling the drain,1,1745315197.0,2025-04-22 09:46:37
1k4a8cj,natasevres,Dollar is crashing so doge is going up.  Low dollar = higher doge,1,1745251283.0,2025-04-21 16:01:23
1k4a8cj,bodog9696,"100% UNTRUE STATEMENT  The price of dogecoin has zero correlation or causation relationship with dogecoin.  If you don't know, you don't know. You know?  WHY insist on pretending to be knowledgeable about something? I don't get it.",2,1745254917.0,2025-04-21 17:01:57
1k4a8cj,natasevres,"I cant believe this dumb comment.  Ofcoarse doge goes up when the dollar goes down, doge increases in value as the dollar drops in value.  It doesnt mean doge increased, it just means youll get more dollars for the same amount of doge coins. This is too basic, I simply have to assume you are an american.  Only an american can be this dumb.  The dollar has dropped upwards of 10% since the tarriffs.",3,1745255088.0,2025-04-21 17:04:48
1k4a8cj,NothingWrong1234,lol bro you got trolled hard and are just getting eaten alive now.  Bro said dogecoin has zero relationship with dogecoin lol.. made it look like you’re just rambling about nothing now lol,1,1745264728.0,2025-04-21 19:45:28
1k4a8cj,natasevres,I hope your right.  But I dont think he was joking. He is this dumb,3,1745264801.0,2025-04-21 19:46:41
1k4a8cj,Inner-Yams,To your own logic here you are also wrong.  Therefore claiming doge has no correlation with its price is (your logic here sorry) a 100% falsity. ![gif](emote|free_emotes_pack|sleep),1,1745328103.0,2025-04-22 13:21:43
1k4beiv,chr127741,How do you get it,2,1745237718.0,2025-04-21 12:15:18
1k4beiv,creArthur,"It's on the description  📲 ""Doge To Mars"" on iOS app store, 📲 ""Dogecoin To The Moon"" on google play store",2,1745240117.0,2025-04-21 12:55:17
1k4beiv,Robmed85,Yea how do you download it?? How will this help doge??,1,1745239204.0,2025-04-21 12:40:04
1k4beiv,creArthur,"On the description fam  📲 ""Doge To Mars"" on iOS app store,  📲 ""Dogecoin To The Moon"" on google play store",2,1745240137.0,2025-04-21 12:55:37
1k4beiv,creArthur,"🚨 Renaming has been approved, it's now ""Doge To Mars"" everywhere, much simpler, wow",2,1745311672.0,2025-04-22 08:47:52
1k4i9lr,Alternative_Demand96,Maybe hire a financial planner and not people who will tell you to put it all on doge,56,1745254958.0,2025-04-21 17:02:38
1k4i9lr,loc710,Holy cow I didn’t know that sensible people could be found in this sub,8,1745325091.0,2025-04-22 12:31:31
1k4i9lr,Most-Clerk-2828,Great idea.. I would never put it all on doge or one crypto but I can see myself doing 75% on some type of crypto. I just need to find a good financial planner but don’t know where to start and not get scammed.,-12,1745257286.0,2025-04-21 17:41:26
1k4i9lr,Specialist_Ad4414,Be careful a lot of financial planners do not act to serve you. They sell you stocks  or iunvestments that they get paid a commission on. They are told by their superiors what stocks to push so that they can get the commission. As Robert kiosaki once said they called them brokers because they're often broker than you  #,5,1745263489.0,2025-04-21 19:24:49
1k4i9lr,Alternative_Demand96,Robert kiyo whatever is such a dunce lmao,2,1745288033.0,2025-04-22 02:13:53
1k4i9lr,ozziesironmanoffroad,Don’t respond to DMs.   Get a financial planner.,16,1745256807.0,2025-04-21 17:33:27
1k4i9lr,TemporaryDisplaced,"""wow I'm actually looking for an investor to start up my landscaping business, I only need 100k to get going""  ""Make a difference...5k would change my life""  I can see it now",4,1745259769.0,2025-04-21 18:22:49
1k4i9lr,ozziesironmanoffroad,"Right? Same as winning life changing money, you don’t ever want to tell people you suddenly have money. All kinds of creatures start coming out.",3,1745259844.0,2025-04-21 18:24:04
1k4i9lr,Even_Association_467,"I have $5k at just 23% for you, simple forms to fill out and boom , life changed",1,1745361585.0,2025-04-22 22:39:45
1k4i9lr,Treeman1979,This 👆🏻,2,1745276091.0,2025-04-21 22:54:51
1k4i9lr,jorgschrauwen,Get a financial advisor please,8,1745255823.0,2025-04-21 17:17:03
1k4i9lr,Most-Clerk-2828,Do you know any with a reputable company and a real office I can walk into? I believe it would be worth the trip.,3,1745257408.0,2025-04-21 17:43:28
1k4i9lr,jorgschrauwen,"Idk where youre located so i'd use google to find a trustworthy one or maybe your bank could help you, i invest through my bank wich is basically professionals doing that for a living. Im from the Netherlands so im unsure how that would look for you bur best of luck!",2,1745257710.0,2025-04-21 17:48:30
1k4i9lr,EUGsk8rBoi42p,"usbank has free financial ed classes on their website, start there, knowledge is power.",2,1745293621.0,2025-04-22 03:47:01
1k4i9lr,Specialist_Ad4414,Why do people trust financial advisors? Many of them are pushing commission products on you and don't give a crap if you make or lose money.,3,1745263639.0,2025-04-21 19:27:19
1k4i9lr,The_hooligan87,Abraham Shakespeare trusted a fake financial advisor and ended up murdered.,1,1745321132.0,2025-04-22 11:25:32
1k4i9lr,anonymous07865,I thought someone shot him at one of his plays,1,1745416561.0,2025-04-23 13:56:01
1k4i9lr,jorgschrauwen,Not every financial advisor is like this,1,1745264336.0,2025-04-21 19:38:56
1k4i9lr,Merlin1039,Literally the worst sub to ask. What's wrong with you man 🤣,4,1745285155.0,2025-04-22 01:25:55
1k4i9lr,Captnblkbeard,I’ll give you some good financial advice. Never tell people how much money you have. Specially not to random internet potatoes. Now you are going to have a bunch of potatoes trying to scam you.,3,1745297108.0,2025-04-22 04:45:08
1k4i9lr,UsualEconomy5209,"If you're desperate, don't do anything with it.",3,1745319566.0,2025-04-22 10:59:26
1k4i9lr,Virtual_Television98,"Firstly, be careful about links and phishing attempts via DMs.  Secondly, sorry about your parents, that sucks.  Thirdly, you seem to be flustered, chill and speak to a financial adviser. Is investing something you’re interested in?",6,1745254752.0,2025-04-21 16:59:12
1k4i9lr,Most-Clerk-2828,"Thank you very much! that does seem like a great way to go actually. Everything is all hitting me at once and I just don’t want to lose everything.. and I’m scared to put all my money in crypto because what if it crashes and I reallly need some money.. but I also need something for inflation.. cause in 20 years 250k might be worth 20k.. I do know some financial advisors could be a scam too though, so do you know any highly recommended ones I can trust. Please and thank you!",1,1745255301.0,2025-04-21 17:08:21
1k4i9lr,Open-Deal-657,You should buy a lambo,1,1745389610.0,2025-04-23 06:26:50
1k4i9lr,Virtual_Television98," I could go ahead and send you anywhere and scam you, or have you scammed etc. Speak to a financial adviser in person with a proven track record, even so you shouldn’t make decisions while in an emotional state.   I can recommend you a few things you could get into with a portion but even so, take it with a grain of salt, you don’t know me, I don’t know you.",1,1745255866.0,2025-04-21 17:17:46
1k4i9lr,Most-Clerk-2828,"Well thank you for that… a lot of people are recommended a financial advisor I just don’t have any close to me in North Carolina and even then I don’t believe they would get enough business to actually do me good, they got to make their money somehow. I’m scared to go online too cause they can have fake reviews.. and you could scam me I just don’t know how anyone is saying I am trying to scam someone when I’m not asking anyone for money.",1,1745257119.0,2025-04-21 17:38:39
1k4i9lr,Virtual_Television98,"You have to understand this space is filled by a ridiculous amount of scammers, it’s hard to depict who’s who in certain scenarios.   I did send you what I think you could get running at least afk with a small portion, but it’s entirely up to you.",1,1745257281.0,2025-04-21 17:41:21
1k4i9lr,FinalHeaven88,"Buy a small house, that'll save you $ right away. Then you can bank money you make at your job/cut your hours and you'll have extra money coming in each month since you won't be paying rent/huge house payments.",2,1745256207.0,2025-04-21 17:23:27
1k4i9lr,Most-Clerk-2828,Thank you for that really need to hear that. Yea I’m not good at investing on my own. Never thought I’d be at this low point of my life. What banks offer those types of safe investments.. I think a real bank would be my best bet.,1,1745257641.0,2025-04-21 17:47:21
1k4i9lr,Most-Clerk-2828,I own my house Already but maybe I can move into a smaller one and just rent this one out.. I don’t think airbnb will work cause it’s in the country parts of North Carolina,1,1745257837.0,2025-04-21 17:50:37
1k4i9lr,FutureCheese379,Sir. This is Wendy's. ![gif](emote|free_emotes_pack|grin)  ![gif](giphy|UrCpmegKiCMC5TJPVk),2,1745266122.0,2025-04-21 20:08:42
1k4i9lr,420MoneyMaker,"First lesson, Never announce to people that you just came into life changing money because all kinds of predators will be knocking on your door.  Second lesson, never ask people on social. Maybe find a reputable financial advisor who can talk you through investment strategies. Maybe it's real estate, stocks or cryptos. But definitely do your research and GL",2,1745303318.0,2025-04-22 06:28:38
1k4i9lr,Puzzleheaded-Tea4460,"Don't put it in crypto. Especially dogecoin. Ordinarily I'd say the s&amp;p 500, or burkshire b. But stocks are bad right now. Do treasury bonds, gold and silver, do some stocks once the trade stuff gets straightened out",2,1745321460.0,2025-04-22 11:31:00
1k4i9lr,capofliberty,"Buy a house, or a second one.",2,1745322495.0,2025-04-22 11:48:15
1k4i9lr,WaySheGoes69420,BROTHER SPEAK TO A FINANCIAL ADVISOR AND DONT BUY CRYPTO WITH YOUR PARENTS LIFE SAVINGS,2,1745326360.0,2025-04-22 12:52:40
1k4i9lr,C300w204,This is a joke or some social engineering scam,4,1745254630.0,2025-04-21 16:57:10
1k4i9lr,Fast_Quality_2007,Social engineering scam,2,1745255299.0,2025-04-21 17:08:19
1k4i9lr,C300w204,100%,2,1745255518.0,2025-04-21 17:11:58
1k4i9lr,Most-Clerk-2828,"Seriously who thinks “ oh his parents aren’t dead, he probably went to school to scam me out of two seconds of my time!” Boo hoo poor me!  How bout you get your heads out your butt and not think so negatively about everything and maybe you will get somewhere.. instead of trolling all day on Reddit trying to make everything about you.. you sad low life… if all you do is sit on Reddit to downplay someone else’s life experiences  it should tell a lot about you.",-5,1745256140.0,2025-04-21 17:22:20
1k4i9lr,ScullingPointers,"Don't take it too personally. I'm going to give you the benefit of the doubt and assume you're still young and immature. But yes, if you are wanting to plan your future, a financial planner is your best bet.",3,1745272100.0,2025-04-21 21:48:20
1k4i9lr,Most-Clerk-2828,"I don’t know what a social engineering scam is? How will peoples advice benefit me.. I feel sorry for you if you feel like 250,000$ is a lot. It’s a honest question but i guess some of you were born in poverty and never had concerns like this. I don’t know who hurt you or socially scammed you but you guys really need to get a life if you feel you can get scammed from off a simple reply!",-7,1745255657.0,2025-04-21 17:14:17
1k4i9lr,Fast_Quality_2007,Nice try diddy,4,1745255930.0,2025-04-21 17:18:50
1k4i9lr,Most-Clerk-2828,Yep you’re a child please stop replying you are socially scamming yourself at this point…,-2,1745257329.0,2025-04-21 17:42:09
1k4i9lr,Bvstxs,"Buddy you sound like an emotional wreck, i wouldnt suggest investing it and i doubt your parents would want you looking online for advice on where to shove the money they left you. Use your head dude. Give yourself time to process.",4,1745261768.0,2025-04-21 18:56:08
1k4i9lr,Fast_Quality_2007,![gif](giphy|31SoVTR4fszw0K7p5I),2,1745266418.0,2025-04-21 20:13:38
1k4i9lr,Most-Clerk-2828,How am I trying to scam by asking for advice?,-5,1745254981.0,2025-04-21 17:03:01
1k4i9lr,Real-Elevator-2977,Dividends could set you up for an easy modest life.,1,1745260513.0,2025-04-21 18:35:13
1k4i9lr,Specialist_Ad4414,"My advice is to invest maybe $1000 of that into financial education  I'm not sure why everybody is pushing for you to get a financial advisor. Many financial advisors are just salesman there to push stocks or other investments in which they get paid a commission. Their superiors actually tell them what to push on clients. It has nothing to do with a client's situation. This is not all financial advisors, but many of them operate like that.  Robert Kiyosaki once said they're called brokers because they're often broker than you are",1,1745263896.0,2025-04-21 19:31:36
1k4i9lr,IndependentTeacher24,Simplest and safest is a high yield savings account.  Fdic insured up to 250k.  Skip crypto.,1,1745264782.0,2025-04-21 19:46:22
1k4i9lr,Fuzzy-Age-113,Never put all your eggs in one basket. The key to success is a diverse portfolio.,1,1745268499.0,2025-04-21 20:48:19
1k4i9lr,Independent_Pay_381,"I think you shouldn’t take none of these answers seriously or even consider. None will make you happy. What you should do is not think about the money they left you , that should be your last priority. Focus on healing , focus on tidying yourself up , if it has to be a year later then so be it. Pretend the money doesn’t exist. And over time , if you’re a wise man. You’ll have a better idea of what you can do with the money so far. And by then you’ve grown wiser and have a level headed mindset. Forget about crypto.",1,1745272243.0,2025-04-21 21:50:43
1k4i9lr,trojan_dude,Dollar sign at the end? Are you in Europe?,1,1745276582.0,2025-04-21 23:03:02
1k4i9lr,smokey94420,Eveyone know when you up a qtr mil you buy a  apt building you invest in the rest in the market at a 5% return now if you wanna play play you wait for the crypto drop btc at 86 or less dump it all btc goes back to 100000 you withdraw rinse and repeat.,1,1745276583.0,2025-04-21 23:03:03
1k4i9lr,Tazzman-502,"Sorry to hear about your parents.  If you do not know what you are doing and want to invest in crypto, you should put a portion in a BTC ETF.  You will not need to worry about seed words, scams, or what cold storage wallet should I use?  You should also consider using a portion for a down payment on real estate.  MOPO.",1,1745282078.0,2025-04-22 00:34:38
1k4i9lr,likedasumbody,Put some in Siacoin ( the next btc) American nom profit company,1,1745282599.0,2025-04-22 00:43:19
1k4i9lr,xBlitzgewitter,Put all in doge and when youre done get a financial planner. You will need one afterwards.,1,1745282946.0,2025-04-22 00:49:06
1k4i9lr,xBlitzgewitter,Put all in doge and when youre done get a financial planner. You will need one afterwards.,1,1745282956.0,2025-04-22 00:49:16
1k4i9lr,Accomplished_Deer_10,"Hire a financial planner, and tbh stay away from crypto until you have another way to earn off that 250k",1,1745293888.0,2025-04-22 03:51:28
1k4i9lr,Extension-Lie-3272,Do not put this money in crypto are you nuts??? Go into dividend stocks. Go get professional help man. Go get an advisor. There is better ways. Crypto is not one of them.,1,1745294845.0,2025-04-22 04:07:25
1k4i9lr,CasualMowse,Dividends,1,1745297027.0,2025-04-22 04:43:47
1k4i9lr,Klutzy-Ad-2917,Its totally up to you but I can promise you I’ll find you the key to financial freedom and your kids kids kids will never  know the meaning struggle this I promise you!,1,1745297112.0,2025-04-22 04:45:12
1k4i9lr,ThePokerRobot,"Sorry for your loss, if I were you I would still work a full time job and put all of the $ in a CD at 2 to 3 % for a two month contract. That’s roughly 7k every two months return. If you roll it over in a few years you will be making bank if the percent doesn’t change.",1,1745316042.0,2025-04-22 10:00:42
1k4i9lr,The_hooligan87,"Don’t think that’s how it works lol  Principal = $250,000 Rate = 3% annually = 0.03 Time = 2 months = 2/12 = 0.1667 years  That’s more like $1,250 every two months Annually that’s about $7,500",1,1745322069.0,2025-04-22 11:41:09
1k4i9lr,ThePokerRobot,Right now chase is offering 3.44% interest for 60 days.,1,1745339039.0,2025-04-22 16:23:59
1k4i9lr,The_hooligan87,"That’s not bad for short term at $250,000.  Roughly $1,412 every 60 days.  I was just saying $7k every 60 days is criminal and sign me up ![gif](emote|free_emotes_pack|money_face)",1,1745405654.0,2025-04-23 10:54:14
1k4i9lr,Fitedds,Buy a house.,1,1745316593.0,2025-04-22 10:09:53
1k4i9lr,[deleted],[removed],1,1745320889.0,2025-04-22 11:21:29
1k4i9lr,The_hooligan87,"Oh and start a Roth IRA and max your contributions every year.  The max for 2025 is $7,000.",1,1745321337.0,2025-04-22 11:28:57
1k4i9lr,Responsible-Cash728,"Absolutely do not put your money in bitcoin right now. I put over $100,000 in and have gotten very few gains. Since Jan 20 I’ve watched 20,000 whittle down to 8,000 in the last 3 months. I wish I would have bought bonds the money would have no choice but to gain interest and grow,",1,1745323048.0,2025-04-22 11:57:28
1k4i9lr,RobAlso,Invest every single penny you ever get into Doge. Trust me bro.,1,1745335462.0,2025-04-22 15:24:22
1k4i9lr,OkResponsibility9181,MSTY,1,1745349886.0,2025-04-22 19:24:46
1k4i9lr,Even_Association_467,100% into Doge !!! You will be rich !!!,1,1745361463.0,2025-04-22 22:37:43
1k4i9lr,hot_drop_it_its_like,"Be careful, you will only get this 1 time!  Diversify, set an exit strategy if you are putting into crypto. If doge, plan you get out price ahead of time and follow through!  Same with all other cryptos!  Stocks can offer dividends that will give you monthly returns that can be a huge supplement to help you get set for your future.  I, being some random on some random reddit board, recomend looking i to ORC, currently trading around 6.50 usd with over 20% dividends.  You will take your total stock worth, multiply by .20 (or whatever the dividends are set at) and ➗️ by 12. That will give you your gain for that month.  Good luck!!",1,1745373000.0,2025-04-23 01:50:00
1k4i9lr,No-Zombie-9725,I can’t help,1,1745462652.0,2025-04-24 02:44:12
1k4i9lr,ScienceObjective7431,Do not invest it in Crypto and find your own financial planner,1,1745496824.0,2025-04-24 12:13:44
1k4i9lr,Charming_Ad_5421,Gold....not financial advice,1,1745556302.0,2025-04-25 04:45:02
1k4i9lr,YouFun3255,For 1% I can be your fiduciary,1,1745613511.0,2025-04-25 20:38:31
1k4i9lr,YouFun3255,That is if you wish to invest the whole sum,1,1745613624.0,2025-04-25 20:40:24
