post_id,author,body,score,created_utc,date
1jxf6pz,Jew_Man_Chu,*looks at doge 90 day chart  -52%…,87,1744458373.0,2025-04-12 11:46:13
1jxf6pz,Remarkable_Misty,And doge is down over 50% in the last 60 days,40,1744459766.0,2025-04-12 12:09:26
1jxf6pz,Gloomy_Setting5936,Keep smoking that good stuff towelie,-26,1744460180.0,2025-04-12 12:16:20
1jxf6pz,Remarkable_Misty,Seems you need to if you think being down over 50% is good,10,1744460243.0,2025-04-12 12:17:23
1jxf6pz,Ranger523,Uhm... can you read a chart?,0,1744541967.0,2025-04-13 10:59:27
1jxf6pz,coronaflo,"What are you buying crypto with, Dogecoin or otherwise?",9,1744463267.0,2025-04-12 13:07:47
1jxf6pz,rastafarihippy,I'm a buyer. Not a seller. 1 day I'll change,13,1744459597.0,2025-04-12 12:06:37
1jxf6pz,Fun_Raise_7858,🤣,2,1744472374.0,2025-04-12 15:39:34
1jxf6pz,tgarrettallen,I’m on vacation and I’m feeling it.,6,1744469751.0,2025-04-12 14:55:51
1jxf6pz,According-Dog-7288,I like looking at one currency versus another but a long term thing I notice is all of them are going down relative to an ounce of gold or silver,4,1744472888.0,2025-04-12 15:48:08
1jxf6pz,ilfollevolo,This is terror propaganda tactic… kids don’t fall for this,8,1744473232.0,2025-04-12 15:53:52
1jxf6pz,Zealousideal-Past851,It’s going to be rough for awhile but there is definitely gold at the end of the rainbow .. some will get rich and some will be wishing they stayed in the race and some will lose a lot … its just the nature of the game we chose to play 🥂  ![gif](giphy|UPm8BqL6igDUPZ29ik|downsized),6,1744480997.0,2025-04-12 18:03:17
1jxf6pz,ilfollevolo,"Stating the obvious. People, make informed decisions with your money!",5,1744490084.0,2025-04-12 20:34:44
1jxf6pz,Commercial_Ease8053,"Hahah is this another bag holder post? It peaked literally FOUR years ago and it’s now at 25% of its ATH… but yeah, keep cooking, go on.",5,1744483433.0,2025-04-12 18:43:53
1jxf6pz,liquid_at,"3 years and 11 months as an asset with 4 year cycles....  Like its been a full day since it's last been midnight, around a minute before midnight....",2,1744540817.0,2025-04-13 10:40:17
1jxf6pz,Frikoulas,"Yeah, you're so right. I'm really wondering if I should get in to a coin that peaked 4 years ago and now is 77.5% down.",3,1744476991.0,2025-04-12 16:56:31
1jxf6pz,ScullingPointers,"Chyea, that's a really Tuff choice. Maybe reach out to a financial advisor to see what they say? 🧐",2,1744569838.0,2025-04-13 18:43:58
1jxf6pz,God-Emperor-Pepe,![gif](giphy|LpkBAUDg53FI8xLmg1|downsized),1,1744467789.0,2025-04-12 14:23:09
1jxf6pz,Puzzleheaded_Cap_336,Yes,1,1744468151.0,2025-04-12 14:29:11
1jxf6pz,nickert0n,[https://www.cnn.com/2025/04/12/tech/trump-electronics-china-tariffs/index.html](https://www.cnn.com/2025/04/12/tech/trump-electronics-china-tariffs/index.html),2,1744468893.0,2025-04-12 14:41:33
1jxf6pz,snorlaxtubbs,Woahh,1,1744468972.0,2025-04-12 14:42:52
1jxf6pz,Danger64X,US dollar lost therefore buy doge.   I can’t even fathom this level of fallaciousness.,1,1744475885.0,2025-04-12 16:38:05
1jxf6pz,Consistent-Set-913,"Doge motto  “We mint 10,000 coins a minute what could go wrong!!”",2,1744479598.0,2025-04-12 17:39:58
1jxf6pz,liquid_at,"It's a currency. If you don't understand why currencies aren't designed to be scarce, look it up.",1,1744544013.0,2025-04-13 11:33:33
1jxf6pz,KindlyBrain6109,How much did doge go up in the same time frame?,1,1744489658.0,2025-04-12 20:27:38
1jxf6pz,ScullingPointers,Yes,1,1744569914.0,2025-04-13 18:45:14
1jxf6pz,Crimision,It is Doomo’clock already?,1,1744517350.0,2025-04-13 04:09:10
1jxf6pz,Lxrd_Dxrkskin,"Now’s the best time to get in. Prices of Doge are low, down 52% last I checked. I bought more doge😂",2,1744523125.0,2025-04-13 05:45:25
1jxf6pz,Claymoreking,Dont get in and wait... We will have a drop the next weeks,1,1744551943.0,2025-04-13 13:45:43
1jxf6pz,Swapuz_com,"While you wait, your USD is losing value! Over the past month, the dollar has dropped **4.5%** against the CHF, JPY, and EUR. The charts don’t lie—currency moves fast, and hesitation can cost you!",1,1744485360.0,2025-04-12 19:16:00
1jxf6pz,Feisty-Committee109,It's short-term and has already been addressed.  Short-term pain for long-term gains.,2,1744510765.0,2025-04-13 02:19:25
1jxf6pz,asloan420,People forget……..crypto is the most liquid thing on the planet and worth holding in case of emergency at the very least……..I bought a bitcoin recently and it took Bank of America 5 business days to transfer $80k. I don’t want any doll hairs at this point and I don’t want to ever have a bank tell me how and when I can get my money……..there will be a run on the banks sooner than later and you’ll be the smartest guy in the room holding some super liquid dog coins,2,1744477879.0,2025-04-12 17:11:19
1jxf6pz,Fetuscake69,LMFAOOOOOOOO,0,1744481373.0,2025-04-12 18:09:33
1jxf6pz,Commercial_Ease8053,🤡☠️☠️☠️,0,1744483360.0,2025-04-12 18:42:40
1jxc09v,Inner-Yams,The market tanks and dogecoin pumps hard,2,1744481756.0,2025-04-12 18:15:56
1jx9gs5,7374616e74,"If you buy low sell high it's a good investment, if you buy high sell low it's not. It's all about time range and you ability to cash out when you should. Little hint, if you happen to buy low and end up in the ""sell high"" situation but you keep thinking it's going up, think this: ""If I had all this as cash, would I yolo it all on this?""",47,1744434462.0,2025-04-12 05:07:42
1jx9gs5,No_Tax_5190,That’s a great way to think about that. I had a time where I should have cashed out and if I thought about it like that I definitely would have cashed out,5,1744467565.0,2025-04-12 14:19:25
1jx9gs5,cooterbutt,What if the answer is yes?,1,1744523087.0,2025-04-13 05:44:47
1jx9gs5,oomenya333,That’s more of a trade than an investment,1,1744786658.0,2025-04-16 06:57:38
1jx9gs5,homerdickens,"according to sir isaac newton, what goes down must go up again.",94,1744433404.0,2025-04-12 04:50:04
1jx9gs5,minimal,I can't unlogic your logic. Have my upboat.,27,1744433460.0,2025-04-12 04:51:00
1jx9gs5,Unlucky_Bell_7354,And have my downvote to cancel his upvote,6,1744436993.0,2025-04-12 05:49:53
1jx9gs5,Low_Band_335,and have my upvote to cancel out his downvote,9,1744438148.0,2025-04-12 06:09:08
1jx9gs5,Unlucky_Bell_7354,Ive created a vicious cycle,2,1744438236.0,2025-04-12 06:10:36
1jx9gs5,Low_Band_335,sure did bud,3,1744438330.0,2025-04-12 06:12:10
1jx9gs5,monnelespiritu,The cycle must continue. I donwvoted 😆.,1,1744456964.0,2025-04-12 11:22:44
1jx9gs5,aurrousarc,You sir get to jump the line for a bit.,1,1744465668.0,2025-04-12 13:47:48
1jx9gs5,waloshin,Well there are many stocks that went down and then delisted because they went to zero… therefore that logic fails.,2,1744440790.0,2025-04-12 06:53:10
1jx9gs5,KrumpKrewGaming,"If you look at February 2021, you'll see a perfect example of a good investment.",12,1744435879.0,2025-04-12 05:31:19
1jx9gs5,Apprehensive-Tour942,Trust me bro,8,1744455277.0,2025-04-12 10:54:37
1jx9gs5,Great-Sport2885,"If you look closely it looks eerily similar to a monstrous cup and handle pattern. Cheers my fellow doges, let's all meet up sometime and get drinks or something.",11,1744436204.0,2025-04-12 05:36:44
1jx9gs5,herniatedballs,It's due? xD,10,1744434076.0,2025-04-12 05:01:16
1jx9gs5,Every_Hunt_160,The PUMPA is due !!,8,1744448876.0,2025-04-12 09:07:56
1jx9gs5,nightfly82,If you think it’s gonna do a 1-2x from here than put some money into it and cash out when you reach that goal Mite happen sooner than you think and you will have to pay short term capital gains taxes But have a plan and stick with it If you long term than it will be painful but I am sure over time and stress doge will make another nice move to the upside,6,1744452009.0,2025-04-12 10:00:09
1jx9gs5,zachmoe,"It was good to me, my starting average was .001987.",5,1744464034.0,2025-04-12 13:20:34
1jx9gs5,xxfallen420xx,Look at it in logarithmic view,7,1744435515.0,2025-04-12 05:25:15
1jx9gs5,Alive_Onion_9708,"Indeed, if you do that you'd be quite depressed",1,1744465227.0,2025-04-12 13:40:27
1jx9gs5,xxfallen420xx,Are u going to elaborate or just hide behind some vague statement?,1,1744478533.0,2025-04-12 17:22:13
1jx9gs5,Seemss_Legit,I'm wondering the same thing about your original comment. 😂,2,1744480526.0,2025-04-12 17:55:26
1jx9gs5,xxfallen420xx,The log shows an ascending cycle of which we’ve hit the floor. Every bullish run on this coin has been preceded by contact with this floor. Dogecoin is holding on the floor despite market conditions which if the run to $.72 is any indication should be a bullish indicator. None of which is apparent in the normal not log view of the chart.,2,1744481233.0,2025-04-12 18:07:13
1jx9gs5,Fru1tLo0psy,"If it goes from 5 cents to 45 cents that's not 4,000 percent that's 900 percent.",3,1744456523.0,2025-04-12 11:15:23
1jx9gs5,_youarewhatyouyeet,dogecoin? investment? 🤣🤣🤣,3,1744464866.0,2025-04-12 13:34:26
1jx9gs5,liquid_at,"set it to logarithmic view and you know.  You just use a terrible graph for long term view that does not tell you anything of significance because it only looks at one cycle of the entire development.  You picked terrible data, that's the problem.",7,1744449800.0,2025-04-12 09:23:20
1jx9gs5,nickert0n,"I agree with you its a great investment, can you explain how logarithmic looks better though?",-2,1744468997.0,2025-04-12 14:43:17
1jx9gs5,liquid_at,"Doge traditionally trades slightly downwards for extended periods of time, only interrupted by massive jumps upwards.  Once you reach 1c, moves between 0.0001c and 0.0002c will look like a flat line, despite having represented +100% moves in the past. Just compared to the 1c it does not mean anything.   logarithmic view compensates for that. A move from 0.0001 to 0.0002 will look much closer to a move from 1c to 2c or a move from 10c to 20c.   In this view, anything that happened before the current ATH that was created in 2021 is just a flat line with nothing to see. Given that doge is trading in 4 year cycles, looking at only the last cycle and nothing but the last cycle is not a good way to determine if it is a good long term investment.",3,1744472506.0,2025-04-12 15:41:46
1jx9gs5,Impressive-Level-276,sell this rip  and don't buy the next dip  and never hodling,2,1744479847.0,2025-04-12 17:44:07
1jx9gs5,Few_Apartment7318,For broke ppl it’s great bc it gives you time to load up overtime during the bear market buying a lil each paycheck. Then bill market comes around and you clip to you think you’ve found the top and cashout.,2,1744505368.0,2025-04-13 00:49:28
1jx9gs5,Reasonable_Beach_389,It's not buy BTC,2,1744548339.0,2025-04-13 12:45:39
1jx9gs5,Dapper_Detective_919,looks like need to need another 3 years,2,1744549731.0,2025-04-13 13:08:51
1jx9gs5,Ok_Sentence_1332,"When it’s low, you buy. Sell when you’ve made profits. In crypto if you invest in the bear market say 2022-2023. You’ll make at least 300% at some point in the bull market in 2-3 years which is better then most investments stock wise ( besides maybe a few ). Sell and never look back is the key. Literally. Make your money and leave crypto. Best advice if you’re looking for a reason to buy now, I’d say it’s bounced well off 13. But I think we still have some downside with all crypto and the stock market. Trump pausing was just a knee jerk reaction but overall won’t help until the trade war is dealt with and it doesn’t hurt business. Also we got rates being cut ( which I think they will hold off on cutting until later ). And a lot more news economy wise that is coming up in late April and mid may. Good luck to us all.",2,1744434960.0,2025-04-12 05:16:00
1jx9gs5,Low-Introduction-565,"This is bs, because looking forward noone knows what low or high is.    The real answer is, it's not investing, it's gambling. Make your peace with that op, and then decide if gambling is the lifestyle you want",2,1744452814.0,2025-04-12 10:13:34
1jx9gs5,Ok_Sentence_1332,"If you invest in the bear market you’ll make good returns and that’s why I literally said “sell and never look back”. If you make money and good money in crypto. Sell. Say you got $500 and you make 2k. Sell and if you wanna put money back in wait a few months and put $200 in. If you got $10k and make 30k. Well and same thing then put no more then 1k in. It’s the best advice if you’re up. If your down, you gotta look at it differently forsure. I don’t think we’re done going down but I also think we’re gonna go way back up before the end of the year. We aren’t in the bear market yet.",1,1744576544.0,2025-04-13 20:35:44
1jx9gs5,Few_Schedule_9338,"your mistake is looking at the doge chart instead of the global stock market, trumper is screwing with it and therefore everything is down, cryptos follow BTC movements once stock market bounces back then BTC will and then doge will too. Looking at a doge chart alone is useless.",2,1744447424.0,2025-04-12 08:43:44
1jx9gs5,coldfurify,Try logarithmic,2,1744474333.0,2025-04-12 16:12:13
1jx9gs5,Inner-Yams,Your chart is trash. Zoom out to the 10 year and use logirthmic.,2,1744476056.0,2025-04-12 16:40:56
1jx9gs5,blessedhedonism,Brutal mid-cycle correction.,1,1744441722.0,2025-04-12 07:08:42
1jx9gs5,jalfry,"Trust me bro, buy the dip bro",1,1744445420.0,2025-04-12 08:10:20
1jx9gs5,Intelligent-Session6,Rules are meant to be broken. In DOGE we trust !,1,1744479724.0,2025-04-12 17:42:04
1jx9gs5,splattered_cheesewiz,Because the money of course!!!!!,1,1744513496.0,2025-04-13 03:04:56
1jx9gs5,Gold_Piccolo_4656,"I see multiple points in that chart that would’ve made you a lot of money, also a lot of point that would wreck you so I wouldn’t say a good investment but certainly one worth looking at during the right time",1,1744550672.0,2025-04-13 13:24:32
1jx9gs5,Thick_Expression_796,It’s all about timing,1,1744607962.0,2025-04-14 05:19:22
1jx9gs5,Kushroom710,We are at another bottom. Buy now and resell later for profits,1,1744727080.0,2025-04-15 14:24:40
1jx9gs5,Low-Hold-8563,Where did you buy it?,1,1744855906.0,2025-04-17 02:11:46
1jx9gs5,minimal,"Mined a ton around Christmas 2013, and bought some more throughout the years. Had 4,000,000 at one point. Sold a fair bit of that from $.001 through ~$0.10, and gave away tens of thousands in the old Doge ""pay it forward"" subreddit. I still hold a not insignificant amount.  Full disclosure, I have not bought a single Doge since we broke through the $0.01 floor.",1,1744857376.0,2025-04-17 02:36:16
1jx9gs5,Low-Hold-8563,So you're way ahead of the game. I also bought in under .01   You know Doge is probably a great investment in the long term. Most people are probably pretty new. They were hoping to make a giant stack of cash quick. Do you have a 9 to 5?,1,1744899576.0,2025-04-17 14:19:36
1jx9gs5,Byro1218,"You see those peaks, that’s why",1,1744450072.0,2025-04-12 09:27:52
1jx9gs5,DeepPanic3566,Massive cup and a handle it is ☕,1,1744473052.0,2025-04-12 15:50:52
1jx9gs5,DoobOnTheDip,Sounds like you already made up your mind. What’s the point of coming here just to be a wet blanket? Needed an ego boost?,1,1744486526.0,2025-04-12 19:35:26
1jx9gs5,minimal,"No, seriously just looking for a rationale beyond ""it went up before"". I'm a long time holder, and have not bought any doge in nearly a decade. I do see a lot of people posting how they have lost significant (to them) amounts of money following advice here, and am genuinely interested in why anyone would buy at even the current depressed level, or encourage anyone else to do so.",0,1744492702.0,2025-04-12 21:18:22
1jx9gs5,kaedoge,Just zoom out…  You’re only looking at a 4 year period…,-2,1744434524.0,2025-04-12 05:08:44
1jx9gs5,Unlucky_Bell_7354,No profit in 4 years is a pretty bad investment,-2,1744437103.0,2025-04-12 05:51:43
1jx9gs5,kaedoge,"Doge over a 5 year period, even at the current price, represents over and 8,200% gain…  That’s almost 8x the gain of Bitcoin during the same period.   Get out of here with this nonsense.",3,1744437359.0,2025-04-12 05:55:59
1jx9gs5,Unlucky_Bell_7354,Lets see your gains,3,1744437519.0,2025-04-12 05:58:39
1jx9gs5,kaedoge,"How about, no.",0,1744437672.0,2025-04-12 06:01:12
1jx9gs5,Low_Band_335,bro if you didn’t sell that’s okay; no shame 😂,4,1744438210.0,2025-04-12 06:10:10
1jx9gs5,Unlucky_Bell_7354,He's holding a bag of dirt. I sold when it was .63 and stayed out. Glad.,2,1744438329.0,2025-04-12 06:12:09
1jx9gs5,Low_Band_335,some people like dirt,0,1744438381.0,2025-04-12 06:13:01
1jx9gs5,Unlucky_Bell_7354,![gif](giphy|Bl1t1DdP6iASI),1,1744438430.0,2025-04-12 06:13:50
1jx9gs5,Hanstor,"Someone once told me not to invest in meme coin, and I laughed at them because I felt confident in my ability to read the market. My confidence has been shaken recently, but the market will recover over the summer, and toward the end of the year. people who buy under .30 are gonna be happy.",0,1744435369.0,2025-04-12 05:22:49
1jx9gs5,liquid_at,"the same people who told you not to invest in meme coins, invented the word meme coin and lost big on scams of the first generation of alts... You chose to trust them on their words...",1,1744449844.0,2025-04-12 09:24:04
1jx9gs5,ForeverPursuing,Just Hold!!!!!  Let Liquid tell you how good of an investment it is.,0,1744444270.0,2025-04-12 07:51:10
1jx9gs5,liquid_at,"S&amp;P-500 lost 20% from pre-inauguration high to low.   1% move on the S&amp;P is considered big.   It's not ""investing"" while a dictator destroys the global economy. It is waiting until the dictator is thrown out and the economy returns to a normal state.   No asset has a true value because no one believes in a future of the planet right now.",-3,1744450006.0,2025-04-12 09:26:46
1jx9gs5,jgarcya,"Bc the cycle isn't over yet... What goes down comes up...  If the cycle fails to produce a new ATH... Then Doge is done for a few cycles...  Meaning we will get lower highs... Until it bottoms out, and breaks through.  We'll see by May./june",-1,1744441295.0,2025-04-12 07:01:35
1jx9gs5,Gloomy_Setting5936,"Exactly, we’ll know in the next month if it’s over or not.",1,1744460403.0,2025-04-12 12:20:03
1jx9gs5,Deijya,Compare it against etherium?,0,1744439595.0,2025-04-12 06:33:15
1jx9gs5,slykethephoxenix,Why don't you show from 2019?,0,1744447922.0,2025-04-12 08:52:02
1jx9gs5,Tlaim,It has ears just like doge. Both are good,0,1744467016.0,2025-04-12 14:10:16
1jx9gs5,Educational-Basis392,by and hold forever lol,0,1744467461.0,2025-04-12 14:17:41
1jx9gs5,Ok_Record_2074,Your name is cry for help not a handle.,1,1744997550.0,2025-04-18 17:32:30
1jx9gs5,minimal,"Maybe I should have been more specific. I meant NOW, not 2, 5, or 10 years ago. We can all read a chart, and yes some of us made out well, but this is not a healthy chart, logarithmic or not.",0,1744470840.0,2025-04-12 15:14:00
1jx9gs5,Andejusjust,"First of all, that’s the weekly chart. And I’ve made a ton of investment money on it. You just have to not be dumb and yolo your life savings on it.",0,1744473239.0,2025-04-12 15:53:59
1jx9gs5,underwaterotta,Zoom out…,0,1744587651.0,2025-04-13 23:40:51
1jx9gs5,Boring_String6625,Stop crying and wait for the best outcome. New investors have no patience. Things are in the works I never seen this coming since 2013.,0,1744687942.0,2025-04-15 03:32:22
1jx9gs5,Sum-Duud,"When bought in and it disappears decimals like Trump disappears free speakers, it is a good investment.",-1,1744469807.0,2025-04-12 14:56:47
1jwsmpq,nickert0n,Its the only memecoin thats been around since 2013. :),6,1744388633.0,2025-04-11 16:23:53
1jwsmpq,xBlitzgewitter,More than a meme 🙌,2,1744392812.0,2025-04-11 17:33:32
1jwsmpq,Fun_Raise_7858,👍,1,1744389186.0,2025-04-11 16:33:06
1jwsmpq,ProfessionalBike5185,Just sell,2,1744402342.0,2025-04-11 20:12:22
1jwsmpq,AlwaysMooning,What does “make it” mean? Return to 70 cents where it was 4 years ago? It’s so far from its ATH it’s sad.,2,1744407911.0,2025-04-11 21:45:11
1jwsmpq,liquid_at,"ATH is a pointless metric. Once you realize that focusing on ATH is only going to make sure that you are desperate for 3.5 years with extreme hype for 6 months, that ends in disappointment every single time, you either sell all your assets at a loss, or you learn that looking at ATHs is stupid.  It's a common beginner mistake.",0,1744452225.0,2025-04-12 10:03:45
1jwsmpq,winds_dark_poem,2 weeks! Lol but Yea one day dogebro 🙏 ✌️,0,1744392025.0,2025-04-11 17:20:25
1jwsmpq,Empress8_,Owoooo!!,0,1744402816.0,2025-04-11 20:20:16
1jwsmpq,[deleted],"Must I say, dogecoin holds no value and is on a trajectory to hit 9.5c by eom!",0,1744421452.0,2025-04-12 01:30:52
1jwsmpq,Open_Bluebird_6902,Yeah..even if goes to zero. HODL 😂🤣,-3,1744391090.0,2025-04-11 17:04:50
1jx10bj,[deleted],My quant analytics say it is hitting 9.5c by eom,3,1744421374.0,2025-04-12 01:29:34
1jx10bj,kaedoge,"Refueling for liftoff, Cap’n",2,1744437795.0,2025-04-12 06:03:15
1jx10bj,Neukted,"Blind optimism **can lead to success and fulfillment**. At times, the force of will is so significant that you can create positive outcomes through positive thinking. However, blind optimism can also cause you to miss vital information that might change your decisions about making what you want to happen.",1,1744597926.0,2025-04-14 02:32:06
1jx10bj,Fun_Raise_7858,Moon soon,0,1744411564.0,2025-04-11 22:46:04
1jx9hl3,AbbreviationsLive475,Guess what I did yesterday OP? I went to Tractor supply and bought a half of dozen Rhode Island Red chicks. Starting my own chicken coop.   And 1 DOGE = 1 DOGE still...  Edit : TBH I didn't read the small print. I agree to an extent; it's definitely a good time to buy if you need to lower your cost average.,5,1744438587.0,2025-04-12 06:16:27
1jx9hl3,liquid_at,"So you bought yourself some $EGG miners? Sounds smart. $EGG has gone up in price recently.  And if people don't buy it, you can convert your $EGG to $Omelette or combine it with some $FLOUR and $SUGAR to convert it into $CAKE.   ![gif](giphy|VEsfbW0pBu145PPhOi)",8,1744451281.0,2025-04-12 09:48:01
1jx9hl3,AbbreviationsLive475,😂,2,1744482700.0,2025-04-12 18:31:40
1jx9hl3,Gloomy_Setting5936,I love this ^,2,1744438768.0,2025-04-12 06:19:28
1jx9hl3,Next-Communication18,Good! I heard they were going cheep…,2,1744505179.0,2025-04-13 00:46:19
1jx9hl3,AbbreviationsLive475,They sure were. On sale and sold out fast. They still had an awesome selection left though.,1,1744513444.0,2025-04-13 03:04:04
1jx9hl3,AbbreviationsLive475,Cool... On what?,2,1744437511.0,2025-04-12 05:58:31
1jx9hl3,Dramatic_Ad_6121,Eggs,1,1744437860.0,2025-04-12 06:04:20
1jx9hl3,AbbreviationsLive475,I like mine scrambled.,1,1744438012.0,2025-04-12 06:06:52
1jx9hl3,Dramatic_Ad_6121,In this economy??,0,1744438214.0,2025-04-12 06:10:14
1jx9hl3,AbbreviationsLive475,CNN much?,0,1744438383.0,2025-04-12 06:13:03
1jx9hl3,Dramatic_Ad_6121,Reporting live from the gutter,2,1744438517.0,2025-04-12 06:15:17
1jx9hl3,Rshellnizzle,Tomorrow,1,1744642144.0,2025-04-14 14:49:04
1jx9hl3,bodog9696,"If you do more research, you will realize there is NO viable research in cryptocurrency. A crypto chart is a visual representation of what has happened in the past. There is NO WAY to extrapolate a trendline into the future with any confidence.  TAKEAWAY- There is no way to project or forecast the future spot price of crypto currency based on historical data. There are no exceptions to this statement. Anyone claiming to have identified a pattern in historical data that can be extrapolated into the future is 💯 BOGUS.",1,1744829772.0,2025-04-16 18:56:12
1jwpzrp,nightfly82,"Yea it’s somewhat exciting, but at the same time this means it will trade more in line with the stock market at times We need our own runs and catalysts. Not one that runs with stocks Let’s hope for the best",7,1744379020.0,2025-04-11 13:43:40
1jwpzrp,nickert0n,Mainstream adoption is part of the process with adoption.,5,1744380104.0,2025-04-11 14:01:44
1jwpzrp,wpfeed,“Popular meme token” hurts when people writing these titles have such little understanding of coin vs token.,4,1744394069.0,2025-04-11 17:54:29
1jwpzrp,TheSpiritOfDoge,"Yes! If they don’t even know enough about Dogecoin to understand that it’s a coin rather than a token, I can’t trust that any information in the article is correct.",2,1744643321.0,2025-04-14 15:08:41
1jwgewp,Fun_Raise_7858,Gold against paper 😁,1,1744364263.0,2025-04-11 09:37:43
1jwgewp,snorlaxtubbs,Correct,1,1744369887.0,2025-04-11 11:11:27
1jwgewp,rasco_88,“Vogecoin” much English,1,1744382312.0,2025-04-11 14:38:32
1jwgewp,Cryptomuscom,Strong $DOGE 💪🏻,1,1744386870.0,2025-04-11 15:54:30
1jwgewp,ItsJustAnotherVoice,Thats a heavy dollar made out of paper.,1,1744477624.0,2025-04-12 17:07:04
1jwgewp,lalvapalooza,I’ll bet your britches doges to dollars that the lil yeller dog comes out on top,1,1744596775.0,2025-04-14 02:12:55
1jwgewp,[deleted],perfect,1,1744658802.0,2025-04-14 19:26:42
1jwgewp,Open_Bluebird_6902,Yeah..🤣😂 it is showed in current prices 😂 and future prices like 0.00005,-1,1744357255.0,2025-04-11 07:40:55
1jwgewp,natasevres,"Dollar crashing.  Albeit on purpose - which is worrying as hell. But as it is now crashing, doge Will inevetible go up.  But lets not confuse hyper inflation with increased value on doge. (Atleast not in shortterm).  What Will be interesting though is if we see increased crypto adoption in the US, similiar to what we have seen in south american countries like Argentina and Venezuela.  However, this also means that the biggest financial global currency is going to become so unreliable that fullscale dumping also Will occur.",-2,1744364766.0,2025-04-11 09:46:06
