post_id,author,body,score,created_utc,date
1jw554q,SuchDogeHodler,I like my doge like I like my woman......mean and freaky.,4,1744347068.0,2025-04-11 04:51:08
1jw554q,Captnblkbeard,Ha. So I’m not the only one.,2,1744336903.0,2025-04-11 02:01:43
1jw554q,SuchDogeHodler,"If you don't sell it's only on paper. If you sell, it becomes real.  Paper hands burn......",3,1744346911.0,2025-04-11 04:48:31
1jw554q,ngronnie,![gif](giphy|cKhD9e7vAefdOJ44lu),3,1744310427.0,2025-04-10 18:40:27
1jw554q,poundsdpound,Doge in the future will be absolutely nothing like it is now. Remember this fact!,1,1744395141.0,2025-04-11 18:12:21
1jw554q,Low-Hold-8563,This might hit tonclose to home for some. I'm not ever combining my finances with any women because of it.,1,1744413036.0,2025-04-11 23:10:36
1jw554q,fatporkchop2712,![gif](giphy|3oriO5t2QB4IPKgxHi),1,1744592448.0,2025-04-14 01:00:48
1jw554q,Fun_Raise_7858,It's happening ,1,1744319203.0,2025-04-10 21:06:43
1jw4wgt,ngronnie,![gif](giphy|dRvEZLV0ORAmHT1L5u|downsized),5,1744309780.0,2025-04-10 18:29:40
1jw4wgt,animeAJ,"GM, dogefam!",3,1744324813.0,2025-04-10 22:40:13
1jw4wgt,Open_Bluebird_6902,I guess is the only way,3,1744309798.0,2025-04-10 18:29:58
1jw4wgt,xirho67,mf this actually made me smile,5,1744319324.0,2025-04-10 21:08:44
1jw4wgt,friendly-survivor,![gif](giphy|aeu60CPZd8zw4),1,1744327655.0,2025-04-10 23:27:35
1jwgr7c,_This_Is_Ridiculous,People (probably children) who only hold $50 of Doge and expect it to make them rich.,3,1744374090.0,2025-04-11 12:21:30
1jwgr7c,Feisty_Grand_8781,"Buddy it’s penny stocks, if you wanna put $1,000 go buy something more valuable stop hating and worry bout yourself",2,1744389212.0,2025-04-11 16:33:32
1jwgr7c,friendly-survivor,bad attempt at a pump /s,2,1744356293.0,2025-04-11 07:24:53
1jwgr7c,probably_to_far,I'm pissed that it didn't go below.13 again.,1,1744402361.0,2025-04-11 20:12:41
1jwgr7c,Patient_Artichoke355,lol..who generates these manipulative posts..and why do you fools continue to fall for this propaganda..LMAO,1,1744367794.0,2025-04-11 10:36:34
1jwctgw,Itsmarty23,Blaze it up in green Lambo,10,1744330706.0,2025-04-11 00:18:26
1jwctgw,Gloomy_Setting5936,Already got the blunt rolled up!,4,1744336984.0,2025-04-11 02:03:04
1jwctgw,FinalHeaven88,"You're welcome to party on 4/20 but I wouldn't expect a pump, it rarely does that day. Being Easter may affect it but who knows, maybe Doge will come back from the dead that day",4,1744332666.0,2025-04-11 00:51:06
1jwctgw,DesconocidoTres,I purchase most doge in groups of 420,3,1744332004.0,2025-04-11 00:40:04
1jwctgw,ScullingPointers,Nice,2,1744372726.0,2025-04-11 11:58:46
1jwctgw,splattered_cheesewiz,I’ll throw some change at it on the 20th,3,1744333266.0,2025-04-11 01:01:06
1jwctgw,Upset-Adhesiveness75,Doge hates dates,3,1744335518.0,2025-04-11 01:38:38
1jwctgw,cuttcorners,Let's go!!,1,1744354040.0,2025-04-11 06:47:20
1jwctgw,Lazy-Challenge-7288,I love Easter! We all gonna get lifted,1,1744366534.0,2025-04-11 10:15:34
1jwctgw,Remarkable_Misty,420 we usually dip hard,1,1744377628.0,2025-04-11 13:20:28
1jwctgw,rasco_88,Jesus and Hitler share a birthday this year.  It’s gunna be wild.,0,1744477248.0,2025-04-12 17:00:48
1jwctgw,SecretGayFacebook,I think if you remove the “-ly hopefully” that you will have a more accurate option,-1,1744330779.0,2025-04-11 00:19:39
1jw3kvb,Template_93,"This is also my second round this year. Sold back a couple years ago, and decided to get back in this year for spits and giggles.",13,1744314989.0,2025-04-10 19:56:29
1jw3kvb,nightfly82,Nice swing trade,10,1744306806.0,2025-04-10 17:40:06
1jw3kvb,Intelligent-Bear-762,Nice work.  Hope you have a selling opportunity soon 👍🏻🤞,5,1744318105.0,2025-04-10 20:48:25
1jw3kvb,Emotional_Brief_4567,It’s a good time to get in.  I’ve been holding since 2020.  I bought a bunch at 0.02.  Hopefully we have a comeback ✨🥂,3,1744351886.0,2025-04-11 06:11:26
1jw3kvb,Ddowntownboy,.03 here and amen,2,1744397380.0,2025-04-11 18:49:40
1jw3kvb,napoelonDynaMighty,You should wait for 90 day when the Tariff talk is back,2,1744308121.0,2025-04-10 18:02:01
1jw3kvb,AbbreviationsLive475,Welcome back. LFG!,1,1744323006.0,2025-04-10 22:10:06
1jw3kvb,Fifty_pips,nice job dawg…always knew you were intelligent 👍,1,1744460024.0,2025-04-12 12:13:44
1jw3kvb,TeacherConsistent240,Waiting for .02 to buy in next few month,1,1744556384.0,2025-04-13 14:59:44
1jw3kvb,GoodParamedic9921,Welcome in this casino,1,1744310072.0,2025-04-10 18:34:32
1jw3kvb,quantum0058d,Why now?,1,1744751987.0,2025-04-15 21:19:47
1jvy85g,Southern-Young-2389,"Paper hands in action, we need more positive news to stop weak hands selling off",33,1744298536.0,2025-04-10 15:22:16
1jvy85g,kairikngdm,Nothing weak about selling when it's no longer Do Only Good Everyday.,14,1744317281.0,2025-04-10 20:34:41
1jvy85g,CranberryKitchen9613,Hopefully the community gets back to that motto...😢,2,1744668547.0,2025-04-14 22:09:07
1jvy85g,FuelAccomplished6133,I needed weed money so I sold mine,12,1744317179.0,2025-04-10 20:32:59
1jvy85g,Cannonblast420,You didn’t own enough to change anything in your life anyways then so no biggie 🤷🏼‍♂️,10,1744339026.0,2025-04-11 02:37:06
1jvy85g,Wpayton3434,Paper hands I bet u catch falling knives lol. Doge is a meme. The real problem is the asics. That’s why it will Never get to all times high again. It’s almost industrialized now.  Good luck with holding,-1,1744328831.0,2025-04-10 23:47:11
1jvy85g,MikeX7s,Hopefully this will make line go up,11,1744295804.0,2025-04-10 14:36:44
1jvy85g,snorlaxtubbs,The ticker is $DOGE,8,1744296434.0,2025-04-10 14:47:14
1jvy85g,To_peach_is_own,Lol! You guys are and will continue to be...suckers 😂,31,1744297418.0,2025-04-10 15:03:38
1jvy85g,OxbridgeDingoBaby,"And you people will always think you know more than everyone else…morons 😂  Edit:  &gt; 100% correct. I was tired of donating to the 0.0000... people. I rather hold Shiba Inu now and wait.  You, a month ago. Thanks for proving my point LMAO.",16,1744304821.0,2025-04-10 17:07:01
1jvy85g,maria_DB,The grass is always greener.,6,1744329450.0,2025-04-10 23:57:30
1jvy85g,HabANahDa,Y’all sheep.,1,1744330554.0,2025-04-11 00:15:54
1jvy85g,Bvstxs,Gotta wait until august for real movement,1,1744467993.0,2025-04-12 14:26:33
1jvy85g,SnooDonuts1009,Screw anyone who says paper hands hodl but dont be a moron,1,1744489396.0,2025-04-12 20:23:16
1jvy85g,TheRealMurtini,How do I get it out of Freewallet? I’ve done everything,1,1744491560.0,2025-04-12 20:59:20
1jvy85g,masta_qui,This didn't age too well 😔 as far as hopes are dreams are concerned,1,1744642353.0,2025-04-14 14:52:33
1jvy85g,nightfly82,Meh it’s a start but at this point crypto as a whole isn’t in a good place plus not many people prob understand or even know about this new project Not a fan of the ETF’s. It will make it trade closer to the stock market rather than on its own,-2,1744295948.0,2025-04-10 14:39:08
1jvy85g,Neukted,btcc is at 75k. dont go around being meh. crypto is in a great place compared to the overall past.,7,1744301338.0,2025-04-10 16:08:58
1jvy85g,spunion_28,"Btc is the ONLY crypto actually in a good place, and that is only because of its proven history.  Doge gave back nearly all its gains from the runup it had.  It is up less than 100% from the eight cent floor it had.  It is one or two bad weeks for btc away from being at ten cents.",4,1744316559.0,2025-04-10 20:22:39
1jvy85g,CollinM47,That's what I'm waiting for,1,1744331539.0,2025-04-11 00:32:19
1jvy85g,spunion_28,Smart move,1,1744331610.0,2025-04-11 00:33:30
1jvy85g,Legitimate-Space-279,Fartcoin is ripping lol,0,1744364553.0,2025-04-11 09:42:33
1jvy85g,spunion_28,You can find at least three solona shitcoins run 10x every day. Fartcoin being up 20% is not ripping. At all,0,1744364671.0,2025-04-11 09:44:31
1jvy85g,nightfly82,If it dips below 69k I think we in a bear market But that’s just me,-1,1744301504.0,2025-04-10 16:11:44
1jw0xp4,Chompbox,"Gotta build some defenses, or Deacon and the Smokers will decimate that place to find the map to dry land.",4,1744302471.0,2025-04-10 16:27:51
1jw0xp4,Tromovation,In one of the most tsunami affected areas of the world! Wow! This is a fantastic idea!,3,1744342256.0,2025-04-11 03:30:56
1jw0xp4,aurrousarc,How is that palm island in dubia doing?,5,1744301300.0,2025-04-10 16:08:20
1jw0xp4,jamdivi,Looks like Olympus from Apex Legends,2,1744302756.0,2025-04-10 16:32:36
1jw0xp4,mcfaillon,Looks like the set from Waterworld,2,1744324212.0,2025-04-10 22:30:12
1jw0xp4,Jumpy_Hold6249,"I look forward to transferring my wealth to this project, so I can watch it evaporate while enjoying the dream",2,1744348057.0,2025-04-11 05:07:37
1jw0xp4,liquid_at,"&gt;Dogen was **a 13th-century Japanese Zen master and the founder of the Soto school of Zen Buddhism**. He is best known for emphasizing the practice of zazen, or seated meditation, as a means to attain enlightenment and for integrating traditional Buddhist teachings with a distinctly Japanese perspective.  So To. Za Zen. Very Dogen.",2,1744368851.0,2025-04-11 10:54:11
1jw0xp4,Kmilly69,lol ok,3,1744300636.0,2025-04-10 15:57:16
1jw0xp4,Jloren81,😂😂😂,1,1744303788.0,2025-04-10 16:49:48
1jw0xp4,OrgyAtPOD6,How do I move there?,1,1744420260.0,2025-04-12 01:11:00
1jw0xp4,Wiggilis,Is that pacifidlog from Pokemon Emerald!?,1,1744432528.0,2025-04-12 04:35:28
1jw0xp4,nightfly82,It will sink just like the price of doge,-5,1744303602.0,2025-04-10 16:46:42
1jw0xp4,OxbridgeDingoBaby,![gif](giphy|xT39D14ZQGal0UwS1G|downsized),4,1744328823.0,2025-04-10 23:47:03
1jvqeww,Cryptomuscom,$DOGE will save us 🚀,3,1744300995.0,2025-04-10 16:03:15
1jvqeww,Difficult-Theory2692,This is just sad...,5,1744267891.0,2025-04-10 06:51:31
1jvqeww,Technical_Ebb6756,lol,1,1744421024.0,2025-04-12 01:23:44
1jvqeww,Idontknowhoiam143,Dogecoin is nothing but memes and broken dreams. Keep dreaming,4,1744303303.0,2025-04-10 16:41:43
1jvvwqy,nightfly82,Him and Ali are the worst lol,9,1744287417.0,2025-04-10 12:16:57
1jvvwqy,9inchjames,I've never seen more made up terms for nothing,8,1744289978.0,2025-04-10 12:59:38
1jvvwqy,Ambitious-Apple1125,![gif](giphy|b0E3PPld4558irObaY),9,1744285968.0,2025-04-10 11:52:48
1jvvwqy,OxbridgeDingoBaby,"&gt; Recession speculation, just wait till it's reality. This ""dip"" is child's play  You just before the market ripped back up. In other words, you’re just as clueless as the OP.",2,1744407455.0,2025-04-11 21:37:35
1jvvwqy,Ambitious-Apple1125,"Nice find stalker, remember to check back when the 90 days are over ;)",-1,1744614667.0,2025-04-14 07:11:07
1jvvwqy,OxbridgeDingoBaby,"Your posts are so regarded, and wrong so often, you make it so easy to call you out on your BS. No stalking necessary, it’s literally right there on your profile 😂",0,1744636007.0,2025-04-14 13:06:47
1jvvwqy,Ambitious-Apple1125,haven't made a single post   ![gif](giphy|x0npYExCGOZeo),0,1744699705.0,2025-04-15 06:48:25
1jvvwqy,OxbridgeDingoBaby,"Comments, posts, whatever. You’re only taking issue with the semantics because the substance (that your incredibly regarded) is irrefutable. So thanks for making my point for me 🤣",0,1744701388.0,2025-04-15 07:16:28
1jvvwqy,Ambitious-Apple1125,"Wow, incredible logic-you butcher the words *and* the point, but hey, at least you're consistent. Must be exhausting being this incredibly 'regargded' all the time,   ![gif](giphy|2XES2Sbh939Hh3NXvz)",0,1744702948.0,2025-04-15 07:42:28
1jvvwqy,OxbridgeDingoBaby,"Butcher the words? Just because you can’t understand them, doesn’t mean they don’t make sense to the rest of us. Thanks for taking another L though; quite the collection 😂",0,1744703970.0,2025-04-15 07:59:30
1jvvwqy,Ambitious-Apple1125,"Thanks for playing. You’ve managed to take an L in logic, language, and self-awareness-all in one reply. That’s talent",0,1744704572.0,2025-04-15 08:09:32
1jvvwqy,OxbridgeDingoBaby,"Imagine being so regarded that you can’t even come up with your own put downs 😂  I think the Germans call someone like you uber-regarded. Now, keep that mouth shut and don’t reply, as everyone knows you’ve taken the L.",0,1744705172.0,2025-04-15 08:19:32
1jvvwqy,friendly-survivor,😂,1,1744286225.0,2025-04-10 11:57:05
1jvvwqy,Krispy7Khrome,I hope so. I just bought $5000 worth of dogecoin. Hopefully it pays off,5,1744291949.0,2025-04-10 13:32:29
1jvvwqy,Ulrich453,This aged well over 5hours lmfao,2,1744303855.0,2025-04-10 16:50:55
1jvvwqy,tobitazzz,May have? It’s a waist of time it’s like saying it might go up and it might go down. Everyone knows that,3,1744290544.0,2025-04-10 13:09:04
1jvvwqy,Traitorparrot,Yeah but what about second bottom?,1,1744291723.0,2025-04-10 13:28:43
1jvvwqy,roger3rd,Riiiiiiight 😜,1,1744295472.0,2025-04-10 14:31:12
1jvvwqy,gSrikar,This should takeaway the anxiety.,1,1744391347.0,2025-04-11 17:09:07
1jvvwqy,lalvapalooza,Much Reclaim,1,1744398884.0,2025-04-11 19:14:44
1jvvwqy,DunderscoreMA,And I saw a unicorn today!,1,1744411362.0,2025-04-11 22:42:42
1jvvwqy,BonusCute7697,"Hope so, I just bought more when it dropped below 0.15c a few days ago.",1,1744423219.0,2025-04-12 02:00:19
1jvvwqy,NickLaaFlare,Doge will hit $1 next bull run lmfao,1,1744466691.0,2025-04-12 14:04:51
1jvvwqy,Consistent-Set-913,Chart of dreams,1,1744484239.0,2025-04-12 18:57:19
1jvvwqy,doolyboy4,ohh you guys wanna see bottom...... I'm buying more rn give it 10 minutes.,1,1744508360.0,2025-04-13 01:39:20
1jvvwqy,lexmansion,Doge will gain all,1,1744574212.0,2025-04-13 19:56:52
1jvvwqy,Tight_Pen_5105,This is the saddest community. Every other day theresa new excuse for why it's ok that your down %80 on your original investment and just hang tight for another 2 years and you might just break even,0,1744598773.0,2025-04-14 02:46:13
1jvybch,Remarkable_Misty,You didnt buy at 12 cent a few days ago?,4,1744298090.0,2025-04-10 15:14:50
1jvybch,ScullingPointers,I v been beating myself up for missing that sale. 😔,2,1744372334.0,2025-04-11 11:52:14
1jvybch,Neukted,Not really,-5,1744300572.0,2025-04-10 15:56:12
1jvybch,Remarkable_Misty,How come?,5,1744300742.0,2025-04-10 15:59:02
1jvybch,friendly-survivor,wendys paycheck didnt hit in time😂,7,1744335588.0,2025-04-11 01:39:48
1jvybch,Gloomy_Setting5936,Those free burgers 🍔 be hittin B,3,1744338647.0,2025-04-11 02:30:47
1jvybch,Southern-Young-2389,"Shorts atack, paper hands panic sell",1,1744299672.0,2025-04-10 15:41:12
1jvybch,Neukted,I keep waiting for 4.20,3,1744300600.0,2025-04-10 15:56:40
1jvybch,Southern-Young-2389,⏳️💵💪,1,1744300671.0,2025-04-10 15:57:51
1jvybch,Whoisyourfactor,This is when you buy?,1,1744301705.0,2025-04-10 16:15:05
1jvybch,Neukted,Yes. But just 1 coin for the meme.,1,1744317316.0,2025-04-10 20:35:16
1jvybch,ImprovementLost3677,Lol,1,1744483996.0,2025-04-12 18:53:16
1jvybch,Miserable_Advance343,Careful friend. This was onetime .0025,1,1744332610.0,2025-04-11 00:50:10
1jvybch,Neukted,Wut brother,2,1744335201.0,2025-04-11 01:33:21
1jvybch,oprahwinfreyspurse,They don’t get it cause they weren’t there 💔,1,1744369401.0,2025-04-11 11:03:21
1jvybch,natasevres,Just wait.  The crash is still ongoing.  At some point Trump is going to fold on China. Then things Will bounce again. Further inside trading,-1,1744307724.0,2025-04-10 17:55:24
1jvybch,Neukted,Don't be a fud machine. Im not into gas lighting haters and negative auras,2,1744320194.0,2025-04-10 21:23:14
1jvybch,natasevres,K - cool story.  Im not that into denying reality,-1,1744320916.0,2025-04-10 21:35:16
1jvybch,Neukted,Welcome to the real world then.,0,1744321157.0,2025-04-10 21:39:17
1jvybch,natasevres,Good.  So wait.,-2,1744321181.0,2025-04-10 21:39:41
1jvybch,Neukted,What else was i going to do? Hold gang.,1,1744321235.0,2025-04-10 21:40:35
1jvybch,Neukted,Damn you must be a bazillionair with your insight,-2,1744317417.0,2025-04-10 20:36:57
1jvybch,natasevres,"Or - the fact that Trump first did this by dropping the Trump coin, pulled the rug.  Then dropped the first tarriffs, pulled the rug.  Then did it on a global scale, pulled the rug.  If by now noone has learned the pattern, you should just seek a doctor.",3,1744318295.0,2025-04-10 20:51:35
1jvybch,3ugeye,"Definitely should trade with caution in the short term, long term I think we are good to go. Happy sailing!",1,1744416195.0,2025-04-12 00:03:15
1jvybch,Neukted,There are no patterns in an entropic universe. The stock market was invented for exploration. To the moon bro.,-1,1744320132.0,2025-04-10 21:22:12
1jvybch,natasevres,You should contact a doctor,3,1744320218.0,2025-04-10 21:23:38
1jvybch,horseradish13332238,lol what’s wrong with you,-1,1744351288.0,2025-04-11 06:01:28
1jvybch,General-Philosophy40,Why not wait till .01?!,0,1744336927.0,2025-04-11 02:02:07
1jvoaoi,Southern-Young-2389,"Future is bright, lets go🚀 Rip paper hands",5,1744255106.0,2025-04-10 03:18:26
1jvoaoi,Mabinajem,Is that a Van Doge?,3,1744255934.0,2025-04-10 03:32:14
1jvoaoi,Wide-Direction881,Dogewifahat,1,1744315865.0,2025-04-10 20:11:05
1jvoaoi,AssistantIcy6117,Diredoge,1,1744375779.0,2025-04-11 12:49:39
1jvoaoi,Open_Bluebird_6902,Yeah..loose all your money..but stay strong,-1,1744293375.0,2025-04-10 13:56:15
1jvfr57,Jon-Adam,The amount of .16 party's we've had lol I'm still drunk from the last 5,46,1744231163.0,2025-04-09 20:39:23
1jvfr57,Gloomy_Setting5936,LOL 😂,6,1744231858.0,2025-04-09 20:50:58
1jvfr57,ScullingPointers,Glad It isn't just me 😪,5,1744238852.0,2025-04-09 22:47:32
1jvfr57,camelot107,I woke up randomly at 5am and saw it was .13 and bought another 50 bucks worth lol lfgg,12,1744235834.0,2025-04-09 21:57:14
1jvfr57,TodaysThoughts21,"Well you would have a good time to sell, would be a little profit...",4,1744236431.0,2025-04-09 22:07:11
1jvfr57,SheCallMeBDD,Imagine selling before $1,3,1744279379.0,2025-04-10 10:02:59
1jvfr57,Comfortable-Cod-8007,I love when I average down it’s so nice. I knew tariffs were going and I dropped my whole bag at a loss. When .14 happened I was 3000 doge richer!,5,1744287052.0,2025-04-10 12:10:52
1jvfr57,Jew_Man_Chu,Nobody is partying…,5,1744240431.0,2025-04-09 23:13:51
1jvfr57,TheWizardSnoot,90 day tariff pause After buying the dip feels like Christmas morning! TO THE MOON BABY,12,1744231155.0,2025-04-09 20:39:15
1jvfr57,Basslicks27,.16 isn’t a party. .35 maybe,4,1744241923.0,2025-04-09 23:38:43
1jvfr57,Vengeful_Doge,Pump and Dump baby here we goooo,13,1744230438.0,2025-04-09 20:27:18
1jvfr57,Gloomy_Setting5936,Pump and TRUMP,11,1744231872.0,2025-04-09 20:51:12
1jvfr57,Jon-Adam,No no no that's not the plan out loud lol,-7,1744231227.0,2025-04-09 20:40:27
1jvfr57,Allyzayd,Needs to go up at least 200%,3,1744233477.0,2025-04-09 21:17:57
1jvfr57,aurrousarc,Its still in this decending wedge...,5,1744230528.0,2025-04-09 20:28:48
1jvfr57,Mobile_Cable_5958,I'm a noob. What's a wedge?,2,1744231399.0,2025-04-09 20:43:19
1jvfr57,pointerssculling,Love how people downvote you for asking a question rather than answering it.,6,1744238953.0,2025-04-09 22:49:13
1jvfr57,MikeX7s,"A piece of wood, metal, etc. having one thick end and tapering to a thin edge, that is driven between two objects or parts of an object to secure or separate them.",8,1744234864.0,2025-04-09 21:41:04
1jvfr57,Mobile_Cable_5958,Haha thanks Einstein! Lol,5,1744238976.0,2025-04-09 22:49:36
1jvfr57,Amputee69,"I have the ""noob"" an up vote. He's at just a -1 now. 😊",1,1744246591.0,2025-04-10 00:56:31
1jvfr57,AlwaysMooning,The shape of the graph. 📉,1,1744270191.0,2025-04-10 07:29:51
1jvfr57,-goneballistic-,"Turn around, we'll show ya",1,1744235430.0,2025-04-09 21:50:30
1jvfr57,Mobile_Cable_5958,Haha thanks Einstein. Lol,1,1744238956.0,2025-04-09 22:49:16
1jvfr57,Allyzayd,Isn’t a falling wedge bullish?,0,1744233586.0,2025-04-09 21:19:46
1jvfr57,aurrousarc,Not while your are still in it.. hahah,4,1744236198.0,2025-04-09 22:03:18
1jvfr57,XManReboot,Just waiting for another chance to dip in a bit.....    $0.14 is also considerable for a quickie..,2,1744237194.0,2025-04-09 22:19:54
1jvfr57,HarleyAPE23,"Every cent increment, brings a new post saying were mooning",2,1744238160.0,2025-04-09 22:36:00
1jvfr57,Eazy-E-40,Not celebrating till it goes back up to .46,2,1744246103.0,2025-04-10 00:48:23
1jvfr57,AlwaysMooning,![gif](giphy|xEpTspH9hGwHS),2,1744270237.0,2025-04-10 07:30:37
1jvfr57,Radiant_Difference43,Should we continue holding? Bitcoin just went up,1,1744232752.0,2025-04-09 21:05:52
1jvfr57,lsdviisine,Hodl until you feel like you’ve made it,1,1744234607.0,2025-04-09 21:36:47
1jvfr57,Ea50000,This is like a déjà vu,1,1744234085.0,2025-04-09 21:28:05
1jvfr57,nightfly82,Can’t wait to see all the “whales buying” stories tomorrow,1,1744234781.0,2025-04-09 21:39:41
1jvfr57,Dwilly253,If it hits $0.20 I'm out 🙏,1,1744236465.0,2025-04-09 22:07:45
1jvfr57,MrEklipze,But if it drops to 13c will you get back in? And then sell when it’s at 20c again?,1,1744237061.0,2025-04-09 22:17:41
1jvfr57,ScullingPointers,Million $ question right der,0,1744239018.0,2025-04-09 22:50:18
1jvfr57,AlwaysMooning,I’d wait for 9 cents,0,1744270291.0,2025-04-10 07:31:31
1jvfr57,Fun_Raise_7858,🥳,1,1744237583.0,2025-04-09 22:26:23
1jvfr57,Feisty-Committee109,See how long this runs up goes 😴,1,1744239296.0,2025-04-09 22:54:56
1jvfr57,tobitazzz,Party time!!!,1,1744244223.0,2025-04-10 00:17:03
1jvfr57,Big-Spot-1553,we going to the moon .. right guys  ? ..,1,1744246748.0,2025-04-10 00:59:08
1jvfr57,Big-Spot-1553,mArZ \*,2,1744246759.0,2025-04-10 00:59:19
1jvfr57,Maleficent-Ad560,Most bought in much higher than .16... I mean they're celebrating but it's like a slow clap and one hand has crinkled finger arthritis.,1,1744251366.0,2025-04-10 02:16:06
1jvfr57,Dramatic_Maximum_942,Keep buying your $20 a week if it is below the ATH,1,1744280684.0,2025-04-10 10:24:44
1jvfr57,2xoak,Moon,1,1744295775.0,2025-04-10 14:36:15
1jvfr57,Prudent_Put_7620,HODL,1,1744413702.0,2025-04-11 23:21:42
1jvfr57,Legitimate-Space-279,welp im retiring,1,1744447783.0,2025-04-12 08:49:43
1jvfr57,Vette_Guy482,"Damn it, just when I thought it would hit $0.09 again so I can buy in again and hold longer…",0,1744279399.0,2025-04-10 10:03:19
1jvfr57,74Cooltoy,"To be fair, it is looking now and not like. 12 is going to be the new low support level. Not sure we will see a . 09 or . 06 again.",1,1744315873.0,2025-04-10 20:11:13
1jvfr57,gualathekoala,Back to .15c party?,0,1744307487.0,2025-04-10 17:51:27
1jvfr57,Claymoreking,Dont buy... The next Dip is on its way   Whats your guess?  I think we will Hit 0.8 before we Go Back to 0.20,0,1744379824.0,2025-04-11 13:57:04
1jvfr57,lbvl0mc,Only haters will say it was market manipulation,-1,1744239192.0,2025-04-09 22:53:12
1jvbmvb,7374616e74,That's how you make millions when you're billionaire,67,1744222157.0,2025-04-09 18:09:17
1jvbmvb,Cootro,Oh now it’s market manipulation,2,1744284157.0,2025-04-10 11:22:37
1jvbmvb,7374616e74,"What? I’ve never seen any other explaination, what do you think?",5,1744287360.0,2025-04-10 12:16:00
1jvbmvb,Minisfortheminigod,"Crypto aligns more with fashion, the more it’s shilled and hyped the more people get into it. Billionaires have no control over this.",-9,1744298895.0,2025-04-10 15:28:15
1jvbmvb,7374616e74,Are you even paying attention?,5,1744298957.0,2025-04-10 15:29:17
1jvbmvb,Minisfortheminigod,Yeah that’s why I’m up.,-7,1744308019.0,2025-04-10 18:00:19
1jvbmvb,7374616e74,Go to sleep you wont lose iq points at least,5,1744308200.0,2025-04-10 18:03:20
1jvbmvb,Minisfortheminigod,Wait what? What does sleep have anything to do with IQ. You really don’t know how IQ works and this is worrysome. Welp enjoy your tax loss harvesting.,-6,1744334441.0,2025-04-11 01:20:41
1jvbmvb,Boon_Rebu,![gif](giphy|MyvY6m13PHOfabwWnE),27,1744220085.0,2025-04-09 17:34:45
1jvbmvb,JawnsonII,"Not a swing, 90 day pause on tariffs for non-retaliating countries (10% max)",32,1744220190.0,2025-04-09 17:36:30
1jvbmvb,Southern-Young-2389,This pump is just telling us what will happen when everything will settle on,30,1744220350.0,2025-04-09 17:39:10
1jvbmvb,Southern-Young-2389,Prelogue🚀💪,10,1744220367.0,2025-04-09 17:39:27
1jvbmvb,not_into_that,Good time to set up shorts. I recommend pepe coin and shib to short hard.  p.s. not financial advice,1,1744238061.0,2025-04-09 22:34:21
1jvbmvb,Whoisyourfactor,Exactly!! There is so much money on the sidelines now waiting to be dumped in. I might not like Trump but I believe him when he says that we will boom.,-9,1744222105.0,2025-04-09 18:08:25
1jvbmvb,Dude_with_the_skis,You’re a fool if you believe anything that guy says.,4,1744234633.0,2025-04-09 21:37:13
1jvbmvb,Boring-Ad1168,but it is his intention to boom the crypto market at some point right?,-2,1744263343.0,2025-04-10 05:35:43
1jvbmvb,Gloomy_Setting5936,I just looked it up you’re right. OMG SOME RELIEF 😅   It’s not a cancellation but a 90 day pause will undoubtedly help.,5,1744220331.0,2025-04-09 17:38:51
1jvbmvb,superworking,"They haven't made it through any of their 30 day policies without throwing wrenches in them, I wouldn't count on a 90 day sticking.",6,1744231746.0,2025-04-09 20:49:06
1jvbmvb,Audixieboy37,"Never sell scared, always buy and sell on highs!",11,1744224193.0,2025-04-09 18:43:13
1jvbmvb,WorkingSpecific7980,It’s the whole market too. My cannabis stocks look the same.,5,1744220207.0,2025-04-09 17:36:47
1jvbmvb,MrEklipze,Called it!,5,1744221545.0,2025-04-09 17:59:05
1jvbmvb,DontLook_Weirdo,"""smallest"" news, lol.  On the bright side, we are witnessing market manipulation from the greatest clown stage on earth.",18,1744230028.0,2025-04-09 20:20:28
