post_id,author,body,score,created_utc,date
1k4i9lr,Flashy_Abrocoma7579,Research. Patience and be like a hawk when targets are set  Right now that sort of money is actually doing alright in basic term accounts.  By all means play with some loot play in crypto.   Interest rates are set to fall so timing now may be beneficial,1,1745634985.0,2025-04-26 02:36:25
1k4i9lr,Upstairs_Moment_1043,"hey first of all, OP, i’m sorry about your parents. second, this is not something to stress about. most people who come into money immediately hire a financial planner to help them. if you like to “tough it out on your own” (a thing i would not recommend), put a majority of that money in a safe investment (a boiler plate Roth IRA, maybe a CD, a good 4.5% savings account) and then keep a little bit to play with if you trust your investing skills. if investing is not a skill you already have, you do not want to gamble all your money away. start small, learn the basics, and above all else protect yourself. i know losing your parents is hard",1,1745255772.0,2025-04-21 17:16:12
1k4i9lr,Most-Clerk-2828,Thank you for that I really needed to hear this. What banks offer those types of safe investments?  I’d feel a lot safer with a major trusted bank.,1,1745257735.0,2025-04-21 17:48:55
1k4i9lr,superjen,"CDs at your local reputable credit union or bank with a physical local presence would be a great place to park that money while you take time to grieve and research everything.  I'm sorry for your loss, it's a big one and you don't need to make big decisions the first year IMO.",1,1745278624.0,2025-04-21 23:37:04
1k4i9lr,Upstairs_Moment_1043,"most banks have CDs you can invest in for a guaranteed ~5% annual return (some give up to 9%). you can also open a Roth IRA at pretty much any brokerage— Charles Schwab, Fidelity etc— and they pretty much return as good as the market (which in the long term is really good!). most of us here are degens willing to throw a bunch of money at shitcoins and memecoins or even gamble 0dte SPY options but that is not a good idea if you’re a beginner and certainly a terrible idea with as much money as you just inherited (you can lose it all in a flash).",1,1745258046.0,2025-04-21 17:54:06
1k4i9lr,MrKillerKiller_,"Noooo. Maybe 5% on BTC when the market is in bear status in like a year. The rest in a standard mutual fund with SPX and all that in the bag. Its the top of the bull run, the highest of speculation price ranges until end of year. Summer is always the worst price action. Just no. Set something up through vanguard or fidelity. Crypto is speculative and it all is just bitcoin profits flowing into the rest. Do not get fooled into thinking crypto is more than a cycle swing trade. When bear markets stop pulling back 80%+ every cycle you’ll slowly see it become more of a traditional investment. It is not something to throw life savings amounts into. Absolutely not",1,1745268098.0,2025-04-21 20:41:38
1k4i9lr,Sufficient-Middle167,"Put it all in msty and live off the  Dividends  that would be bringing in almost like 16 grand a month. If you can’t live off 16 grand, you got a huge problem lol",0,1745257849.0,2025-04-21 17:50:49
1k4i9lr,Merlin1039,It's lost 50% of it's peak value in 6 months. The div won't make up for that and the div has been crashing every month,1,1745285357.0,2025-04-22 01:29:17
1k4i9lr,ScullingPointers,Donate it to Luigi's defense team. He's going to need our help.,0,1745272005.0,2025-04-21 21:46:45
1k4i9lr,Wide-Direction881,Can you slide me some doge?  D7EQn4GgYNT69x9e5HLUaX5qjryxHFoVVk,-2,1745256853.0,2025-04-21 17:34:13
1k476vr,fab-zed,"Ah, graphs! I know the graphs. As a matter of fact I do the graph all the time.",20,1745218958.0,2025-04-21 07:02:38
1k476vr,God-Emperor-Pepe,I’m somewhat of a graph myself.,5,1745267413.0,2025-04-21 20:30:13
1k476vr,SecretSquirrel8888,"One Doge, One dollar 4eva!",5,1745237257.0,2025-04-21 12:07:37
1k476vr,Odd_Stick_3042,"If it’s three in a row, then 4-th one could be different. Maybe.. I’m not sure.. I definitely not arguing with you..",2,1745231847.0,2025-04-21 10:37:27
1k476vr,yudsayo,different in a good way or a bad way. decision time.,2,1745268949.0,2025-04-21 20:55:49
1k476vr,Odd_Stick_3042,"Exactly.. it’s a risk, but is it worth it?",1,1745298980.0,2025-04-22 05:16:20
1k476vr,anotherjunkiescum,I’ve been holding since 2020 why would I stop now.. I’m 💎🙌🏻 till a dollar,2,1745282438.0,2025-04-22 00:40:38
1k476vr,SmoothPersonality923,"to około 0,5",1,1745221272.0,2025-04-21 07:41:12
1k476vr,Swapuz_com,"Dogecoin (DOGE) is sitting at **$0.162**, forming bullish patterns with key levels at **$0.19** and **$0.23**. If momentum holds, **$0.30** could be the next big target.",1,1745413829.0,2025-04-23 13:10:29
1k476vr,Inner-Yams,For me its a trigger point more then a sell signal.,1,1745458961.0,2025-04-24 01:42:41
1k476vr,Routine-Duck6896,Muh graphs,1,1745743484.0,2025-04-27 08:44:44
1k41hyn,RevolutionaryBed297,Happy Doge day to the original legend. Y’all started a movement and a wave of legendary Shibas follow in your wake. San community looks to keep the vision of Do Only Good Everyday at our forefront.,2,1745198039.0,2025-04-21 01:13:59
1k41hyn,Neukted,Lfg,2,1745202054.0,2025-04-21 02:20:54
1k41hyn,Dazzling_Tax5869,Happy Doge Day!,1,1745222081.0,2025-04-21 07:54:41
1k41hyn,MajorWarGeneral,HAPPY DOGEDAY? I’M DOWN 30%,1,1745248369.0,2025-04-21 15:12:49
1k41hyn,supplier-Benza,Ahhh San chan is so cute!!,1,1745285396.0,2025-04-22 01:29:56
1k44dnm,Alternative_Demand96,Why would you use a website to generate a wallet,14,1745208154.0,2025-04-21 04:02:34
1k44dnm,Saint-Kevin,"I was testing it out.  It was years ago when doge wasn't worth much.  I just forgot about it until earlier this year, didn't bother taking it out.  Just thought there are some others that might have done the same but with larger amounts and am trying to warn others.",6,1745208345.0,2025-04-21 04:05:45
1k44dnm,Fulvio55,"Yes, walletgenerator has been compromised twice that we know of.  In one instance there was a clone site that phoned home with all the wallets it generated. We mounted a concerted effort to flood it with millions of wallets until it was taken down, which took a few days.  In the other case there was a bug where it was reusing the same wallets repeatedly. That one was fixed fairly quickly as well.  This is an open source project, and anyone could download the code and run it in preference to using the live site.  I generally advise people to generate thousands of bulk wallets and to let them stew for as long as possible before using any of them randomly. For immediate needs, coinb.in will generate single wallets which you can do offline on your own copy, not the live site.  I think you may have fallen victim to one of the two instances above. I think a blanket warning isn’t warranted though. All wallets are identical, and how you generate them is irrelevant. The risk is not in the methodology but in someone else having access to the keys either through compromised code, in transit, or through malware on your devices.  I’m sorry for your loss. Did you have other wallets from the same time as well? And were they bulk or a single wallet?",13,1745210095.0,2025-04-21 04:34:55
1k44dnm,Saint-Kevin,"No, just a single wallet.  Thank you for the info.",3,1745210393.0,2025-04-21 04:39:53
1k44dnm,Fulvio55,"NP.  I’m guessing the guy who cloned the site may have gone back to look through his harvested keys and had another bite. Was there activity on the target wallet before this theft? Have the coins moved out again? And if so, are there any associated wallets feeding in that look like they were used back then?",3,1745210984.0,2025-04-21 04:49:44
1k44dnm,Saint-Kevin,"Also, if you're a victim to the scam, get the thief's info and address from Dogechain website and report it to the ""Cryptocurrenty - Internet Crime Complaint Center (IC3)"" like I did.  This way they have a decent chance of getting caught.",3,1745209468.0,2025-04-21 04:24:28
1k44dnm,beeskneecaps,This reminds me of my garlicoin disaster. Sorry bro,1,1745208603.0,2025-04-21 04:10:03
1k44dnm,Saint-Kevin,It's cool man.  Live and learn I guess.  Glad I didn't store a lot in that wallet though.,2,1745208727.0,2025-04-21 04:12:07
1k44dnm,horseradish13332238,lol,-8,1745207556.0,2025-04-21 03:52:36
1k44dnm,Saint-Kevin,"It might be funny because it was only about $150 dollar loss for me, but there were a bunch of others that lost way more than that on the list of transactions.",2,1745208262.0,2025-04-21 04:04:22
1k44dnm,horseradish13332238,No it’s just funny how clueless people are.  You’re lucky it was only 150,-1,1745209640.0,2025-04-21 04:27:20
1k44dnm,robotcoke,"&gt;No it’s just funny how clueless people are.  You’re lucky it was only 150  Why is that funny? Because you happen to have this knowledge? There was a time when you didn't have this knowledge, either. Just be happy you didn't have to learn it the hard way like the people OP is talking about did.   Nothing funny about this. These people used a product the way it was intended to be used - which is made specifically to prevent this exact thing from happening.",2,1745245909.0,2025-04-21 14:31:49
1k44dnm,MASTER_SUNDOWN,"Not your keys, not your crypto",0,1745247326.0,2025-04-21 14:55:26
1k44dnm,pop-1988,"&gt; that site was/is compromised  Was compromised many years ago, by a hand-coded random number generator, which had an insecure quirk - every second ""random"" number it generated is ""3""  &gt; they have a decent chance of getting caught  No",0,1745258507.0,2025-04-21 18:01:47
1k44dnm,Saint-Kevin,"It is better than doing nothing so I did my part.  The guy stole $52k worth of Dogecoin in one day.  The IC3 might be interested since it is a large amount of fraud, but who knows... maybe you're right.",0,1745260779.0,2025-04-21 18:39:39
1k44dnm,pop-1988,A Dogecoin address does not identify its owner,0,1745261014.0,2025-04-21 18:43:34
1k44dnm,Saint-Kevin,It can however see it's transactions and link other addresses associated with it.  I'm pretty sure the FBI's IC3 knows more than you do on what to do.  That's why they ask for the address and transaction number which I provided to them.  Hope they get caught and rot in jail.,1,1745265033.0,2025-04-21 19:50:33
1k4135c,C300w204,good memes make good times,17,1745198056.0,2025-04-21 01:14:16
1k4135c,No_Dare_6284,What's this mean?,7,1745199743.0,2025-04-21 01:42:23
1k4135c,Neukted,Or tonight,5,1745202941.0,2025-04-21 02:35:41
1k4135c,Fun_Raise_7858,It's happening🤣,12,1745197211.0,2025-04-21 01:00:11
1k4135c,Raynman90,Source: Trust me bro,8,1745200891.0,2025-04-21 02:01:31
1k4135c,Super-Junket3805,Thought it was March?? Then April?? 🤔 🤔,7,1745199404.0,2025-04-21 01:36:44
1k4135c,Lagna85,Summer 2024,4,1745201721.0,2025-04-21 02:15:21
1k4135c,liquid_at,"april was the time and still is. But anyone who bought for the april run who isn't in profit right now, would want people buying to get the necessary liquidity to sell.   I'm highly suspicious of anyone saying that summer will be bullish. It would be the first summer in the history of perpetual markets where we'd get a high.",3,1745231386.0,2025-04-21 10:29:46
1k4135c,Gohan335i7,"![gif](giphy|ETPCFipRTogPb0C22o)  Hodl, it’ll happen, you’ll just want to own it when it does…",3,1745203255.0,2025-04-21 02:40:55
1k4135c,Odd_Stick_3042,I heard apocalypse coming,3,1745210337.0,2025-04-21 04:38:57
1k4135c,znehlrak,Well keep on saying that and one day you will eventually be right,3,1745241820.0,2025-04-21 13:23:40
1k4135c,Stony_1987,Vroom vroom...,5,1745198774.0,2025-04-21 01:26:14
1k4135c,liquid_at,"Any reason you believe the most boring and least bullish period of the year is going to see an ATH?  I mean... it's a weird year and everything, but without an argument it feels like a lot of copium. We have about 2 weeks left for the traditional bull market and Mid-May is traditionally bearish. Even extended, we might get 4 weeks where a run could happen.   Personally, if we do not see a run this month, I would not expect to see one before november or january.",2,1745231304.0,2025-04-21 10:28:24
1k4135c,Elegant-Wedding8582,Every cycle is different. I figured beginning 2026 would be the peak but now I’m thinking November we peak. I think Q3 we see new ATH. Then Q4 we peak. Bitcoin needs to get to 90k to get the momentum back cause once 100k hits again I think we fly again!,5,1745238596.0,2025-04-21 12:29:56
1k4135c,liquid_at,"An argument can be made that 2025 resembles 2020. This would break the 4 year cycles, but still match previous progression.  If we don't see a run in the next few weeks, 20w6 is still a chance, but no guarantee.",2,1745256249.0,2025-04-21 17:24:09
1k4135c,Southern-Young-2389,"Underperforming now, I see more red incoming, hope I'm wrong and we🚀 ",2,1745209685.0,2025-04-21 04:28:05
1k4135c,zoneyboy,🙏🏼🙂‍↕️,3,1745198985.0,2025-04-21 01:29:45
1k4135c,Opportunist_tradeX,Summer 2100?,1,1745310245.0,2025-04-22 08:24:05
1k4135c,Helpful_Source_8985,So you saying .75 in summer?,1,1745405542.0,2025-04-23 10:52:22
1k43wri,ArtInfinite5179,![gif](giphy|jPAdK8Nfzzwt2),3,1745205740.0,2025-04-21 03:22:20
1k43wri,tobitazzz,lol,2,1745205759.0,2025-04-21 03:22:39
1k43wri,Amputee69,Happy Easter. 🐰  Perhaps Doge will rise too.,2,1745210336.0,2025-04-21 04:38:56
1k43wri,Saint-Kevin,Happy Easter,2,1745210454.0,2025-04-21 04:40:54
1k43wri,Gloomy_Setting5936,Happy Easter my man.,1,1745214496.0,2025-04-21 05:48:16
1k43dfz,cUrrencyofchoice3,"Great job, it’s well done!!",1,1745204358.0,2025-04-21 02:59:18
1k43dfz,KevinNeverSleeps,Thanks so much!,2,1745206124.0,2025-04-21 03:28:44
1k43dfz,ZVsmokey,I dont hold any doge or any crypto. I'm not here to be combative at all. I'd like to know just how many doge coin are in circulation?,1,1745207967.0,2025-04-21 03:59:27
1k44ctk,TrustLordJesusChrist,Jesus is risen ✝️,1,1745230934.0,2025-04-21 10:22:14
1k3oa9f,liquid_at,![gif](giphy|FPTDCH4KpB5mFiHHAB),3,1745164806.0,2025-04-20 16:00:06
1k3oa9f,RunItupBaby,Happy Easter Fam,3,1745161444.0,2025-04-20 15:04:04
1k3oa9f,kirtash93,Woof woof!,3,1745165136.0,2025-04-20 16:05:36
1k3oa9f,Open_Bluebird_6902,"Nice picture! At least while you HODL loosing all your money, you ca look at nice puppies",2,1745166076.0,2025-04-20 16:21:16
1k3oa9f,[deleted],";) much wow, I hope yall have a good day",2,1745173307.0,2025-04-20 18:21:47
1k3oa9f,PuG3_14,Doge is Risen!,2,1745176457.0,2025-04-20 19:14:17
1k3oa9f,Shellilala,![gif](giphy|3osxYoCkKu892JBLUc),1,1745201337.0,2025-04-21 02:08:57
1k43s08,Electrical_Ad_9196,Your post is visible here,3,1745205352.0,2025-04-21 03:15:52
1k43s08,your-dad-ethan,Lukewarm IQs are on display all over this sub.,2,1745327858.0,2025-04-22 13:17:38
1k40zs3,FinalHeaven88,"Ask again in a week if there was a rally, then we'll let you know.",11,1745197779.0,2025-04-21 01:09:39
1k40zs3,inewbee,Thank you for your service. See you behind Wendy’s,1,1745211418.0,2025-04-21 04:56:58
1k40zs3,dayumbrah,![gif](giphy|fXnRObM8Q0RkOmR5nf),1,1745206166.0,2025-04-21 03:29:26
1k40zs3,natasevres,"Dollar is crashing, so I do foresee a rally on crypto similiar to gold.  The stock market is not reliable",1,1745266803.0,2025-04-21 20:20:03
1k40zs3,Similar-Inevitable42,Rally to 0 maybe,-2,1745220207.0,2025-04-21 07:23:27
1k40zs3,GJustGotaBag,It’s too easy🥱🚀  ![gif](giphy|x0npYExCGOZeo),1,1745356905.0,2025-04-22 21:21:45
1k3vcmj,C300w204,Who is that boi,2,1745190660.0,2025-04-20 23:11:00
1k3vcmj,bodog9696,"Yeah, sorry. Just not a fan.         Not just a fan, but all variables should be evaluated. Yes it blows, but sometimes doing the work is unavoidable. Cool?",-1,1745193988.0,2025-04-21 00:06:28
1k3iywk,Stony_1987,Happy Easter. Much W.O.W,2,1745142917.0,2025-04-20 09:55:17
1k3iywk,GeorgeSorf,Happy Easter!!,2,1745161722.0,2025-04-20 15:08:42
1k3iywk,ShrimpScampi1,happy easter!,2,1745168568.0,2025-04-20 17:02:48
1k3iywk,[deleted],;) enjoy the day!,2,1745173323.0,2025-04-20 18:22:03
1k3iywk,Shellilala,Happy Easter   ![gif](giphy|12ypWXblQkzLk4),2,1745201997.0,2025-04-21 02:19:57
1k3iywk,Open_Bluebird_6902,"Happy Easter! While you HODL in an increasing loss, wales are on their luxurious yacht thanks for your money 🤣😂",-1,1745145470.0,2025-04-20 10:37:50
1k3iywk,rizzo49er,If you don't  sell your don't  give them anything  clown,1,1745306531.0,2025-04-22 07:22:11
1k3h0v9,jorgschrauwen,Since when is 4 20 doge day?,3,1745134147.0,2025-04-20 07:29:07
1k3h0v9,RioRancher,Since you have to be high to think it has value,2,1745153808.0,2025-04-20 12:56:48
1k3h0v9,CoinGate,Drop your favorite Doge memes.,1,1745133373.0,2025-04-20 07:16:13
1k3h0v9,Every_Hunt_160,"Today’s the day!!  DOGE 420, TO THE MOON !!",1,1745136708.0,2025-04-20 08:11:48
1k3h0v9,Remarkable_Misty,We usually dip on 420,3,1745146806.0,2025-04-20 11:00:06
1k3h0v9,DancesWithDeliMeats,"Went to bed at .159, woke up to .154 🥲",1,1745156270.0,2025-04-20 13:37:50
1k3h0v9,Shellilala,![gif](giphy|rVTYCU7JG6S4LRJMgX),1,1745202145.0,2025-04-21 02:22:25
1k3h0v9,zession1,"While most crypto went in the positive, doge stayed in the negative? 😭",0,1745133583.0,2025-04-20 07:19:43
1k3h0v9,DancesWithDeliMeats,Tactical Growth 🤔,1,1745154378.0,2025-04-20 13:06:18
1k3h0v9,Open_Bluebird_6902,Ahaha HODL 😂😂🤣until it goes to 0.00005,-3,1745135065.0,2025-04-20 07:44:25
1k3lu8e,layn333,Do you wanna build a dogecoin?,5,1745153984.0,2025-04-20 12:59:44
1k3lu8e,Neukted,Yes. Gives a big node,1,1745154255.0,2025-04-20 13:04:15
1k3lu8e,DesconocidoTres,Haven’t been there in a while. I’m waiting to go back!,2,1745176193.0,2025-04-20 19:09:53
1k3lu8e,Shellilala,Why not ?   ![gif](giphy|S1SnLg08CxnUGqyqha),2,1745202201.0,2025-04-21 02:23:21
1k3lu8e,ANeeSH20,Username checks out this entire sub.,0,1745154336.0,2025-04-20 13:05:36
1k3lu8e,Neukted,![gif](giphy|26Ff2g4dDhF7gPEl2),1,1745154870.0,2025-04-20 13:14:30
1k3lu8e,liquid_at,imagine being gullible.  imagine thinking memes are opinions.   imagine thinking you are smart because you got fooled by something you could have just looked up.,1,1745155927.0,2025-04-20 13:32:07
1k3lu8e,ANeeSH20,"Unfortunately, i cant happen to imagine soo much at soo little time given, for the better or worse.",0,1745161851.0,2025-04-20 15:10:51
1k3lu8e,Neukted,i cant fathom imagination,1,1745175083.0,2025-04-20 18:51:23
1k3lu8e,Neukted,really thought it was phathom,1,1745175261.0,2025-04-20 18:54:21
1k3bhpn,MrCedswiss8,Did someone say altseason?,4,1745131652.0,2025-04-20 06:47:32
1k3bhpn,kaedoge,![gif](giphy|QEYYlJqOaEhXrjTrOH),4,1745119083.0,2025-04-20 03:18:03
1k3bhpn,WarmTranslator6633,On 4/20 too,4,1745128055.0,2025-04-20 05:47:35
1k3bhpn,C300w204,Much math,3,1745112886.0,2025-04-20 01:34:46
1k3bhpn,Gloomy_Setting5936,Such arithmetic.,3,1745126225.0,2025-04-20 05:17:05
1k3bhpn,Shellilala,![gif](giphy|gEvab1ilmJjA82FaSV),3,1745202508.0,2025-04-21 02:28:28
1k3bhpn,shazam99301,Nice.,2,1745121600.0,2025-04-20 04:00:00
1k3bhpn,Fulvio55,"Yeah, and?  A million doge used to be ninety bucks.  Don’t you wish you’d bought some? 💰",2,1745146709.0,2025-04-20 10:58:29
1k3bhpn,Neukted,![gif](giphy|PfGyTbeBBaVd8rMDtN),1,1745202911.0,2025-04-21 02:35:11
1k3bhpn,Shellilala,![gif](giphy|AFG5O9JGmWwa2gMLQQ),2,1745202480.0,2025-04-21 02:28:00
1k3ao7c,_Ceaz_,HODL 💎🙌🏼member since 2020,8,1745182659.0,2025-04-20 20:57:39
1k3ao7c,Crafty-Complex6914,Same. Idgaf what happens until 2030. Its all a game until then! Led by the orange spedcial himself!,3,1745342433.0,2025-04-22 17:20:33
1k3ao7c,GJustGotaBag,🖨️💸 Just a matter of time,2,1745973281.0,2025-04-30 00:34:41
1k3ao7c,aphexflip,Back in my day you could make money with doge.,23,1745114600.0,2025-04-20 02:03:20
1k3ao7c,GJustGotaBag,Must be a new day💸🖨️,1,1745973248.0,2025-04-30 00:34:08
1k3ao7c,JustinCompton79,There’s potential elsewhere,-2,1745115750.0,2025-04-20 02:22:30
1k3ao7c,dynoman7,![gif](giphy|SclQC1VGlH0GyQvbkr),12,1745117793.0,2025-04-20 02:56:33
1k3ao7c,JustinCompton79,![gif](giphy|qMzIaUz1mOTiHEJZhF),0,1745118556.0,2025-04-20 03:09:16
1k3ao7c,your-dad-ethan,DOGE of course!,0,1745147795.0,2025-04-20 11:16:35
1k3ao7c,OxbridgeDingoBaby,There isn’t.,1,1745131111.0,2025-04-20 06:38:31
1k3ao7c,JaggaJazz,Brain rot,5,1745126884.0,2025-04-20 05:28:04
1k3ao7c,GJustGotaBag,That’s why you are in a stock sub talking trash. Must be nice to eat all day &amp; sit on the internet.,0,1745973320.0,2025-04-30 00:35:20
1k3ao7c,JaggaJazz,I sold all my alts over a year ago at the top but do you bb  Funny how you respond to my 9 day old message,1,1745978385.0,2025-04-30 01:59:45
1k3ao7c,GJustGotaBag,Oh… I’m about to pass 20k in Doge alone. This is the only alt coin I believe in. Other than that I’m BTC &amp; S&amp;P500 indexes.🥱,1,1746042430.0,2025-04-30 19:47:10
1k3ao7c,Suitable-Classic-174,![gif](giphy|Wgb2FpSXxhXLVYNnUr|downsized)  Must be new here.,7,1745116922.0,2025-04-20 02:42:02
1k3ao7c,mikelimebingbong,Says the people holding for only a couple months lol,6,1745152515.0,2025-04-20 12:35:15
1k3ao7c,Juliansaurusrex,Why?,3,1745125060.0,2025-04-20 04:57:40
1k3ao7c,Dazzling-Photo-5479,He’s new. Don’t mind him,7,1745158715.0,2025-04-20 14:18:35
1k3ao7c,Nobleman5860,Patience,2,1745169304.0,2025-04-20 17:15:04
1k3ao7c,GJustGotaBag,You already know,1,1745973421.0,2025-04-30 00:37:01
1k3ao7c,Maleficus-Malus,I'm in at 29c and not too worried. I keep holding we see what happens in 4 to 5 years. The more time passes the less stressed I am about losing so much paper money.  It's not lost until it's sold.,2,1745257425.0,2025-04-21 17:43:45
1k3ao7c,GJustGotaBag,It will appreciate quicker than you may expect.,1,1745973462.0,2025-04-30 00:37:42
1k3ao7c,friendly-survivor,did i miss something,4,1745116472.0,2025-04-20 02:34:32
1k3ao7c,Intelligent-Session6,"No, just your usual worry Nancy with his 3 alarm fire. Hasn’t really been following the markets to see everything is unstable at the moment.",13,1745116826.0,2025-04-20 02:40:26
1k3ao7c,No-Spread9601,THE MOMENT? LOL haven't been positive since buying at the dips back since December lol down 42% all year lmfao,1,1745274735.0,2025-04-21 22:32:15
1k3ao7c,Intelligent-Session6,Me too down 50%. But didn’t get into thinking I’d be rich in a year or two. People threw in their life savings into it like it was a sure thing and are now panicking,2,1745274839.0,2025-04-21 22:33:59
1k3ao7c,No-Spread9601,Exactly I started at 60 atom built up buying in earned 20 with staking it's been nothing but dips,1,1745274939.0,2025-04-21 22:35:39
1k3ao7c,ForeverPursuing,No bro. To the moon!!!!!!!!!!!  Continue to hold!!!!!!!!!  $1 here we come 🫡🫡🫡🫡  ![gif](giphy|ISOckXUybVfQ4),5,1745110908.0,2025-04-20 01:01:48
1k3ao7c,Clear-Jellyfish2197,How so please advise,1,1745120152.0,2025-04-20 03:35:52
1k3ao7c,Open_Bluebird_6902,HODL 🤣🤣😂😂,1,1745132924.0,2025-04-20 07:08:44
1k3ao7c,Catharsiscult,A recession is not a good time to buy meme coins.,1,1745155728.0,2025-04-20 13:28:48
1k3ao7c,hotcheezsoup3014,Unless that coin is a decade old then it might be all right,2,1745167303.0,2025-04-20 16:41:43
1k3ao7c,GJustGotaBag,😒🥱,1,1745973408.0,2025-04-30 00:36:48
1k3ao7c,BGJohnnyG,It's still in the top 10,1,1745190721.0,2025-04-20 23:12:01
1k3ao7c,Cannonblast420,"I think we’re in a good place to be accumulating/dollar cost averaging. It’s definitely finding a bottom or already has bottomed. Just my opinion, I’m long on the Doge. Very long",1,1745200242.0,2025-04-21 01:50:42
1k3ao7c,yecatsmiles,Still my most profitable stock to date. But I bought at .002.... 😘,1,1745202321.0,2025-04-21 02:25:21
1k3ao7c,Difficult_Fig_1582,Huh,1,1745125347.0,2025-04-20 05:02:27
1k3ao7c,Fun_Raise_7858,Moon soon,0,1745145421.0,2025-04-20 10:37:01
