post_id,author,body,score,created_utc,date
1jvlssn,TheRazorPigKid,I prefer to do bad,1,1744250905.0,2025-04-10 02:08:25
1jvlssn,Southern-Young-2389,"Tell that to these paper hands, I hope we will have another good day and RIP weak hands",1,1744255261.0,2025-04-10 03:21:01
1jvlssn,nickert0n,"Sir this is a Dogecoin subreddit, not a catocoin",1,1744381272.0,2025-04-11 14:21:12
1jvk5nr,DiligentButterfly443,Doge seems to be holding up better than other cryptos at the moment,2,1744242109.0,2025-04-09 23:41:49
1jvk5nr,SecretSquirrel8888,HLD that line! For Kabosu!,2,1744244879.0,2025-04-10 00:27:59
1jvk5nr,Open_Bluebird_6902,HODL until it goes to 0.00005,1,1744252851.0,2025-04-10 02:40:51
1jvk5nr,Southern-Young-2389,Everytime we pump these m....f... paper hands and weak hands never sleep,1,1744255022.0,2025-04-10 03:17:02
1jvk5nr,ProfessionalBike5185,Just sell,1,1744561854.0,2025-04-13 16:30:54
1jvc9cu,WilyWascallyWizard,Woof woof mother doger.,3,1744222086.0,2025-04-09 18:08:06
1jvc9cu,Shellilala,![gif](emote|free_emotes_pack|joy),1,1744224587.0,2025-04-09 18:49:47
1jvc9cu,Open_Bluebird_6902,Is up? Is it really dude? 😂🤣 compared to one month ago? Two months ago?,1,1744296738.0,2025-04-10 14:52:18
1jvc9cu,C300w204,"Its a meme , dont fight with memes lmao",0,1744296986.0,2025-04-10 14:56:26
1jvl89f,Routine-Duck6896,Who,0,1744245263.0,2025-04-10 00:34:23
1jvl89f,xBlitzgewitter,Who what?,0,1744325211.0,2025-04-10 22:46:51
1jvl89f,nickert0n,[https://www.21shares.com/en-eu](https://www.21shares.com/en-eu),-1,1744245473.0,2025-04-10 00:37:53
1jvon3s,Fulvio55,Why are you spamming this crap? Trying to get banned?,1,1744264963.0,2025-04-10 06:02:43
1jvtv0h,National-Jackfruit32,Umm? Buy doge coin !!!,13,1744278599.0,2025-04-10 09:49:59
1jvtv0h,brazys,yiou need a fence to hodl him?,5,1744281494.0,2025-04-10 10:38:14
1jvtv0h,liusuneiAlice,"Yes, I hope to surround it and make it safer, so that I don't have to worry about its safety all the time",1,1745567524.0,2025-04-25 07:52:04
1jvtv0h,Brilliant_Wealth_433,A it took to keep mine in the yard was. 8 ft of hog panel around the entire yard.  Shelf brackets at top of every post and a turned in row of fencing so the dog can't climb over.  Then we tried rocks along the entire inside of the fence.  That eventually turned into digging out along the fence and setting concrete bags where the base of the fence is literally concrete down.   Dang dog is so determined to escape so she can go get treats from the neighbor.,2,1744282073.0,2025-04-10 10:47:53
1jvtv0h,slykethephoxenix,"/r/lostredditors  But seriously, why do you want an invisible fence? You could try a geofenced electric color (one that vibrates - not shocks), but that only works for as long as it has batteries.  Another solution could be thick shrubs that act as a natural wall.",1,1744284266.0,2025-04-10 11:24:26
1jvtv0h,Top-Beginning2560,Does this mean the price is going up?,1,1744299276.0,2025-04-10 15:34:36
1jvtv0h,herkdwrlmal,"Yes, broke redditors are looking at buying things. This is bullish.",1,1744302296.0,2025-04-10 16:24:56
1jvtv0h,Routine-Duck6896,Shut up,1,1744312140.0,2025-04-10 19:09:00
1jvtv0h,thedukeofprescott,"Okay - this may be the wrong sub, but…  I had 2 huskies growing up. You can’t stop them. It’s not that they’re smarter than you (depends on the husky and the human), they are determined. We had an electric fence, turns out it turns off a certain distance outside the fence. We had a permanent fence, they went under that. Hell, they were inside one day and the dug through the floor and escaped through the crawl space. We weren’t even gone for a half hour!   Lesson is, love them, feed them, put a tracker on them and a chip in them, and then buy some DOGE while you wait for them to come home.",1,1744326033.0,2025-04-10 23:00:33
1jvtv0h,masterbatesAlot,I personally just don't let my dog play in the front yard unattended.  Spend the money on Dogecoin instead!,1,1744330637.0,2025-04-11 00:17:17
1jvtv0h,makograves,"I have two huskies and some dogecoin, guess which one gives me the most joy?",1,1744590749.0,2025-04-14 00:32:29
1jvtv0h,Rshellnizzle,"The only way to keep Doge secure is self custody, I use Trezor.",1,1744642590.0,2025-04-14 14:56:30
1jvtv0h,Ok_Worker7057,"My friend recommended the PetHey electronic invisible fence to me. I'm currently in the trial stage because this electronic fence is three-in-one. I need to use it for a while. If I use it well, I will reply to you!",1,1745567370.0,2025-04-25 07:49:30
1jvcmck,Free-Finding9047,Can't keep a good dog down,6,1744232745.0,2025-04-09 21:05:45
1jvcmck,natasevres,Tarriffs where paused - again. (Or selected tarriffs) - for 90 days.  China got further raised tarriffs.  So yeah…,5,1744223317.0,2025-04-09 18:28:37
1jvcmck,Responsible-Cash728,But When??,2,1744325755.0,2025-04-10 22:55:55
1jvcmck,Billionarie_1,Yes in 2045,1,1744315259.0,2025-04-10 20:00:59
1jvcmck,Radiant_Difference43,"So, do we sell while it’s high or hold",1,1744224939.0,2025-04-09 18:55:39
1jvcmck,TYT6647,Should sell alittle profit yet.,1,1744226034.0,2025-04-09 19:13:54
1jvcmck,[deleted],[removed],-4,1744222542.0,2025-04-09 18:15:42
1jvcmck,Southern-Young-2389,We don't need you sir,6,1744222795.0,2025-04-09 18:19:55
1jv5fy6,liquid_at,"That's why you never give financial advice....  If you want to help your friends, throw some money in for them and pay them when you cash out. If you wouldn't spend any money for them, they aren't friends, but only people you want to impress.",9,1744215600.0,2025-04-09 16:20:00
1jv5fy6,Usual_Blueberry_1953,🦮,3,1744209031.0,2025-04-09 14:30:31
1jv5fy6,Fearless_Agent_1985,When bullrun?,3,1744210698.0,2025-04-09 14:58:18
1jv5fy6,ResponsibleWeb7136,Now apparently,3,1744235974.0,2025-04-09 21:59:34
1jv5fy6,Atlus01,That's the thing we never left the bull run.,2,1744276425.0,2025-04-10 09:13:45
1jv5fy6,Cannonblast420,"If you look at it in the long term, we’ve been in a bull run since the first bull run started. Just in a correction currently, finding a bottom. Or a bottom was already found 😉",1,1744496577.0,2025-04-12 22:22:57
1jv5fy6,ComposerAdvanced3539,Eventually they will profit. But until then… your a bad friend 😂😂😂😂😂,2,1744336392.0,2025-04-11 01:53:12
1jv5fy6,[deleted],🐕,1,1744209083.0,2025-04-09 14:31:23
1jv5fy6,Fearless_Agent_1985,🐕- to mars,3,1744210728.0,2025-04-09 14:58:48
1jv5fy6,Cannonblast420,"If they weren’t willing to buy more now that it’s lower, then they didn’t have good enough conviction to be invested in it at all 🤷🏼‍♂️",1,1744496492.0,2025-04-12 22:21:32
1jv5fy6,shawn-r,The only way you make money here is if you bought it at .003 otherwise you’re wasting your time,0,1744234967.0,2025-04-09 21:42:47
1jv5fy6,joejoeontheradio22,I bought at .000001,1,1744422969.0,2025-04-12 01:56:09
1jvfth9,I-Respect-You,"Awsome concept! Go green and use a display QR code for point of sale use? That way you don't have to mess with paper and screen can just be a polorized film on a reflective surface! Maybe you can make point of sale transactions lightning fast with minimal cost and a more secure ""handshake"".",4,1744230957.0,2025-04-09 20:35:57
1jvfth9,Fun_Raise_7858,👍,1,1744235205.0,2025-04-09 21:46:45
1jvao5n,C300w204,"Well kind of following the Bitcoin way  ETP is like ETF for europeans, they can buy “coins” without having to care about self custody or get worried about exchanges.   For USA people could invest IRA into these ETF taxfree so not sure if there is some kind of similiar things for EU",6,1744218134.0,2025-04-09 17:02:14
1jvao5n,Fun_Raise_7858,It's happening,5,1744230219.0,2025-04-09 20:23:39
1jvao5n,WilyWascallyWizard,ITS HAPPENING PEOPLE LETS GOOOOOOOO,3,1744231621.0,2025-04-09 20:47:01
1jvao5n,Fun_Raise_7858,I can't hear you,5,1744234868.0,2025-04-09 21:41:08
1jv1w51,Stony_1987,"Dad, where is my treat? Lol.",2,1744192556.0,2025-04-09 09:55:56
1jv1w51,Sancadebem,Gosh I love them  I raised a few akitas myself,2,1744192722.0,2025-04-09 09:58:42
1jv1w51,Superr_Steve,Hi to my two doge,2,1744195554.0,2025-04-09 10:45:54
1jv1w51,Fearless_Agent_1985,Ask them when's the next bull run?,2,1744203664.0,2025-04-09 13:01:04
1jv1w51,snorlaxtubbs,Hiiii,1,1744203789.0,2025-04-09 13:03:09
1jv1w51,God-Emperor-Pepe,They’re so big! Are they Shibs?,1,1744230149.0,2025-04-09 20:22:29
1jv1w51,ValeVegIta,akita,2,1744231278.0,2025-04-09 20:41:18
1jv1w51,OwnProgrammer2166,Nice porn couch ![gif](emote|free_emotes_pack|grin),0,1744209755.0,2025-04-09 14:42:35
1jvhy3p,Specialist_Meal_7891,Explain the math,1,1744239975.0,2025-04-09 23:06:15
1jvhy3p,I-Respect-You,"Gladly... get someone with competence in the alternative energy field present. (Other than myself) This way, I can submit the sciencey stuff for the moon.",1,1744241171.0,2025-04-09 23:26:11
1jvhy3p,tomcarbon,Do Only Good Everyday,1,1744245104.0,2025-04-10 00:31:44
1jvlptw,Ambitious-Apple1125,![gif](giphy|RhGEiScVGJWXEFgzEt),2,1744268851.0,2025-04-10 07:07:31
1jvlptw,DOME2DOME,Yes,1,1744289832.0,2025-04-10 12:57:12
1jvlptw,ItsJustAnotherVoice,"If you know this kind of knowledge, it be wasted on doge and might as well buy the lottery ticket lmao",1,1744296972.0,2025-04-10 14:56:12
1jvlptw,illestrated16,Nice,1,1744304804.0,2025-04-10 17:06:44
1jvlptw,Treeman1979,Are you two years old?,1,1744309217.0,2025-04-10 18:20:17
1jvlptw,Consistent_Bluejay_6,Nah,1,1744479982.0,2025-04-12 17:46:22
1jvlptw,Southern-Young-2389,"No, if paper hands will be around",1,1744254927.0,2025-04-10 03:15:27
1jut9ub,nightfly82,Take me back,20,1744159924.0,2025-04-09 00:52:04
1jut9ub,SithC,"Don’t stop believing, you just might see it.",12,1744161163.0,2025-04-09 01:12:43
1jut9ub,SuchDogeHodler,I bought 1k at .007.  Just after that point.....  Then I bought a house.,18,1744164676.0,2025-04-09 02:11:16
1jut9ub,ngronnie,That’s when I bought. If I only knew where it would go I would have bought 10k worth,12,1744163129.0,2025-04-09 01:45:29
1jut9ub,Neukted,Makes a man's heart heavier than a ton of feathers thats for sure,8,1744159995.0,2025-04-09 00:53:15
1jut9ub,C300w204,This is proof that you should hold.,19,1744159860.0,2025-04-09 00:51:00
1jut9ub,ThatOzGirl,"Robinhood chat was a glorious, lawless place - RIP",5,1744181701.0,2025-04-09 06:55:01
1jut9ub,[deleted],My first buy was at $0.0049. Haven't worked in 4 years thanks to it.,10,1744160409.0,2025-04-09 01:00:09
1jut9ub,No-Surround-9303,"Great job, I hope to say the same thing, hopefully sooner than later, and live happily 😊",2,1744223082.0,2025-04-09 18:24:42
1jut9ub,[deleted],I was just incredibly lucky! I was starting to get into crypto and I saw the market cap of Doge was nothing at the time and I saw the potential Elon Musk would bring to Doge as he got more popular. I dumped my life savings into it months before it began pumping.,4,1744230071.0,2025-04-09 20:21:11
1jut9ub,Truthfullyseeker,That hits like nostalgia on a cold December.  Good times in deed.,4,1744164075.0,2025-04-09 02:01:15
1jut9ub,Raynman90,Take me back... good times.,3,1744165146.0,2025-04-09 02:19:06
1jut9ub,Happiness-Meter-Full,"I purchased 110,000 doge at .0045 in 2020, wish I woulda held longer. If only =(",3,1744166649.0,2025-04-09 02:44:09
1jut9ub,Villainslover,I never seen reddit get as poetic as some of these comments over old crypto prices lol it’s kinda nice,2,1744195538.0,2025-04-09 10:45:38
1jut9ub,Ok_Letterhead_6365,2020** was another opportunity to get in this low,2,1744219303.0,2025-04-09 17:21:43
1jut9ub,DragonSinOWrath47,"Oh, this is perfect for posterity on my inheritance owed to me.",1,1744161715.0,2025-04-09 01:21:55
1jut9ub,Man_Muck,Hodl,1,1744189291.0,2025-04-09 09:01:31
1jut9ub,Open_Bluebird_6902,Yes and in 2025 is sinking like a rock in a lake,2,1744195696.0,2025-04-09 10:48:16
1jut9ub,[deleted],"I was ignorant to doges potential at this price and never bought, won’t happen again. now I’ll never sell, bright future",1,1744213508.0,2025-04-09 15:45:08
1jut9ub,ziksy9,... And DOGE was already up 150% from my initial purchase price....,1,1744249502.0,2025-04-10 01:45:02
1jut9ub,NEUROSMOSIS,Got in 2020 with an average of .004. 400k coins. Felt like too much so I sold 300k of them. Huge mistake but still great trade,1,1744294928.0,2025-04-10 14:22:08
1jut9ub,11justin,Jumped in at 0.008. No lambo but I sure did get nice TRD Off-Road 4Runner.,1,1744301677.0,2025-04-10 16:14:37
1jut9ub,Level-Sense9371,"I once opened a rap song with the line ""The year was 2018""",1,1744327563.0,2025-04-10 23:26:03
1juzjfz,lalvapalooza,Buy til I die,5,1744202377.0,2025-04-09 12:39:37
1juzjfz,mrtcarson,Launch Time....,3,1744218490.0,2025-04-09 17:08:10
1juzjfz,jgarcya,Word...  Holding since .003... I'm not selling em.. until $15.,4,1744203653.0,2025-04-09 13:00:53
1juzjfz,Whoisyourfactor,I mentioned this on the other post. Global economy is literally on fire and doge and rest of the crypto is still holding. I guess 60% drop we experienced months back priced that in.,2,1744213289.0,2025-04-09 15:41:29
1juzjfz,neo9113,I was up nearly 50k.   I'm now down 22k.  Did I sell?  Nope.   Not millyair yet.,2,1744272923.0,2025-04-10 08:15:23
1juzjfz,RunItupBaby,Stay Strong Brohan,1,1744230065.0,2025-04-09 20:21:05
1juzjfz,Fifty_pips,just booked my green lambo for delivery in 2057😤,1,1744344520.0,2025-04-11 04:08:40
1juzjfz,Gohan335i7,![gif](giphy|9FQ89bO3TipLASwmRs|downsized)  🚀📈🧘📈🚀 Hodl…,1,1744184472.0,2025-04-09 07:41:12
1juzjfz,GJustGotaBag,I’ll let the numbers speak for themselves… Hopefully you have picked up knowledge from these &amp; continue thinking for YOURSELF! I never have let false agendas scare me away. Take it all away if I’m wrong &amp; good luck.,-8,1744182638.0,2025-04-09 07:10:38
1juzjfz,Gloomy_Setting5936,We will be fine my doge.   It’s not over till the fat lady sings!,1,1744193815.0,2025-04-09 10:16:55
1juu3wg,ngronnie,![gif](giphy|GjrPXo3gpibgQ),5,1744163205.0,2025-04-09 01:46:45
1juu3wg,natasevres,"Realist.  The USD will take a deep dive.  As the value of the dollar go down, the closer doge will be to value 1 dollar.",4,1744166029.0,2025-04-09 02:33:49
1juu3wg,Less-Cartographer851,That’s actually the first sensible answer I’ve seen in this whole subreddit.,1,1744374860.0,2025-04-11 12:34:20
1juu3wg,natasevres,The problem is that most here Will not realize that it does not mean value growth.  But the fact it Will happen could trigger a fomo that could alleviate doge,1,1744375101.0,2025-04-11 12:38:21
1juu3wg,Next-Communication18,Sometimes you get so far down it’s not worth selling. What does that make me?,2,1744162346.0,2025-04-09 01:32:26
1juu3wg,Barbarianmoss,Optipessimistic,5,1744162771.0,2025-04-09 01:39:31
1juu3wg,Next-Communication18,"Lol… I see the word tipsy, burrrrrp",2,1744163047.0,2025-04-09 01:44:07
1juu3wg,SuchDogeHodler,"To the moon, baby!",2,1744168209.0,2025-04-09 03:10:09
1juu3wg,Myxologyst666,"Neither, I'd never be caught dead in a Citadel jacket.",1,1744181458.0,2025-04-09 06:50:58
1juyxl7,Quirky-Effective-355,Only time will tell. If anyone is holding 20000 dogecoin and up those holders could be sitting on a fortune,5,1744179663.0,2025-04-09 06:21:03
1juyxl7,Captnblkbeard,"I hope you’re right bro. Crypto is crazy, anything is possible. I remember thinking bitcoin was expensive at $2500.",3,1744208800.0,2025-04-09 14:26:40
1juyxl7,Quirky-Effective-355,I wish I would have bought into bitcoin then.,3,1744210115.0,2025-04-09 14:48:35
1juyxl7,Patient_Artichoke355,It’s always the same old excuses on this thread..and the same old being told that this meme coin will make us lots of money..isn’t anyone else getting sick of this baloney,-1,1744219508.0,2025-04-09 17:25:08
1jujlt3,Maleficent-Ad560,Worst decision 15k? Nah bro unprotected sex with hookers. That's the worst decision. You'll be ok.,231,1744135971.0,2025-04-08 18:12:51
1jujlt3,[deleted],Debatable. Depends how much cocaine was involved in each decision.,64,1744145927.0,2025-04-08 20:58:47
1jujlt3,mister-fancypants-,also depends if you get anything from the hookers,15,1744162888.0,2025-04-09 01:41:28
1jujlt3,CisIowa,The knowledge that you’re supporting a small business owner?,8,1744201411.0,2025-04-09 12:23:31
1jujlt3,Technical_Moose8478,Like…information? Is OP Daredevil?,4,1744182463.0,2025-04-09 07:07:43
1jujlt3,bennyroc190,Tell me more about your encounters with hookers I'm here to hear the pain,25,1744154574.0,2025-04-08 23:22:54
1jujlt3,Dizzy-Shelter-2108,Survived both. ,18,1744157920.0,2025-04-09 00:18:40
1jujlt3,Gloomy_Setting5936,🤣🤣,4,1744141992.0,2025-04-08 19:53:12
1jujlt3,Able_Channel45,🤣🤣🤣,3,1744147401.0,2025-04-08 21:23:21
1jujlt3,Fannersops11,😂,3,1744157802.0,2025-04-09 00:16:42
1jujlt3,Bongwaterfoxhole,At least ya didn't get a prostitute pregnant. That would be expensive lmao,1,1744263223.0,2025-04-10 05:33:43
1jujlt3,Few_Significance_201,at least you had some fun and felt alive... these coins make people anxious and depressed,1,1744415748.0,2025-04-11 23:55:48
1jujlt3,[deleted],"Ya hold, find an acceptable exit and don’t buy crypto again😂",103,1744134258.0,2025-04-08 17:44:18
1jujlt3,Exciting-District424,LOL,7,1744149182.0,2025-04-08 21:53:02
1jujlt3,C300w204,Hold buddy,23,1744134859.0,2025-04-08 17:54:19
1jujlt3,AlwaysMooning,"Just be happy it was only $15k. It won’t be easy but you can grind that back. Out of curiosity, why did you think going all in on a meme coin that had already exploded upwards was a good idea?",35,1744140450.0,2025-04-08 19:27:30
1jujlt3,shawlawoff,I made same Mistake for $25K  And the reason?  Because I’m dumb,6,1744246502.0,2025-04-10 00:55:02
1jujlt3,Strange-Winner-5650,Same question as this guy up here,3,1744174969.0,2025-04-09 05:02:49
1jujlt3,Novel-Bad2984,"Hope is not lost.  I made the same mistake with some other asset. However, I took bold steps of trading small portion during the dip.  You have to accept some loss or HOLD. Holding was unacceptable for me as staring the screen everyday I felt depressed. So during this time trading I made $2256 without losing any of my held asset.  Remember, when fear is high you are not alone. Others will also sell and good chances to buy back your trade. That’s how whales capitalize, accumulate during bear market.",1,1744463979.0,2025-04-12 13:19:39
1jujlt3,MrEklipze,I have a feeling crypto will be immune to tariff announcements soon. Just like doge is immune to Elon’s tweets now. Hopefully doge bottoms out soon. I’m already filling up my bags atm.,17,1744141714.0,2025-04-08 19:48:34
1jujlt3,nightfly82,At this point he’s hated so much that even if he does implement doge coin to Tesla payments or X money that it would have only a little bit of a pump. Shoulda did it sooner,7,1744152031.0,2025-04-08 22:40:31
1jujlt3,DonNelly87,"Chillllll, could be the best decision.   Just close your eyes the next couple days.",25,1744134320.0,2025-04-08 17:45:20
1jujlt3,vishalb777,&gt; Just close your eyes the next couple ~~days~~ months.,23,1744140345.0,2025-04-08 19:25:45
1jujlt3,clink51,just close your eyes,34,1744144674.0,2025-04-08 20:37:54
1jujlt3,shawlawoff,Just close,1,1744246565.0,2025-04-10 00:56:05
1jujlt3,oprahwinfreyspurse,Just,1,1744395103.0,2025-04-11 18:11:43
1jujlt3,friendly-survivor,!NFA,1,1744137968.0,2025-04-08 18:46:08
1jujlt3,Pleasant-Fix-6277,"Hey listen man at one point I had $2.7 million my average cost was $.13 I was up 900,000 in profit and didn’t take anything out cause I’m hoping we go closer to a dollar. Now with the dip I’m only up like $50,000.But for me it’s more of a long-term hold but if I can get out at the end of this year with a few hundred thousand profit I’ll be happy.",27,1744138859.0,2025-04-08 19:00:59
1jujlt3,Blazekyre,Dawg if you see any signs of it going to a dollar hold for dear life,8,1744152400.0,2025-04-08 22:46:40
1jujlt3,Bryansherenow,It is just gonna take time,2,1744160830.0,2025-04-09 01:07:10
1jujlt3,Bryansherenow,Prob gonna come out with a couple mil this year,3,1744160865.0,2025-04-09 01:07:45
1jujlt3,Pleasant-Fix-6277,"Well, in late November early December I was close to $1 million with my portfolio. I actually had 1.3 million so I was up 900,000 profit but I didn’t sell cause I’m hoping that we get closer to a dollar.",3,1744232868.0,2025-04-09 21:07:48
1jujlt3,Bryansherenow,That’s awesome. God bless you man. Stay patient brother,3,1744232934.0,2025-04-09 21:08:54
1jujlt3,Pleasant-Fix-6277,I’m trying man.  Wish I sold at .40 cents and waited to buy back in at these lows.  Rinse and repeat.   But no way could time that market,5,1744238958.0,2025-04-09 22:49:18
1jujlt3,Bryansherenow,"Of course man, me too not with doge but.. just going to wait some time, pick up some capital and start over",1,1744241936.0,2025-04-09 23:38:56
1jujlt3,ConsistentPay4876,Jesus Christ what do you do for a living. I have only put $500 max into this.,1,1744240248.0,2025-04-09 23:10:48
1jujlt3,Pleasant-Fix-6277,Own biz,1,1744241076.0,2025-04-09 23:24:36
1jujlt3,ChingChingLing,Choosing to invest $1.3M in dogecoin over your own business is psychotic.,1,1744326033.0,2025-04-10 23:00:33
1jujlt3,Fail-Major,It's losing money till it isn't! It will go back up. Diamond hands my friend. You have to believe . Stay strong.  This is not financial advice lol,18,1744138888.0,2025-04-08 19:01:28
1jujlt3,Jimmy_Tropes,"I believe that it'll top .37 again, but it's gonna take a while.",10,1744134601.0,2025-04-08 17:50:01
1jujlt3,Goopstains6318,"I agree , im waiting for this botton to get in , last time i got in at .14 and dca down to a .07 avg and then sold at .31  i am looking to repeat this cycle over and over again  and its at .14 now 🫡🫡",3,1744135190.0,2025-04-08 17:59:50
1jujlt3,Jimmy_Tropes,I'm going to try and buy a little every paycheck while things are down. It sucks having money in when the price is down but it's a hell of a time to buy more.,5,1744135325.0,2025-04-08 18:02:05
1jujlt3,Goopstains6318,"Yeahh thats true i was lucky and made a good play for once in my life so i sold when it was up and am now just waiting in the shadows for .08 lol definetly dca if you can, your future self will thank you , good luck out there friend",3,1744135413.0,2025-04-08 18:03:33
1jujlt3,Bitcoin_Chaca,"We are short sighted when trading crypto. I am down $30,000. I bought Dogecoin at $.42 and have no money to DCA. I bought up Dogecoin because of the four year cycle. I expected it to have this parabolic rally by the end of May at the latest. I was picturing Lamborghinis and paying cash for a house blah blah blah. I’m doing the best I can to have the mindset to just buy and hold. I thought about deleting my Robinhood app and not looking at it for a year. A buddy of mine did that with bitcoin. He bought several years ago and literally deleted the app and didn’t look at it for three years and made a lot of money so you will too. You made a smart investment, but you need to be patient, both of us do. You will recoup your money and more. I feel your pain, chin up and HODL",5,1744152253.0,2025-04-08 22:44:13
1jujlt3,Gloomy_Setting5936,In May/June I think you’ll make your money back and then some.,2,1744164178.0,2025-04-09 02:02:58
1jujlt3,Dumbazzhoe89,"Uninstall, download, uninstall, download, uninstall, download. That’s how it would play out for me 😭",1,1744263382.0,2025-04-10 05:36:22
1jujlt3,TwistAnxious2494,Just stay patient I was down $10-20K for a year and some change then when DOGE and ETH had a good bull run I walked away with over $30K in profit.,3,1744147088.0,2025-04-08 21:18:08
1jujlt3,BigKarina4u,"You are done.                                                Joking, you'll be fine.",3,1744148492.0,2025-04-08 21:41:32
1jujlt3,eluviis,"That's a $5k loss +/- baed on the current price. That's less that the depreciation and tax on a new car. Don't sweat it. I can't tell you to sell or hold, but I can tell you that you shouldn't be depressed by this one.",4,1744161345.0,2025-04-09 01:15:45
1jujlt3,liquid_at,"Any decision you make without considering all possible outcomes can be a bad decision.  Doge is doing well. There is literally nothing you could have found out researching doge, that would have told you that the price would go down, because it wasn't doge that dropped, but the Fiat-Economy.   The only way you had to know that the market would drop would have required insider information from the current US administration, long before they were even inaugurated.   The reason all prices are down is because of the current US president, the current US president and the current US president. There is no other reason on earth for why the prices are down right now.   The reason has one name, one face and one braincell.",14,1744135151.0,2025-04-08 17:59:11
1jujlt3,KP_Bearz,"Sell a little, buy it back cheaper. Keep doing this to lower your average and you'll get rid of that loss in no time. Just play to volume.",3,1744136878.0,2025-04-08 18:27:58
1jujlt3,Useful_Divide7154,Nobody has the ability to time the market like this. It’s not impossible that we are nearing the bottom at this very moment. Would be a shame to sell now and buy back higher!   DCA down is a far better strategy.,4,1744178781.0,2025-04-09 06:06:21
1jujlt3,KP_Bearz,"Worked for me, netted more coins and lowered my average without putting in an extra dime.   I bet it hits .12 again at least once this year.",1,1744249442.0,2025-04-10 01:44:02
1jujlt3,Lizeht11,"Yes, hold all the way it will be worth it",3,1744139801.0,2025-04-08 19:16:41
