post_id,author,body,score,created_utc,date
1jcrq6v,Solidsnake_86,Just checked my wallet. The answer is No.,8,1742149166.0,2025-03-16 18:19:26
1jcrq6v,Catharsiscult,Shib is showing REMARKABLE resistance and confidence today. Almost the whole crypto market is down with SHIB up. That isn't common.,6,1742151971.0,2025-03-16 19:06:11
1jcrq6v,Mundane-Bluebird-338,"You are kidding, right? 🙄",2,1742169204.0,2025-03-16 23:53:24
1jcrq6v,cinesias,Get ready to buy the dip.,2,1742278028.0,2025-03-18 06:07:08
1jcrq6v,Still-River2259,Trash coin,1,1742186522.0,2025-03-17 04:42:02
1jcrq6v,V0rclaw,It hasn’t moved??? What rally?,1,1742193391.0,2025-03-17 06:36:31
1jcrq6v,Eastern_Dog_8888,I'll take green over a sea of red surrounding shib.,1,1742174735.0,2025-03-17 01:25:35
