post_id,author,body,score,created_utc,date
1jdi77s,rasco_88,The longer your in this - the more true this is.,22,1742237529.0,2025-03-17 18:52:09
1jdi77s,Throw_andthenews,![gif](giphy|LLSlEH04ntrcA),1,1742283688.0,2025-03-18 07:41:28
1jdi77s,Bizzzznuzzz,He said give us answers not questions,2,1742323093.0,2025-03-18 18:38:13
1jdi77s,Odd-Negotiation2779,so did this guy get flushed today or did he dig in deeper?,1,1742509838.0,2025-03-20 22:30:38
1jdi77s,BenXam1n,Wen Moon?,2,1742246259.0,2025-03-17 21:17:39
1jdi77s,ModifiedLeaf,Nah he closed out before the rate decision. He made 9 million,1,1742511370.0,2025-03-20 22:56:10
1jdi77s,Aimin4ya,You should buy more,2,1742246884.0,2025-03-17 21:28:04
1jdi77s,Available-Pace1598,When lambo,3,1742249592.0,2025-03-17 22:13:12
1jdi77s,Invest0rnoob1,Moon soon,1,1742364221.0,2025-03-19 06:03:41
1jdhj2n,RepostSleuthBot,"Looks like a repost. I've seen this image 76 times.  First Seen [Here](https://redd.it/10dj9z5) on 2023-01-16 100.0% match. Last Seen [Here](https://redd.it/1hpqgc1) on 2024-12-30 100.0% match  [View Search On repostsleuth.com](https://www.repostsleuth.com/search?postId=1jdhj2n&sameSub=false&filterOnlyOlder=true&memeFilter=false&filterDeadMatches=false&targetImageMatch=80&targetImageMemeMatch=97)  ---  **Scope:** Reddit | **Target Percent:** 80% | **Max Age:** None | **Searched Images:** 773,367,464 | **Search Time:** 2.34621s",1,1742230799.0,2025-03-17 16:59:59
1jdhj2n,DoggyL,But if everyone holds then no one can use any of the “currency”. Congratulations you have a pile of digital toilet paper.,2,1742517644.0,2025-03-21 00:40:44
1jdhj2n,PointOfTheJoke,If you DCA you can go all the way!,2,1742232051.0,2025-03-17 17:20:51
1jdhj2n,N/A,"But, I'll be dead",1,1742397673.0,2025-03-19 15:21:13
1jdhj2n,AnalogueBoy1992,Keep posting?? Damn... that's 559 weeks,0,1742272595.0,2025-03-18 04:36:35
1jdhj2n,Fast_Quality_2007,Lmaoo,0,1742301041.0,2025-03-18 12:30:41
1jdhj2n,Swapuz_com,"This image perfectly captures the community-driven spirit of Dogecoin enthusiasts. The message is clear: collective support and solidarity are the foundation of this movement. It’s both humorous and inspiring to see the dedication to the goal of hitting the $1 mark, even after 201 weeks. A true testament to the power of holding together!",0,1742498011.0,2025-03-20 19:13:31
1jdhj2n,Fun_Raise_7858,👍,-1,1742242160.0,2025-03-17 20:09:20
1jdhj2n,Solid_Caterpillar340,Inflation,-1,1742243425.0,2025-03-17 20:30:25
1jdh2dv,liquid_at,"Psa: word_word_number names are reddit random default. A new user that didn't even bother to pick a name isn't here to make friends. Their reputation doesn't matter to them. That's how trustworthy they are.  Find someone with 10 years, a custom username and a lot of participation, they do care about their accounts reputation. At least a bit.  Never trust strangers online, but especially not new default accounts that try to hype or gloom you.",5,1742246357.0,2025-03-17 21:19:17
1jdh2dv,Vegetable_Holiday835,How are u sure??,4,1742232478.0,2025-03-17 17:27:58
1jdh2dv,geneva_illusions,"""Alt season"". Do you even know what you're talking about?",1,1742259274.0,2025-03-18 00:54:34
1jdh2dv,AutoModerator,"WARNING. NEW REDDIT ACCOUNT DETECTED. IS THIS PERSON TRYING TO SELL OR BUY DOGECOIN? Are they trying to get you to comment on a T-Shirt? Are they posting fake Twitter images containing links? BE CAREFUL. IT COULD BE A SCAM..  I see you are new here, Welcome to /r/dogecoin. How did you find out about Dogecoin?  Do you have any questions you need answered to help get you started?    Here are some handy links:  [How to buy Dogecoin](https://www.reddit.com/r/dogecoin/comments/msp3e9/how_to_buy_dogecoin/)   [Wallet Help - ELI5](https://redd.it/3b3h5d/)  Please check the information on the sidebar -->>  *I am a bot, and this action was performed automatically. Please [contact the moderators of this subreddit](/message/compose/?to=/r/dogecoin) if you have any questions or concerns.*",0,1742229417.0,2025-03-17 16:36:57
1jdh2dv,DankShibe,"March hasn't been very kind to us though. The big dips have  stopped, at least, but we are going sideways with a downwards direction.",1,1742274443.0,2025-03-18 05:07:23
1jdh2dv,Intrepid_Upstairs243,I want to change my username 😭,1,1742428569.0,2025-03-19 23:56:09
1jdh2dv,PastaVeggies,They are not sure. That is why they made a new account to spread false information.,7,1742235494.0,2025-03-17 18:18:14
1jdh2dv,jgarcya,https://coinmarketcap.com/charts/altcoin-season-index/  This is how.,1,1742249367.0,2025-03-17 22:09:27
1jdh2dv,Corey307,They’re so sure they deleted their own burner account. ,1,1742253378.0,2025-03-17 23:16:18
1jdh2dv,liquid_at,"As would be the expectation given all the influences that affect the price right now. Nothing unexpected, other than the willingness of one president to harm his own country.",1,1742295684.0,2025-03-18 11:01:24
1jdh2dv,liquid_at,4 years. active participation. post and comment karma each above 1000.   not too bad. You put effort into the account that the 2025-defaults haven't put in.,2,1742464106.0,2025-03-20 09:48:26
1jdh2dv,Odd_Stick_3042,Agree.,2,1742238039.0,2025-03-17 19:00:39
1jdh2dv,Intrepid_Upstairs243,😂 thanks I try. Well I didn’t take my account seriously when I created the account but the more I was on the more I liked Reddit. Wish they would input a feature to change usernames. Just put a limit on how often you can.,2,1742484609.0,2025-03-20 15:30:09
1jdh2dv,liquid_at,that would have been a reddit gold feature that people would have actually paid money for... But Reddit doesn't really know how to make money if it doesn't sell out users. They just never came up with it.,2,1742493546.0,2025-03-20 17:59:06
1jdg8yp,IronRongShanks,Much wow good puppers,1,1742228892.0,2025-03-17 16:28:12
1jdegp3,Translations666,My advice is don’t be dumb and throw your money away.,35,1742224427.0,2025-03-17 15:13:47
1jdegp3,sergiogarduno,Good job 👍🏼 😆,6,1742225499.0,2025-03-17 15:31:39
1jdegp3,roger3rd,It would be easier to just start a fire and burn up all your stuff 😜,4,1742237799.0,2025-03-17 18:56:39
1jdegp3,yrmum812,Cooked idea,4,1742238137.0,2025-03-17 19:02:17
1jdegp3,itsmedRu,Nope.,3,1742227664.0,2025-03-17 16:07:44
1jdegp3,trefster,I’ll buy it for 100 Doge,2,1742226355.0,2025-03-17 15:45:55
1jdegp3,Ill_Avocado_3898,2000 Doge final offer?,2,1742228942.0,2025-03-17 16:29:02
1jdegp3,N/A,Sell your shoes too,2,1742229183.0,2025-03-17 16:33:03
1jdegp3,NewbieNooo,Duuuude nah,1,1742225071.0,2025-03-17 15:24:31
1jdegp3,AlbumGuide,How does this work in the UK wrt to taxes? I’m assuming that by “sell” you mean trade and this has some tax advantages assuming you want to be long Dogecoin?,1,1742227061.0,2025-03-17 15:57:41
1jdegp3,Ill-Olive2666,You are a Hero! /s   Dont be an Idiot! Get the income frpm your house and then buy from it dogecoin.,1,1742231093.0,2025-03-17 17:04:53
1jdegp3,markphillips401,"It's back ups, buy mores.",1,1742231766.0,2025-03-17 17:16:06
1jdegp3,Throw1566,Put it in BTC.,1,1742233059.0,2025-03-17 17:37:39
1jdegp3,ADottore8533,"at least sell it  50% FIAT - 25% BTC - 25% DOGE or 50% DOGE / 25% FIAT / 25 BTC I think it would be easier, beneficial for both parties. 🤷🏻‍♂️",1,1742234356.0,2025-03-17 17:59:16
1jdegp3,back2lifeagain,Good luck,1,1742234625.0,2025-03-17 18:03:45
1jdegp3,HospitalNo2216,Im selling my DOGE for a UK property,1,1742236020.0,2025-03-17 18:27:00
1jdegp3,Thump12345,I have a bridge for sale for some Doge!,1,1742240689.0,2025-03-17 19:44:49
1jdegp3,I-Respect-You,"Amazing concept! Maybe an application that is something like a bartering platform for different assets? Something that you could possess, maintain, use different types of currency and assets; an application that will let you post an asset or item for sale and the user can select a list of acceptable currency or barter for something else.   As the sole inspiration,  I grant shared rights for this concept to you.  You have one year to pursue this concept.   Please seek appropriate council should you wish to persue.  This is not any kind of advice or paid service.   If you need any help with vision systems, let me know.",1,1742250668.0,2025-03-17 22:31:08
1jdegp3,mazemadman12346,"may i ask, this isnt your only property is it?",1,1742268263.0,2025-03-18 03:24:23
1jdegp3,GaspSpit,BAD BOT 🤖,1,1742225700.0,2025-03-17 15:35:00
1jdegp3,Kandrade1234,Top is in signal,0,1742225393.0,2025-03-17 15:29:53
1jdegp3,I-Respect-You,"Nice try. Why would they want to be ""dumb"" and throw money away?",1,1742250780.0,2025-03-17 22:33:00
1jdegp3,Individual-Brush-360,"Haha, need a tad more",0,1742226768.0,2025-03-17 15:52:48
1jdegp3,AlbumGuide,Chat seems to think there are no tax advantages for the buyer or seller when trading real estate for crypto in the US or UK.,1,1742227590.0,2025-03-17 16:06:30
1jdegp3,Individual-Brush-360,I would pay CGT if any was applicable. I’d be transferring the deeds to the buyer which would be a sale. This is simply to get more exposure to crypto for me,-2,1742227619.0,2025-03-17 16:06:59
1jdegp3,I-Respect-You,"Should call it ""Market Global"" or something for faster professional acceptance. Or could call it D.O.G.E. Global for VERY WOW.",1,1742251964.0,2025-03-17 22:52:44
1jdegp3,Translations666,Nice try bot.,1,1743202751.0,2025-03-28 22:59:11
1jdegp3,trefster,"Sell it for Bitcoin, OK, but dogecoin? Why not just sell it for fiat and then buy doge? Still not a great idea, in my opinion, but that does seem an easier solution",3,1742226905.0,2025-03-17 15:55:05
1jdegp3,trefster,"Ok, you drive a hard bargain.. 200",2,1742226806.0,2025-03-17 15:53:26
1jdegp3,Lets_Get_Retard,yes there is bro. he doesnt have to pay the transaction fee of buying doge,1,1742239304.0,2025-03-17 19:21:44
1jdegp3,Bvstxs,"People invest to be able to buy a house, you already got one and you wanna double down on Dogecoin?",2,1742228053.0,2025-03-17 16:14:13
1jdegp3,AlbumGuide,"So, is this about the transaction fees? Or is there something I’m missing?",1,1742348725.0,2025-03-19 01:45:25
1jdegp3,I-Respect-You,"I would be inclined to start trading stocks for food. Then there will be no weeps; this archaic and unless concept of stocks could finally evolve to currency!  Retailers:  *""Congratulations, you had 1,000,000 shares with [Retail Cooperation]. We have changed that to [Retail Cooperation] store credit so you can purchase dinner from [Local Farmer] directly.""*  Consumers: *""This will save everyone time and resources now that I can just convert to Dogecoin with D.O.G.E. Global.""*",1,1742253345.0,2025-03-17 23:15:45
1jdegp3,I-Respect-You,Sounds like throwing away money to be lazy with extra work.,1,1742252194.0,2025-03-17 22:56:34
1jdegp3,Individual-Brush-360,Yup,1,1742231000.0,2025-03-17 17:03:20
1jdbwy4,Sudz-White,Relax,9,1742217744.0,2025-03-17 13:22:24
1jdbwy4,God-Emperor-Pepe,Stop whining,9,1742217779.0,2025-03-17 13:22:59
1jdbwy4,Ambitious-Apple1125,![gif](giphy|8ciYJQKumKBRz5yFm2),3,1742216428.0,2025-03-17 13:00:28
1jdbwy4,OnlyRawSauce,"He posted just days ago a comment, that it's about global and regional big retail brands, that's why it's hard to just announce it. He has to wait",2,1742219459.0,2025-03-17 13:50:59
1jdbwy4,N/A,"I'm newish please go gentle plenty of lube and just the tip, who is this bloke and how is he trustworthy with his information?",2,1742223581.0,2025-03-17 14:59:41
1jdbwy4,coreyz1103,What partnership news is the community expecting?,2,1742217098.0,2025-03-17 13:11:38
1jdbwy4,liquid_at,"how long until you understand that your fear is not coming from understanding, but from not understanding?  We are fine with our investment. If you are not, go your own way and find your own thing to be positive about.   Literally not one person on earth is asking themselves what YOU think about their plans and goals. Not one single person. Not even your mom or your own kids...",2,1742237944.0,2025-03-17 18:59:04
1jdbwy4,myironcity,![gif](giphy|11xiu89honfGaQ|downsized),1,1742218406.0,2025-03-17 13:33:26
1jdbwy4,LawDaddy-o,writing on wall much gibberish; people make us so currency,1,1742221352.0,2025-03-17 14:22:32
1jdbwy4,hodlinsteady,"You've got yourself all worked up. You should try not thinking about it, like everyone else.",1,1742228285.0,2025-03-17 16:18:05
1jdbwy4,PastaVeggies,True,1,1742216289.0,2025-03-17 12:58:09
1jdbwy4,ArrivalOk3799,So the goal post moves once again. ,-2,1742219582.0,2025-03-17 13:53:02
1jdbwy4,Psychological_Bake45,The official Dogecoin Twitter account has reposted his stuff numerous times. Trustworthy enough for me 🤷‍♂️ lol,3,1742226481.0,2025-03-17 15:48:01
1jdbwy4,liquid_at,"We are currently in talks with a lot of large corporations that want to further the adoption of doge as a currency, but having to wait for a months for several large companies to get their stuff together and go public with it, is too much to ask for, for the meme-traders that make posts like OP here.",2,1742237993.0,2025-03-17 18:59:53
1jdbwy4,Large_Pen_6412,Dude just found out about Doge today 😂,1,1742217998.0,2025-03-17 13:26:38
1jdbwy4,Armadillo-66,We don’t no,1,1742217139.0,2025-03-17 13:12:19
1jdbwy4,OnlyRawSauce,typical,1,1742246024.0,2025-03-17 21:13:44
1jdbwy4,liquid_at,"There is no goalpost....   You just want to read people talking about their investment as promises, and you think if anything anyone said not happening 100% like they said it would, means that you are right and everyone else is not.  But your personal mental coping mechanisms that you found for yourself to avoid the reality of your own stupidity, does not affect the reality of anyone but you.   If you do not like dogecoin, you do not have to buy it. No one is telling you to invest. You're free to go anywhere you want. No one is promising anything and no one is trying to get anyone to do anything...   Just do whatever the F you want with your own money and stop pretending that it is the responsibility of strangers online to give you predictions for the future.. it is not. Your expectation of this is the problem, not anything anyone else does.  I'd recommend 2 possible approaches for your dilemma:   a) grow up  b) cancel your internet plan and never go online again.",2,1742238187.0,2025-03-17 19:03:07
1jdbwy4,N/A,Thankyou mate I might sign up for twitter just for things like this I guess,2,1742226933.0,2025-03-17 15:55:33
1jdbwy4,liquid_at,"People are so oblivious to their own bad habits and would rather make up stories to rationalize them, than to admit that they have potential to improve.",0,1742246892.0,2025-03-17 21:28:12
1jdbwy4,ArrivalOk3799,How big is your bag? Or are you part of the Doge Foundation LOL,0,1742249269.0,2025-03-17 22:07:49
1jdbwy4,OnlyRawSauce,Boy asked a question and you roast and insult him in a toxic essay as if u feel provoked personally. Do that quite often right?,-2,1742242146.0,2025-03-17 20:09:06
1jdbwy4,liquid_at,"It's a trash site, but sadly still one of the best place to get information fast.   I use it as read-only. Never posted anything, but being able to read it is often useful.",1,1742238256.0,2025-03-17 19:04:16
1jdbwy4,OnlyRawSauce,That's exaclty you describing yourself,0,1742279604.0,2025-03-18 06:33:24
1jdbwy4,liquid_at,"My ""bag"" has never been red.... If yours is, ask yourself why others were better than you.",1,1742295273.0,2025-03-18 10:54:33
1jdbwy4,liquid_at,"No, he didn't. He placed subversive and insulting assumptions into a constructed attack post. If he fooled you, every scammer on the internet will. Sorry for your loss.",1,1742244780.0,2025-03-17 20:53:00
1jdbwy4,N/A,"Will keep that in mind ty, don't want to get roped into social media stuff said the bloke on reddit",0,1742246836.0,2025-03-17 21:27:16
1jdbwy4,liquid_at,"Analyze it with equal precision and make your case then... ""no you"" is for toddlers, not adults.  Use big boy words for big boy ideas...",1,1742295757.0,2025-03-18 11:02:37
1jdbwy4,ArrivalOk3799,Lol. Wake me up never when the partnership news comes out,0,1742336294.0,2025-03-18 22:18:14
1jdbwy4,ArrivalOk3799,"Just be honest with yourself already. Goal post, MOVED ONCE AGAIN",1,1742249320.0,2025-03-17 22:08:40
1jdbwy4,liquid_at,"Reddit is topic based, twatter, fake book, gangster gram and the likes are people based.  People = society => social....  But I do understand that a lot of people coming from the kids section of the internet. Do have a hard time trying to cope with the world not being Disney World.",2,1742247146.0,2025-03-17 21:32:26
1jdbwy4,OnlyRawSauce,Keep insulting mr. toxic :-),0,1742297694.0,2025-03-18 11:34:54
1jdbwy4,liquid_at,"Must be a sad life, being negatively obsessing over things you have nothing to do with. Very sad.",1,1742337065.0,2025-03-18 22:31:05
1jdbwy4,DankShibe,As did the ETF applications.,2,1742274743.0,2025-03-18 05:12:23
1jdbwy4,liquid_at,You're insulting yourself by pretending childish behavior is your version of being an adult. Grow up kid.,1,1742297801.0,2025-03-18 11:36:41
1jdbwy4,ArrivalOk3799,ETFs always had an October deadline though. ,1,1742294285.0,2025-03-18 10:38:05
1jdbitw,AutoModerator,"WARNING. NEW REDDIT ACCOUNT DETECTED. IS THIS PERSON TRYING TO SELL OR BUY DOGECOIN? Are they trying to get you to comment on a T-Shirt? Are they posting fake Twitter images containing links? BE CAREFUL. IT COULD BE A SCAM..  I see you are new here, Welcome to /r/dogecoin. How did you find out about Dogecoin?  Do you have any questions you need answered to help get you started?    Here are some handy links:  [How to buy Dogecoin](https://www.reddit.com/r/dogecoin/comments/msp3e9/how_to_buy_dogecoin/)   [Wallet Help - ELI5](https://redd.it/3b3h5d/)  Please check the information on the sidebar -->>  *I am a bot, and this action was performed automatically. Please [contact the moderators of this subreddit](/message/compose/?to=/r/dogecoin) if you have any questions or concerns.*",2,1742214755.0,2025-03-17 12:32:35
1jdbe12,Ambitious-Apple1125,Doge gonna have the rocket ship from Mr.D,3,1742214944.0,2025-03-17 12:35:44
1jdalyp,aurrousarc,I see you found my algorythem.,5,1742212223.0,2025-03-17 11:50:23
1jdalyp,McDerbsalotty,"Finally, an accurate post of predictions!",4,1742240604.0,2025-03-17 19:43:24
1jdalyp,Jets237,![gif](giphy|Q40zmeFedhkbhISnwj|downsized),3,1742212666.0,2025-03-17 11:57:46
1jdalyp,MieXuL,This is how i made millions off just $1 in doge. Theyre supposed to mail me the cash. All the haters will remember me when im buying cybertrucks like you buy ice cream.,2,1742225183.0,2025-03-17 15:26:23
1jdalyp,N/A,"I see it. So, its going to go down before it goes up.",2,1742238761.0,2025-03-17 19:12:41
1jdalyp,mmi777,So 1 doge = 1 doge? Think your prediction is spot on! 💚🐶🚀,2,1742221343.0,2025-03-17 14:22:23
1jdalyp,Ambitious-Apple1125,![gif](giphy|l4pTky87QVuvbzwnS),1,1742211854.0,2025-03-17 11:44:14
1jdalyp,Odd_Stick_3042,"Think about it.. how would you trick people, like a casino does? You’d start by convincing everyone that the price is about to skyrocket. If they all believe it, they’ll buy in. And that’s your perfect chance to do the opposite, sell while they’re still buying.",1,1742213614.0,2025-03-17 12:13:34
1jdalyp,fab-zed,I see it. No really guys!!,1,1742214712.0,2025-03-17 12:31:52
1jdalyp,marksangryreview,Just follow the red line. Pretty sure that's the right one,1,1742224420.0,2025-03-17 15:13:40
1jdalyp,Think-Conference9724,I see the vision,1,1742318023.0,2025-03-18 17:13:43
1jdalyp,Swapuz_com,"""The image humorously portrays the chaotic and unpredictable nature of predicting Dogecoin's price. The tangled lines and colorful mess of the chart serve as a funny exaggeration of how complicated market analysis can be. It's a great visual metaphor for the wild ride that is cryptocurrency trading!",1,1742498698.0,2025-03-20 19:24:58
1jdalyp,WilyWascallyWizard,Your algorythem will never trump my compooter divinationism.,2,1742213374.0,2025-03-17 12:09:34
1jdalyp,Distinct-Manner8331,"they say once you buy a cyber truck it has 0 resale value for some reason, buy a telsa instead",1,1742520532.0,2025-03-21 01:28:52
1jdalyp,The_Arcade2,1 doge= 1 Doge,1,1742264029.0,2025-03-18 02:13:49
1jdalyp,aurrousarc,It happens evey day.. just ask cramer.. he created liquidity while the big boys leave..,3,1742214533.0,2025-03-17 12:28:53
1jdalyp,Odd_Stick_3042,Good for him👍,1,1742215889.0,2025-03-17 12:51:29
1jd6uh7,Jumpy_Hold6249,This is the purpose of crypto. We will all find inner peace.,5,1742199285.0,2025-03-17 08:14:45
1jd6uh7,BullshitSwap,Inner piss,4,1742204416.0,2025-03-17 09:40:16
1jd6uh7,snorlaxtubbs,Legend!!,3,1742211924.0,2025-03-17 11:45:24
1jd6uh7,Cat_in_a_Gundam,You're not wrong.,2,1742212424.0,2025-03-17 11:53:44
1jd6uh7,The_Letter_Aitch,Its like watching a new series on HBO,2,1742203838.0,2025-03-17 09:30:38
1jd6uh7,not_into_that,YES! HAHA! YES!!!!,1,1742214307.0,2025-03-17 12:25:07
1jd6uh7,EggIll2175,![gif](giphy|Tdyx4uduOnM3tvRc1e),1,1742226565.0,2025-03-17 15:49:25
1jd6uh7,Ashamed-Upstairs-737,No,1,1742243027.0,2025-03-17 20:23:47
1jd6uh7,bbatardo,Pretty sure that is just called death.,1,1742250418.0,2025-03-17 22:26:58
1jd6uh7,Vivid-Plum-3995,"So we're knowingly agreeing to our own demonetization and individual bankruptcy? New investor here, and this didnt give me hope",1,1742253471.0,2025-03-17 23:17:51
1jd6uh7,gSrikar,Inner Peace,1,1742313797.0,2025-03-18 16:03:17
1jd6uh7,Microdips,![gif](giphy|QMHoU66sBXqqLqYvGO),1,1742358002.0,2025-03-19 04:20:02
1jd6uh7,Physical_Invite5925,"NOT REALLY !!!!!!!!!!! Seriously, Chris Upchurch",1,1742412211.0,2025-03-19 19:23:31
1jd6uh7,GainsByVitto,nah ong 😭😭,1,1742519956.0,2025-03-21 01:19:16
1jd6uh7,Anraksha,And then you realized that you borrowed those coin to the bank and sold them for 0 and it got to 1$,0,1742203975.0,2025-03-17 09:32:55
1jd6uh7,No-Surround-9303,"✨️⚘️💟Yes, I attain inner peace 🕊🙏🧿",0,1742224552.0,2025-03-17 15:15:52
1jd6uh7,Relative-Way-876,"You will find you need a dark sense of humor to survive crypto investing.  It is a high risk and volatile investment, so if you can't laugh at your own misery, you will have a bit of a rough time of it.",4,1742305329.0,2025-03-18 13:42:09
1jd6uh7,Vivid-Plum-3995,There's beauty in that. Thanks mate,2,1742420914.0,2025-03-19 21:48:34
1jd0sje,I-Respect-You,"Mandatory gyroscopic sphere cap suspension; true all terrain.   Linear Actuation Speed Variable = Tangent Point  Volume Displacement Variable = Helix Height   #*""LMKah WAY; ALL DAY!""*",0,1742175848.0,2025-03-17 01:44:08
1jcyujm,Great-Sport2885,"Some of these negative responses on here are purely to divide, cause arguments, discourage and cause people to sell. It's either a team of people or a team of bots, brand new accounts out of nowhere saying they hold all the doge and are gonna sell because they cooked or something. Lol. Honestly I'm with you about alot of this, but just try your best to be that light and be that change you wanna see both in this sub and this world:). And that's What doge is all about, the light in the darlness.",61,1742168865.0,2025-03-16 23:47:45
1jcyujm,Background_Unit4205,"Payeth no heed to the chart artists, and take everything thou doth peruse, with a pinch of salt.   If thou doeth only good everyday, the moon be'eth but the only way",18,1742169066.0,2025-03-16 23:51:06
1jcyujm,SuperNintenerd,I am here cause i like to Do Only Good Daily and because I like trains.,16,1742168813.0,2025-03-16 23:46:53
1jcyujm,C300w204,"Much thoughts, very true  Keep in mind that the group here is large and everyone can post anything  I could say a lot of doges  ![gif](giphy|lMyEespPQdFoWuK4oP|downsized)",14,1742168637.0,2025-03-16 23:43:57
1jcyujm,pbx1123,"We respect and just speculation I think lot of Solana meme coins pushers are roaming this subs and others, creating division, difference and tactics to manipulate to make people jump into all those memes and tokens worthless waiting for retailers to jump in and what they do is dumping and profit",5,1742170302.0,2025-03-17 00:11:42
1jcyujm,Digicracka,"It's a highly volatile trading asset, classified as a collectible. The only community is either people looking for reassurance that there are others who agree with their own position, or people trying to convince everyone to take actions which benefit their own. The only thing useful here is occasional news.",7,1742168799.0,2025-03-16 23:46:39
1jcyujm,rizzo49er,Never let other make you not want to be on here. Doge Do only good everyday.  F anyone who hates in this community.  I just block the punks and move on. Stay and just block the trolls.,5,1742173500.0,2025-03-17 01:05:00
1jcyujm,Medical-Conflict-438,All the spam and - IQ posts make me want to leave lol but this issue you're speaking of is the problem with any large group of people. Any group with thousands of followers seem to spew negativity even if it's only 5% of the followers it's what you see. Put the group on minimum notifications so you only see the top posts.,7,1742168330.0,2025-03-16 23:38:50
1jcyujm,McDerbsalotty,"OP, what you are describing is the state of public discourse in modern day America. This sub is just a sample size of the absurdity. You’re 100% right. If it isn’t a comment tearing down everything, it’s an exercise through posturing for who knows the most. Very little insight is ever revealed. Except for your post.",3,1742169896.0,2025-03-17 00:04:56
