post_id,author,body,score,created_utc,date
1ju7q9y,Coniferous_Needle,🏆,2,1744118189.0,2025-04-08 13:16:29
1ju7q9y,Xxxjtvxxx,His plan to hand over his,3,1744097982.0,2025-04-08 07:39:42
1ju7q9y,xDragonetti,It was at this moment he knew,3,1744100072.0,2025-04-08 08:14:32
1ju55zd,_This_Is_Ridiculous,"Ah, the good ol' ""next month will be better"" comment.",3,1744140282.0,2025-04-08 19:24:42
1ju55zd,Ambitious-Apple1125,![gif](giphy|3oz8xLd9DJq2l2VFtu),5,1744096269.0,2025-04-08 07:11:09
1ju55zd,tobitazzz,Say what? Eat your words!!,2,1744118897.0,2025-04-08 13:28:17
1ju55zd,Fulvio55,Oh! You must be that financial genius from the future.  Because not even the people making decisions on interest rates have any clue yet of what they will decide.,1,1744157786.0,2025-04-09 00:16:26
1ju55zd,Ok_Sentence_1332,Down what. .01% or down to 4%. I wouldn’t call it just yet. I think they aren’t gonna move them. I think we will see them drop to 4.15-4.25% in later part of the year. But they already said there’s only gonna be 2 small cuts in 2025,1,1744247169.0,2025-04-10 01:06:09
1ju3bjp,ConversationNo9992,Cutie patutie,3,1744082705.0,2025-04-08 03:25:05
1ju3bjp,snorlaxtubbs,Cutee,3,1744114576.0,2025-04-08 12:16:16
1ju3bjp,clownn99,You the man. 👍🏻,1,1744080592.0,2025-04-08 02:49:52
1ju3bjp,Gohan335i7,![gif](giphy|9FQ89bO3TipLASwmRs|downsized),1,1744179150.0,2025-04-09 06:12:30
1ju2u3l,misfitgarden,RH is where I started too.,3,1744081400.0,2025-04-08 03:03:20
1ju2u3l,nickert0n,and thats why those giveaways are bullish,2,1744289514.0,2025-04-10 12:51:54
1ju2fas,killakat96,🫡🫡,1,1744077804.0,2025-04-08 02:03:24
1ju2fas,p0Nd3R1Ng_hYp0Th3s1s,"must be another dog meme coin, must post shiba inu good boy for doge to pump",1,1744079135.0,2025-04-08 02:25:35
1ju2fas,Open_Bluebird_6902,HODL 🤣🤣😂 until it goes to 0.00005$,1,1744111701.0,2025-04-08 11:28:21
1ju2fas,Objective_Run3248,![gif](giphy|l0ExbnGIX9sMFS7PG),1,1744142008.0,2025-04-08 19:53:28
1ju0ava,69yourMOM,Do you have money in anything else as well?,8,1744074727.0,2025-04-08 01:12:07
1ju0ava,fab-zed,"I will always hold until i can spend it. No sell, only hold.",4,1744113828.0,2025-04-08 12:03:48
1ju0ava,GJustGotaBag,Yessir this is the way. LFG my doge,7,1744071361.0,2025-04-08 00:16:01
1ju0ava,nickert0n,Yup because they fomo back in propelling the price higher on an uptrend.,2,1744289538.0,2025-04-10 12:52:18
1ju0ava,csbagley,I find it amazing that there are several institutions applying for Dogecoin ETF’s but some lowly traders keep spreading FUD and trying to convince newer traders NOT TO invest in a great project like Doge! Doge is considered a currency type coin that is fast in transaction speed and cheap! Several big name companies and sports teams take doge as payment! I guess some traders like to think they can influence others to invest in their project thinking its going to cause it to spike and they can sell for profits but they are fools! Yes let them see when the dust settles that Doge will always be the king meme coin! All they did was miss the boat!,2,1744326050.0,2025-04-10 23:00:50
1ju0ava,RunItupBaby,In Doge We Trust 💎🖐🏻,5,1744074377.0,2025-04-08 01:06:17
1ju0ava,Additional_Cut6158,"I bought it when it was well under a penny and I didn’t invest that much, and I have sold twice, once to get my original investment back, and one other time when it was at 45 cents. Everything I have now in doge is for the long run, can’t convince me to sell again till it’s well past $1",1,1744075983.0,2025-04-08 01:33:03
1ju0ava,ENSAKE,"It is not about believing it is about understanding the fundamentals of the market movement.  As a top 10 coin, from low to high DOGE went up 8-9X this cycle.    People are expecting a 1,000X or whatever from this when it has gained probably enough to consider the cycle being over and going back down for 3-4 years.  This is a top 10 coin that made that massive move, higher market cap coins do not really do that often and is a win for those that bought at 0.05.  Now to get over $1 there needs to be some type of utility which is a pipe dream.   remember this post",2,1744124931.0,2025-04-08 15:08:51
1ju0ava,BitOfAll_NYC,Doge coin is a big scammm,1,1744135453.0,2025-04-08 18:04:13
1ju0ava,NOT_EZ_24_GET_,"Can you be more specific to provide any objective measurements to support the sentence you wrote?  ""loving a great coin/ community""  While I can appreciate the community, what exactly (using SMART metrics) has made this particular coin 'great'?",1,1744302333.0,2025-04-10 16:25:33
1ju0ava,TheWizardSnoot,So funny the normies thought it was a coin for elons stupid D.O.G.E.,1,1744076593.0,2025-04-08 01:43:13
1ju0ava,dracokingz,Doge is lower today.,1,1744171391.0,2025-04-09 04:03:11
1ju0ava,Wide-Direction881,Why? In doge I trust!!,2,1744238401.0,2025-04-09 22:40:01
1ju0ava,N/A,yep ;) just wait,1,1744326944.0,2025-04-10 23:15:44
1ju0ava,One_Method_6305,"Ho l' impressione che per quanto possa essere lunga la tua vita,e spero il più a lungo possibile,non vedrai mai il doge a quel prezzo.",0,1744103078.0,2025-04-08 09:04:38
1ju0ava,csbagley,What makes it a scam?! You made the statement now defend it or hush ur dirty mouth!,1,1744326225.0,2025-04-10 23:03:45
1ju0ava,csbagley,Right along with most everything else right!,2,1744326155.0,2025-04-10 23:02:35
1ju0ava,dracokingz,Crypto should be independent from the stock and global market and yet here we are.,1,1744326222.0,2025-04-10 23:03:42
1ju0ava,csbagley,As its always been! Go figure! Apparently you are new!,1,1744326991.0,2025-04-10 23:16:31
1ju0ava,dracokingz,I dont think you understood. Read my last post again. If its independent from the stock and global markets then explain why the mentioning of tariffs trigger one of the biggest sell off we have seen in past couple of years??,1,1744327151.0,2025-04-10 23:19:11
1ju0ava,csbagley,Because my meaning to my statement is that it has never been independent from global markets! The same thing driving crypto (traders) are the same thing driving global markets (traders) so when bad news comes about then they all panick sell!,1,1744327307.0,2025-04-10 23:21:47
1jtzdwy,GJustGotaBag,But we’ve been splashing… People are finally starting to see the truth.,2,1744071461.0,2025-04-08 00:17:41
1jtzdg0,Deminero30,You can try edge wallet on IOS or Android.,1,1744068596.0,2025-04-07 23:29:56
1jtzdg0,Fulvio55,"Too easy…  Go to coinb.in. Download a copy so you can run it locally offline.  Fire it up, fill in the boxes, sign the transaction, broadcast. Done.  Everything other than loading the UTXOs and broadcasting can and should be done offline.  And by the way, you don’t need actual paper for a wallet. A text file is much more convenient, just store it on removable media and never have it online.  You can find ELI5s and lots of detailed explanations if you do some searching. Start with ‘text wallet’.",1,1744158059.0,2025-04-09 00:20:59
1jtzdg0,Fulvio55,"Never ever use any software on mobile devices. It’s just asking for trouble, as many have found.  Text wallets are the ONLY way.",1,1744158109.0,2025-04-09 00:21:49
1jtwu40,VillagePrestigious18,I’ve averaged from .37 to .25 so you good!!,10,1744062492.0,2025-04-07 21:48:12
1jtwu40,ThePokerRobot,No dawg you good!,5,1744062270.0,2025-04-07 21:44:30
1jtwu40,No_Journalist_9959,"I got myself down to 24 so if you're cooked at 16, what's that make me? Sounds like you're doing good 👍 ",5,1744070916.0,2025-04-08 00:08:36
1jtwu40,Great-Sport2885,Yeah he cooking! Now ya cooking with gas son!,3,1744064905.0,2025-04-07 22:28:25
1jtwu40,Southern-Young-2389,"$0.161 that is close to being geeen, good job. That is great comparing to lot of folks here including myself at $0.31😭",3,1744064941.0,2025-04-07 22:29:01
1jtwu40,Oxygen4Lyfe,congrats on getting all your money back,3,1744065729.0,2025-04-07 22:42:09
1jtwu40,Ambitious-Apple1125,![gif](giphy|l2Sq5Ij6m33GyZEha),2,1744097137.0,2025-04-08 07:25:37
1jtwu40,MrEklipze,"Depends, looks like orange man wants to impose a 50pct tariffs on China, so we are gonna get another shake down soon…",1,1744062342.0,2025-04-07 21:45:42
1jtwu40,HarleyAPE23,![gif](giphy|TNO6mwK8s38vpHjh8Y),1,1744061579.0,2025-04-07 21:32:59
1jtwu40,tobitazzz,Oh yea screwd,1,1744062828.0,2025-04-07 21:53:48
1jtwu40,DOME2DOME,Yes,1,1744065440.0,2025-04-07 22:37:20
1jtwu40,mschf1234,Thanks man I hope so!,2,1744076404.0,2025-04-08 01:40:04
1jtwu40,Gloomy_Setting5936,LOL,1,1744113186.0,2025-04-08 11:53:06
