post_id,author,body,score,created_utc,date
1k8tx3m,Fulvio55,A million doge back in the day is a pretty hefty chunk of a mil now. Especially if they were trading them rather than stashing them away and forgetting about them.,1,1745807000.0,2025-04-28 02:23:20
1k8tx3m,Fulvio55,Yup. Always has been.  They were really anal about proof that you actually had a million coins. Which was really funny when that was like ninety bucks.  I couldn’t be bothered stuffing about with their BS. I was too busy giving away millions.,2,1745852574.0,2025-04-28 15:02:54
1k8t015,Neukted,![gif](giphy|3o751YAk75ka5Grexy),0,1745719605.0,2025-04-27 02:06:45
1k8roey,MrEklipze,"Since the lowest point, we’ve been in a slow uptrend, so probably consolidation right now and next week we go a little higher.",5,1745722557.0,2025-04-27 02:55:57
1k8roey,Stony_1987,Im ready for a 240 % run. Tick tock tick tock,5,1745715442.0,2025-04-27 00:57:22
1k8roey,Odd_Stick_3042,"It’s about time… The price will rise along with inflation. As inflation goes up, so does Dogecoin..  don’t worry, the price will go 📈",2,1745747275.0,2025-04-27 09:47:55
1k8roey,GJustGotaBag,Much higher.. Learn patience & take advantage of Red days.🥱,2,1745770303.0,2025-04-27 16:11:43
1k8roey,GregoryGoose,Of course. This is the way.,3,1745724140.0,2025-04-27 03:22:20
1k8roey,Neukted,"im ill cited for a ,21 run",2,1745716797.0,2025-04-27 01:19:57
1k8roey,makeformai,Ummm I heard that there is a doge party in Dubai this May?,2,1745729303.0,2025-04-27 04:48:23
1k8roey,Merlin1039,I love how the bar gets lower every month. It was .70 4 years ago and people are creaming about .19  Get your investment tips from Bobcat Goldthwait,1,1745728915.0,2025-04-27 04:41:55
1k8roey,SuchDogeHodler,Hope so,1,1745739724.0,2025-04-27 07:42:04
1k8roey,batmanineurope,![gif](giphy|3oz8xZvvOZRmKay4xy),1,1745801193.0,2025-04-28 00:46:33
1k8roey,Southern-Young-2389,Doesn't look like will happen soon,1,1745805202.0,2025-04-28 01:53:22
1k8roey,CaptainKraken9,Y'all asking this crap everyday makes me so bored of Doge coin.  Just sold all of mine.  Let it die.  Let it go to the moon.  I don't give a crap anymore.,1,1745862017.0,2025-04-28 17:40:17
1k8roey,theVeezNeez,The data are trending that way 📈,2,1745715096.0,2025-04-27 00:51:36
1k8roey,Southern-Young-2389,"No, probably drop",-1,1745717241.0,2025-04-27 01:27:21
1k8roey,Technical_Ebb6756,Shut up,-3,1745717626.0,2025-04-27 01:33:46
1k8roey,N/A,Jajaja this was the top is going to crash 💥 hard,-4,1745717938.0,2025-04-27 01:38:58
1k8roey,simpsoneee,Nope,-1,1745761382.0,2025-04-27 13:43:02
1k8roey,Even_Association_467,Wrong. Dogecoin will not continue to raise. There is a sell off coming . If Dogecoin stays above .08 in the next 8 months that would be amazing.,-3,1745761438.0,2025-04-27 13:43:58
1k8roey,Neukted,doge down?,-1,1745719462.0,2025-04-27 02:04:22
1k8roey,Odd_Stick_3042,"I agree, nothing good to expect from dogecoin and crypto overall. What I ment is become rich with crypto it’s an illusion.",-2,1745762232.0,2025-04-27 13:57:12
1k8roey,N/A,Back in november,2,1745720786.0,2025-04-27 02:26:26
1k8roey,Neukted,talking about now,-1,1745732025.0,2025-04-27 05:33:45
1k8qjuj,Interesting-Cow-1652,The people who constantly complain about how many DOGE are minted every block fail to understand that it will take FOUR DECADES for the supply to double  The US and other countries double their money supply much faster than that,11,1745715573.0,2025-04-27 00:59:33
1k8qjuj,Boon_Rebu,"Can you make a version of this chart that goes to the year 42,069?",5,1745717706.0,2025-04-27 01:35:06
1k8qjuj,nickert0n,"Bingo, this right here.   Dogecoin is the most stable money in the world.",2,1745720126.0,2025-04-27 02:15:26
