post_id,author,body,score,created_utc,date
1juifid,Murky-Ad6524,your mom flowers 💐,1,1744263110.0,2025-04-10 05:31:50
1juifid,National_Pop_4078,Lambo huracan STO with low miles,1,1744292664.0,2025-04-10 13:44:24
1juifid,transposonalpha,Hope that it hits $2,1,1744322085.0,2025-04-10 21:54:45
1juifid,Glassjaw888,Sleeping pills... So I can go back to sleep and dream $2 doge.,1,1744325068.0,2025-04-10 22:44:28
1juifid,Dat_Ch3f_Guy,"If I can make it, I think a descent car for my son so he don’t have to worry about messing up mine.",1,1744330647.0,2025-04-11 00:17:27
1juifid,Nike1400,More Doge,1,1744381542.0,2025-04-11 14:25:42
1juifid,Mooniedoge69,Gold,1,1744411775.0,2025-04-11 22:49:35
1juifid,512tony512,I'm waiting for 4 dollars or more before I start selling even a little bit of my doge .,1,1744458542.0,2025-04-12 11:49:02
1juifid,safwaan41,Next US election,1,1744615215.0,2025-04-14 07:20:15
1juifid,DisastrousAd2335,My way out!,1,1744682855.0,2025-04-15 02:07:35
1juifid,Stormyj,"A unicorn.  I know,  unicorns don't exist.  Well,  doge won't hit a dollar either,  so...",1,1744131869.0,2025-04-08 17:04:29
1juifid,Boon_Rebu,"When (not if) Doge hits $1, getting a Shiba Inu and sending a request to Atsuko Sato for the honour of naming them Kabosu, but only if permission granted.",1,1744132950.0,2025-04-08 17:22:30
1juifid,CactusButtons,More doge,1,1744133119.0,2025-04-08 17:25:19
1juifid,Maleficus-Malus,I just want my money back. Don't think this is going north of 30 cents in the next 5 years.,1,1744136622.0,2025-04-08 18:23:42
1juifid,GoodParamedic9921,Go to casino,1,1744132609.0,2025-04-08 17:16:49
1juifid,TupamaroIke,when ![gif](emote|free_emotes_pack|trollface),1,1744132767.0,2025-04-08 17:19:27
1juifid,xBlitzgewitter,The dorst thing im buying when Doge hits $1 ? .... More doge 🐶,1,1744134608.0,2025-04-08 17:50:08
1juifid,Benatar16,Putting it all on green,1,1744134841.0,2025-04-08 17:54:01
1juifid,Available-Talk-7161,"If doge hits 10c, what's the first thing you're selling to buy more doge?",1,1744137023.0,2025-04-08 18:30:23
1juifid,_thatkidd,With $10 ? Maybe a packet of cigarette,1,1744137059.0,2025-04-08 18:30:59
1juifid,No_Coyote_5727,A unicorn!🦄,0,1744133293.0,2025-04-08 17:28:13
1juifid,Large_Spare_5261,Taxes.,0,1744134558.0,2025-04-08 17:49:18
1juifid,Own-Cow-9517,Some precious metals.,0,1744134678.0,2025-04-08 17:51:18
1juifid,Tlaim,Shiba inu,0,1744136179.0,2025-04-08 18:16:19
1juifid,Vengeful_Doge,Bitcoin,0,1744136663.0,2025-04-08 18:24:23
1juifid,SauceyGGs,A six pack,0,1744137314.0,2025-04-08 18:35:14
1juifid,Traditional_Curve444,A life... Since this crypto journey has sucked so much of it from me 😂,0,1744137338.0,2025-04-08 18:35:38
1juifid,Icy_Plan6888,"A pen. Now if it hits $1,000 that’s different.",0,1744137358.0,2025-04-08 18:35:58
1juifid,nightfly82,We’re closer to zero than a dollar,0,1744138717.0,2025-04-08 18:58:37
1juifid,willyfistagash12,It's not.,0,1744139460.0,2025-04-08 19:11:00
1juifid,IndependentTeacher24,Yeah right🤣🤣🤣,0,1744140341.0,2025-04-08 19:25:41
1juifid,fakestuser420,A lottery ticket,0,1744140790.0,2025-04-08 19:33:10
1juifid,Zbinxsy,Try to hold it for a year to let some taxes and sell throw into something else. Rarely do I pull money I put into investments back into my regular accounts to spend on stuff.,0,1744141171.0,2025-04-08 19:39:31
1juifid,StayOk2378,"It ain't hitting $1, you should cash out now and buy yourself some common sense.",0,1744197623.0,2025-04-09 11:20:23
1juifid,fatrabbit99,"Nothing, because it’s not hitting a dollar",-1,1744136321.0,2025-04-08 18:18:41
1juifid,Ticklemykelmo,"Probably a funeral, bc that’s a long, long way away.",-1,1744137106.0,2025-04-08 18:31:46
1juifid,Technical_Ebb6756,"Markets crashed, and this guy is talking about $1",-1,1744137626.0,2025-04-08 18:40:26
1juifid,oghypeshop,A Tesla .,-2,1744134805.0,2025-04-08 17:53:25
1juifid,Wack0Wizard,It will never hit $1,-2,1744136034.0,2025-04-08 18:13:54
1juifid,dmillibeats,"lol doge is never hitting $1, this was its last pump ever. Back to under a penny by years end",-5,1744135038.0,2025-04-08 17:57:18
1juifid,AC_Lerock,this guy gets it,13,1744137644.0,2025-04-08 18:40:44
1juifid,marksangryreview,Lol. I'm trying to be hopeful here ![gif](emote|free_emotes_pack|money_face),2,1744143069.0,2025-04-08 20:11:09
1juifid,markphillips401,Beat me to it.,1,1744160900.0,2025-04-09 01:08:20
1juifid,MMShaggy,Damn son!  How much dodge you holdr?,5,1744137885.0,2025-04-08 18:44:45
1juifid,RadioSalt8589,Oh so you’ll be RICH rich,1,1744241150.0,2025-04-09 23:25:50
1juifid,Kmilly69,That’s a stretch buddy,1,1744137248.0,2025-04-08 18:34:08
1juifid,AlwaysMooning,I’ll get Scrabble and maybe we can get someone else to get Parcheesi. Our board game nights are going to be wild!,4,1744140248.0,2025-04-08 19:24:08
1juifid,ScullingPointers,![gif](giphy|kD5cIPhzpGIoVCKsTO),1,1744143037.0,2025-04-08 20:10:37
1juifid,ScullingPointers,🫡,2,1744143071.0,2025-04-08 20:11:11
1juifid,DoctorVitaliy,Spot on…..,2,1744143480.0,2025-04-08 20:18:00
1juifid,marksangryreview,![gif](emote|free_emotes_pack|give_upvote),0,1744132214.0,2025-04-08 17:10:14
1juifid,MikeX7s,why would you want to buy more student debt? don't you already have enough? 🤔,13,1744138066.0,2025-04-08 18:47:46
1juifid,Odd_Stick_3042,Which one??,1,1744143231.0,2025-04-08 20:13:51
1juifid,Itsmarty23,I know of a few I'd have a good time with lol,1,1744143429.0,2025-04-08 20:17:09
1juifid,Dumbazzhoe89,Foolish! If doge ever hits a dollar I guarantee you it would dump back to .35 cents within 2 months time.,1,1744262461.0,2025-04-10 05:21:01
1juifid,marksangryreview,![gif](emote|free_emotes_pack|cry),0,1744132167.0,2025-04-08 17:09:27
1juifid,AZ_Desert_Pirate,This is the casino,3,1744133304.0,2025-04-08 17:28:24
1juifid,Jokierre,Elon’s already taking your money.  You just don’t get anything in return.,2,1744138670.0,2025-04-08 18:57:50
1juifid,ScullingPointers,Can I join or nah?,1,1744142976.0,2025-04-08 20:09:36
1juifid,Typical_gut,Lmao,1,1744161164.0,2025-04-09 01:12:44
1juifid,Interesting-Cow-1652,lol it’s hard for me to choose. There are so many hot ones available that it’s difficult to pick,1,1744143555.0,2025-04-08 20:19:15
1juifid,floppo7,"no, this is rigged by whales. in the casino you can still count on probabilites and effective regulation.",1,1744135472.0,2025-04-08 18:04:32
1juifid,oghypeshop,A nice car?,0,1744138732.0,2025-04-08 18:58:52
1juifid,Odd_Stick_3042,"You know that’s total BS, right?😂 Everyone’s got their own personal GOATs actresses) But hey, that’s a solid wish! If Doge hits $1 before we hit retirement, now that would be legendary!",1,1744144093.0,2025-04-08 20:28:13
1juifid,AZ_Desert_Pirate,Yet we still buy in on both due to cognitive dissonance.  Hooray flaws,0,1744135518.0,2025-04-08 18:05:18
1juidx3,Ambitious-Apple1125,nice rainbows  ![gif](giphy|x0npYExCGOZeo),2,1744190557.0,2025-04-09 09:22:37
1juidx3,PastaVeggies,This is a BTC graph. Part of alt season is dumping on the BTC dominance chart.,1,1744141009.0,2025-04-08 19:36:49
1juidx3,fatporkchop2712,![gif](giphy|UaeipOHpGoG5BGYnyq),1,1744154776.0,2025-04-08 23:26:16
1juidx3,Goopstains6318,"Im trying to figure out when its will be close to the bottom here , i really would love to get in at the .08 area again",-5,1744135298.0,2025-04-08 18:01:38
1juidx3,Inner-Yams,So me a chart of bitcoin next to dogecoin to support this theory. Ill wait bro.,1,1744155397.0,2025-04-08 23:36:37
1juido2,1olaMas,![gif](giphy|8tPJmYXqYGCek),5,1744132143.0,2025-04-08 17:09:03
1juido2,RoundLikeSpheal,At this point $1.22 is the moon 😂,9,1744131341.0,2025-04-08 16:55:41
1juido2,nightfly82,We can’t even get off the ground lol,7,1744131921.0,2025-04-08 17:05:21
1juido2,ParksDontBsuspicious,.122,6,1744131586.0,2025-04-08 16:59:46
1juido2,rddrgn84,![gif](giphy|OhLrbM4CqP8dr7DpIo),2,1744133622.0,2025-04-08 17:33:42
1juido2,Difficult_Fig_1582,.122?,2,1744133483.0,2025-04-08 17:31:23
1juido2,mrtcarson,It will be used on the Moon before it gets there on the Earth...but dreams are good for you.,1,1744162620.0,2025-04-09 01:37:00
1juido2,AdFormal3014,Typo….thr decimal should be before the 1 not after.,1,1744133358.0,2025-04-08 17:29:18
1juido2,Mean_Fault_4988,Decimal in the wrong spot.,-1,1744131992.0,2025-04-08 17:06:32
1juido2,slykethephoxenix,![gif](giphy|dwEcrACvIwsJN36ONr),3,1744132717.0,2025-04-08 17:18:37
1juido2,Standard_Departure14,Funny story he was our flight attendant on a mia/nyc flight lol,2,1744138491.0,2025-04-08 18:54:51
1juido2,Fun_Raise_7858,🤣,1,1744131453.0,2025-04-08 16:57:33
1juido2,slykethephoxenix,I agree. $12.20 or bust.,2,1744132761.0,2025-04-08 17:19:21
1jui8gu,RoundLikeSpheal,Just put the fries in the bag bruh...,19,1744131299.0,2025-04-08 16:54:59
1jui8gu,whatsupeveryone34,Well this is the dumbest thing I have seen all day.,14,1744131745.0,2025-04-08 17:02:25
1jui8gu,natasevres,"Yeah, just a stock crash comparative to 1929 and people freak out ”for no reason”.  I mean coffee prices just went up by 50% just the last three days. Big deal right?  The US have self inflicted a interest rate of minimum of 10%, thanks to the tarriffs. But i mean - who cares?",14,1744131434.0,2025-04-08 16:57:14
1jui8gu,Jarcoreto,This is exactly the kind of thinking that leaves you holding a bunch of bags.,7,1744133891.0,2025-04-08 17:38:11
1jui8gu,friendly-survivor,somebody lost some money...👀🤭,3,1744140767.0,2025-04-08 19:32:47
1jui8gu,Zealousideal_Bet5745,Zip up Trumps pants when you’re done bud.,3,1744143622.0,2025-04-08 20:20:22
1jui8gu,naanless,Just looking for a delicious patch of grass leave my sleeple alone 😔,2,1744137568.0,2025-04-08 18:39:28
1jui8gu,BrokeLikeRamen,Reptile posting,2,1744138445.0,2025-04-08 18:54:05
1jui8gu,Fulvio55,"No, putting an orange imbecile in charge for a second go at destroying the world shows it.  And this time he may have found a better way than a big red button.",1,1744157373.0,2025-04-09 00:09:33
1jui8gu,Neukted,So much hate on this post lol 😆,1,1744159852.0,2025-04-09 00:50:52
1jui8gu,liquid_at,"roughly 99.9% of trades in the market are done by corporations that use borrowed money to trade with algorithms.   If you think that the prices are made by normal people who buy and sell, you got fooled by advertisement.   It is billion dollar corporations. Not you or me.",1,1744195221.0,2025-04-09 10:40:21
1jui8gu,Neukted,so much hate on this earth :) no wonder they still use FIAT,-1,1744133367.0,2025-04-08 17:29:27
1jui8gu,Neukted,gladly. society couldnt use my b.s. in physicis anyways because of myopic people like you <3 thanks for the cold and lonely world. dont worry ill be the man.,-15,1744133326.0,2025-04-08 17:28:46
1jui8gu,Neukted,because your eyes are closed,-4,1744133265.0,2025-04-08 17:27:45
1jui8gu,Neukted,ur sarcasm is no good here,-7,1744133241.0,2025-04-08 17:27:21
1jui8gu,Neukted,Or the kind of thinking that made me a dogecoin investor who is doing better than average 🤔,1,1744138560.0,2025-04-08 18:56:00
1jui8gu,Neukted,I'm basically living for free so 🤷,1,1744141709.0,2025-04-08 19:48:29
1jui8gu,Neukted,The goats watch you with indifrent cantor from the rocks above    ÷),1,1744137848.0,2025-04-08 18:44:08
1jui8gu,Neukted,![gif](giphy|YxfllYGDqLRyE|downsized),1,1744138616.0,2025-04-08 18:56:56
1jui8gu,RoundLikeSpheal,"Just put em there next time, no need for the yap fest",10,1744134737.0,2025-04-08 17:52:17
1jui8gu,Wide-Direction881,Please bring back the small salt packets,2,1744143466.0,2025-04-08 20:17:46
1jui8gu,natasevres,Oh im sorry? Reality is too real for your childish dreams?,9,1744133780.0,2025-04-08 17:36:20
1jui8gu,dende5416,"This is the kind of talk you expect from a sheep who follows a snake oil salesman's word. No taste of the real world, no understanding for how the world works, no understanding why policies like this fail.",1,1744144099.0,2025-04-08 20:28:19
1jui8gu,Neukted,Oh yeah I forgot im to good for you 👍,-6,1744137943.0,2025-04-08 18:45:43
1jui8gu,Neukted,You don't even know me and you have so much hate for me. This is what I mean.,0,1744159919.0,2025-04-09 00:51:59
1juh873,Neukted,accumulating,3,1744130821.0,2025-04-08 16:47:01
1juh873,Fun_Raise_7858,Did you eat my bone 😁,2,1744152648.0,2025-04-08 22:50:48
1juh873,fatporkchop2712,![gif](giphy|g01FakEbcUua6yM34a),2,1744154679.0,2025-04-08 23:24:39
1juh873,your-dad-ethan,I need this for my phones Lock Screen.,2,1744162036.0,2025-04-09 01:27:16
1juh873,liquid_at,"If you set out to build a tower of a specific height, whether you build it on ocean level or on top of a mountain does not change the task.  Doge and other alts performing well in spring is true, independent of the global Fiat economy being up, down or stable.  Just that a tower built on a mountain will always be higher than one built on the ground.  Not the fault of the builder when plate tectonics change the environment.  Doge is doing fine. The US is dying.",3,1744132088.0,2025-04-08 17:08:08
1juh873,SnooMaps8028,![gif](giphy|wvWJOoYmFnSp2|downsized),1,1744184601.0,2025-04-09 07:43:21
1juh873,Boon_Rebu,![gif](giphy|HCTfYH2Xk5yw),6,1744135921.0,2025-04-08 18:12:01
1juh873,mmi777,Woef 🐶💚,2,1744211729.0,2025-04-09 15:15:29
1juh873,mmi777,You used to be a person. You sound like an oracle now. Would it be possible to give me a cupcake recipy next?,2,1744143144.0,2025-04-08 20:12:24
1juh873,liquid_at,"Since the pandemic the average IQ around the world has dropped around 30%. Maybe that's why everyone who is capable of writing complete sentences reminds you of AI that was trained on pre-pandemic data.   I recognize AI beause of its stupidity, not because it writes more complex sentences than me...",2,1744185692.0,2025-04-09 08:01:32
1juh873,mmi777,"Oracle or AI? Still in doubt, it's you have been around long enough in this sub to deserve my trust. Thx 4 the attention Shibe. Keep up the #DoOnlyGoodEveryday 💯",1,1744211517.0,2025-04-09 15:11:57
1juh6mf,Chompbox,Life is becoming Grand Theft Auto 5,2,1744128524.0,2025-04-08 16:08:44
1juecnu,DonNelly87,Lol 112 votes,26,1744122073.0,2025-04-08 14:21:13
1juecnu,killakat96,I definitely am! .143 avg and ready to moon 🌙,3,1744141801.0,2025-04-08 19:50:01
1juecnu,LawDaddy-o,112 voters mean very data and much reliable,3,1744123963.0,2025-04-08 14:52:43
1juecnu,MrEklipze,"Coinmarketcap has a 1.2M poll with 86% saying bullish, it is gonna go up, it’s just a matter of time, it will go up slowly.",3,1744128945.0,2025-04-08 16:15:45
1juecnu,workaholic007,Lol delete this.,2,1744122578.0,2025-04-08 14:29:38
1juecnu,nightfly82,We need real world catalyst and adoption.  No more just tweets and memes Overall we didn’t touch 50 cents this previous run. If 2025 continues to be a bull market than I hope we can get above 50 cents From there I dunno,1,1744121939.0,2025-04-08 14:18:59
1juecnu,supplier-Benza,Wild to see 112 votes on a 2.6 million subreddit,1,1744126343.0,2025-04-08 15:32:23
1juecnu,dadudoge,![gif](giphy|2fQFtTmhCjhsoY21Y1),1,1744132256.0,2025-04-08 17:10:56
1juecnu,alex12biz,"Half of the investors waits X2 and the other half have ""to the moon"" expectations.",1,1744155786.0,2025-04-08 23:43:06
1juecnu,WilyWascallyWizard,I feeling bullish but it will take awhile.,1,1744158173.0,2025-04-09 00:22:53
1juecnu,icebot1190,"Nah, dead run this time around",1,1744161997.0,2025-04-09 01:26:37
1juecnu,ForwardPersonality5,HODL it!,1,1744178839.0,2025-04-09 06:07:19
1juecnu,Ambitious-Apple1125,"all 112 are holders lmao, obviously it will be bullish",1,1744189922.0,2025-04-09 09:12:02
1juecnu,coronaflo,"They have to be. Otherwise, they are admitting to making a huge mistake.",1,1744252013.0,2025-04-10 02:26:53
1juecnu,coronaflo,"They have to be. Otherwise, they are admitting to making a huge mistake.",1,1744252024.0,2025-04-10 02:27:04
1juecnu,coronaflo,"They have to be. Otherwise, they are admitting to making a huge mistake.",1,1744252091.0,2025-04-10 02:28:11
1juecnu,coronaflo,"They have to be. Otherwise, they are admitting to making a huge mistake.",1,1744252096.0,2025-04-10 02:28:16
1juecnu,GJustGotaBag,It’s undervalued… When will people think and learn for themselves?🫠,1,1744254368.0,2025-04-10 03:06:08
1juecnu,Similar-Inevitable42,Take a look on the 5 month chart...- does it look bullish to you ?,1,1744124014.0,2025-04-08 14:53:34
1juecnu,chr127741,"Seems like the only way to win is to randomly chose a coin that’s less then a penny and hope it reaches 1 cent.   One day the markets up, next day it’s down.  It’s like someone is playing with a light switch until the fuse blows..",1,1744122775.0,2025-04-08 14:32:55
1juecnu,Boon_Rebu,"Poll invalid, no 0.069/.69/6.9/4.20/42.0/69/420/420.69 options.",0,1744126739.0,2025-04-08 15:38:59
1juecnu,Low-Hold-8563,What Doge HODL'ers want to happen has no effect on the price.,0,1744129008.0,2025-04-08 16:16:48
1juecnu,toogood01,"Bro, 112 votes in total, and roughly 55 people voted for above 1.2…. 😩🤣😭",-1,1744125390.0,2025-04-08 15:16:30
1juecnu,RGV_Ikpyo,lol..  fishing for more suckers...,-1,1744133436.0,2025-04-08 17:30:36
1juecnu,PastaVeggies,Massive turnout. Much data,11,1744122310.0,2025-04-08 14:25:10
1juecnu,Mr_Hodlerr,It's ongoing so number of voters will increase with time.,4,1744123778.0,2025-04-08 14:49:38
1juecnu,Neukted,you dont even know 100 people lmfao,1,1744131038.0,2025-04-08 16:50:38
1juecnu,Mr_Hodlerr,What price range is predicted by these voters on Coinmarketcap?,1,1744134024.0,2025-04-08 17:40:24
1juecnu,Neukted,get back to work nerd,4,1744131054.0,2025-04-08 16:50:54
1juecnu,Neukted,extremely. lots of room to go up. stop being a doomest. be a boomest,3,1744131023.0,2025-04-08 16:50:23
1juecnu,AlwaysMooning,Or just hodl bitcoin,1,1744159249.0,2025-04-09 00:40:49
1juecnu,Neukted,if i got 100 votes that is actually alot. 99 is the highest number i can think of,3,1744130906.0,2025-04-08 16:48:26
1juecnu,N/A,[deleted],3,1744130260.0,2025-04-08 16:37:40
1juecnu,MrEklipze,"Doesn’t give you that information just gives the option of bearish or bullish. There is an option to guess short term but it’s more of a game poll. My comment refers to the overall sentiment, without involving numbers.",2,1744141391.0,2025-04-08 19:43:11
1juecnu,chr127741,"It’s too late for bitcoin for me  I never had it when it was cheap enough for poor people to buy it. I have to stick with coins under $1 till one of them makes me rich..probably never will but, like an idiot I keep trying.",1,1744159473.0,2025-04-09 00:44:33
1juecnu,Neukted,you must know gods programmer personally. probably doing so well for yourself with that massive brain of yours. its good to see people are optimistic. doge to 1 dollar is inevitable. :),-2,1744130990.0,2025-04-08 16:49:50
1juecnu,iSeitan,A firm +50% over a « maybe » chance to hit a 100x or an absolute 0,1,1744165960.0,2025-04-09 02:32:40
1jucte1,Neukted,feeeling like its going to pump huge,5,1744131151.0,2025-04-08 16:52:31
1jucte1,redhawk1155,"I'm fine, thanks! Dipped below my average last night it looks like but we were back up by the time I could see it",3,1744120169.0,2025-04-08 13:49:29
1jucte1,SnooMaps8028,![gif](giphy|wWmmGqSxHqVU92Bnki),3,1744171722.0,2025-04-09 04:08:42
1jucte1,Cryptotiptoe21,Majestic.,1,1744315055.0,2025-04-10 19:57:35
1jucte1,Neukted,buy the dip <3,3,1744131509.0,2025-04-08 16:58:29
1jucp7a,Low-Hold-8563,Aaaa..yes another expert opinion. They've proven themselves so valuable.,2,1744214391.0,2025-04-09 15:59:51
1jucp7a,Tellamya,"feels like it's always ""next rally"", but hey... maybe this time it’s real",4,1744125101.0,2025-04-08 15:11:41
1jucp7a,chr127741,I hope your right,2,1744123142.0,2025-04-08 14:39:02
1jucp7a,CorrectStaple,"So.... it'll break out because 4,000 people bought the dip?  Wouldn't the price going down further indicate an even greater number of people sold instead?",2,1744145284.0,2025-04-08 20:48:04
1jucp7a,fatporkchop2712,I gotta buy a few more at the discounted price,1,1744154584.0,2025-04-08 23:23:04
1jucp7a,BradleySnooper,🥱🥱🥱,1,1744168396.0,2025-04-09 03:13:16
1jucp7a,SnooMaps8028,![gif](giphy|vMFnRYMFAbA0jP5kkx),1,1744170473.0,2025-04-09 03:47:53
1jucp7a,Fun_Raise_7858,Anal-ist opinion,1,1744235085.0,2025-04-09 21:44:45
1jucp7a,Mr_Ander5on,"Accounts holding 10,000 doge, that’s not very much.",1,1744380792.0,2025-04-11 14:13:12
1jucp7a,Consistent-Set-913,"Doge mints 10,000 coins a minute. So it would make sense that those coins are being dispersed to the people being fleeced of their money. School of hard knocks I guess. Live and learn.",1,1744483950.0,2025-04-12 18:52:30
1jucp7a,Dat_Ch3f_Guy,"Sounds like old news agian, hasn’t been in the 20s for a few. Calling a breakout because 4k people decide to dca isn’t amazing news.",1,1744605221.0,2025-04-14 04:33:41
1jucp7a,Similar-Inevitable42,"Sold at 0,38 - no ragrets, you boiiis keep holding, and buying the dip... Lambo soon haha",1,1744180691.0,2025-04-09 06:38:11
1jucp7a,Open_Bluebird_6902,Ahaha 🤣 yea..sure..🤣🤣the next rally 😂 the one that starts from $ 0.00001 and goes yo $ 0.000002,0,1744156014.0,2025-04-08 23:46:54
1jucp7a,nickert0n,Long time horizon's just feel choppy in the moment. Crypto just chops sideways and then runs crazy for like month or two,2,1744126666.0,2025-04-08 15:37:46
1jucp7a,liquid_at,"every buy is a sell, every sell is a buy.  You cannot buy doge if no one is selling and you cannot sell doge if no one is buying.",2,1744195323.0,2025-04-09 10:42:03
1jucp7a,Oddyseous420,More for me at a discount!,1,1744196490.0,2025-04-09 11:01:30
1jucp7a,Neukted,Yup. Looking at the 5 year chart now. I coulda just been buying every week and be chilling,2,1744137238.0,2025-04-08 18:33:58
1jubv2o,Constantly-baked,Nothing to do with community; this is bitcoins actions nothing more.,7,1744114100.0,2025-04-08 12:08:20
1jubv2o,Patient_Artichoke355,So I get confused by these nonstop posts..is this just a platform for some community engagement..or an actual investment opportunity.. I scroll through Reddit and see many posts of folks losing money..posts that to me seem like they are just pumping up the value of the coin.. and some just promoting being part of a community..which at times it seems like any profit is consequential and is secondary to making money …???????,3,1744115918.0,2025-04-08 12:38:38
1jubv2o,N/A,Zoom out that 4 hour chart.,2,1744261224.0,2025-04-10 05:00:24
1jubv2o,natasevres,Even a dead cat bounces when it falls,0,1744147654.0,2025-04-08 21:27:34
1jubv2o,Alexrs_Media,"Goes up for 4 hours, goes down for 8.",0,1744139025.0,2025-04-08 19:03:45
1jubv2o,PantsMicGee,Learn to understand bearish divergence. ,0,1744151898.0,2025-04-08 22:38:18
1jubv2o,liquid_at,Nothing to do with bitcoin; this is fiats actions nothing more.,2,1744195366.0,2025-04-09 10:42:46
1jubv2o,Stony_1987,Even in the current conditions Doge fam shows resilience. #Doge🦾,0,1744116236.0,2025-04-08 12:43:56
1jubv2o,liquid_at,"doge usually goes down 99% of the time.   But in the 1% of time it does not go down, it makes moves upwards that not only undo the drops, but elevate doge to a higher level it has never seen before.   10+ years of trading history are pretty clear about that...",2,1744195426.0,2025-04-09 10:43:46
1jubv2o,Patient_Artichoke355,Ok..but I’m not sure it answers my question..was trying to understand what dogecoin actually is..so I refer back to my original question.. I really won’t have an opinion on whatever the answer is.. I was just curious,1,1744116634.0,2025-04-08 12:50:34
1jubv2o,FinalHeaven88,"It's a joke investment that historically can actually make you a lot of money. It's also trying to be a currency, and is making strides at turning the dream into a reality.   But at its core, it's a meme coin in honor of Kabosu. Regardless of how it gets used, Kabosu will live on through Dogecoin and all of the memes about her. May she rest in peace. Much sad. Such legend.   Wow.",6,1744119878.0,2025-04-08 13:44:38
1jubv2o,Stony_1987,I like using it for purchasing items that allow Doge for payment options.,3,1744116999.0,2025-04-08 12:56:39
1ju7q9y,uptokesforall,"plz don't buy in fomo  there's no bottom and no top, the only people who should be holding it are those with discretionary spending they can see go to zero. It's not a lottery ticket you redeem in a week",25,1744103383.0,2025-04-08 09:09:43
1ju7q9y,PhatAszButt,Good talk,19,1744097271.0,2025-04-08 07:27:51
1ju7q9y,HarleyAPE23,![gif](giphy|TIXPly7geOCZ7cstWI|downsized),8,1744102139.0,2025-04-08 08:48:59
1ju7q9y,Healthy-Falcon1737,Nah. it's cheap at .05,5,1744105898.0,2025-04-08 09:51:38
1ju7q9y,Boon_Rebu,"Doge go up, Doge go down, Doge go sideways, good Doge.",2,1744126655.0,2025-04-08 15:37:35
1ju7q9y,Telemetris,Bro if .15 is the lowest it goes i will cry,1,1744102942.0,2025-04-08 09:02:22
1ju7q9y,No-Zombie-9725,It’s too expensive right now,1,1744120908.0,2025-04-08 14:01:48
1ju7q9y,Fulvio55,#What? Can you buy a million doge for $90?  Because you could back when it was cheap.  This is in no way ‘cheap’.,1,1744157687.0,2025-04-09 00:14:47
1ju7q9y,Remarkable_Misty,Or your worst move,2,1744098144.0,2025-04-08 07:42:24
1ju7q9y,Dad_Genes,What don’t we just wait a few weeks until it is worth .01,0,1744109181.0,2025-04-08 10:46:21
1ju7q9y,eStrangeIbanez,😂 needs to drop at .01,0,1744122044.0,2025-04-08 14:20:44
1ju7q9y,Odd_Stick_3042,The best to buy dogecoin was 6 years ago.. now it’s like buy high sell low…,0,1744122269.0,2025-04-08 14:24:29
1ju7q9y,Loveletter2URmom,I read an article saying doge can hit $1 . …… in like 30 years though,0,1744123638.0,2025-04-08 14:47:18
1ju7q9y,redspikedog,"Crypto is solidified, so I agree and I have been repeating this.  The lower it goes, the more people have an opportunity to gather round.",-4,1744098980.0,2025-04-08 07:56:20
1ju7q9y,devonathan,Agreed. My favorite part is when op mentioned,8,1744097731.0,2025-04-08 07:35:31
