post_id,author,body,score,created_utc,date
1jtfhlc,RunItupBaby,197k doge coin here 🎢 It’s been one hell of a ride,5,1744036421.0,2025-04-07 14:33:41
1jtfhlc,Blazekyre,I love this. Fire sale!,2,1744010704.0,2025-04-07 07:25:04
1jtfhlc,tobitazzz,Not be of your business buddy boy,1,1744085989.0,2025-04-08 04:19:49
1jtfhlc,lalvapalooza,At least a baker’s dozen,1,1744088228.0,2025-04-08 04:57:08
1jtfhlc,Intelligent-Bear-762,4.5k,1,1744153876.0,2025-04-08 23:11:16
1jtfhlc,Gloomy_Setting5936,![gif](giphy|3ohhwtftK2lWSFvwUo),2,1744031074.0,2025-04-07 13:04:34
1jtfhlc,DisastrousAntelope24,That’s awesome! I’m only at 21k:(,1,1744059902.0,2025-04-07 21:05:02
1jtfhlc,SirBankz,Really?,5,1744010902.0,2025-04-07 07:28:22
1jtfhlc,RunItupBaby,Keep stacking.,1,1744060345.0,2025-04-07 21:12:25
1jtfgm5,SnooDrawings5837,"Maybe, but probably not",4,1744018753.0,2025-04-07 09:39:13
1jtfgm5,MrEklipze,"It's possible, a bit unlikely but possible. Crypto market just likes to nose dive regardless of the reason.",5,1744021020.0,2025-04-07 10:17:00
1jtfgm5,DankShibe,No. The tarrifs were priced in today. Over 20 cents on April 9th.,4,1744018771.0,2025-04-07 09:39:31
1jtfgm5,SithC,.06,1,1744066556.0,2025-04-07 22:55:56
1jtfgm5,dracokingz,More like .10 very likely,1,1744069405.0,2025-04-07 23:43:25
1jtfgm5,Maleficent-Ad560,"On April 9th I'll be all like, how did you know.",1,1744092739.0,2025-04-08 06:12:19
1jtfgm5,EarthNo1740,Looks like you all were correct…. ☠️,1,1744376163.0,2025-04-11 12:56:03
1jtfgm5,Qaishqai,Lets hope 🙏🏻,1,1744011208.0,2025-04-07 07:33:28
1jtfgm5,Ambitious-Apple1125,![gif](giphy|tcu9i8MMAc800),0,1744018845.0,2025-04-07 09:40:45
1jtfgm5,Gloomy_Setting5936,Exactly my doge,1,1744019875.0,2025-04-07 09:57:55
1jtev81,AlwaysMooning,If you liked it at 47 cents why would you not like it at 13 cents? It’s the same product.,20,1744007890.0,2025-04-07 06:38:10
1jtev81,MrEklipze,"If I buy at 10c, I double at 20c. If I buy at 8, I double at 16 and so on…I rather buy cheaper….",9,1744009390.0,2025-04-07 07:03:10
1jtev81,C300w204,Close your eyes and buy,4,1744024219.0,2025-04-07 11:10:19
1jtev81,DillysRevenge,Buying at .05,7,1744011054.0,2025-04-07 07:30:54
1jtev81,Gohan335i7,![gif](giphy|qjSxTWJxqH4YDuIrOs),9,1744008843.0,2025-04-07 06:54:03
1jtev81,lonelyboy069,I'm from the future and I'm telling you Doge hits $100 🎯,3,1744052957.0,2025-04-07 19:09:17
1jtev81,Gohan335i7,![gif](giphy|qjSxTWJxqH4YDuIrOs)  HODL,3,1744008850.0,2025-04-07 06:54:10
1jtev81,Automatic-Moose7416,"Yeah buying the dips, it’s going to moon once all this is over",2,1744009534.0,2025-04-07 07:05:34
1jtev81,DanielJohnnn,"Yup, also bought more",2,1744012623.0,2025-04-07 07:57:03
1jtev81,lalvapalooza,![gif](giphy|l44Q6HJ7lkiweTQ6k|downsized)  Until payday,2,1744012650.0,2025-04-07 07:57:30
1jtev81,Sensitive-Trouble648,Not doing anything,2,1744014663.0,2025-04-07 08:31:03
1jtev81,Kadiusz,Hoping for best,2,1744018475.0,2025-04-07 09:34:35
1jtev81,McDerbsalotty,"BUY IT, BRO!!!!",2,1744018751.0,2025-04-07 09:39:11
1jtev81,jorgschrauwen,Eating lunch scrolling through reddit,2,1744020530.0,2025-04-07 10:08:50
1jtev81,Ulrich453,Sleeping,2,1744020553.0,2025-04-07 10:09:13
1jtev81,Odd_Stick_3042,Enough dips for me..,2,1744021120.0,2025-04-07 10:18:40
1jtev81,Whoisyourfactor,"With this market reaction, I would expect Doge to be at 3C. We grow stronger every year.",2,1744021670.0,2025-04-07 10:27:50
1jtev81,North-Phrase8983,"Yes, always",2,1744022621.0,2025-04-07 10:43:41
1jtev81,cyborg_elephant,"Some of us are buying, some aren't. But NOBODY here is selling",2,1744046844.0,2025-04-07 17:27:24
1jtev81,DOME2DOME,Yes,2,1744057962.0,2025-04-07 20:32:42
1jtev81,Erick25Cua,I did bru,2,1744074443.0,2025-04-08 01:07:23
1jtev81,Sudz-White,Buying of course,2,1744008537.0,2025-04-07 06:48:57
1jtev81,IcyAstronomer8820,Waiting for it to keep dropping to buy … 😅,4,1744009137.0,2025-04-07 06:58:57
1jtev81,Spirited-Act-2117,Bought more at 1.80 that was not the low,1,1744009020.0,2025-04-07 06:57:00
1jtev81,N/A,"Lol just checked the price, gonna play lil Jon low",1,1744009354.0,2025-04-07 07:02:34
1jtev81,VagueInterlocutor,"I want to make more Doge so I shifted to making a couple per day. That said, I might consider buying a little once my DCA day arrives.  I'll be sure to let everyone know when that is, because the price will immediately fall after I drop in and you can buy after that. You're welcome.",1,1744016203.0,2025-04-07 08:56:43
1jtev81,nightfly82,Praying,1,1744023135.0,2025-04-07 10:52:15
1jtev81,wild_bill_massey,"Everytime I buy it goes down, I am now down $26k. Everyone says ""buy the dip""! Well, I did, and I lost!",1,1744029436.0,2025-04-07 12:37:16
1jtev81,probably_to_far,I'm waiting. I really really want to buy now but feel like the dip is not over yet. I'm looking for.10 . My current average is .08 and I took profits at .48.,1,1744033835.0,2025-04-07 13:50:35
1jtev81,Rshellnizzle,"No, I just got out of a meeting with our builder we had some more design choices to make.",1,1744042458.0,2025-04-07 16:14:18
1jtev81,RuddyDucky97,Being greedy when others are fearful,1,1744080841.0,2025-04-08 02:54:01
1jtev81,Giorgi-k,Buying,1,1744087279.0,2025-04-08 04:41:19
1jtev81,chr127741,I can’t afford to throw anymore money away right now..,1,1744122907.0,2025-04-08 14:35:07
1jtev81,driftstep,Waiting for the dip,1,1744125258.0,2025-04-08 15:14:18
1jtev81,Boon_Rebu,"Hedgies are taking out massive naked-shorts on exchanges creating what appears to be a complete market collapse.  This way, they can scoop everything cheap.  Retail panics, Institutions thrive.  Also, don't put any money into any type of stock/coin/NFT/tulips that you can't afford to lose. Literally all investments, of any kind, are pure gambling.  If you need to eat, do that instead, keep your money.",1,1744010790.0,2025-04-07 07:26:30
1jtev81,Blazekyre,"That’s the end of the dip, I’d hope lower!",0,1744009290.0,2025-04-07 07:01:30
1jtev81,SnooDrawings5837,"Crying, my average is .35 and I kind of don’t know what to do. I would just HODL for another 4 years if I could but need to buy some stuff soon so",0,1744013973.0,2025-04-07 08:19:33
1jtev81,ricardo_sousa11,Way too soon to buy.,0,1744017556.0,2025-04-07 09:19:16
1jtev81,DarePlastic5074,Laughing,0,1744017806.0,2025-04-07 09:23:26
1jtev81,xpatbrit,Hodling Doge and ca$h til this dip bottoms out,0,1744020113.0,2025-04-07 10:01:53
1jtev81,Joztek,"Currently holding 75k coins, waiting for it to drop to .09 to spend 10k if it doesn’t hit that amount then I might buy that much when it’s at .12",0,1744042680.0,2025-04-07 16:18:00
1jtev81,C_Pala,"At .47 is a different product as it's a product that has a value of .47 instead of a value of .13, making it more desirable ",6,1744009215.0,2025-04-07 07:00:15
1jtev81,Idontknowhoiam143,The product is worthless no matter what price you buy it at lol,3,1744036376.0,2025-04-07 14:32:56
1jtev81,Ok_Sentence_1332,Yeah if this stuff drops super super low like 4 cents near market crap like 3 years back. Every paycheck ima throw money at it forsure. Like all “savings” going into it. And the moment it hits 8 cents I’m out. Slowly gonna make that money back. Ima keep a book of my lost and “potential” I should have sold and had and I swear if this stuff drops to 4 cents ima buy so much. 16k would get you 400k doge which is insane.,-2,1744010261.0,2025-04-07 07:17:41
1jtev81,xpatbrit,This is the level I used to get my original .25 buy in level down to .07 if it hits .05 again ill join the 100k club,2,1744020230.0,2025-04-07 10:03:50
1jtev81,driftstep,![gif](giphy|xT9IgnLP6MxXtAvVtK),1,1744125433.0,2025-04-08 15:17:13
1jtev81,AlwaysMooning,lol,0,1744011339.0,2025-04-07 07:35:39
1jtev81,waloshin,Bingo…,1,1744055090.0,2025-04-07 19:44:50
1jtev81,AlwaysMooning,That’s what I was getting at 😆,0,1744056125.0,2025-04-07 20:02:05
1jtev81,SnooDrawings5837,"I know it’s dropping fast but cmon bro, 4 cents??",2,1744014144.0,2025-04-07 08:22:24
1jtev81,MrEklipze,"My prediction is that it’s going to bottom around 10c, if we are actually able to see 10c long enough. 4c would be amazing, but I don’t think it would go that low, don’t quote me on that, but yeah…",2,1744015332.0,2025-04-07 08:42:12
1jtev81,Upstairs_Moment_1043,good to see i wasn’t the only one who bought in for .25. dca’ing as we speak,4,1744025223.0,2025-04-07 11:27:03
1jtev81,Ok_Sentence_1332,I’m talking full on bear market. Not current panic status. That’s why I said If it drops super super low because 4 cents is where it landed last bear market,1,1744113785.0,2025-04-08 12:03:05
1jtev81,SnooDrawings5837,"Same, if you want my hot take I don’t think we are going below 13 cents for the next 6 months, I don’t think we will go to ATH this year, but wouldn’t be surprised if we see 0.50 maybe October/november time",1,1744122184.0,2025-04-08 14:23:04
1jtev81,SnooDrawings5837,"It might drop that low again at some point, but it doesn’t look like that will come until probably next year at least",1,1744114210.0,2025-04-08 12:10:10
1jtephd,Mysterious-Curve5679,I’m tired of winnng mr president,360,1744007898.0,2025-04-07 06:38:18
1jtephd,LostImprovement198,"My average is .32, gotta hold and wait",87,1744007971.0,2025-04-07 06:39:31
1jtephd,thYrd_eYe_prYing,I threw in a bit at .15,13,1744008678.0,2025-04-07 06:51:18
1jtephd,Zealousideal-Past851,Fall fall fall .. then we all get back in and become millionaires  ![gif](giphy|2RGhmKXcl0ViM),8,1744034580.0,2025-04-07 14:03:00
1jtephd,Boon_Rebu,"I mean, it gives you a chance to buy low, you get more coins per $ this way.",16,1744007450.0,2025-04-07 06:30:50
1jtephd,agrevated-twist,The doge will rise again!!!!,6,1744048919.0,2025-04-07 18:01:59
1jtephd,Template_93,"I got some more DOGE 5 hours ago at $0.146, and lowered my average by two cents. Guess I could have waited a little longer, but oh well XD (just means lower average and more coin per dollar down the road if this keeps up).",19,1744008759.0,2025-04-07 06:52:39
1jtephd,Fhantom1221,Just by the dip? It may go back up rapidly or in several years....  Maybe this is a way to burn the stock and drive it up to outrageous numbers in a decade.,17,1744009832.0,2025-04-07 07:10:32
1jtephd,MikeX7s,I see no issues. The price is holding very well  considering the fact the entire global economy is on fire right now,15,1744024076.0,2025-04-07 11:07:56
1jtephd,kill_the_bigotry,Keep buying!,3,1744033304.0,2025-04-07 13:41:44
1jtephd,OgjayR,I think we’re going back into the .06-.10 range. And we still haven’t seen the full impact of the terrifs. Hopefully some negotiations happen and we get some good news.,25,1744009024.0,2025-04-07 06:57:04
1jtephd,AbbreviationsLive475,Cheer up Buck! Great time to lower your cost average. I threw some at it last night. I went from .38 to .24 I just wish I had more capital to buy more dip.,8,1744023070.0,2025-04-07 10:51:10
1jtephd,CranDrescher,I bought at nine cents. I’m not worried.,4,1744035008.0,2025-04-07 14:10:08
1jtephd,Dazzling-Photo-5479,You should love it. Run it 🆙,4,1744067573.0,2025-04-07 23:12:53
1jtephd,cambridgeLiberal,That was the perfect time to buy.,5,1744075533.0,2025-04-08 01:25:33
1jtephd,jackscagnetti,wait till it hits zero and buy  for nothing,5,1744082719.0,2025-04-08 03:25:19
1jtephd,locofspades,![gif](giphy|I3WAJgc0J61Xxkff5o),13,1744031795.0,2025-04-07 13:16:35
1jtephd,Quirky-Effective-355,It’s probably going to be.06,10,1744009835.0,2025-04-07 07:10:35
1jtephd,FuroreLT,It's just on discount,7,1744011766.0,2025-04-07 07:42:46
1jtephd,poundsdpound,It's happening,3,1744020403.0,2025-04-07 10:06:43
1jtephd,GregoryGoose,Chaos is a ladder,3,1744027692.0,2025-04-07 12:08:12
1jtephd,Bazaar_is_here,HAHAHAHAHAHAHAHAHA!!!!!!!!,3,1744031170.0,2025-04-07 13:06:10
1jtephd,TheBestPoopBandit,I love it.  Lowered my average from 29 to 23,3,1744041851.0,2025-04-07 16:04:11
1jtephd,Vi_Loveless,Might be time for me to buy back in lmao,3,1744046785.0,2025-04-07 17:26:25
1jtephd,Nervous-Boat-1863,Ah time to buy again :),3,1744047084.0,2025-04-07 17:31:24
1jtephd,Gabrielparda,"Averaged down to,14",3,1744048657.0,2025-04-07 17:57:37
1jtephd,dougeatspaint,Hahahaha,3,1744051549.0,2025-04-07 18:45:49
1jtephd,WhiteSneaks,You must be new,3,1744054677.0,2025-04-07 19:37:57
1jtephd,pankoman95,It's cause I finally pulled the trigger at .15 and bought in that it's tanking. My bad,3,1744060121.0,2025-04-07 21:08:41
1jtephd,No_Grape7717,Just hold.,3,1744060132.0,2025-04-07 21:08:52
1jtephd,Empress8_,Hang in there!!,3,1744067982.0,2025-04-07 23:19:42
1jtephd,Administrative-Pay43,Pleasseee keep going down. I'm about to finally be able to buy again lol,3,1744080253.0,2025-04-08 02:44:13
1jtephd,Iheartyourmom38,"it become kind habit to me now. everytime I a see a post like this, I buy.",3,1744108009.0,2025-04-08 10:26:49
1jtephd,Lacan66,![gif](giphy|I3WAJgc0J61Xxkff5o),6,1744034502.0,2025-04-07 14:01:42
1jtephd,schaudhery,"""I vOteD fOr tHis""",6,1744023469.0,2025-04-07 10:57:49
1jtephd,Ok-Issue-3661,"Sell stocks, become president, crash stocks, buy stocks, repair stocks",6,1744023569.0,2025-04-07 10:59:29
1jtephd,ngronnie,![gif](giphy|XEo7YJHUeplXa|downsized),4,1744026452.0,2025-04-07 11:47:32
1jtephd,AO_Xolos,"Time to sell !!!   Remember kids, buy high, sell low",3,1744033248.0,2025-04-07 13:40:48
1jtephd,oakster777,Shoulda sold,2,1744020745.0,2025-04-07 10:12:25
1jtephd,SuchDogeHodler,Time to buy!,2,1744025434.0,2025-04-07 11:30:34
1jtephd,tobitazzz,Love it,2,1744034715.0,2025-04-07 14:05:15
1jtephd,RemindsMeThatTragedy,"It's my fault, sorry.  I bought some more.",2,1744035841.0,2025-04-07 14:24:01
1jtephd,SprinklesDangerous57,lol so happy i never bought any when i was planning to a few months ago,2,1744042880.0,2025-04-07 16:21:20
1jtephd,AffectionateLemon980,Liquidity is king everything else is just noise,2,1744044930.0,2025-04-07 16:55:30
1jtephd,Apprehensive_Key7084,I love it. Time to buy,2,1744046060.0,2025-04-07 17:14:20
1jtephd,Sugar_Free_RedBull,Just got $700 more,2,1744056146.0,2025-04-07 20:02:26
1jtephd,KacieCosplay,I do lol,2,1744072305.0,2025-04-08 00:31:45
1jtephd,devil1fish,Hahahaha hope it drops more,2,1744223372.0,2025-04-09 18:29:32
1jtephd,reallywrong08,I understand dips but this anit no dip this a restart lol,3,1744046949.0,2025-04-07 17:29:09
1jtephd,GJustGotaBag,"I love it, I’m hoping it hits .09 so I can splash again.",6,1744007440.0,2025-04-07 06:30:40
1jtephd,Extension-Lie-3272,I was banned for saying somewhere you will see doge coin below 0.01 by end of April. Doge won't disappear but it's going real low.,5,1744007984.0,2025-04-07 06:39:44
1jtephd,FlintKnapped,I want it to go down to .07 so I can buy some more,2,1744036561.0,2025-04-07 14:36:01
1jtephd,Independent_Gap8262,"In comparison to other crypto's, this is actually not that concerning.",2,1744048932.0,2025-04-07 18:02:12
1jtephd,valentinevince54,Buy and hold,2,1744049728.0,2025-04-07 18:15:28
1jtephd,Lets_Get_Retard,stop posting about price drops. we all get robinhood notifications for god’s sake. this is just an upcoming entry.,2,1744050797.0,2025-04-07 18:33:17
1jtephd,5000milesprint,Buy bruh tf,2,1744059713.0,2025-04-07 21:01:53
1jtephd,J34fe,"I’ve said this for awhile now. I’m waiting until the 8 cents range and I’m throwing back in. In 4-5 years, it will be back up to 30-40 cents. 😂",1,1744036011.0,2025-04-07 14:26:51
1jtephd,AC2498,Wym you don’t like this?? This is literally the greatest time to buy thousands in doge and win big next bull run,2,1744034738.0,2025-04-07 14:05:38
1jtephd,TranslatorNo8445,The president said this is necessary. We were sick patients. we just need this medication shoved down our throat. We need to be liberated from our money. I'm just surprised any one is still holding at this point. His goal is to destroy America and remake it how he sees fit are you at all sure any thing will be recognizable when this idiot is done ?,4,1744019095.0,2025-04-07 09:44:55
1jtephd,One_Method_6305,Credo che doge Coin sia finito,1,1744007545.0,2025-04-07 06:32:25
1jtephd,scenemore,lol,1,1744014408.0,2025-04-07 08:26:48
1jtephd,All_Usernames_Tooken,I’ve been winning for 5 years now,1,1744025597.0,2025-04-07 11:33:17
1jtephd,Fun_Neat_8050,Thank God i already lost everything to lose again in this market 😇,1,1744029809.0,2025-04-07 12:43:29
1jtephd,awesumpawesum,panicanaminnicus,1,1744037756.0,2025-04-07 14:55:56
1jtephd,eddiebisi,getting to the sweet spot.,1,1744039171.0,2025-04-07 15:19:31
1jtephd,eddiebisi,getting to the sweet spot.,1,1744042171.0,2025-04-07 16:09:31
1jtephd,BravoTimes,Literally sold 60-70k doge all I had at .16.-.18,1,1744052152.0,2025-04-07 18:55:52
1jtephd,MMShaggy,What a shocker!  I would have never guessed. (can we finally get a sarcasm font!),1,1744056803.0,2025-04-07 20:13:23
1jtephd,Alea_Iacta_Est21,😅,1,1744058199.0,2025-04-07 20:36:39
1jtephd,N/A,That’s crazy my average is .10 imma let it ride for now,1,1744061291.0,2025-04-07 21:28:11
1jtephd,WarriorWoman44,I can't even look at my crypto at the moment,1,1744062506.0,2025-04-07 21:48:26
1jtephd,Endreeemtsu,🤣🤣,1,1744065165.0,2025-04-07 22:32:45
1jtephd,Coach_Billly,Buy the dip!,1,1744076720.0,2025-04-08 01:45:20
1jtephd,Gurgoth,"Swasticoin isn't doing so well now. Yeah, I know Doge isn't about Musk but Musk co-opted it and now they are intertwined.  Good luck.",1,1744077728.0,2025-04-08 02:02:08
1jtephd,MiniDrow,So glad I sold at all time high. Y’all really suck at this making money thing huh?,1,1744078937.0,2025-04-08 02:22:17
1jtephd,Tough_Definition5084,Sellllll,1,1744079178.0,2025-04-08 02:26:18
1jtephd,Drewliveryboy,Bought $1K when it dropped lol. Keep buying boys,1,1744080710.0,2025-04-08 02:51:50
1jtephd,CanWeSchmooze,The old man bamboozled-anyone who voted for them 🤣,1,1744083181.0,2025-04-08 03:33:01
1jtephd,FATKEDLUVSCAKE,I’ve been waiting for this for a long time. I swore if it ever dipped I would buy as much as I can afford. My only regret is I don’t have more cash on hand. Still mining though!,1,1744083549.0,2025-04-08 03:39:09
1jtephd,That-1-guy-in-az,Buy buy buy,1,1744084373.0,2025-04-08 03:52:53
1jtephd,Fhantom1221,Not with that attitude we're not.  If we break the economy hard enough crypto might be feasible for billionaires since it can't be regulated easily. Thus insulating them from the fallout. If they burn the token they may be able to amass great amounts of theoretical money making the first Trillionair.,1,1744084495.0,2025-04-08 03:54:55
1jtephd,That-Interview5890,Yay I’m going to load the boat when it hits $6 again!,1,1744088161.0,2025-04-08 04:56:01
1jtephd,ProfileExtreme1949,That's awesome,1,1744089979.0,2025-04-08 05:26:19
1jtephd,Infinite_Assignment4,All coins are down not just doge,1,1744092669.0,2025-04-08 06:11:09
1jtephd,TerryMckenna,Oh no it's a Fire ------> SALE!,1,1744097833.0,2025-04-08 07:37:13
1jtephd,ProGamer923,"Starting to be a good investing opportunity, buy low sell high idiots.",1,1744098813.0,2025-04-08 07:53:33
1jtephd,NEUROSMOSIS,The sharp drops are when you buy. The sharp spikes are when you sell,1,1744100369.0,2025-04-08 08:19:29
1jtephd,lpkzach92,"Ungrateful, did you even say thank you once?",1,1744108194.0,2025-04-08 10:29:54
1jtephd,Kitchen_Equivalent75,It’s a dump for everyone,1,1744112531.0,2025-04-08 11:42:11
1jtephd,IsolateVL,My average is 0.4 🥲I’m going to hold for years if that’s what it takes but I refuse to take a loss. “To the moon” they said…. 🤦‍♂️,1,1744112664.0,2025-04-08 11:44:24
1jtephd,Vivid_Bake_1482,That’s actually good … it’ll decrease to increase even more,1,1744121428.0,2025-04-08 14:10:28
1jtephd,Ohio-life,We are headed back into an opportunity to buy. Keep in mind this has been cyclical.,1,1744128086.0,2025-04-08 16:01:26
1jtephd,Top_Bed461,Idk this meme coin was still around,1,1744130903.0,2025-04-08 16:48:23
1jtephd,WhereasObjective5219,Lol doge needs to hold,1,1744134828.0,2025-04-08 17:53:48
1jtephd,Responsible-Cash728,Under 1 penny if coming back.,1,1744148368.0,2025-04-08 21:39:28
1jtephd,edouvele,Neither,1,1744153128.0,2025-04-08 22:58:48
1jtephd,Feisty-Committee109,The .10 cents is starting to look more like a reality 😒,1,1744156320.0,2025-04-08 23:52:00
1jtephd,Albertagus,Yall were still holding that?,1,1744169484.0,2025-04-09 03:31:24
1jtephd,Oddyseous420,I see this as an absolute win! Now I can buy so much more doge before it climbs to $4.20.,1,1744173705.0,2025-04-09 04:41:45
1jtephd,AdventurousOil8382,MURICAAAA,1,1744176838.0,2025-04-09 05:33:58
1jtephd,letsgetregarded,Doge is cooked after the ties to musk.,1,1744184859.0,2025-04-09 07:47:39
1jtephd,JackedFactory,Aww you fell for the scam,1,1744205411.0,2025-04-09 13:30:11
1jtephd,SectorMajestic7246,Be patient or lose your position and your money my average is 38cents I'm buying more to get the average down,1,1744212539.0,2025-04-09 15:28:59
1jtephd,Dumbazzhoe89,Shorts do? That is bullish for shorts.  Why not short it? Did ya buy the top to go long?,1,1744218503.0,2025-04-09 17:08:23
1jtephd,Shellilala,It happens   ![gif](giphy|eLvhchyvNNOuLbOtYP),1,1744219124.0,2025-04-09 17:18:44
1jtephd,ejsifheb,I hope this goes to zero.,1,1744220658.0,2025-04-09 17:44:18
1jtephd,scorpionsoulz,Doge only will go up after DT and EM get out of office,1,1744221218.0,2025-04-09 17:53:38
1jtephd,FlerisEcLAnItCHLONOw,![gif](emote|free_emotes_pack|joy),1,1744232601.0,2025-04-09 21:03:21
1jtephd,Consistent-Set-913,"They only mint 10,000 a min. Of course the price will go up forever 🤣🤣🤣",1,1744258947.0,2025-04-10 04:22:27
1jtephd,Commercial_Carrot907,Dogecoin died...,1,1744289672.0,2025-04-10 12:54:32
1jtephd,Ok_Boysenberry_8021,I don’t think there’s a recovery,1,1744292831.0,2025-04-10 13:47:11
1jtephd,Xearlo,Buy the dip.,1,1744311474.0,2025-04-10 18:57:54
1jtephd,not420guilty,I mean to be fair it’s a worthless meme coin so….,1,1744319588.0,2025-04-10 21:13:08
1jtephd,donzere88,It’s funny to watch ppl average down to something that is only going down 😂,1,1744326285.0,2025-04-10 23:04:45
1jtephd,N/A,This is how crypto works. I have friends who were holding doge when it hit $0.70. They didn’t sell. It plummeted to around this amount. They sold once they got back to break even. But then it hit the 40’s and they missed out. And the cycle happens again.,1,1744341700.0,2025-04-11 03:21:40
1jtephd,freakuentlyGreg,Yall bought a meme coin and held it for longer than a year???? Yall so funny lol,1,1744393543.0,2025-04-11 17:45:43
1jtephd,Naive_VisualOne,Buys meme coin is surprised at the lack of longevity?,1,1744415073.0,2025-04-11 23:44:33
1jtephd,CapitalLeague9613,This is hilarious!,1,1744424059.0,2025-04-12 02:14:19
1jtephd,FaithlessnessNo5400,You haven’t lost anything till you sell short. It will come back to life one day and then you’ll get lucky. 🍀,1,1744564735.0,2025-04-13 17:18:55
1jtephd,CaseGroundbreaking71,"I bought at .003, it seems everyone bought it at way higher. That's on you.",1,1744568868.0,2025-04-13 18:27:48
1jtephd,PantheonAlien,IVE BEEN WAITING FOR THIS PROCE POINT!! TIME TO JUMP IN !!,1,1744576142.0,2025-04-13 20:29:02
1jtephd,BarharborMaine,Who does,1,1744583217.0,2025-04-13 22:26:57
1jtephd,N/A,[deleted],1,1744008613.0,2025-04-07 06:50:13
1jtephd,Sturdily5092,It'll be 5¢ before it stops falling,1,1744011178.0,2025-04-07 07:32:58
1jtephd,Fermato,I mean if you were still “invested” in a meme coin by now you deserve all of it. Yeah I’ll see myself out,1,1744044121.0,2025-04-07 16:42:01
1jtephd,happpycammper,lol! Thanks for holding lol,1,1744008776.0,2025-04-07 06:52:56
1jtephd,Low-Hold-8563,I suppose I'll buy another 3 to 8k in Doge and hold for 5 more years.,1,1744027950.0,2025-04-07 12:12:30
1jtephd,k_rocker,Least of our worries.   I’ve got real money making this same pattern.,1,1744035643.0,2025-04-07 14:20:43
1jtephd,angelwolf71885,Why it’s an opportunity to lower your averages,1,1744039026.0,2025-04-07 15:17:06
1jtephd,Jaredp1153,Buy the dip!!,1,1744039571.0,2025-04-07 15:26:11
1jtephd,SnooDonuts1009,"He did in fact say ""your net worth will be like youve never seen before"" didnt he",1,1744043641.0,2025-04-07 16:34:01
1jtephd,SatSumaFire,First time? Lol,1,1744044129.0,2025-04-07 16:42:09
1jtephd,Burnzie_Burnz,It’s fine it happens every year,1,1744045836.0,2025-04-07 17:10:36
1jtephd,LuxuryFedora,Time to buy dogecoin,1,1744046883.0,2025-04-07 17:28:03
1jtephd,No_Ladder6325,It's funny a few months ago when it was around. 40 cents i said don't worry it will be back around .10. .15 cents again everyone said it's not possible.,1,1744047182.0,2025-04-07 17:33:02
1jtephd,SenyorHefe,Time to stock up on coins... After the Cheeto backs down all will spring back,1,1744047190.0,2025-04-07 17:33:10
1jtephd,FnWinner,"Average for me is 2cents, 300,000 coins priced at half a penny, I’m chilling lol.",1,1744051147.0,2025-04-07 18:39:07
1jtephd,Dull-Appointment-521,"I bought in at 9 cents.  So, anything over that is a plus.  And still, I don't need 1 single thing.  Do Only Good Everyday.",1,1744052409.0,2025-04-07 19:00:09
1jtephd,Human_Bus6138,HODL,1,1744053017.0,2025-04-07 19:10:17
1jtephd,Human_Bus6138,HODL,1,1744053023.0,2025-04-07 19:10:23
1jtephd,Zeppelin041,It’s a buying market now. People don’t see the opportunities right in front of them? People can finally afford to buy things again thanks to the rich globalists currently trying to crash the markets and blame the sitting president.,1,1744054380.0,2025-04-07 19:33:00
1jtephd,sybersonic,"If you don't need it right now, then it shouldn't be a problem.",1,1744054668.0,2025-04-07 19:37:48
1jtephd,Ckiniceone,Time to buy lol,1,1744057502.0,2025-04-07 20:25:02
1jtephd,JDeessf,Time to buy more,1,1744058109.0,2025-04-07 20:35:09
1jtephd,ScullingPointers,And here I am getting FOMO cause I missed the sale,1,1744058625.0,2025-04-07 20:43:45
