post_id,author,body,score,created_utc,date
1jdom6b,Richardpfitzer,I'm still +230%! Hell yeah!,13,1742248176.0,2025-03-17 21:49:36
1jdom6b,Kanifya,![gif](giphy|M7gtacN7aPNsc),13,1742250879.0,2025-03-17 22:34:39
1jdom6b,ItsJustAnotherVoice,Wheres the moon on this chart?,4,1742251128.0,2025-03-17 22:38:48
1jdom6b,Mudnuts77,We’re so back!,6,1742251441.0,2025-03-17 22:44:01
1jdom6b,Fast_Quality_2007,Omg its time!,3,1742249045.0,2025-03-17 22:04:05
1jdom6b,Majestic_Trust_3019,Just bought some more. It's only money!,3,1742295665.0,2025-03-18 11:01:05
1jdom6b,BonusCute7697,"I hope so, need to withdraw soon due to losing a medical patient and three weeks on with just respite clients at 6hrs/week and short on funds. 🤦‍♂️",1,1742262683.0,2025-03-18 01:51:23
1jdom6b,kinkycrypto,Yay,1,1742266682.0,2025-03-18 02:58:02
1jdom6b,DreamBiiigly,Lmao get ready for next leg down!,1,1742278632.0,2025-03-18 06:17:12
1jdom6b,Capable-Reach7509,Yay!!,1,1742302126.0,2025-03-18 12:48:46
1jdom6b,Dav1d8923,Are we?,1,1742306378.0,2025-03-18 13:59:38
1jdom6b,wggn,time to sell,1,1742318567.0,2025-03-18 17:22:47
1jdom6b,N/A,buy!!! BUY!!!! bye...,1,1742333199.0,2025-03-18 21:26:39
1jdom6b,razorbladejr,😂,1,1742355998.0,2025-03-19 03:46:38
1jdom6b,CaptainSamps,Best way to keep the momentum up is to keep buying :) always good to have more doge.,1,1742391293.0,2025-03-19 13:34:53
1jdom6b,BelloBellaco,BUY! HODL!,1,1742404416.0,2025-03-19 17:13:36
1jdom6b,ArrivalOk3799,You're all like 21 or something ,1,1742426177.0,2025-03-19 23:16:17
1jdom6b,God-Emperor-Pepe,Nobody holds anymore and it shows lol,0,1742252629.0,2025-03-17 23:03:49
1jdom6b,slykethephoxenix,Zoom out.,0,1742311854.0,2025-03-18 15:30:54
1jdom6b,Fast_Quality_2007,Right on brother!,4,1742249059.0,2025-03-17 22:04:19
1jdom6b,t3chnical3rr0r,Are you a Miner only?,0,1742261756.0,2025-03-18 01:35:56
1jdom6b,GJustGotaBag,Where to even begin on this brilliant comment…🫠,2,1742251795.0,2025-03-17 22:49:55
1jdom6b,GJustGotaBag,"It has been back, people just like to try to scare you.",5,1742251525.0,2025-03-17 22:45:25
1jdom6b,GoodParamedic9921,![gif](giphy|mz7iww9tCUnJJeZvGN|downsized),1,1742299450.0,2025-03-18 12:04:10
1jdom6b,Wpayton3434,lol it’s the miners bro. So much sell pressure from all them asic,1,1742256256.0,2025-03-18 00:04:16
1jdom6b,XCOMGrumble27,It looks worse when I do that.,2,1742319948.0,2025-03-18 17:45:48
1jdom6b,ItsJustAnotherVoice,"Idk, I keep hearing “to the moon” so I figured it would be here also lol",6,1742251949.0,2025-03-17 22:52:29
1jdom6b,Aggravating-Fix-4547,To the left! Value is going up as you move left. Looks like it’s skyrocketing westward! That ends up on the moon still. I think,3,1742269749.0,2025-03-18 03:49:09
1jdom6b,slykethephoxenix,Really? It was 0.0002 when I first started DCA'ing Dogecoin.,1,1742320349.0,2025-03-18 17:52:29
1jdom6b,GJustGotaBag,It is there… You just need a closer look my doge.,2,1742252079.0,2025-03-17 22:54:39
1jdnwvu,Traditional_Let_2023,Kinda shocked you didn't think to look for your coins when it was approaching .70,48,1742246080.0,2025-03-17 21:14:40
1jdnwvu,liquid_at,"So if I understand it right, you paid 100 bucks and someone sent you dogecoin for it, but they never arrived in your wallet, because the transaction was never completed?  Then the seller still has them and you never got any.  You can check the sellers wallet and see what happened there. But my guess would be that the coins were moved out of the wallet, just with a later transaction to a different wallet. Maybe even a history of different transfers to different wallets that also never arrived.",21,1742246085.0,2025-03-17 21:14:45
1jdnwvu,ShibeCEO,"""Sad to say these Coins got lost."" what exactly does that mean?",6,1742248173.0,2025-03-17 21:49:33
1jdnwvu,Fulvio55,"Sorry, but nowhere near enough information for any kind of answer.  Where did the coins come from? Where did they go? Who owned the sending and receiving wallets? Was any software client involved? So many questions…  You should be aware that clients use change wallets to send the excess coins in UTXOs to. And they don’t tell you. That’s why managing them yourself with text wallets is the only way to go.  But as others have said, you’re years late to this party.",2,1742279194.0,2025-03-18 06:26:34
1jdnwvu,guinader,"When you send to wallets or spend i think. The whole of the couns are usually in a different wallet address still under your account..  i would open the wallet and synchronize it.    It should still show under your core wallet.  (If that's how you did it).   You can ""send it, to yourself"" to the wallet you went to see it under"" and that should work.      Unless you are saying that she your 2017  purchase, you see a new transaction showing it under another address.      As i you mentioned unspent i think it's still yours.   Sync that wallet!",2,1742248125.0,2025-03-17 21:48:45
1jdnwvu,DVArmyoff1984,Thou must quest for the Necronomicon!,2,1742299827.0,2025-03-18 12:10:27
1jdnwvu,Nikolopolis,"I can't help if magic was involved, sorry.",1,1742300636.0,2025-03-18 12:23:56
1jdnwvu,Odd-Negotiation2779,this sounds like wow-AI and seems like a wow-idea to try to track these down 8 years later,1,1742305323.0,2025-03-18 13:42:03
1jdnwvu,Izual_Rebirth,Where were you keeping the coins? Online account was local wallet? I know I had issues accessing my coins because I had them in an old wallet and the new wallet client didn’t like my old wallet. I had to get the private key out and was able to import it into a 3rd party wallet. But that was because I still had the wallet. If you don’t have the wallet you may be screwed.,1,1742309464.0,2025-03-18 14:51:04
1jdnwvu,FriendlyBuddy1454,Gone forever,1,1742320698.0,2025-03-18 17:58:18
1jdnwvu,Raynman90,"Might be cooked bro, sorry 😬",1,1742331830.0,2025-03-18 21:03:50
1jdnwvu,DataNo3790,You got got!,1,1742526961.0,2025-03-21 03:16:01
1jdnwvu,Routine-Duck6896,100 for only 44k in 2017 sounds wrong,1,1742270905.0,2025-03-18 04:08:25
1jdnwvu,GJustGotaBag,Crazy how I said this was undervalued & got downvoted by the whole “community”🥱🚮  I don’t take it personally though. I only care about Winning or losing.,-15,1742249268.0,2025-03-17 22:07:48
1jdnwvu,N/A,[removed],-22,1742246721.0,2025-03-17 21:25:21
1jdnwvu,Hairider,"I did check but couldn't figure out why the coins got stuck and how they could be transfered into my wallet. No denial I have been a crypto beginner for all those years, but now I wanna find a solution and retrieve the coins if possible.",14,1742251351.0,2025-03-17 22:42:31
1jdnwvu,Hairider,Many thanks for your recommendations!,2,1742507039.0,2025-03-20 21:43:59
1jdnwvu,agreeable-bushdog,That English isn't his native language...,2,1742302467.0,2025-03-18 12:54:27
1jdnwvu,Hairider,"Thanks for pointing this out. However, by now I was able to check the private keys and I realized they are lost. And so are the coins, no way to retrieve them, have to accept that.",1,1742507243.0,2025-03-20 21:47:23
1jdnwvu,Hairider,"Many thanks, I did sync but with the private keys lost there'll be no wy to retrieve the coins. Have to accept this.",2,1742506968.0,2025-03-20 21:42:48
1jdnwvu,Hairider,"I do assure you I'm a human being, not AI. Sorry if this wow-matter sounds nuts. ![gif](emote|free_emotes_pack|slightly_smiling)",1,1742330234.0,2025-03-18 20:37:14
1jdnwvu,Hairider,"Thanks for pointing this out. However, by now, I understand my coins are gone for good as the private keys are lost also.",1,1742506851.0,2025-03-20 21:40:51
1jdnwvu,Hairider,Please explain what you deem cooked. I'm an amateur looking for support here in a matter I am very unfamiliar with. That's all. Wow.,1,1742421115.0,2025-03-19 21:51:55
1jdnwvu,Hairider,It was 31 December 2017.,1,1742281248.0,2025-03-18 07:00:48
1jdnwvu,Codedheart,You take it personally enough to write an out of context comment about it.  Oh congratulations on correctly guessing the value of a coin would go up! There were so many other ways it could have gone like down or staying the same. Truly insane odds.,6,1742264841.0,2025-03-18 02:27:21
1jdnwvu,Correct-Potential-15,🚨 SCAM ALERT,6,1742253073.0,2025-03-17 23:11:13
1jdnwvu,Traditional_Let_2023,"So, you bought the coins and you never verified that they arrived in your wallet?    That would have been something to track down in 17'",7,1742253609.0,2025-03-17 23:20:09
1jdnwvu,ShibeCEO,"it still gives little information to go on for getting this sorted out.... google translate is a thing though, and it works rather well for cases like this",1,1742303429.0,2025-03-18 13:10:29
1jdnwvu,Fulvio55,Sorry to hear. How did you lose them?,1,1742525161.0,2025-03-21 02:46:01
1jdnwvu,guinader,"If the wallet is still in your computer, you can find the backup key in there. Place it in a new wallet and it will sync.     I'm curious how the old private key was lost... It's just a file in your wallet folder.  Wallet.dat i believe  Get a new core wallet, open once. Close it.  Go to the folder and replace the file with your original wallet.dat and that should now sync as your old wallet with access to everything",1,1742683940.0,2025-03-22 22:52:20
1jdnwvu,lightheadedone,"Doge price on December 31 2017 was .009 so 11,111 coins for $100.",1,1742312709.0,2025-03-18 15:45:09
1jdnwvu,GJustGotaBag,![gif](giphy|9C1nyePnovqlpEYFMD),1,1742411753.0,2025-03-19 19:15:53
1jdnwvu,Hairider,"Hey folks, I do NOT use Google Translator but my own language skills. :-)",3,1742329875.0,2025-03-18 20:31:15
1jdnwvu,Hairider,"Many thanks, mate, for pointing this out. Being an absolute DOGE beginner, I will try and check where I will get.",2,1742729007.0,2025-03-23 11:23:27
1jdnwvu,ShibeCEO,did you solve your problem? any more info you have that can maybe be used to help you further?   good luck either way!,1,1742330562.0,2025-03-18 20:42:42
1jdnwvu,Hairider,"Oh gosh, please look what wallet.dat looks like, it's endless!  Just a tiny tiny excerpt:    É  €   ’ü    \]ßSZŠíX    Éý W   Ž0„                       wallet.dat    F=     lÚg'                     õý 8   d×/¯     Éý    +ú \]ßSZŠíX    Lþ M   ¾ybÅ)   Ê  €                0            Indeed the DOGE wallet address of 2017 does show up, but no trace of a private key in sight!",2,1742729296.0,2025-03-23 11:28:16
1jdnwvu,Hairider,"Many thanks, buddy, still working on it",1,1742420524.0,2025-03-19 21:42:04
1jdnwvu,guinader,"Oh, that's the file.     You can Google. ""Transferring my wallet.dat file to a new wallet.""  That's the file you put in your new wallet folder and sync everything. You got this. Your coins will be accessible soon!    Just of course don't share with anyone the  .dat file.  You don't need to open that file. That's the file the dogecoin wallet reads to extract the private key and sync your wallet",1,1742762598.0,2025-03-23 20:43:18
1jdnwvu,guinader,"Also, when you first open the new wallet with your old. Dat file. It will show 0 coins.... That's because your new wallet is not synchronized yet... As dogecoin started in 2014. So you need to wait for the synchronization to reach the day you made the transaction in 2017 to see your transaction show up on the wallet.",1,1742762988.0,2025-03-23 20:49:48
1jdnwvu,Hairider,"Final insight: The coins are gone for good. A nice buddy here at reddit helped me to understand what had gone wrong 2017 - and it did go wrong, so unfortunately no way to retrieve the coins.",1,1742506732.0,2025-03-20 21:38:52
1jdnwvu,Hairider,"Thanks again, you sound very knowledgeable to me!! I'll try as outlined.",1,1742849868.0,2025-03-24 20:57:48
1jdnwvu,guinader,"I ran into the same problem a few years ago, so i learned haha",1,1742850043.0,2025-03-24 21:00:43
1jdkbb3,liquid_at,Do you understand what the difference between short positions in stocks and crypto are or are you just using stock-memes on crypto?,4,1742237641.0,2025-03-17 18:54:01
1jdkbb3,God-Emperor-Pepe,I’m selling between April and May no matter what.,2,1742238725.0,2025-03-17 19:12:05
1jdkbb3,Ranger523,"Tell me you know nothing about crypto without telling.... oh wait, it's a doge page they definitely know nothing",1,1742240548.0,2025-03-17 19:42:28
1jdkbb3,Southern-Past-5341,Imagine you hold onto something you believe in and it works out beautifully. Do only good everyday.,1,1742253547.0,2025-03-17 23:19:07
1jdkbb3,Grymloq22,Squeeze Deez Nuts!,1,1742259586.0,2025-03-18 00:59:46
1jdkbb3,tobitazzz,Just buy,0,1742237925.0,2025-03-17 18:58:45
1jdkbb3,AutoModerator,"WARNING. NEW REDDIT ACCOUNT DETECTED. IS THIS PERSON TRYING TO SELL OR BUY DOGECOIN? Are they trying to get you to comment on a T-Shirt? Are they posting fake Twitter images containing links? BE CAREFUL. IT COULD BE A SCAM..  I see you are new here, Welcome to /r/dogecoin. How did you find out about Dogecoin?  Do you have any questions you need answered to help get you started?    Here are some handy links:  [How to buy Dogecoin](https://www.reddit.com/r/dogecoin/comments/msp3e9/how_to_buy_dogecoin/)   [Wallet Help - ELI5](https://redd.it/3b3h5d/)  Please check the information on the sidebar -->>  *I am a bot, and this action was performed automatically. Please [contact the moderators of this subreddit](/message/compose/?to=/r/dogecoin) if you have any questions or concerns.*",0,1742237140.0,2025-03-17 18:45:40
1jdkbb3,Mountain_Road9197,These people are clueless and think the entire market is based off 1 dude with 8 mil on 40x short controls it.  These type of people posting this are the exit liquidity in bull runs,5,1742237822.0,2025-03-17 18:57:02
1jdkbb3,liquid_at,I'm not sure if it is dumb people or criminal people aiming to fool dumb people.  Either way... those are dumb posts.,3,1742238296.0,2025-03-17 19:04:56
1jdkbb3,OnlyRawSauce,typical,1,1742246058.0,2025-03-17 21:14:18
1jdkbb3,ok_Fix1532,What happened to you thinking it's hedge funds hiring people?,-5,1742238422.0,2025-03-17 19:07:02
1jdkbb3,liquid_at,"hedge funds are very well regulated. Unlike the thousands of ""family offices"" that only trade with their own money.  And while hedge funds are required to hedge their positions or the banks won't loan them any money anymore, the family offices do not have that problem.   Either way. Stocks have T+2 Settlement and criminal market makers, while Crypto has instant settlement.   You can use options to push short-positions on stocks into the future, you cannot do that with crypto.  But if you have any evidence for anyone having been able to extend their short position through a liquidation event by cheating the system in crypto, I'd be very happy to listen to you how they did it.   Because if there is no bubble, there is no squeeze. Instant settlement prevents bubbles from growing.   I have not found a single way so far, how a trader could prevent getting liquidated on a crypto-short, by using balancing-tricks, like they do in stocks.",1,1742238702.0,2025-03-17 19:11:42
1jdkbb3,ok_Fix1532,Now you get it 🤣,-2,1742238848.0,2025-03-17 19:14:08
1jdkbb3,liquid_at,"You apparently still do not get that ""short squeeze"" as it is known from stocks is NOT POSSIBLE in crypto....  Shorts are thrown out of their position every day. Millions of dollars worth. Just like longs.   For a short squeeze, that cannot happen. These shorts need to pile up debt, that in the end, breaks every short-sellers neck. This CAN NOT HAPPEN IN CRYPTO.   Eli5: YOU ARE WRONG.",-2,1742239226.0,2025-03-17 19:20:26
1jdkbb3,ok_Fix1532,"You know what else is wrong? You're theory of going to the ""moon"". Your alt season shenanigans. When we were at 40 cents you were telling people that it will be impossible to get to 20. Now we are close to 10 and it's becoming a reality for you. That your ""iTs EveRy 4 yEarS"" rule is coming to an end. I guess you learn through experience.",1,1742239396.0,2025-03-17 19:23:16
1jdkbb3,liquid_at,"""to the moon"" is a meme invented by altcoin-hypers of the first generation, that dogecoin made fun of, by ridiculing htem with their stupid phrases.  Those altcoin-hypers then lost big on their scams, turned into bitcoin maxis and told every new investor how they are all for bitcoin and how every other coin is a scam.   If you think ""to the moon"" means that dogecoin holders believe it will go to a million, you did not understand that we are making fun of bad traders with our memes.   But yes... it is stupid. It was stupid in 2013 when doge started to make fun of it and it's still stupid in 2025, where doge is still making fun of it.  If you thought dogecoin holders actually believe that memes are financial advice, whoever lied to you, did not do you a favor...",0,1742239744.0,2025-03-17 19:29:04
1jdkbb3,ok_Fix1532,"I forgot to include this because it seems like you don't get it still.  ELI5: alt season = to the moon. You were preaching that we were going up at 40 cents, at 30 cents, at 20 cents. Doge never went to moon. Alt season never came.",1,1742239929.0,2025-03-17 19:32:09
1jdkbb3,Jsant616,"Why are you so literal? Do you not understand metaphors? To the moon just means that it goes up. We went to the moon back in November. We went to the moon in 2021. No, we don't mean that we are going to the actual moon.  ![gif](giphy|1Pfd5qmaqBvjO)",-1,1742244497.0,2025-03-17 20:48:17
1jdi77s,nobodyknowsoh,Can someone explain this like I’m 5 years old,13,1742245875.0,2025-03-17 21:11:15
1jdi77s,SharkBait1124,It's called propaganda.,61,1742232685.0,2025-03-17 17:31:25
1jdi77s,Mountain_Road9197,"People don’t understand crypto lmao. The trade is 8 million of margin/liquidity. He’s on a 40x which yesterday his trade had 320 mil value  If the price goes up and liquidates him, he loses 8 million. 8 million liquidated wont increase BTC price up up up lmaoo.   His liquidation like 85k, it could barely hit 85k ish to grab liquidity and nuke afterwards.",26,1742235329.0,2025-03-17 18:15:29
1jdi77s,Jintopia,In English please,17,1742232467.0,2025-03-17 17:27:47
1jdi77s,this_guy_zach,I bought 10 dollars of bitcoin. Is he liquidated yet?,9,1742259997.0,2025-03-18 01:06:37
1jdi77s,GrouchyAd9824,I have a suspicion this entity wants the market to run to their liquidation price and they'll enter a bigger short position there.,9,1742233706.0,2025-03-17 17:48:26
1jdi77s,Somsanite7,1 Trillion left for cash out to buy stocks when they are nicely down and then wash it in crypto again when they are up,4,1742235843.0,2025-03-17 18:24:03
1jdi77s,Logical-Fault310,I don’t get all the liquidate him talk. Go with it and use his play. Make money down and up.,7,1742232468.0,2025-03-17 17:27:48
1jdi77s,Icy-Independence5737,Does anyone know the website used for this screen grab?,2,1742240469.0,2025-03-17 19:41:09
1jdi77s,Acrobatic_Airline605,Now im gonna buy even harder  ![gif](giphy|zCpYQh5YVhdI1rVYpE|downsized),2,1742243696.0,2025-03-17 20:34:56
1jdi77s,tomcsvan,"This comment section sum up very well the crypto community. Bunch of kids buying some magical snake oils and hope they go up. Don’t even know what margin and short is. Instead of just googling it, ask it on here lmaoo",2,1742298829.0,2025-03-18 11:53:49
1jdi77s,Lucky_Diver,"I like how you're reading this as a positive. Another way to spin it is that someone with a lot more money and information than yourself has placed a large bet that bitcoin will go down. The game stop thing doesn't happen every day... You're not forcing billionaires into a short squeeze just because you bought $5,000 bitcoin.",2,1742388970.0,2025-03-19 12:56:10
1jdi77s,m9wd,All of this just to liquidate 10m lmao,1,1742242575.0,2025-03-17 20:16:15
1jdi77s,SlushySaucer313,So how much did he lose 😂,1,1742248581.0,2025-03-17 21:56:21
1jdi77s,one_1life,Decent spike if price pushes up and he covers.,1,1742276877.0,2025-03-18 05:47:57
1jdi77s,Commercial-Idea-1536,"""Bitcoin Historian"" tf is that?",1,1742304910.0,2025-03-18 13:35:10
1jdi77s,sfv818,400MM short but 1.2 B long to fool the public lol,1,1742327811.0,2025-03-18 19:56:51
1jdi77s,Kanifya,Not one of you on this platform have any idea what's going on or why. So wild...,-1,1742240509.0,2025-03-17 19:41:49
1jdi77s,NothingWrong1234,So the market has been held hostage by this if so many coins coincide with bitcoin?  What the front door?!,0,1742239430.0,2025-03-17 19:23:50
1jdi77s,New-Ability8483,"Or, maybe he have long position bigger than $400m going to liquadate?   Bait by open this short and think market will push up and liquadate himself?  And he will reach break even for his long position.💆🏻‍♂️",0,1742273929.0,2025-03-18 04:58:49
1jdi77s,Kanifya,"Ok. Let's say collectively people decided rocks where currency, anyone could pick up rocks so how would you denominated any actual value. Well you do that through mass psychosis. You basically lie about everything until nothing seems to matter! Then and only then can you sell water to the fish. Anyone who actually sees a long term value here is attributing value to the continued by in to mass psychosis. Which is a strong bet if you look at the history of monotheism. Everyone loves a good lie that gives them a community of people to support, as long as they are given a target to hate. I expect the down votes to pour in and I'll be reported and banned but that's ok. I just answered the question posed.",-1,1742324733.0,2025-03-18 19:05:33
1jdi77s,Apprehensive_Look770,If anyone wants Solona in a good price then let me know here.,-11,1742233052.0,2025-03-17 17:37:32
1jdi77s,ModifiedLeaf,"Someone thinks Bitcoin is going to drop in price so they opened up a massive short position. The individual is looking to profit from a decline in price. Some brokerages allow traders to short certain instruments. They lend you the shares, you'll sell at the price they were loaned to you and buy them back at a lower price.   Everyone saying they want them to be liquidated is saying they want the price to rise so that the trader loses all their money.",43,1742263792.0,2025-03-18 02:09:52
1jdi77s,tobitazzz,Well explained,2,1742303506.0,2025-03-18 13:11:46
1jdi77s,VagaBond_1776,"FACTS, The sheep bit it everytime",21,1742234418.0,2025-03-17 18:00:18
1jdi77s,tobitazzz,No,-36,1742235758.0,2025-03-17 18:22:38
1jdi77s,Objective-Light-9019,![gif](giphy|eV3B6VcUIrBFm|downsized),3,1742266918.0,2025-03-18 03:01:58
1jdi77s,Loufrancisbacon,Someone recently bought about $30k otm calls expiring 3/21 for mstr on the belief that bitcoin will moon if the Whale is liquidated,1,1742268613.0,2025-03-18 03:30:13
1jdi77s,andorraliechtenstein," 'Tis U.Today, which of late hath told a tale of of a Bitcoin whale, who didst open a short position of three hundred and two and thirty million in Bitcoin, at a price of fourscore thousand and fourscore and forty, thus kindling the fires of interest amongst those that dwell in the crypto markets. And 'tis said, according to Pete Rizzo, he that hath studied Bitcoin's lore of old, that this very whale, now possessed of four hundred million BTC shorts, doth wield 'all available margin,' in order to double down upon his perilous, short position. Verily, a tale of risk and daring for the ages!",61,1742251011.0,2025-03-17 22:36:51
1jdi77s,scottb90,I'm in it for maybe 100 too lol it's gonna be life changing for us,1,1742512913.0,2025-03-20 23:21:53
1jdi77s,ok_Fix1532,He has been increasing his short position every time it gets closer. And he has increased their leverage,5,1742233924.0,2025-03-17 17:52:04
1jdi77s,tobitazzz,Yes exactly,1,1742235850.0,2025-03-17 18:24:10
1jdi77s,tobitazzz,No he trying to get more people to short of so it goes down down,4,1742235621.0,2025-03-17 18:20:21
1jdi77s,JohnRichJ2,x,2,1742266908.0,2025-03-18 03:01:48
1jdi77s,scottb90,Yeah these are like the basics. I just started throwing myself into trading and crypto this year an i already know these things. Its kinda surprising but it is easy to jump on the bandwagon when you see all the crypto news online. I feel like every article is saying everythin is gonna 10x soon but then it never happens lol.,1,1742513565.0,2025-03-20 23:32:45
1jdi77s,tobitazzz,Then teach us ol wise one,2,1742303435.0,2025-03-18 13:10:35
1jdi77s,noitsmoog,in what condition? is it freshly minted or after heavy use? does it have any scratches?,5,1742248546.0,2025-03-17 21:55:46
1jdi77s,Lets_Get_Retard,me,-2,1742239893.0,2025-03-17 19:31:33
1jdi77s,Suspicious-Agent8932,"Like, giving it away? I’m disabled and poor (no kidding) and need some trees cut down and to trade in my i3 that’s on its last legs, give a dog a bone!",-4,1742245754.0,2025-03-17 21:09:14
1jdi77s,nobodyknowsoh,Thank you I appreciate this answer 🙏,1,1742360284.0,2025-03-19 04:58:04
1jdi77s,Tiranous_r,Can we tell by the info the expected price the whale thinks btc will drop to or what price it will have to go up to in order to be liquidated?,1,1742441404.0,2025-03-20 03:30:04
1jdi77s,SharkBait1124,"When everyone is telling you to sell, its probably a good time to buy. When everyone is telling you buy, it's probably a good time to sell.",35,1742236933.0,2025-03-17 18:42:13
1jdi77s,Jintopia,Haha.  Old English 🤣🤣🤣,7,1742256834.0,2025-03-18 00:13:54
1jdi77s,mrkav2,If I had awards I’d give you one,2,1742264728.0,2025-03-18 02:25:28
1jdi77s,GuaranteeOk6268,This is great,1,1742361850.0,2025-03-19 05:24:10
1jdi77s,Logical-Fault310,Ahhhh,1,1742238041.0,2025-03-17 19:00:41
1jdi77s,Jakemcdtw,So wait til absolute rock bottom and then buy?,1,1742268357.0,2025-03-18 03:25:57
1jdi77s,Kanifya,No thanks I ask questions and mods get silly and ban people,0,1742308323.0,2025-03-18 14:32:03
1jdi77s,ModifiedLeaf,"Not necessarily. One can make assumptions based on where liquidity may be resting, ie stop losses. There are stop losses placed below a level that is considered support. If I was going short BTC I'd be looking at November lows at 75k and 66k. From what I understand they whale has been averaging down on the short every time price has pumped.",1,1742448340.0,2025-03-20 05:25:40
