post_id,author,body,score,created_utc,date
1k9d5iw,mrtcarson,$0.69420 just had a typo I think...,40,1745785301.0,2025-04-27 20:21:41
1k9d5iw,mmi777,69 is OK with me,12,1745785891.0,2025-04-27 20:31:31
1k9d5iw,Anxious_Cup_3939,Let's goo,7,1745784640.0,2025-04-27 20:10:40
1k9d5iw,lbvl0mc,If it does. Even at .69cents. I’ll shave my head and donate my curls to a good cause.,7,1745790628.0,2025-04-27 21:50:28
1k9d5iw,SuchDogeHodler,"This is the chant..... 69.420    sex, drugs, and all we need is the rock and roll  To the Moon!",6,1745787399.0,2025-04-27 20:56:39
1k9d5iw,birbs3,So according to the chart we hit 2.50 when we only hit .70 ish,7,1745788712.0,2025-04-27 21:18:32
1k9d5iw,LogicalPsychosis,Is it reasonable? Not sure... Would I will it into existence? Absolutely!,4,1745787770.0,2025-04-27 21:02:50
1k9d5iw,Pleasant-Fix-6277,Boy do I love 69,4,1745794711.0,2025-04-27 22:58:31
1k9d5iw,fatporkchop2712,My baby has been waiting for me for a long time...  ![gif](giphy|bdIWDmBodnc4kkQyhy|downsized),4,1745801462.0,2025-04-28 00:51:02
1k9d5iw,Interesting-Cow-1652,"Sorry to be a party pooper but this “analysis” is complete bull$h1t. $69.420? Really? If Doge were to actually hit that this cycle I’d swallow my own coom  A more realistic analysis would be performing an exponential regression on the price and forming standard deviation bands. That will tell you Doge will probably top out around $4-10 this cycle, which is far more realistic",6,1745787869.0,2025-04-27 21:04:29
1k9d5iw,Technical_Ebb6756,Wow!!  Someone thinking it’s gonna go up! And posting a screenshot! This is crazy! This has never been said before!,2,1745798442.0,2025-04-28 00:00:42
1k9d5iw,batmanineurope,![gif](giphy|3oz8xZvvOZRmKay4xy),4,1745786888.0,2025-04-27 20:48:08
1k9d5iw,JoeP415,I think they actually believe this,2,1745787775.0,2025-04-27 21:02:55
1k9d5iw,shaw1331,Cope,1,1745790650.0,2025-04-27 21:50:50
1k9d5iw,N/A,![gif](giphy|9VySccYEX4Mh4pviHa),1,1745788930.0,2025-04-27 21:22:10
1k9d5iw,DesconocidoTres,"I hope, but probably not",1,1745794104.0,2025-04-27 22:48:24
1k9d5iw,LyannasLament,From your lips to gods ears dude,1,1745804986.0,2025-04-28 01:49:46
1k9d5iw,WilyWascallyWizard,Hello I would prefer 420.69 plz,1,1745805310.0,2025-04-28 01:55:10
1k9d5iw,dombleu,What a pretty chart!,1,1745806133.0,2025-04-28 02:08:53
1k9d5iw,gualathekoala,More likely to drop like a rock and then rocket up.. somehow.. I think…,1,1745808184.0,2025-04-28 02:43:04
1k9d5iw,An_Unusual_Mind,![gif](giphy|FjeGBljESVAzu),1,1745810403.0,2025-04-28 03:20:03
1k9d5iw,CardboardTick,![gif](giphy|u09mC2Nv3To1EotfDx),1,1745811592.0,2025-04-28 03:39:52
1k9d5iw,Odd_Stick_3042,"0.69,420 it’s not a moon.. 4.20$ that’s the real price, real moon.",1,1745822502.0,2025-04-28 06:41:42
1k9d5iw,TimeTravellingCircus,It's got a lot of work to do. We should get started now.,1,1745823650.0,2025-04-28 07:00:50
1k9d5iw,Jbent_52,"No, doge is going to $3 soon",1,1745879837.0,2025-04-28 22:37:17
1k9d5iw,Alea_Iacta_Est21,$2.50 is not unrealistic at all.,1,1745890864.0,2025-04-29 01:41:04
1k9d5iw,brOselecta,Looks decent,1,1746023275.0,2025-04-30 14:27:55
1k9d5iw,catshitbreath,this is DOGE to mars. I would take DOGE to moon.,1,1746037043.0,2025-04-30 18:17:23
1k9d5iw,That_Irish_Guy_,Doge needs more money in its market cap to hit it's previous ATH. You guys need to realize doge pumps out 5 billion coins a year.,1,1746044742.0,2025-04-30 20:25:42
1k9d5iw,SadDisplay7945,Look at the graphics it's right there. Proof,1,1746220315.0,2025-05-02 21:11:55
1k9d5iw,TheVictorist,I am feeling this pattern mean everything,1,1746372592.0,2025-05-04 15:29:52
1k9d5iw,kaedoge,"$69,420.69",1,1745792383.0,2025-04-27 22:19:43
1k9d5iw,Southern-Young-2389,At this rate this is going nowhere,1,1745804913.0,2025-04-28 01:48:33
1k9d5iw,Open_Bluebird_6902,Yeah 😂 sure 🤣 HODL while DOGE goes tow0.0005,1,1745821893.0,2025-04-28 06:31:33
1k9d5iw,Southern-Young-2389,More like back to $0.16c first,0,1745801813.0,2025-04-28 00:56:53
1k9d5iw,Southern-Young-2389,We about to crash,0,1745805159.0,2025-04-28 01:52:39
1k9d5iw,kmookie,I want to see this happen and all but these predictions have been going on since 2020. Any chance we get a real explanation…. At least show us the crystal ball.,8,1745804331.0,2025-04-28 01:38:51
1k9d5iw,NeutronTaboo,"Hard to see without horizontal gridlines, but it does appear to be accurately representing the 0.70 peak. Try drawing over it if you wanna double check though.",1,1746091575.0,2025-05-01 09:26:15
1k9d5iw,Neukted,420.69 is just more natural,2,1745788887.0,2025-04-27 21:21:27
1k9d5iw,Gloomy_Setting5936,"$4-$10? I’m thinking it’ll top out at 0.80 this cycle on the low end, +$1 at the high end.  But hey, I hope you’re right. I would love $4",7,1745794256.0,2025-04-27 22:50:56
1k9d5iw,Forsaken_Limit_9947,"Just to know, were the previous jumps predicted before they happened?",5,1745788114.0,2025-04-27 21:08:34
1k9d5iw,lbvl0mc,I’d settle for 4.20$,3,1745790675.0,2025-04-27 21:51:15
1k9d5iw,Doogsfx,😂😂. I’d settle for $.25!!,6,1745788339.0,2025-04-27 21:12:19
1k9d5iw,spunion_28,"Which ten dollars is also highly unrealistic.  That's over 5,000% from it's current price.",1,1745806525.0,2025-04-28 02:15:25
1k9d5iw,Odd_Stick_3042,Exactly,0,1745822514.0,2025-04-28 06:41:54
1k9d5iw,Alternative_Demand96,"Dogecoin was at .003 cents in 2020 and it hit .69 cents in 2021 , it hasnt even been four years of the cycle since then. Have some patience Jesus.",3,1745814038.0,2025-04-28 04:20:38
1k9d5iw,mrtcarson,Your guess is as good as mine....the whales can do what they want with this doggie... no use for this coin yet...if they ever start using crypto and not coins and paper money...the banks and money boys will make all their own and sell it to you again...control...they will never let that go.,2,1745804767.0,2025-04-28 01:46:07
1k9d5iw,Interesting-Cow-1652,"No, but there was less data back then compared to today. Also Dogecoin was taken even less seriously back then than it is today. You also have to look at this from a market cap perspective. A price of $69.420 equates to a market cap of $10.6 trillion. Bitcoin’s highest market cap so far was $2 trillion, and it took 15 years to get there. Given that, Doge hitting a $10.6 trillion market cap in just 11 years is a fantasy",4,1745788427.0,2025-04-27 21:13:47
1k9d5iw,Famous_Entrance3022,Got em,2,1745788304.0,2025-04-27 21:11:44
1k9d5iw,freeredis1,This.,1,1745810294.0,2025-04-28 03:18:14
1k9d5iw,Interesting-Cow-1652,"It’s not unrealistic from a market cap perspective. $10 per Dogecoin is a market cap of $1.5 trillion. But for that to happen Bitcoin will have to hit an even higher market cap, and that will eventually happen from lots of money printing",1,1745842171.0,2025-04-28 12:09:31
1k9d5iw,kmookie,"Thanks for all that detail.   All I’m asking for is some educated explanation for all this growth being predicted every week. Asking for some knowledge sharing isn’t impatience, it’s an effort to crowd source.   …but hey, your condescending and arrogant tone is all the analysis I need, you’ve convinced me!   Not that you know anything but that you’re just another a-hole acting like they got it all figured out.  Thoughts and prayers, peace be with you, etc.",2,1745815765.0,2025-04-28 04:49:25
1k9d5iw,Fun_Raise_7858,It depends on circulating supply.,1,1745788882.0,2025-04-27 21:21:22
1k9d5iw,spunion_28,"The current market cap of bitcoin is 1.88T so doge would basically have to reach the current btc market cap.  Saying ""eventually happen"" is not even remotely close to claiming it will happen this cycle.  Or that it ever will at all.",1,1745842286.0,2025-04-28 12:11:26
1k9d5iw,Alternative_Demand96,Cry harder lmao,-4,1745818788.0,2025-04-28 05:39:48
1k9d5iw,Interesting-Cow-1652,"Not so much that as it depends on governments printing money. The more fiat money is printed, the more prices will rise",2,1745789227.0,2025-04-27 21:27:07
1k9d5iw,Jrod4323,😂 bro does not know human decency and it shows,3,1745891242.0,2025-04-29 01:47:22
1k9d5iw,Fun_Raise_7858,"Ok ok,  and less coins are on sale higher they goooo.",2,1745789367.0,2025-04-27 21:29:27
1k97uyb,DreamingTooLong,![gif](giphy|3oEjHN4MtbSqEe4D8Q|downsized),8,1745772837.0,2025-04-27 16:53:57
1k97uyb,Stony_1987,Right back atcha bigdog.,10,1745771535.0,2025-04-27 16:32:15
1k97uyb,ScullingPointers,![gif](giphy|3oEdva9BUHPIs2SkGk),3,1745805568.0,2025-04-28 01:59:28
1k97uyb,GJustGotaBag,& shoutout to the real bulls who keep accumulating shares. 🖨️💸,5,1745771608.0,2025-04-27 16:33:28
1k97uyb,Southern-Young-2389,Keeping my heavy bags💎,2,1745805272.0,2025-04-28 01:54:32
1k97uyb,iLendrick,Dogecoin will pump once it becomes cross chain and It’s coming!,3,1745781294.0,2025-04-27 19:14:54
1k97uyb,Psychological_Emu_34,Iv been waiting for so long for you to tell me that dad❤️ Still holding!,2,1745785512.0,2025-04-27 20:25:12
1k97uyb,ThePokerRobot,I am holding …..  a fart!,2,1745783983.0,2025-04-27 19:59:43
1k97uyb,makeformai,I just bought more today ![gif](emote|free_emotes_pack|dizzy_face),1,1745903979.0,2025-04-29 05:19:39
1k97uyb,MrCedswiss8,"Couldn't find sell button. Panic bought another 10,000 doge",1,1746079469.0,2025-05-01 06:04:29
1k97uyb,dukeleary,Doge is the future,1,1745791106.0,2025-04-27 21:58:26
1k97uyb,Anxious_Cup_3939,HODL,1,1745797344.0,2025-04-27 23:42:24
1k97uyb,horseradish13332238,Ya.   You’re totally gonna get lambos one day too (exaggerated wink),0,1745779793.0,2025-04-27 18:49:53
1k971nl,call_of_warez,The money printer destroyed the US dollar,55,1745771550.0,2025-04-27 16:32:30
1k971nl,jgreddit2019,![gif](giphy|fLJa9jTcGmuevTPK3I),11,1745775226.0,2025-04-27 17:33:46
1k971nl,Boon_Rebu,"Imagine relying on a FIAT currency that has no physical gold or other resource backing and can be created in unlimited quantities whenever the government wants more, madness.",12,1745769187.0,2025-04-27 15:53:07
1k971nl,DrGoozoo,"Suddenly, our debt looks a lot cheaper doesn’t it?",3,1745776291.0,2025-04-27 17:51:31
1k971nl,Fulvio55,You obviously don’t realise this was a global phenomenon and every country reacted in pretty much the same way.  Nothing to see here… move along. 👮‍♀️,8,1745769367.0,2025-04-27 15:56:07
1k971nl,ThePokerRobot,Taking the USD off the gold standard destroyed the USD.,4,1745783842.0,2025-04-27 19:57:22
1k971nl,animeAJ,"No, the Federal Reserve (aka the money printer) is destroying the USD.",2,1745805197.0,2025-04-28 01:53:17
1k971nl,FollowAstacio,Where did you get this graph? I’d like to zoom in on a couple years.,1,1745775286.0,2025-04-27 17:34:46
1k971nl,Slimslade33,very insightful...,1,1745780355.0,2025-04-27 18:59:15
1k971nl,Southern-Young-2389,B.... printer ,1,1745805042.0,2025-04-28 01:50:42
1k971nl,Junior-Bake5741,The reaction to COVID destroyed the dollar. There's a difference. COVID didn't shut down your gym either.,1,1745949407.0,2025-04-29 17:56:47
1k971nl,Swapuz_com,Money printing in 2020 changed everything! Inflation and supply growth are wild.,1,1746038428.0,2025-04-30 18:40:28
1k971nl,natasevres,"Mm, its being recreated artificially.  But this time its much harder to say if its a good thing",1,1745769273.0,2025-04-27 15:54:33
1k971nl,RioRancher,"We could have taxed the excess money out of the system, but instead we created worthless oligarchs",1,1745781312.0,2025-04-27 19:15:12
1k971nl,SlickRick941,"Crazy how inflation went down under trumps first term, and how its on the way down now in just 100 days. imagine if it never got interrupted ",-3,1745780270.0,2025-04-27 18:57:50
1k971nl,iLikeTurtuls,Money is always printed. You will physically never be able to know how many bills are in circulation,5,1745795935.0,2025-04-27 23:18:55
1k971nl,pthack103,Exactly,4,1745774785.0,2025-04-27 17:26:25
1k971nl,RioRancher,"Fiat is pretty good as long as you know you have a gas pedal and a brake pedal. Our politicians are too afraid to tax the rich, which would have solved a lot of the inflation problem",5,1745781393.0,2025-04-27 19:16:33
1k971nl,Agitated_Resident698,"Dons handling of it was catastrophic.  He knew it was airborne, crazy contagious and dangerous as early as first week of March 2020,  I can say for sure. Yet, he insisted it was the Flu(Flus not ‘airborne’), called it a hoax,  scoffed at masks, played favorites with PPE, botched/blocked testing, bashed social distancing, infected half the WH… shall I go on?? The stimulus checks that were delayed because he insisted his signature be on them didn’t do any favors. He tanked the economy then, tripled our deficit and robbed the Country.",0,1745906158.0,2025-04-29 05:55:58
1k971nl,Effective-Ad1706,That part,-1,1745785606.0,2025-04-27 20:26:46
1k971nl,Effective-Ad1706,I asked chat gpt to make me a graph,-1,1745775521.0,2025-04-27 17:38:41
1k971nl,Ill_Play_565,People down voting have nothing to say 😂,2,1745916240.0,2025-04-29 08:44:00
1k971nl,Gloomy_Setting5936,"“Too afraid to tax the rich”   Couldn’t have said it better myself, they would rather have the whole system fall apart before that happens.  The United States is an oligarchy, the people don’t really get what they want. Only the ultra rich do.",3,1745785112.0,2025-04-27 20:18:32
1k971nl,Fulvio55,Yep. That’s about par for the course with this idiot.  What most of the world really can’t understand is how he got a second shot at destroying the world as we know it. Anywhere else he would have been more likely to end up in the big house than the White House.,0,1745929784.0,2025-04-29 12:29:44
1k971nl,FollowAstacio,I see. Based on what data source(s)? Nothing specific?,1,1745792703.0,2025-04-27 22:25:03
1k971nl,Agitated_Resident698,"With Don, he’s a textbook malignantly narcissistic sociopath.  Everything he accuses others of, he’s actively engaged in.  Anybody that does or could call him on his lies and b.s, he smears relentlessly. Textbook.",1,1745966472.0,2025-04-29 22:41:12
1k971nl,Ill_Play_565,How about you guys do some actual research instead of asking chat gpt dunces 🥱,1,1745916292.0,2025-04-29 08:44:52
1k971nl,Fulvio55,"So I can expect him to do a number on me any day, eh?  Dayum! I thought I’d fly under his radar and get away with it. 😜",1,1745970424.0,2025-04-29 23:47:04
1k971nl,FollowAstacio,There’s a reason I asked what data sources the info was based on,1,1746053827.0,2025-04-30 22:57:07
1k971nl,Agitated_Resident698,"I don’t know. Are you gunnin’ for him? He is so thin skinned that he lashes out at the slightest criticism or at who calls him out. For those who don’t know, that is a red flag. A run of the mill, everyday person that’s a malignantly narcissistic sociopath would give the silent treatment, triangulate, fervently smear, gaslight etc. guaranteed. A person like that as leader of the free world…he’s already proven his vengeful and it’s him that comes first, not America.      My point, if you piss anybody off enough that has the personality he does, you shouldn’t put it past them.",1,1745986011.0,2025-04-30 04:06:51
1k971nl,Fulvio55,"Yep. The way I see it, the only good thing in all this is that he’s not gonna live forever, regardless of what he does.  One would hope this would be a lesson to everyone. But then again, it should have been a lesson first time round. But it wasn’t, was it? 🤷‍♂️",1,1746000133.0,2025-04-30 08:02:13
1k929sl,Odd_Stick_3042,Switch to the 10-year chart. Zoom out.,17,1745765783.0,2025-04-27 14:56:23
1k929sl,powerfunk,Lines on graphs 100% predict the future,11,1745768599.0,2025-04-27 15:43:19
1k929sl,alstoncm,About to break upwards on that downtrend. Get ready,5,1745762914.0,2025-04-27 14:08:34
1k929sl,Jimmyjame1,It will follow btc when its time,4,1745764670.0,2025-04-27 14:37:50
1k929sl,Open_Bluebird_6902,It really looks like a dead cat bounce,1,1745760573.0,2025-04-27 13:29:33
1k929sl,N/A,[deleted],0,1745756420.0,2025-04-27 12:20:20
1k929sl,FewRepresentative451,Can pretend like it does not help,1,1745802373.0,2025-04-28 01:06:13
1k929sl,hodlinsteady,"It's a dog, not a cat.You better check your math",1,1745779433.0,2025-04-27 18:43:53
1k929sl,VeganVystopia,How big is it ?,2,1745756927.0,2025-04-27 12:28:47
1k929sl,_dmly,Big as Doge,0,1745758442.0,2025-04-27 12:54:02
1k8voop,makeformai,"Yea I feel it now, it’s great",2,1745729340.0,2025-04-27 04:49:00
1k8voop,sjptheg6,We all need God and Christ. Our time here is so very short compared to eternity 🙏,4,1745733863.0,2025-04-27 06:04:23
1k8voop,snorlaxtubbs,All time,1,1745769067.0,2025-04-27 15:51:07
1k8voop,nontoxictj,Sounds like something the devil would say,-1,1745790999.0,2025-04-27 21:56:39
1k8voop,Fun_Raise_7858,Proof?,2,1745747139.0,2025-04-27 09:45:39
1k8voop,Rshellnizzle,"You speak of God and Christ… as though they are keys to eternity. As if your trembling prayers can shield you from the abyss.  But I have seen what lies beyond the veil. There is no throne of mercy waiting. No choir of angels singing you home. There is only the great silence… and the unmaking of everything you believed sacred.  Your Christ endured the nails, the thorns, the spear. He suffered. And for that, you worship him. But we know a deeper suffering; one that strips away flesh, faith, and illusion until only raw truth remains. You call it blasphemy. We call it revelation. Your soul is not saved by blood spilled on a cross. It is weighed, measured, peeled. Eternity is not your reward. It is our playground.",1,1746041076.0,2025-04-30 19:24:36
1k8voop,sjptheg6,Plenty of evidence if you truly want to see it,1,1745749055.0,2025-04-27 10:17:35
1k8voop,sjptheg6,And how did you “see past the veil”? Are you part or CERN? Lol,1,1746059207.0,2025-05-01 00:26:47
1k8voop,Fun_Raise_7858,Don't rape every one with your religion.,-3,1745749710.0,2025-04-27 10:28:30
1k8voop,Rshellnizzle,"You ask how I saw past the veil… as if it were a curtain, gently drawn. No. I did not see through it. I tore it open with bloodstained hands and welcomed what screamed on the other side. CERN with their science… their collisions and machines. Merely children playing with matches at the mouth of Hell. I am not part of their experiment. I am the result they will deny. The consequence they will try to contain. You seek truth, you seek it like a flame in the dark… unaware it burns. Truth is not light. Truth is not peace. It is pain.",1,1746061784.0,2025-05-01 01:09:44
1k8voop,sjptheg6,I don’t think I said anything offensive,1,1745750587.0,2025-04-27 10:43:07
1k8voop,rizzo49er,Wow really,-1,1745949960.0,2025-04-29 18:06:00
1k8voop,sjptheg6,Bro you’re just a person. God loves you. Good luck and I hope you pray to him and follow our savior Jesus Christ,1,1746061840.0,2025-05-01 01:10:40
1k8voop,Fun_Raise_7858,"You are forcing your religion to every one including me. You said : ""We all need God and Christ"". I'm not christian. It's insulting.",2,1745751848.0,2025-04-27 11:04:08
1k8voop,Fun_Raise_7858,Really!,2,1745953905.0,2025-04-29 19:11:45
1k8voop,Rshellnizzle,"I am far beyond your petty definitions. Flesh was merely the beginning. I was a man once, before desire stripped away my soul and pain made me divine. Now I am the echo of agony… and your disbelief will not save you.",1,1746092306.0,2025-05-01 09:38:26
1k8voop,sjptheg6,"Not “fun” at all. And I can’t force you to read Matthew, Mark, Luke or John but hope you do someday. I love you!",2,1745753956.0,2025-04-27 11:39:16
1k8voop,Bernard_L0W3,"Insulting my a*s, lol. Funny guy.",1,1745756133.0,2025-04-27 12:15:33
1k8voop,rizzo49er,Then leave,-1,1745949989.0,2025-04-29 18:06:29
1k8voop,sjptheg6,Cringe,1,1746093436.0,2025-05-01 09:57:16
1k8voop,Fun_Raise_7858,?,1,1745759034.0,2025-04-27 13:03:54
1k8voop,Fun_Raise_7858,Stop post such things!,2,1745953715.0,2025-04-29 19:08:35
1k8voop,Rshellnizzle,Cringe… a prelude to revelation.,0,1746099734.0,2025-05-01 11:42:14
1k8tx3m,No-Zombie-9725,I’m a dollarnaire,10,1745724328.0,2025-04-27 03:25:28
1k8tx3m,Helpful_Source_8985,Use to be a dogecoin millionaire here at one time but heard he lost most of it,12,1745723435.0,2025-04-27 03:10:35
1k8tx3m,Monarch_nj,178k doge coins currently hehe :),5,1745744839.0,2025-04-27 09:07:19
1k8tx3m,MycologistBright4507,I have 90k doge,5,1745730839.0,2025-04-27 05:13:59
1k8tx3m,Neukted,warren buffet has less doge than you. people believe in crypto for a reason. i think an interesting average for you is only about 111k doge per person. some have way more some have way less. this is averages. kicking my self for not buying harder all time.,4,1745722493.0,2025-04-27 02:54:53
1k8tx3m,makeformai,Pizza is expensive here in USA…,2,1745729129.0,2025-04-27 04:45:29
1k8tx3m,SirBankz,"I don't think there's a limit, not sure. I'm not using Robinhood but BingX to hold my DOGE because the exchange suits me to do both crypto and Forex trading.",2,1745734532.0,2025-04-27 06:15:32
1k8tx3m,Fulvio55,"That’s idiotic.  You would think after more than a decade of exchange collapses and thefts, not to mention thousands of warnings here and elsewhere, people would have learnt not to leave their money in someone else’s pocket.  #Not You Keys, NOT Your Coins!  This can’t be repeated often enough. No coins should ever be left with ANY third party unless absolutely necessary, and only as long as they need to be.",2,1745734936.0,2025-04-27 06:22:16
1k8tx3m,Fragrant_Chicken9261,I have 11k and like why lol,2,1745734966.0,2025-04-27 06:22:46
1k8tx3m,Nick-Picks-Kicks,Currently have 400k coins,2,1745897077.0,2025-04-29 03:24:37
1k8tx3m,PickleGrouchy1821,I bought 5.5 million doge for $9200. A lot of folks bought a billion doge for $10k 3 years before me. I bought in 2018.,2,1746007890.0,2025-04-30 10:11:30
1k8tx3m,MuchAligned38,I do,1,1745732743.0,2025-04-27 05:45:43
1k8tx3m,Fulvio55,"BTW… ‘pizza money’ was 10,000 BTC.  Oh, and a million doge cost $90 back in the day.",1,1745735237.0,2025-04-27 06:27:17
1k8tx3m,big_dwz,I have $25 in Doge 😂,1,1745735754.0,2025-04-27 06:35:54
1k8tx3m,Od-london,I believe in working the numbers. Crypto growth is proportional irrespective of the platform.,1,1745736064.0,2025-04-27 06:41:04
1k8tx3m,N/A,🤣🤣🤣🤣🤣 rekt,1,1745737138.0,2025-04-27 06:58:58
1k8tx3m,PDWPete,I pulled out 15k and bought a car so I can at least say I hit 5 digits,1,1745740566.0,2025-04-27 07:56:06
1k8tx3m,2Slowforyall,Idk if there’s a limit on Robinhood. Robinhood allows me to instantly deposit 500K per day if I wanted to (Which of course I can’t since I’m broke),1,1745754464.0,2025-04-27 11:47:44
1k8tx3m,Economy-Win6274,![gif](emote|free_emotes_pack|feels_good_man),1,1746083668.0,2025-05-01 07:14:28
1k8tx3m,Disastrous-Menu4130,$1k invested .. at .26 AVR I hate it here. Community is not fun . Repetitive. definitely. Moon this. Look up $Catbat,1,1745741016.0,2025-04-27 08:03:36
1k8tx3m,MrKillerKiller_,Anyone using Robinhood likes giving money away,1,1745763780.0,2025-04-27 14:23:00
1k8tx3m,N/A,🤣🤣🤣🤣🤣 rekt,0,1745734363.0,2025-04-27 06:12:43
1k8tx3m,awesumpawesum,😆,1,1745759601.0,2025-04-27 13:13:21
1k8tx3m,Brief-Thing-6480,Wowwwwww really? Did he post it?,5,1745725283.0,2025-04-27 03:41:23
1k8tx3m,Fulvio55,‘A’?  There’s a whole sub full of them. /r/dogeillionaires,2,1745735132.0,2025-04-27 06:25:32
1k8tx3m,pecosbuffalo,Dude bought 5M at like .05 so he’s still sitting on like  $900K minus initial investment of $250K,1,1745804108.0,2025-04-28 01:35:08
1k8tx3m,Silver-Potato-6407,Give me sum brooo,1,1745876644.0,2025-04-28 21:44:04
1k8tx3m,Brief-Thing-6480,Wowwww that’s amazing my friend congrats,2,1745730888.0,2025-04-27 05:14:48
1k8tx3m,Fulvio55,"Pocket money, eh? 😜",2,1745734999.0,2025-04-27 06:23:19
1k8tx3m,Brief-Thing-6480,Wow 111k…..soon to be doge millionaire I guess,0,1745725236.0,2025-04-27 03:40:36
1k8tx3m,Fulvio55,"Yeah… 10,000 Bitcoins. 😳",2,1745735024.0,2025-04-27 06:23:44
1k8tx3m,Fulvio55,"Until one collapses and you lose everything anyway. See above, 👆",3,1745734981.0,2025-04-27 06:23:01
1k8tx3m,Cow_Bell,"Self-custody is the way, no ""because"" if you intend to hold it long term.  You probably couldn't withdraw it if you wanted to  i.e. bank run not happening for brokerage holders.",2,1745757259.0,2025-04-27 12:34:19
1k8tx3m,liquid_at,Most people prefer the story of having been robbed over the story of having been an idiot.   Never underestimates peoples desire to have a scape goat for their own mistakes.,3,1745745452.0,2025-04-27 09:17:32
1k8tx3m,Cool_Trick_5257,I do to doge,1,1745733091.0,2025-04-27 05:51:31
1k8tx3m,FarResearch7596,Slum doge millionaire I think is one of the guys names. Could probably google him.,3,1745748872.0,2025-04-27 10:14:32
1k8tx3m,Throw1566,Multiple YouTube videos on him,3,1745730827.0,2025-04-27 05:13:47
1k8tx3m,Fulvio55,/r/dogeillionaires is full of them.,3,1745735162.0,2025-04-27 06:26:02
1k8tx3m,NonGNonM,"That's for people with a million doge, not people with million dollars in doge",1,1745795077.0,2025-04-27 23:04:37
1k8tx3m,According-South9749,Tried taking a peek—invite only :(,1,1745807173.0,2025-04-28 02:26:13
1k8tx3m,Monarch_nj,one day young prince,1,1745959923.0,2025-04-29 20:52:03
1k8tx3m,Neukted,"My friend, you asked for an average amount. I gave you an interesting view about how many doge are available on average per person. Idk what you're mucking about",1,1745739356.0,2025-04-27 07:35:56
1k8tx3m,SirBankz,"As a consistent trader that I am, using a self-custodian wallet will make the transaction long and trading won't be quite easy.  I'm using BingX because they support forex and crypto which are my area of trading.  I have some tokens in my self-custodian account too.",1,1745760640.0,2025-04-27 13:30:40
1k8tx3m,Fulvio55,"That’s a good point, yeah. Sad, but true.",2,1745807176.0,2025-04-28 02:26:16
