post_id,author,body,score,created_utc,date
1jcyujm,Patient_Artichoke355,I’m sorry..but if I read the comments from the OP correctly.. I think he’s confusing a social community with an investment community..when hr after hr garbage posts most likely generated bots..are encouraging people..I’m willing to bet are young and inexperienced investors..with the sole purpose of enticing them to invest in a meme coin..so they can manipulate the price..then the idea of a social community goes out the window..perhaps those he described as trolls ..are people who lost money..because they were naive enough to believe that this meme coin..which was started as a joke..was going to be the next Bitcoin in the crypto currency world.. this is serious business..this is money..in reality it’s a penny stock..it’s not a real currency..I wonder how many people are dumping their life savings into this..or playing on margins..this is not a social community..the truth needs to be out there..not the propaganda that constantly being vomited hr after hr..,2,1742171626.0,2025-03-17 00:33:46
1jcyujm,Captnblkbeard,You should post memes like crazy and don’t take it too personal. You’re doing it wrong. When you’re winning you post some memes and when you’re losing you post memes too.,2,1742171707.0,2025-03-17 00:35:07
1jcyujm,cstar4004,"Hey, friend, Im sorry for the negative experience, and I cannot disagree. I am not condoning or making excuses, but Id like to offer some possible theories to why it is this way:  -There are troll and spam accounts who intend to manipulate public perception, one way or another, by either spreading undeserved fear to scare off new investors, or spreading undeserved hype to attract new investors, depending on whatever agenda they might have. These are the “I CAN GUARANTEE WE HIT $100 BY NEXT WEEK” or the “SELL NOW! GET OUT! CRYPTO IS DEAD AND WILL NEVER RECOVER” type comments and posts. Especially the newer accounts with shorter post history. Also look out for the accounts that seem to suddenly switch personalities halfway through their post history, which have likely been account-farmed, or stolen.   -Dogecoin’s association with Elon Musk and Donald Trump have added in some political sentiment to the community. Whether or not the association to Musk is real or just perceived, the emotion of politics is still spilling into this sub.  -Because it’s the internet, it’s easier to just unleash all the pent up emotion by lashing out on complete strangers. Youre not talking to a human, you’re talking to a Reddit Snoo with silly clothes, and a wall of text. Maybe even a bot or two. It’s easy for people to forget the human behind the other screen.  -Repetition might be annoying to some people, and instead of muting the sub, or just downvoting and moving on, they have to jump in to bully or complain every time they see a similar topic get posted more than once. Or they think they are attacking one the aforementioned troll accounts, but they are accidentally just attacking a genuine newcomer with legitimate questions.",2,1742177137.0,2025-03-17 02:05:37
1jcyujm,jeffthefakename,To the moon,2,1742178097.0,2025-03-17 02:21:37
1jcyujm,Telemetris,The irony of a negative post complaining about a negative post is not lost on me haha,2,1742184878.0,2025-03-17 04:14:38
1jcyujm,northrupthebandgeek,"The community was great a decade ago.  Much less so now.  People looked at Dogecoin and saw dollar signs, forgetting that 1 DOGE = 1 DOGE.  People got greedy, forgetting to Do Only Good Everyday.",2,1742199919.0,2025-03-17 08:25:19
1jcyujm,God-Emperor-Pepe,"I’ve been in this sub for 4 years. It’s completely different now and I have almost word for word posted exactly what you said on more than one occasion. Unfortunately, right now Reddit as a whole is being infiltrated by political griefers, hate mongers, and outright trolls.  It’s not just this sub, however; the fact that DOGE is now largely considered the Department Of Government Efficiency, most if not all liberal/left investors are furious.   The lines between authentic engagement and dead internet theory is harder to distinguish now than ever been. At the end of the day, you have to just shut off most of the noise and carry on as you normally would.   At this moment in time, anti Trump and Elon posts, regardless of the subreddit, have become MAJOR karma farms. I’m not suggesting that there aren’t real people who are upset. There are. They’re real, but Reddit as a whole right now is in complete collapse. So much so that the stock has lost 50% of its value since Trump took office.   Moderating may get better, or it may get much much worse. Only time will tell. Stick to the basics. Do Only Good Everyday.",2,1742171277.0,2025-03-17 00:27:57
1jcyujm,N/A,[removed],2,1742168281.0,2025-03-16 23:38:01
1jcyujm,N/A,The spam is very minimal,1,1742169283.0,2025-03-16 23:54:43
1jcyujm,SithC,"There are many a whale out there, eager to drum up anticipation with bots, so they can take your profit. In a way, it’s probably best to stay away, if you’re one that’s susceptible to these ploys.",1,1742169581.0,2025-03-16 23:59:41
1jcyujm,guinader,"It was like that, and if you learn to recognize the user names of the  ""seniors"" I'm dogecoin.. you will notice we still only say our do good. 😀 But from 40,000 people to 2 million people is hard to control anything.     I just do my part and stay positive, say nice things.     Much sad if you go. 🙂",1,1742169690.0,2025-03-17 00:01:30
1jcyujm,Rddt_stock_Owner,Grow up. All of you,1,1742170334.0,2025-03-17 00:12:14
1jcyujm,Thick_Expression_796,It’s just some people human nature behind a user name and phone/ computer to be rude or cruel. Sad,1,1742170450.0,2025-03-17 00:14:10
1jcyujm,GoodShibe,"I've been here since the start, 11-ish years now.  It's cyclical and often comes in waves.  What I often tell people is to be the change that you wish to see around here. It's not always easy but you do start to get a sense of who the good actors are around here are (like /u/Fulvio55, for instance).  Find the good ones and go from there. It takes a bit of time investment but it's worth it.  Also, if you notice certain accounts always trolling or being toxic either A) report them or B) Block them. It's amazing how blocking a small handful of people can clean your feed up significantly.  Hope that helps,  GoodShibe",1,1742171226.0,2025-03-17 00:27:06
1jcyujm,randymursh,"Any crypto sub is like advanced training to better understand/observe the many types of trolls that exist in our world here.   There is good stuff that goes on in the sub though, the poopy stuff is the filler between anything worthwhile.",1,1742173284.0,2025-03-17 01:01:24
1jcyujm,BelloBellaco,HODL!!!,1,1742177727.0,2025-03-17 02:15:27
1jcyujm,Mean_Fault_4988,For the pep talks! Duh..,1,1742180584.0,2025-03-17 03:03:04
1jcyujm,Icy-Championship726,Doge party to the moon again.,1,1742182903.0,2025-03-17 03:41:43
1jcyujm,Wonderful_Lie6698,.. funny enough .. I’m not even in this subreddit and I keep getting updates of post about dogecoin lol why,1,1742192072.0,2025-03-17 06:14:32
1jcyujm,Substantial-Shoe-486,.00000001% up= TO THE MOON!! .00000001% down= ITS OVER!!!,1,1742202765.0,2025-03-17 09:12:45
1jcyujm,Infinite_Assignment4,"It's going to rise, they didn't create a government agency after the coin for NO reason, get ready...",1,1742203631.0,2025-03-17 09:27:11
1jcyujm,InterestingTitle4242,I like dodge coin 🪙,1,1742208708.0,2025-03-17 10:51:48
1jcyujm,OnlyRawSauce,Sometimes the hostility against new members here is crazy,1,1742211333.0,2025-03-17 11:35:33
1jcyujm,minimal,"See, this I get. Doge started about fun and community, especially when compared to the toxicity of BTC in the 20teens. People forget the absolute crap show that was the post MTGox era. Doge was fresh, friendly, and worth fractions of a cent. It democratized crypto for a lot of folks. Now, there are still the old school 1 doge = 1 doge folks, but there seems to be WAY more people chasing some insane hope that their 4675 doge will make them rich. They believe (or at least hope) it will hit $5, $10, $100, or, new to me, even $2000. We've become the toxic community, and anyone who says doge is not a great investment gets labeled a hater, or accused of spreading FUD, or a BTC shill. Frankly, it is sad and pretty disappointing.   ""To the moon"" used to be a meme, and now it is costing people their life savings.",1,1742215170.0,2025-03-17 12:39:30
1jcyujm,txtiemann,"No Divide, Only DOGE  SUCH COMMUNITY  VERY YES",1,1742215291.0,2025-03-17 12:41:31
1jcyujm,Basic_Car8415,Another day at the office,1,1742215906.0,2025-03-17 12:51:46
1jcyujm,locofspades,Username checks out.  That is all. CHEERS,1,1742218650.0,2025-03-17 13:37:30
1jcyujm,DogeCoin_Soldier,Try R/Dogecoinunfiltered,1,1742218878.0,2025-03-17 13:41:18
1jcyujm,Mountain_Plan_4608,You basically joined a 4chan coin community. What did you expect? Sounds like you're more suitable for the BTC or $VOO community.,1,1742221128.0,2025-03-17 14:18:48
1jcyujm,huntleyhl,I agree. That’s why I left. Still visit from time to time but I just mind my own and hold.,1,1742222489.0,2025-03-17 14:41:29
1jcyujm,iamlordjebus,So my takeaway from this is you want to fight. Meet me out at the playground,1,1742224879.0,2025-03-17 15:21:19
1jcyujm,zytrohs-801,Do only good everyday,1,1742228843.0,2025-03-17 16:27:23
1jcyujm,DothrakAndRoll,"I can’t help but chuckle at that first sentence. Of all the subs to think would be an engaging community, you thought it was the memiest of meme coin subs?",1,1742229509.0,2025-03-17 16:38:29
1jcyujm,The_Arcade2,Doge troll here; ignore everything you see on the subreddit. Its all FUD just Hodl on Gooners,1,1742232457.0,2025-03-17 17:27:37
1jcyujm,jbob08,"When it comes to money, it doesn't take much to make people frustrated. For a lot of people, the way they best know to handle that is to hear from other people in the same pain. So I think a lot of it is misery looking for company. A lot of the people on this sub that were around when it was a lot more positive are here for the long term and get equally as annoyed at new people upset they didn't make it big in their first week.  In other words you have veterans and rookies who have very different experiences but all working with the same resource. One half seems permanently annoyed at the other half pretty much all the time. Not saying that's an excuse, but keep in mind you are in a sub that combines reddit personas and money. That's as volatile as it gets.",1,1742235360.0,2025-03-17 18:16:00
1jcyujm,Sea_Bastard_2806,"I feel sad for DOGE communities. They confused hope with expectations, and I think a lot of people put in thei savings, not working money.",1,1742236088.0,2025-03-17 18:28:08
1jcyujm,INFJericho,"I mean, people are negative because the market is currently negative (with no signs that we will find an uptrend any time soon, as long as trade wars, etc., continue to look like they are only escalating.)  If and when we can stop the craziness, and markets get in a place of certainty, then when we start going up - expect a lot more positive posts, memes, etc.   Until then, expect a lot of depressing, angry posts or no posts... which just leaves the trolls.   It sucks to be in crypto and stocks right now, and a lot of people are angry, cause this seems like a self-inflicted wound. We should be much higher right now.   Just try to stay positive. Everything is being manipulated down. Just got to wait it out till it starts getting manipulated up.🤗",1,1742236708.0,2025-03-17 18:38:28
1jcyujm,Clear_Programmer5329,i’m here because it’s fun! I’m not gonna bet my farm for Doge for sure.,1,1742237799.0,2025-03-17 18:56:39
1jcyujm,liquid_at,"That's what happens during every bull-run. Bots, shills, haters, trolls, etc. flood all the subs to be as toxic as possible.   If you want to experience any crypto sub, take the 3.5 years between the 6 months of hype.  Those 6 months are where the new victims for scammers buy their first crypto and all the scammers want to be first in line to fool new investors with bad data.   Not much we can do about thousands of bots, when Reddit itself likes it and wants those scammers to continue. If the Owners of the site support the scammers, there is nothing the users can do.",1,1742238407.0,2025-03-17 19:06:47
1jcyujm,ChemicalSwan5729,Who cares dude.  Why write all that?,1,1742244965.0,2025-03-17 20:56:05
1jcyujm,ADottore8533,"Don't worry, the same thing is seen in many subs, not just this one.  You just have to learn to ignore them and continue being yourself, and not pay attention to aggressive, pessimistic, or negative posts in general, energy is a very valuable possession to waste it unnecessarily.   All the best! 💪😉👍",1,1742247027.0,2025-03-17 21:30:27
1jcyujm,Adventurous_Drop8014,If the internet isn't a place to mock other people's misfortune. IDK what it's for 😆,1,1742248075.0,2025-03-17 21:47:55
1jcyujm,Then-Philosopher2348,"I’m not a troll, I promise 😉",1,1742251412.0,2025-03-17 22:43:32
1jcyujm,LetoLeto1147,"Most people suck, and can only get enjoyment by tearing other people apart. 2 Timothy 3: 1-5 in a nutshell No disputing this...",1,1742255512.0,2025-03-17 23:51:52
1jcyujm,Fulvio55,"Since /u/goodshibe tagged me, I guess I’ll stick an oar in.  The people here fall broadly into two groups. Well, three if you count the bots, shills and haters from other subs.  There are the pre-Musk people, dating back to 2013.  And then there are the post-Musk people who rushed in and paid insane amounts for their coins in the expectation of becoming filthy rich with zero effort.  When the bubble burst, that latter group got caught holding very expensive bags. In some cases their life savings which they foolishly threw in. This group also subscribe to the truly idiotic HODL mentality, not realising it was coined as a sarcastic joke, not as a game plan to riches.  So they constantly post garbage about prices, complete with stupid screenshots and absolutely zero content of any value whatsoever. Thee people seriously think the coin is going to be worth a mythical dollar sometime tomorrow, and are happy to do nothing to improve their situation.  It’s a bit like the priest in a flood, who refused rescue by multiple boats and helicopters only to drown. When he arrived at the pearly gates and complained about god not helping him, god said “I sent you boats and helicopters, and you refused them all”.  If these people bothered to learn to trade, they would all have completely free coins, just like all the pre-Musk people do. Then they wouldn’t care about what prices do, and might make this place fun again, like it used to be a decade ago.  Thank you for your quality post. If more people posted like you instead of the garbage shitposts, we truly would be an awesome place to be again.  👍🏆❤️",1,1742258737.0,2025-03-18 00:45:37
1jcyujm,thirdcoasttoast,"Lol stop the cap. Everyone thought they were gonna make a quick buck. Now we come here to join together and share each other's pain.   There no deeper meaning . We just wanted to make lambo money. Just be honest, itll make your life easier",1,1742270319.0,2025-03-18 03:58:39
1jcyujm,Distinct-Manner8331,"screw what other people have to say, if you like something you like it",1,1742317237.0,2025-03-18 17:00:37
1jcyujm,No_Entertainer_5919,Every Doge has its day.,1,1742689854.0,2025-03-23 00:30:54
1jcyujm,Commercial_Ease8053,"It’s because people continue posting bs delusional hopium and it’s annoying. Clearly the price is going down and people are trying to convince others to stay based on literally nothing but ridiculous fantasy articles just so they can probably exit themselves.  It’s a meme coin that is clearly dying. Idk what some of you expect, but this is exactly what happens to 99% of them.",1,1742171130.0,2025-03-17 00:25:30
1jcyujm,kaedoge,"Dude, did you just ask your chatGPT to write a diatribe on Dogecoin?   Most of the negative stuff and technical analysis garbage is bots or shills.   The real community is here, thriving, and buckling up for the moon.",1,1742175452.0,2025-03-17 01:37:32
1jcyujm,Xxxjtvxxx,"I joined to gain insight on an investment i made in 2021, it was “do only good everyday” at the time and was fun and lighthearted. Since i sold my holdings on the evening that elmo was on snl, I’ve noticed this sub get more and more toxic; alot of people are upset and frustrated just trying to break even is my best guess for the toxicity.",1,1742187654.0,2025-03-17 05:00:54
1jcyujm,Danger64X,"No one cares . We here to make money, not hollow friendships.",-6,1742167846.0,2025-03-16 23:30:46
1jcyujm,magiCAD,TL;DR?,0,1742167903.0,2025-03-16 23:31:43
1jcyujm,OddSyrup2712,"Personally, I do a recurring $5 DOGE buy on the first of each month.  So far I have 860 DOGE.  Not enough to make me rich, but also not enough to make me worry.  I just come here to read the comments.  All the best to everyone!  I hope we hit $2k!",0,1742185227.0,2025-03-17 04:20:27
1jcyujm,IsolatedAndH8ted,"Thanks for your input man, You are the Second non-troll that I have seen so far in the comments on my post, Thanks for saying things how it is, I haven't been around reddit forever, And now that I think of It, I guess when you said something about those bots, I guess I have recently saw a lot of these strange new accounts coming in here to make strange posts..... , So yeah I mean I agree with a bunch of others trying to get others to sell of course which is a waste of time IMO, But yeah lol.",17,1742169469.0,2025-03-16 23:57:49
1jcyujm,IsolatedAndH8ted,Under rated comment. Sir you have been promoted.   😂😂,2,1742170909.0,2025-03-17 00:21:49
1jcyujm,IsolatedAndH8ted,Thomas.....?? THE TRAIN.....??  ![gif](giphy|QsTGfN7bYXUm4),6,1742171568.0,2025-03-17 00:32:48
1jcyujm,IsolatedAndH8ted,For sure man.....,2,1742169486.0,2025-03-16 23:58:06
1jcyujm,IsolatedAndH8ted,I guess I never thought of it that way LOL.,4,1742171798.0,2025-03-17 00:36:38
1jcyujm,IsolatedAndH8ted,"I guess I never thought of it that way LOL. I literally came across the one like that one pump dot fun or whatever in th3 heck website not even that long ago, so I guess what You say makes sense",3,1742171944.0,2025-03-17 00:39:04
1jcyujm,IsolatedAndH8ted,"Thanks for actually reading the post, And responding with an actual reasonable comment...... , I appreciate your input man, So far all I'm seeing are just people thinking that I only said that people on reddit are mean to one another, while that may be true, It's not exactly 100% what I was meaning, But thanks for understanding without getting stupid and troll-ish towards me homie. Much love.",6,1742169327.0,2025-03-16 23:55:27
1jcyujm,guinader,That's not how the sub was... 1 doge is 1 doge and that's all that matters,5,1742169762.0,2025-03-17 00:02:42
1jcyujm,BelloBellaco,Dey Often Get Emotional,2,1742177790.0,2025-03-17 02:16:30
1jcyujm,Corey307,It depends on how you define negativity. I’ve routinely been labeled negative for telling people dogecoin isn’t going to get to five dollars let alone $20 this year. That HODL’ing long term is OK if you got in very early at a few cents but otherwise make money every four years. ,2,1742168757.0,2025-03-16 23:45:57
1jcyujm,IsolatedAndH8ted,"True.............. , I suppose tho when it comes to human beings tho, Every single human being is capable of getting along with another person , They just make it 10 billion times harder than what it actually is, Like if everybody got along, and everybody helped each other in some sort of way, Then nobody would struggle, But that's not exactly how it's supposed to be, I know that's not really what my post was 100% about.... , \* sigh \* . , But aha yeah I guess if you do take a crap ton of people you're gunna have a bunch of bots, trolls, nice people, and just other people talking crap just because they are having a bad day and to just take it out onto somebody else...",1,1742169651.0,2025-03-17 00:00:51
1jcyujm,IsolatedAndH8ted,"Thanks for seeing it that way....... yeah you're right.... i mean yeah it is everywhere...... for some reason, people just thrive on it.... but to me.... It's a HUGEEEE waste of energy..... Like drama and stuff lol.....",3,1742171679.0,2025-03-17 00:34:39
1jcyujm,BigMoneyBrad007,lol you seen there stock lately i wouldn’t doubt political or government actors,1,1742194977.0,2025-03-17 07:02:57
1jcyujm,xephrenata,"Sounds great, I'm in",1,1742168559.0,2025-03-16 23:42:39
1jcyujm,IsolatedAndH8ted,Make sense thanks for the comment,1,1742171591.0,2025-03-17 00:33:11
1jcyujm,Fulvio55,"Aww, shucks…  I’m gonna have to buy a bigger hat now, GS. 🎩  🤣🤣🤣🤣🤣",1,1742258099.0,2025-03-18 00:34:59
1jcyujm,Realistic-Ground4111,Hodl hodl hodl!!!!,2,1742179079.0,2025-03-17 02:37:59
1jcyujm,Fulvio55,It’s called writing quality instead of shitposting garbage.,1,1742258788.0,2025-03-18 00:46:28
1jcyujm,WorkingSpecific7980,Why is optimism annoying? Genuinely curious about this.,1,1742171561.0,2025-03-17 00:32:41
1jcyujm,BigMoneyBrad007,things only die if they let it like a plant. Water it everyday buy doge everyday lol,1,1742194903.0,2025-03-17 07:01:43
1jcyujm,minimal,"Define the moon. Doge at $1 would be about a $150 billion market cap with the current supply, which is increasing by 15,000,000 Doge per day. You can extrapolate 5, 10, 100. What do you honestly believe is a peak for Doge?",0,1742189365.0,2025-03-17 05:29:25
1jcyujm,Z3400,"I miss the days when people were just here to be here. Making money is a bonus, but this subreddit used to just be memes and positivity.",3,1742169254.0,2025-03-16 23:54:14
1jcyujm,N/A,People on our Reddit aren’t nice to each other,2,1742168007.0,2025-03-16 23:33:27
1jcyujm,Land-Otter,"I feel you, dude. I am holding now at a 50 percent loss. I have faith this coin will rise again in the future but my plan is to hold for years, even five years. Many of the negative posters here are looking for quick gains, which is fine. But the negative posts have become overwhelming. Just stick around for the positivity. Many of us are only investing what we can afford to lose and understand this is a gamble so we're not freaking out right now. Hopefully you'll stick around!",17,1742174446.0,2025-03-17 01:20:46
1jcyujm,Great-Sport2885,"For real dude! I hope they see feedback like this and simply give up on their goal. I keep hearing about reddit getting bought out by major lobbyists too, meaning they can kinda control what you see, post, and Influence ya. It's soo weird too, it's not just this platform but many social medias pushing narratives. I've never in my life gotten soo much right wing cermercials and ads then I do roght now and I just like mythological creatures. Bigfoot and the sorts, but somehow that's close enough to an algorithm or something to push such garbage on me. Lol.",9,1742169965.0,2025-03-17 00:06:05
1jcyujm,splattered_cheesewiz,![gif](giphy|l1J9GOHzv61L2UyYM|downsized),3,1742179121.0,2025-03-17 02:38:41
1jcyujm,C300w204,"To be honest my reddit experience has been going downhill for some time,   went 2 days without looking at reddit and first moment i open the app it was horrible , suggest you do this and look at the difference.  Cant take anything seriously here anyway",5,1742170444.0,2025-03-17 00:14:04
1jcyujm,pbx1123,Yeap,2,1742173900.0,2025-03-17 01:11:40
1jcyujm,IsolatedAndH8ted,"You know what,  I totally agree.",5,1742171050.0,2025-03-17 00:24:10
1jcyujm,IsolatedAndH8ted,"Huh..... , I would think that would be more of an opinion....... Lol.",1,1742169532.0,2025-03-16 23:58:52
1jcyujm,Cocaineisgr8,You get dibs on the bowl,1,1742169052.0,2025-03-16 23:50:52
1jcyujm,BelloBellaco,![gif](giphy|p4pWzctMrCBfLFgycF),1,1742179139.0,2025-03-17 02:38:59
1jcyujm,ChemicalSwan5729,Yeah it's quite a work of quality literature there.,1,1743601611.0,2025-04-02 13:46:51
1jcyujm,Commercial_Ease8053,I think you should make better investments. Over the last entire year it’s only up 0.018 cents haha. Not even 2 cents. How is this a smart investment whatsoever? Btw don’t answer — that’s a rhetorical question.   It’s not a smart investment. Throw more and more money in the trash all you want. I’m sure Elon loves it.,1,1742195124.0,2025-03-17 07:05:24
1jcyujm,Danger64X,Making money on an investment is optional……wow.,0,1742169611.0,2025-03-17 00:00:11
1jcyujm,IsolatedAndH8ted,That's..... Not...... what the post was 100% .. about...............,1,1742169201.0,2025-03-16 23:53:21
1jcyujm,magiCAD,Thanks kind sir!,0,1742168309.0,2025-03-16 23:38:29
1jcyujm,IsolatedAndH8ted,Thanks for good vibes man.,11,1742176342.0,2025-03-17 01:52:22
1jcyujm,YoungOhian,They already do. They dont need to buy reddit. This thing is MAJORLY influenced. Politically and culturally.,1,1742255252.0,2025-03-17 23:47:32
1jcyujm,IsolatedAndH8ted,Makes sense,3,1742171491.0,2025-03-17 00:31:31
1jcyujm,GoodShibe,Hi there!  I'll give you the same advice I gave to OP: you can clean up your feed quite a bit by reporting and/or blocking trolls and other bad actors when you see them.  Hope you find that helpful!  GoodShibe,2,1742171371.0,2025-03-17 00:29:31
1jcyujm,Fulvio55,😜,1,1743641307.0,2025-04-03 00:48:27
1jcyujm,Z3400,Dogecoin was not considered an investment back in the day (probably still shouldn't be). It was a joke. It was for fun (like gambling on silly nonsense) I miss that.,2,1742170680.0,2025-03-17 00:18:00
1jcyujm,IsolatedAndH8ted,"I'm sorry i'm having trouble keeping up with everybody's comments, but thanks for the advice.I'll try to figure out how to do that.I'm sure it's not that hard l o l",3,1742171522.0,2025-03-17 00:32:02
1jcyujm,N/A,[deleted],1,1742231868.0,2025-03-17 17:17:48
1jcyujm,GoodShibe,"I haven't banned anyone in a long, long time.",1,1742232270.0,2025-03-17 17:24:30
