post_id,author,body,score,created_utc,date
1jtvmay,Away-Assistant-7577,special thanks to those who didnt panic sell at all the past week and focused on your daily tasks instead.   well done 💎✊,27,1744058373.0,2025-04-07 20:39:33
1jtvmay,Great-Sport2885,"Not gonna lie they really had me in that first half, lol.",9,1744064872.0,2025-04-07 22:27:52
1jtvmay,Ir0nman123,It’s happening!,4,1744068299.0,2025-04-07 23:24:59
1jtvmay,mainlanddoan,i’m at .19 am i gonna be alright,3,1744081845.0,2025-04-08 03:10:45
1jtvmay,TFTEnjoyerM0RTDOG,is this a good buy price?,3,1744103191.0,2025-04-08 09:06:31
1jtvmay,Chris_Torts,Iam waiting for my tax return or paycheck so I can get some more on sale,4,1744060567.0,2025-04-07 21:16:07
1jtvmay,BigMoneyBrad007,woooo,2,1744086877.0,2025-04-08 04:34:37
1jtvmay,Exciting_couple77,Go back to .30 please lol,2,1744104064.0,2025-04-08 09:21:04
1jtvmay,Fizassist1,"before any Debbie's come in here, don't lol I'll participate in a 15 cent party as many times as I want to dammit 🤣",2,1744061740.0,2025-04-07 21:35:40
1jtvmay,Neukted,Holding,1,1744137350.0,2025-04-08 18:35:50
1jtvmay,Hot-Fun-1566,Shiba Inu coin plummets amid volatile market after investors spooked by Rabies outbreak.,1,1744141582.0,2025-04-08 19:46:22
1jtvmay,SuchDogeHodler,I bought the dip! Now to the moon!,1,1744163774.0,2025-04-09 01:56:14
1jtvmay,Practical_Struggle_1,.14 cent party lol,1,1744177751.0,2025-04-09 05:49:11
1jtvmay,Fun_Raise_7858,🥳,1,1744063301.0,2025-04-07 22:01:41
1jtvmay,Maleficent-Ad560,Are we celebrating again if it goes below a penny?,1,1744092145.0,2025-04-08 06:02:25
1jtvmay,YOUbeOHkay,"Who voted for this guy! Step up, are we winning?",1,1744109261.0,2025-04-08 10:47:41
1jtvmay,Open_Bluebird_6902,Nice chart..zoom out dude 🤣 6 months for example 😂,1,1744110067.0,2025-04-08 11:01:07
1jtvmay,nightfly82,“Whales” buying?,0,1744059723.0,2025-04-07 21:02:03
1jtvmay,chr127741,Too big to fail situation.,0,1744067714.0,2025-04-07 23:15:14
1jtvmay,Odd_Stick_3042,Down 100% - correction.. up - 15%… going to the moon soon..,0,1744116941.0,2025-04-08 12:55:41
1jtvmay,To_peach_is_own,"Lol, clowns 😂🤣😂🤣",0,1744308200.0,2025-04-10 18:03:20
1jtvmay,friendly-survivor,if your average is 15 cents you'll be fine (speaking from experience),11,1744059320.0,2025-04-07 20:55:20
1jtvmay,Fizassist1,"had to sell some for a down payment on a car a week ago, but outside of unexpected expenses I'm holding 😊",5,1744061784.0,2025-04-07 21:36:24
1jtvmay,BeerPowered,fr fr. patience pays 🫡,3,1744067209.0,2025-04-07 23:06:49
1jtvmay,ArtInfinite5179,I had no choice but to hodl im way to far in the red 😂😭,3,1744062881.0,2025-04-07 21:54:41
1jtvmay,MikeDickBeinchin,I panic bought lol,2,1744152692.0,2025-04-08 22:51:32
1jtvmay,GJustGotaBag,They’d have to take all of it from me before I sell any for what the actual value is… Good luck,1,1744071631.0,2025-04-08 00:20:31
1jtvmay,69yourMOM,lol the first half…. Was buying it for under 5 cents and cashing out when the majority of people did during the pandemic. Had that run happened this year I think a lot less would have fully cashed out. But with Elon losing so much money over the last month.. maybe he’ll pump it a few more times lol.,2,1744076731.0,2025-04-08 01:45:31
1jtvmay,nickert0n,Yes don't sell until 40 or higher . It will go when everything turns around,5,1744085097.0,2025-04-08 04:04:57
1jtvmay,Chris_Torts,It came today second I woke up and checked my account it was there.. next was buy doge!..,1,1744212292.0,2025-04-09 15:24:52
1jtvmay,CardiologistGloomy85,And back down.,2,1744176589.0,2025-04-09 05:29:49
1jtvmay,Odd_Stick_3042,I agree.,1,1744177184.0,2025-04-09 05:39:44
1jtv575,Gohan335i7,![gif](giphy|mz7iww9tCUnJJeZvGN|downsized),1,1744071455.0,2025-04-08 00:17:35
1jtu5jr,catshitbreath,what scale is it? 1:64?,11,1744057416.0,2025-04-07 20:23:36
1jtu5jr,Elvy2006,I don't want one. I want to get the crappiest car make make it a sleeper.,6,1744057007.0,2025-04-07 20:16:47
1jtu5jr,SithC,Matchbox new release?,3,1744057787.0,2025-04-07 20:29:47
1jtu5jr,FinalHeaven88,I'm getting a grabber blue mustang gt. I'm modest.,3,1744065628.0,2025-04-07 22:40:28
1jtu5jr,RunItupBaby,Sexy,2,1744056358.0,2025-04-07 20:05:58
1jtu5jr,coronaflo,At least it's not a fugly cybertruck.,2,1744059173.0,2025-04-07 20:52:53
1jtu5jr,AnalogueBoy1992,I'm buying a gold colour tomica...I'm getting 2,2,1744086356.0,2025-04-08 04:25:56
1jtu5jr,fab-zed,"Finally some classic doge coin talk [https://hips.hearstapps.com/hmg-prod/images/vol-24-lamborghini-countach-1-66acf1fd95736.jpg?crop=0.784xw:0.662xh;0.146xw,0.237xh&resize=2048:*](https://hips.hearstapps.com/hmg-prod/images/vol-24-lamborghini-countach-1-66acf1fd95736.jpg?crop=0.784xw:0.662xh;0.146xw,0.237xh&resize=2048:*)",1,1744057741.0,2025-04-07 20:29:01
1jtu5jr,Academic-Doctor-6829,Is that a toy car ? 🤣,1,1744078315.0,2025-04-08 02:11:55
1jtu5jr,SecretSquirrel8888,I'm dedicating my Lambo to  Kabosu. RIP legend.,1,1744245196.0,2025-04-10 00:33:16
1jtu5jr,WallStrt_Tony,Wen Lambo?,1,1744277291.0,2025-04-10 09:28:11
1jtu5jr,N/A,[deleted],0,1744061829.0,2025-04-07 21:37:09
1jtu5jr,Ambitious-Apple1125,probably just the ink on the paper,2,1744191487.0,2025-04-09 09:38:07
1jtu5jr,mr3v3rlast,Big boy toy 🤓,1,1744107842.0,2025-04-08 10:24:02
1jtu5jr,mr3v3rlast,Meme or not… we getting this shmomey!,1,1744107901.0,2025-04-08 10:25:01
1jtswuc,Common-Stick5229,How about you just relax and play the long game,17,1744052166.0,2025-04-07 18:56:06
1jtswuc,PastaVeggies,.15 you have nothing to worry about,4,1744053110.0,2025-04-07 19:11:50
1jtswuc,C300w204,Is this a joke,2,1744065972.0,2025-04-07 22:46:12
1jtswuc,Longjumping_Town_227,Is this a joke? Hope u get cooked joking around like this,2,1744072751.0,2025-04-08 00:39:11
1jtswuc,lalvapalooza,"If one thinks they are cooked, they have already deep fried themselves - Socrates",2,1744076244.0,2025-04-08 01:37:24
1jtswuc,Away-Assistant-7577,your post remind me of the guys from the 30 cent bracket   ![gif](giphy|C6JQPEUsZUyVq),2,1744059454.0,2025-04-07 20:57:34
1jtswuc,BigMoneyBrad007,bro stop put ur phone down,1,1744086906.0,2025-04-08 04:35:06
1jtswuc,Thisisfinek,In times like this when everyone is fearful is the best time to dca.,1,1744109860.0,2025-04-08 10:57:40
1jtswuc,cooterbutt,Hope you held,1,1744242916.0,2025-04-09 23:55:16
1jtswuc,Useful_Divide7154,"Same here, my plan is to hold for a couple years and aim for 3 to 5x returns. Will buy more if it falls below 6 cents.",1,1744061108.0,2025-04-07 21:25:08
1jtswuc,Easy_GameDev,"I'm going to sell all my dogecoin, when it hits $7",1,1744075465.0,2025-04-08 01:24:25
1jtswuc,jgarcya,My average is .12  I'm not buying until it hits .10  But I'll spend half of my available cash .. to make sure I can still buy the next 3 dips.,0,1744055975.0,2025-04-07 19:59:35
1jtswuc,Bax3r,I’ve been playing it… I thought this would break previous ATH and didn’t sell,0,1744053149.0,2025-04-07 19:12:29
1jtswuc,Bax3r,Yeah I think I’ll wait it out if it falls to let’s say 6 cents i’ll average down,1,1744053221.0,2025-04-07 19:13:41
1jtswuc,Bax3r,Hope we don’t see posts from the 00 bracket,3,1744059511.0,2025-04-07 20:58:31
1jtswuc,Bax3r,"I’ll just wait if it drops below 10 cents and do a huge buy and pray there’s no more dips… Somebody said on here 0.6 is the absolute bottom, but nobody knows with crypto I guess",2,1744056083.0,2025-04-07 20:01:23
1jtswuc,False_Decision_610,well that was silly especially once you’ve seen everything that has happened since inauguration day. You had multiple chances to sell for a very decent profit,4,1744070112.0,2025-04-07 23:55:12
1jtswuc,Merlin1039,It'll never break ATH again. It'll go up and down but the pipe dreams of $1 are just that,-1,1744075919.0,2025-04-08 01:31:59
1jtswuc,ArtInfinite5179,If it hits 6 cents you’ll be waiting another 4 years before another run,6,1744053278.0,2025-04-07 19:14:38
1jtswuc,ReflexNeedsBuff,I mean just looking at the bottom over the last 4 years .06 is a pretty hard bottom. I say buy below .10,2,1744072493.0,2025-04-08 00:34:53
1jtswuc,Bax3r,Yeah I know I messed up,1,1744072536.0,2025-04-08 00:35:36
1jtswuc,Bax3r,I don’t think anything crazy is gonna happen in the next 3 years anyway,-2,1744053316.0,2025-04-07 19:15:16
1jtswuc,Telemetris,Me too man. I was up 10 gs on 31000 doge with .12 buy in. I thought the bitcoin reserve would boom us but nope. Continued to hold until a month ago i sold at .155 for a tenth of what i could have...meanwhile .15 seems like it could be the floor.    Oof.   I regret selling and maybe you will too at this pp,2,1744112778.0,2025-04-08 11:46:18
1jtswuc,RunItupBaby,I think your cooked,-2,1744053932.0,2025-04-07 19:25:32
1jtswuc,Bax3r,If it drops below 10 I’ll do a substantial buy and sell at 40… if I see it again ever 😆😆,2,1744114779.0,2025-04-08 12:19:39
1jtsm0e,C300w204,"I chipped more yesterday, for now im chilling",6,1744053059.0,2025-04-07 19:10:59
1jtsm0e,LidiaSelden96,"Honestly, I’m just waiting for the moon to hit, lol.",3,1744054513.0,2025-04-07 19:35:13
1jtsm0e,Away-Assistant-7577,"if youre looking for the perfect position, youve already lost",3,1744057594.0,2025-04-07 20:26:34
1jtsm0e,RunItupBaby,Pfft… all day everyday. Stack that Doge,6,1744054325.0,2025-04-07 19:32:05
1jtsm0e,angelwolf71885,At $0.13 👀,2,1744092655.0,2025-04-08 06:10:55
1jtsm0e,Sizododayladyyu,"I’ve been picking up DOGE whenever I get the chance and also farming rewards by playing Boinkers on TG. Every time I send a Boinker to the moon, I earn rewards, it’s a fun way to build up.",1,1744105209.0,2025-04-08 09:40:09
1jtsm0e,natasevres,”Bullish”  Even a dead cat bounces atleast once after it falls,1,1744149548.0,2025-04-08 21:59:08
1jtsm0e,Fancy_Abrocoma_7861,"If your impatient wait for .085 to .10, if your really patient wait for .04 to .06.  People will not like hearing that though.",1,1744152952.0,2025-04-08 22:55:52
1jtsm0e,Easy_GameDev,"I put in 1k a month, do I contribute at all or is it moot? Should I stop?",0,1744077219.0,2025-04-08 01:53:39
1jtsm0e,TheWizardSnoot,"This is the way, waiting to see if tomorrow is bloody, if it is, we buy again at discount",4,1744076703.0,2025-04-08 01:45:03
1jtsm0e,angelwolf71885,The perfect position is lower then your current average and when you see giant dips like the last one to $0.13,1,1744092742.0,2025-04-08 06:12:22
1jtojbm,dmillibeats,Yah don’t buy doge,0,1744049314.0,2025-04-07 18:08:34
1jtn7hh,RepostSleuthBot,"Looks like a repost. I've seen this image 76 times.  First Seen [Here](https://redd.it/10dj9z5) on 2023-01-16 100.0% match. Last Seen [Here](https://redd.it/1hpqgc1) on 2024-12-30 100.0% match  [View Search On repostsleuth.com](https://www.repostsleuth.com/search?postId=1jtn7hh&sameSub=false&filterOnlyOlder=true&memeFilter=false&filterDeadMatches=false&targetImageMatch=80&targetImageMemeMatch=97)  ---  **Scope:** Reddit | **Target Percent:** 80% | **Max Age:** None | **Searched Images:** 792,314,487 | **Search Time:** 4.62645s",1,1744037804.0,2025-04-07 14:56:44
1jtn7hh,ngronnie,I’ll be holding past $1,9,1744038244.0,2025-04-07 15:04:04
1jtn7hh,Fun_Raise_7858,👍,3,1744052686.0,2025-04-07 19:04:46
1jtn7hh,WilyWascallyWizard,![gif](giphy|3oEjHV0z8S7WM4MwnK),3,1744040075.0,2025-04-07 15:34:35
1jtmj22,greedybatman,I'm still trying to understand the question.,5,1744036233.0,2025-04-07 14:30:33
1jtmj22,XxCotHGxX,All countries use the same DOGE,3,1744036811.0,2025-04-07 14:40:11
1jtmj22,N/A,I'll trade 17 for 1 bitcoin,2,1744036986.0,2025-04-07 14:43:06
1jtmj22,Fulvio55,#What? 🙀   There’s no such thing.,2,1744067398.0,2025-04-07 23:09:58
1jtmj22,Gaping_Maw,1 doge = 1 doge,3,1744036420.0,2025-04-07 14:33:40
1jtmj22,Jusssoguod,You wanna buy a koala coin ?,1,1744123676.0,2025-04-08 14:47:56
1jtm8ay,mcfool123,"Been doing this every year, shhhhhhh.",3,1744049263.0,2025-04-07 18:07:43
1jtm8ay,Accurate_Sorbet_251,Because it’s going to be a red year?,1,1744049493.0,2025-04-07 18:11:33
1jtm8ay,Specialist_Meal_7891,I won't tell if you won't 👀,2,1744049586.0,2025-04-07 18:13:06
1jtm8ay,Specialist_Meal_7891,Primarily yes thats the joke,3,1744049537.0,2025-04-07 18:12:17
1jtlq0u,Southern-Young-2389,"And for crypto, utilization, adaptation is most important",2,1744034644.0,2025-04-07 14:04:04
1jtlq0u,Southern-Young-2389,Market cap is how you see worth not the price,2,1744034578.0,2025-04-07 14:02:58
1jtlq0u,chr127741,Yet it’s still got a higher price than doge Dumb crypto math…,1,1744149415.0,2025-04-08 21:56:55
1jtlq0u,Southern-Young-2389,Melania token has none,1,1744034707.0,2025-04-07 14:05:07
1jtkmsp,William195,I’ve averaged down from around .36 to about .24 over the last couple of months. Went from .26 to .24 in just a couple of days. Happy with my progress tbh,4,1744034567.0,2025-04-07 14:02:47
1jtkmsp,Ambitious-Apple1125,![gif](giphy|tQqDJHTbHHRMiEN00k),6,1744031573.0,2025-04-07 13:12:53
1jtkmsp,myironcity,![gif](giphy|5xtDarqlsEW6F7F14Fq|downsized),2,1744033501.0,2025-04-07 13:45:01
1jtkmsp,Southern-Young-2389,You miss this round bottom this morning,2,1744030924.0,2025-04-07 13:02:04
1jtkmsp,lsdviisine,That’s what I get for waiting,4,1744030944.0,2025-04-07 13:02:24
1jtkmsp,Southern-Young-2389,"Hope for good week, market now is in shocks and very delicate for any news, rebound or more sell off",2,1744031116.0,2025-04-07 13:05:16
1jtk0of,napoelonDynaMighty,Where were you from 2021-2024?,67,1744029933.0,2025-04-07 12:45:33
1jtk0of,villefilho,still waiting to sell at the lowest value,16,1744035398.0,2025-04-07 14:16:38
1jtk0of,Ambitious-Apple1125,![gif](giphy|fXnRObM8Q0RkOmR5nf),32,1744029296.0,2025-04-07 12:34:56
1jtk0of,Yoder_TheSilentOne,0.0018 lowest ive seen due to covid,16,1744030425.0,2025-04-07 12:53:45
1jtk0of,RichMisc90,"Did you just started looking at charts? Bro we was at .10 like four months ago, before election",6,1744067242.0,2025-04-07 23:07:22
1jtk0of,SlappyMcLovin,![gif](giphy|gHFi5N6uU3TLq),6,1744070322.0,2025-04-07 23:58:42
1jtk0of,waloshin,I bought when it was not even a penny… I’ve seen much lower…,6,1744046875.0,2025-04-07 17:27:55
1jtk0of,Eddy97501,I feel aorry for the people who dumped thouasands at 30 o higher,5,1744049157.0,2025-04-07 18:05:57
1jtk0of,TheLostMiddle,It was at 0 when I started mining it.,6,1744041594.0,2025-04-07 15:59:54
1jtk0of,ParksDontBsuspicious,I am waiting for single digits,6,1744039922.0,2025-04-07 15:32:02
1jtk0of,kinkycrypto,So you’ve only been in like 5-6 months lol welcome to crypto,5,1744039651.0,2025-04-07 15:27:31
1jtk0of,President-Fish,"Best price in a while, get it now if your looking long for doge",4,1744043938.0,2025-04-07 16:38:58
1jtk0of,Suspicious_Ad7384,Who would buy this above .05 and think it's a sure thing is beyond me.,7,1744030725.0,2025-04-07 12:58:45
1jtk0of,ieatmoondust,Bought mine at 8 cents like a year ago if that.,2,1744041023.0,2025-04-07 15:50:23
1jtk0of,carguy6912,"I was in, in 2018",2,1744045521.0,2025-04-07 17:05:21
1jtk0of,blue_bomber508,"My av cost was 0.138, was going to buy and blinked, just missed that dip now sitting at ave 0.143. Thank you dogeey",2,1744045927.0,2025-04-07 17:12:07
1jtk0of,Commercial_Break1471,U musta been born yesterday,2,1744047567.0,2025-04-07 17:39:27
1jtk0of,V3ndeTTaLord,Huh? 1 doge is still 1 doge. Next!,3,1744053949.0,2025-04-07 19:25:49
1jtk0of,nightfly82,"Was buying/swing trading doge back in 2021-2022 Around end of October 2023 doge was at 6 cents. A few weeks later it shot up to 10 cents, sold and bought back at 7 cents. Since then the majority of my buying has been 8-10 cents range (did buy some more in the teens but not as much)  My DCA is around 9 cents now. Hope we don’t see those prices again. I’d really prefer a rebound. But if we do dip into below 10 cents range than maybe I will buy some more  Not even sure where resistance price could actually be at the way the market is dropping so fast",2,1744031300.0,2025-04-07 13:08:20
1jtk0of,gSrikar,Missed it when it dipped.,2,1744036518.0,2025-04-07 14:35:18
1jtk0of,NearbySyllabub7722,0.07351 was the lowest I got in during covid.,1,1744122120.0,2025-04-08 14:22:00
1jtk0of,Sir_trades_alot,First buy was .00347,1,1744243415.0,2025-04-10 00:03:35
1jtk0of,supershimadabro,Yall gamblers fr,1,1744041140.0,2025-04-07 15:52:20
1jtk0of,ChumpChainge,I still think it’ll dip to 7 pips,1,1744062994.0,2025-04-07 21:56:34
1jtk0of,NeVeR614,There are NO TECHNICALS ON MEME COINS!!,0,1744033316.0,2025-04-07 13:41:56
1jtk0of,LDroo9,Safe bet that this isn't the bottom lmao,0,1744034188.0,2025-04-07 13:56:28
1jtk0of,Cold_Appearance_5551,How low can you go?   Lmao. This is only the beginning.,0,1744034610.0,2025-04-07 14:03:30
1jtk0of,dracokingz,Wait after the 9th Timmmmbbeeeer!,0,1744074993.0,2025-04-08 01:16:33
1jtk0of,FaastEddy,"Well, I hope you sold everything you had!",-1,1744053938.0,2025-04-07 19:25:38
1jtk0of,Extra-Bumblebee5351,The New penny stock maybe when 2050 comes like a movie back in 2006 we gone be 45-55 old,-4,1744035809.0,2025-04-07 14:23:29
1jtk0of,Extra-Bumblebee5351,Wasn’t buying stock or crypto my friend told me it was at .1 cent 2020 covid,-33,1744030038.0,2025-04-07 12:47:18
1jtk0of,stannndarsh,"It was lower than this for years, but I was buying the joke in 2018",2,1744042595.0,2025-04-07 16:16:35
1jtk0of,Temporary-Setting714,Yeah. Just looked at robinhood buys.  .00162. 3-13-2020,1,1744040003.0,2025-04-07 15:33:23
1jtk0of,Extra-Bumblebee5351,😂😂,0,1744047624.0,2025-04-07 17:40:24
1jtk0of,flinginlead,USB dual miners and gridseed orbs!,1,1744163382.0,2025-04-09 01:49:42
1jtk0of,Vengeful_Doge,This is when we really see the whales start to sell. So many of them are in that .03 to .06 range. I feel like when it drops to .10 we're gonna see massive sell offs.  I'm just waiting for that so I can average out.,1,1744074452.0,2025-04-08 01:07:32
1jtk0of,MyWeedsYoWeed,Buy using different accounts. The Capital Gains tax is real so when I buy a significant amount of a coin I already own? I use a new account so my holding period acquired date doesn’t change.,1,1744076439.0,2025-04-08 01:40:39
1jtk0of,Extra-Bumblebee5351,You should see my prize pick,2,1744063057.0,2025-04-07 21:57:37
1jtk0of,liquid_at,"There are no meme coins...  But if there were meme coins, technical analysis of trader sentiment would be the best way to get actual data.",1,1744047386.0,2025-04-07 17:36:26
1jtk0of,Bitcoin_Chaca,? The 9th? Whatup?,1,1744076967.0,2025-04-08 01:49:27
1jtk0of,Extra-Bumblebee5351,Sold lmaooo the point is to keep it till 2050   Sell it when it’s like $5 bucks a pop or $10,3,1744063208.0,2025-04-07 22:00:08
1jtk0of,List-Beneficial,Fcking lol. Yo I got some options to sell you.,24,1744034195.0,2025-04-07 13:56:35
1jtk0of,Temporary-Setting714,.00162.  Lowest i bought.,0,1744039909.0,2025-04-07 15:31:49
1jtk0of,Extra-Bumblebee5351,😂,2,1744063024.0,2025-04-07 21:57:04
1jtk0of,dracokingz,Tariffs deadline,1,1744125548.0,2025-04-08 15:19:08
1jtk0of,FaastEddy,that was sarcasm... lol,3,1744063311.0,2025-04-07 22:01:51
1jtk0of,Ledairyman,How rich are you now?,1,1744057015.0,2025-04-07 20:16:55
1jtk0of,NovoNB,Sold at 0.002,2,1744065560.0,2025-04-07 22:39:20
1jthuoo,jfgonzales,"Do doge coins make you a millionaire? Yeah, if you were a billionaire.",9,1744058773.0,2025-04-07 20:46:13
1jthuoo,ExempliGratiaEG,Anything about 0.06 is a profit to me. Diamond hands forever,11,1744034862.0,2025-04-07 14:07:42
1jthuoo,Low-Hold-8563,"👏,  it's less painful for second time. I was here in 2021.",6,1744049495.0,2025-04-07 18:11:35
1jthuoo,TinyTanks2122,What’s the point if everything costs a gabillion dollars and people are looting in the streets. FDT.,3,1744193926.0,2025-04-09 10:18:46
1jthuoo,RiceDogo,"You only lose when you sell, bro.",7,1744045966.0,2025-04-07 17:12:46
1jthuoo,WietGetal,Bro just turn off your crypto notifications and forget about it. In 5 years its either more or less money. Wich shouldn't really matter tbh because as a responsible adult i assume you only used money you can miss.,5,1744077500.0,2025-04-08 01:58:20
1jthuoo,ashurgujjar,Yas future coin,2,1744079226.0,2025-04-08 02:27:06
1jthuoo,Individual-Word4408,This is more like it.,2,1744087878.0,2025-04-08 04:51:18
1jthuoo,Kino1337,What is this? The ubisoft crew?,1,1744021112.0,2025-04-07 10:18:32
1jthuoo,Salt_Alfalfa9529,We are all exit liquidity my friends.,1,1744040580.0,2025-04-07 15:43:00
1jthuoo,Ok-Scale6404,"I wish it goes to .03, i would be buying for sure",1,1744050230.0,2025-04-07 18:23:50
1jthuoo,MrEklipze,this week will be a rough one for diamond hands,0,1744027926.0,2025-04-07 12:12:06
1jthuoo,Fast_Quality_2007,Fire sale 🤑🤑 we finally get to join the 2021 hodlers and be able to say things like I bought at .03 hahaha isnt this great for everyone where the I bought at .03 hodlers lmao keep hodling isnt that what doge is for to be able say I bought .03,-4,1744021273.0,2025-04-07 10:21:13
1jthuoo,Pugnaceous,Same.,3,1744153417.0,2025-04-08 23:03:37
1jthp19,lekhosi,Thanks for your sacrifice,5,1744031723.0,2025-04-07 13:15:23
1jthp19,RunItupBaby,Thanks bro 😎,3,1744037267.0,2025-04-07 14:47:47
1jthp19,manctrev1974,Legend,2,1744041324.0,2025-04-07 15:55:24
1jthp19,Accurate_Sorbet_251,"Did the same thing, sold everything and tried to get back in lower. I got about 500 extra doge out of it but the stress really wasn’t worth it.",2,1744049802.0,2025-04-07 18:16:42
1jthp19,xBlitzgewitter,Ty bro,2,1744065907.0,2025-04-07 22:45:07
1jthp19,Ambitious-Apple1125,![gif](giphy|bjB3gtFvREqqr5NAHW),2,1744020968.0,2025-04-07 10:16:08
1jthp19,Murder831x,I should have sold some at 18 cent and then rebought it right now 😑,1,1744142282.0,2025-04-08 19:58:02
1jtfl8c,Boon_Rebu,"Buy low, sell high.    Buy high, sell low.  HODL  There are many paths, only you can choose yours.",13,1744011003.0,2025-04-07 07:30:03
1jtfl8c,PastaVeggies,History will be on the verge of repeating itself for years FYI,2,1744029186.0,2025-04-07 12:33:06
1jtfl8c,Treeman1979,By not investing in this very unstable coin with an even more unstable leader.,4,1744027084.0,2025-04-07 11:58:04
1jtfl8c,Harha,There's no long-term stability in DOGE because it's a meme and nothing more. I can't believe some people actually spend significant amounts of money on it.,2,1744014543.0,2025-04-07 08:29:03
1jtfl8c,Funny_Engineering_15,My plan is to complain until it recovers too much to be worth buying back in,1,1744110010.0,2025-04-08 11:00:10
1jtfl8c,SirBankz,Buying low and selling high is one of a great strategy.,5,1744011090.0,2025-04-07 07:31:30
1jtfl8c,Commercial_Break1471,Booooo,2,1744078125.0,2025-04-08 02:08:45
1jtfl8c,lalvapalooza,There is no leader you doofus,2,1744088380.0,2025-04-08 04:59:40
1jtfl8c,Gloomy_Setting5936,"I can’t believe some people actually spend significant amounts of money on your mom, but here we are 😅",-2,1744019849.0,2025-04-07 09:57:29
1jtfl8c,nickert0n,"It is actually much more, its a currency and is being used as such.",1,1744053118.0,2025-04-07 19:11:58
1jtfl8c,Treeman1979,lol. You’re right. What musk does has zero influence over DOGE. All of these post about to the moon and history repeating itself are kinda exhausting.,0,1744089549.0,2025-04-08 05:19:09
1jtfl8c,GaslightGlen,At least in a video game you’d have 10+ Strength from holding all those virtual bags.,3,1744032363.0,2025-04-07 13:26:03
1jtfl8c,GrimbosliceOG,Where?,1,1744057052.0,2025-04-07 20:17:32
1jtfl8c,WilyWascallyWizard,Go away,-1,1744249092.0,2025-04-10 01:38:12
1jtfl8c,Typical_gut,Some stores support cryptocurrency,1,1744073689.0,2025-04-08 00:54:49
1jtfl8c,GrimbosliceOG,Where? Are you spending it as currency? Generic answer is generic.,0,1744074102.0,2025-04-08 01:01:42
1jtfil6,Adirato1,My balls are a sign,18,1744037301.0,2025-04-07 14:48:21
1jtfil6,Blazekyre,The chief’s out there somewhere,8,1744010733.0,2025-04-07 07:25:33
1jtfil6,LEWDOGGER22,What’s the sign?,5,1744033564.0,2025-04-07 13:46:04
1jtfil6,Truthfullyseeker,Well at this point just hold the bag. We either see a bull run at the end of the year or during midterms elections.,3,1744074994.0,2025-04-08 01:16:34
1jtfil6,Ohio-life,I'm in at .08. Saw it go up. Then down. Then up this last year. Bought a car with some profit. Now just waiting to buy more. What's everyone's target buy in?,3,1744127925.0,2025-04-08 15:58:45
1jtfil6,nightfly82,"Sign alright, sign of going down into the shadows and staying there for who knows how long. Good news is a good majority of YouTube crypto influencers have disappeared, as well as “whales buying” news articles  Once those start returning with “doge to $5,$10 etc etc” price predictions  It’s prob a top signal",4,1744022619.0,2025-04-07 10:43:39
1jtfil6,3ugeye,![gif](giphy|l4pTdC5oYg3xKoQ1O|downsized),1,1744045368.0,2025-04-07 17:02:48
1jtfil6,Similar-Inevitable42,"I got in at 0,40 - will buy more when Doge hits 1 eur",1,1744105886.0,2025-04-08 09:51:26
1jtfil6,ConcentrateLeast2864,Nothing compares to BTC!!!!!!,1,1744037266.0,2025-04-07 14:47:46
1jtfil6,iTZBLaSToFFTiMe,It’s a sign alright… “Going out of business.”,0,1744036853.0,2025-04-07 14:40:53
1jtfil6,Truthfullyseeker,Lol that’s funny!,1,1744075057.0,2025-04-08 01:17:37
1jtfil6,Joztek,Exactly,1,1744077020.0,2025-04-08 01:50:20
1jtfil6,Bitcoin_Chaca,"OMG so true about those influencers and analysts. How about crypto expert Trader Tardigrade. “Doge recently broke out of a converging triangle, a pattern often associated with the start of a bullish trend and is still expanding rapidly after its weekly golden cross and currently trading above the macro golden pocket at $0.26.” What? Pocket?",5,1744078484.0,2025-04-08 02:14:44
1jtfil6,rasco_88,Those articles are more painful than losing the money!,2,1744057752.0,2025-04-07 20:29:12
1jtfhlc,Gohan335i7,"Please God, I need this … lol. Getting tired boss…  ![gif](giphy|NBYI7ptF9JurS)",5,1744011013.0,2025-04-07 07:30:13
