post_id,author,body,score,created_utc,date
1jtephd,ur_rad_dad,This is what you all voted (or chose not to vote/3rd party). Seriously.  We warned you.,1,1744059195.0,2025-04-07 20:53:15
1jtephd,mcfaillon,Can’t you see all this winning is making us loose Mr President,1,1744059733.0,2025-04-07 21:02:13
1jtephd,Free-Refrigerator-96,Get used to it. And it's about to get much worse 🤨,1,1744115359.0,2025-04-08 12:29:19
1jtephd,DeadlyCareBear,"Glad i sold a long time ago. Always liked the community here, the flow of the Doge-Coin, the raises, memes etc.. But Elon and his Puppet ruined it completely. I dont want my money in anything related to them. Sorry for Doge-Coin, and sorry that the purehearted dog gets abused by these people. But i am out of Doge-Coin, simply because of these dictators.",-1,1744025292.0,2025-04-07 11:28:12
1jtephd,tgwaste,Why? Let it tank and buy a bunch more on sale.,-1,1744008172.0,2025-04-07 06:42:52
1jtephd,SRJ342,This is what happens when you buy thin air boys and girls.,0,1744015905.0,2025-04-07 08:51:45
1jtephd,Fru1tLo0psy,This is an absolutely wonderful long awaiting time 😊.  Couldn't be more excited for this.  Hallelujah 🙏.  Now everyone gets to buy Dogecoin at a discount.  🥳🥳🥳,0,1744023825.0,2025-04-07 11:03:45
1jtephd,bluecebin,I think 8 cents rock bottom.,-1,1744009774.0,2025-04-07 07:09:34
1jtephd,Vette_Guy482,I do keep dropping I’ll buy more at $0.05,0,1744013565.0,2025-04-07 08:12:45
1jtephd,Physical_Invite5925,SELL BABY SELL !!! JUST SAYING 😂,0,1744016661.0,2025-04-07 09:04:21
1jtephd,radical01,Hopefully it drops further. The economy is crashin.,0,1744025256.0,2025-04-07 11:27:36
1jtephd,StrungOut147,Didn't Americans elect this guy? Yall did this lol,0,1744028421.0,2025-04-07 12:20:21
1jtephd,Odd-Negotiation2779,I love it looking to add to some zeros before the .13,0,1744029336.0,2025-04-07 12:35:36
1jtephd,Top-Beginning2560,So glad I sold😆,0,1744029670.0,2025-04-07 12:41:10
1jtephd,PresentImagination53,Im in tears,0,1744030714.0,2025-04-07 12:58:34
1jtephd,snorlaxtubbs,No one like that,0,1744031746.0,2025-04-07 13:15:46
1jtephd,tehoway,At least you have the option to sell. Mine was in the old dogecoin wallet and the app doesn't even open anymore.,0,1744032176.0,2025-04-07 13:22:56
1jtephd,BitOfAll_NYC,Nothing to like... We been scamed,0,1744035205.0,2025-04-07 14:13:25
1jtephd,Joztek,I love it!!! 🙏🙏 and this is coming from a guy that has 75k coins at .18 average. I want it to go down to .06 so bad! I got 10k I am ready to spend but I am Waiting on it to hit bottom so I can load up. I really hope he keeps going down but I just don’t know that it will. My guess is .09 will be the bottom unless we get lucky and it goes further,0,1744041657.0,2025-04-07 16:00:57
1jtephd,livens,I do. Bring it back down to my 0.04 average :). If it gets that low I'm buying $$$$.,0,1744052190.0,2025-04-07 18:56:30
1jtephd,Able_Magazine_8150,The art of the deal. Let him cook,0,1744054093.0,2025-04-07 19:28:13
1jtephd,Healthy-Falcon1737,First time? Lolol back to .05,0,1744055683.0,2025-04-07 19:54:43
1jtephd,No-Past-4850,Still plenty to go until the bottom,0,1744055791.0,2025-04-07 19:56:31
1jtephd,Commercial_Ease8053,lol Trump has been president for 2 months… he has  46 to go man. Get used to it. Shib and doge are dead. No more lambos.,0,1744057141.0,2025-04-07 20:19:01
1jtephd,N/A,Time to buy soon,0,1744061253.0,2025-04-07 21:27:33
1jtephd,Even_Association_467,My .08¢ bottom is looking right,0,1744062541.0,2025-04-07 21:49:01
1jtephd,curvedbymykind,It’s prob going to 0.05,0,1744064022.0,2025-04-07 22:13:42
1jtephd,Gothy_girly1,The coin that shares a name with super hated fake government department is doing poorly i shocked shocked I say,0,1744068209.0,2025-04-07 23:23:29
1jtephd,ChingChingLing,But..it's happening!,0,1744068462.0,2025-04-07 23:27:42
1jtephd,Mundane-Bluebird-338,🤔...at two cents it will stop.,0,1744070566.0,2025-04-08 00:02:46
1jtephd,El_Burr0,I use to like crypto until I lost my money and realized that it has no utility to it and it only exists to pump and dump.,0,1744072938.0,2025-04-08 00:42:18
1jtephd,Ten-Spot-4u,Buy again at .05.,0,1744075768.0,2025-04-08 01:29:28
1jtephd,General-Philosophy40,Ahh here comes the .01 doge buy the tip of the dip,0,1744075828.0,2025-04-08 01:30:28
1jtephd,Fatcapz,Come on guys. We must be honest with ourselves.,0,1744119510.0,2025-04-08 13:38:30
1jtephd,Excellent-Piglet-655,What happened to “Doge to $1 by March”?? Hahaha🤣🤣🤣,0,1744126672.0,2025-04-08 15:37:52
1jtephd,EdzysssGaming,Thank everyone who voted for that Duck,0,1744134211.0,2025-04-08 17:43:31
1jtephd,r_snchz8,HODL and buy moar!!!,0,1744215941.0,2025-04-09 16:25:41
1jtephd,UnevenElephant3,Diamond hands!,0,1744221795.0,2025-04-09 18:03:15
1jtephd,TodaysThoughts21,"Well, you should be able to sell now if that was what your looking for, it's up to 0.16",0,1744232793.0,2025-04-09 21:06:33
1jtephd,Agitated-Travel2506,💎🙌,0,1744256090.0,2025-04-10 03:34:50
1jtephd,TheNoblePrince,Looks like I'll finally be able to get my .12 average from 2021 down,-1,1744012643.0,2025-04-07 07:57:23
1jtephd,Patient_Artichoke355,I’m sorry.. I think we were had.. I think we were sold a bill of goods by some unsavory people whose intentions were to make money off of us,-1,1744023841.0,2025-04-07 11:04:01
1jtephd,templekev14,We’re supposed to be in alt season now…,-1,1744029306.0,2025-04-07 12:35:06
1jtephd,Financial-Block9817,Bought in at 0.04. I’m eyeing a drop under 10 and then im buying more.,-1,1744030267.0,2025-04-07 12:51:07
1jtephd,LastSide8008,You idiots still buy crypto? Lol,-1,1744032441.0,2025-04-07 13:27:21
1jtephd,R3d_Man,"You shouldn't have bought into a meme coin, then.",-1,1744043704.0,2025-04-07 16:35:04
1jtephd,Byro1218,We didn’t thank JD enough,176,1744009267.0,2025-04-07 07:01:07
1jtephd,No-Efficiency8991,._.,2,1744115778.0,2025-04-08 12:36:18
1jtephd,SnooDrawings5837,"I feel u man, I have a 0.35 average, was looking at selling by end of May, not sure about that anymore though",24,1744014356.0,2025-04-07 08:25:56
1jtephd,Fru1tLo0psy,Buy more... It's on sale right now.  🙏,36,1744023898.0,2025-04-07 11:04:58
1jtephd,GasHistorical9316,My avg was .38 now it’s .175,5,1744046714.0,2025-04-07 17:25:14
1jtephd,N/A,[deleted],13,1744020453.0,2025-04-07 10:07:33
1jtephd,OldboyCrypt,Same boat. GLTA,2,1744031895.0,2025-04-07 13:18:15
1jtephd,humandisaster93,Glad to see we in that boat together,2,1744037934.0,2025-04-07 14:58:54
1jtephd,humandisaster93,Glad to see we in that boat together,1,1744037939.0,2025-04-07 14:58:59
1jtephd,Oddyseous420,Or you can buy more now that it's low and lower your average?,1,1744173772.0,2025-04-09 04:42:52
1jtephd,PublicLogical5729,"There might be a chance to buy much lower, very soon",2,1744189221.0,2025-04-09 09:00:21
1jtephd,DontTrustGoverment_,"I bought it yesterday at 0.15.. like you, I could have got it cheaper a few hours later, but you can not time the market. It's a great time to buy.",9,1744026094.0,2025-04-07 11:41:34
1jtephd,Problemchild2001,I keep buying the dip im all out it keeps dipping,24,1744011705.0,2025-04-07 07:41:45
1jtephd,schaudhery,"Ah yes, rapidly or in several years. Way to cover your bases.",8,1744023419.0,2025-04-07 10:56:59
1jtephd,Positive-Gur-3150,You will probably never burn the coins fast enough for doge coin,1,1744020555.0,2025-04-07 10:09:15
1jtephd,Top_Bed461,Economy or stock markets?,3,1744130927.0,2025-04-08 16:48:47
1jtephd,TranslatorNo8445,The negotiations are happening just without us he is making China great again,19,1744019179.0,2025-04-07 09:46:19
1jtephd,dynoman7,We don't negotiate with terrorists.,-4,1744032091.0,2025-04-07 13:21:31
1jtephd,Shellilala,"Mine are basically freeeeeeeeeee. But, I havent gotten any more for a long time. I sold enough during ath to cover my initial investment . Been hodling ever since .   I'll not sell   ![gif](giphy|QllMtxNIGXghulVpJA)",1,1744220683.0,2025-04-09 17:44:43
1jtephd,Positive-Gur-3150,I see it dropping lower,6,1744020609.0,2025-04-07 10:10:09
1jtephd,ChaBoiFletch,".09-.10, I think true value last year was 0.07",2,1744046017.0,2025-04-07 17:13:37
1jtephd,Shellilala,Might be ![gif](emote|free_emotes_pack|shrug),1,1744220570.0,2025-04-09 17:42:50
1jtephd,Shellilala,![gif](giphy|AzKdgBuMjU0eKPxtpV),2,1744220897.0,2025-04-09 17:48:17
1jtephd,Shellilala,So did I !!!!    ![gif](giphy|11IwpB7SH7gGUU),1,1744220814.0,2025-04-09 17:46:54
1jtephd,Status_Estimate4601,This guy understands.,2,1744046391.0,2025-04-07 17:19:51
1jtephd,Shellilala,![gif](emote|free_emotes_pack|shrug)maybe,1,1744220851.0,2025-04-09 17:47:31
1jtephd,Shellilala,"![gif](emote|free_emotes_pack|joy)I dont know . Apparently there are some ""40 year old Real Mages"" in here ![gif](emote|free_emotes_pack|feels_good_man)",1,1744221364.0,2025-04-09 17:56:04
1jtephd,jhonka_,I CANT HEAR YOU  WHAT,2,1744128734.0,2025-04-08 16:12:14
1jtephd,AdFormal3014,Stupid. You must love losing money. ,3,1744009034.0,2025-04-07 06:57:14
1jtephd,Byro1218,If dogecoin goes below.01 then we are going to see bitcoin back below 1000,12,1744009380.0,2025-04-07 07:03:00
1jtephd,Status_Estimate4601,Dude when everything crashed it was at 7ct. 1ct won't happen without some extraordinary reasons.,4,1744046545.0,2025-04-07 17:22:25
1jtephd,Shellilala,banned?  yet your still here ![gif](emote|free_emotes_pack|thinking_face_hmm),1,1744221569.0,2025-04-09 17:59:29
1jtephd,Dry-Stranger-5590,"If it goes that low, I’m buying and I don’t even like Doge, don’t even know why I’m getting recommended this🤣",2,1744008374.0,2025-04-07 06:46:14
1jtephd,firl21,You speak like it’s certain.,0,1744043598.0,2025-04-07 16:33:18
1jtephd,N0Man74,"I don't think it's his goal to destroy America. I think he's just profoundly ignorant about incompetent. He's been talking about tariffs for decades. He clearly doesn't understand how a trade deficit works and really believes that it means these other countries are doing something wrong to us. He's actually a bad negotiator, in that he doesn't want to come up with mutually beneficial deals. He just wants to ""win"" and make someone else lose. He can't conceive of both parties winning.",2,1744040259.0,2025-04-07 15:37:39
1jtephd,Rare_Wheel1907,"Oh look, a swastimeme.  Good job",1,1744114283.0,2025-04-08 12:11:23
1jtephd,WodkaGT,"See what reddit says, do exactly the opposite. Always worked for me.",5,1744009559.0,2025-04-07 07:05:59
1jtephd,Status_Estimate4601,Of course not they are 18yo and bought for 200dollar at ATH. What do they know,0,1744046995.0,2025-04-07 17:29:55
1jtephd,Merlin1039,I've seen it before. When I was working my way through college. Not sure why he thinks I want to be that poor again though,2,1744075333.0,2025-04-08 01:22:13
1jtephd,Merlin1039,You didn't. It'll be lower tomorrow,0,1744075759.0,2025-04-08 01:29:19
1jtephd,Shellilala,"I dont take advice from ""real life red mages"" ![gif](emote|free_emotes_pack|grin)",0,1744220943.0,2025-04-09 17:49:03
1jtephd,5000milesprint,"Its doge coin buddy , relax 😂",-2,1744059734.0,2025-04-07 21:02:14
1jtephd,YoDudeguy,No. It won’t. Quit fear mongering.,0,1744137688.0,2025-04-08 18:41:28
1jtephd,GuaranteedIrish-ish,So you just wasted 4 years of holding for what?,4,1744017462.0,2025-04-07 09:17:42
1jtephd,masterbatesAlot,Their names are Donald and Elon.,2,1744024098.0,2025-04-07 11:08:18
1jtephd,Merlin1039,Should have sold at .70,2,1744075553.0,2025-04-08 01:25:53
1jtephd,zongsmoke,![gif](giphy|9d7Cql3JjU7SROkV3o),64,1744054988.0,2025-04-07 19:43:08
1jtephd,Early-Size370,And you didn't wear a suit,40,1744035725.0,2025-04-07 14:22:05
1jtephd,Physical_Invite5925,"Thank you ... Mr. Vice president- JD... You may need to recall the marine - First To Fight, motto... Where ALL this is heading ???  You may TRULY CALL upon that motto once again ... Mr. Vice - President My current perspective... just saying",4,1744016972.0,2025-04-07 09:09:32
1jtephd,These-Substance6194,Buy more now and lower that average,41,1744037694.0,2025-04-07 14:54:54
1jtephd,Positive-Gur-3150,"Wait, did you buy on a downward slope and expect it to raise? lol",12,1744020454.0,2025-04-07 10:07:34
1jtephd,SnooDrawings5837,"I really want to as I could easily bring my average down to 0.30 but I’m not comfortable spending any more money rn, I’m quite tight atm as I have a holiday to pay for soon",16,1744033774.0,2025-04-07 13:49:34
1jtephd,HubristicFallacy,This!,2,1744041068.0,2025-04-07 15:51:08
1jtephd,BusinessCat85,"This guy gets it.  Keep buying.  Eat beanie weenies this month so you can buy more. I bought 5 lb bag of rice Food. Shelter up..spend no money   Buy stocks, doge, market",6,1744029171.0,2025-04-07 12:32:51
1jtephd,pumpkinwhey,You guys are crazy lol. I was trading garlic coin I mined for doge when it was like less than a cent. Before that I got thousands just for making reddit comments. I sat on it for years and forgot about it until one day I saw it had it went up crazy to like 6 or 7 cents. What’s the plan here? it’s supposed to be a currency not an investment. How many times in the past 4 years has it gone from like 10 cents to 30 cents? Why would anyone hold and not sell when it’s up when you know it’s just gonna go back down?,7,1744035317.0,2025-04-07 14:15:17
1jtephd,cbailez,My average is 0.0084. 😀,2,1744068610.0,2025-04-07 23:30:10
1jtephd,nightfly82,I also have an 8-9 cent average. I am starting to get back down to scary territory and won’t be in the green anymore  Gonna set some buy orders at 10 cents tho If we break 10 cents than I honestly don’t know when it will stop. There’s really no resistance,1,1744022801.0,2025-04-07 10:46:41
1jtephd,DothrakAndRoll,This was my entry point 🤗,1,1744046286.0,2025-04-07 17:18:06
1jtephd,DontTrustGoverment_,Well said.. my Avg is .05.. its a great time to buy.,0,1744025540.0,2025-04-07 11:32:20
1jtephd,Merlin1039,Buy more at .10. then mortgage your house and buy more at .05. Then wonder why you're busted after putting all your money into garbage,-2,1744071417.0,2025-04-08 00:16:57
1jtephd,ANeeSH20,"There always will, till the end of trumps current term.",1,1744223564.0,2025-04-09 18:32:44
1jtephd,Fhantom1221,![gif](emote|free_emotes_pack|facepalm)that's why you sell then by the dip...  (![gif](emote|free_emotes_pack|shrug) which you never know how low it will be... FYI in the morning the stock market may crash far more... like horrifically. So brace yourself.)  I sold everything Sunday morning. I might buy this week. Depending on what happens.,7,1744011877.0,2025-04-07 07:44:37
1jtephd,r_snchz8,Keep buying then!,1,1744216059.0,2025-04-09 16:27:39
1jtephd,Shellilala,But thats what it does,1,1744219989.0,2025-04-09 17:33:09
1jtephd,Shellilala,Its all linked together . ALL of it,1,1744220012.0,2025-04-09 17:33:32
1jtephd,Angrry_,China stock market is down 7 percent today,14,1744026276.0,2025-04-07 11:44:36
1jtephd,Status_Estimate4601,I agree with that.,1,1744046347.0,2025-04-07 17:19:07
1jtephd,MrEklipze,"Even if he was already in, the coin going lower and buying more can greatly improve his average. This in return, will get him his lost money back faster.",8,1744015803.0,2025-04-07 08:50:03
1jtephd,Byro1218,Curious what’s your strategy?,2,1744009307.0,2025-04-07 07:01:47
1jtephd,Fru1tLo0psy,1 Doge = 1 Doge,1,1744024085.0,2025-04-07 11:08:05
1jtephd,Shellilala,Actually it's because I LOVE  reading all these crying comments ![gif](emote|free_emotes_pack|grin),1,1744221423.0,2025-04-09 17:57:03
1jtephd,Status_Estimate4601,"It was at 7ct after ftx, 9cent is a nobrainer",1,1744046944.0,2025-04-07 17:29:04
1jtephd,Status_Estimate4601,"It was certain that it was going down and yet all the noobs got in at ATH. The buy high sell low isn't made up, it's what all the noobs do. You buy when everybody sells and you sell when everybody and his grandmothers dog buys.",2,1744047089.0,2025-04-07 17:31:29
1jtephd,AC2498,"It’s not certain, it’s gambling. However based on how the stock has moved in the past. There’s a decent chance of a good return within a few years timeframe",-1,1744043764.0,2025-04-07 16:36:04
1jtephd,SnooDonuts1009,Nah idk this time might really be like youve never seen before,1,1744084430.0,2025-04-08 03:53:50
1jtephd,ur_rad_dad,"I didn’t advise you of anything. Nothing in my comment was advice.  Every single ticker, crypto or traditional, is suffering because of the Orange idiots policies.",1,1744225796.0,2025-04-09 19:09:56
1jtephd,RJVegeto,Yes. It will. Quit being dismissive.,2,1744139837.0,2025-04-08 19:17:17
1jtephd,Merlin1039,LoLz. Dude had like 50 chances to get out ahead and now he's at zero. Like he never started. Only he's 4-5 years behind,1,1744075443.0,2025-04-08 01:24:03
1jtephd,TheNoblePrince,For the memes...duh,0,1744069861.0,2025-04-07 23:51:01
1jtephd,Demonyx12,![gif](giphy|fQDfbPF4ZpxujCfY2g),10,1744074059.0,2025-04-08 01:00:59
1jtephd,birdpervert,"Nah man, you can’t blame the assistant manager for not getting the raises promised by the GM.",8,1744029787.0,2025-04-07 12:43:07
1jtephd,SnooDrawings5837,"Well I personally bought at what I thought was a dip from the 0.48 top of last year, clearly that didn’t go as planned but still",16,1744020711.0,2025-04-07 10:11:51
1jtephd,Fru1tLo0psy,Just hang in there.  This is part of the volatility of the Cryptography market.  It will bounce back like always and you'll be happy you held on.  Have a good holiday.,15,1744054906.0,2025-04-07 19:41:46
1jtephd,N/A,[deleted],3,1744044471.0,2025-04-07 16:47:51
1jtephd,SignatureFunny7690,These forums are just full of people arguing in bad faith desperately trying to convince others to pump the coin so they might have a chance of cashing out. It's like a shittier pyramid scheme only a shocking majority of people really fall for it big time. If your gonna gamble at least do stock options,1,1744277268.0,2025-04-10 09:27:48
1jtephd,N/A,[deleted],2,1744068894.0,2025-04-07 23:34:54
1jtephd,N/A,[deleted],1,1744024321.0,2025-04-07 11:12:01
1jtephd,IndependentTeacher24,Yep my average is .05 as well.  So i am still good.,1,1744033992.0,2025-04-07 13:53:12
1jtephd,BusinessCat85,Paper hands,6,1744029236.0,2025-04-07 12:33:56
1jtephd,Shellilala,So ? The stock market will go back up too . It ALWAYS does .  Why people PANIC ?  This is literally what the stock market and crypto DO .  Most of it is manipulation or even political . Cause the 1% of the richest people on the planet play with it ![gif](emote|free_emotes_pack|neutral_face),1,1744219643.0,2025-04-09 17:27:23
1jtephd,TranslatorNo8445,"All stock markets are down, and the entire world understands why. One man did this, and I would expect the world will learn not to trust the United States. We are screwed. Japan and South Korea with china are talking about a trade agreement. Canada and Mexico and Europe will make an agreement. Canada and Europe will not buy our weapons. Americans are not in a position to do this we can't and won't manufacture stuff that costs less to manufacture somewhere else. The republican voter just eat up all the garbage this guy says without any understanding of anything l. We are cooked",12,1744026658.0,2025-04-07 11:50:58
1jtephd,Remarkable-Ad6420,For a coin that barely reached 50% of its previous ATH I wouldn't be too confident that it ever goes up to new ATH.  Next bullrun we might see a max of .25 from Doge.,-1,1744026847.0,2025-04-07 11:54:07
1jtephd,firl21,It’s not a stock…,3,1744043784.0,2025-04-07 16:36:24
1jtephd,Merlin1039,Why is that? It's ATH was years ago. It's at 20% now. There's a good chance it never recovers,-1,1744075155.0,2025-04-08 01:19:15
1jtephd,YoDudeguy,That didn’t age well bud,1,1744648660.0,2025-04-14 16:37:40
1jtephd,SnooDrawings5837,"Thank you for the positive message man, don’t see many now a days in the subreddit unfortunately. Probably going to end up selling in June/July but I will see how the next 2/3 months go",7,1744056947.0,2025-04-07 20:15:47
1jtephd,Status_Estimate4601,Zoom out.,2,1744046265.0,2025-04-07 17:17:45
1jtephd,Disastrous_Kick_7420,"Serious question, but whay makes you think somebody who is scared of the current market conditions would sell their stock for dogecoin?",2,1744049962.0,2025-04-07 18:19:22
1jtephd,Useful_Divide7154,"That’s an insane amount of DOGE! Aren’t you a bit worried about having that much of a meme coin, even if it’s a high quality one?",0,1744045923.0,2025-04-07 17:12:03
1jtephd,cbailez,Great! HODL to the moon.,1,1744068999.0,2025-04-07 23:36:39
1jtephd,BusinessCat85,"Well I mean, markets effect wealthy people the most, so I thought y'all were all about eat the rich? I figured the left would be happy with this massive redistribution of wealth.  From paper hands to diamond hands. That's all that really matters. Think about it...",0,1744029094.0,2025-04-07 12:31:34
1jtephd,Shellilala,Just as well you arent president,1,1744220519.0,2025-04-09 17:41:59
1jtephd,MrEklipze,"no new ath needed, you just buy lower and lower every time you can and sell high when resistance is detected etc....",3,1744027763.0,2025-04-07 12:09:23
1jtephd,Shellilala,Good thing your not giving financial advice,1,1744221492.0,2025-04-09 17:58:12
1jtephd,Status_Estimate4601,You sound like you a topblaster.,-2,1744047135.0,2025-04-07 17:32:15
1jtephd,AC2498,Doesn’t matter what you want to refer to it as. Point still stands,-3,1744043857.0,2025-04-07 16:37:37
1jtephd,AC2498,"It doesn’t need to go that high to make money. If you invest a good amount now and it goes to .30 cents in another bull run, then you doubled your money. What makes you think a coin that’s had 3 bull runs since 2021 won’t recover?",0,1744098195.0,2025-04-08 07:43:15
1jtephd,N/A,[deleted],1,1744051882.0,2025-04-07 18:51:22
1jtephd,New_Cryptographer248,Rich people make more money because they can afford to buy the dip,11,1744029400.0,2025-04-07 12:36:40
1jtephd,TranslatorNo8445,Redistribution?  They are shorting the market getting richer by the day. No one rich is being affected by this if they are they are dumber than a Trump supporter,7,1744029209.0,2025-04-07 12:33:29
1jtephd,Schnarf420,Hell yea. My average is a penny and am not selling.,1,1744035901.0,2025-04-07 14:25:01
1jtephd,KindlyBrain6109,"""Markets effect wealthy people the most"" that's a questionable statement.  Wealthy people have more money to loose when markets are effected, yes. But unlike a middle class grandma who managed to invest enough for a modest retirement, the rich don't have to choose between food or meds when the markets crash.",1,1744081991.0,2025-04-08 03:13:11
1jtephd,Merlin1039,Or it never goes up from.15 again and you lost everything,-2,1744072280.0,2025-04-08 00:31:20
1jtephd,heidens649,What do you mean never have an average over 20 cents ? 😂😂😂 sorry we didn’t get in when you did  and I actually don’t believe you . I highly doubt you had that much and held onto it when it went up over .50,1,1744056135.0,2025-04-07 20:02:15
1jtephd,BusinessCat85,"Nothing stopping you from shorting stocks either.   But the real play is what Mr buffet is doing. He sold out over the last year. Waited for the explosion, and buys the dip.    I recommend having some liquid cash on the side of your portfolio for this very reason. A. It doesn't go down, it's cash B. Now you can buy the dip.  C. Just refill this cash first with your monthly savings then resume normal monthly drip  Right now I'm feeding it to stay above a certain value, it stings but I have been able to buy a ton of stock at 2023 prices. Not bad.  I think the most the market would drop is a total of 25%, with a rapid recovery over 2025",-2,1744031045.0,2025-04-07 13:04:05
1jtephd,BusinessCat85,Neither do the middle class.  Poor people don't invest,0,1744101526.0,2025-04-08 08:38:46
1jtephd,MrEklipze,"That’s unlikely, even in that case, you can still make money.",1,1744105511.0,2025-04-08 09:45:11
1jtegtc,Remarkable_Misty,The u.k is trying to stop crypto they keep annoucing more restrictions on it i mean most banks here dont even let you buy crypto,3,1744032568.0,2025-04-07 13:29:28
1jtegtc,nightfly82,House of dissatisfaction. They started this hype with meetings with corporations etc etc back in February and since then they only announced that a car at the Indy 500 will be wrapped in doge coin lettering or something  This is turning out to be a big nothing burger,1,1744022983.0,2025-04-07 10:49:43
1jtegtc,nightfly82,House of dissatisfaction. They started this hype with meetings with corporations etc etc back in February and since then they only announced that a car at the Indy 500 will be wrapped in doge coin lettering or something  This is turning out to be a big nothing burger,0,1744022989.0,2025-04-07 10:49:49
1jtegtc,OnlyRawSauce,Interesting!,2,1744034422.0,2025-04-07 14:00:22
1jtegtc,BigMoneyBrad007,it’s because the head of most banks are against the tariffs and oppose trumps ways right now so they are training their staff to kinda go against the system,0,1744087013.0,2025-04-08 04:36:53
1jtegtc,nickert0n,Not at all actually.,3,1744085152.0,2025-04-08 04:05:52
1jtegtc,OxbridgeDingoBaby,You literally spam post the same comment everywhere. Tiresome.,1,1744101643.0,2025-04-08 08:40:43
1jtegtc,OnlyRawSauce, i understand your view.,3,1744028192.0,2025-04-07 12:16:32
1jtegtc,Remarkable_Misty,No this has been going on for a fair few years now way before the tariifs the u.k is pretty anti crypto,1,1744090426.0,2025-04-08 05:33:46
1jtegtc,nightfly82,"Prove me wrong. Go to their X account  All they do is repost memes lol I get it doge coin is a meme coin but let’s be a little more serious on getting the ball rolling on doge coin adoption. Tim stebbings initial announcement about having a meeting with corporations and businesses was back in February, he said “will reveal more about those companies in 2 weeks” Still waiting",1,1744103432.0,2025-04-08 09:10:32
