post_id,author,body,score,created_utc,date
1jiaw0e,N/A,[deleted],34,1742767585.0,2025-03-23 22:06:25
1jiaw0e,Whoisyourfactor,"Once we resolve the tarrifs situation, we will be back at 23C and so on. At this point buy and hold.",10,1742772109.0,2025-03-23 23:21:49
1jiaw0e,GJustGotaBag,One of the easiest plays rn.,11,1742767828.0,2025-03-23 22:10:28
1jiaw0e,stegosaurusterpenes,![gif](giphy|M7gtacN7aPNsc),6,1742771308.0,2025-03-23 23:08:28
1jiaw0e,PuG3_14,Im ready to bust!,2,1742792246.0,2025-03-24 04:57:26
1jiaw0e,tobitazzz,Ok what did you say? You missing the ride lmao by by I’m on my way to the moon,2,1742826125.0,2025-03-24 14:22:05
1jiaw0e,GJustGotaBag,"Be careful being positive in this sub though, you’ll just get downvoted & removed more than likely, even though you are correct!🚀🥂",5,1742767982.0,2025-03-23 22:13:02
1jiaw0e,Stony_1987,To .20 an beyond...,3,1742768689.0,2025-03-23 22:24:49
1jiaw0e,GJustGotaBag,💸🖨️,2,1742767004.0,2025-03-23 21:56:44
1jiaw0e,Fun_Raise_7858,Should i find a rain suit?,1,1742772298.0,2025-03-23 23:24:58
1jiaw0e,tobitazzz,And glasses,1,1742778752.0,2025-03-24 01:12:32
1jiaw0e,tobitazzz,Your right. We need some positive news,1,1742781469.0,2025-03-24 01:57:49
1jiaw0e,traderhp,Be careful anytime bears will attack it's trap,1,1742855465.0,2025-03-24 22:31:05
1jiaw0e,tobitazzz,Not this time,1,1742862649.0,2025-03-25 00:30:49
1jiaw0e,coronaflo,I don’t care whether you believe it or not but do you have to post the same thing ad nauseam.,0,1742798857.0,2025-03-24 06:47:37
1jiaw0e,delshimo,People keep saying it’s going to go up and it never does. I’ll save this and come back in May to show you,0,1742818223.0,2025-03-24 12:10:23
1jiaw0e,Southern-Young-2389,"Low volume, small pump and dump, no suprise if ends day in red. Unfoetunetly Crypto is in stall now",-1,1742779009.0,2025-03-24 01:16:49
1jiaw0e,mrtcarson,nope,-6,1742770379.0,2025-03-23 22:52:59
1jiaw0e,duzz_dee,![gif](giphy|pumIQjPQ5Y7skwEZes|downsized),8,1742768381.0,2025-03-23 22:19:41
1jiaw0e,Gloomy_Setting5936,I am so ready to burst all over your face friend 😳,1,1742774260.0,2025-03-23 23:57:40
1jiaw0e,GJustGotaBag,🥱🤣,1,1742838180.0,2025-03-24 17:43:00
1jiaw0e,GJustGotaBag,How does this clown still have 15 upvotes? Lol trash sub,-6,1742776222.0,2025-03-24 00:30:22
1jiaw0e,N/A,[deleted],3,1742822118.0,2025-03-24 13:15:18
1jiaw0e,God-Emperor-Pepe,"Seriously, what’s up with that? I’ve been seeing it for a while now.",2,1742768186.0,2025-03-23 22:16:26
1jiaw0e,GJustGotaBag,🥂,4,1742768959.0,2025-03-23 22:29:19
1jiaw0e,Beneficial-Turnover6,I think we’re gonna get back to 0.17 where it belongs any day now.,1,1742770870.0,2025-03-23 23:01:10
1jiaw0e,GJustGotaBag,About to rebound like Dennis Rodman🥱,3,1742772506.0,2025-03-23 23:28:26
1jiaw0e,GJustGotaBag,Go for it,1,1742772458.0,2025-03-23 23:27:38
1jiaw0e,GJustGotaBag,Fantastic reply my guy🤣🥱  Just very informative overall… It looks like it keeps going up though?,2,1742770759.0,2025-03-23 22:59:19
1jiaw0e,GJustGotaBag,I’m just revealing the facts.. like it or not.,0,1742776272.0,2025-03-24 00:31:12
1jiaw0e,Gloomy_Setting5936,I actually agree with you bro lol. He uses that joke way too much.,-4,1742794310.0,2025-03-24 05:31:50
1jiaw0e,GJustGotaBag,"It’s undervalued & we’re buying, not selling.",2,1742838228.0,2025-03-24 17:43:48
1jiaw0e,GJustGotaBag,"This is a trash community/admins to be quite honest with you. I just call out the play & this sub has a terrible reaction, when DOGE goes up.  I don’t care about your feelings, I care about my return & if I’m right or wrong… Ya’ know?",3,1742768493.0,2025-03-23 22:21:33
1jiaw0e,GJustGotaBag,I don’t know or care. — them as far as I’m concerned. Probably trying to keep the price contained so they can milk it for the most that they can.  All I know is we won😈,0,1742768266.0,2025-03-23 22:17:46
1jiaw0e,Stony_1987,🥃,1,1742769091.0,2025-03-23 22:31:31
1jiaw0e,GJustGotaBag,Undervalued.. nice try though,1,1742771647.0,2025-03-23 23:14:07
1jiaw0e,mrtcarson,Nope...whales in control of BTC...back to .08 for the dogee....,-4,1742771155.0,2025-03-23 23:05:55
1jiaw0e,Corey307,"Are we looking at the same chart? It’s been between $.15 and $.17 for the last two weeks. Yeah, it seems to have found a floor, but that does not indicate more than it has stabilized. It stayed fairly stable for four years last time.",-1,1742773961.0,2025-03-23 23:52:41
1jiaw0e,GJustGotaBag,.20 is undervalued too? What is happening to logic…😞,1,1742772690.0,2025-03-23 23:31:30
1jiaw0e,GJustGotaBag,Do you think that people here don’t own BTC?,1,1742771339.0,2025-03-23 23:08:59
1jiaw0e,GJustGotaBag,Call me the 97’ Bulls🥱,0,1742771389.0,2025-03-23 23:09:49
1jiaw0e,GJustGotaBag,Blah blah,0,1742773987.0,2025-03-23 23:53:07
1jiaw0e,Stony_1987,"Just renewed interest is all at the .20 psychological level lol. Up or down personally, i'm in it for the long game.",2,1742772995.0,2025-03-23 23:36:35
1jiaw0e,Gloomy_Setting5936,"This is a great price to buy! Load up before the spaceship 🚀 departs for the moon, prices won’t remain this low much longer!",2,1742774062.0,2025-03-23 23:54:22
1jiaw0e,mrtcarson,"They were the best....The ""97 Bulls"" refers to the 1996-97 Chicago Bulls, a team led by Michael Jordan, Scottie Pippen, and Dennis Rodman, who won their fifth NBA championship that season",2,1742771981.0,2025-03-23 23:19:41
1jiaw0e,GJustGotaBag,I have a hard time imagining this won’t trade past it’s ATH this year. I am a st00pid retail investor though.😉,1,1742773169.0,2025-03-23 23:39:29
1jiaw0e,GJustGotaBag,Exactly,1,1742772062.0,2025-03-23 23:21:02
1jiaw0e,GJustGotaBag,"Money talks.. numbers don’t lie, or can only lie for so long & that’s why the market is the best.",1,1742772217.0,2025-03-23 23:23:37
1jiaw0e,Stony_1987, Nothing wrong with supporting something we like. Don't be to hard on yourself lol. Imop were just getting started.,3,1742773508.0,2025-03-23 23:45:08
1jiaw0e,GJustGotaBag,100% just getting started… It was too easy to see.,2,1742773582.0,2025-03-23 23:46:22
1jiaw0e,Stony_1987,Facts,3,1742773613.0,2025-03-23 23:46:53
1ji5311,Feeling-Comfort7823,Its shaped like a piss stain on a cushion.,30,1742753142.0,2025-03-23 18:05:42
1ji5311,daSTDbunny,"In space, up is relative, but on earth, that is not going to the moon.",21,1742752997.0,2025-03-23 18:03:17
1ji5311,Difficult_Fig_1582,Which moon this time?,6,1742752528.0,2025-03-23 17:55:28
1ji5311,Odd_Stick_3042,Did you sleep well?,3,1742754741.0,2025-03-23 18:32:21
1ji5311,Lets_Get_Retard,this literally means nothing,3,1742765658.0,2025-03-23 21:34:18
1ji5311,Reefer_Refugee,“Mr. Mandelbrot… i have something you need to see…”,2,1742761650.0,2025-03-23 20:27:30
1ji5311,N/A,disclosure : I just bought $50 CAD in dogecoin.,5,1742752142.0,2025-03-23 17:49:02
1ji5311,N/A,I think the problem is most of us aren't equipped with anything to handle the vacuum and die horribly while our money boils away.,2,1742754016.0,2025-03-23 18:20:16
1ji5311,wisefool4ever,Moon on other side of earth…,1,1742760544.0,2025-03-23 20:09:04
1ji5311,N/A,Who’s going to tell him?,1,1742762399.0,2025-03-23 20:39:59
1ji5311,roamflex3578,"Congratulations, you just notice one of way to analyse stock. Good resistant line. Take look at past for btc graphs and look across inducators. * thumb up from me",1,1742762996.0,2025-03-23 20:49:56
1ji5311,GJustGotaBag,🖨️💸,1,1742767021.0,2025-03-23 21:57:01
1ji5311,suthekey,Good idea. Inverted chart to the moon!,1,1742777524.0,2025-03-24 00:52:04
1ji5311,daSTDbunny,I came back to see if OP could explain how their chart was going to the moon just to find the account is deleted. They must have lost everything going all in with their life savings of 50 CAD,1,1743461646.0,2025-03-31 22:54:06
1ji5311,Unlucky_Bell_7354,Womp womp,1,1742757092.0,2025-03-23 19:11:32
1ji5311,N/A,look closer mate,-24,1742753060.0,2025-03-23 18:04:20
1ji5311,TYT6647,Down moon at 04/04/25,5,1742753486.0,2025-03-23 18:11:26
1ji5311,N/A,uranus of course mate,1,1742752953.0,2025-03-23 18:02:33
1ji5311,MaleOrganDonorMember,I don't sleep. I wait.,3,1742759834.0,2025-03-23 19:57:14
1ji5311,N/A,Fractal trading ftw,2,1742762235.0,2025-03-23 20:37:15
1ji5311,Corey307,What do you think you’re looking at? Explain how you are interpreting those charts. Explain why inverting what has happened over the last year or whatever means anything. ,4,1742753278.0,2025-03-23 18:07:58
1ji5311,slykethephoxenix,Baller!,1,1742753722.0,2025-03-23 18:15:22
1ji5311,daSTDbunny,"You know how many posts since 2020, just like these, made the same claim? And are we at the moon?  You fail to understand economics, learn more mate.",20,1742753152.0,2025-03-23 18:05:52
1ji5311,Positive-Gur-3150,Umm the graph literally shows it is in a steady decline,1,1742813263.0,2025-03-24 10:47:43
1ji5311,HabitEnvironmental87,ur anus,1,1742773516.0,2025-03-23 23:45:16
1ji5311,Odd_Stick_3042,Of course you do.,1,1742761131.0,2025-03-23 20:18:51
1ji5311,N/A,"sure.  so you see where the red line starts, thats a local high, buyers pushed price there , then did not think dogecoin was worth more so stopped buying, the sellers took control and dumped to the lowest value people thought it might be good to buy at.  look at the future when price again gets dumped at that price point, the 3rd time, theres been a shift in sentiment of buyers, for some reason buyers think dogecoin IS worth more than this price, and so price breaks this barrier, we return to this barrier and people watch to see what everyone thinks, people decide it IS worth more and refuse to sell, then the buying continues until like before at our local maximum, people dont think it's worth more, then like the local maximum, sellers begin dumping as if people dont think its worth more then its a good time to sell.  price returns to this previous area where sellers decided it WAS worth more, same as in the local support area where sellers stopeed selling, and now we can see that the sellers , who think they can get a better sell value , and buyers who think they can buy cheap might start getting in.  I've also added a LRC , linear regression channel with outer layers of 2nd standard devition, the data points in the LRC account for about 90% or so ( google it ) corrolated values, what this means is that, 90% of the data over that period is contained in the LRC, price broke out of that, that shows that this is a significant change in price movement as it is uncorrolated with previous movement, this LRC break alongside the return to the switch point ( resistance turned to support ) , made me take my precious $50 ( im canadian so i'm poor ) and buy dogecoin and HODLE THE FKIN LINE HOOOOOOOOOLDDDDD  edit : oh I'm a very advanced day trader / analyst ( haven made money yet tho ) despite how i'm communicating , I use inversion as part of my analysis for some psychological and analytical enhancement, its not relevant here, my chart just always looks like this.  edit2: HoDLLL THE LINEEEEEE",3,1742754132.0,2025-03-23 18:22:12
1ji5311,N/A,thanks for the advice big dawg,-21,1742753212.0,2025-03-23 18:06:52
1ji5311,liquid_at,"It always is between massive runs. Doge has never, in its entire history, only traded up. Down until run is the expectation. It's never been different.  Only in the bigger picture does it trade upwards because the sum of gains in the short term outweigh the sum of losses between those runs. .",1,1742817892.0,2025-03-24 12:04:52
1ji5311,Daddioster,No! Ur an anus,2,1742773599.0,2025-03-23 23:46:39
1ji5311,binglelemon,">edit : oh I'm a very advanced day trader / analyst ( haven made money yet tho ) despite how i'm communicating ,  lol",10,1742757875.0,2025-03-23 19:24:35
1ji5311,MaleOrganDonorMember,It's also shaped like a penis,3,1742759925.0,2025-03-23 19:58:45
1ji5311,daSTDbunny,Just wear something pretty when i pick you up tonight.,10,1742754869.0,2025-03-23 18:34:29
1ji5311,gay_for_hideyoshi,OP: “This is a very good position to go in I have done my research. And it’ll come out on top.”  Also OP: puts $50 in,2,1742811339.0,2025-03-24 10:15:39
1ji5311,technicallyanadult83,You should probably see a doctor,1,1742817347.0,2025-03-24 11:55:47
1ji5311,MaleOrganDonorMember,How does a smile sound?,3,1742759807.0,2025-03-23 19:56:47
1ji5311,Lets_Get_Retard,nothing but a smile?,3,1742765688.0,2025-03-23 21:34:48
1ji5311,daSTDbunny,Nothing but,2,1742767894.0,2025-03-23 22:11:34
1ji3bao,ajshrike_author,"Good boys, HODL.",3,1742747847.0,2025-03-23 16:37:27
1ji3bao,Stony_1987,Eyeing that green toy. Must be his favorite lol. #doge🦾,3,1742749615.0,2025-03-23 17:06:55
1ji3bao,zorglubo,"Ho, hi doge !",2,1742755552.0,2025-03-23 18:45:52
1ji3bao,Rough-Promotion6628,I just want to make enough for some hookers at this point,1,1742750489.0,2025-03-23 17:21:29
1ji3bao,alopez0405,They are patiently waiting 🌙,2,1742749504.0,2025-03-23 17:05:04
1ji3bao,alopez0405,Waiting for dad to stop taking pictures and throw it 🤣,3,1742752105.0,2025-03-23 17:48:25
1ji3bao,DelawareDankster,What about the booger sugar to go with the hookers,1,1742751247.0,2025-03-23 17:34:07
1ji3bao,alopez0405,Well depending on your taste/quality. I know some places were 5 bucks is 5 bucks 🤣,0,1742752070.0,2025-03-23 17:47:50
1ji0mf3,Weekly_Mousse_4194,A great news that DOGE popular globally,5,1742792005.0,2025-03-24 04:53:25
1ji0mf3,MyGT40,"Nope, any adaptation is good!",8,1742740642.0,2025-03-23 14:37:22
1ji0mf3,C300w204,"Got source/link   Edit : Oh damn just saw it , https://www.prnewswire.com/apac/news-releases/open-house-group-expands-cryptocurrency-payment-options-to-xrp-sol-and-doge-302408033.html",6,1742741033.0,2025-03-23 14:43:53
1ji0mf3,Stony_1987,Exciting times.,5,1742743392.0,2025-03-23 15:23:12
1ji0mf3,notso96600,Hype Hype hype,2,1742769681.0,2025-03-23 22:41:21
1ji0gea,GJustGotaBag,🍻,2,1742775294.0,2025-03-24 00:14:54
1ji0gea,Stony_1987,👊,3,1742775399.0,2025-03-24 00:16:39
1ji07wz,IronRongShanks,Much wow,1,1742739780.0,2025-03-23 14:23:00
1jhx7jq,TellMeMore_1111,i see it came later and later after every halving event. I think it will come.,6,1742742330.0,2025-03-23 15:05:30
1jhx7jq,angelwolf71885,I will say this it feels good to be riding the profit line right now i but i feel bad for anyone who bought in the last rise at $0.48,5,1742756112.0,2025-03-23 18:55:12
1jhx7jq,sonnyjames,"Had a nice chuckle,good one!",1,1742782893.0,2025-03-24 02:21:33
1jhx7jq,reditpost1,Our day will happen someday soon 😄,1,1742800216.0,2025-03-24 07:10:16
1jhx7jq,liquid_at,"You had expectations for a bullish run during a predicted consolidation? Let me guess... You also think the entire dump was dogecoin investors losing so much hope, that it pulled the s&p down with us and forced president's to enact tariffs and support dictators?  Bold theory cotton...",0,1742730428.0,2025-03-23 11:47:08
1jhx7jq,Low-Hold-8563,Hoping to science you're right.   Do you have a post pop plan?,1,1742751304.0,2025-03-23 17:35:04
1jhx7jq,Low-Hold-8563,If they dove into crypto to make money right now they messed up. Get comfy. Eventually  all top 10 cryptos will see a new ATH.,1,1742775472.0,2025-03-24 00:17:52
1jhx7jq,Low-Hold-8563,Cotton? 🤣   I was hoping for a bigger pop. Might still be coming. Probably isint.,1,1742733000.0,2025-03-23 12:30:00
1jhx7jq,angelwolf71885,At some point indeed crypto will break out…I bought on the last major dip in 2022 and got in at $0.17 wish I could of gotten in at $0.08 the true bottom,1,1742775680.0,2025-03-24 00:21:20
1jhtjhb,BelloBellaco,“Never sold” / “no one bought”,55,1742744112.0,2025-03-23 15:35:12
1jhtjhb,FeistyCandle4032,Ill give you 100 doge,28,1742721381.0,2025-03-23 09:16:21
1jhtjhb,Remarkable-Ad6420,NFTs ....the peak of braindead degeneracy.,40,1742748810.0,2025-03-23 16:53:30
1jhtjhb,Agile-Property-9365,Actually a real cool scene dude,17,1742725673.0,2025-03-23 10:27:53
1jhtjhb,zytrohs-801,I like it 👌,5,1742770393.0,2025-03-23 22:53:13
1jhtjhb,snorlaxtubbs,Looks sick!,9,1742729247.0,2025-03-23 11:27:27
1jhtjhb,Stevealot,You could be a hundredaire now,3,1742752161.0,2025-03-23 17:49:21
1jhtjhb,Wide-Direction881,Easily get a billion for that,2,1742771693.0,2025-03-23 23:14:53
1jhtjhb,FierceFamilyLLC,I love this!! Can I buy it?,2,1742777956.0,2025-03-24 00:59:16
1jhtjhb,Intelligent_Gur_5711,Whats your price ?,2,1742789944.0,2025-03-24 04:19:04
1jhtjhb,reditpost1,Van Gogh  Starry night Doge  NFT with  movement. Price 200 to 300 million dollars. I start my bid 1 million.,2,1742795025.0,2025-03-24 05:43:45
1jhtjhb,Zeppelin041,"Kinda cool you can make them, but I just never got the point…",2,1742826162.0,2025-03-24 14:22:42
1jhtjhb,Objective_Run3248,I’ll buy,2,1742826163.0,2025-03-24 14:22:43
1jhtjhb,Endless-OOP-Loop,"That's pretty cool. I'd buy it, if I were into NFTs.",1,1742761603.0,2025-03-23 20:26:43
1jhtjhb,Correct-Potential-15,How do you make NFTs 😭,1,1742782139.0,2025-03-24 02:08:59
1jhtjhb,ChargeSpecialist1644,The doge yerns for the moon 😔,1,1742855940.0,2025-03-24 22:39:00
1jhtjhb,Active-Magician8008,Tell me that it’s Jarjar Binks,1,1742924001.0,2025-03-25 17:33:21
1jhtjhb,ImpressSubstantial87,Looks like ai slop,0,1742811847.0,2025-03-24 10:24:07
1jhtjhb,Accomplished_Bar_791,I got a free $10 if anybody needs it and you can cash out instantly when you get the virtual card 👀,0,1742834443.0,2025-03-24 16:40:43
1jhtjhb,Human_Lecture_348,Why would it sell? I have a copy of it on my phone for all time now. So does everyone here.,-1,1742947722.0,2025-03-26 00:08:42
1jhtjhb,ricardo_sousa11,Never sold becasuse its cr\*p :(,-2,1742813906.0,2025-03-24 10:58:26
1jhtjhb,horseradish13332238,Exactly,7,1742777384.0,2025-03-24 00:49:44
1jhtjhb,FuroreLT,Bingo,3,1742800577.0,2025-03-24 07:16:17
1jhtjhb,thYrd_eYe_prYing,200!,10,1742723702.0,2025-03-23 09:55:02
1jhtjhb,Outrageous-Rip5743,You bought a coin with a dog on it,25,1742765434.0,2025-03-23 21:30:34
1jhtjhb,N/A,"Make a White Paper and lie about future plans, make a stock main asset, and then make a bunch of dumb little accessories for said asset, then lastly have an AI make 1000’s of copies of said basic art with the different accessories. Than shell it to a bunch of CryptoBros on X or pay for it to be promoted and watch the money roll in before disappearing.",2,1742783381.0,2025-03-24 02:29:41
1jhtjhb,Ghxst369,I’ll just download it 😹,31,1742740828.0,2025-03-23 14:40:28
1jhtjhb,No_Run1652,300!,1,1742752427.0,2025-03-23 17:53:47
1jhtjhb,Glittering_Camera155,I hooted at this 😂,7,1742779914.0,2025-03-24 01:31:54
1jhtjhb,Remarkable-Ad6420,And I sold that coin for a currency with dead presidents on it for a large profit.  What's your point?,8,1742790827.0,2025-03-24 04:33:47
1jhtjhb,Correct-Potential-15,Omg…,2,1742783788.0,2025-03-24 02:36:28
1jhtjhb,Wild-Rough-2210,I took a screen recording and printed it,6,1742758920.0,2025-03-23 19:42:00
1jhtjhb,Oftiklos,I'll buy it from you,5,1742751148.0,2025-03-23 17:32:28
1jhtjhb,N/A,[removed],-13,1742750975.0,2025-03-23 17:29:35
1jhtjhb,Wild-Rough-2210,301,1,1742758963.0,2025-03-23 19:42:43
1jhtjhb,Ambitious-Apple1125,![gif](giphy|D0RvPABUNF3AQ),2,1742822054.0,2025-03-24 13:14:14
1jhtjhb,AbbreviationsLive475,You should totally do it...,1,1742787426.0,2025-03-24 03:37:06
1jhtjhb,lofigamer2,is the print moving?  ![gif](giphy|b8RfbQFaOs1rO10ren),3,1742780254.0,2025-03-24 01:37:34
1jhtjhb,Correct-Potential-15,Uhm.....   Ill stick to tryna make a crypto for now,2,1742787597.0,2025-03-24 03:39:57
1jhpj83,Fun_Raise_7858,Are you from bloomberg ?,10,1742698427.0,2025-03-23 02:53:47
1jhpj83,gSrikar,Multiple Meme coins came in already but couldn't cross doge market cap.,7,1742699332.0,2025-03-23 03:08:52
1jhpj83,C300w204,"Why dont you short it and post the position here, seem like free money right ?",12,1742698692.0,2025-03-23 02:58:12
1jhpj83,Gohan335i7,Mmmkay…,6,1742698837.0,2025-03-23 03:00:37
1jhpj83,3ugeye,“Sub penny prices” 😂 We are just a bunch of pennies! Trading for pennies here… there…. waiting for a few pennies to go up… to go down. 😱 I’m going to make my pennies that’s for sure 🔥,3,1742699523.0,2025-03-23 03:12:03
1jhpj83,Fulvio55,"Because…..?  #Trust Me, Bro! ??????",3,1742731073.0,2025-03-23 11:57:53
1jhpj83,N/A,[removed],1,1742698607.0,2025-03-23 02:56:47
1jhpj83,Whoisyourfactor,He still tells you to buy later lol.,1,1742951642.0,2025-03-26 01:14:02
1jhpj83,ChumpChainge,I think the floor is 7 cents. I won’t buy again above that anyway.,-4,1742698958.0,2025-03-23 03:02:38
1jhpj83,Gloomy_Setting5936,No he’s from the Motley Fool 🤡,11,1742698665.0,2025-03-23 02:57:45
1jhpj83,JarretYT,I dont got balls,2,1742703119.0,2025-03-23 04:11:59
1jhpj83,N/A,[deleted],-1,1742698781.0,2025-03-23 02:59:41
1jhpj83,JarretYT,"Yea pretty much, alt season is over, if it makes it to 30 cents before 1 cent im wrong",-1,1742751274.0,2025-03-23 17:34:34
1jhpj83,SOtotheSQUAD,You sure can,4,1742698907.0,2025-03-23 03:01:47
1jhpj83,C300w204,"You can in futures, every exchange that has doge on spot has futures of it.",3,1742698869.0,2025-03-23 03:01:09
1jhpj83,Fulvio55,"Uhhuh.  Me, I don’t actually care. It’s all good.",2,1742789443.0,2025-03-24 04:10:43
1jhpj83,C300w204,Lol did the guy get emberrased and deleted his account or are these bots,2,1742700042.0,2025-03-23 03:20:42
1jhpj83,JarretYT,"Lol it depends how long the bear season is, if it has 3 green days in a row its back to moon",1,1742795744.0,2025-03-24 05:55:44
1jhpj83,SOtotheSQUAD,Definitely embarrassed lol,2,1742700108.0,2025-03-23 03:21:48
1jhpj83,Fulvio55,"It still doesn’t matter though.  As long as prices move, there are trading opportunities.",2,1742803614.0,2025-03-24 08:06:54
1jhpj83,JarretYT,"Yea ykw look at my post history, i still trade (as a bull) but sometimes you just gotta hodl and pray",1,1742803853.0,2025-03-24 08:10:53
1jhpj83,Fulvio55,👍,1,1742890770.0,2025-03-25 08:19:30
1jhms5s,Nismotech_52,![gif](giphy|O9HeC49RBpLpUj0ein),35,1742689751.0,2025-03-23 00:29:11
1jhms5s,ChixawneyFarms,Lines  Graph  Lines on a graph.   Not convinced,26,1742691297.0,2025-03-23 00:54:57
1jhms5s,FinalHeaven88,He's got a dream! He's got a dream! Ain't it the most 'moon' thing you've ever seen??,5,1742693043.0,2025-03-23 01:24:03
1jhms5s,Open_Bluebird_6902,You got hope and it will ruin you and all the doge little fans,10,1742690053.0,2025-03-23 00:34:13
1jhms5s,EggIll2175,That;s definitely something,2,1742708451.0,2025-03-23 05:40:51
1jhms5s,liquid_at,It's just a Theory. A Gain-Theory.  ![gif](giphy|HfFccPJv7a9k4),2,1742723745.0,2025-03-23 09:55:45
1jhms5s,Jintopia,So moon ?,2,1742723967.0,2025-03-23 09:59:27
1jhms5s,Anouchavan,Just add one... Let's say two more colors and I'm buying.,2,1742730963.0,2025-03-23 11:56:03
1jhms5s,SonicLocket58,You might be on to something because it's now going straight up,2,1742745759.0,2025-03-23 16:02:39
1jhms5s,cooldude5789,Looks about right,2,1742761213.0,2025-03-23 20:20:13
1jhms5s,AbbreviationsLive475,My theory 1 DOGE =1 DOGE is a fact.,2,1742777697.0,2025-03-24 00:54:57
1jhms5s,jupiterjupiterA,I like this theory,2,1742793791.0,2025-03-24 05:23:11
1jhms5s,JarretYT,Aww isnt that moony,2,1742800381.0,2025-03-24 07:13:01
1jhms5s,Known_Ad3453,Set ur buy at ur stop loss lol,2,1742823974.0,2025-03-24 13:46:14
1jhms5s,gualathekoala,Hahah come on man.,3,1742694987.0,2025-03-23 01:56:27
1jhms5s,Odd_Stick_3042,Did you sleep well?,3,1742726295.0,2025-03-23 10:38:15
1jhms5s,Fru1tLo0psy,Oooohhh yayyyyyy squiggly lines 🥳,4,1742727268.0,2025-03-23 10:54:28
1jhms5s,qtipinear,Theory can only take you so far,2,1742694244.0,2025-03-23 01:44:04
1jhms5s,Intelligent-Bear-762,So.  We all are going to be rich very soon,2,1742696915.0,2025-03-23 02:28:35
1jhms5s,EyeStrange9592,A damn good theory.,2,1742699878.0,2025-03-23 03:17:58
1jhms5s,Extension-Lie-3272,.10 and lower in April.,0,1742691776.0,2025-03-23 01:02:56
1jhms5s,Unlucky_Bell_7354,I got a theory too. I have a theory that you are in the negative rn. 😂,1,1742757296.0,2025-03-23 19:14:56
1jhms5s,Lost-Trouble-4971,"Je peux voir que ça chute beaucoup ….et que ça monte pas beaucoup 🤪 Quand tu achète au creux de la vague  Tu peux vendre au prochain petit sommet …  Le dernier creux date du 11 mars 2025 à 0,142 … tu peux vendre maintenant que tu es au sommet avant la prochaine chute ….  Je rappel également que ce  graphique et le tracé de l’histoire PASSÉE du Doge   SE baser sur le passé pour prévoir l’avenir c’est comme regarder dans son rétroviseur à 200 sur autoroute  Bonne chance",1,1742773876.0,2025-03-23 23:51:16
1jhms5s,InevitableEducation,When Lambo....,1,1742781820.0,2025-03-24 02:03:40
1jhms5s,MaleOrganDonorMember,Give it up already,1,1742702586.0,2025-03-23 04:03:06
1jhms5s,eddyabdul,"Not gonna happen. If you have doge, sell now. Market is going to crash very soon",1,1742729680.0,2025-03-23 11:34:40
1jhms5s,LifeOfSpirit17,![gif](giphy|YnkMcHgNIMW4Yfmjxr),1,1742700804.0,2025-03-23 03:33:24
1jhms5s,ConsistentForce3611,"I’ve tried to like DOGE…I just hate that it goes nowhere lately. Well actually nothing does really anymore since like January, so I guess that’s not fair to say",0,1742692395.0,2025-03-23 01:13:15
1jhms5s,Saibazz,Please more dip i need to add more doge token on my local wallet 🥰,0,1742727510.0,2025-03-23 10:58:30
1jhms5s,Direct-Gas-8400,"Nah, that's not gonna happen",0,1742758967.0,2025-03-23 19:42:47
1jhms5s,Positive-Gur-3150,That is make-believe,0,1742813637.0,2025-03-24 10:53:57
1jhms5s,mcwilgb,"Step one.... Disband, department of government efficiency.  Done 👍  It's called band toxicity, as long as it exists, and the majority of people hate it. DOGE coin will suffer. Period.",0,1742821209.0,2025-03-24 13:00:09
1jhms5s,AnalogueBoy1992,You drew wrong,-1,1742706672.0,2025-03-23 05:11:12
