post_id,author,body,score,created_utc,date
1jhms5s,gualathekoala,100%  I think April 2nd it’s going to literally jump off a cliff.,0,1742694975.0,2025-03-23 01:56:15
1jhms5s,liquid_at,#trustmebro  Because listening to fear mongers with empty claims never hurt nobody... /s,2,1742730675.0,2025-03-23 11:51:15
1jhms5s,MercurioRU,Why?,1,1742696909.0,2025-03-23 02:28:29
1jhms5s,gualathekoala,Trumps truth social post.   And the fact that tariffs will really kick in I think,0,1742701148.0,2025-03-23 03:39:08
1jhms5s,liquid_at,And markets wait with pricing in news until they happen? they never trade ahead of time?,1,1742723782.0,2025-03-23 09:56:22
1jhms5s,gualathekoala,It’s pumping a bit now. Wait until “liberation day”,2,1742827682.0,2025-03-24 14:48:02
1jhljnr,taewongun1895,"I owe, I owe Off to work I go",56,1742688053.0,2025-03-23 00:00:53
1jhljnr,TheSpiritOfDoge,Y’all are getting refunds?,96,1742687140.0,2025-03-22 23:45:40
1jhljnr,Andfree1234,Refund? I have to pay every year. 15-30k a year.,35,1742687508.0,2025-03-22 23:51:48
1jhljnr,Old_Marsupial4448,Refund?,28,1742686936.0,2025-03-22 23:42:16
1jhljnr,txrigup,Refunds?,23,1742687095.0,2025-03-22 23:44:55
1jhljnr,ConversationNo9992,Getting a refund just means you loaned your money to the government without earning any interest.,10,1742694723.0,2025-03-23 01:52:03
1jhljnr,KingsCosmos,I owed them because of some Doge I sold 🤫,4,1742690470.0,2025-03-23 00:41:10
1jhljnr,DRDongBNGO,No,10,1742685759.0,2025-03-22 23:22:39
1jhljnr,JestasPriestiii,I’ll invest like 100$,3,1742693701.0,2025-03-23 01:35:01
1jhljnr,IndependentTeacher24,Nope have to pay my property tax.,7,1742686431.0,2025-03-22 23:33:51
1jhljnr,Independent_Sir8960,Wait you guys haven’t filed yet? 😳,2,1742690237.0,2025-03-23 00:37:17
1jhljnr,Separate_Ad478,What refund?,2,1742732049.0,2025-03-23 12:14:09
1jhljnr,Extension-Lie-3272,Nobody is getting money you silly people. And once doge pumps again 200% I am cashing out!,5,1742689011.0,2025-03-23 00:16:51
1jhljnr,comfortablesorrow,"Got mine. Saved a little and paid bills. Not a dime into crypto, and I won't until guardrails and regulations are put into the crypto space.",3,1742686680.0,2025-03-22 23:38:00
1jhljnr,StandardObservations,"Nobody that's smart. You get left holding the bag with crypto, making rich people richer. Look at my post History for this topic, I waited for 4+years.. just got out even.",2,1742687560.0,2025-03-22 23:52:40
1jhljnr,Less_Poet3992,I’m praying to pay less after I get my taxes done.,1,1742687281.0,2025-03-22 23:48:01
1jhljnr,lambone1,Not it,1,1742688625.0,2025-03-23 00:10:25
1jhljnr,stingerfingerr,"Buy the dip, not the availability",1,1742689318.0,2025-03-23 00:21:58
1jhljnr,Routine-Duck6896,I did 100 so far,1,1742714040.0,2025-03-23 07:14:00
1jhljnr,GlobalEnergetix,Doge is going to the Moon!,1,1742726459.0,2025-03-23 10:40:59
1jhljnr,TheUglyWeb,\-ZERO- I have all the funds in DOGE I intend to invest.,1,1742741787.0,2025-03-23 14:56:27
1jhljnr,Exciting-Biscotti-38,Yes. My whole $50 after tax prep fees,1,1742753865.0,2025-03-23 18:17:45
1jhljnr,thatdudeweswes,What refund? 😂🥲😢😭,1,1742764846.0,2025-03-23 21:20:46
1jhljnr,Amputee69,"Me! Me! 🤚Right here!! I'm safe, VERY safe. I just break even with that bunch of outlaws.",1,1742782805.0,2025-03-24 02:20:05
1jhljnr,Technical_Moose8478,Tax refund? I live in America and don’t own my own jet. I’ll be investing in a jar of peanut butter.,1,1742816581.0,2025-03-24 11:43:01
1jhljnr,bitcoin_islander,Well the govt garnished mine so not me :(,1,1742962713.0,2025-03-26 04:18:33
1jhljnr,BatmanBhop,Yall haven't got your refund yet?,1,1742687245.0,2025-03-22 23:47:25
1jhljnr,Pelthail,"Already got mine, not making that mistake again for the third time. I’ve already got $6K locked up in it.",1,1742689827.0,2025-03-23 00:30:27
1jhljnr,DesconocidoTres,Unless there is a big price drop. No.,1,1742695026.0,2025-03-23 01:57:06
1jhljnr,Allboutdadoge,"You realize that the people working for DOGE are getting paid 6 figures on the taxpayers dime, right?  You are already invested.  Heavily.     Oh wait, you mean the ponzicoin that my username is unceremoniously referencing? No.",-2,1742686756.0,2025-03-22 23:39:16
1jhljnr,MastersClinicalRehab,Never put a dollar into DOGE or anything related to it. Let it tank like Tesla...,-7,1742687965.0,2025-03-22 23:59:25
1jhljnr,Tlaim,"Mine went to dugs. Much, wow.",0,1742694074.0,2025-03-23 01:41:14
1jhljnr,thumbdrip,Stop buying this garbage.  Wake up.  OMG.  I was a believer also.  Move on.,-1,1742700521.0,2025-03-23 03:28:41
1jhljnr,Alvarius,Why the hell would I buy more coins tarnished by the douche trying to make sure no non-billionaire ever gets a refund ever again?,-7,1742691070.0,2025-03-23 00:51:10
1jhljnr,ArtInfinite5179,I guess we are all in the same boat on owing taxes 😂,0,1742687636.0,2025-03-22 23:53:56
1jhljnr,PuG3_14,What is this refund you speak of?,0,1742687773.0,2025-03-22 23:56:13
1jhljnr,Gmantle22,What’s a refund and how do I get one?,0,1742688426.0,2025-03-23 00:07:06
1jhljnr,N/A,lol we owe😂,0,1742698437.0,2025-03-23 02:53:57
1jhljnr,Bangbang_burrito,Do people get refunds??? Damn I'm missing out 🤣,0,1742708299.0,2025-03-23 05:38:19
1jhljnr,Sad_Border_3874,Refund? What’s a refund?,0,1742709847.0,2025-03-23 06:04:07
1jhljnr,No-Plastic-4640,I’ll be buying once the market fully hits the bottom. Cycle is over. Wait. Reposition. And some very profitable horizontal trading begins. (Not doge though. High priced fluctuations are more profitable),0,1742711837.0,2025-03-23 06:37:17
1jhljnr,schrandomiser,"How cute, thinking they are getting a tax return.",0,1742726705.0,2025-03-23 10:45:05
1jhljnr,nimwok69,🤣,0,1742748225.0,2025-03-23 16:43:45
1jhljnr,Affectionate_Age752,Getting a refund might also mean that you have a side business that allows you to have enough deductions to get money back from your regular job taxes.,0,1742749990.0,2025-03-23 17:13:10
1jhljnr,FeuerMarke,I always owe. Why give the government a interest free loan?,0,1742770429.0,2025-03-23 22:53:49
1jhljnr,LearnTheirLetters,You guys are getting a refund?,-1,1742689154.0,2025-03-23 00:19:14
1jhljnr,malacosa,Refund?,-1,1742689789.0,2025-03-23 00:29:49
1jhljnr,Kanguin,Wait you get a refund?,-1,1742691786.0,2025-03-23 01:03:06
1jhljnr,rludqig39,Do you get penalized for that?,3,1742689815.0,2025-03-23 00:30:15
1jhljnr,floyd1550,BLASPHEMY!,-1,1742697208.0,2025-03-23 02:33:28
1jhljnr,dankill1,"Damn, I swear I just paid those things. I need to sell some lumber or something, to break even.",0,1742688325.0,2025-03-23 00:05:25
1jhljnr,N/A,[deleted],5,1742691693.0,2025-03-23 01:01:33
1jhljnr,ArtInfinite5179,You and me both 🤫,1,1742689061.0,2025-03-23 00:17:41
1jhljnr,elscorcho96,Lol,1,1742687149.0,2025-03-22 23:45:49
1jhljnr,FeuerMarke,FOMO got you good during that bull run.,1,1742770730.0,2025-03-23 22:58:50
1jhljnr,socalsilverback,You mean as soon as it hits s ATH,1,1742752802.0,2025-03-23 18:00:02
1jhljnr,liquid_at,dogecoin is not affiliated with any government. there are no government workers in dogecoin.,3,1742721844.0,2025-03-23 09:24:04
1jhljnr,liquid_at,"believing is always bad. when it is positive just like when it is negative.  replacing bullish faith with bearish faith is just a sentiment change, but not really growth...",2,1742721928.0,2025-03-23 09:25:28
1jhljnr,Perc30popper98,"The only reason you get a refund, hear me out, is because you gave the government to much money. Hes is trying to stop that. 🤦",1,1742729898.0,2025-03-23 11:38:18
1jhljnr,ArtInfinite5179,Whoa calm down Jamal 😳,-5,1742691280.0,2025-03-23 00:54:40
1jhljnr,kmookie,No you’re basically not giving the government a free loan. The less you have them take out during the year the more you owe but it’s better in your pocket than theres….especially now.,3,1742694979.0,2025-03-23 01:56:19
1jhljnr,N/A,[deleted],1,1742692126.0,2025-03-23 01:08:46
1jhljnr,Walled_en,I’ll trade you 2 sheep and a bushel of wheat for your lumber!,5,1742691025.0,2025-03-23 00:50:25
1jhljnr,Independent_Sir8960,😂😂😂😂,2,1742691982.0,2025-03-23 01:06:22
1jhljnr,Alvarius,"Actually thanks to tariffs, people who buy things (you know, like MOST people) will be paying more. They want tax cuts for billionaires and for the rest of us to work 60 hours a week to barely be out of poverty. Don’t be a fool.",1,1742761488.0,2025-03-23 20:24:48
1jhljnr,Medical-Conflict-438,Yes put it in a high yield interest account all year until it comes time to pay it. I love how you're down voted it shows so many on reddit don't know how taxes work lol.,6,1742740967.0,2025-03-23 14:42:47
1jhljnr,PrintinghouseImp,All the downvotes on an obvious statement of fact is odd.,2,1742769549.0,2025-03-23 22:39:09
1jhljnr,No-Plastic-4640,This. Over paying taxes is not necessary.  Though most people will not have the extra funds if they owe. It’s usually an income level that determines financial savvy decisions.  Of course this is a small one of many.,1,1742711739.0,2025-03-23 06:35:39
1jhljnr,Jamman636,"I owe 20k this year, despite already paying over 400k in taxes, so not necessarily.",-8,1742694193.0,2025-03-23 01:43:13
1jhljnr,dankill1,Word. Male and Female?,0,1742691118.0,2025-03-23 00:51:58
1jhljnr,kmookie,"LMAO! I actually just noticed that! Oh well. Not to sound harsh but this is why I’ve lost faith in our culture. Downvoting a completely non-offensive comment to be sensible is considered negative.   This will really get downvoted once I also say…… this country is filled with idiots, at least 50%.  It’s why we have billionaires, 1% have figured out how to extort the stupidity, then that same 50% bite the hand that tries to help them.",4,1742741545.0,2025-03-23 14:52:25
1jhljnr,kmookie,Excellent point. A person has to be mindful of their spending so when taxes come due you have them. Arguably this is part of the problem.  People look at this as a government payday/ when it’s your money and you should be encouraged to manage it better.,0,1742741238.0,2025-03-23 14:47:18
1jhljnr,Walled_en,Oh I’ve got no idea. I just need the lumber to build a road,2,1742691197.0,2025-03-23 00:53:17
1jhljnr,cuddlyrhinoceros,Pervert,1,1742691490.0,2025-03-23 00:58:10
1jhljnr,Medical-Conflict-438,"Exactly, I think you're being generous. Reddit has some of the lowest iq keyboard warriors😂",3,1742741691.0,2025-03-23 14:54:51
1jhljnr,dankill1,Word.,0,1742695866.0,2025-03-23 02:11:06
1jhljnr,dankill1,"Man, after Corona,....",1,1742695820.0,2025-03-23 02:10:20
1jhk3kk,N/A,Want a car or need a car,6,1742683482.0,2025-03-22 22:44:42
1jhk3kk,3ugeye,What kinda car are we talking about?,3,1742689828.0,2025-03-23 00:30:28
1jhk3kk,justhuman1618,"If you haven’t done so yet, a good rule of thumb is to wait to buy for at least 2-4 weeks. If it’s still something you’d want, get it, but trust me, a car is not worth an asset.   Cars are junk, immediately and constantly deprecate in value, and cost money for upkeep. They’re a money pit. If you can afford to do it because you’re in a good place in life, go for it, but seeing as the state of everything is tough and only getting tougher, I’d hold on to any assets youve got for dear life.",3,1742744751.0,2025-03-23 15:45:51
1jhk3kk,ItsTheBreadman92,Personally… i just hold it.    You sell for a loss and whip a new car and the car gets boring and then you just for fun check doge and oh no i woulda been positive..   Done it myself on things other than doge as well.   Just follow rule 1. Don’t invest money you WANT for spendin,2,1742692196.0,2025-03-23 01:09:56
1jhk3kk,Drizzy4201,I'd never sell for a loss.. I'll go down with the ship before I sell 🤣,2,1742699986.0,2025-03-23 03:19:46
1jhk3kk,Richar_16,DCA. DCA. DCA. Dont look back. Dont sell. Just hold brother,2,1742681873.0,2025-03-22 22:17:53
1jhk3kk,hodlinsteady,"By the amount of words you've written, it looks grim. Escape to a country with no extradition is your only option now.",1,1742682620.0,2025-03-22 22:30:20
1jhk3kk,poundtownpete,Couple of things I think. Only you know how bad you need the money. If you gotta take the loss then you gotta do what you gotta do. I think it'll pump but I'm not sure it'll pump that soon. I obviously have no real idea though.,1,1742683887.0,2025-03-22 22:51:27
1jhk3kk,N/A,You might try perpetual contracts.  You can make money when it goes down or up.,1,1742685113.0,2025-03-22 23:11:53
1jhk3kk,Patient_Artichoke355,You get some outstanding advice on these threads..lol,1,1742685129.0,2025-03-22 23:12:09
1jhk3kk,jefother-edig1999,keep your doge for now and spend the next few months saving to cover what you are down at this point. If doge recovers a little by then then when you sell you will have money left over. If it doesn't recover then you are no worse off then you are now. If it keeps declining then keep saving. until it recovers if you believe in it.,1,1742700239.0,2025-03-23 03:23:59
1jhk3kk,Dumbazzhoe89,"I’m 17 k in the hole and I’m not selling, some are not meant for this game. Hold hold hold. It’s just a # on a screen for now",1,1742704040.0,2025-03-23 04:27:20
1jhk3kk,NeonSage22,"Think long term, beyond the next few months. You can’t lose (initial investment) what you don’t sell. Cars are a liability and will always depreciate. Yea it’s enticing, especially at 19 to have a nice vehicle. It sounds like you have a sizable investment in Doge. Be patient. Future you would prefer holding the Doge investment…just my opinion, not financial advise",1,1742744904.0,2025-03-23 15:48:24
1jhk3kk,MrSushi1115,Another bag holder bites the dust,1,1742745401.0,2025-03-23 15:56:41
1jhk3kk,Professional_Emu_935,Don’t pull it out - make more money for 4 months and if you’re still at a loss then sell and buy the car.,1,1742760362.0,2025-03-23 20:06:02
1jhk3kk,skeetabeater,"I think you should hold. I personally think the crypto market has bottomed out but I could be wrong. You're only young and getting a decent car should be fine at your age as opposed to a nice car. You will kick yourself harder if the price of dogecoin his say 70c which isn't impossible, at least in Aussies dollars.",1,1742790090.0,2025-03-24 04:21:30
1jhk3kk,Acrobatic-Support939,It’s popping back up now 0.18,1,1742827020.0,2025-03-24 14:37:00
1jhk3kk,N/A,Sell it all at a loss like most do.. it is how crypto,0,1742682440.0,2025-03-22 22:27:20
1jhk3kk,Extension-Lie-3272,This is so sad. Are we even investing anymore?,-1,1742692532.0,2025-03-23 01:15:32
1jhk3kk,MaleOrganDonorMember,Doge is a terrible investment for almost everyone,-1,1742701231.0,2025-03-23 03:40:31
1jhk3kk,N/A,Pretty sure it's going to 2-5c in this bear market.,-1,1742707964.0,2025-03-23 05:32:44
1jhk3kk,Practical-Lecture946,Take the loss and move on mentally. Yes it could go up. But it could also go down and your $3k loss turns to $6k loss.,-1,1742708451.0,2025-03-23 05:40:51
1jhk3kk,ArtInfinite5179,He wants a nice car cause if he needed one he wouldn’t be looking for a nice car lol,9,1742684386.0,2025-03-22 22:59:46
1jhk3kk,SnooDrawings5837,It’s a bmw f22 m235i. I would say it’s a nice car in my eyes as I’m 19😂,-10,1742690582.0,2025-03-23 00:43:02
1jhk3kk,SnooDrawings5837,"Yeah I defo am, just wondering wether I should hold past May or not",1,1742682506.0,2025-03-22 22:28:26
1jhk3kk,SnooDrawings5837,I wouldn’t say it’s that bad lol😂 down about 3k but I’ve see a LOT worse in the subreddit,1,1742682677.0,2025-03-22 22:31:17
1jhk3kk,SnooDrawings5837,"Very well said sir. I think it will pump too, all I need is it to pump to 0.35 and I will be at a net loss so. If it pumps even further to 0.45/0.50 I will make a nice bit of money but, we will see lol",3,1742684306.0,2025-03-22 22:58:26
1jhk3kk,liquid_at,"So you regularly invest in things you do not understand, without researching them or having an exit strategy, so you speak from experience at selling at a loss, making you the expert on the subject?  Listen up folks! Mr expert will teach you how to lose money professionally. Stop losing small amounts like a total noob and learn how to maximize your losses.  /s",1,1742730877.0,2025-03-23 11:54:37
1jhk3kk,SnooDrawings5837,Couldn’t of said it better myself hahaha,2,1742690229.0,2025-03-23 00:37:09
1jhk3kk,Lickyourpie,Ur 19…. Get a cheap car u got a long expensive life ahead of u bud. Driving a bmw doesn’t make u cooler hold that doge why would u be okay with losing 3k when it will eventually got back to ur average make it make sense please,5,1742702780.0,2025-03-23 04:06:20
1jhk3kk,Gloomy_Setting5936,Dude downvoted me LOL. He will learn the hard way guys.,4,1742697243.0,2025-03-23 02:34:03
1jhk3kk,Fun_Raise_7858,BMW is not a reliable car.,5,1742692805.0,2025-03-23 01:20:05
1jhk3kk,3ugeye,"Nice, looks like a fun car. Just heads up for being 19 that insurance may be costly. Were you trying to pay cash in full? Personal opinion… i’d keep stacking, whether that’s cash or investments. Get a fun beater car. I wish I had started investing when I was 19. I started at 30…",2,1742699219.0,2025-03-23 03:06:59
1jhk3kk,Gloomy_Setting5936,"I’m in a similar situation as you. The primary reason I invested in DOGE is because I need a new car. I’m planning on getting a 2023-2024 Honda Civic Sport. I have a kid and it’s perfect for me at this point in my life, I’m a car enthusiast, the BMW will come later.   I think getting a BMW at 19 is an unwise financial decision, it’s too much car for someone your age. I’m 28 and believe me I can understand your mindset, you want to be the slick young guy who wants to impress everyone with his German luxury car, but hey do you bro. You will learn eventually.",1,1742696708.0,2025-03-23 02:25:08
1jhk3kk,AnAbandonedAstronaut,"Good odds sideways in a range with a few bounces for the next 4 years.  Lots of deregulation talk and a US SEC head that fought FOR hedge funds has the market a bit scared, atm.  However, sideways way under your cost could be a good dca time.",2,1742683441.0,2025-03-22 22:44:01
1jhk3kk,Practical-Lecture946,Someone is down bad huh?,1,1742736222.0,2025-03-23 13:23:42
1jhk3kk,SnooDrawings5837,"I’m not okay with me loosing 3k, I would be very sad, but for me and in my situation it would mean I would have to save up a few more months/ wait a few more months to buy the car I want",0,1742722474.0,2025-03-23 09:34:34
1jhk3kk,SnooDrawings5837,"Well to say BMW isn’t a reliable car is quite a broad statement. Man BMWs aren’t reliable but many are, the one I’m getting is pretty reliable, as long as it has been maintained well",1,1742721453.0,2025-03-23 09:17:33
1jhk3kk,SnooDrawings5837,"Yeah going to pay in cash. Yeah the insurance is quite costly especially as I live in the uk, but it still isnf awful or anywhere near as bad as some other people. Honestly that’s what I was thinking. I think I’m going to buy the car anyways, and have it for a year or two, and if I think it’s too expensive to maintain then I will get rid of it. I’m already saving quite a lot of money and have been since I was 17, if I didn’t already have a tasty amount of extra cash sitting around I wouldn’t have been thinking about buying this car haha!",1,1742722270.0,2025-03-23 09:31:10
1jhk3kk,digitalr3lapse,"Sideways for 4 years? What makes you think this cycle is going to be any different than every one in the past?  And don't say ""mass adoption"", people were screaming that last cycle right before the crash...",1,1742850657.0,2025-03-24 21:10:57
1jhk3kk,liquid_at,Probably. Some people like fomo more than learning.,1,1742738348.0,2025-03-23 13:59:08
1jhk3kk,NeonSage22,Doge could 2-3x by the end of this year. Which is more important?,1,1742744976.0,2025-03-23 15:49:36
1jhk3kk,Fun_Raise_7858,Try it and see. Put some money aside...,1,1742728686.0,2025-03-23 11:18:06
1jhk3kk,bitcoin_islander,I guess you gotta learn the hard way so go for it. Once you've figured out what a slave rat race is you will wish you kept dogecoin and retired early.,1,1742963245.0,2025-03-26 04:27:25
1jhk3kk,bitcoin_islander,More like 20x,1,1742963145.0,2025-03-26 04:25:45
