post_id,author,body,score,created_utc,date
1kfusdl,NotSoGreatGonzo,"No, actually it is my answer to ”Not remotely possible”.",1,1746614670.0,2025-05-07 10:44:30
1kfusdl,Corey307,"That your hypothetical is nonsense. No major retailer takes doge. Very few mom and pop shops even take it. There is no reason to assume it will ever be adopted as currency. Even then, Dogecoin is never going to have a $5.4 trillion market cap. That’s nearly 3 times the current market cap for bitcoin and more than twice the highest market cap bitcoin has ever had.",1,1746551198.0,2025-05-06 17:06:38
1kftvcp,_This_Is_Ridiculous,"Someone who posts ""I’m just buy buy buying large amounts. Crash it all the way if you can?"" has like $50 worth of Doge.",6,1746538586.0,2025-05-06 13:36:26
1kftvcp,hodlinsteady,"You are starting to frighten people, please back it down defcon tweaker status 2. Thank you",5,1746508114.0,2025-05-06 05:08:34
1kftvcp,Ambitious-Apple1125,sucks when you buy high huh,3,1746531580.0,2025-05-06 11:39:40
1kftvcp,poundsdpound,"MY tactic is to buy (much WOW) when it's extremely high/expensive and then inevitably sell when it has dipped back down again, at a negative total profit of my original amount.  Anyone else with me?",2,1746550959.0,2025-05-06 17:02:39
1kftvcp,Glum-Beach-1621,"i am sold yesterday that was drain money, powell if not cut interest this can be look badly :3",2,1746498821.0,2025-05-06 02:33:41
1kftvcp,Glum-Beach-1621,DONE,1,1746529611.0,2025-05-06 11:06:51
1kftvcp,GJustGotaBag,I’m just buy buy buying large amounts. Crash it all the way if you can?🤡🤣,-3,1746498772.0,2025-05-06 02:32:52
1kftvcp,True-Culture2804,Wait for the FOMC meeting bruh,0,1746529304.0,2025-05-06 11:01:44
1kftvcp,friendly-survivor,he bought high when he should have bought schizo meds,3,1746543071.0,2025-05-06 14:51:11
1kftvcp,Famous_Entrance3022,This is the ONLY WAY ... B.H.S.L 💪💪💪,1,1746564286.0,2025-05-06 20:44:46
1kftvcp,GJustGotaBag,We will see who wins & loses!,-3,1746499175.0,2025-05-06 02:39:35
1kftvcp,ItsJustAnotherVoice,So you want it to go to zero? The logic here makes no sense..,1,1746541848.0,2025-05-06 14:30:48
1kfqoqj,Other_Lucky,This sub shows me how stupid doge/crypto people really be,23,1746490854.0,2025-05-06 00:20:54
1kfqoqj,rastafarihippy,I got Me some more. Since I'm an idiot and all ...,3,1746492849.0,2025-05-06 00:54:09
1kfqoqj,Ir0nman123,It’s happening!,3,1746490289.0,2025-05-06 00:11:29
1kfqoqj,Agile-Common-1448,bought 30k worth more at 14,2,1746491697.0,2025-05-06 00:34:57
1kfqoqj,Routine-Duck6896,How many times you gonna post today alone,1,1746489839.0,2025-05-06 00:03:59
1kfqoqj,SithC,"Down, down, down, down.",2,1746493862.0,2025-05-06 01:11:02
1kfqoqj,Vegetable_Holiday835,Funny how Bitcoin now at 97k and Doge still at 17 cents😔,1,1746610705.0,2025-05-07 09:38:25
1kfqoqj,Famous_Entrance3022,"There's no underlying value to DOGE ... until there is   HODL and smile everyone! Depending on where you're at , might be beautiful out. Go rub one out in the woods, become one w nature ..",0,1746564377.0,2025-05-06 20:46:17
1kfqoqj,Jets237,![gif](giphy|Q40zmeFedhkbhISnwj|downsized),3,1746501599.0,2025-05-06 03:19:59
1kfqoqj,GJustGotaBag,This comment shows that you can’t identify an undervalued play.,-8,1746498335.0,2025-05-06 02:25:35
1kfqoqj,GJustGotaBag,As much as I want to random. Just wait until you see my return clown.,-3,1746498018.0,2025-05-06 02:20:18
1kfqoqj,GJustGotaBag,This is why you don’t get fat returns.,-2,1746498121.0,2025-05-06 02:22:01
1kfqoqj,dinkerdong,it is under valued bc there is no underlying value,5,1746501102.0,2025-05-06 03:11:42
1kfqoqj,Other_Lucky,When moon ?,3,1746503707.0,2025-05-06 03:55:07
1kfqoqj,Gold_Jellyfish227,We'll be waiting,3,1746506421.0,2025-05-06 04:40:21
1kfqoqj,ANeeSH20,😆😂🤣🤣😭,2,1746505399.0,2025-05-06 04:23:19
