post_id,author,body,score,created_utc,date
1jxp8bh,Extension-Lie-3272,Depression anxiety and insanity not included.,4,1744486880.0,2025-04-12 19:41:20
1jxp8bh,Fun_Raise_7858,👀,2,1744486434.0,2025-04-12 19:33:54
1jxp8bh,PrincessAela,Wait for it…,1,1744496733.0,2025-04-12 22:25:33
1jxp8bh,N/A,"Brother man, that is the entry exam to Reddit",2,1744492404.0,2025-04-12 21:13:24
1jxopr5,hodlinsteady,"""Fly Dogecoin fly""  Tony Montana",5,1744488225.0,2025-04-12 20:03:45
1jxopr5,Ir0nman123,Is doge going to slip on the banana peel? Wen un Fk my life? Wen banana? 🍌,2,1744502483.0,2025-04-13 00:01:23
1jxopr5,horseradish13332238,Ok new guy,1,1744800867.0,2025-04-16 10:54:27
1jxopr5,AudienceBubbly4817,Lordy help em. Just buy bottom.,1,1745608873.0,2025-04-25 19:21:13
1jxopr5,AudienceBubbly4817,How’s this aged?,0,1745608847.0,2025-04-25 19:20:47
1jxopr5,horseradish13332238,In the last 9 days?   Pretty well considering none of your pretties are flying?   Weirdo.,1,1745610448.0,2025-04-25 19:47:28
1jxopr5,AudienceBubbly4817,Quick with it.  Patience is a learnt trait.,1,1745610614.0,2025-04-25 19:50:14
1jxopr5,horseradish13332238,So is English.,1,1745610883.0,2025-04-25 19:54:43
1jxopr5,AudienceBubbly4817,So fast.,1,1745611230.0,2025-04-25 20:00:30
1jxk7yw,lalvapalooza,You know… you can milk anything with nipples.,9,1744487224.0,2025-04-12 19:47:04
1jxk7yw,Agile-Property-9365,“Tokens”…,4,1744515732.0,2025-04-13 03:42:12
1jxk7yw,Fulvio55,"Except these stupid posts are total bullshit. And only stupid people take any notice of them.  ALL trading activity is invisible. It happens on private ledgers each exchange operates, and only they can see who does what.  Onchain transfers are NOT buying or selling. And for the most part they’re just exchanges doing their regular housekeeping.  So do the sub a favour and don’t share this garbage. We have enough sewage already and don’t need more. 💩",3,1744514089.0,2025-04-13 03:14:49
1jxk7yw,Gloomy_Setting5936,The pump is coming… 📈,9,1744475571.0,2025-04-12 16:32:51
1jxk7yw,EscapeFacebook,I bought today,2,1744491229.0,2025-04-12 20:53:49
1jxk7yw,Consistent-Set-913,The Protocol mints 80m tokens in 5.5 days. Who cares doge is short for dogshit,-7,1744480002.0,2025-04-12 17:46:42
1jxk7yw,Extension-Lie-3272,That's so sad .20 we are going to the moon. .20 is the new all time high,0,1744496355.0,2025-04-12 22:19:15
1jxk7yw,itsalawnchair,"these hype moonbois don't understand the nature of dogecoin or how it is built. We pump brand spanking new coins at a rate no other PoW blockchain does and we will keep doing that for eternity.  Price action is NOT the play for dogecoin, the sooner you understand this the better you will be.      Per Minute: Ð10,000/min      Per Hour: Ð600,000/hr      Per Day: Ð14,400,000/day      Per Week: Ð100,800,000/week      Per Month (30 days): Ð432,000,000/month      Per Year: Ð5,256,000,000/year   Ð80M?pffft we will eat that up in less than a week.",0,1744503539.0,2025-04-13 00:18:59
1jxk7yw,Upset-Adhesiveness75,Hate this,-6,1744473514.0,2025-04-12 15:58:34
1jxk7yw,pmoorer,I just watched this movie last night! lol. I have nipples Greg can ya milk me????,3,1744556664.0,2025-04-13 15:04:24
1jxk7yw,Fun_Raise_7858,🤣👍,1,1744492852.0,2025-04-12 21:20:52
1jxk7yw,3D-Doge,"or ""shares"" smh",2,1744527421.0,2025-04-13 06:57:01
1jxk7yw,Ryan_min,"Almost all major exchange today have public orders book  with trading volume and price levels, isn't that enough to makes a part of the trading activity ""visible"" ? Just asking ",1,1744652310.0,2025-04-14 17:38:30
1jxk7yw,GJustGotaBag,100% Value is value. We can let the numbers speak for themselves.,3,1744492714.0,2025-04-12 21:18:34
1jxk7yw,Impressive-Spend-497,Don’t ruin it for the idiots.,-5,1744481042.0,2025-04-12 18:04:02
1jxk7yw,PythonsByX,What hahaha.... Be worth less than pennies soon at that rate,-10,1744483764.0,2025-04-12 18:49:24
1jxk7yw,Fulvio55,"Seems you don’t understand that this is the only reason Dogecoin still exists.  It was supposed to die early in 2015 when we reached the end of our mining schedule. That was the entire point Jackson was trying to make. We just got lucky that Billy made a mistake, or we’d have been then what Bitcoin Gold is now. Dead and buried.  So knock it off with the crap about new coins, and be thankful for them instead.",0,1744513803.0,2025-04-13 03:10:03
1jxk7yw,Fulvio55,"Nope. Because you have no idea who’s doing what, or how much they have. You could be sitting next to an actual whale on the bus, and you’d never know. And if he were trading say 100 doge parcels, that wouldn’t tell you he’s a whale.  People read far too much into things, not because they gain insights, but because they want to believe something that simply isn’t true.  Like, you know, every single prediction here of doom or moon by tomorrow lunchtime. Scroll back and see just how much wasted space these clowns have created here.",1,1744675404.0,2025-04-15 00:03:24
1jxk7yw,Consistent-Set-913,Exactly. It’s trash,-9,1744483861.0,2025-04-12 18:51:01
1jxk7yw,itsalawnchair,"probably I was not clear enough.     I'm thankful for the new coins, I'm not againt it.      I'm just pointing out that because we mint 10K/min price is not going to be affected by someone buyin 80Million.      Price increase is not the goal.",1,1744517452.0,2025-04-13 04:10:52
1jxk7yw,xBlitzgewitter,Why are you here then?,8,1744489079.0,2025-04-12 20:17:59
1jxk7yw,3ugeye,Bet a lot of the crap you buy day to day just ends up being trash 🤔,0,1744500382.0,2025-04-12 23:26:22
1jxk7yw,Fulvio55,"Agreed.  However as I told OP, nobody ‘bought’ 80 mil at all. These idiotic ‘whale’ reports are simply exchanges moving coins around as part of their normal operations, that’s all.  Also, there’s another generally overlooked fact. If the price stays constant, the market cap will still increase because those new coins increase the supply. So an arbitrary price today is actually greater than the same price previously.  In time (and no, we won’t live that long) we’re going to overtake everything that has a cap on it. Particularly considering they will cease to exist if they don’t remove their caps. But that’s another story.",1,1744526090.0,2025-04-13 06:34:50
1jxk7yw,greenthumbgoody,Cuz watching you guys circlejerk each other is fun Edit: tO tHE mOoN!,-6,1744494047.0,2025-04-12 21:40:47
1jxk7yw,Ranger523,This comment seems like a desperate attempt to keep your 1% flair.,2,1744542812.0,2025-04-13 11:13:32
1jxk7yw,Ranger523,"This makes no sense to me. Limited supplies make something valuable, and unlimited supplies make things worthless.",1,1744543046.0,2025-04-13 11:17:26
1jxk7yw,xBlitzgewitter,Well seems fair. I do that too in other subs but I dont spread negativity while watching people,3,1744494333.0,2025-04-12 21:45:33
1jxk7yw,3ugeye,Oh did I strike a chord with ya? 1% Flair 🤣 Bro your hilarious,-1,1744553926.0,2025-04-13 14:18:46
1jxk7yw,Fulvio55,"Nope.  That may apply in the real world, but not in this case.  If it were true, Bitcoin, which releases many many times more than we do, would be worthless too.",0,1744577859.0,2025-04-13 20:57:39
1jxk7yw,greenthumbgoody,Yeah but y’all are some clowns in here so I get it,0,1744526168.0,2025-04-13 06:36:08
1jxk7yw,Ranger523,Not at all. I just love seeing people's pathetic comments and attempts to keep their little flair so they can feel some sort of relevant feeling in the sad life they must live.,2,1744554186.0,2025-04-13 14:23:06
1jxk7yw,Ranger523,"But it's known to have a limit to its supply, so that analogy didn't help.",1,1744600461.0,2025-04-14 03:14:21
1jxk7yw,3ugeye,I don’t even know what flair is? Is this the reddit life?,-1,1744559489.0,2025-04-13 15:51:29
1jxf6pz,Jew_Man_Chu,*looks at doge 90 day chart  -52%…,83,1744458373.0,2025-04-12 11:46:13
1jxf6pz,Remarkable_Misty,And doge is down over 50% in the last 60 days,41,1744459766.0,2025-04-12 12:09:26
1jxf6pz,coronaflo,"What are you buying crypto with, Dogecoin or otherwise?",9,1744463267.0,2025-04-12 13:07:47
1jxf6pz,rastafarihippy,I'm a buyer. Not a seller. 1 day I'll change,14,1744459597.0,2025-04-12 12:06:37
1jxf6pz,tgarrettallen,I’m on vacation and I’m feeling it.,4,1744469751.0,2025-04-12 14:55:51
1jxf6pz,According-Dog-7288,I like looking at one currency versus another but a long term thing I notice is all of them are going down relative to an ounce of gold or silver,5,1744472888.0,2025-04-12 15:48:08
1jxf6pz,ilfollevolo,This is terror propaganda tactic… kids don’t fall for this,7,1744473232.0,2025-04-12 15:53:52
1jxf6pz,Commercial_Ease8053,"Hahah is this another bag holder post? It peaked literally FOUR years ago and it’s now at 25% of its ATH… but yeah, keep cooking, go on.",5,1744483433.0,2025-04-12 18:43:53
1jxf6pz,nickert0n,[https://www.cnn.com/2025/04/12/tech/trump-electronics-china-tariffs/index.html](https://www.cnn.com/2025/04/12/tech/trump-electronics-china-tariffs/index.html),2,1744468893.0,2025-04-12 14:41:33
1jxf6pz,Consistent-Set-913,"Doge motto  “We mint 10,000 coins a minute what could go wrong!!”",2,1744479598.0,2025-04-12 17:39:58
1jxf6pz,Lxrd_Dxrkskin,"Now’s the best time to get in. Prices of Doge are low, down 52% last I checked. I bought more doge😂",2,1744523125.0,2025-04-13 05:45:25
1jxf6pz,Feisty-Committee109,It's short-term and has already been addressed.  Short-term pain for long-term gains.,2,1744510765.0,2025-04-13 02:19:25
1jxf6pz,Frikoulas,"Yeah, you're so right. I'm really wondering if I should get in to a coin that peaked 4 years ago and now is 77.5% down.",1,1744476991.0,2025-04-12 16:56:31
1jxf6pz,asloan420,People forget……..crypto is the most liquid thing on the planet and worth holding in case of emergency at the very least……..I bought a bitcoin recently and it took Bank of America 5 business days to transfer $80k. I don’t want any doll hairs at this point and I don’t want to ever have a bank tell me how and when I can get my money……..there will be a run on the banks sooner than later and you’ll be the smartest guy in the room holding some super liquid dog coins,2,1744477879.0,2025-04-12 17:11:19
1jxf6pz,God-Emperor-Pepe,![gif](giphy|LpkBAUDg53FI8xLmg1|downsized),1,1744467789.0,2025-04-12 14:23:09
1jxf6pz,Puzzleheaded_Cap_336,Yes,1,1744468151.0,2025-04-12 14:29:11
1jxf6pz,snorlaxtubbs,Woahh,1,1744468972.0,2025-04-12 14:42:52
1jxf6pz,Danger64X,US dollar lost therefore buy doge.   I can’t even fathom this level of fallaciousness.,1,1744475885.0,2025-04-12 16:38:05
1jxf6pz,KindlyBrain6109,How much did doge go up in the same time frame?,1,1744489658.0,2025-04-12 20:27:38
1jxf6pz,Crimision,It is Doomo’clock already?,1,1744517350.0,2025-04-13 04:09:10
1jxf6pz,Claymoreking,Dont get in and wait... We will have a drop the next weeks,1,1744551943.0,2025-04-13 13:45:43
1jxf6pz,Swapuz_com,"While you wait, your USD is losing value! Over the past month, the dollar has dropped **4.5%** against the CHF, JPY, and EUR. The charts don’t lie—currency moves fast, and hesitation can cost you!",1,1744485360.0,2025-04-12 19:16:00
1jxf6pz,Gloomy_Setting5936,Keep smoking that good stuff towelie,-25,1744460180.0,2025-04-12 12:16:20
1jxf6pz,Fun_Raise_7858,🤣,2,1744472374.0,2025-04-12 15:39:34
1jxf6pz,Zealousideal-Past851,It’s going to be rough for awhile but there is definitely gold at the end of the rainbow .. some will get rich and some will be wishing they stayed in the race and some will lose a lot … its just the nature of the game we chose to play 🥂  ![gif](giphy|UPm8BqL6igDUPZ29ik|downsized),6,1744480997.0,2025-04-12 18:03:17
1jxf6pz,liquid_at,"3 years and 11 months as an asset with 4 year cycles....  Like its been a full day since it's last been midnight, around a minute before midnight....",2,1744540817.0,2025-04-13 10:40:17
1jxf6pz,liquid_at,"It's a currency. If you don't understand why currencies aren't designed to be scarce, look it up.",1,1744544013.0,2025-04-13 11:33:33
1jxf6pz,ScullingPointers,"Chyea, that's a really Tuff choice. Maybe reach out to a financial advisor to see what they say? 🧐",2,1744569838.0,2025-04-13 18:43:58
1jxf6pz,Fetuscake69,LMFAOOOOOOOO,0,1744481373.0,2025-04-12 18:09:33
1jxf6pz,Commercial_Ease8053,🤡☠️☠️☠️,0,1744483360.0,2025-04-12 18:42:40
1jxf6pz,ScullingPointers,Yes,1,1744569914.0,2025-04-13 18:45:14
1jxf6pz,Remarkable_Misty,Seems you need to if you think being down over 50% is good,10,1744460243.0,2025-04-12 12:17:23
1jxf6pz,Ranger523,Uhm... can you read a chart?,0,1744541967.0,2025-04-13 10:59:27
1jxf6pz,ilfollevolo,"Stating the obvious. People, make informed decisions with your money!",4,1744490084.0,2025-04-12 20:34:44
1jxenyc,jgarcya,I'm sure a lot of people are like this ... They break even... They sell... Then to the moon!  Then they jump back in... At a much higher price... Then it tanks....  Then the praying again 😊🤣,17,1744459368.0,2025-04-12 12:02:48
1jxenyc,hmmmmmmpsu,"I bought at $0.41.  But I bailed at $0.24.  Feel like a genius for bailing.  Stupid, twisted logic for sure.",12,1744455786.0,2025-04-12 11:03:06
1jxenyc,liquid_at,"That's the type of psychology that allows the big firms to make profits and is why they say retail shouldn't trade...  Too many think it is a casino and gamble money. Emotions have no place in trading and if you feel joy over gains or desperation over losses, you are not trading or investing, you are gambling.   It's not the asset that is to blame, it is the behavior. People will blame the asset for copium as they have for centuries... that's human psychology. But it does not change that it's bad behavior.",4,1744459431.0,2025-04-12 12:03:51
1jxenyc,midnight-cowboy78,It comes in cycles..be patient..,3,1744459751.0,2025-04-12 12:09:11
1jxenyc,N/A,[removed],3,1744615480.0,2025-04-14 07:24:40
1jxenyc,Few_Wrongdoer_1372,my entry was at 0.31c so I sure hope it doesn't get to mine,2,1744466609.0,2025-04-12 14:03:29
1jxenyc,lovejo1,Let me guess.. you bough in 4 months ago. Have some patience man... just wait a bit and it WILL come up.. or it won't.. but you don't need to worry about it every second.,2,1744514727.0,2025-04-13 03:25:27
1jxenyc,Capable-Reach7509,Let’s touch .01 again so I can buy at my entry again,2,1744477366.0,2025-04-12 17:02:46
1jxenyc,Raynman90,"If DOGE ever drops below a penny again, I'm dumping a G",1,1744496205.0,2025-04-12 22:16:45
1jxenyc,SuchDogeHodler,? Mines up from my buy-in.,1,1744516822.0,2025-04-13 04:00:22
1jxenyc,edouvele,Too late  Put more money into it then go to sleep for 2 years,1,1744559689.0,2025-04-13 15:54:49
1jxenyc,lexmansion,It will come back,1,1744578731.0,2025-04-13 21:12:11
1jxenyc,Low-Lab-9237,Hahahahaha goodness 🤣 😂,1,1744835633.0,2025-04-16 20:33:53
1jxenyc,N/A,[deleted],0,1744480356.0,2025-04-12 17:52:36
1jxenyc,EscapeFacebook,I'm just averaging down at these prices.,5,1744470622.0,2025-04-12 15:10:22
1jxenyc,PeterParkerUber,The technical analysis theory of support/resistance levels.  Not that I use T analysis but that’s the logic,0,1744459452.0,2025-04-12 12:04:12
1jxenyc,MikeX7s,All you did was lock in your loses. Sad![gif](emote|free_emotes_pack|sob),11,1744456235.0,2025-04-12 11:10:35
1jxenyc,Raynman90,At least you learned an important lesson,1,1744496235.0,2025-04-12 22:17:15
1jxenyc,firl21,"Technical trading is gambling, fundamentals is investing.",1,1744494107.0,2025-04-12 21:41:47
1jxenyc,Fearless_Agent_1985,❤️ 💙,1,1744623527.0,2025-04-14 09:38:47
1jxenyc,God-Emperor-Pepe,Crypto is not a stock,2,1744482780.0,2025-04-12 18:33:00
1jxenyc,hmmmmmmpsu,I could jump back in if I like with more than what I sold at for the same price.  I still might.,2,1744456368.0,2025-04-12 11:12:48
1jxenyc,liquid_at,"gambling is when you base it on luck. trading is when you base it on data.  If you do not know how to get data, all you have left is gambling.   But that's the same as saying everyone is just roaming around aimlessly, simply because you do not know how a map works.",0,1744530451.0,2025-04-13 07:47:31
1jxenyc,EvaUnit_03,"Or you could jump in now, balancing out your loss gains.   So if you bought now. After selling at 24. It's as if you bought at 32 instead of 41. Or you could ride it to see if it'll go lower. Catch a falling knife.",3,1744488397.0,2025-04-12 20:06:37
1jxenyc,firl21,Blackjack is still gambling even with all the data.  Random walk theory my dude. It’s all gambling.,0,1744552862.0,2025-04-13 14:01:02
1jxenyc,liquid_at,"And card counting is banned because it is gambling, right?  You gamblers and your copium memes are hilarious. Not everyone is a gambler, you're just victims...",1,1744553988.0,2025-04-13 14:19:48
1jxenyc,firl21,Card counting is banned because it’s advantaged play. It’s still gambling but with advantage for the player.,1,1744556848.0,2025-04-13 15:07:28
1jxenyc,liquid_at,"so... it's ""advanced luck"" ?  kiddo... stop listening to memes and use your gray matter to actually do some work. You're contradicting yourself and are trying to argue for a narrative you just accepted without ever thinking about it...",-1,1744557732.0,2025-04-13 15:22:12
1jxenyc,firl21,https://en.m.wikipedia.org/wiki/Advantage_gambling,1,1744563471.0,2025-04-13 16:57:51
1jxenyc,liquid_at,sure. insurance companies are gambling. Trading firms in stocks are also gambling. People crossing the road are gambling. 👍,-1,1744569211.0,2025-04-13 18:33:31
1jxc09v,Inner-Yams,The market tanks and dogecoin pumps hard,2,1744481756.0,2025-04-12 18:15:56
1jx9hl3,AbbreviationsLive475,Guess what I did yesterday OP? I went to Tractor supply and bought a half of dozen Rhode Island Red chicks. Starting my own chicken coop.   And 1 DOGE = 1 DOGE still...  Edit : TBH I didn't read the small print. I agree to an extent; it's definitely a good time to buy if you need to lower your cost average.,5,1744438587.0,2025-04-12 06:16:27
1jx9hl3,AbbreviationsLive475,Cool... On what?,2,1744437511.0,2025-04-12 05:58:31
1jx9hl3,Rshellnizzle,Tomorrow,1,1744642144.0,2025-04-14 14:49:04
1jx9hl3,bodog9696,"If you do more research, you will realize there is NO viable research in cryptocurrency. A crypto chart is a visual representation of what has happened in the past. There is NO WAY to extrapolate a trendline into the future with any confidence.  TAKEAWAY- There is no way to project or forecast the future spot price of crypto currency based on historical data. There are no exceptions to this statement. Anyone claiming to have identified a pattern in historical data that can be extrapolated into the future is 💯 BOGUS.",1,1744829772.0,2025-04-16 18:56:12
1jx9hl3,liquid_at,"So you bought yourself some $EGG miners? Sounds smart. $EGG has gone up in price recently.  And if people don't buy it, you can convert your $EGG to $Omelette or combine it with some $FLOUR and $SUGAR to convert it into $CAKE.   ![gif](giphy|VEsfbW0pBu145PPhOi)",7,1744451281.0,2025-04-12 09:48:01
1jx9hl3,Gloomy_Setting5936,I love this ^,2,1744438768.0,2025-04-12 06:19:28
1jx9hl3,Next-Communication18,Good! I heard they were going cheep…,2,1744505179.0,2025-04-13 00:46:19
1jx9hl3,Dramatic_Ad_6121,Eggs,1,1744437860.0,2025-04-12 06:04:20
1jx9hl3,AbbreviationsLive475,😂,2,1744482700.0,2025-04-12 18:31:40
1jx9hl3,AbbreviationsLive475,They sure were. On sale and sold out fast. They still had an awesome selection left though.,1,1744513444.0,2025-04-13 03:04:04
1jx9hl3,AbbreviationsLive475,I like mine scrambled.,1,1744438012.0,2025-04-12 06:06:52
1jx9hl3,Dramatic_Ad_6121,In this economy??,0,1744438214.0,2025-04-12 06:10:14
1jx9hl3,AbbreviationsLive475,CNN much?,0,1744438383.0,2025-04-12 06:13:03
1jx9hl3,Dramatic_Ad_6121,Reporting live from the gutter,2,1744438517.0,2025-04-12 06:15:17
1jx9gs5,7374616e74,"If you buy low sell high it's a good investment, if you buy high sell low it's not. It's all about time range and you ability to cash out when you should. Little hint, if you happen to buy low and end up in the ""sell high"" situation but you keep thinking it's going up, think this: ""If I had all this as cash, would I yolo it all on this?""",47,1744434462.0,2025-04-12 05:07:42
1jx9gs5,homerdickens,"according to sir isaac newton, what goes down must go up again.",96,1744433404.0,2025-04-12 04:50:04
1jx9gs5,KrumpKrewGaming,"If you look at February 2021, you'll see a perfect example of a good investment.",12,1744435879.0,2025-04-12 05:31:19
1jx9gs5,Apprehensive-Tour942,Trust me bro,7,1744455277.0,2025-04-12 10:54:37
1jx9gs5,Great-Sport2885,"If you look closely it looks eerily similar to a monstrous cup and handle pattern. Cheers my fellow doges, let's all meet up sometime and get drinks or something.",10,1744436204.0,2025-04-12 05:36:44
1jx9gs5,herniatedballs,It's due? xD,9,1744434076.0,2025-04-12 05:01:16
1jx9gs5,nightfly82,If you think it’s gonna do a 1-2x from here than put some money into it and cash out when you reach that goal Mite happen sooner than you think and you will have to pay short term capital gains taxes But have a plan and stick with it If you long term than it will be painful but I am sure over time and stress doge will make another nice move to the upside,6,1744452009.0,2025-04-12 10:00:09
1jx9gs5,zachmoe,"It was good to me, my starting average was .001987.",5,1744464034.0,2025-04-12 13:20:34
1jx9gs5,xxfallen420xx,Look at it in logarithmic view,7,1744435515.0,2025-04-12 05:25:15
1jx9gs5,Fru1tLo0psy,"If it goes from 5 cents to 45 cents that's not 4,000 percent that's 900 percent.",3,1744456523.0,2025-04-12 11:15:23
1jx9gs5,_youarewhatyouyeet,dogecoin? investment? 🤣🤣🤣,3,1744464866.0,2025-04-12 13:34:26
1jx9gs5,liquid_at,"set it to logarithmic view and you know.  You just use a terrible graph for long term view that does not tell you anything of significance because it only looks at one cycle of the entire development.  You picked terrible data, that's the problem.",8,1744449800.0,2025-04-12 09:23:20
1jx9gs5,Impressive-Level-276,sell this rip  and don't buy the next dip  and never hodling,2,1744479847.0,2025-04-12 17:44:07
1jx9gs5,Few_Apartment7318,For broke ppl it’s great bc it gives you time to load up overtime during the bear market buying a lil each paycheck. Then bill market comes around and you clip to you think you’ve found the top and cashout.,2,1744505368.0,2025-04-13 00:49:28
1jx9gs5,Reasonable_Beach_389,It's not buy BTC,2,1744548339.0,2025-04-13 12:45:39
1jx9gs5,Dapper_Detective_919,looks like need to need another 3 years,2,1744549731.0,2025-04-13 13:08:51
1jx9gs5,Ok_Sentence_1332,"When it’s low, you buy. Sell when you’ve made profits. In crypto if you invest in the bear market say 2022-2023. You’ll make at least 300% at some point in the bull market in 2-3 years which is better then most investments stock wise ( besides maybe a few ). Sell and never look back is the key. Literally. Make your money and leave crypto. Best advice if you’re looking for a reason to buy now, I’d say it’s bounced well off 13. But I think we still have some downside with all crypto and the stock market. Trump pausing was just a knee jerk reaction but overall won’t help until the trade war is dealt with and it doesn’t hurt business. Also we got rates being cut ( which I think they will hold off on cutting until later ). And a lot more news economy wise that is coming up in late April and mid may. Good luck to us all.",2,1744434960.0,2025-04-12 05:16:00
1jx9gs5,Few_Schedule_9338,"your mistake is looking at the doge chart instead of the global stock market, trumper is screwing with it and therefore everything is down, cryptos follow BTC movements once stock market bounces back then BTC will and then doge will too. Looking at a doge chart alone is useless.",2,1744447424.0,2025-04-12 08:43:44
1jx9gs5,coldfurify,Try logarithmic,2,1744474333.0,2025-04-12 16:12:13
1jx9gs5,Inner-Yams,Your chart is trash. Zoom out to the 10 year and use logirthmic.,2,1744476056.0,2025-04-12 16:40:56
1jx9gs5,blessedhedonism,Brutal mid-cycle correction.,1,1744441722.0,2025-04-12 07:08:42
1jx9gs5,jalfry,"Trust me bro, buy the dip bro",1,1744445420.0,2025-04-12 08:10:20
1jx9gs5,Intelligent-Session6,Rules are meant to be broken. In DOGE we trust !,1,1744479724.0,2025-04-12 17:42:04
1jx9gs5,splattered_cheesewiz,Because the money of course!!!!!,1,1744513496.0,2025-04-13 03:04:56
1jx9gs5,Gold_Piccolo_4656,"I see multiple points in that chart that would’ve made you a lot of money, also a lot of point that would wreck you so I wouldn’t say a good investment but certainly one worth looking at during the right time",1,1744550672.0,2025-04-13 13:24:32
1jx9gs5,Thick_Expression_796,It’s all about timing,1,1744607962.0,2025-04-14 05:19:22
1jx9gs5,Kushroom710,We are at another bottom. Buy now and resell later for profits,1,1744727080.0,2025-04-15 14:24:40
1jx9gs5,Low-Hold-8563,Where did you buy it?,1,1744855906.0,2025-04-17 02:11:46
1jx9gs5,Byro1218,"You see those peaks, that’s why",1,1744450072.0,2025-04-12 09:27:52
1jx9gs5,DeepPanic3566,Massive cup and a handle it is ☕,1,1744473052.0,2025-04-12 15:50:52
1jx9gs5,DoobOnTheDip,Sounds like you already made up your mind. What’s the point of coming here just to be a wet blanket? Needed an ego boost?,1,1744486526.0,2025-04-12 19:35:26
1jx9gs5,kaedoge,Just zoom out…  You’re only looking at a 4 year period…,-1,1744434524.0,2025-04-12 05:08:44
1jx9gs5,Hanstor,"Someone once told me not to invest in meme coin, and I laughed at them because I felt confident in my ability to read the market. My confidence has been shaken recently, but the market will recover over the summer, and toward the end of the year. people who buy under .30 are gonna be happy.",0,1744435369.0,2025-04-12 05:22:49
1jx9gs5,ForeverPursuing,Just Hold!!!!!  Let Liquid tell you how good of an investment it is.,0,1744444270.0,2025-04-12 07:51:10
