post_id,author,body,score,created_utc,date
1jx9gs5,jgarcya,"Bc the cycle isn't over yet... What goes down comes up...  If the cycle fails to produce a new ATH... Then Doge is done for a few cycles...  Meaning we will get lower highs... Until it bottoms out, and breaks through.  We'll see by May./june",-1,1744441295.0,2025-04-12 07:01:35
1jx9gs5,Deijya,Compare it against etherium?,0,1744439595.0,2025-04-12 06:33:15
1jx9gs5,slykethephoxenix,Why don't you show from 2019?,0,1744447922.0,2025-04-12 08:52:02
1jx9gs5,Tlaim,It has ears just like doge. Both are good,0,1744467016.0,2025-04-12 14:10:16
1jx9gs5,Educational-Basis392,by and hold forever lol,0,1744467461.0,2025-04-12 14:17:41
1jx9gs5,minimal,"Maybe I should have been more specific. I meant NOW, not 2, 5, or 10 years ago. We can all read a chart, and yes some of us made out well, but this is not a healthy chart, logarithmic or not.",0,1744470840.0,2025-04-12 15:14:00
1jx9gs5,Andejusjust,"First of all, that’s the weekly chart. And I’ve made a ton of investment money on it. You just have to not be dumb and yolo your life savings on it.",0,1744473239.0,2025-04-12 15:53:59
1jx9gs5,underwaterotta,Zoom out…,0,1744587651.0,2025-04-13 23:40:51
1jx9gs5,Boring_String6625,Stop crying and wait for the best outcome. New investors have no patience. Things are in the works I never seen this coming since 2013.,0,1744687942.0,2025-04-15 03:32:22
1jx9gs5,Sum-Duud,"When bought in and it disappears decimals like Trump disappears free speakers, it is a good investment.",-1,1744469807.0,2025-04-12 14:56:47
1jx9gs5,No_Tax_5190,That’s a great way to think about that. I had a time where I should have cashed out and if I thought about it like that I definitely would have cashed out,6,1744467565.0,2025-04-12 14:19:25
1jx9gs5,cooterbutt,What if the answer is yes?,1,1744523087.0,2025-04-13 05:44:47
1jx9gs5,oomenya333,That’s more of a trade than an investment,1,1744786658.0,2025-04-16 06:57:38
1jx9gs5,minimal,I can't unlogic your logic. Have my upboat.,27,1744433460.0,2025-04-12 04:51:00
1jx9gs5,Unlucky_Bell_7354,And have my downvote to cancel his upvote,7,1744436993.0,2025-04-12 05:49:53
1jx9gs5,waloshin,Well there are many stocks that went down and then delisted because they went to zero… therefore that logic fails.,3,1744440790.0,2025-04-12 06:53:10
1jx9gs5,Every_Hunt_160,The PUMPA is due !!,8,1744448876.0,2025-04-12 09:07:56
1jx9gs5,Alive_Onion_9708,"Indeed, if you do that you'd be quite depressed",2,1744465227.0,2025-04-12 13:40:27
1jx9gs5,nickert0n,"I agree with you its a great investment, can you explain how logarithmic looks better though?",-2,1744468997.0,2025-04-12 14:43:17
1jx9gs5,Low-Introduction-565,"This is bs, because looking forward noone knows what low or high is.    The real answer is, it's not investing, it's gambling. Make your peace with that op, and then decide if gambling is the lifestyle you want",3,1744452814.0,2025-04-12 10:13:34
1jx9gs5,minimal,"Mined a ton around Christmas 2013, and bought some more throughout the years. Had 4,000,000 at one point. Sold a fair bit of that from $.001 through ~$0.10, and gave away tens of thousands in the old Doge ""pay it forward"" subreddit. I still hold a not insignificant amount.  Full disclosure, I have not bought a single Doge since we broke through the $0.01 floor.",1,1744857376.0,2025-04-17 02:36:16
1jx9gs5,minimal,"No, seriously just looking for a rationale beyond ""it went up before"". I'm a long time holder, and have not bought any doge in nearly a decade. I do see a lot of people posting how they have lost significant (to them) amounts of money following advice here, and am genuinely interested in why anyone would buy at even the current depressed level, or encourage anyone else to do so.",0,1744492702.0,2025-04-12 21:18:22
1jx9gs5,Unlucky_Bell_7354,No profit in 4 years is a pretty bad investment,-1,1744437103.0,2025-04-12 05:51:43
1jx9gs5,liquid_at,"the same people who told you not to invest in meme coins, invented the word meme coin and lost big on scams of the first generation of alts... You chose to trust them on their words...",1,1744449844.0,2025-04-12 09:24:04
1jx9gs5,liquid_at,"S&P-500 lost 20% from pre-inauguration high to low.   1% move on the S&P is considered big.   It's not ""investing"" while a dictator destroys the global economy. It is waiting until the dictator is thrown out and the economy returns to a normal state.   No asset has a true value because no one believes in a future of the planet right now.",-3,1744450006.0,2025-04-12 09:26:46
1jx9gs5,Gloomy_Setting5936,"Exactly, we’ll know in the next month if it’s over or not.",1,1744460403.0,2025-04-12 12:20:03
1jx9gs5,Ok_Record_2074,Your name is cry for help not a handle.,1,1744997550.0,2025-04-18 17:32:30
1jx9gs5,Low_Band_335,and have my upvote to cancel out his downvote,8,1744438148.0,2025-04-12 06:09:08
1jx9gs5,xxfallen420xx,Are u going to elaborate or just hide behind some vague statement?,1,1744478533.0,2025-04-12 17:22:13
1jx9gs5,liquid_at,"Doge traditionally trades slightly downwards for extended periods of time, only interrupted by massive jumps upwards.  Once you reach 1c, moves between 0.0001c and 0.0002c will look like a flat line, despite having represented +100% moves in the past. Just compared to the 1c it does not mean anything.   logarithmic view compensates for that. A move from 0.0001 to 0.0002 will look much closer to a move from 1c to 2c or a move from 10c to 20c.   In this view, anything that happened before the current ATH that was created in 2021 is just a flat line with nothing to see. Given that doge is trading in 4 year cycles, looking at only the last cycle and nothing but the last cycle is not a good way to determine if it is a good long term investment.",4,1744472506.0,2025-04-12 15:41:46
1jx9gs5,Ok_Sentence_1332,"If you invest in the bear market you’ll make good returns and that’s why I literally said “sell and never look back”. If you make money and good money in crypto. Sell. Say you got $500 and you make 2k. Sell and if you wanna put money back in wait a few months and put $200 in. If you got $10k and make 30k. Well and same thing then put no more then 1k in. It’s the best advice if you’re up. If your down, you gotta look at it differently forsure. I don’t think we’re done going down but I also think we’re gonna go way back up before the end of the year. We aren’t in the bear market yet.",1,1744576544.0,2025-04-13 20:35:44
1jx9gs5,Low-Hold-8563,So you're way ahead of the game. I also bought in under .01   You know Doge is probably a great investment in the long term. Most people are probably pretty new. They were hoping to make a giant stack of cash quick. Do you have a 9 to 5?,1,1744899576.0,2025-04-17 14:19:36
1jx9gs5,kaedoge,"Doge over a 5 year period, even at the current price, represents over and 8,200% gain…  That’s almost 8x the gain of Bitcoin during the same period.   Get out of here with this nonsense.",5,1744437359.0,2025-04-12 05:55:59
1jx9gs5,Unlucky_Bell_7354,Ive created a vicious cycle,1,1744438236.0,2025-04-12 06:10:36
1jx9gs5,Seemss_Legit,I'm wondering the same thing about your original comment. 😂,2,1744480526.0,2025-04-12 17:55:26
1jx9gs5,Unlucky_Bell_7354,Lets see your gains,3,1744437519.0,2025-04-12 05:58:39
1jx9gs5,Low_Band_335,sure did bud,4,1744438330.0,2025-04-12 06:12:10
1jx9gs5,xxfallen420xx,The log shows an ascending cycle of which we’ve hit the floor. Every bullish run on this coin has been preceded by contact with this floor. Dogecoin is holding on the floor despite market conditions which if the run to $.72 is any indication should be a bullish indicator. None of which is apparent in the normal not log view of the chart.,2,1744481233.0,2025-04-12 18:07:13
1jx9gs5,kaedoge,"How about, no.",0,1744437672.0,2025-04-12 06:01:12
1jx9gs5,monnelespiritu,The cycle must continue. I donwvoted 😆.,1,1744456964.0,2025-04-12 11:22:44
1jx9gs5,Low_Band_335,bro if you didn’t sell that’s okay; no shame 😂,3,1744438210.0,2025-04-12 06:10:10
1jx9gs5,aurrousarc,You sir get to jump the line for a bit.,1,1744465668.0,2025-04-12 13:47:48
1jx9gs5,Unlucky_Bell_7354,He's holding a bag of dirt. I sold when it was .63 and stayed out. Glad.,2,1744438329.0,2025-04-12 06:12:09
1jx9gs5,Low_Band_335,some people like dirt,0,1744438381.0,2025-04-12 06:13:01
1jx9gs5,Unlucky_Bell_7354,![gif](giphy|Bl1t1DdP6iASI),1,1744438430.0,2025-04-12 06:13:50
1jx10bj,N/A,My quant analytics say it is hitting 9.5c by eom,3,1744421374.0,2025-04-12 01:29:34
1jx10bj,kaedoge,"Refueling for liftoff, Cap’n",2,1744437795.0,2025-04-12 06:03:15
1jx10bj,Neukted,"Blind optimism **can lead to success and fulfillment**. At times, the force of will is so significant that you can create positive outcomes through positive thinking. However, blind optimism can also cause you to miss vital information that might change your decisions about making what you want to happen.",1,1744597926.0,2025-04-14 02:32:06
1jx10bj,Fun_Raise_7858,Moon soon,0,1744411564.0,2025-04-11 22:46:04
