post_id,author,body,score,created_utc,date
1jegv6b,Local_Doubt_4029,I'm a Villain....10B here AND HOLDING!!!!,24,1742334801.0,2025-03-18 21:53:21
1jegv6b,MelodicInstruction48,https://preview.redd.it/lt72cdaxsipe1.jpeg?width=550&format=pjpg&auto=webp&s=0fc6dfa1d1cce5e1429e01a5c7d013adb5dc5581  I lied I just added another 2k worth,10,1742335153.0,2025-03-18 21:59:13
1jegv6b,LinesideOne,Makes you a millionaire if we lose 2 zeros… nice lottery ticket there,20,1742334949.0,2025-03-18 21:55:49
1jegv6b,Ape-per-view,![gif](giphy|eeYCKm1UriwMAKe11Q|downsized),6,1742341947.0,2025-03-18 23:52:27
1jegv6b,Less-Dragonfruit-294,At 1.2 billion that’s roughly 15k USD. Damn.,6,1742339999.0,2025-03-18 23:19:59
1jegv6b,beachhunt,Shibillionaire,5,1742341536.0,2025-03-18 23:45:36
1jegv6b,EQN1,Nice 👍,4,1742335228.0,2025-03-18 22:00:28
1jegv6b,justinkasereddditor,Let's goooooo,5,1742335675.0,2025-03-18 22:07:55
1jegv6b,Necessary-Ad3429,We are truly in the new John Cena era.,2,1742345829.0,2025-03-19 00:57:09
1jegv6b,Plastic-List215,Teach me your ways sensei,2,1742351358.0,2025-03-19 02:29:18
1jegv6b,HeavyBigdean,LFG.,2,1742359356.0,2025-03-19 04:42:36
1jegv6b,Pizza_Agent,or Live Long Enough to See Yourself Become poor 😞,1,1742336369.0,2025-03-18 22:19:29
1jegv6b,Ok_Fox_1770,"Opened coinboose after like a month, just laughed. Oh it can be worse. Close. Luckily after 4 years just kinda fried out on it. Let it be, let’s see. Just be dumb at this point…what happened anyway why crypto melt down again? Tax season?",1,1742344058.0,2025-03-19 00:27:38
1jegv6b,PelicanWaveSurfer,Damn 🫡,1,1742366939.0,2025-03-19 06:48:59
1jegv6b,snorlaxtubbs,No risk no rich,1,1742383886.0,2025-03-19 11:31:26
1jegv6b,Extension-Ad4554,Brother in arms. Time to get rich or die trying,1,1742385687.0,2025-03-19 12:01:27
1jegv6b,Signal-Impact4785,I’m at 902k. Waiting for .0006,1,1742390123.0,2025-03-19 13:15:23
1jegv6b,CAN-SUX-IT,10 billion. Do you use any algorithmic tools?,7,1742336457.0,2025-03-18 22:20:57
1jegv6b,ChemNerd86,Aww… I only have a measly 9 million… what am I even doing with my life…,6,1742337653.0,2025-03-18 22:40:53
1jegv6b,TheIrrepressible1,Fake post to trick rookies into wasting their money on this DEAD coin.,-10,1742336044.0,2025-03-18 22:14:04
1jegv6b,JaggaJazz,I like this thought process   So long as they don't care about the 10k+ then this is prob one of the best lotto tickets possible,12,1742336059.0,2025-03-18 22:14:19
1jegv6b,Ferrariflak,That’s the best way.,4,1742340058.0,2025-03-18 23:20:58
1jegv6b,Csizemore028,"What is that like a 20,000 lotto ticket",2,1742411321.0,2025-03-19 19:08:41
1jegv6b,MelodicInstruction48,Right on the money,5,1742340118.0,2025-03-18 23:21:58
1jegv6b,Substantial-Travel18,"Maybe one day it will be back, you win some you lose some. I can say I’m a shib billionaire 😂😂",1,1742369519.0,2025-03-19 07:31:59
1jegv6b,MelodicInstruction48,I’m so happy u said this,2,1742347067.0,2025-03-19 01:17:47
1jegv6b,MelodicInstruction48,I’m already there trust 😭😂,5,1742336434.0,2025-03-18 22:20:34
1jegv6b,Local_Doubt_4029,Nope....just buying when low.....thats all,9,1742339082.0,2025-03-18 23:04:42
1jegv6b,buffalo_Fart,I had seven mil but then I realized I could lose the money faster elsewhere so I sold it back down to two...😬👍,2,1742341563.0,2025-03-18 23:46:03
1jegv6b,LinesideOne,"Rookies? I’m holding a similar amount. Shib will blow up like Doge did. In 10 years Shib will be a penny plus! Even if you hate shib, you should buy a few mill and stash it, one day it could be worth a lot.",5,1742337071.0,2025-03-18 22:31:11
1jegv6b,MelodicInstruction48,Why would I lie?😭😂,5,1742336081.0,2025-03-18 22:14:41
1jegv6b,LinesideOne,About 13k currently,2,1742411725.0,2025-03-19 19:15:25
1jegv6b,Less-Dragonfruit-294,"I’m applauding you, as once there’s any swing upward you should be able to recoup money",1,1742377354.0,2025-03-19 09:42:34
1jegv6b,CAN-SUX-IT,I do it completely differently. I’m buying high and selling low.,21,1742339819.0,2025-03-18 23:16:59
1jegv6b,TheIrrepressible1,everyone has been saying this nonsense since ‘21. There’s no proof outside of a good amount of “hopium”. This coin solves nothing and has next to ZERO usage nor purpose. It was pumped and then dumped.,0,1742338721.0,2025-03-18 22:58:41
1jegv6b,TheIrrepressible1,Every month or so newbie accounts/backups post their imaginary holdings to lure readers to buying this memecoin. It’s been going on for years on this sub. And there’s always a lackey chiming in how they too are “holding” all these billions of WORTHLESS coins 😂   The coin is never going back to .00008 aka ATH. It’s done.   THOSE WATCHING AND AREN’T SURE WHAT TO DO.   You’re welcome.,-2,1742338621.0,2025-03-18 22:57:01
1jegv6b,slowtdi,Isn't this the way it's supposed to be done?,1,1742495692.0,2025-03-20 18:34:52
1jegv6b,LinesideOne,"Open your eyes dude!!!! Nothing in the crypto world makes sense but here are the facts..  1. Shib is a top 20 crypto 2. People want Memes because they go crazy out of nowhere 3. Newbies want cheap crypto.. BTC is so darn expensive. Doge will be above a dollar soon so less people will be buying it. Shib is next in line  4. Shib has only had one bullrun in its life, we have NO idea how it’s going to act on the next one. 5. Nothing in Crypto is predictable so what does it hurt to be stocked up and some projects that might pop off. Shib included",4,1742339784.0,2025-03-18 23:16:24
1jegv6b,MelodicInstruction48,"Buddy ur just slow in the head, I have that much and I constantly post in here",1,1742339902.0,2025-03-18 23:18:22
1jegv6b,TheIrrepressible1,"1. Keep mentioning how it’s Top 20 in crypto when 99% of the cryptos are virtually WORTHLESS and have no usage. Shiba is worthless. Hell, Bitcoin is the official coin of every illegitimate money earning business on the planet. The common human being has no use for Bitcoin.   2. No they don’t. Not since everyone lost their shirt in 2021.   3. Lmao @ doge going to $1 when it’s highest point never cracked .75….Doge was a rugpull of epic proportion as well. It’s is a USELESS coin that solves nothing financially.   4. Sure we know. It’s right in the toilet exactly where it went down after the pump and dump in ‘21. It’s never recovered, nor will it ever.   5. It’s easily predictable. It has zero usage and most of these worthless coins are artificially pumped and then dumped for major profits to those controlling the majority of the coins. Once the price artificially increases, the coins are sold and the price drops faster than thongs off a stripper on a busy Friday night.",1,1742347013.0,2025-03-19 01:16:53
1jegv6b,TheIrrepressible1,Sure you do. How much are they paying you to post this rhetoric?,-1,1742347027.0,2025-03-19 01:17:07
1jegv6b,LinesideOne,Clearly you haven’t been in crypto very long. A lot to learn little dude… a lot to learn.,1,1742356736.0,2025-03-19 03:58:56
1jegv6b,MelodicInstruction48,https://preview.redd.it/3bu6nx4hsjpe1.jpeg?width=3840&format=pjpg&auto=webp&s=c0499bce65a7c690d624957c89e97cde83a7f518,1,1742347101.0,2025-03-19 01:18:21
1jegv6b,TheIrrepressible1,"Whatever you say, scammer. Hopefully, they find a way to put you guys behind the walls in a penitentiary.   Laughable how most “white paper” are copy and pastes of one other. The actual owners of these bogus memecoins are buried in anonymity. Billions have been lost to fraud in this industry. And here you are insisting THIS is the coin that’s going to rise to unseen levels one day.   It’s literally impossible for Shiba to reach $1. Fat chance it reaches .01. The height of worthlessness in reality.",1,1742360876.0,2025-03-19 05:07:56
1jegv6b,TheIrrepressible1,"Much like the owner of this trash coin, you can’t post even your fake name….lol.",0,1742360910.0,2025-03-19 05:08:30
1jegv6b,LinesideOne,"Scammer…? I’m a scammer because I’m investing in something that will increase in value? You’re such a clown! People like you are hilarious, you’re the same type of person who screamed from mountaintops when BTC was at a nickel saying it’s a scam don’t buy it, then again at 1.00, 100.00, 1000.00 and so on. These cryptos will keep gaining value whether you like it or not, that’s just the way it is. Doge will do the same, before last bullrun it sat at .002 forever then boom, .74 cents. Crypto will be here for a very long time bud, you screaming calling people scammers isn’t going to stop anything. The next transfer of wealth from the older generation to the newer generation will be injected into the crypto market. That’s just the way it is. I’m not saying crypto is the only thing you should invest in, I believe real estate is the best investment out there. However, crypto being so volatile is a high risk/high reward play, when you watch the market cycles over the course of years you can time it so that you buy when it’s low and sell when it’s high. People trade every day in the stock market for profit whether it be buying long, short positions and options. Crypto is the same shit just more volatile. The only way crypto will go away is if Satoshi wakes up and cashes out his millions of BTC and completely destroys the price. That’s literally what it would take. But good luck to you man in whatever it is that you do or trade or invest in.",2,1742383384.0,2025-03-19 11:23:04
1jegv6b,MelodicInstruction48,What are u saying rn?,1,1742389724.0,2025-03-19 13:08:44
1jedb9r,Disgustipated2,Let um leave I'm tryna stack.,19,1742328085.0,2025-03-18 20:01:25
1jedb9r,Jadaisok,"Whales are not leaving, they just put their assests in a cold wallet…..there will be a moment that people have FOMO and buy in again and that will be good for SHIB and for the long term holders…",8,1742334259.0,2025-03-18 21:44:19
1jedb9r,General-Highlight999,have you seen crypto in general ? everything dumping. 90% down,7,1742339453.0,2025-03-18 23:10:53
1jedb9r,CAN-SUX-IT,Whales leaving is the best thing ever for Shib! The huge holders are the ones who use algorithmic trading programs that harvest money for themselves but It keeps the price suppressed for the rest of us. Whales using algorithmic trading programs are losing their asses in Shib! The problem is there’s so much Shib and so little owned. 80% of Shiba Inu has never been bought.  It’s just sitting there unowned and there’s so much Shib still waiting it makes it difficult for the automated trading platforms to work. Plus the amount of whales that were manipulating Shib was disrupting others who used algorithmic trading programs. So if we see another zero drop we’ll see the whales coming back. But it’s good riddance for Shib guppies like me.,5,1742331161.0,2025-03-18 20:52:41
1jedb9r,GearhedMG,![gif](giphy|DEZA7FlHbMesUF1jm9),2,1742406524.0,2025-03-19 17:48:44
1jedb9r,Philsnotdead,![gif](giphy|o0eOCNkn7cSD6),2,1742344071.0,2025-03-19 00:27:51
1jedb9r,Sigmaprax,The whole market is down rn chill lol,2,1742357655.0,2025-03-19 04:14:15
1jedb9r,need2feedpart2,💎👋,1,1742342290.0,2025-03-18 23:58:10
1jedb9r,MostResponsible2210,You're better off just lighting your money on fire,1,1742330388.0,2025-03-18 20:39:48
1jedb9r,Fresh-Solid-1831,"Whales are leaving you tool, look it up.   It’s not hard",1,1742474215.0,2025-03-20 12:36:55
1jedb9r,Disgustipated2,Its my money to set on fire homie,12,1742332473.0,2025-03-18 21:14:33
1jedb9r,MostResponsible2210,No shit,-4,1742336102.0,2025-03-18 22:15:02
1jedb9r,Commercial_Ease8053,You probably don’t have much left to even light on fire 😂,-1,1742354412.0,2025-03-19 03:20:12
1jedb9r,MostResponsible2210,"I don't light money on fire, I don't lose trades.",0,1742355636.0,2025-03-19 03:40:36
1jedb9r,Commercial_Ease8053,"Oh yeah, let me see your position on shib",-3,1742355669.0,2025-03-19 03:41:09
1jedb9r,MostResponsible2210,You mean the one I sold in 2022? You think I bought back in? Lol that's funny.,2,1742355781.0,2025-03-19 03:43:01
1jedb9r,Commercial_Ease8053,Then you’re one of the smart ones here lol,1,1742355802.0,2025-03-19 03:43:22
1jedb9r,MostResponsible2210,Every comment I make on this sub is trying to make people realize this thing ain't going anywhere anymore lol.,-3,1742355861.0,2025-03-19 03:44:21
1jedb9r,Commercial_Ease8053,"100% agree. It’s clear… idk how people are like “please sell so I can buy more!”   Yeah, keep buying more at lower and lower prices being more and more negative 😂 no one is buying this.",2,1742355927.0,2025-03-19 03:45:27
1jedb9r,Blue_Skies-,Seek life elsewhere.,1,1742420130.0,2025-03-19 21:35:30
