post_id,author,body,score,created_utc,date
1h4jhkn,Tough_Ad2136,It's so cute to see how many people sleeping on this crypto.,5,1733103692.0,2024-12-02 01:41:32
1h4jhkn,Purist1638,Just sold all today. Made bank. Waiting to get back in at the dip,1,1733105752.0,2024-12-02 02:15:52
1h4jhkn,Informal_Opening_962,How much??,1,1733166128.0,2024-12-02 19:02:08
1h4jhkn,Purist1638,Wouldn’t you like to know,0,1733166945.0,2024-12-02 19:15:45
1h4jhkn,Informal_Opening_962,"Just love reading people hit big, motivates me to buy more.",1,1733167759.0,2024-12-02 19:29:19
1h4jhkn,Purist1638,I’ll buy back in the next dip.,1,1733188195.0,2024-12-03 01:09:55
1h4jhkn,TrustTNT,"Good luck, I don't think there's gonna be another dip before it hits $100. $10T market cap on its way",1,1733251666.0,2024-12-03 18:47:46
1h4jhkn,Expensive-North-9556,Welcome to the family. Wof!,2,1733137196.0,2024-12-02 10:59:56
1h4jhkn,[deleted],"I think the moral of the story is, don’t  buy now because you missed the run up. Now is the time to sell what you bought 2 years ago",2,1733228305.0,2024-12-03 12:18:25
1h46n35,[deleted],I’m doubtful he joins us he’s tied up in Doge,6,1733076646.0,2024-12-01 18:10:46
1h46n35,Warminsandiego,"Oh goody, another burn post. Now I can just hope for something that asks “will Shibainu go up to one cent?“",4,1733081604.0,2024-12-01 19:33:24
1h46n35,Ancient-Eye3022,Burn all of yours first.,2,1733076997.0,2024-12-01 18:16:37
1h4e6qq,neotic_reaper,"To put it very simply, if there are 9 coins total and I have 3 well I have a third of all the coins. But if 3 get burned then I’ll have half of all the coins meaning that even though I have the same amount then it’s worth more.  The less coins there are the more “scarce” the current supply becomes meaning more valuable because in economics the less there is of something the more expensive it can become.",6,1733093264.0,2024-12-01 22:47:44
1h4e6qq,Mj_6o4,"Removed from circulation, sent to a dead wallet address.   Shib is a deflationary asset meaning the supply goes down over time, no new shib is ever created. The supply only shrinks.   Eventually any transactions that happen on shibarium (shiba inus new network) will burn shib automatically, reducing the circulating supply.",5,1733089093.0,2024-12-01 21:38:13
1h4e6qq,jackser2024,And that’s what makes shiba price go up?,2,1733090326.0,2024-12-01 21:58:46
1h4e6qq,Mj_6o4,"Supply &amp; demand is what makes most crypto go up.  Other than that- Speculation, fomo, news and hype.  The #1 cause of crypto moving upward, is rich people pumping billions into the market.",2,1733090600.0,2024-12-01 22:03:20
1h4e6qq,sparkyu,But whose coins get burned? Apparently not mine. Probably not yours either. Whose coins were actually removed?,3,1733209646.0,2024-12-03 07:07:26
1h4e6qq,nofil_siddiqui,Exactly my question too,2,1733210270.0,2024-12-03 07:17:50
1h4e6qq,ChampOfSon,"Well, Shibarium is mostly a failure, but there is a gas fee to do transactions on there, so a portion of those fees are gathered and used to buy and then burn Shib tokens.  There's a few community members that have done it.  A new token just burned 5.1B Shib tokens as a gimmick to advertise their project.  The only ever real and impact full burn was when Vitalik Buterin burned over 40% od the circulating supply from his half of the Shib token supply that was given to him as an unwanted gift as a symbolic burn in the beginning. That he actually ended up burning the vast majority of those tokens was pretty cool.  IF something like Shibarium were to have billions of dollars of volume a day, the burn mechanism attached to it would be more impactful. But I think it was a major fail for them to make a L2 called Shibarium but then require BONE tokens to be used as the gas. It could have been Shib tokens or even Ethereum but they chose the token they invented and controlled out of greed imo.  Note the Shib ""team"" is just community members that declared themselves as such. The Shiba Inu contract was designed and launched so that there could never be a true owner or team behind the Shib contract.  A selfless community would have built a L2 that used the Shib token itself making it more accessible to people to use. Or just Ethereum like BASE does in Coinbase's L2. Base has a lot of volume as a result and imagine if something like Shiabariim existed with a lot of volume and a burn mechanism attached to that volume.",1,1733262855.0,2024-12-03 21:54:15
1h41h5h,External-Ad-6098,Truth is who seriously cares what opinions people have . If you love the project or utility invest what you can. Many people missed eth btc ltc when it was like shib prices and where are they now? still crabs in a bucket 🪣 don’t let others pull you down.,8,1733080652.0,2024-12-01 19:17:32
1h41h5h,Affectionate_Seat959,"You know who the Shib whales are? Besides Big exchanges that want inventory to sell to their retail customers like you and I. Exchanges love this because they make a ton of money with people buying and selling in fees. Eth holders love it because those who transfer Shib to cold wallet pay eth for fees which burns eth supply. A Shib whale as an individual is not someone that took actual 21 million dollars and bought Shib. They took eth that they have had and bought at $1 or mined in early days and exchanged it for Shib. They don’t really care about Shib. They are buying Shib to burn eth supply to made their eth more valuable and go up. These gentlemen and ladies have millions and some even have billions in Eth value to exchange. Every time eth is exchanged on eth blockchain eth percentage is burned this includes any crypto that uses eth block chain like Shib, lessen the supply of Eth making it go up in value. Eth is stalled and not going up as fast as Bitcoin is. If Shib goes up then that is extra for them, For Shib, we need to burn a lot of the supply by using their block chain on their exchange. Anyone here doing that? Anyone here staking their Shib there? Also The problem is the people Shib Devs that control how much is burned; it is not automatic like eth block chain. Someone there has to push the key to burn Shib by sending it to the dead wallet.  Any volunteers that wanna burn their Shib? Anyway it will be a very long time before burns through two zeros. Maybe 2026 one zero or close to it like .00009 for a few months. I see Shib as that hot girl friend or boy friend that is big tease. All tokens that are on exchanges will do well this coming year. My advice is look at the chart history for Shib to know best time to buy. Right now and coming weeks are going to be interesting. I wish you all great success for 2025.",4,1733087775.0,2024-12-01 21:16:15
1h41h5h,Local_Doubt_4029,Proof?,1,1733064752.0,2024-12-01 14:52:32
1h41h5h,Warminsandiego,Yes. Or no.,1,1733068327.0,2024-12-01 15:52:07
1h41h5h,Tough_Ad2136,Yes it will no question.,1,1733096579.0,2024-12-01 23:42:59
1h41h5h,EQN1,Dec 27th will be a good day for Shiba Inu holders,1,1733126645.0,2024-12-02 08:04:05
1h41h5h,PuzzleheadedFan6274,Need burn rate to increase substantially!! If this doesnt occur its not worth the investment,1,1733162415.0,2024-12-02 18:00:15
1h41h5h,Fritz73r,Friday the 13th is the day….,1,1733355870.0,2024-12-04 23:44:30
1h41h5h,Fritz73r,Patience for shib to appreciatet to .005,1,1733355963.0,2024-12-04 23:46:03
1h41h5h,Negative_Ingenuity53,This is good news,1,1733490809.0,2024-12-06 13:13:29
1h41h5h,crzy4vr,"Don't want to throw water on your dreams. But let's be realistic - current price is 0.000032 with a ~19B valuation. If it has to grow to 0.001, it has to grow almost 30x and the valuation will become 570B - which is insane.  For comparison, ethereum is valued at 450B.   I will leave it up to you to decide if that's feasible.",1,1733065636.0,2024-12-01 15:07:16
1h41h5h,Canadianretordedape,It’s always the market cap guys that have zero idea how much burning effects price.,3,1733105190.0,2024-12-02 02:06:30
1h41h5h,crzy4vr,"Burning coins is a fair argument and it will increase the price however the current burn rate is very less. For example if 2b coins are burnt every week, it feels big but compared to the total coins 500+trillion coins- burn rate is very less. If the burn rate increases then yes, it has the potential to go higher in value.",2,1733105513.0,2024-12-02 02:11:53
1h3rm4o,EQN1,"You finally understand, holding is key",29,1733016596.0,2024-12-01 01:29:56
1h3rm4o,Effective_Explorer95,Let the billions roll in,18,1733016147.0,2024-12-01 01:22:27
1h3rm4o,Tradefxsignalscom,"Ok, Ok….now my 500,000,000 Shib is worth $1,820.00! Watch out and move over Charlie Munger!👹obsessively doing mathematical what ifs in my head…..if it ONLY reached 0.001 then I’ll retire early LOL🤪",13,1733018153.0,2024-12-01 01:55:53
1h3rm4o,PaulACED,"Isn’t 500,000,000 at 0.00003 $15,000? 🤔 did you get in at 0.0000265 ? lol",5,1733019090.0,2024-12-01 02:11:30
1h3rm4o,[deleted],"I had the same thought, calculation",3,1733040211.0,2024-12-01 08:03:31
1h3rm4o,Tradefxsignalscom,"lol, i screwed up the calculation in this example by not looking at the expanded pic. 😣",5,1733059351.0,2024-12-01 13:22:31
1h3rm4o,PaulACED,It’s all good!! 😊I just hope we are all just sitting back enjoying the current pump 🚀🤘😎,2,1733065740.0,2024-12-01 15:09:00
1h3rm4o,Canadianretordedape,Apes don’t math.  We hodl.,1,1733105044.0,2024-12-02 02:04:04
1h3rm4o,TaterTotInABush,Yeah my 125 mil is worth 4k,1,1733359633.0,2024-12-05 00:47:13
1h3rm4o,ThaHyst,"Lets go! Although I would love it if it hit .001 let's get this sucker to $1!!!! Idc how ""impossible"" or ""unrealistic"" it may be.   My friend told me to buy BTC when it was at $4, and I said nahhhhhh! And people then had no idea it would get to where it is now. Now look. Anything is possible.   SHIB TO THE MOOOOON!!! 🗣",2,1733102104.0,2024-12-02 01:15:04
1h3rm4o,Accomplished-Tap3223,To the moooooooooon!!!!!!!,9,1733016180.0,2024-12-01 01:23:00
1h3rm4o,xtcy68,Is it time,8,1733015841.0,2024-12-01 01:17:21
1h3rm4o,Amazing-One-7978,.05-.10 my target this bull run sell at that,5,1733019210.0,2024-12-01 02:13:30
1h3rm4o,Jimmie0708,.10 would mean a $58.9 Trillion (with a T) market cap..,7,1733037969.0,2024-12-01 07:26:09
1h3rm4o,Canadianretordedape,Did you factor in current burn rate and adjust for aggressive burn increase and adoption?   How much shib has been burnt to date.  How much was burned yesterday.  Why the spike in burns yesterday.  Gotta factor in burns or you’ll sell early.  10 years.  Sit tight and stfu.,0,1733105114.0,2024-12-02 02:05:14
1h3rm4o,avatorjr1988,Isn’t possible,3,1733064854.0,2024-12-01 14:54:14
1h3rm4o,Schult34,Going to wait that 30 to 40 years?,0,1733060365.0,2024-12-01 13:39:25
1h3rm4o,Canadianretordedape,Nope.  Just 10.  That’ll bring the 41% currently burnt to 90-95% burnt.  Math.,1,1733105144.0,2024-12-02 02:05:44
1h3rm4o,Schult34,I want to see the math..,1,1733105432.0,2024-12-02 02:10:32
1h3rm4o,nismos14us,"Impossible, no one’s burning that many trillions again, don’t fool yourself. That was the original burn by founder.",1,1733355773.0,2024-12-04 23:42:53
1h3rm4o,CoolFerret8848,All the low holders are selling rn,5,1733020401.0,2024-12-01 02:33:21
1h3rm4o,H3LLZSUNLIGHT,Yeah I sold way too early but i only had $200 invested in. I wish I had a like 10k into it,1,1733037308.0,2024-12-01 07:15:08
1h3rm4o,Shelbyt93,I hope so!,3,1733016069.0,2024-12-01 01:21:09
1h3rm4o,pressedun,🌛,3,1733016478.0,2024-12-01 01:27:58
1h3rm4o,CardiologistOk90,When penny,3,1733020706.0,2024-12-01 02:38:26
1h3rm4o,tonyh1993,I finally evened out and made $5 😂😂,3,1733033614.0,2024-12-01 06:13:34
1h3rm4o,ActWide6615,I don’t think it going to $0.001,3,1733042588.0,2024-12-01 08:43:08
1h3rm4o,tomtex32,I really need it to go to pluto.,2,1733023319.0,2024-12-01 03:21:59
1h3rm4o,OwnAbbreviations1427,Y’all I suck at math. I have about 5 mil. How much will I have when it hits 0.01 ?,2,1733032755.0,2024-12-01 05:59:15
1h3rm4o,TomorrowzHero,$50k,1,1733033285.0,2024-12-01 06:08:05
1h3rm4o,OwnAbbreviations1427,So your saying I should buy more,1,1733034514.0,2024-12-01 06:28:34
1h3rm4o,TomorrowzHero,Yep.,1,1733034535.0,2024-12-01 06:28:55
1h3rm4o,julapoo1,I don’t know the exact math but it would require at least 3-4 trillion dollars for shib to go to .01. Entirely impossigle,1,1733044746.0,2024-12-01 09:19:06
1h3rm4o,growingsplif,Trillion coins not trillion dollars ……. It’s only 75$ every 2250000 2.5 million coins . Do the math it’s only about 50 million or so or even less to max it,1,1733047340.0,2024-12-01 10:02:20
1h3rm4o,mywifehatesme82,"no, it's going to take a lot.  And it'll take some time, but it's averaging growing 300% in 3 years.  Anyone else have a fund outpacing that?  Anything that's really coming close?  It's an appreciating currency when the world is flood with depreciating ones.  It's so weird, yet.... that's what it is.  Just buy and hodl...",1,1733057671.0,2024-12-01 12:54:31
1h3rm4o,growingsplif,I’m with ya,1,1733077416.0,2024-12-01 18:23:36
1h3rm4o,mywifehatesme82,"Cheers bro!  And the only real reason why everyone says this is bullshit is because they're astounded by it's success to catch on, and so it's pretty much just the wider financial world saying.... ""nuh uh.... it can't be legitimate.  It's all based on nothing.""  As if money itself is based on something other than faith...  That's like the pot calling the kettle black...  Bitcoin brought crypto, as a whole, legitimacy.  This boom here, after a crash that many thought could wipe crypto out, or at least knock it back to an obscure risky thing, is only happening because trust, faith, and legitimacy.  No sane person would turn down 10 bitcoin, just willingly given to them.  Why?  Because... it is universally accepted, just like money, that this would have extreme value.  Shiba, Doge, Pepe, etc.... they're the next ones up, to become real legitimate global currencies that have value, pretty much anywhere in the world, even if they're harder to transact at the moment...  Bitcoin is fortunate in that it literally has the nation of El Salvador using it as a national currency.  Any nation, even a city, or town, that transacts primarily in a particular crypto, breathes a ton of life into it.  What happens when Guatemala or Costa Rica adopt Doge or Shiba?  Their economies, just like El Salvador, as a whole, will become more prosperous, and the currency will spike in value, and mine and yours investment and faith in this will have helped bring that to them.  I've been to Afghanistan, and it sucks, but even the Taliban could adopt something like this, and both they and I, would prosper greatly financially speaking.  It would've been a funny topic to bring up when I had previously met with warlords 20 years ago...  I wonder if they would've shot at us less, if we helped make each other rich...  I bet El Salvadorians aren't going to be coming across the border as much in the coming years.... Crypto will have played a roll in that, in spite of all of the ""nuh uh's, it's bullshit!  It doesn't do anything!""",1,1733080673.0,2024-12-01 19:17:53
1h3rm4o,mywifehatesme82,"and why's that impossible?  If you add up all the long term assets in America, land, housing, factories, companies, bonds, stocks etc... that's about $300 trillion.  And... our production per year is hedging close to the $30 trillion.  And all of these numbers, 20 years from now, are going to seem really small compared to our kids talking in terms of quadrillions.  You find 3-4 trillion as impossible?  It's pert near almost inevitable at some point it'll cross that line.",1,1733057480.0,2024-12-01 12:51:20
1h3rm4o,julapoo1,You thinking a useless meme coin will SURELY grow to trillions for no reason is sorely delusional.,1,1733089694.0,2024-12-01 21:48:14
1h3rm4o,mywifehatesme82,"?  Delusional?  Look at the market cap today bro.  Bitcoin is standing at 2 trillion.  Are we all to believe that forever, there shall only be one?  Most especially in a world with ever more money being made?  Bitcoin already did this delusional heavy lifting, whether you care to see or not.  Know anyone who's not constantly pumping and dump crypto regretting their purchase?  Nah... me neither.  Why?  Because... irregardless of whether you or I are right, many of these cryptos have been outpacing their stocks and bonds counterparts, for awhile now...",1,1733100660.0,2024-12-02 00:51:00
1h3rm4o,Strange-Menu-860,So why are coins like the chill guy already 40 cents why can’t that happen to shib overnight,1,1733088174.0,2024-12-01 21:22:54
1h3rm4o,julapoo1,You are severely uneducated about crypto. Chill guy has fewer coins in circulation. The price of a cryptocurrency is determined by (market cap) / (number of coins in circulation). You should seriously do reading about crypto before your lack of knowledge causes you to lose money stupidly.,1,1733089788.0,2024-12-01 21:49:48
1h3rm4o,Strange-Menu-860,Can shib burn coins still?,1,1733089845.0,2024-12-01 21:50:45
1h3rm4o,julapoo1,"It doesn’t matter. Just to let you know, chill guy has a market cap of $460m, where is Shiba is over $18 billion. The price of the coin doesn’t matter.",1,1733089969.0,2024-12-01 21:52:49
1h3rm4o,Killer_Stickman_89,Your token has nearly 600 Trillion in circulating supply. Compared to everyone else if your primary bag is SHIB you will make no money this bullrun and have to pray that BTC is worth FAR more than it is now in 10 years. AND that you are actually burning hundreds of Trillions of coins with HIGH price growth rates every year.,1,1733120830.0,2024-12-02 06:27:10
1h3rm4o,jonizzooted,Serious question. What’s a good place to learn? I’m just now looking into this and it’s all so interesting.,1,1733306457.0,2024-12-04 10:00:57
1h3rm4o,Invisble_Swag777,New to all this stuff. Is Shiba legit or is it just a meme? Genuinely asking.,2,1733036046.0,2024-12-01 06:54:06
1h3rm4o,InCenaRawrXd,"You can have so much of it for so little. Same with Pepe. So what's the harm in having some? That's how it was with Doge. My friend and I got in when it was low, .05 I believe, maybe earlier. He only put 100 in and still has it, I probably put like 500 in and sold at it's all time high.",1,1733045437.0,2024-12-01 09:30:37
1h3rm4o,OGPaterdami_anus,Hopium to make money. Fucking hell man. You should've pointed him towards Solana or whatever.  A coin with utility is always a better choice than a coin with literally nothing.,1,1733049434.0,2024-12-01 10:37:14
1h3rm4o,InCenaRawrXd,"People said the same about doge and now it does have utility. I'm not saying put hundreds of dollars into these garbage coins. But if you wanna put like 100 and set it and forget and then years down the line omg it's actually something, cool. Any type of investing is for those with capital to spare. If you can swing it, why not? If not, you shouldn't even be here in the first place",2,1733050334.0,2024-12-01 10:52:14
1h3rm4o,OGPaterdami_anus,I think doge is a different story tho... Its only because Elon expanded it's utility...   Other memecoins don't have someone like Elon working on it extensively...,0,1733050514.0,2024-12-01 10:55:14
1h3rm4o,InCenaRawrXd,"It went higher than what shib and Pepe are before Elon got involved. Elon is not a saviour or a champion of anything. It boomed when he started being annoying about it, now it may boom again because he's pushing again. The other two coins can still grow on their own without involvement. With it being so cheap rn, it doesn't hurt to have. By the time they grow and it's time to sell, it'll be past any hurtful taxes too",2,1733050639.0,2024-12-01 10:57:19
1h3rm4o,OGPaterdami_anus,"Dude... Elon is making that coin from a meme to an actual coin with use...  Sure memecoins can grow. But it's a higher risk than a coin with utility...   And taxes is country based. There are countries already taxing crypto gains, definetly if you do it full time.",2,1733051081.0,2024-12-01 11:04:41
1h3rm4o,InCenaRawrXd,"But what level of risk is it when it's so cheap? The point is to risk money that you can risk.   Doge had already gotten to .05 without Elon, that's huge  This guy is clearly not going to do it full time, most people shouldn't",1,1733051298.0,2024-12-01 11:08:18
1h3rm4o,OGPaterdami_anus,"Dude...  Go ask an investor to invest in something that has literally no utility or usage... You won't see any money.   Its all hope at that point.   But thats a good thing of an exchange. It doesn't need someone with a large pile to handout to believe in order to get some.  YOU can choose. But risk management wise, utility over air really.",1,1733051429.0,2024-12-01 11:10:29
1h3rm4o,InCenaRawrXd,"I have 100 in each just for the hell of it. To me, that's acceptable risk. You don't need to ask an investor anything, most coins are garbage and fluff lol that's not what I'm arguing here. I think you lost the plot a bit",1,1733051529.0,2024-12-01 11:12:09
1h3rm4o,QueasyCarpenter6852,"You realize now that Elon is aside the president shib is going to turn into DOGE , Shib and Doge essentially are going to partner up , so this is an early boat man you have no idea WTH you’re talking about. SHIB IS THE NEXT DOGE",1,1733066052.0,2024-12-01 15:14:12
1h3rm4o,jimipotpie,Moon,1,1733020961.0,2024-12-01 02:42:41
1h3rm4o,Flimsy-Return-6745,Hodl!!!!! Tooooooo the mooooon!,1,1733022761.0,2024-12-01 03:12:41
1h3rm4o,CM_Leedm,To the mooooooooooooooon!!!!!!!!!!,1,1733024626.0,2024-12-01 03:43:46
1h3rm4o,d8801,The very best it could ever do is .0001,1,1733026233.0,2024-12-01 04:10:33
1h3rm4o,HaasonHeist,"Yes, but people are not good at math lol",1,1733032571.0,2024-12-01 05:56:11
1h3rm4o,Sweaty-Emergency-493," It to be mean but nobody should take advice from dead people. I mean, they can’t back it up.",1,1733030427.0,2024-12-01 05:20:27
1h3rm4o,Character-Example879,Lambo !,1,1733031459.0,2024-12-01 05:37:39
1h3rm4o,fermium82,0.1 coming soon?,1,1733035970.0,2024-12-01 06:52:50
1h3rm4o,Electronic-Lab-6769,I woke up to this spike. Anyone know the reason?,1,1733036152.0,2024-12-01 06:55:52
1h3rm4o,mandrakecdam,The journey is beginning. Fasten your seatbelts because we're leaving...,1,1733038022.0,2024-12-01 07:27:02
1h3rm4o,[deleted],This Is Financial Advice Folding Ideas,1,1733058603.0,2024-12-01 13:10:03
1h3rm4o,TheDiscoJellyfish,"Yes, moon.",1,1733059835.0,2024-12-01 13:30:35
1h3rm4o,Redditandbedone,To the window? To the wall?,1,1733065693.0,2024-12-01 15:08:13
1h3rm4o,ItsShai91,🤣🤣🤣,1,1733072032.0,2024-12-01 16:53:52
1h3rm4o,johnjames123_Ask,$0.01 by Nov 2025,1,1733068369.0,2024-12-01 15:52:49
1h3rm4o,austinalley101,Hoge coin!!,1,1733071634.0,2024-12-01 16:47:14
1h3rm4o,Ill_Entrepreneur6643,"Unfortunately this will never be worth much. Just imagine how many people you know with an absurd amount of Shib, myself included. We all would be able to quit our jobs. Essential jobs. Fast food, cashiers, servers, left etc.",1,1733073783.0,2024-12-01 17:23:03
1h3rm4o,wokachoda,&gt; shib to the moon  &gt; hits a millionth of a cent  im kidding guys pls buy,1,1733076236.0,2024-12-01 18:03:56
1h3rm4o,fuzzy-albert,If you invested ?1 million prior yea. That’s a nice moon,1,1733079561.0,2024-12-01 18:59:21
1h3rm4o,SensitiveRip3303,"I’m fucked, I have to sell mine by March 2025 because etoro no longer supports shib",1,1733079961.0,2024-12-01 19:06:01
1h3rm4o,Horror_Personality27,Why sell it just transfer it to a different wallet,1,1733090353.0,2024-12-01 21:59:13
1h3rm4o,SensitiveRip3303,"It won’t allow us, it only gives us the option to sell at this point",1,1733090648.0,2024-12-01 22:04:08
1h3rm4o,Killer_Stickman_89,Unless you have 4 digits worth then you should put that into another token with actual use and an unabsurd circulating supply. Buy back in if you want after but DO NOT hard focus on this token. It's going no where this bullrun and I mean that as is in its getting left behind. I thought SHIB would be in a better spot all these years but the community SOMEHOW didn't care or do anything about their tokens having a circulating supply of almost 600 Trillion FOR OVER 4 YEARS!  Trump owns a fuck load of ETH and he is going to be President of The United States. I'd think about stacking that because it's going to scale up with BTC and have far more money put into it soon.,1,1733121013.0,2024-12-02 06:30:13
1h3rm4o,SensitiveRip3303,"I never thought shib was going to the moon, just planned on holding till it dropped another 0.",1,1733152375.0,2024-12-02 15:12:55
1h3rm4o,Killer_Stickman_89,"It might not be capable of doing that during this bullrun. That token has a circulating supply of basically 600 Trillion.  We will not know what direction the market is going in 2025 until post Trump inauguration. That is going to be on Jan 20, 2025. If there is some serious price movement leading up to that moment the floor is going to raise exponentially. Meaning that your entry point and opportunity to 2x, 3x, 4x, etc. on coins and tokens with actual use cases and SIGNIFICANTLY less than **1** Trillion in circulating supply will GREATLY diminish. The multiple that you would get from SHIB after a LONG time of holding this token.",1,1733161724.0,2024-12-02 17:48:44
1h3rm4o,SensitiveRip3303,"It has the potential too and if not this time the next! You don’t earn money overnight by either, you don’t put money into a coin and think you’re going to get rich over night it takes years.   Also people need to stop comparing their meme coins to bitcoin 😂 they are not the same. Insta reels thinking xrp is the next bitcoin has had me cracking up",0,1733162135.0,2024-12-02 17:55:35
