post_id,author,body,score,created_utc,date
1hask00,Vast-Communication40,Exactly,1,1733809910.0,2024-12-10 05:51:50
1hask00,cryptoking87,Sell today.  Buy back at 0.00003000 or 0.00003500.  Then sell again at 0.00002500  Rinse and repeat.,8,1733821701.0,2024-12-10 09:08:21
1hask00,Kaiden_937,Ah the ol’ buy high method,4,1733850337.0,2024-12-10 17:05:37
1hask00,According_Elephant_6,This is the way.,1,1733870274.0,2024-12-10 22:37:54
1hask00,diealot85,Omg I have been doing it wrong the whole time 😞😭,2,1734025726.0,2024-12-12 17:48:46
1hask00,K02P,It amazes me how many people jump in with $30 and then get upset when they lose $3….  You might lose $29 before you jump all the way to $50,2,1733868059.0,2024-12-10 22:00:59
1hask00,vaninga,Lmao ain’t that the truth,1,1734225415.0,2024-12-15 01:16:55
1hask00,Myg0t_0,BuY tHe diP !!!!  Hooollllddddd !!!,1,1733802475.0,2024-12-10 03:47:55
1hask00,ChallengerBaca,He did the opposite. Bought high. Sell low?,3,1733807207.0,2024-12-10 05:06:47
1hask00,Myg0t_0,He just needs to hooooooollldd !,1,1733807536.0,2024-12-10 05:12:16
1hask00,amartinkyle,lol this is what the people selling say.,1,1733952850.0,2024-12-11 21:34:10
1hask00,FaastEddy,"Was doing great, until you. (I kid , I kid)",1,1733805469.0,2024-12-10 04:37:49
1hask00,LurkinRhino,Welcome fellow holder!,1,1733808128.0,2024-12-10 05:22:08
1hask00,Vast-Communication40,Market is down today bro its with most of the coins i lost around 2k today,1,1733809881.0,2024-12-10 05:51:21
1hask00,Purist1638,Time to buy,1,1733853177.0,2024-12-10 17:52:57
1hask00,iamfredlawson,Buy,1,1733816002.0,2024-12-10 07:33:22
1hask00,[deleted],🤣🤣🤣,1,1733823787.0,2024-12-10 09:43:07
1hask00,SlashRModFail,Now you need to sell so it goes up,1,1733825969.0,2024-12-10 10:19:29
1hask00,One_Ant_8924,Buy more !,1,1733840687.0,2024-12-10 14:24:47
1hask00,futureshock224,"Buy more,",1,1733844488.0,2024-12-10 15:28:08
1hask00,smprandomstuffs,Welcome to the team buddy.... You broke it,1,1733844605.0,2024-12-10 15:30:05
1hask00,Punstorms,what app?,1,1733845449.0,2024-12-10 15:44:09
1hask00,thegnarles,Keep going!!!,1,1733847098.0,2024-12-10 16:11:38
1hask00,ApexTrader616,you better sell so it goes back up!!,1,1733849951.0,2024-12-10 16:59:11
1hask00,No-Pressure2341,Lmao 🤌,1,1733852825.0,2024-12-10 17:47:05
1hask00,ItsSoLitRightNow,"Spikes are for holding or selling, dips are for buying.",1,1733854369.0,2024-12-10 18:12:49
1hask00,Ok-Business7192,Just relax. You bought in for the long run. Just don’t look at it for a year and all will be fine,1,1733858449.0,2024-12-10 19:20:49
1hask00,BoomBeachBoss621,Buy more,1,1733859529.0,2024-12-10 19:38:49
1hask00,Own_Difference_6900,And why you get panic? It will every go down and up.,1,1733862252.0,2024-12-10 20:24:12
1hask00,Tough-Bear5401,we've all done it. It is what it is. It will go back up. This is a market correction.,1,1733862809.0,2024-12-10 20:33:29
1hask00,thethomaswgeorge,Just means today is a good day to buy more!,1,1733867997.0,2024-12-10 21:59:57
1hask00,Schult34,Then get the fuck out,1,1733878966.0,2024-12-11 01:02:46
1hask00,glockwitharulerclip,Natural selection. 🥃,1,1733891803.0,2024-12-11 04:36:43
1hask00,NotPassingBy,story of my life,1,1733902950.0,2024-12-11 07:42:30
1hask00,saiyanflo,So buy more,1,1733930787.0,2024-12-11 15:26:27
1hask00,SensiRider,"Did you expect to be a millionaire in a day? Crypto's like SHIB are meant to be purchased low and HELD for awhile. I don't see SHIB ever hitting anything worthwhile anymore. If you weren't an early investor, then the boat left you.",1,1733952002.0,2024-12-11 21:20:02
1hask00,amartinkyle,Buying at the highest price in years was pretty stupid.,1,1733952811.0,2024-12-11 21:33:31
1hask00,amartinkyle,Can someone ban me from this sub please,1,1733952864.0,2024-12-11 21:34:24
1hask00,AuntyDMoney,Don’t you worry it’ll drop even more. Make sure to panic sell at an all time low. This is not financial advice. Also we might be related.   All joking aside. HODL,1,1733956026.0,2024-12-11 22:27:06
1hask00,Ok_Resolution8683,Get use to it,1,1733963889.0,2024-12-12 00:38:09
1hask00,yeedidas,"Let me know when you plan on buying again, i need to buy the dip",1,1733981170.0,2024-12-12 05:26:10
1hask00,Ninja_Goals,Welcome,1,1734014324.0,2024-12-12 14:38:44
1hask00,Jamm3dTo3,You don’t lose until you sell.,1,1734018183.0,2024-12-12 15:43:03
1hask00,Cryptopimpeth,Should have bought MOG,1,1734022682.0,2024-12-12 16:58:02
1hask00,diealot85,Welcome and get used to it.,1,1734025681.0,2024-12-12 17:48:01
1hask00,Due_Warning_5129,😂😂😂,1,1734030734.0,2024-12-12 19:12:14
1hask00,MrFerleysAscot,But moar!!!!,1,1734031259.0,2024-12-12 19:20:59
1hask00,devil_lettuce,"Buy high, sell low - this is the way",1,1734058069.0,2024-12-13 02:47:49
1hask00,Cold_Television_9565,Welcome to crypto.,1,1734077651.0,2024-12-13 08:14:11
1hask00,MightyZuuL,Be ready to hold shib til 90 years old.,1,1734123103.0,2024-12-13 20:51:43
1hask00,carb0nbasedlifeforms,They will rebrand to SHIBA INU 3.0 and devalue it to 15 zeros first.,1,1734150935.0,2024-12-14 04:35:35
1hask00,Wrong-Ad4243,Join the crowd.  We've all done that. But keep watching. With hope it will rise.,1,1734205833.0,2024-12-14 19:50:33
1hask00,vaninga,You must not be studying your charts,1,1734225339.0,2024-12-15 01:15:39
1hask00,DeepInTheSheep,Get used to it.  Shib is a losing con,1,1733814739.0,2024-12-10 07:12:19
1hask00,vaninga,I’m ahead,0,1734225462.0,2024-12-15 01:17:42
1hask00,amartinkyle,Can believe people actually invest in this thinking they will make money,-1,1733952833.0,2024-12-11 21:33:53
1hask00,diealot85,I have made money,2,1734025750.0,2024-12-12 17:49:10
1hask00,amartinkyle,Sweet dude. Get that lambo.,1,1734033745.0,2024-12-12 20:02:25
1hask00,According_Elephant_6,"I made $800 last big spike, it can be done.",1,1734029650.0,2024-12-12 18:54:10
1hask00,amartinkyle,Lambo time,1,1734033763.0,2024-12-12 20:02:43
1hask00,According_Elephant_6,😆 🏍can I get a Ducati instead?,1,1734042818.0,2024-12-12 22:33:38
1hask00,amartinkyle,Yessir,2,1734054989.0,2024-12-13 01:56:29
1hamboq,Hemightbegiant,I did. Got another 260k+,6,1733784142.0,2024-12-09 22:42:22
1hamboq,Muito2,"For sure, been waiting... That wasn't the big run. Sorry for the sellers that will miss the much bigger money. Dip buy",4,1733784555.0,2024-12-09 22:49:15
1hamboq,Purist1638,Sold the high. Just rebought the dip. What am I gonna be sorry for?,2,1733886718.0,2024-12-11 03:11:58
1hamboq,Traditional_Owl_8963,Ole,1,1734204063.0,2024-12-14 19:21:03
1hamboq,Status_Beat_5193,Bought 9 mill,5,1733786610.0,2024-12-09 23:23:30
1hamboq,Hotsaltynutz,Wish I saw it hit 24,3,1733784789.0,2024-12-09 22:53:09
1hamboq,SlashRModFail,Just bought 10m,3,1733787800.0,2024-12-09 23:43:20
1hamboq,313deezy,Yes queso is good with chips,3,1733808189.0,2024-12-10 05:23:09
1hamboq,c4me20n,"I will, not this dip, but the bigger one coming. Then moon",5,1733784680.0,2024-12-09 22:51:20
1hamboq,Elmatadorzao,What makes you say there’s a bigger one?,2,1733788865.0,2024-12-10 00:01:05
1hamboq,c4me20n,"Seems like total alt coin market cap needs a healthier pullback than the one today before we push up more. I’m still positioned, but definitely have lower buy targets.",2,1733789133.0,2024-12-10 00:05:33
1hamboq,ScruttyMctutty,What is your lower buying target? .000020? Or lower,1,1733841013.0,2024-12-10 14:30:13
1hamboq,c4me20n,Whatever SHIB is at when the OTHERS total market cap excluding top 10 chart is around 325B-300B,1,1733843962.0,2024-12-10 15:19:22
1hamboq,Ericjr321,Starting to think day trading this might work.,2,1733793072.0,2024-12-10 01:11:12
1hamboq,galangga,"Buy the dip, it will go deeper.",2,1733795783.0,2024-12-10 01:56:23
1hamboq,[deleted],I never sold mine,2,1733949472.0,2024-12-11 20:37:52
1hamboq,Icy-Maize-7281,I’m up now it’s normal,1,1733954636.0,2024-12-11 22:03:56
1hamboq,Due_Alternative389,I’ve never understood buy the dip. My avg is so low that I’m wasting money buying the dip. My strategy is buy the dip when it’s lower than your avg. OR if you are trying to buy to get a certain coin total.,2,1733791600.0,2024-12-10 00:46:40
1hamboq,HeavyBigdean,LFG!,1,1733783757.0,2024-12-09 22:35:57
1hamboq,EQN1,Always buy when it dips/ I just bought another 10 K of XRP and 5K of Shiba Inu,1,1733787356.0,2024-12-09 23:35:56
1hamboq,TheRealThrowed,Damn shib team needs to burn 3/4 of the supply and crank it up a notch.. stop making excuses. Always pulls back like a rug.,1,1733788147.0,2024-12-09 23:49:07
1hamboq,LuckyTinMan,"Hey, you’re up 2 cents! Kudos!",1,1733788555.0,2024-12-09 23:55:55
1hamboq,richman678,2 years later still holding.,1,1733789288.0,2024-12-10 00:08:08
1hamboq,bibbydiyaaaak,Is it happening?,1,1733794597.0,2024-12-10 01:36:37
1hamboq,Icaruswaxwing95,Just bought another 3 mill,1,1733796028.0,2024-12-10 02:00:28
1hamboq,Dougielong,Just did the same!,1,1733796413.0,2024-12-10 02:06:53
1hamboq,Playful_Tonight_6267,Buy the dip they said,1,1733798430.0,2024-12-10 02:40:30
1hamboq,Interesting_Set8591,Yes but it will keep dipping,1,1733799816.0,2024-12-10 03:03:36
1hamboq,notso96600,Isn't my 6 billion enough..dips are for chips,1,1733804027.0,2024-12-10 04:13:47
1hamboq,Icy-Maize-7281,Damn that’s a lot of shib,1,1733808385.0,2024-12-10 05:26:25
1hamboq,IYoloStocks,"Pretty sure it’s gonna go further as bitcoin slides. Let it hit lower then buy the dip, you’re only catching a falling knife by the blade",1,1733869751.0,2024-12-10 22:29:11
1hamboq,LeaderBrilliant3662,Added 3 billion,1,1733973863.0,2024-12-12 03:24:23
1hamboq,Hour_Entrepreneur921,No don't,1,1734028959.0,2024-12-12 18:42:39
1hamboq,New-Chemistry6093,lol,1,1733789987.0,2024-12-10 00:19:47
1hamboq,traplox,Buy Pepecoin Network ($PEP).,1,1733791869.0,2024-12-10 00:51:09
1hamboq,SunshineW0lf,No pepe**,0,1733792285.0,2024-12-10 00:58:05
1hamboq,traplox,"No it’s PEP, it went up 2,690% just this month. It’ll soon hit $0.01!",0,1733792409.0,2024-12-10 01:00:09
1hamboq,Killer_Stickman_89,Lol not a fucking chance,1,1733795261.0,2024-12-10 01:47:41
1hamboq,martinez2k19,Not listening to you as this post shows you are down a few hundred 🙄,1,1733794769.0,2024-12-10 01:39:29
1hamboq,Icy-Maize-7281,"I’m down 150$ yesterday was up 1,000 just hold it’s doing the same as doge in 2020",5,1733795485.0,2024-12-10 01:51:25
1hamboq,martinez2k19,You right I just need to jump at the right time I made over $100 the last month and then net -$72,1,1733798198.0,2024-12-10 02:36:38
1hamboq,Hot_Perspective_9405,I had close to a million dogecoin when it was super low!  Sold and made a couple grand!  Then it shot up and I’ve had regrets ever since!  I bought shibu hoping it may do the same.  I’m not selling earlier.  The best thing to do is to buy it and then forget you own it…,1,1734048691.0,2024-12-13 00:11:31
1hat63n,Icy-Maize-7281,You will make a large sum of money holding it rather than trying to time it right either be in or be out,4,1733803451.0,2024-12-10 04:04:11
1hat63n,DeepInTheSheep,Chump change,1,1733820647.0,2024-12-10 08:50:47
1hat63n,executive0utcome,How much is that worth now?,1,1733869480.0,2024-12-10 22:24:40
1hat63n,Dougielong,"That’s a good question. 🙋‍♂️ if they were smart they would’ve sold their initial investment, sold off that and held.",1,1733889021.0,2024-12-11 03:50:21
1hat63n,michaeljai24,Good for you,1,1733951198.0,2024-12-11 21:06:38
1hat63n,michaeljai24,At $2.25 you will be a millionaire,2,1733951359.0,2024-12-11 21:09:19
1hanb0l,StillBiscuit900,Welcome to the club. I bought during yesterday's dip as well,2,1733840908.0,2024-12-10 14:28:28
1hanb0l,TorosTrades028,Word to the wise 😎,1,1733846339.0,2024-12-10 15:58:59
1hanb0l,Cristirus06,Buy more. I have it from 2021 and never sold it. It’s time to sell it. So buy the deep 😂,2,1733929572.0,2024-12-11 15:06:12
1hanb0l,michaeljai24,Me too,2,1733930599.0,2024-12-11 15:23:19
1hanb0l,Open_Shallot_411,Think I have like $25 on it now? Somewhere in there. If I have leftover pocket change in my portfolio I throw it in there if there's a dip. Holding on for the long run.,2,1733963941.0,2024-12-12 00:39:01
1hanb0l,[deleted],[removed],1,1733798065.0,2024-12-10 02:34:25
1hanb0l,TorosTrades028,That's alright I bought at range I'm comfortable at 😎,3,1733799345.0,2024-12-10 02:55:45
1havalh,ComplexWrangler1346,Wow,2,1733827520.0,2024-12-10 10:45:20
1havalh,Icy-Maize-7281,In bull cycles the market is way to volatile,1,1733859940.0,2024-12-10 19:45:40
1havalh,SteezyAsFunk,People get too confident/greedy and don't put stop losses to save their ass.,2,1733881157.0,2024-12-11 01:39:17
1havalh,Icy-Maize-7281,It will be worse in the coming months it always has a pull back gains resistance for a new high that applies to all coins,2,1733892025.0,2024-12-11 04:40:25
1havalh,SteezyAsFunk,"Yup, all the people who are fair weather traders can't comprehend it.",1,1736540762.0,2025-01-10 20:26:02
1havalh,Icy-Maize-7281,That’s what all coins did in 2020-2021,1,1733892059.0,2024-12-11 04:40:59
1havalh,Icy-Maize-7281,Half a billion gone from the market,1,1733810881.0,2024-12-10 06:08:01
1havalh,Beanfromband23,Nothing wrong with using leverage. People losing right now are not trading with fundamentals.,1,1734102946.0,2024-12-13 15:15:46
1haz8uv,ComplexWrangler1346,It will go back up,1,1733905380.0,2024-12-11 08:23:00
1ha99su,GeologistAromatic268,now’s the time to buy more and get that average cost down as low as you can get it,6,1733759248.0,2024-12-09 15:47:28
1ha99su,AvailableNinja9316,We all have bought at the top at some point. Dont be ashamed.,10,1733756072.0,2024-12-09 14:54:32
1ha99su,Alternative-Hope-196,Holding 3 years strong,11,1733760412.0,2024-12-09 16:06:52
1ha99su,Chili327,"Buying $50 and now it’s worth $18? Sure not bad. lol Just keep holding, and don’t sell just to get your $50 back.",3,1733762576.0,2024-12-09 16:42:56
1ha99su,jclopez95,Hodl,3,1733781263.0,2024-12-09 21:54:23
1ha99su,lagged_ts,"why my coinbase doesn’t show the return, avg cost etc? just the balance in $ and then transactions",2,1733763921.0,2024-12-09 17:05:21
1ha99su,c4me20n,Turn off advanced trading to view it like this… I don’t know why it should be like this on advanced trading too.,1,1733770779.0,2024-12-09 18:59:39
1ha99su,lagged_ts,i did turn off advanced trade mode,1,1733795601.0,2024-12-10 01:53:21
1ha99su,FreshExtent8720,It's 50 bucks? Whats your gameplan? You might make 300?,2,1733765148.0,2024-12-09 17:25:48
1ha99su,Alminho92,Why do you care just let people invest how much they want/can. You never know their background,1,1733773358.0,2024-12-09 19:42:38
1ha99su,KhaiBurObsolete, It the dips Evan adding 10$ here and there would make a huge difference with a position this size,2,1733768256.0,2024-12-09 18:17:36
1ha99su,Alternative-Hope-196,I did just for you,1,1733788455.0,2024-12-09 23:54:15
1ha99su,Crypto_Mike55,Never a good idea to have all your portfolio in one token. You should always diversify,2,1733771274.0,2024-12-09 19:07:54
1ha99su,Alternative-Hope-196,"I agree, hitting big on draft kings now",3,1733771322.0,2024-12-09 19:08:42
1ha99su,TorosTrades028,I would wait until it gets to a support or resistance level,2,1733777303.0,2024-12-09 20:48:23
1ha99su,DeepInTheSheep,Is losing 60% of your investment good?  No real investor is going to say yes.,2,1733787529.0,2024-12-09 23:38:49
1ha99su,NobodyKey594,Just keep buying,1,1733785372.0,2024-12-09 23:02:52
1ha99su,BenjaminC40,For tax purposes,1,1733792220.0,2024-12-10 00:57:00
1ha99su,Independent_Pay_381,Better on $swft probably,1,1733890358.0,2024-12-11 04:12:38
1ha99su,gionatacar,Not great,1,1733909934.0,2024-12-11 09:38:54
