post_id,author,body,score,created_utc,date
1hdsmh1,Affectionate_Seat959,"No one knows what and how Shib will perform next year. All speculative. Charts can give an idea from past of dips and raises and economic climate can give some idea. We do know that Shib did go up to .00008 at one time and at current place right now if you did buy it now or during Bear market and if it goes up to highest it has been before, you will make some money. It is a possibility that it could go to .00009 and even loose 1 zero next year to .0001. If any dips which are naturally going to happen. May take it back to current levels or maybe little lower. That is my prediction.",12,1734146361.0,2024-12-14 03:19:21
1hdsmh1,Fearless-Hornet6980,"I had 100 mil shares at one point for almost 5 years.  I traded off 50 mil and eventually converted it all to XRP 7 months ago.  Now up 330%.  I moved on for a profit, mistake on not, that’s the choice we make.  You can believe in something and be patient or you can find something else to believe in and make a profit.",13,1734146941.0,2024-12-14 03:29:01
1hdsmh1,larryjefferyjohnson,"XRP is more legit, has real use cases.",7,1734158929.0,2024-12-14 06:48:49
1hdsmh1,Vvw3297,I’d say you dis the right thing,3,1734171374.0,2024-12-14 10:16:14
1hdsmh1,Hotsaltynutz,When you buy high you are going to have to wait. The trick is to buy low and sell high,6,1734150900.0,2024-12-14 04:35:00
1hdsmh1,DANDELOREAN,No,15,1734144743.0,2024-12-14 02:52:23
1hdsmh1,Twitchfresse,No you wont ... you invested in a meme coin Project that was Internally made to make their creators money ...  Its literally like having Monopoly money at home waiting for it to be worth anything.,4,1734167494.0,2024-12-14 09:11:34
1hdsmh1,Vvw3297,LOL sounds like truth,1,1734174440.0,2024-12-14 11:07:20
1hdsmh1,Twitchfresse,"It is i invested in a lot of shit a few years ago ... bought shiba bought saitama etc.  Still worth nothing ... if i had Bought BTC, ETH instead of meme coins i would have a lot of money right now.  So my best advice do what i did and try to learn as much as possible ...  Some Tips:  BTC is big daddy and the only COIN.  Whole market moves after BTC ... in the long run its better to invest in BTC - altcoins only go up at the end of the Bull market or before they are rug Pulled.  Everybody who tells you to invest in meme coins is probably invested himself and already lost money.  The buy in and hold strategy of reddit Investors is mental ... you dont want to be Exposed to the market through rough periods.  The best way to do this is Trend probability.  Dont believe in news on Google etc cause its lagging... news are in the past already happened and are mostly already priced in.",1,1734176519.0,2024-12-14 11:41:59
1hdsmh1,obliterate_reality,You just held it and never converted profits to usdc or sol? Thats your issue lmao  most shitter traders have no issue because theyll remove initial liq after first pump. which should be common sense.,1,1734297699.0,2024-12-15 21:21:39
1hdsmh1,obliterate_reality,"Its what I did with shib in 2021 then dumped at .00007 or .0007, forgot the exact decimal , because as much as people dont want to admit, it is in the shitcoin category",2,1734297851.0,2024-12-15 21:24:11
1hdsmh1,Twitchfresse,i still have like 5 mil of this token but lets not be delusional ... there is almost zero chance it will get to 0.1.,1,1734339814.0,2024-12-16 09:03:34
1hdsmh1,Twitchfresse,iti was just when i started getting into crypto i did a lot of shitty investments in the beginning ... did know nothing to be honest.,1,1734339714.0,2024-12-16 09:01:54
1hdsmh1,FrankBridge25,"Probably not, I bought 1m coins for £22 and will hold forever in hope. Even if it ever reaches £0.001 I'll have made 4k which would pay for a holiday.",3,1734146269.0,2024-12-14 03:17:49
1hdsmh1,Vvw3297,Honestly since I have it I have only seen it being the same or going down,1,1734171420.0,2024-12-14 10:17:00
1hdsmh1,Jaded_Seesaw,Patience,6,1734142798.0,2024-12-14 02:19:58
1hdsmh1,Legitimate_Ad785,No,2,1734147431.0,2024-12-14 03:37:11
1hdsmh1,[deleted],How long are you going to be on earth?,2,1734147578.0,2024-12-14 03:39:38
1hdsmh1,martinez2k19,No too late I lost 60$ YTD I’m done with Shib 😭,2,1734156166.0,2024-12-14 06:02:46
1hdsmh1,SlashRModFail,You're an emotional investor OP.  You're never going to make it with such a weak mental model.,2,1734266296.0,2024-12-15 12:38:16
1hdsmh1,MountainIcy8084,"I’ll be honest, if you’re not a whale, you’re not ever going to earn significant amount with shib",1,1734143727.0,2024-12-14 02:35:27
1hdsmh1,Vvw3297,Honestly I know I’m not. But what does that suppose to mean…lolll,1,1734144486.0,2024-12-14 02:48:06
1hdsmh1,MountainIcy8084,It means you won’t get much gains (in my opinion). Maybe like a 2-3x at max.  Maybe look at popular projects with a lower MC if you want gains,2,1734144842.0,2024-12-14 02:54:02
1hdsmh1,THEDRDARKROOM,Ya when it flips positive you sell it 👌🏻,1,1734147875.0,2024-12-14 03:44:35
1hdsmh1,AuntyDMoney,It lost 7 zeros since 2020 sooooo. HODL,1,1734148415.0,2024-12-14 03:53:35
1hdsmh1,robynv12,I’m up 5k never sold bought at .0000065,1,1734150182.0,2024-12-14 04:23:02
1hdsmh1,Icy-Maize-7281,"Last week I was up 1,000 until it corrected just hold it not gonna move over night",1,1734151152.0,2024-12-14 04:39:12
1hdsmh1,Doironzch1,Held for over a year to make profit. Just be patient,1,1734151650.0,2024-12-14 04:47:30
1hdsmh1,johnmoney22,"Noone knows or can garuntee anything from any stock or crypto especially. Even the so-called experts. With these types of investments nothing is quick. Some people make a few bucks here and there by taking out at every rise and buying back in at every dip but that only gets you minimal gains…maybe 15-60 buckere here and there depending on how much money you’re investing. If you wanna see real gaines it would take alot of investment up front and steady investments weekly or monthly on the dips and waiting  over time for the long haul. Im talking about 1-3 years of holding and investing depending on the rate at wich it rises to see a substantial increase. You must be prepared to invest over 1,000 dollars, and you must also be aware and understand that you very well could lose all of it. Its lost a few zero’s since i started investing, and i will stand to make a few hundred thousand dollars if it loses 2 more zeros. The golden spot that everyone is hoping for is the .01 cent mark. For example bit coin started less then 1 cent in 2010 but now is over 100k per coin. Had someone purchased 1,000 dollars worth and cashed out today that’s enough money for 10 different familes to live for 5 generations …so its about the long haul.",1,1734154798.0,2024-12-14 05:39:58
1hdsmh1,dixiemud,"I did oct 2021. Just don’t chase spikes. Buy on red, sell on green homie",1,1734196944.0,2024-12-14 17:22:24
1hdsmh1,The_MailMan88,NO,1,1734197342.0,2024-12-14 17:29:02
1hdsmh1,el_pieablo,"Spent £45 in 2020/2021, and I'm up £100.",1,1734258463.0,2024-12-15 10:27:43
1hdsmh1,MonacoFranzee,you will earn as long as there are People who are willing to pay more for buying SHIB,1,1734262881.0,2024-12-15 11:41:21
1hdsmh1,Flyinryan699,Glad I only put $30 in it recently,1,1734291568.0,2024-12-15 19:39:28
1hdsmh1,abaconsandwich,I bought and plan on sitting on it for a while. Like 10 years. Not sure what you bought in for but hopefully after some time itll go up,1,1734143039.0,2024-12-14 02:23:59
1hdsmh1,Vvw3297,"Well, that makes sense I guess",1,1734144445.0,2024-12-14 02:47:25
1hdsmh1,VladTheSimpaler,How does holding a meme coin for 10 years make any sense?,1,1734161788.0,2024-12-14 07:36:28
1hdsmh1,Vvw3297,Makes sense when you already have fortune you can spend your whole life with it and just gambling on side on other stuff just in case you get more into your account,2,1734174391.0,2024-12-14 11:06:31
1hdsmh1,Prestigious_Weird_86,Lottery ticket innit?,1,1734170557.0,2024-12-14 10:02:37
1hdsmh1,Vvw3297,One don’t get the lottery either everyday,1,1734174409.0,2024-12-14 11:06:49
1hdsmh1,Express-Ad4146,I’m up 500 bucks. . and…..they’re gone.,1,1734143549.0,2024-12-14 02:32:29
1hdsmh1,Vvw3297,Lucky,0,1734144459.0,2024-12-14 02:47:39
1hdsmh1,ChiefRasta,Gotta stay to play &amp; win,1,1734145712.0,2024-12-14 03:08:32
1hdsmh1,brhadli,I quit looking at my Shib in spring of 2022. Any idea of the change in price since then?,1,1734145762.0,2024-12-14 03:09:22
1hdsmh1,EQN1,Hold for 5 years,0,1734143004.0,2024-12-14 02:23:24
1hdsmh1,Vvw3297,What if it doesn’t grow in 5years,0,1734144425.0,2024-12-14 02:47:05
1hdsmh1,thegnarles,Then wait longer. Set it and forget it.,2,1734144743.0,2024-12-14 02:52:23
1hdsmh1,EQN1,I guarantee it will be near the $0.01 cent mark,-3,1734146485.0,2024-12-14 03:21:25
1hcw29i,ComplexWrangler1346,To the moon,0,1734080960.0,2024-12-13 09:09:20
1hcw29i,IYoloStocks,"Yea it’s doomed gloom for everyone with puts, trump literally rang the bell today to say the bull run isn’t over",1,1734039978.0,2024-12-12 21:46:18
1hcw29i,PuzzleheadedFan6274,Going to the moon is not happenimg for 10-20 years bruh or more,1,1734049077.0,2024-12-13 00:17:57
1hcw29i,Muito2,"I burned my 2 PDT shorts for this week, so nothing for tomorrow. Only Long so let her rip. Aren't we due for a low float screamer...",0,1734043626.0,2024-12-12 22:47:06
1hd2v2d,Metspolice,If it does I will own everything on the earth.,8,1734059364.0,2024-12-13 03:09:24
1hd2v2d,CYPH3R_22,😂,1,1734059417.0,2024-12-13 03:10:17
1hd2v2d,arcticfunky9,How many do u have,1,1734059727.0,2024-12-13 03:15:27
1hd2v2d,Nftman101,No,4,1734059283.0,2024-12-13 03:08:03
1hd2v2d,Grisuno123,It would be worth 589 Trillion Dollars. LOL,3,1734059616.0,2024-12-13 03:13:36
1hd2v2d,Ok-Dot-5344,Short answer….No.,2,1734059534.0,2024-12-13 03:12:14
1hd2v2d,Positive_Mastodon_46,No,2,1734060008.0,2024-12-13 03:20:08
1hd2v2d,Opposite_Daikon_6396,Unless trump dumps all the federal reserve money that gets burned into shib burns den I doubt it😂😂 like to even burn over 500 trillion shib is going to take a lot of money and most people buying into shib aren’t buying to burn it they actually  need the money lol,2,1734082023.0,2024-12-13 09:27:03
1hd2v2d,geotristan,1 cent would be difficult to hit let alone a dollar. Tbh i font think it is possible unless the value of usd tanks much worse than we have ever seen it before,1,1734060905.0,2024-12-13 03:35:05
1hd2v2d,Bigkilo27,I remember when everyone was saying dogecoin wouldn’t hit anything. Believe in Shib,1,1737155352.0,2025-01-17 23:09:12
1hd2v2d,NoInvestment1266,No,1,1734085848.0,2024-12-13 10:30:48
1hd2v2d,Fair-Argument-9650,I’d make way too much money for that to ever happen lol sorry,1,1734130443.0,2024-12-13 22:54:03
1hd2v2d,[deleted],It might if the dollar devalues massively.,1,1734171591.0,2024-12-14 10:19:51
1hbxdsr,No-Nose-6007,Holding tight to my 326M 🤞🏽,8,1733949422.0,2024-12-11 20:37:02
1hbxdsr,Frosty-Dependent1975,That's what I have!,1,1733959260.0,2024-12-11 23:21:00
1hbxdsr,Ryse47,1.65 billion since Dec of 2023. I still live like a poor man. Just sitting on that honey pot that I haven’t even told my family about. I’m only 32 so I have a long time to keep holding.,3,1734018898.0,2024-12-12 15:54:58
1hbxdsr,[deleted],What? Come on….i think we found the bullshit king,1,1734117666.0,2024-12-13 19:21:06
1hbxdsr,Fair-Argument-9650,Why are they the bullshit king?,1,1734130574.0,2024-12-13 22:56:14
1hbxdsr,ImPossiblycorrect,🙌,2,1733951622.0,2024-12-11 21:13:42
1hbxdsr,R852012,"Good stuff, I just acquired another 3 million SHIB last night, total of 24 million now. Racing towards 100 million 🫡🫡🫡🫡",2,1734016557.0,2024-12-12 15:15:57
1hbxdsr,Whimsical-Pigeon,Good luck!,2,1733935324.0,2024-12-11 16:42:04
1hbxdsr,AvailableNinja9316,They’re here. Buckle up boys,2,1733942703.0,2024-12-11 18:45:03
1hbxdsr,Cryptopimpeth,Should have bought MOG,2,1734022418.0,2024-12-12 16:53:38
1hbxdsr,TDawgg89,Just dreaming for .10 cents,1,1734318469.0,2024-12-16 03:07:49
1hbpll2,unknown-one,!RemindMe 50 years,16,1733909531.0,2024-12-11 09:32:11
1hbpll2,The_mogliman,"Hey becoming a millionaire in 50 years is still not something to scoff at, especially if you only put down like $50 or something",10,1733953747.0,2024-12-11 21:49:07
1hbpll2,RemindMeBot,I will be messaging you in 50 years on [**2074-12-11 09:32:11 UTC**](http://www.wolframalpha.com/input/?i=2074-12-11%2009:32:11%20UTC%20To%20Local%20Time) to remind you of [**this link**](https://www.reddit.com/r/Shibainucoin/comments/1hbpll2/one_day/m1i1ttg/?context=3)  [**7 OTHERS CLICKED THIS LINK**](https://www.reddit.com/message/compose/?to=RemindMeBot&amp;subject=Reminder&amp;message=%5Bhttps%3A%2F%2Fwww.reddit.com%2Fr%2FShibainucoin%2Fcomments%2F1hbpll2%2Fone_day%2Fm1i1ttg%2F%5D%0A%0ARemindMe%21%202074-12-11%2009%3A32%3A11%20UTC) to send a PM to also be reminded and to reduce spam.  ^(Parent commenter can ) [^(delete this message to hide from others.)](https://www.reddit.com/message/compose/?to=RemindMeBot&amp;subject=Delete%20Comment&amp;message=Delete%21%201hbpll2)  *****  |[^(Info)](https://www.reddit.com/r/RemindMeBot/comments/e1bko7/remindmebot_info_v21/)|[^(Custom)](https://www.reddit.com/message/compose/?to=RemindMeBot&amp;subject=Reminder&amp;message=%5BLink%20or%20message%20inside%20square%20brackets%5D%0A%0ARemindMe%21%20Time%20period%20here)|[^(Your Reminders)](https://www.reddit.com/message/compose/?to=RemindMeBot&amp;subject=List%20Of%20Reminders&amp;message=MyReminders%21)|[^(Feedback)](https://www.reddit.com/message/compose/?to=Watchful1&amp;subject=RemindMeBot%20Feedback)| |-|-|-|-|,6,1733909589.0,2024-12-11 09:33:09
1hbpll2,Icy-Maize-7281,🤣🤣🤣,2,1733910004.0,2024-12-11 09:40:04
1hbpll2,Icy-Maize-7281,Wake up it’s 2030,3,1733909568.0,2024-12-11 09:32:48
1hbpll2,Icy-Maize-7281,Remind me in 2030,2,1733910051.0,2024-12-11 09:40:51
1hbpll2,Different-Ad-6571,In 50 years reddit might not be a thing,1,1734109515.0,2024-12-13 17:05:15
1hbpll2,obliterate_reality,id probably aim for more like 130-175,1,1733937808.0,2024-12-11 17:23:28
1hbpll2,Open_Shallot_411,Like when Fry (Futurama) finds his debit card lol. I threw $20 at it. It can sit for a few years. Not going to miss it.,3,1733931306.0,2024-12-11 15:35:06
1hbpll2,notyourusualgabe,This is what me and my hubs did. Four years ago we each put $50 in. Wouldn’t miss it. And then we forgot about it until recently 😂,3,1733949458.0,2024-12-11 20:37:38
1hbpll2,Extension-Lie-3272,You all laugh but it's true 2050-2060 is where it's at,2,1733919102.0,2024-12-11 12:11:42
1hbpll2,MotherEarthsFinests,"Realistically, by 2050 Shiba will **very likely** be worth close to nothing with a sub 20m marketcap.    Nothing against Shib. Most coins will be worth nothing.",4,1733935029.0,2024-12-11 16:37:09
1hbpll2,CatOrganic609,The realest answer on this delusional subreddit lol,2,1734002441.0,2024-12-12 11:20:41
1hbpll2,robinwilliamlover911,Shiba shills are probably the most delusional people in the crypto space,1,1734187845.0,2024-12-14 14:50:45
1hbpll2,JakobiWunKenobi,"You probably don’t even know who your real father is, let alone the future of crypto.",1,1733954730.0,2024-12-11 22:05:30
1hbpll2,amartinkyle,And $2m USD can buy you a hamburger!,3,1733962654.0,2024-12-12 00:17:34
1hbpll2,amartinkyle,lol,1,1733962626.0,2024-12-12 00:17:06
1hbpll2,Jotadvanucci,No vale la pena,1,1733966941.0,2024-12-12 01:29:01
1hbpll2,Novel-Bad2984,Good luck! Hope you can make it before we go to mars,1,1733969422.0,2024-12-12 02:10:22
1hbpll2,crxcked_,".001 is my goal for the next 15 years on this coin. That works out to a 500 billion market cap. Realistic wait time, and a more probable outcome compared to a cent (5 trillion cap).",1,1733982129.0,2024-12-12 05:42:09
1hbpll2,crypto95240,Je n’y crois pas le fondateur a vendu ses coins,1,1734015673.0,2024-12-12 15:01:13
1hbpll2,Tae82_,Its comments and “ know it all” attitudes that get people to lose money when they feed into it.. Forget math let’s look at the facts ( If The Powers That Be) wants shib to go up it will.. No Math Needed.,1,1734017831.0,2024-12-12 15:37:11
1hbpll2,Icy-Maize-7281,Exactly,2,1734081887.0,2024-12-13 09:24:47
1hbpll2,robinwilliamlover911,"Math is how you get factual information, delusional ideology doesn't magically make a coin go up.",1,1734188187.0,2024-12-14 14:56:27
1hbpll2,Tae82_,I said what I said if you know you know and obviously you don’t so comment don’t apply to you .,1,1734223629.0,2024-12-15 00:47:09
1hbpll2,DongWaiTulong,"idk how many times i have to say it but there isn’t enough money in the world to support a 1¢ shiba valuation, do you people not know how basic arithmetic works?",-1,1733952440.0,2024-12-11 21:27:20
1hbpll2,Icy-Maize-7281,Realistically if wall st black rock Morgan Stanley could easily get it up if they tried also the burns over the years it’s impossible til it’s done 2020 doge 0.0045 2021 0.73 I had 438k doge for 2k usd investment I listened to other ppl it will never reach 0.01 or be worth anything,5,1733953423.0,2024-12-11 21:43:43
1hbpll2,DongWaiTulong,"you don’t understand how money works, do you?",-3,1733957612.0,2024-12-11 22:53:32
1hbpll2,Icy-Maize-7281,If you don’t believe in the coin why are you in this chat genuinely curious,4,1733957707.0,2024-12-11 22:55:07
1hbpll2,DongWaiTulong,"who said I didn’t see value in this coin? again you’re being delusional. I said there isn’t enough money on the planet, even in fifty years, to support a 1¢ coin valuation. Not unless 95%+ of the coin is burned. so continue to throw this bologna comments my way I’m loving the lack of cognition you’re displaying.",1,1734133905.0,2024-12-13 23:51:45
1hbpll2,Icy-Maize-7281,No I do but I’m not gonna look back in 10 years saying oh well I sold 200m Shiba now it’s worth 2m usd,2,1733957679.0,2024-12-11 22:54:39
1hbpll2,DongWaiTulong,you guys are delusional 😂,1,1734133819.0,2024-12-13 23:50:19
1hbpll2,Icy-Maize-7281,Shib is still considered a new coin compared to its competitors doge has been around for well over 10 years now it hit 0.73 I understand it different I’m aware,3,1733957821.0,2024-12-11 22:57:01
1hbpll2,[deleted],[deleted],3,1733977677.0,2024-12-12 04:27:57
1hbpll2,Clean_Ad3478,Bro talks about not understanding crypto but doesn’t put into consideration that over 400 trillion coins have been burned in the past 4 years,1,1733999412.0,2024-12-12 10:30:12
1hbpll2,CatOrganic609,"Word of advice: Unless you're holding BNB/ETH - most ""burns"" are gimmicks to attract new buyers.  Burning 400 trillion tokens yet still not getting back to ATH should tell you everything you need to know.  BTC/SOL/BNB and most assets from last cycle have surpassed their previous ATHs, SHIB hasn't even come close.   So burning really doesn't do much. Hard to create ""demand"" when there is almost an infinite supply of tokens.",1,1734002587.0,2024-12-12 11:23:07
1hbpll2,Clean_Ad3478,"What about the Quadrillion+ DOGE coins that were in circulation back when it was first created, look how many has been burned since then. Coins like shiba and PEPE are staples to the meme coin community just like DOGE. I have full belief that this coin will grow tremendously long term. We all have our opinions and I appreciate yours.",2,1734010354.0,2024-12-12 13:32:34
1hbpll2,CatOrganic609,"It’s not an argument over whether SHIB will survive. Of course, it should. It’s more about the delusion of 1 cent which mathematically makes no sense",1,1734010976.0,2024-12-12 13:42:56
1hbpll2,Clean_Ad3478,!RemindMe 16 years,1,1734015889.0,2024-12-12 15:04:49
1hbpll2,[deleted],[deleted],0,1734015766.0,2024-12-12 15:02:46
1hbpll2,DongWaiTulong,thank you fellow brain-user.,1,1734133936.0,2024-12-13 23:52:16
1hbpll2,VideoRainBo,"1,000 people at a billion equals Elon musk and a group like him buy it out and split 10 times they get their money back 10 people lose what the 1,000 people put in and the party stay's together basically to much money right.... Since a bank can not offer interest and the losers keep growing...",1,1734135419.0,2024-12-14 00:16:59
1hbpll2,Lonely-Blueberry-637,You seriously don’t understand how the crypto market works do you 🙄,1,1733964343.0,2024-12-12 00:45:43
1hbpll2,DongWaiTulong,want to compare how much our accounts increased in % value? I’m willing to bet I outperformed you in both securities and cryptocurrencies.,0,1734134034.0,2024-12-13 23:53:54
1hbpll2,Lonely-Blueberry-637,"Put it away, Dick. You’re getting mad about a stranger on the internet. Take a deep breath. No one fkn cares ok. No one but you.",0,1734135334.0,2024-12-14 00:15:34
1hbpll2,DongWaiTulong,I’m mad? 😂 bro my profits could be fifty dollars the point is my percentage return is for sure way higher than this schmuck’s because I know what I’m doing and I’m not making incompetent claims online.,-1,1734137945.0,2024-12-14 00:59:05
1hbpll2,shazzzzzzzzzzzzy,Actually.. shib won’t get to 1 cent by normal means. The market cap will have to undergo a 90% burn for that to happen.,1,1734033024.0,2024-12-12 19:50:24
1hbpll2,DongWaiTulong,the third person beside me to posses a brain in this comments section.,1,1734134063.0,2024-12-13 23:54:23
1hbpll2,Human_Ebb_6533,"Forget about it, pull your money and invest in PEP",-8,1733923836.0,2024-12-11 13:30:36
1hbpll2,Icy-Maize-7281,It will take 4yr longer for Pepe to 0.01 compared to shib,0,1733966222.0,2024-12-12 01:17:02
1hbpll2,Upper-Ad4942,"🌙🐾 Have you heard about SleepyShiba (ZZZSHIB)? 🐾🌙 The coziest meme coin on Solana is here, and it’s already napping its way to the moon! 🚀💤  🔥 Why $ZZZSHIB?  Built on Solana for fast, low-cost transactions. A fun, community-driven token perfect for meme lovers and dreamers. Airdrops, giveaways, and exclusive rewards for our growing pack! 🐶 Token Address: DaetkfL8dBRFCVJTZaeUbukqCJCvHbNKzzv8Sn4VWpnR  Track our progress and check out $ZZZSHIB using the address above. Let’s dream big together, one nap at a time! 🌟🐾  #MemeCoin #Crypto #ShibaZZZ #ZZZSHIB",-3,1733925920.0,2024-12-11 14:05:20
1hb9abd,According_Elephant_6,Did the 🌙 move closer?,10,1733857534.0,2024-12-10 19:05:34
1hb9abd,Hydrosquatch,Aaaaaaand back to earth,5,1733862334.0,2024-12-10 20:25:34
1hb9abd,Jackle935,Shibussy?,5,1733866177.0,2024-12-10 21:29:37
1hb9abd,Shining_Star11-,yeah bro the the moon!! gonna hit $1 FASHO you’re the next shib millionaire,3,1733875492.0,2024-12-11 00:04:52
1hb9abd,PirateCareless1363,"Imma need you to buy more. I don’t want you to regret the day when the internet says it’s impossible for SHIB to hit $1 and then say “BREAKING NEWS” SHIB INU and PEPE hits $1, $5, $10 and $15 dollars!!!!!!",3,1733947220.0,2024-12-11 20:00:20
1hb9abd,StillBiscuit900,Time to buy more lol,2,1733866492.0,2024-12-10 21:34:52
1hb9abd,aaronald88,Buy more,2,1733866757.0,2024-12-10 21:39:17
1hb9abd,Extension-Lie-3272,Woah no it's not going to the moon. Maybe to the land from the bottom of the river or something. You can see it in the pic you showed us.,2,1733882845.0,2024-12-11 02:07:25
1hb9abd,latcatlovesfilm,Srsly,1,1733882965.0,2024-12-11 02:09:25
1hb9abd,Current_Growth_9867,pepe 🔝,2,1733886354.0,2024-12-11 03:05:54
1hb9abd,DaRealJayy,Have hope people . Once these people start pushing trillions onto the block chain all these coins that blew up before are gonna blow up 10000x more . It’s gonna be trillions of dollars which means hundreds of billions possibly 10-20 trillion will be circulating imagine shib with just a 900 billion market cap . It’s not impossible people stuff is lining up so perfectly it seems fake.💯💯,2,1733886828.0,2024-12-11 03:13:48
1hb9abd,Critical_Reserve_123,So how many zeros are we losing and when?  That's all I wanttoi know.,2,1733971053.0,2024-12-12 02:37:33
1hb9abd,amartinkyle,"This is the story of most, don’t worry though. It’ll all be gone soon enough",2,1734013424.0,2024-12-12 14:23:44
1hb9abd,funnnFka,Idk why people still invest in this 😔,2,1734094970.0,2024-12-13 13:02:50
1hb9abd,latcatlovesfilm,Closing coinbase app until further notice,1,1737222455.0,2025-01-18 17:47:35
1hb9abd,PoomanJoo,These posts need to be moderated for attempted manipulation or something - they’re getting more and more pathetic,2,1734013032.0,2024-12-12 14:17:12
1hb9abd,latcatlovesfilm,Boohoo,1,1734031885.0,2024-12-12 19:31:25
1hb9abd,serbobbyross,lmao,1,1733859232.0,2024-12-10 19:33:52
1hb9abd,michaeljai24,Let’s go,1,1733864472.0,2024-12-10 21:01:12
1hb9abd,latcatlovesfilm,* and there - fck it my mind hurts back to not opening the app for another year,0,1733862410.0,2024-12-10 20:26:50
1hb9abd,Barachiel93,$UOS  has a far better chance of moving to $1 than shiba does. It's gonna take at least a few years. $UOS can pop off to a dollar with in a few weeks plus the dev is active in the chat too   https://x.com/Universal_O_S?t=2YwI6Sevj2ZMEX6SjKe4hg&amp;s=09,0,1733960716.0,2024-12-11 23:45:16
1hb9abd,Inside-Practice6149,Ur down 60$… that’s one nice meal. Shut up 😂,-1,1734031868.0,2024-12-12 19:31:08
1hask00,[deleted],Welcome to Crypto!,24,1733801540.0,2024-12-10 03:32:20
1hask00,CowboyBebopBang,And the next post…   OMG IT WENT UP!,7,1733823171.0,2024-12-10 09:32:51
1hask00,WhyAreYouGe,Next post:  back down :(,3,1733851692.0,2024-12-10 17:28:12
1hask00,MooseLogic7,Next post:  Why sideways?,3,1733968718.0,2024-12-12 01:58:38
1hask00,[deleted],“I bought crypto and time slowed down…what gives”,2,1734123256.0,2024-12-13 20:54:16
1hask00,Cold_Television_9565,Need eth to pump and it hasnt,0,1734077662.0,2024-12-13 08:14:22
1hask00,New-Slice4221,At 4pm EVERY CRYPTO DIPPED,9,1733801985.0,2024-12-10 03:39:45
1hask00,[deleted],Timezone?,1,1733802424.0,2024-12-10 03:47:04
