post_id,author,body,score,created_utc,date
1h3rm4o,Killer_Stickman_89,XRP has gotten legal clarity from the SEC and is essentially at ATH levels. While it will not be worth more than Bitcoin or ETH. If you actively chose to dump money into SHIB over it you are a fool. It still has a lot of potential growth in this bullrun alone that would greatly surpass your gains from holding SHIB. As your token has essentially no room for growth period. The circulating supply is too large. I'm saying this as someone who kind of has a grudge against the XRP Army as well.,0,1733162271.0,2024-12-02 17:57:51
1h3rm4o,SensitiveRip3303,"And that is your opinion, I bought into shib a while ago and my money is up.  I will not be dumping anymore money into shib but I’m not selling",1,1733162417.0,2024-12-02 18:00:17
1h3rm4o,Killer_Stickman_89,"I mean if you are only holding 4 digits and you cannot put significant money into other projects with your income. Then logically there's not really much of a reason to hold it in SHIB. Only reason it'd be acceptable is if you bought A LOT in say January of this year.   You don't know when this bullrun will end or what the floor will be after it's concluded. Odds are its gonna pump pretty hard towards the end of this month and in January of 2025. If it's stays stagnant after Trump's inauguration. Then it will dip, HARD, and that will be your only chance to buy back in.   The logical conclusion would be to buy into market while it's currently stagnant. The floor right now will already be much higher than it was during the last crash at worst because the price of BTC right now is 95k with I think a 98k ATH. So even in the event that BTC somehow stays at around 95-98k for 2-3 months straight despite being shilled by both Elon and Trump at this point, and despite the SEC no longer being a real obstacle for BTC and many other cryptocurrencies going forward. You'd still *initially* lose near the exact same amount that you have for holding it. **However in both the short and long term you'd make way more money.** Because with another token you'd have more options for that token to make whatever you lost back and then some with APY. There are so many wallets and even exchanges like Coinbase. That will give you good APY just for holding without having to stake. You do that and throw in investments during the dip and by the time the next bullrun happens you'd be absolutely stacked. It's a lot more preferable and logical than waiting I think what they are saying here is **10 years.** I have a feeling that unless you spent like 10-20k on it during ATH levels you could probably put back in whatever you sell in a week or less if holding SHIB matters that much to you.  Lol I'm just telling you how it is. My guess is that Elon couldn't give less of a shit about SHIB and the same could be said for Donald Trump. In fact I'd argue they'd drag SHIB in the mud to make DOGE look better. Which could tank the price.",0,1733162613.0,2024-12-02 18:03:33
1h3rm4o,Fritz73r,.0025 would be a more realistic target…..but you never know !!!,1,1733080921.0,2024-12-01 19:22:01
1h3rm4o,Bobflan123,Let’s goooo!!,1,1733088821.0,2024-12-01 21:33:41
1h3rm4o,[deleted],hoping shiba to reach 1$,1,1733106124.0,2024-12-02 02:22:04
1h3rm4o,michaeljai24,To mars,1,1733111136.0,2024-12-02 03:45:36
1h3rm4o,8lbs_overweight,"""it's happening""",1,1733113423.0,2024-12-02 04:23:43
1h3rm4o,ALargeHotCarl,We hope!,1,1733119427.0,2024-12-02 06:03:47
1h3rm4o,Substantial-Bull,To the mooonnn,1,1733160502.0,2024-12-02 17:28:22
1h3rm4o,Commercial-Note-5079,🤣🤣🤣,1,1733193498.0,2024-12-03 02:38:18
1h3rm4o,WorldViewSuperStar,"ha, you had nice timing if it was before the rise",1,1733362421.0,2024-12-05 01:33:41
1h3rm4o,kaesefetisch,I will sell at 10$,1,1733373041.0,2024-12-05 04:30:41
1h3rm4o,ripcityblaz3r,"Bought 2,000,000 at 0.000013 trying to get to 10,000,000 🐶🚀",1,1733408278.0,2024-12-05 14:17:58
1h3rm4o,LavaPlug4Bowser,"Alright, I wanna join the trip towards the moon, how do I ~~sell my soul~~ climb aboard?",1,1733429181.0,2024-12-05 20:06:21
1h3rm4o,byngcbc,Stop fcking around it’s going no where,1,1733430633.0,2024-12-05 20:30:33
1h3rm4o,papahead135,Whatever keeps dreaming about the moon and you get to the center of the earth very quickly,1,1733021730.0,2024-12-01 02:55:30
1h3rm4o,ChaotiQ78,Let it rise,1,1733020268.0,2024-12-01 02:31:08
1h3rm4o,cinesias,"Get ready to buy the dip, friend.",0,1733019001.0,2024-12-01 02:10:01
1h3rm4o,worldtraveler1979,"Zoom out to all.. We have a long way to go, we need more gas.. ⛽️",0,1733100855.0,2024-12-02 00:54:15
1h3y9xt,Kuriouskat22,The funny thing is you don’t need it to go to 1 cent. It could be just 1 decimal place and it’s x10,26,1733044653.0,2024-12-01 09:17:33
1h3y9xt,External-Ad-6098,"If it does my family will be happy ,parents retired, the Reddit shiba banna guy comes threw for us and I , will finally break free from the hamster wheel , of work life management Hahahha , but if it Doesn’t   Guess who still has to show up to work ;) this guy",6,1733066731.0,2024-12-01 15:25:31
1h3y9xt,Kazey1228,how much have you put in it,1,1733134614.0,2024-12-02 10:16:54
1h3y9xt,Cool-Top-8568,I think I'd need it to hit 50 cents to be able to retire like that....,1,1733202847.0,2024-12-03 05:14:07
1h3y9xt,confused_shrew,"I dunno, I have almost 1.2 billion shib, if it got to 100th of a cent, I'd be pretty well set",1,1733886697.0,2024-12-11 03:11:37
1h3y9xt,Cool-Top-8568,I wish i had half of that.... That would be so cool,1,1733913496.0,2024-12-11 10:38:16
1h3y9xt,Comfortable_Train417,I hope you get rich too ,1,1737920628.0,2025-01-26 19:43:48
1h3y9xt,EX_N1HIL0,"Would be nice as I'm sitting on over 5 million of it, but I don't see it ever coming close to .01. I wish for all of our sakes, and I'll be hopeful. But I doubt it. I do often sell and buy Doge Coin as it goes up and down. Might be better off toying with that. I don't have a lot, but just by playing the market I've already added an extra 150 crypto coins at no cost just by doing that in the last few months. It's nothing, but can't hurt to see what you achieve in a year. Your best bet is to buy physical gold right now. I have already made a profit of $5,000 in the last year. It's expensive, by you can buy in small denominations. I usually buy 1/10th oz. Coins at a time. I also recommend buying Canadian Maples over American Eagles (which are priced higher just out of popularity). Canadian Maples even have a higher purity than American Eagles Gold and Silver. Canadian Maples gold and silver's purity is set at .9999 where as American Eagles are set at .999. just a thought. I'd look into it if I were you, especially since the American dollar is not looking so good.",1,1738247302.0,2025-01-30 14:28:22
1h3y9xt,Colorado_Trader,I love hearing all the experts In here 😂,13,1733060849.0,2024-12-01 13:47:29
1h3y9xt,-5H4Z4M-,"No, and i will tell you why :  As we talk, shiba inu price is $0.00003068 dollar , with a market cap of 18 Billion dollars and there are 589 Trillion shiba inu coins circulating, Okay ?  Now you always haveto remind this formula : **Market Cap= Price × Circulating Supply**  So if you aim a price of 0.1 dollar, then you calculate it like that :  Market Cap = 0.1 (dollar) x 589 trillion (circulating coins) = **58.9 trillion dollars**  Now to compare, the Market cap of ALL THE CRYPTO TOGETHER is **3.5 trillion dollars** right now.  So it's impossible.",22,1733041528.0,2024-12-01 08:25:28
1h3y9xt,hoffwagon,"If you're calculating for one cent should it be 0.01 dollar? Which I think would make it 5.89 trillion.  Still not gonna happen, but very different numbers.",20,1733055585.0,2024-12-01 12:19:45
1h3y9xt,-5H4Z4M-,I know but i used 0.1 to illustrate bigger numbers because i know that sooner or later someone else will ask if it would reach 0.1 or 1 dollar 😁,1,1733086877.0,2024-12-01 21:01:17
1h3y9xt,Effective_Explorer95,"Yeah that’s how it works but it’s not impossible. Apple had a market cap of  54 million back in 1980. People then would have said a 3 trillion market cap was impossible. Tell me what the market cap of shib or all of crypto will be in 40 years, you can’t so you also can’t say it’s impossible without being presumptuous.",12,1733065694.0,2024-12-01 15:08:14
1h3y9xt,Horesonus,Apple is an extremely profitable company that actually sells product. SHIB as most of crypto you know today will be worthless in 40 years.,-2,1733068063.0,2024-12-01 15:47:43
1h3y9xt,Effective_Explorer95,The best argument you have is Apple is a company shib is a crypto not a good comparison. My point is when talking market cap you cannot fathom today what valuations will be in 30-40 years. We are in the beginning stages for crypto and blockchain technologies. Apple was not the juggernaut they are today in the 80s they were a joke to a lot of people.,6,1733068385.0,2024-12-01 15:53:05
1h3y9xt,Standard_Ad_1550,"No, it will never reach 1 penny because everyone will sell and force the price back down, there people out there with billions of shib just waiting to cash out.  It will never touch a penny because those who own it won't let it get that high. People out there ready to retire if it drops just 2 zeroes.",4,1733075961.0,2024-12-01 17:59:21
1h3y9xt,TECHSHARK77,CORRECT😁,1,1733091771.0,2024-12-01 22:22:51
1h3y9xt,coyote1276,So you're saying there's a chance?,3,1733086612.0,2024-12-01 20:56:52
1h3y9xt,Conscious-King6656,😂😂😂💯,2,1733983625.0,2024-12-12 06:07:05
1h3y9xt,clee5989,Market cap is useless when it comes to determining the price of a crypto,2,1733149644.0,2024-12-02 14:27:24
1h3y9xt,ReasonableHour3838,They said that about doge so called people like you at this price doge should be worth over 100 trillion . It’s all supply and demand no crypto people no anything at all. They see crypto. As a future investment just like sneakers . Walking around with tape on the bottom not trying to get a scratch on them,1,1733261895.0,2024-12-03 21:38:15
1h3y9xt,-5H4Z4M-,"The difference with DOGE is that it been rumored to be used by Elon Musk on his Platform X in future. Same for XRP who could be used in banks for faster transactions.  Gossips always make price bigger.  For Shiba Inu, nobody planned to use it in any way, it's just rise now because of the bull run, but let's face it : Not all memecoins will have a good future.  And omg, stop to use the word INVESTMENT when talking about memecoins, it's so volatile and it's really a bad way to help people especially newbies that will think that they can invest some money for weeks, months, years to lose everything at the end.  To put money in memecoins is like playing roulette in casino, or placing a bet on a football match, it's gambling.",1,1733345210.0,2024-12-04 20:46:50
1h3y9xt,Severe-Reaction-7842,"Elon and Trump are working to create a department of government efficiency program and are pro crypto , now take the first letter of each word in department of government efficiency, D.O.G.E plus it's backed by the richest man in America, it will take off",2,1733549735.0,2024-12-07 05:35:35
1h3y9xt,ReasonableHour3838,All crypto is a meme . It was created to get away with legal activity but the criminals switched to another crypto. Bitcoin is supply and demand as well. That’s why everyone screams don’t sell. They trying make money off supply and demand. People think if shit hits the fan crypto will be stable. It won’t we can see that in market conditions. People believe many things . Crypto is a pile of money every one is trying to cash out in their own currency. Maybe a stable coin but we all know visa out preform every crypto combined in speed and everything else . Even in use also they say it’s for the people. Well the US dollar is owed by the people and the banks no government already . It’s why we can’t print more money to pay off are debt and that’s why we pay interest. Doge was pumped by TikTok then Elon . It was a pass pump with u can do with any crypto don’t matter,1,1733390280.0,2024-12-05 09:18:00
1h3y9xt,Top_Lingonberry7518,You mean like doge couldnt reach what it is when it has just as much supply and started out like shibu. Haters who dont have any shares.. smh,1,1733514944.0,2024-12-06 19:55:44
1h3y9xt,Severe-Reaction-7842,"Never say never bud , people use to say Bitcoin would never take off when it first came out , now look",1,1733549520.0,2024-12-07 05:32:00
1h3y9xt,Dedharvey,"Doge was .000085 in 2015, Shibu could certainly meet the doge movement and hit .01 cent",1,1733715360.0,2024-12-09 03:36:00
1h3y9xt,Then-Direction-8540,If I to use this calculation then I believe max it will go to $.0001 by end of next year. It can't lose more than one decimal from it's current value.,1,1733765875.0,2024-12-09 17:37:55
1h3y9xt,Comprehensive_Menu19,Unless they keep burning coins like they did recently with 80 mil coins which influenced the price increase,-12,1733045656.0,2024-12-01 09:34:16
1h3y9xt,HappyTumbleweed2743,"It theoretically is possible,  but even if 100 billion coins were burned a day,  it would still take almost 9 years to burn only half the circulating coins.  So it's highly unlikely in our lifetime.",4,1733046137.0,2024-12-01 09:42:17
1h3y9xt,Snakeypoo85,80 million 🤣🤣🤣,3,1733051465.0,2024-12-01 11:11:05
1h3y9xt,obliterate_reality,"They can burn 80M coins a day for 20 years and that wouldn’t even be .5% of total supply.  I don’t think shib holders understand just how large 1,000,0000,000,000 is. And there’s 550 of them.  I’m also going to add. That 80M burn did not affect price… BTC teetering on the edge of 6 fig ATH is what affected the price of shib😂",3,1733082619.0,2024-12-01 19:50:19
1h3y9xt,big_gains_only,Yommbro burning 80M coins has nothing to do with the price increase. Lmao.,1,1733062523.0,2024-12-01 14:15:23
1h3y9xt,EyesFor1,do the math,2,1733046834.0,2024-12-01 09:53:54
1h3y9xt,TECHSHARK77,They can not,1,1733091814.0,2024-12-01 22:23:34
1h3y9xt,TopIndependence5807,This is not the way…for a lot of folks.,1,1733112903.0,2024-12-02 04:15:03
1h3y9xt,Colorado_Trader,To the Moon 🔥🚀🔥🚀,2,1733060870.0,2024-12-01 13:47:50
1h3y9xt,SomethingsSomeone,No simple as that.,2,1733086792.0,2024-12-01 20:59:52
1h3y9xt,galangga,"Yes, its possible, maybe more. If you can burn at least 588T of shib coin.",2,1733087785.0,2024-12-01 21:16:25
1h3y9xt,TrustTNT,"With a $10t market cap on its way, I'd say it hits $100 here soon. Go ahead sell but you'll regret it",2,1733252047.0,2024-12-03 18:54:07
1h3y9xt,lilith_linda,"I remember doge being like 0.00002 never could have I imagined it being close to $1, so Shiba can do it, it's memorable enough, but memes come and go, I can't say what will be popular tomorrow. Are crypto Kitties still around?",2,1733084055.0,2024-12-01 20:14:15
1h3y9xt,JacketHM_OG,Facts,1,1733272655.0,2024-12-04 00:37:35
1h3y9xt,anonq115,my stupid ass remembers when dogecoin was like 0.006 smh....,1,1733465739.0,2024-12-06 06:15:39
1h3y9xt,Metareferential,"The highest it can realistically go in the short term is its ATH, around 3-4x the current price.",1,1733052030.0,2024-12-01 11:20:30
1h3y9xt,FiNgAz-300k,"No, but it can still make you A LOT of money",1,1733067541.0,2024-12-01 15:39:01
1h3y9xt,michaeljai24,Few years maybe.,1,1733069450.0,2024-12-01 16:10:50
1h3y9xt,RobingThem,"don't forget to calculate burns, and the mob mentality. if just a few bitcoin holders converted for a run it would not take long",1,1733075018.0,2024-12-01 17:43:38
1h3y9xt,seaniiboy71,Lets just worry about breaking this resistance level first!!!,1,1733078582.0,2024-12-01 18:43:02
1h3y9xt,best_s2021,"unless it would be used as currency for daily retail purchases, it can’t reach to that price.",1,1733078969.0,2024-12-01 18:49:29
1h3y9xt,IAMN0TSTEVE,"Can it? Possibly  Will it?..... Well, ya know",1,1733081029.0,2024-12-01 19:23:49
1h3y9xt,kevinj933,Never. Not in this lifetime anyway.,1,1733083371.0,2024-12-01 20:02:51
1h3y9xt,imveste,Doesn't matter in the long run.,1,1733084012.0,2024-12-01 20:13:32
1h3y9xt,AmphibianRemarkable4,One dollar,1,1733093391.0,2024-12-01 22:49:51
1h3y9xt,Tough_Ad2136,"Big maybe, I can see .001 though",1,1733096405.0,2024-12-01 23:40:05
1h3y9xt,wavaif4824,no. settle in and hodl or find another obsession. also stop asking.,1,1733101433.0,2024-12-02 01:03:53
1h3y9xt,MuchPangolin554,Stop replying. Find another obsession than being rude to people for no reason.,0,1733207769.0,2024-12-03 06:36:09
1h3y9xt,wavaif4824,"the ""wen one cent"" question is asked here daily. it's not happening. that's the reason. move on.",1,1733212614.0,2024-12-03 07:56:54
1h3y9xt,nyr00nyg,No,1,1733137383.0,2024-12-02 11:03:03
1h3y9xt,clee5989,Absolutely,1,1733149546.0,2024-12-02 14:25:46
1h3y9xt,Due-Employee-1855,Yeah in your dreams,1,1733166808.0,2024-12-02 19:13:28
1h3y9xt,Ok-Business7192,I’ve seen the “experts” say 2040 at minimum,1,1733234167.0,2024-12-03 13:56:07
1h3y9xt,OkCardiologist1154,No it cannot.,1,1733345297.0,2024-12-04 20:48:17
1h3y9xt,Aggravating-Debt8431,Does who say it's impossible. Just got back in time and rethink bitcoin starting price. Absolutely no one thought it will surpass $100k and it's just crossed $100k. Just have some faith. Crypto is for a long run and the question is who is going to hold for long run? and I'm saying years and years of run! Those who do they will see the fruit and does who don't they only be left out with regrets just like bitcoin. #PositiveThoughts #HaveSomeFaith,1,1733367722.0,2024-12-05 03:02:02
1h3y9xt,Sufficient-Way-9701,Everyone buy some on December 10th. It will go up. Set your calendar.,1,1733460514.0,2024-12-06 04:48:34
1h3y9xt,Conscious-King6656,How did u know that 😳,1,1733983999.0,2024-12-12 06:13:19
1h3y9xt,Flashy_Map_6807,I have 360 million shib 1/10 of a penny I will be happy,1,1733515550.0,2024-12-06 20:05:50
1h3y9xt,88Keyzdapiannoman,Highly unlikely,1,1733586249.0,2024-12-07 15:44:09
1h3y9xt,Possumbrth,Yes tomorrow,1,1733601644.0,2024-12-07 20:00:44
1h3y9xt,AngryMonkkk,It will be 100th of the 1cent.,1,1733623263.0,2024-12-08 02:01:03
1h3y9xt,PlantainInner8296,If it hits .001 I can retire,1,1733980967.0,2024-12-12 05:22:47
1h3y9xt,LovaFets,Anybody else putting their Shib into Xrp??,1,1737308559.0,2025-01-19 17:42:39
1h3y9xt,randomuser336699,"Nobody believed DogeCoin would reach 1cent , look where it is now. Reality is nobody will ever know, but chances are YES.",1,1737326037.0,2025-01-19 22:33:57
1h3y9xt,Rich-Ad8641,"realistically no, atleast in near future if it were to reach 1 cent shubu’s market cap has to be 5.89 trillion which seems impossible for now(bitcoin has 2 trillion)",1,1738017814.0,2025-01-27 22:43:34
1h3y9xt,JJKillerElite,A lot of people say NEVER!  But 85% of shib is owned by  whales. For an oversimplification wĥy own 100 coins worth $10 when you can own 10 coins worth $100. It seems like the only logical outcome would be to burn tf out of the supply,1,1743909138.0,2025-04-06 03:12:18
1h3y9xt,Gamemaster77,it could but not any time soon,1,1745685682.0,2025-04-26 16:41:22
1h3y9xt,PoomanJoo,Can your mom?,0,1733139975.0,2024-12-02 11:46:15
1h3y9xt,Sugarcanejuice108,Mo,-1,1733039741.0,2024-12-01 07:55:41
1h3y9xt,mandrakecdam,"Yes, like Deogecoin.",-1,1733043251.0,2024-12-01 08:54:11
1h3y9xt,[deleted],"I had 8.1M Shiba Inu, but just now sold it all to buy dogecoin. I suggest you all do the same my friends...",-9,1733040307.0,2024-12-01 08:05:07
1h3rsib,Imaginary_Ad_5019,Pepe,4,1733029339.0,2024-12-01 05:02:19
1h3rsib,Sweaty-Emergency-493,"Whatever it’s doing my anus is free to use, as long as it’s keeps going to the moon",3,1733030604.0,2024-12-01 05:23:24
1h3rsib,2wheelJ_00,I volunteer as tribute to continue green stick,1,1733030681.0,2024-12-01 05:24:41
1h3rsib,Redditandbedone,I’m going all in then YOLO!,1,1733327199.0,2024-12-04 15:46:39
1h3rsib,[deleted],"No, it’s not. Trust me..",1,1733402858.0,2024-12-05 12:47:38
1h3rsib,Blg_Foot,Go to sleep bot,1,1733027998.0,2024-12-01 04:39:58
1h43281,TomorrowzHero,"CoinBase has SO many complaints on Reddit. Most recently, not allowing people to sell their crypto. I am one of the affected. I would go elsewhere.",2,1733059949.0,2024-12-01 13:32:29
1h3xzm6,[deleted],[removed],1,1733040755.0,2024-12-01 08:12:35
1h3xzm6,AutoModerator,"Advertising Discord/Telegram/etc. groups isn't allowed here  *I am a bot, and this action was performed automatically. Please [contact the moderators of this subreddit](/message/compose/?to=/r/Shibainucoin) if you have any questions or concerns.*",1,1733040756.0,2024-12-01 08:12:36
1h3xzm6,KatiePyroStyle,"If I were you, personally I'd avoid joining discord servers for any crypto currency. You will be bombarded by scammers, at least I was.   As for your buy in question? It's honestly not a black/white question. Like, there's so many different strategies for market investments. It's hard to know when to buy or sell for regular stock markets, let alone crypto, which is much more volatile in that the markets fluctuate a lot, each currency isn't backed by any product (usually), and a lot of currencies are built off of memes, and tend to die fast or soar high, there's very little in between.  Shib has done well as a meme coin thus far, it's been one of those rare middle ground coins that hasn't died, this community is very passionate about the coin  But in general, I say there's no bad time to buy in. In general, buy the dip. I bought my first shib coins in 2021, at that time 1 dollar bought me nearly half a million coins. Now you need nearly 5 bucks to get that amount. I say if you dont feel good buying in right now, wait for the next big dip and buy in. Otherwise, why wait? The market is growing NOW, it's a risk worth taking in my opinion",2,1733435075.0,2024-12-05 21:44:35
1h3ufdk,FreshExtent8720,"Xrp, xlm and hbar if you want to make money",5,1733027498.0,2024-12-01 04:31:38
1h3ufdk,rveras88,That is the way,4,1733081175.0,2024-12-01 19:26:15
1h3ufdk,FrequentService747,Hm idk,2,1733128841.0,2024-12-02 08:40:41
1h3ludn,[deleted],"In my understanding a lot is burned, but with so many, it needs to be 1000x more!",3,1733003609.0,2024-11-30 21:53:29
1h3ludn,Busy-Fault-6964,Exactly,1,1733020215.0,2024-12-01 02:30:15
1h3ludn,TECHSHARK77,You forgot to add 2 more zeros,1,1733020234.0,2024-12-01 02:30:34
1h3ludn,[deleted],Lol that would be even more amazing,1,1733020538.0,2024-12-01 02:35:38
1h3ludn,TECHSHARK77,"No, we want it to be easier lower max supply,  not harded higher max supple  It needs  1,000,000,00000 every week",0,1733020673.0,2024-12-01 02:37:53
1h3ludn,Personal_titi_doc,"You ficked up your comma and the number doesn't make sense anymore. 100,000,000,000.",1,1733030084.0,2024-12-01 05:14:44
1h3ludn,RaconBang,They? Why don't YOU,3,1733008684.0,2024-11-30 23:18:04
1h3ludn,Busy-Fault-6964,How do you burn it,1,1733020257.0,2024-12-01 02:30:57
1h3ludn,[deleted],[deleted],0,1733067219.0,2024-12-01 15:33:39
1h3ludn,Busy-Fault-6964,Are upvotes this important? I have Shiba Inu. Answer the question or stfu,0,1733069053.0,2024-12-01 16:04:13
1h3ludn,Snellenger-AR15,Send it here. Its dead to you now. 0x16CA5eADe30cFf3C2394C67CaEA26ce3a11EB6ad,5,1733001989.0,2024-11-30 21:26:29
1h3ludn,[deleted],[deleted],2,1732999946.0,2024-11-30 20:52:26
1h3ludn,Busy-Fault-6964,🤣,2,1732999971.0,2024-11-30 20:52:51
1h3ludn,thrive2day,It's already been done,2,1733002269.0,2024-11-30 21:31:09
1h3ludn,Busy-Fault-6964,Needs to be done again,0,1733020287.0,2024-12-01 02:31:27
1h3ludn,Mrtooth12,We have lift off!,2,1733015752.0,2024-12-01 01:15:52
1h3ludn,d8801,"Who's ""they""?  Why would it be the biggest holders' responsibility to burn all their stake so that a bunch of incel's can make a few bucks?  It's never ever going to surpass .0001.  Buy a dip and be happy with the 4x or 5x you might get in a decade.",2,1733026593.0,2024-12-01 04:16:33
1h3ludn,Busy-Fault-6964,I understand now,1,1733048344.0,2024-12-01 10:19:04
1h3ludn,mywifehatesme82,"That's what I'm doing....  That's exactly my strategy here.  4-5 times growth in a decade is pretty wow!  Yes, I'll take that all the way to the bank.  And I recommend it for others too.  The only people regretting crypto purchases are those that are pumping and dumping and timed it wrong.  Just buy it, and hodl...  You're doing decent in the stock market if you double every decade.  This seems.... better.  It will go past .0001.  It will just take some time, and I suppose patience too.  .0001 isn't even that big of a hurdle.  We're already almost a third of the way there...  Getting to .001 or .01 would be the mammoth jumps that will take decades to occur and actual currency adoption in the wider global market.  This is a third of the way to .0001, and it's a barely used currency at this point...  basically a commodity we are all putting hope in...  If it hits .001 in 20 years, and your money grow 35 fold, are you going to feel like you fucked it all up?  No.... you'll take that all the way to the bank, smiling, probably wishing you invested more.",1,1733075662.0,2024-12-01 17:54:22
1h3ludn,FreshExtent8720,So burn some then,2,1733026651.0,2024-12-01 04:17:31
1h3ludn,Busy-Fault-6964,How?,1,1733069743.0,2024-12-01 16:15:43
1h3ludn,nyr00nyg,You first and post tx,1,1733013665.0,2024-12-01 00:41:05
1h3ludn,michaeljai24,Burn baby.,1,1733069606.0,2024-12-01 16:13:26
1h3ludn,albatrossSKY,"410,740,162,680,278 Total burnt from initial supply  you just don't know what you are talking about",1,1733012470.0,2024-12-01 00:21:10
1h3ludn,Busy-Fault-6964,They need to burn more. What does this have to do with “not knowing what I’m talking about”,1,1733020245.0,2024-12-01 02:30:45
1h3ludn,albatrossSKY,burn whats in your wallet then and stop complaining that other people should burn for you,1,1733064619.0,2024-12-01 14:50:19
