post_id,author,body,score,created_utc,date
1h3ludn,Busy-Fault-6964,How?,1,1733069071.0,2024-12-01 16:04:31
1h3ludn,GroundbreakingKick38,You have no idea what you talking about havent you?,1,1733069685.0,2024-12-01 16:14:45
1h3ludn,Busy-Fault-6964,So how to burn? Answer the question,1,1733069708.0,2024-12-01 16:15:08
1h3ludn,GroundbreakingKick38,Just send SHIB to a dead wallet....,1,1733071037.0,2024-12-01 16:37:17
1h3ludn,Busy-Fault-6964,Thank you,1,1733071053.0,2024-12-01 16:37:33
1h37nix,Brief-Possibility753,It's take zero effort to not be a dick 😬 welcome bud and much success to you,9,1732956348.0,2024-11-30 08:45:48
1h37nix,Particular-Scene5534,Much love tho  we are all one shib family,9,1732955661.0,2024-11-30 08:34:21
1h37nix,Expensive-North-9556,Welcome to the family. Wof!,5,1732955732.0,2024-11-30 08:35:32
1h37nix,Particular-Scene5534,Thank you 🥲,3,1732955780.0,2024-11-30 08:36:20
1h37nix,Ok_Tell_7456,$13 big whale,9,1732975941.0,2024-11-30 14:12:21
1h37nix,spunion_28,Seen about twenty posts in less than two days of people buying less than $100 lol,3,1733001069.0,2024-11-30 21:11:09
1h37nix,BrianLevre,I got 3 million for less than 20 bucks when it first came out.  I only need it to get to 20 cents to do what I want to do.,4,1732974981.0,2024-11-30 13:56:21
1h37nix,302CiD_Canada,Only 20 cents lol,5,1732980129.0,2024-11-30 15:22:09
1h37nix,DeepElephant954,I'm out if it hits 0.009,3,1733012087.0,2024-12-01 00:14:47
1h37nix,Illustrious_Celery90,20 cents? Ummmm....NO! Not now not ever.,1,1732997179.0,2024-11-30 20:06:19
1h37nix,Classic_Fly_6389,I mean they said the same about DOGE in 2016,0,1733000785.0,2024-11-30 21:06:25
1h37nix,Illustrious_Celery90,Compare market caps..,2,1733001008.0,2024-11-30 21:10:08
1h37nix,Classic_Fly_6389,In 2016 DOGE was not a whole lot higher then where Shib is now,2,1733001259.0,2024-11-30 21:14:19
1h37nix,ShaneS86,"If you have no fundamental understanding of Market Caps, please do your research before you talk of such nonsense.",1,1733370024.0,2024-12-05 03:40:24
1h37nix,Classic_Fly_6389,"But yet you didn't give any example or the actual numbers, so I don't think you have any ""fundamental understanding"" either.",1,1733370731.0,2024-12-05 03:52:11
1h37nix,ShaneS86,"I've been in crypto since 2021, so I have a VERY good understanding of how market caps work. Shib is a meme coin with 590 TRILLION tokens in circulation. In order for Shib to reach $.20, the token alone would have an almost $12 Trillion value! 4 times the value of Nvidia. AKA not going to happen.",1,1733373795.0,2024-12-05 04:43:15
1h37nix,Classic_Fly_6389,"Again, they said the same about doge...",1,1733400093.0,2024-12-05 12:01:33
1h37nix,ShaneS86,"LOL, OK, dude! You just don't understand the significance of multi-trillions as opposed to multi-billions. I'll just leave you to your own delusions.",1,1733423307.0,2024-12-05 18:28:27
1h37nix,Wrong-Ad4243,Welcome. Enjoy the ride,2,1732975413.0,2024-11-30 14:03:33
1h37nix,alianaoxenfree,Welcome to the fam,2,1732977493.0,2024-11-30 14:38:13
1h37nix,GidgetsDad,You will wish you bought more at that price. I know I wish I would have a few months ago.  Hope this makes you rich with the rest of us.,2,1732979626.0,2024-11-30 15:13:46
1h37nix,Particular-Scene5534,Only time will tell,1,1733007819.0,2024-11-30 23:03:39
1h37nix,Particular-Scene5534,"Also, I think you care since you went out of your way to reply to it",2,1732955620.0,2024-11-30 08:33:40
1h37nix,SokkaHaikuBot,"^[Sokka-Haiku](https://www.reddit.com/r/SokkaHaikuBot/comments/15kyv9r/what_is_a_sokka_haiku/) ^by ^Particular-Scene5534:  *Also, I think you*  *Care since you went out of your*  *Way to reply to it*  --- ^Remember ^that ^one ^time ^Sokka ^accidentally ^used ^an ^extra ^syllable ^in ^that ^Haiku ^Battle ^in ^Ba ^Sing ^Se? ^That ^was ^a ^Sokka ^Haiku ^and ^you ^just ^made ^one.",3,1732955632.0,2024-11-30 08:33:52
1h37nix,Particular-Scene5534,"Yep, and you're right 👍",1,1732955712.0,2024-11-30 08:35:12
1h37nix,Traditional_Let_2023,Didn't your grandmother warn you about spending it all in one place?,1,1732981627.0,2024-11-30 15:47:07
1h37nix,Particular-Scene5534,Its just 13$ ?,1,1733007837.0,2024-11-30 23:03:57
1h37nix,Particular-Scene5534,But you're right I bet grandmother very disappointed in me right now😕,1,1733007871.0,2024-11-30 23:04:31
1h37nix,ChaotiQ78,"Guy posted he bought 10 dollars for SHIB and had like a few hundred thousand, lol. Some people these days!! Holding for the long haul",1,1732984706.0,2024-11-30 16:38:26
1h37nix,Particular-Scene5534,Yep I'm one of those long haul,1,1733007613.0,2024-11-30 23:00:13
1h37nix,Klutzy-Chain5875,I bought 1 Shibu . In the petshop.,1,1732987114.0,2024-11-30 17:18:34
1h37nix,Particular-Scene5534,I'm confused,1,1733007580.0,2024-11-30 22:59:40
1h37nix,FreshExtent8720,Lol,1,1732988152.0,2024-11-30 17:35:52
1h37nix,Fixx95,Just casually sitting on 4mill debating on buying more or not,1,1732992586.0,2024-11-30 18:49:46
1h37nix,Particular-Scene5534,Go you! That's amazing,1,1733007554.0,2024-11-30 22:59:14
1h37nix,Rooftop720,How do I buy?,1,1733001152.0,2024-11-30 21:12:32
1h37nix,Particular-Scene5534,Me personally I used coin base,1,1733001788.0,2024-11-30 21:23:08
1h37nix,Ill_Share_7970,Where can I buy on what platform,1,1733344845.0,2024-12-04 20:40:45
1h37nix,Successful_Mode1203,Atta pepper 🌶️ just hold  whatever ya get,1,1733366426.0,2024-12-05 02:40:26
1h37nix,Professional-Low8679,Shib is for people who are unaware of xrp,0,1732976312.0,2024-11-30 14:18:32
1h37nix,GidgetsDad,I own both so what's your point.,3,1732979721.0,2024-11-30 15:15:21
1h37nix,Several-Fly848,Lets go i got 120 million,0,1732983452.0,2024-11-30 16:17:32
1h37nix,Particular-Scene5534,Amazing,1,1733007624.0,2024-11-30 23:00:24
1h37nix,Certain_Ad5879,Why tf do people put up this shit? 13$ is nothing.. for that big a MC as shib even 1.300.000 wouldn't really move anything..  Your 13$ won't become anything. You will maybe have 20$ if you sell at the right time and that's it.,-11,1732954125.0,2024-11-30 08:08:45
1h37nix,Particular-Scene5534,You have to start somewhere brother,4,1732954187.0,2024-11-30 08:09:47
1h37nix,Kevosrockin,lol no clue what you are talking about,3,1732956795.0,2024-11-30 08:53:15
1h37nix,packets4you,Why post it though?   Straight up childish behavior.   It would be like me posting the Starbucks coffee I bought.   No one cares ,-10,1732955442.0,2024-11-30 08:30:42
1h37nix,Particular-Scene5534,Why not does it matter at the end of the day,1,1732955548.0,2024-11-30 08:32:28
1h37nix,packets4you,Okay   Enjoy your $13 of shib. ,-7,1732955670.0,2024-11-30 08:34:30
1h37nix,TheMalformedLlama,Not everyone has thousands of dollars to throw at a meme lmfao  Acting superior because they didn’t buy as much as you is childish behavior.,9,1732955831.0,2024-11-30 08:37:11
1h37nix,ChipThaBlackBoy,grab placid glorious juggle disarm party joke sugar sheet cows   *This post was mass deleted and anonymized with [Redact](https://redact.dev/home)*,2,1732983538.0,2024-11-30 16:18:58
1h37nix,TheMalformedLlama,"Again, it’s a meme coin. It’s not that serious",1,1732985307.0,2024-11-30 16:48:27
1h37nix,ChipThaBlackBoy,innocent cause file workable plate important merciful deliver subsequent screw   *This post was mass deleted and anonymized with [Redact](https://redact.dev/home)*,2,1732985351.0,2024-11-30 16:49:11
1h37nix,Brief-Possibility753,Be humble everyone has their own race to run and different starting points 😬 at what price did u first purchase and how much.? I'm sure no one care but you 😅  don't be a dick in attempt to look cool online 😁,2,1732956246.0,2024-11-30 08:44:06
1h37nix,papahead135,To the moon and back,1,1733442034.0,2024-12-05 23:40:34
1h3rnan,TheGrimShiba,You don’t sell. Just hodl!!!,2,1733023422.0,2024-12-01 03:23:42
1h3rnan,xBlaze1992x,That's easier for people to say that spend thousands. That don't answer the question for the poor guys.,3,1733029311.0,2024-12-01 05:01:51
1h470hp,Federal-Designer2988,I sold half my shin at .00003 earlier saw it went up a bit higher but I put the money into xrp which is due to explode in price in the next few weeks.,2,1733074422.0,2024-12-01 17:33:42
1h470hp,pizzandwings,Put some in XRP,2,1733074976.0,2024-12-01 17:42:56
1h470hp,-5H4Z4M-,Depends what is your strategy ? you want gamble on short or long term ?,1,1733070822.0,2024-12-01 16:33:42
1h470hp,NeverSum52,I’ll throw the dice with a short term game. I’m open to hearing your strategies.,0,1733070904.0,2024-12-01 16:35:04
1h470hp,-5H4Z4M-,"Well, in short term, you won't make any big profit with Shiba so you definetely sell it. We are not allowed to promote crypto in the sub, so i will tell you where to look at in a pm without giving you a financial advice.",1,1733074132.0,2024-12-01 17:28:52
1h470hp,[deleted],"Shiba short can do well if market is timed, during the initial Crypto surge it was better than doge for a bit",1,1733075091.0,2024-12-01 17:44:51
1h470hp,trade_and_be_rich,No coin is stable other than Bitcoin.,1,1733070845.0,2024-12-01 16:34:05
1h470hp,imreading411,I was in .08c and saw it push to 20% gains since I purchased 2 days ago now I just bought $16 worth lol Apparently Doge and Shib will partner?,1,1733071999.0,2024-12-01 16:53:19
1h470hp,Typical_Interview539,why do you think shib and doge will partner?,1,1733073874.0,2024-12-01 17:24:34
1h470hp,imreading411,someone said it in another thread lol,1,1733076710.0,2024-12-01 18:11:50
1h470hp,Muito2,"Sell or not to sell, 😂",1,1733075579.0,2024-12-01 17:52:59
1h470hp,obliterate_reality,"id put it into xrp, hbar, or ada. heavy on xrp or ada",1,1733170100.0,2024-12-02 20:08:20
1h470hp,JesusStarbox,I did. Sold it and eth and put it in bitcoin.,1,1733071206.0,2024-12-01 16:40:06
1h39tcu,Fancy_Click_3048,"also look at MC, that will show you $pepe has way more room for growth than shib",16,1732963173.0,2024-11-30 10:39:33
1h39tcu,[deleted],Does it ?,1,1732978079.0,2024-11-30 14:47:59
1h39tcu,Fancy_Click_3048,"only a question of when. think about it for more than a second, $pepe is the og meme, older than btc itself. Shib ain’t even a meme tho, just came out as the doge killer which it wasn’t able to do",4,1732978212.0,2024-11-30 14:50:12
1h39tcu,[deleted],The meme itself being older ? Yea. But shiba has been able to kill doge in terms of percent increase,7,1732978337.0,2024-11-30 14:52:17
1h39tcu,[deleted],I just did it and shiba valued more ?,3,1732988746.0,2024-11-30 17:45:46
1h39tcu,69fuk,Only a matter of time,2,1733209689.0,2024-12-03 07:08:09
1h39tcu,DeepInTheSheep,Depends on how fast you want to lose your investment.,72,1732965062.0,2024-11-30 11:11:02
1h39tcu,IIlllllIIlllI,lmfao,10,1732973689.0,2024-11-30 13:34:49
1h39tcu,R852012,"Lol that’s pretty good. I got SHIB but anything I put in there I’m not missing so if something happens good, if I LOSE it all I have to remind myself it’s a meme coin with nothing but speculation backing it",5,1732978655.0,2024-11-30 14:57:35
1h39tcu,ledbems,"Exactly, just look at like this. Stop buying all the dumb shit that one would normally and not miss having the money. Like fucking McDonald's....stopping at the gas station for snacks...bottled water (dumbest thing ever..when you can filter your own shit). Expensive shit you don't need. And invest that shit into something. It's a possibility that you could make money. But you would lose it anyway with the latter. I would much rather throw 50 bucks into something that could possibly help me in the future than hurt me.",2,1737803390.0,2025-01-25 11:09:50
1h39tcu,zincolnreturns,"Ok but isn't it becoming more than a meme coin? Utilities are being developed, shibarium, bones, Defi applications, game tokens, metaverse etc..... Not to mention the protocol of shibarium that burns the coins. So why would it still be considered as just a meme coin with ""just speculation"" and nothing more?  People who hold shiba inu in small amounts (as compared to the supply) may get worried depending upon how they are managing their finances and whether the money they are putting in it is necessary money or just disposable income right? Shouldn't whales be worried more about losing because they have millions or billions worth of dollars in this asset?  Educate me",3,1732995412.0,2024-11-30 19:36:52
1h39tcu,OutsideYourWorld,Because none of that really means anything.,4,1732996207.0,2024-11-30 19:50:07
1h39tcu,zincolnreturns,Meaning? Development is useless or just hogwash? Is no development taking place or even developments aren't going to fix the nature of this coin?,2,1732996896.0,2024-11-30 20:01:36
1h39tcu,OutsideYourWorld,"I've heard so many coins/tokens talk about being implemented in this or that, and many of those coins still go nowhere or disappear altogether.   Look at all the coins out there trying to do something. Most don't. Sure it's possible Shiba will, but it's more of a ""throw a few bucks in and see if anything is different a few years later"" kind of coin.",5,1733010233.0,2024-11-30 23:43:53
1h39tcu,zincolnreturns,Yea most coins try to mimick what got others successful but I feel shiba inu stands out in this because of the enthusiastic community and market cap.,1,1733032797.0,2024-12-01 05:59:57
1h39tcu,R852012,"We need more utilitarian components of crypto currency in general. It’s a long process but the more main stream coins like SHIB and DOGE get the closer we will be.   I read a lot of “analysts” reports and I see major bright side in purchasing more SHIB. Waiting until money but 10,000,000 coin order will be happening. That’ll bring me to 32million coins total and I think I’ll stop when I get to 100,000,000",2,1733684321.0,2024-12-08 18:58:41
1h39tcu,Mr_Boags,"I've been in Shib for years, overall its up.🚀 SHIB'S a Deflationary asset moving forward, with a decreasing supply (Burns) increasing in value over time and adoption.  Buy and continue to Hodl Stake and Swap @ Shibaswap.com ",1,1733669513.0,2024-12-08 14:51:53
1h39tcu,amartinkyle,"Preach! But you didn’t answer, which one would be quicker",1,1732982666.0,2024-11-30 16:04:26
1h39tcu,LateAdministration68,That's exactly what they said about Bitcoin dummy and look how that turned out.,0,1738627374.0,2025-02-04 00:02:54
1h39tcu,DeepInTheSheep,“Dummy”?  Are you even old enough to be on the internet?,1,1738689361.0,2025-02-04 17:16:01
1h39tcu,Wrong-Ad4243,Buy a little of both,9,1732975510.0,2024-11-30 14:05:10
1h39tcu,GidgetsDad,"Drop it all into shiba inu and when you make some cash bail out then rinse and repeat. I did that with DOGE years ago, paid off my truck, invested and paid off some bills, Not bad for a MEME coin.",8,1732980794.0,2024-11-30 15:33:14
1h39tcu,linustheman1990,24K into a shit coin is wild work.,28,1732963636.0,2024-11-30 10:47:16
1h39tcu,BigSabbathh,24k could be like $240 to this person,1,1733324012.0,2024-12-04 14:53:32
1h39tcu,Chemical-Ad7118,I literally put 22k in Pepe,1,1737833981.0,2025-01-25 19:39:41
1h39tcu,Economy_Stimulatorr,"Just wait until it goes to all time high, that is 4x more",1,1732995900.0,2024-11-30 19:45:00
1h39tcu,linustheman1990,"It's a hype coin with zero utility.  Putting 24k into it is just dumb and I made 10k on the coin with a very small investment.  Putting 3k into it would probably be a better idea if you've got 24,000 burning a whole",4,1732996116.0,2024-11-30 19:48:36
1h39tcu,Economy_Stimulatorr,If the money is needed and one can’t afford it ofcourse pull it out. But the probability of Shib hitting all time high is good. Just my opinion not financial advice. On the other hand Pepe hasn’t gone any higher than it is currently so there is no way to measure it. Just a glance from market cap comparison,1,1732997132.0,2024-11-30 20:05:32
1h39tcu,linustheman1990,"Yeah, Shib is off its ATH. By a lot. But I don't think that necessarily means it will get there again. It tends to follow ETH, but it really hasn't been acting in a way we can predict. It's for that reason I personally wouldn't YOLO a ton into it.",1,1732997420.0,2024-11-30 20:10:20
1h39tcu,michaeljai24,Follow your heart,4,1732972159.0,2024-11-30 13:09:19
1h39tcu,Professional_Cost241,Shiba great. But don’t sleep on XRP,6,1732972325.0,2024-11-30 13:12:05
1h39tcu,ComplexWrangler1346,XRP is almost at $2 today,1,1732993641.0,2024-11-30 19:07:21
1h39tcu,tre85moore,I just bought $100 worth of XRP yesterday if it hit $2 will i still get a nice profit?,1,1733023815.0,2024-12-01 03:30:15
1h39tcu,Appropriate_Eye_9148,Hold xrp my guy,2,1733090294.0,2024-12-01 21:58:14
1h39tcu,phantom_gain,Its 3 now 😀,2,1737469904.0,2025-01-21 14:31:44
1h39tcu,Accomplished-Pass527,How can u not figure that out,1,1733452064.0,2024-12-06 02:27:44
1h39tcu,Powerful_Plane6980,🤣🤣🤣🤣,1,1733605539.0,2024-12-07 21:05:39
1h39tcu,Jonlsujon,  XRP,6,1732991578.0,2024-11-30 18:32:58
1h39tcu,Fancy_Click_3048,"Im im both, but $pepe has been outperforming shib and $pepe will flip shib by this year",8,1732963100.0,2024-11-30 10:38:20
1h39tcu,MasterAir2753,"I would consider long-term investing with higher amounts, however neither shiba nor pepe. You can take a risk with investing 500,- to 1k in both. You have to know what risks you want to take. Just take a look on what happenned with leaders like #1 btc  Safer investing^",4,1732968625.0,2024-11-30 12:10:25
1h39tcu,[deleted],PEPE SHIBA OR DOGE NOT THAT CLOWN PEP COIN THAT ONE IS FOR DORKS,4,1732989575.0,2024-11-30 17:59:35
1h39tcu,CodedGems,Just buy xrp,7,1732973446.0,2024-11-30 13:30:46
1h39tcu,badussybandit1,Pepe,3,1732973302.0,2024-11-30 13:28:22
1h39tcu,Lumis_umbra,"Put it in a high interest trust fund with a good bank. Swiss, maybe. Leave it to your kids or nieces/nephews. Maybe they'll actually be able to buy a house when they're in their late twenties or early thirties. If they, and their children, and so on, do the same with the money that they save from not having to spend it on a house, and make decent choices in life, your family could be decently well-off for generations to come.",3,1732983089.0,2024-11-30 16:11:29
1h39tcu,Muito2,Nobody really knows....,3,1732983289.0,2024-11-30 16:14:49
1h39tcu,Fair-Argument-9650,I have $100k in Shiba Inu and a good amount in $Bonk as well. Been adding to my Pepe position slowly. Will go in once I reach $100k in Bonk,3,1732990244.0,2024-11-30 18:10:44
1h39tcu,confusionauta,"Invest 1000 on shiba and 1000 on pepe, the rest on invest education. Worst case scenario In 6 months you only lost 2k",3,1732990584.0,2024-11-30 18:16:24
1h39tcu,Kwirbyy,I'd advise more 100 and 100. 2k is already a significant sum,1,1732994394.0,2024-11-30 19:19:54
1h39tcu,confusionauta,"Depends on the amount you want to ""invest"" and with 24k on the table 1k its not too much.",1,1733171088.0,2024-12-02 20:24:48
1h39tcu,okwudizzle,"Please don’t dump 24k into meme coins tf. Keep btc/eth for slower, proven gains and alt coins with utility and low cap for bigger but riskier gains",7,1732963998.0,2024-11-30 10:53:18
1h39tcu,Canadianretordedape,Just give me the 24k and I’ll message you in a year to tell you it’s worth 1k,6,1732973133.0,2024-11-30 13:25:33
1h39tcu,forget_it_again,"$24k in a meme coin based on reddit opinions, good luck with that 🙈",6,1732966694.0,2024-11-30 11:38:14
1h39tcu,Fancy_Click_3048,where else would you get unbiased opinions from gen pop? I find reddit is the best platform for that,9,1732967900.0,2024-11-30 11:58:20
1h39tcu,Jpprflrp,Ans people looking for exit liquidity,1,1732986108.0,2024-11-30 17:01:48
1h39tcu,Wrong-Ad4243,"I have several millions of each. So I'm ready to retire when either hits it big, to outter space",2,1732979548.0,2024-11-30 15:12:28
1h39tcu,SufficientCookie9347,You should BAD,2,1732981209.0,2024-11-30 15:40:09
1h39tcu,SufficientCookie9347,Buy BAD,3,1732981242.0,2024-11-30 15:40:42
1h39tcu,leftnutbrown,I would go with Hedge,2,1732991960.0,2024-11-30 18:39:20
1h39tcu,AmphibianRemarkable4,Diversity,2,1732992515.0,2024-11-30 18:48:35
1h39tcu,[deleted],Just set it on fire thats more fun,2,1732993771.0,2024-11-30 19:09:31
1h39tcu,DownWitBoogaloo,Don’t invest anything you aren’t willing to loose completely. There are absolutely no guarantees in crypto. Personally I’d diversify,2,1733022992.0,2024-12-01 03:16:32
1h39tcu,Cool-Top-8568,"Honestly  You could split the investments. But from What I've noticed, there's more gravitation and general noise going towards Shiba inu. I'd likely split it 75/25 in favor of shiba, personally speaking. Two of the few things that pepe has going for it is it's still semi relevant, and it currently has fewer coins in circulation than shiba. But shiba is catching up with its alleged plans for relevancy and burn rates sporadic but increasing.",2,1733202693.0,2024-12-03 05:11:33
1h39tcu,[deleted],"Shiba inu. Wherever Doge goes, Shiba will follow",5,1732971083.0,2024-11-30 12:51:23
1h39tcu,URN3434,I like $Pepe more room to run as stated above,3,1732965128.0,2024-11-30 11:12:08
1h39tcu,Gold_Organization964,Pepe for sure.,2,1732963102.0,2024-11-30 10:38:22
1h39tcu,jb452021,Dogecoin only,2,1732970059.0,2024-11-30 12:34:19
1h39tcu,Thatoneguywvette,I’d put this on xlm tbh,1,1732963228.0,2024-11-30 10:40:28
1h39tcu,IIlllllIIlllI,yeah atleast XLM has stability i don’t understand the business goal behind coins like shiba and pepe,2,1732973712.0,2024-11-30 13:35:12
1h39tcu,Powerful_Plane6980,Xlm vs h bar vs Xrp vs dogecoin? What would you choose for 24k investment?,1,1733605982.0,2024-12-07 21:13:02
1h39tcu,Opposite_Practice666,Treat in Shiba swap.  Only asset in the world with pent up demand.,1,1732978074.0,2024-11-30 14:47:54
1h39tcu,thrive2day,You should look at market caps and figure out what they mean. Then compare them to others,1,1732987468.0,2024-11-30 17:24:28
1h39tcu,Alycinwanderland,I got a couple million of each. Nothing more than I’m will to wake up and see it evaporated…. cuz it’s a meme coin. 100% if I had 24K I’d put that into xrp or btc. Cuz if 24k evaporated from my life I’d probably die lol,1,1732989874.0,2024-11-30 18:04:34
1h39tcu,[deleted],[removed],1,1732992668.0,2024-11-30 18:51:08
1h39tcu,AutoModerator,"Advertising Discord/Telegram/etc. groups isn't allowed here  *I am a bot, and this action was performed automatically. Please [contact the moderators of this subreddit](/message/compose/?to=/r/Shibainucoin) if you have any questions or concerns.*",1,1732992668.0,2024-11-30 18:51:08
1h39tcu,OutsideYourWorld,"lol, jesus dude.",1,1732996146.0,2024-11-30 19:49:06
1h39tcu,Redditandbedone,Neither,1,1732997150.0,2024-11-30 20:05:50
1h39tcu,Positive_Mastodon_46,"I personally have both. I have 100,000,000 each with this bitcoin run and alt season close at hand money eventually hits all the meme coins. Buy and hold and when your at an amount worth cashing out do it. Don’t get stuck holding the bag on hopium thinking it’ll go farther up. Just as fast as it goes up it goes even faster going down.",1,1732997611.0,2024-11-30 20:13:31
1h39tcu,GumGumPistol89,Why not half and half? Or just dump it in XRP.,1,1732999035.0,2024-11-30 20:37:15
1h39tcu,Make2much,I like pepe. Because of the community.,1,1733001481.0,2024-11-30 21:18:01
1h39tcu,irishmoney72,Hedera,1,1733006834.0,2024-11-30 22:47:14
1h39tcu,Jiddyprofits,"I would get both , putting more in shib than pepe",1,1733011238.0,2024-12-01 00:00:38
1h39tcu,Ir0nman123,Cardano (ada) is going to be the future blockchain. The ceo and creator is now going to be working with the next administration in regulating crypto. Bullish af.,1,1733012458.0,2024-12-01 00:20:58
1h39tcu,Safe_Ranger3690,"Ach, trx, flr relatively",1,1733012786.0,2024-12-01 00:26:26
1h39tcu,Cagg311,"Xrp is a much better choice, or doge.. to answer your question tho, shib is def the better of the 2.",1,1733013031.0,2024-12-01 00:30:31
1h39tcu,Weird-Comparison-242,Do XRP if you actually wanna make money,1,1733015121.0,2024-12-01 01:05:21
1h39tcu,mindshank,"Neither, XRP is the answer.",1,1733023968.0,2024-12-01 03:32:48
1h39tcu,d8801,Why in the world is your first instinct to pick between 2 meme coins?,1,1733026326.0,2024-12-01 04:12:06
1h39tcu,framinggiga,Neither . They are both memes . I would invest in new blockchain with lower mc . Probably ,1,1733045217.0,2024-12-01 09:26:57
1h39tcu,[deleted],50/50,1,1733055478.0,2024-12-01 12:17:58
1h39tcu,pandiculate4,Buy Bonk!,1,1733069374.0,2024-12-01 16:09:34
1h39tcu,Ok_Campaign6991,Slow painful or a fast loss on investment? 🫡🚀,1,1733075327.0,2024-12-01 17:48:47
1h39tcu,PeacockKing1,"You’ll make money on both Pepe and Shiba Inu this cycle. Looking at buying volume, and market cap. It looks like Pepe will overtake Shiba Inu next year in this bull cycle.   If you’re unsure just invest in both you’ll easily quadruple your money if you hold at least 1 year.",1,1733079617.0,2024-12-01 19:00:17
1h39tcu,Readytobustheirbank,24k in TSLY and you would be bringing in some good money and dividends each month,1,1733094084.0,2024-12-01 23:01:24
1h39tcu,WrongButterscotch876,xrp heating up!,1,1733099220.0,2024-12-02 00:27:00
1h39tcu,SamuraiEldenLord,Pepe just because it’s still fairly new shib is cool but Pepe is forever,1,1733127176.0,2024-12-02 08:12:56
1h39tcu,lilith_linda,"Shiba, buy and hold until I sell at least.",1,1733162992.0,2024-12-02 18:09:52
1h39tcu,Mammoth_Draw_2244,I’m buying Pepe and Shiba. 100 million of each coin almost there. I’ll sell one or both or neither for .01 each between 25-30 ,1,1733188420.0,2024-12-03 01:13:40
1h39tcu,Jimmy_Page_69,Best case scenario shib reaches its ath again and thats it. Worst case for pepe it flips shib and does a 4-5x from here. You do the math on your returns,1,1733205395.0,2024-12-03 05:56:35
1h39tcu,[deleted],Interesting,1,1733266172.0,2024-12-03 22:49:32
