post_id,author,body,score,created_utc,date
1cxzhtv,Mattie_Kadlec,Yes please,2,1716398423.0,2024-05-22 17:20:23
1cxe1pg,[deleted],I have 9m,3,1716320539.0,2024-05-21 19:42:19
1cxe1pg,Your_Doctor18,That’s the volume being moved in shiba in total over the past 24 hours. Not what I own lol,3,1716328707.0,2024-05-21 21:58:27
1cxe1pg,[deleted],Darn. I wanted that for you! You deserve it. And so do I!,3,1716408768.0,2024-05-22 20:12:48
1cxe1pg,Your_Doctor18,Dude I wish 😭 I could use some money rn lol,2,1716422963.0,2024-05-23 00:09:23
1cxe1pg,Professional_Yak4761,Holding 50m 🙏,2,1716372809.0,2024-05-22 10:13:29
1cxe1pg,Your_Doctor18,173 million for me 💪,2,1716422997.0,2024-05-23 00:09:57
1cxe1pg,_chuky2859,Needs 6 more billion daily to make a difference hope we all can jump in on this ride!,2,1716351081.0,2024-05-22 04:11:21
1cxe1pg,happyterry222,I Have 11 million at .0000023,1,1716595339.0,2024-05-25 00:02:19
1cxe1pg,Your_Doctor18,197 million 💪 I was where you are now! Get them gains bro! We’re just seeing the beginning of where this is going 😁,0,1716595777.0,2024-05-25 00:09:37
1cxe1pg,CryptoMoneyLand,Just holding now,2,1716688802.0,2024-05-26 02:00:02
1cxacmp,yoooimfuckingerect,Just did,1,1716337408.0,2024-05-22 00:23:28
1cx8da0,Accurate-Bus4640,"The whales been saying this shit for weeks now, but still no fucking change!",1,1716369751.0,2024-05-22 09:22:31
1cwv6g5,PositivePrimary8773,Or just a tiny bump up that will eventually return down 🤷🏻‍♂️,9,1716255030.0,2024-05-21 01:30:30
1cwv6g5,Necessary-Ad3429,Booooo 🥺,1,1716256263.0,2024-05-21 01:51:03
1cwv6g5,Either_Ad9709,Ima say the unpopular this is probably the fake out rally before the fake out Dump and then the real top,3,1716303128.0,2024-05-21 14:52:08
1cwv6g5,Illustrious_Storm777,You have crypto shorts in here?? 🤣,1,1716265878.0,2024-05-21 04:31:18
1cwv6g5,Eyes500,All the coins will come back down in a day or so it’s called trading swapping from one coin to another that’s how you make money,1,1716294720.0,2024-05-21 12:32:00
1cwv6g5,Buddle9292,"Bruh, wait a few days before you post dumb stuff like this cause y'all dummies always be wrong.  It'll shoot back down before it goes up",1,1716316100.0,2024-05-21 18:28:20
1cwv6g5,New_Technology_3327,Going down,1,1716257495.0,2024-05-21 02:11:35
1cwv6g5,TonyMontana00404,Scam Coin,-3,1716289461.0,2024-05-21 11:04:21
1cwg4lp,[deleted],I'm counting on it lol See what I did there,8,1716214339.0,2024-05-20 14:12:19
1cwg4lp,Willing-Gold3092,To be fair I would like to see it it $0.07 before withdrawing back to 0.0002.,6,1716237604.0,2024-05-20 20:40:04
1cwg4lp,Dry-Refrigerator-676,Me too! 😂,3,1716239480.0,2024-05-20 21:11:20
1cwg4lp,[deleted],"Shiba currently has a circulating supply of 580 Trillion, there is no way in hell it ever even hits 1 Cent. It’s literally not possible, do the maths lol, won’t even reach half a cents worth, not possible. Shiba Inu would have to account for roughly 5% of the worlds total money combined, for each coin to be worth half a penny.",2,1716276002.0,2024-05-21 07:20:02
1cwg4lp,PositivePrimary8773,No,6,1716224878.0,2024-05-20 17:07:58
1cwg4lp,tHeRe-Is-noSe-p00N,It would be a lot cooler if it did,4,1716242541.0,2024-05-20 22:02:21
1cwg4lp,heretolearn48,😂🤣😂🤣,3,1716229476.0,2024-05-20 18:24:36
1cwg4lp,ksuschmidt,would be fun to see.  but don't see this happening,4,1716232886.0,2024-05-20 19:21:26
1cwg4lp,[deleted],[deleted],2,1716243949.0,2024-05-20 22:25:49
1cwg4lp,AWa1ton,in other words they are asking monkeys to hold,1,1716305312.0,2024-05-21 15:28:32
1cwg4lp,jftirone,"It would if it could, but it can't.",2,1716248764.0,2024-05-20 23:46:04
1cwg4lp,iamnotlegendxx,lol,1,1716264079.0,2024-05-21 04:01:19
1cwg4lp,Master-Monitor112,Depends if most of bitcoin is from the ETF in the big ball run .,1,1716282454.0,2024-05-21 09:07:34
1cwg4lp,Creepy_Tonight3051,No,1,1716375913.0,2024-05-22 11:05:13
1cwtjls,Stunning-Web739,"I played it at Wellys last night.  Pietro's got the highest score so far.  It's new to Giuseppe, he's not that good so I beat him a few times.  Go to the one in Palermo, everyone is talking about shootout because it's part of ordering a # 3 meal.",2,1716258217.0,2024-05-21 02:23:37
1cwtjls,Beginning-Beyond-335,"It is a Ponzi scheme, avoid wasting money",1,1725257265.0,2024-09-02 06:07:45
1cwtjls,Nutri_bee,"I think Shiba Shootout is a blast! If you haven’t tried it yet, definitely give it a go..",1,1727372863.0,2024-09-26 17:47:43
1cwtjls,Linoring888,Recently did some research on it &amp; i think it's a decent pick for long term investment,1,1727627970.0,2024-09-29 16:39:30
1cwb9ro,andhemac,"Yes, supply is the greatest roadblock",11,1716204374.0,2024-05-20 11:26:14
1cwb9ro,Apollo_3249,And demand. Nobody wants this crap,2,1716290392.0,2024-05-21 11:19:52
1cwb9ro,Standard_Phase5417,Hell .0001… would be lit.,5,1716211697.0,2024-05-20 13:28:17
1cwb9ro,DatLuccaboy,"Personally, Im not eyeing $0.01, $0.0005 would do me wonders.  People get to obsessed with the crazy numbers when you can make plenty trading strategically.",5,1716222513.0,2024-05-20 16:28:33
1cwb9ro,Standard_Phase5417,I’ll be happy with .001 :),3,1716211681.0,2024-05-20 13:28:01
1cwb9ro,StarAny3150,Finally someone tells the truth,1,1716230468.0,2024-05-20 18:41:08
1cwb9ro,jftirone,"Well, that's news to me!",1,1716250937.0,2024-05-21 00:22:17
1cwb9ro,Humble-Economics-648,"Because Biden, Trudeau sucks. Iran president passed.",-2,1716221997.0,2024-05-20 16:19:57
1cwb9ro,antnask,What Iran to do with this,2,1716352813.0,2024-05-22 04:40:13
1cwdqhv,bigmoe123,If each one of us on this sub burn 100$ worth or shiba. We can bump up the price by alot as well,2,1716232160.0,2024-05-20 19:09:20
1cwcohk,PurpleHairedMOD,It’s never a good time,1,1716216687.0,2024-05-20 14:51:27
1cvx9i5,PossibleDifferent955,I’m not complaining. With the price drop I just piled even more. It’ll be back up tomorrow morning if not by the end of the night.,2,1716150470.0,2024-05-19 20:27:50
1cvx9i5,[deleted],"I wish I could do that as well. Actually I have bought more than I should, so right now I just want to sell that part when it comes to a decent amount and then Hodl the rest.",1,1716150566.0,2024-05-19 20:29:26
1cvx9i5,OCDbeaver,"""why are you guys selling? Stop selling so I can sell"" cyrpto life",1,1716164269.0,2024-05-20 00:17:49
1cvx9i5,HorseGuy515,I bought 50 million in January I can't really buy anymore without hurting my average. 000008 was when I bought in.,1,1716256480.0,2024-05-21 01:54:40
1cvx9i5,Either_Ad9709,Believe its a fake out rally,1,1716405598.0,2024-05-22 19:19:58
1cvx9i5,Icy-Section4424,"FFIE short squeeze will be back after it's done but not gonna miss an opportunity this good, gonna be like a GME repeat",0,1716165305.0,2024-05-20 00:35:05
1cv3og8,NochillWill123,So jealous of your guts .,10,1716075203.0,2024-05-18 23:33:23
1cv3og8,Mission_Speed_8398,"Damn! So many haters in here following SHIB. What a sad life, I almost feel bad for them lol. But hey, nice holdings fren",8,1716145565.0,2024-05-19 19:06:05
1cv3og8,Advanced_Procedure90,!remindme 1 year,5,1716131724.0,2024-05-19 15:15:24
1cv3og8,ksuschmidt,when are the creators of shib going to actually start the supposed shibarium and all the burn mechanisms they promised?,4,1716126481.0,2024-05-19 13:48:01
1cv3og8,Apollo_3249,Don’t hold your breath,2,1716204383.0,2024-05-20 11:26:23
1cv3og8,ksuschmidt,each passing day leads me to believe it's a scam coin,1,1716206662.0,2024-05-20 12:04:22
1cv3og8,Apprehensive-Tour942,"It's not a scam, it's a meme.",1,1716288424.0,2024-05-21 10:47:04
1cv3og8,ksuschmidt,okay.  is there a difference between a meme and a scam?,1,1716288487.0,2024-05-21 10:48:07
1cv3og8,Apprehensive-Tour942,Yes,1,1716288900.0,2024-05-21 10:55:00
1cv3og8,No_Teaching_8769,Quiet down with your pessimism,2,1716133482.0,2024-05-19 15:44:42
1cv3og8,-Uncle_Chuck-,shibarium layer 2 is already up and running,1,1716470176.0,2024-05-23 13:16:16
1cv3og8,ksuschmidt,Then why aren't more coins being burned?,1,1716949534.0,2024-05-29 02:25:34
1cv3og8,unumss,Very nice brother. If you’re able to hold them for years then you have a pretty decent Retirement Fund right there.,8,1716073632.0,2024-05-18 23:07:12
1cv3og8,ProperPoem5476,Or nothing,15,1716097589.0,2024-05-19 05:46:29
1cv3og8,[deleted],Probably nothing,9,1716110162.0,2024-05-19 09:16:02
1cv3og8,TheGoluOfWallStreet,Most likely nothing,6,1716129386.0,2024-05-19 14:36:26
1cv3og8,isometrixk,Most likely 1 billion shib,5,1716132572.0,2024-05-19 15:29:32
1cv3og8,wtfftw1221,Delisted shib,2,1716136205.0,2024-05-19 16:30:05
1cv3og8,[deleted],8M+ and Holding,3,1716092137.0,2024-05-19 04:15:37
1cv3og8,the_blacksmythe,Brave man,3,1716101666.0,2024-05-19 06:54:26
1cv3og8,RessShamen22,Very Nice,3,1716146371.0,2024-05-19 19:19:31
1cv3og8,Significant-Field232,Patrick Bateman references?,1,1716168032.0,2024-05-20 01:20:32
1cv3og8,RessShamen22,"Impressive, very nice.",3,1716169881.0,2024-05-20 01:51:21
1cv3og8,[deleted],Borat. Very Nice! I like!,1,1716196821.0,2024-05-20 09:20:21
1cv3og8,spirit-of-the-inu,Fly Shiba Fly,3,1716156284.0,2024-05-19 22:04:44
1cv3og8,User8858,Real man! Good luck Jones,2,1716084795.0,2024-05-19 02:13:15
1cv3og8,ManuelQbe,10x it with michi,2,1716128595.0,2024-05-19 14:23:15
1cv3og8,Advanced_Procedure90,Woah 😲,2,1716131635.0,2024-05-19 15:13:55
1cv3og8,wtfftw1221,lol. I spent $500 to get that 3 years ago,2,1716136177.0,2024-05-19 16:29:37
1cv3og8,GoWiwi-Yolo,"Hi, I didn’t buy them all at once, I tried to lower avg at every dip",1,1716146247.0,2024-05-19 19:17:27
1cv3og8,DatLuccaboy,And I feel so good about my 115mil. What an absolute beast you are.,2,1716211354.0,2024-05-20 13:22:34
1cv3og8,GoWiwi-Yolo,"When I started a lot of folks were in the. Billions, not sure where they are.  But I didn’t spend that much money, this is just a valuation at this point.",1,1716212442.0,2024-05-20 13:40:42
1cv3og8,DatLuccaboy,"The highest I've been was 150mil but Ive pulled profits and bought back in during dips, now Im done selling until this next alt run occurs at least.  Im not trying to get rich off of this but I do want to add to my savings and investment account in order to invest in other things.",2,1716212550.0,2024-05-20 13:42:30
1cv3og8,Outrageous-Check6776,200 million Shib and holding for at least another 4 years.,2,1716220147.0,2024-05-20 15:49:07
1cv3og8,GoWiwi-Yolo,Gr8,1,1716220965.0,2024-05-20 16:02:45
1cv3og8,siospawn,Wellnif it ever gets ti bitcoin prices we are all gonna be the top millionaire's on the planet,2,1716241389.0,2024-05-20 21:43:09
1cv3og8,GoWiwi-Yolo,It is all supply and demand economics.  Too Much supply in shiba to reach btc prices.  So you have to adjust the expected price,1,1716261719.0,2024-05-21 03:21:59
1cv3og8,Stormyfurball,300 milli here.  Not buying anymore or selling,2,1716244783.0,2024-05-20 22:39:43
1cv3og8,MartianBreeder,Ppl still holding on to shib? 🙃,2,1716309784.0,2024-05-21 16:43:04
1cv3og8,SpecificArm4482,Yep still making me money lol!! What about you??,1,1716366352.0,2024-05-22 08:25:52
1cv3og8,Bmxguy93,I wish I had that much XRP RN that shits about to launch off the deck like a fighter jet a lot of big news is coming out that will be good for many cryptos. XRP has also been accepted by Dubai as an oil trade currency.,2,1716462431.0,2024-05-23 11:07:11
1cv3og8,ineedshitcoin,"What do you expect now? Shib already reached it's peak, better look out for new coins",2,1716119042.0,2024-05-19 11:44:02
1cv3og8,RockRiver100,Don’t you know that it’s going to the moon?,3,1716120012.0,2024-05-19 12:00:12
1cv3og8,ineedshitcoin,"Yeah like 3 years ago, common it's already reach it's marketcap.  Many new coin already did go to Mars and Pluto recently, and people still holding shib",2,1716120140.0,2024-05-19 12:02:20
1cv3og8,GoWiwi-Yolo,I only invested 1.5k 3 years ago.  Why would I sell now and give all to Uncle Sam?,3,1716130285.0,2024-05-19 14:51:25
1cv3og8,BookieOnFoodStamps,Bc it’s long term capital gains now,2,1716130551.0,2024-05-19 14:55:51
1cv3og8,larssonic,Don’t you consider to burn some of it?,2,1716126574.0,2024-05-19 13:49:34
1cv3og8,[deleted],[deleted],1,1716131650.0,2024-05-19 15:14:10
1cv3og8,RemindMeBot,I will be messaging you in 1 year on [**2025-05-19 15:14:10 UTC**](http://www.wolframalpha.com/input/?i=2025-05-19%2015:14:10%20UTC%20To%20Local%20Time) to remind you of [**this link**](https://www.reddit.com/r/Shibainucoin/comments/1cv3og8/1b_shib_and_holding/l4qss79/?context=3)  [**CLICK THIS LINK**](https://www.reddit.com/message/compose/?to=RemindMeBot&amp;subject=Reminder&amp;message=%5Bhttps%3A%2F%2Fwww.reddit.com%2Fr%2FShibainucoin%2Fcomments%2F1cv3og8%2F1b_shib_and_holding%2Fl4qss79%2F%5D%0A%0ARemindMe%21%202025-05-19%2015%3A14%3A10%20UTC) to send a PM to also be reminded and to reduce spam.  ^(Parent commenter can ) [^(delete this message to hide from others.)](https://www.reddit.com/message/compose/?to=RemindMeBot&amp;subject=Delete%20Comment&amp;message=Delete%21%201cv3og8)  *****  |[^(Info)](https://www.reddit.com/r/RemindMeBot/comments/e1bko7/remindmebot_info_v21/)|[^(Custom)](https://www.reddit.com/message/compose/?to=RemindMeBot&amp;subject=Reminder&amp;message=%5BLink%20or%20message%20inside%20square%20brackets%5D%0A%0ARemindMe%21%20Time%20period%20here)|[^(Your Reminders)](https://www.reddit.com/message/compose/?to=RemindMeBot&amp;subject=List%20Of%20Reminders&amp;message=MyReminders%21)|[^(Feedback)](https://www.reddit.com/message/compose/?to=Watchful1&amp;subject=RemindMeBot%20Feedback)| |-|-|-|-|,1,1716131701.0,2024-05-19 15:15:01
1cv3og8,JkMotoman,You’ll make money but Shib is a meme coin. Slightly better than pump and dump. I have some. My main is XRP 4 year maturity to millions,1,1716148084.0,2024-05-19 19:48:04
1cv3og8,UniqueSoul_007,What are some penny stocks to keep an eye on or invest in?,1,1716190169.0,2024-05-20 07:29:29
1cv3og8,Long_Inspection254,$FFIE bro. Go look at it.,1,1716190815.0,2024-05-20 07:40:15
1cv3og8,[deleted],[deleted],1,1716167774.0,2024-05-20 01:16:14
1cv3og8,[deleted],"Hey! I'm using SoFi Invest 📊 to buy and sell stocks (and pieces of stocks) with zero fees. Open an Active Investing account with $10 or more, and you'll get $25 in stock. Use my link: https://www.sofi.com/invite/invest?gcp=fd9d9d07-bccb-4ea4-9ad4-b0a83ce0b817&amp;isAliasGcp=false",1,1716171580.0,2024-05-20 02:19:40
1cv3og8,TrainerMaleficent232,Buy $FFIE,1,1716201063.0,2024-05-20 10:31:03
1cv3og8,vertillus22,"Brave move. I can't wait to sold mine, didn't expect much from this coin, yet it still manages to dissapoint.",1,1716212325.0,2024-05-20 13:38:45
1cv3og8,deejaaf,"Good for you!  Had the same since 2021 but recently unloaded shibs, bones, and leash for pikas...  good lunch!",1,1716232587.0,2024-05-20 19:16:27
1cv3og8,eligas1007,$KNTO is where the real opportunity is,1,1716247046.0,2024-05-20 23:17:26
1cv3og8,Foreign_Brilliant403,First time with crypto?,1,1716261058.0,2024-05-21 03:10:58
1cv3og8,GoWiwi-Yolo,Started 3 years ago before the last jump.,1,1716261383.0,2024-05-21 03:16:23
1cv3og8,Familiar_Fortune_835,Waste of money. Should have put your money into cosine and hookers,1,1716293472.0,2024-05-21 12:11:12
1cv3og8,Trollwerks2A,The only thing you need is someone more foolish than you to sell it to!,1,1716409105.0,2024-05-22 20:18:25
1cv3og8,psychedelicnomad111,You should sell this rn... Reinvest it all in crow with knife. 20-40X,1,1716422230.0,2024-05-22 23:57:10
1cv3og8,Key_Influence298,See you guys at the new shiballers club once we are richer than bill gates lol,2,1716640327.0,2024-05-25 12:32:07
1cv3og8,[deleted],Everyday you hold more shiba is being printed devaluing the fuck out of your existing holdings,0,1716460681.0,2024-05-23 10:38:01
1cv3og8,GoWiwi-Yolo,Thats not what i have seen!’ Sorry but I jumped in at 0.000007 and now it sits at 0.000026 that is a 271% up,1,1716481116.0,2024-05-23 16:18:36
1cv3og8,[deleted],Give it time.,1,1716620541.0,2024-05-25 07:02:21
1cv3og8,Life_Hearing_7297,Shib is a stupid meme coin that will die off and hit zero like most useless coins,-1,1716165349.0,2024-05-20 00:35:49
1cvcdnu,RussianIntrigue,I hope that wonderful pup survives.,6,1716090660.0,2024-05-19 03:51:00
1cvcdnu,1cnx,This is a pot that everyone throws money in.  Then plays musical chairs. The developers have no useful function for this coin. It needs a reason to exist or it just will cease to exist,2,1716156340.0,2024-05-19 22:05:40
1cvcdnu,One_Afternoon3331,I love Shiba but this has got to be the worst and most bullshit crypto sub I've ever seen,3,1716125949.0,2024-05-19 13:39:09
1cvcdnu,TonyMontana00404,Shit coin,1,1716102362.0,2024-05-19 07:06:02
1cvcdnu,PurpleHairedMOD,This coin sucks,-2,1716117746.0,2024-05-19 11:22:26
1cvcdnu,[deleted],"Everyone wants a get rich quick scheme, the chances of actually profiting from shiba is slim. You have to put money in, close your eyes &amp; check back again in about 2-3 years.",5,1716128696.0,2024-05-19 14:24:56
1cvcdnu,freshclips563,This doesn’t make sense. Im profiting rn.,4,1716160822.0,2024-05-19 23:20:22
1cvcdnu,[deleted],Have you obtained unimaginable wealth from your profit?,2,1716160954.0,2024-05-19 23:22:34
1cvcdnu,1_Excus3,u can say this abt any coin gangi btw unimagine wealth is insane u must be new here,1,1716168116.0,2024-05-20 01:21:56
1cvcdnu,[deleted],You must’ve not seen what happened with shib back in 21 if you think unimaginable wealth is insane. $5 investment turned people millionaires 😂 where else you know $5 can turn into a million? You said nothing relevant to my comment at all,1,1716170251.0,2024-05-20 01:57:31
1cvcdnu,1_Excus3,my brother in christ 21 is the past we must focus on the future,1,1716191783.0,2024-05-20 07:56:23
1cvcdnu,1_Excus3,i didn’t read the rest and what i said related to ur comment was that if ur goal is unimaginable wealth in short time u short mind,1,1716191903.0,2024-05-20 07:58:23
1cuin5c,PositivePrimary8773,No,0,1715997952.0,2024-05-18 02:05:52
1cuin5c,[deleted],I’m not expecting a pop until Sept-Nov 24,1,1716075045.0,2024-05-18 23:30:45
1cuin5c,Linstrocity,Why this date?,1,1716208815.0,2024-05-20 12:40:15
1cuin5c,[deleted],Look at the all time chart &amp; you should notice a pattern during halving years,1,1716213137.0,2024-05-20 13:52:17
1cuin5c,Necessary-Ad3429,Yes,1,1716118192.0,2024-05-19 11:29:52
1cua77s,unumss,I was able to transfer some over not too long ago without issue.,2,1716001798.0,2024-05-18 03:09:58
1cua77s,cjsmith517,Crypto money has transferred in minutes.  But stocks and ETFs have to wait for the sale to finalize which takes 3 businesses days. So those are slower,1,1715967959.0,2024-05-17 17:45:59
1cua77s,Waste_Investigator_1,He said from his bank not into it. He probably went over the limit,1,1716066651.0,2024-05-18 21:10:51
1cua77s,[deleted],I transferred money today without any problems.,1,1715980492.0,2024-05-17 21:14:52
1cua77s,TacticalCountryCoder,No issues here at all. Seems to be working fine (shrug) :),1,1715993423.0,2024-05-18 00:50:23
1cua77s,ShocksMyBrains,It’s from your bank and has to clear and they give you a portion as an instant deposit. How did you do the transfer process?,1,1715997489.0,2024-05-18 01:58:09
1cua77s,Leo_perez34,Maybe you’re flagged as a day trader,1,1716050107.0,2024-05-18 16:35:07
1cua77s,Proof-Blueberry1882,No. I’m cash.,1,1716051764.0,2024-05-18 17:02:44
1cua77s,Stunning-Web739,"None if you go to the Wellys in Palermo.  Pietro runs a fairly tight ship.  He is still giving actual tokens, which I take to the Robinhood around the corner from Torino street and Garibaldi.  That's a great Robinhood, they are big time supporters of Wellys.  The head teller Georgina loves the #4 with the sauce.",1,1716258499.0,2024-05-21 02:28:19
1cttc1c,PurpleHairedMOD,"Still below .00025, dog shit coin is worthless",2,1715943729.0,2024-05-17 11:02:09
1cu8s9z,-Bad_Dad-,"Dump to FFIE, there's always time to come back to crypto. Get that 🎒",9,1715961706.0,2024-05-17 16:01:46
1cu8s9z,inthisplacemusic,Friend told me about it. I said it's going to dump hard. He bought more...instead of 7x gain he only 2x now. It dropped over 35%,1,1715995079.0,2024-05-18 01:17:59
1cu8s9z,HotCourt6842,ironically they are pumping penny stocks to try and get people to fomo away from crypto before the moon. id personally refrain.,1,1715991747.0,2024-05-18 00:22:27
1cu8s9z,[deleted],"For me, this was right before the craze with doge and Shiba. So I think after the p stocks rocket and dump, meme coins will follow suit. But yeah I wish I got in. I knew it would come back but didn’t know what stock. If I bought at 5 cents sold at 3.5 I woulda had over 4 million. Just like that. Life would be on easy mode",4,1716011571.0,2024-05-18 05:52:51
1cu8s9z,HotCourt6842,ya thats the point. to make u think you can win big quick. but only the professionals win. ive learned this lesson the hard way.,0,1716019661.0,2024-05-18 08:07:41
1cu8s9z,[deleted],Exactly! So you come back or buy in late thinking you can keep winning with them,0,1716083471.0,2024-05-19 01:51:11
1cu8s9z,HotCourt6842,"im not buying it at all lol ill stick true to my original investment plan and accept any losses that come in between. if i dont reach my investment goal i will evaluate, reconsider my goals, and take a step forward learning from the previous experiences.",1,1716119398.0,2024-05-19 11:49:58
1cu8s9z,[deleted],"Of course not. I’m saying that’s the psychological warfare of investing and the dumps coming thinking “it could go back up” when it’s done.  But yeah you got a solid plan. I’m invested in a few things here and there but I’ve got one that could pay out big and if that were to happen, I would definitely set myself up long term",1,1716134576.0,2024-05-19 16:02:56
1cu8s9z,HotCourt6842,i wouldnt bet more than 1-5% of my bag on it. and i wouldnt hold id trade options.,0,1715991841.0,2024-05-18 00:24:01
1cu8s9z,JHTPYO,Weird. Why?,2,1715981440.0,2024-05-17 21:30:40
1cu8s9z,GoWiwi-Yolo,Returns on bitcoins will no longer be +3x as oppose to shib coins potential is still very possible yl be +10x growth,2,1716057788.0,2024-05-18 18:43:08
1cu8s9z,TonyMontana00404,This coin is horseshit.,2,1716015498.0,2024-05-18 06:58:18
1cu8s9z,[deleted],Don't miss render😁,1,1715991453.0,2024-05-18 00:17:33
1cu8s9z,Kitibayunii,"If you believe more than one coin will rise, then it’s important to diversify",1,1716464620.0,2024-05-23 11:43:40
1ct96mi,PurpleHairedMOD,"That was me, feel the power of my blow hole peasants.",6,1715858383.0,2024-05-16 11:19:43
1ct96mi,[deleted],[deleted],-3,1715879678.0,2024-05-16 17:14:38
1ct96mi,popsmokeimout,It was about 3 trillion coins.,0,1715931869.0,2024-05-17 07:44:29
1cta0zf,Potential-Meet8517,Wow pick your Fantasy Players Fast and Securely these payout are less than 60 seconds… Get You Some!!!,1,1715935135.0,2024-05-17 08:38:55
1csy888,Stunning-Web739,"Absolutely, I ran into Pietro at Wellys in Palermo and as usual he was extremely bullish.  That's why I picked up another 800 million when I was there.  He is just so darn convincing, I mean the Wellys had coins literally all over the restaurant.  You speak to Josefina (Pietro's wife) and she is always the one telling me that she just got off the phone with Ryoshi.  I guess Ryoshi has a place in town, and he is a lover of the # 4.   There's really nothing like that special sauce.  Unreal.",2,1715985466.0,2024-05-17 22:37:46
