post_id,author,body,score,created_utc,date
1h1bhmo,paul0_0liveira,Hope this comment doesn’t come back to haunt either of us.,7,1732738643.0,2024-11-27 20:17:23
1h1bhmo,PsychologyOwn257,It won’t because it’s impossible. If ur capable of doing multiplication you can also see how wrong you are!,-1,1732738707.0,2024-11-27 20:18:27
1h1bhmo,Boring_Blueberry_113,Can you explain to me please 😅,1,1732740204.0,2024-11-27 20:43:24
1h1bhmo,PsychologyOwn257,"Shiba Inu is currently trading at .00002554/token. There are currently 589.26 trillion tokens in circulation. Multiply the token supply by the price and you get $15 billion, which is the market cap of the coin. In other words the total value of all the coins combined.   Let’s say you were extremely bullish on Shiba Inu and you believe it will one day be just as valuable as bitcoin (currently 1.9 trillion market cap). Assuming the supply remains steady, a single Shiba coin would still only be worth $.003. You can do the math yourself. 589 trillion times .003 equals $1.77 trillion. That’s a little lower than btc current market cap but you get the idea.",1,1732740841.0,2024-11-27 20:54:01
1h1bhmo,vorlando9000,How did doge go up to .70cents ? It was literally the same as shiba,3,1732783328.0,2024-11-28 08:42:08
1h1bhmo,PsychologyOwn257,Doge has far fewer tokens in circulation than Shiba.,2,1732791021.0,2024-11-28 10:50:21
1h1bhmo,tony78ta,"Elon Musk promoted it. Also, there's less, but it's inflationary, which means tokens are created at a constant rate.",1,1732802399.0,2024-11-28 13:59:59
1h1bhmo,Drizzho,"Not the same at all, Shiba had 1 quadrillion coins when created. Doge started with 10,000 coins and has been mining them at a constant rate since inception. Doge is Proof of Work on its own blockchain forked from Lite Coin and Shiba is an ERC 20 created on Ethereum which is a Proof of Stake network. Shiba is trying to burn supply while doge is inflating supply.",1,1732808807.0,2024-11-28 15:46:47
1h1bhmo,Boring_Blueberry_113,So who decided to burn coins and how 🤔 and why haven’t they burnt coins to drive the price up,1,1733012362.0,2024-12-01 00:19:22
1h1bhmo,PsychologyOwn257,You could burn literally half the supply and the same principles would apply here,1,1733012654.0,2024-12-01 00:24:14
1h1bhmo,[deleted],[deleted],1,1732740939.0,2024-11-27 20:55:39
1h1bhmo,Plus-Strawberry6068,"It would have to burn trillion of coins, which would not make the market cap as much, as well as making shib price move higher due to less coins in circulation.",1,1732836644.0,2024-11-28 23:30:44
1h1bhmo,debybang777,No need to be a total jack ass,1,1733052117.0,2024-12-01 11:21:57
1h1bhmo,RelevantBelt1656,It’s never gonna happen…,3,1732736731.0,2024-11-27 19:45:31
1h1bhmo,AbjectScar3729,CG!,1,1732734097.0,2024-11-27 19:01:37
1h1bhmo,ChaotiQ78,Everyone gets a cut,1,1732738532.0,2024-11-27 20:15:32
1h1bhmo,Grand_Hedgehog_6842,There’s literally a toggle at bottom on screen for advanced trading use it,1,1732742277.0,2024-11-27 21:17:57
1h1bhmo,Jseery7,Woah what the hell thats insane I imagine people are gonna sell and not notice that,1,1732743508.0,2024-11-27 21:38:28
1h1bhmo,paul0_0liveira,"Thank you all for the tip on the Advances trading. The fee there is $3,600 🙌🏻",3,1732744159.0,2024-11-27 21:49:19
1h1bhmo,Leo_perez34,Make separe advanced trades to unlock lower fees,1,1732768088.0,2024-11-28 04:28:08
1h1bhmo,Affectionate_Seat959,Wow. 🤯,1,1732793797.0,2024-11-28 11:36:37
1h1bhmo,Equivalent_Goat_5860,Kraken has way lower fees. I use both but prefer kraken for this reason.,1,1732797316.0,2024-11-28 12:35:16
1h1bhmo,Suresh_74,"You can buy 60 million $PURPE Purple PEPE (S0L)with that Gas fees.... strong community, backed by FB Wallstreet bets (550k member), 1 mil MC to 130 mil MC in 2 weeks, 50000+ holders, 8+ listings already.  All I see is PURPLE, let's f'ing gooooo 🚀🚀🚀 to 1 Billion MC .  HBoNJ5v8g71s2boRivrHnfSB5MVPLDHHyVjruPfhGkvL",1,1732807021.0,2024-11-28 15:17:01
1h1bhmo,KCdacutter13,Coinbase one 30 bucks a month and ur gonna pay 9 k on 292 k. Capital gains after brings it down to 165ish,1,1732810952.0,2024-11-28 16:22:32
1h1bhmo,KCdacutter13,Or jail for you friend,1,1732810961.0,2024-11-28 16:22:41
1h1bhmo,Emergency_Tennis_167,Do you have the coinbase one subscription? It’s $30 per month,1,1732811717.0,2024-11-28 16:35:17
1h1bhmo,junknownr,Send to ledger nano x wallet,1,1732814004.0,2024-11-28 17:13:24
1h1bhmo,ComprehensiveGrape73,"Me regalas $5k ? Para dar otro attempto?   Mi portfolio esta -12,500 tristemento  Y quiero hacer trading again!",1,1732816861.0,2024-11-28 18:01:01
1h1bhmo,abjones97,Use kraken much lower fees. .2% taker .4% maker,1,1732817496.0,2024-11-28 18:11:36
1h1bhmo,Wise_D_is_me,I too bought about 5 million Shabu k Inu. Is predicting to be 0.5-1 in 5 years even sooner if they start selling gold out federal reserve and replace with bitcoin,1,1732817741.0,2024-11-28 18:15:41
1h1bhmo,jorgehn12, I would sell when it reaches $1 /s,1,1732819389.0,2024-11-28 18:43:09
1h1bhmo,RabbitedEth,"That's literal Insanity.  An SPL of Shiba Inu on the Solana network may be significantly less, possibly. How about bridging it over to Base or something along those lines. Possibly less fees? Looking at the Portal Token bridge and it's $4.13 USD to transfer that much USDC (on ETH; converting the SHIB to USDC) to Solana. Then you can off ramp it. DM if you'd like help.",1,1732830783.0,2024-11-28 21:53:03
1h1bhmo,CartoonistDouble1464,Side note.  How many scammers are in your inbox after posting this? 😂,1,1732832014.0,2024-11-28 22:13:34
1h1bhmo,lunat1c_,Thats 3% seems a bit high but nothing ridiculous,1,1732832568.0,2024-11-28 22:22:48
1h1bhmo,Honest_Bodybuilder_5,Maybe in 3-4 years,1,1732833669.0,2024-11-28 22:41:09
1h1bhmo,VANM3TER,Crypto.com will literally only allow you to cash out $5000K at a time lmao,1,1732834018.0,2024-11-28 22:46:58
1h1bhmo,TONNAGE1975,ERC-20,1,1732841560.0,2024-11-29 00:52:40
1h1bhmo,BOWFL3xxxx30,Transfer to another platform with lower fees like Robinhood maybe,1,1732843203.0,2024-11-29 01:20:03
1h1bhmo,Comfortablec0,Don't hold on CoinBase and everything going to be ok with fee's :D,1,1732868058.0,2024-11-29 08:14:18
1h1bhmo,SpecialGuestOfficial,Something tells me you’ll be alright.,1,1732871761.0,2024-11-29 09:16:01
1h1bhmo,Scrumdiddlies,Those aren’t network fees. Those are coinbase fees. They know you have no other way off so they will pillage your account for all they can get.,1,1732873958.0,2024-11-29 09:52:38
1h1bhmo,Free-Photograph724,Gemini - $3 fee,1,1732899491.0,2024-11-29 16:58:11
1h1bhmo,Tasty-Television-360,Can’t you just send it to Robinhood wallet and sell it for free?,1,1732906001.0,2024-11-29 18:46:41
1h1bhmo,xmewsickx,Coinbase one is 29/month and no trade fees,1,1732915346.0,2024-11-29 21:22:26
1h1bhmo,Known_Carpenter570,Will the fees ever devalue?,1,1732916437.0,2024-11-29 21:40:37
1h1bhmo,michaeljai24,All great advice,1,1732920629.0,2024-11-29 22:50:29
1h1bhmo,Ambitious_Opinion254,Coinbase One! Lower fees 🚀,1,1732923271.0,2024-11-29 23:34:31
1h1bhmo,Popular-Feeling7673,Wow.,1,1732925365.0,2024-11-30 00:09:25
1h1bhmo,CheechBuzzz,Can.... Can I get like $20?,1,1732928432.0,2024-11-30 01:00:32
1h1bhmo,LengthinessHuge2118,get coinbase 1,1,1732930041.0,2024-11-30 01:27:21
1h1bhmo,Ezpeebz,Your phones on 100% mines on 2%,1,1732930203.0,2024-11-30 01:30:03
1h1bhmo,speadskater,That's because you're expecting at immediate sell.  Go to coinbase advanced and make an order.,1,1732932942.0,2024-11-30 02:15:42
1h1bhmo,MoodyEclipse,300k dollars? Bro give me some,1,1732933351.0,2024-11-30 02:22:31
1h1bhmo,[deleted],Awesome,1,1732933875.0,2024-11-30 02:31:15
1h1bhmo,OutrageousArrival701,did you press the blue button?,1,1732940302.0,2024-11-30 04:18:22
1h1bhmo,Muvmhead1,How do you get to that option I have about the same in Shiba,1,1732960259.0,2024-11-30 09:50:59
1h1bhmo,Normal-Masterpiece76,Let’s hope it goes that high,1,1732968703.0,2024-11-30 12:11:43
1h1bhmo,Petard2688,Lol sell when at 1 cent. That's a dream within a dream.,1,1732979777.0,2024-11-30 15:16:17
1h1bhmo,Least-Ad2968,Hold it’s gonna go up more,1,1732981700.0,2024-11-30 15:48:20
1h1bhmo,crudetatDeez,Can you not use Coinbase One for 1 month for $5? I think it gives you no fees from what I can tell,1,1732993759.0,2024-11-30 19:09:19
1h1bhmo,All0ut0f0ptions,Just take your coins out of Coinbase,1,1733016075.0,2024-12-01 01:21:15
1h1bhmo,creative_dizruption,That's wild,1,1733022815.0,2024-12-01 03:13:35
1h1bhmo,[deleted],When it hits 1 cent 😂,1,1733023590.0,2024-12-01 03:26:30
1h1bhmo,Charcuterie1,3%,1,1733024693.0,2024-12-01 03:44:53
1h1bhmo,CoconutKey7541,Coinbase is for suckers,1,1733032876.0,2024-12-01 06:01:16
1h1bhmo,Inquiring-purchase,I’ve held Shib for years. I sold and moved it to HEGE. I’ve gotten 5x since. Consider coming to HEGE for a bit and come back to SHIB later.  If you’re looking for active community it’s great.,1,1733050857.0,2024-12-01 11:00:57
1h1bhmo,blackcell1,What a bargin,1,1733063610.0,2024-12-01 14:33:30
1h1bhmo,Inevitable-Pie-6979,XRPL will be there whenever yall ready lol….tons of memes rugs and good projects alike…but nonetheless your cash out and cost to trade will be seamless,1,1733071901.0,2024-12-01 16:51:41
1h1bhmo,NMEsEscape,Yeah Coinbase dookie . I could be a day trader but nah,1,1733076484.0,2024-12-01 18:08:04
1h1bhmo,WillNA,@paul0_0liveira dude just send some to me instead,1,1733077002.0,2024-12-01 18:16:42
1h1bhmo,[deleted],Truthfi coming soon,1,1733077847.0,2024-12-01 18:30:47
1h1bhmo,Logical-Doughnut-567,May as well buy $RUDGE with Solana!,1,1733098411.0,2024-12-02 00:13:31
1h1bhmo,johnmoney22,"Im praying, hoping,wishing, and waiting for the day it reaches.01🔥🔥🔥🙏🏽🙏🏽",1,1732769672.0,2024-11-28 04:54:32
1h1bhmo,Ognvps,Put it in LCX OR SPERAX THANK ME LATER,1,1732751111.0,2024-11-27 23:45:11
1h1bhmo,Neither_Upstairs_872,"You’re complaining about 9k compared to 300? Bro going to shit his pants when he learns about taxes 😂 on the real, Coinbase advanced is worth the membership to minimize the fees",1,1732813808.0,2024-11-28 17:10:08
1h1bhmo,bazookapapa69,Coinbase pro,1,1732824032.0,2024-11-28 20:00:32
1h1bhmo,Dannimaru,It's actually only $8625 in fees.  Rounding up doesn't make it sound cool,0,1732782129.0,2024-11-28 08:22:09
1h1bhmo,Starscreamz1,Mental,0,1732733179.0,2024-11-27 18:46:19
1h1bhmo,Thefleasknees86,You have to pay for advance right? (Not saying OP shouldn't),0,1732734365.0,2024-11-27 19:06:05
1h1bhmo,AltruisticGene7318,Should use revolut x. Fuck that shit you using with fees like that,0,1732737219.0,2024-11-27 19:53:39
1h1bhmo,inthisplacemusic,They take 3% no matter what the amount . Whe. I first dove into crypto I lost about 800$ in trade fees by doing daily trades when I was getting only 2% gains,0,1732755941.0,2024-11-28 01:05:41
1h1bhmo,Flat4Power4Life,How does one have that much to invest and not understand how market caps work? A .01 cent Shib would make it worth more than the entire crypto currency market combined including Bitcoin. Ha ha,0,1732808281.0,2024-11-28 15:38:01
1h1bhmo,thesnake1213,Why tf you own 200k in shib,0,1732824621.0,2024-11-28 20:10:21
1h1bhmo,Schult34,"They don't. That's what it would be worth if Shib got to .01 each. They have maybe 1k worth of Shib, depending on n when they bought it, maybe even only a few hundred bucks",1,1732883947.0,2024-11-29 12:39:07
1h1bhmo,MotherEarthsFinests,Dont worry the order won’t ever go through lol,0,1732837628.0,2024-11-28 23:47:08
1h1bhmo,DMunE,Damn people really don’t understand that a coin is only as valuable as what people are willing to pay for it. There is not a single chance in hell it will ever go up there in our lifetime. It would be worth more than bitcoin with the supply,0,1732842330.0,2024-11-29 01:05:30
1h1bhmo,Public-Cucumber-7620,Right thereOcala fever,0,1732842932.0,2024-11-29 01:15:32
1h1bhmo,Silent-Spot-619,Good thing you’ll never have to worry about that💀,0,1732843701.0,2024-11-29 01:28:21
1h1bhmo,powerenterprises,You won’t have to ever worry about it at that price lol,0,1732848032.0,2024-11-29 02:40:32
1h1bhmo,Jdsmitty10,Your worried about less than 10k in fees when selling for an unrealistic price that will never happen? I have over 60 million coins but also a brain,0,1732849028.0,2024-11-29 02:57:08
1h1bhmo,Amdvoiceofreason,"Never gonna hit a penny with as many coins as they have.  Would be nice tho.  People can downvote doesn't make it any less true, shiba will never ever be worth 4 trillion dollars which equates to a penny each",0,1732862348.0,2024-11-29 06:39:08
1h1bhmo,Miserable-Mix-5374,"This is like complaining that you have to bulk order special condoms for your monster cock so you can keep fucking instagram models, pornstars, and bitches that look like Timothée Chalamet. My guy, look at the numbers you’re gonna get. Life is gonna be rewarding for you regardless. Take some joy from it or just say “hey look at all the money l’m getting”",0,1732872895.0,2024-11-29 09:34:55
1h1bhmo,chilledout5,Or in this case never getting. But maybe their joy is in dreaming the impossible dream.,1,1733078034.0,2024-12-01 18:33:54
1h1bhmo,Snixxis,Cool. 'When'? You're going to become very disapointed when you realise that shib is never going to be worth 100times the value of apple.,0,1732874707.0,2024-11-29 10:05:07
1h1bhmo,trashmangamer,So? 9k....and you get near 300k... Just deal with it.,0,1732894374.0,2024-11-29 15:32:54
1h1bhmo,Beanfromband23,"Bro, pay the $25 for Coinbase Pro and save that money lol",0,1732898821.0,2024-11-29 16:47:01
1h1bhmo,Straight_Lion6520,Stop buying shitcoins 🤷🏾,0,1732918079.0,2024-11-29 22:07:59
1h1lz13,FightingTolerance,My lord,5,1732767192.0,2024-11-28 04:13:12
1h1lz13,Nek0w0rks,Lmao rugged,5,1732794004.0,2024-11-28 11:40:04
1h1lz13,Mike_kont,Dude WTF,3,1732778757.0,2024-11-28 07:25:57
1h1lz13,devil_lettuce,"What?? It looks like a rugpull scam? I don't get it, what are you trying to say? Was this just a scammer post? Mods?",3,1732813081.0,2024-11-28 16:58:01
1h1lz13,DarkSoulsExplorer,Bottom drop out?  Went from $85 to $13 in hours.,2,1732788068.0,2024-11-28 10:01:08
1h1lz13,Why-mom-why,Cringe?,1,1732836362.0,2024-11-28 23:26:02
1h1lz13,ReasonableHour3838,Biodios,1,1733282208.0,2024-12-04 03:16:48
1h1lz13,Drizzho,Dog this is a meme coin scam lmfao the best GameStop coin is on Solana held the value the longest so far out of all I’ve seen. Everyone can make a GameStop coin this isn’t official at all and rugged lmao. You can buy any meme coin on launch but you need to be on chain.,1,1732813821.0,2024-11-28 17:10:21
1h1kxlt,badussybandit1,I bought $100 worth like 5 mins after asking this. 😂,19,1732761850.0,2024-11-28 02:44:10
1h1kxlt,gila-lagi,Good for u. Patience,1,1732833196.0,2024-11-28 22:33:16
1h1kxlt,Electrical-Mango-871,"If you are to invest 500$, put first 250$ now, then the remaining amount if it dips like 10-15%. Such drops and spikes are not unusual, and if you invest 1/2 now, and 1/2 later if the opportunity presents, you are in a position to potentially reap the rewards or average down if needed.   Whatever you do, just buy and forget about it if you are ok to let it sit for 2-4 years.",9,1732765736.0,2024-11-28 03:48:56
1h1kxlt,badussybandit1,Love it!,2,1732765825.0,2024-11-28 03:50:25
1h1kxlt,Electrical-Mango-871,"You obviously need to account for your brokerage's fees and all. When I was buying the.coints, I had to buy in increments of 100$ due to my limited finances, so I ended up paying maybe like 10-15$ in fees. Those fees may translate for additional coins if your brokerage doesn't charge those fees. I'm still up about 29% overall but keeping in mind trading fees may be another factor to consider if you are.to invest in increments in general.",1,1732766012.0,2024-11-28 03:53:32
1h1kxlt,NihilistHUGZ,Its a good time to catch it before it breaks down the current 'Wall of Resistances' and breaks ABOVE $0.00003s. It may not come back down below $0.00003s if we establish Strong Supports ABOVE that point. It could trigger a massive wave of Buyer interest which will be HIGH Volatility with massive price appreciation beyond ATH and into $0.00005s.,7,1732761867.0,2024-11-28 02:44:27
1h1kxlt,Local_Doubt_4029,Jump in!!!!,4,1732761586.0,2024-11-28 02:39:46
1h1kxlt,trashmangamer,"You can buy 1 million shib for $20... No, never bad time.",3,1732894173.0,2024-11-29 15:29:33
1h1kxlt,NathsAPirate,Jump aboard!  Also your username made me snort-laugh out loud 😂,2,1732795846.0,2024-11-28 12:10:46
1h1kxlt,Wrong-Ad4243,Never a bad time. The more we move the coins it will be fir all of us,2,1732800939.0,2024-11-28 13:35:39
1h1kxlt,Colorado_Trader,Never a bad time .  See you on the moon 🌝,2,1732989076.0,2024-11-30 17:51:16
1h1kxlt,DeepInTheSheep,"If you like losing money, it’s always a good time to buy Shib",1,1732764284.0,2024-11-28 03:24:44
1h1kxlt,Doironzch1,"People down voting this yet, tons of people do lose money on shib. I held onto what I had for over a year before it turned green again. Most people won't wait and see, they just sell and cry.",2,1732793447.0,2024-11-28 11:30:47
1h1kxlt,johnmoney22,Never bad time to buy if your willing to hold and allow it to lose a few 0’s definitely if you willing to hold amd hope for .01 cents..,1,1732772362.0,2024-11-28 05:39:22
1h1kxlt,uspilot13,There are 4 zeros after the decimal point……yes it’s a good time to buy in. My break even is .0000097. I am trying to keep my break even low so right now the dips aren’t getting low enough for me to buy.  I would buy more if it dropped below.000020 but I am happy it’s moving up and keeping me in the red.,1,1732791600.0,2024-11-28 11:00:00
1h1kxlt,IGotMetalingus1,Never a bad time when it comes to Shiba. Because it never moves. Can still buy the same amount at the same price from 3 years ago,1,1732925733.0,2024-11-30 00:15:33
1h1kxlt,Purist1638,10 years ago,0,1732765874.0,2024-11-28 03:51:14
1h1kxlt,emoody247,Wasn’t a coin 10 years ago,2,1732809689.0,2024-11-28 16:01:29
1h1kxlt,Purist1638,Exactly,1,1732816683.0,2024-11-28 17:58:03
1h1it5d,Critical_Deal_2408,In 20 years there could possibly be 20x the amount of fiat  money so it’s possible but not any time soon,7,1732754219.0,2024-11-28 00:36:59
1h1it5d,Armendicus,Shit in the next 4 yrs when Trump has to bail out farmers and everyone else his tariffs fuck over. Plus all the other shit he’ll pass!! Lets hope no new strains of Covid pop up.,-3,1732757700.0,2024-11-28 01:35:00
1h1it5d,thrive2day,Those tariffs gonna do work. Can't wait til all the bailout stimmies start hitting the market again,2,1732763087.0,2024-11-28 03:04:47
1h1it5d,Armendicus,I want Elon to gon n drop that Doge Stimmy!!,2,1732763149.0,2024-11-28 03:05:49
1h1it5d,RaconBang,It will never hit 0.01,6,1732752632.0,2024-11-28 00:10:32
1h1it5d,TheFudge,It’s crazy to me that people actually think this coin could hit .01. The market cap at even .001 would be insane. Do people realize that there are 589 TRILLION tokens?,4,1732753130.0,2024-11-28 00:18:50
1h1it5d,MountainIcy8084,nothing is impossible 😤,-4,1732753758.0,2024-11-28 00:29:18
1h1it5d,Electrical-Mango-871,"I don't think it will hit 0.01 either, at least not anytime soon. I do, however, think it is incorrect to apply market caps the way we understand them now in the context of stock / bonds markets to crypto.",1,1732766202.0,2024-11-28 03:56:42
1h1it5d,obliterate_reality,I used to hold shib. Made very good profit early 2021. But these mfs are delusional thinking .001 is possible. Let alone .01  It is mathematically not possible,1,1732830675.0,2024-11-28 21:51:15
1h1it5d,[deleted],LMFAOO 🤣🤣,2,1732755565.0,2024-11-28 00:59:25
1h1it5d,Jamm3dTo3,lol you’ll be gone before it happens.,1,1732843691.0,2024-11-29 01:28:11
1h1it5d,Ancient_Ad_5582,Pass it to you and then collect it or whatever you want,0,1732796403.0,2024-11-28 12:20:03
1h1lph7,PoomanJoo,Are you the “puuuuuush lfgoooooooo!” Wierdo?,1,1732765111.0,2024-11-28 03:38:31
1h22pmd,devils117,How in the actual fk would tariffs remotely impact a token that's literally useless in every sense possible?  ![gif](emote|free_emotes_pack|dizzy_face),22,1732823021.0,2024-11-28 19:43:41
1h22pmd,AAFAswitch,LMAO,2,1732824419.0,2024-11-28 20:06:59
1h22pmd,BreakfastIndividual,WHAT?? Who taught OP??.,1,1732919051.0,2024-11-29 22:24:11
1h22pmd,obliterate_reality,Why would Tariffs on manufacturing parts and equipment affect shitcoin prices?,4,1732827460.0,2024-11-28 20:57:40
1h22pmd,[deleted],No?,2,1732819478.0,2024-11-28 18:44:38
1h22pmd,Myg0t_0,What u people think shib does and why it has value?,2,1732826627.0,2024-11-28 20:43:47
1h22pmd,michaeljai24,No I don’t think so,1,1732824696.0,2024-11-28 20:11:36
1h22pmd,Snakedicks,They aren’t actually Shiba Inu’s…,1,1732830347.0,2024-11-28 21:45:47
1h22pmd,Local_Doubt_4029,"If it didn't crash from 2020 to 2024 with the knuckle heads.....then don't let the corrupt media scare you, 2025 will be to start of the greatest thing ever.   Since you brought politics in this, that's why I posted this.",-2,1732822539.0,2024-11-28 19:35:39
1h22pmd,DeepInTheSheep,Found the nazi,-2,1732823933.0,2024-11-28 19:58:53
1h22pmd,Local_Doubt_4029,I guess you're entitled to your opinion since you hold $50 worth of SHIB.....lol.,0,1732825266.0,2024-11-28 20:21:06
1h22pmd,DeepInTheSheep,"Nah man, I cashed out when it was at ath.  $50 is chump change anyway, I trade in 6 figures sister.",-7,1732825561.0,2024-11-28 20:26:01
1h22pmd,Local_Doubt_4029,"Lol....6 figures, .000006  there's the only 6 figures u can afford.",1,1732831675.0,2024-11-28 22:07:55
1h22pmd,DeepInTheSheep,Nah.  I don’t invest in dead worthless tokens.,1,1732837468.0,2024-11-28 23:44:28
1h22pmd,Local_Doubt_4029,and yet.....HERE U ARE....LOL,1,1732842369.0,2024-11-29 01:06:09
1h22pmd,BobRossmissingvictim,"Trades in 6 figures, but excited a game came out on Xbox. Buy a gaming pc loser",1,1732827762.0,2024-11-28 21:02:42
1h22pmd,Local_Doubt_4029,Lol...yup,2,1732831569.0,2024-11-28 22:06:09
1h22pmd,DeepInTheSheep,PC is for poor people.  I run Mac.,-1,1732829443.0,2024-11-28 21:30:43
1h22pmd,BobRossmissingvictim,Clearly you don’t understand costs. My pc cost 5 grand and my Mac cost 1.5.,-1,1732829539.0,2024-11-28 21:32:19
1h22pmd,DeepInTheSheep,Clearly you make poor financial decisions if you simp for dead tokens and spend 5k on a machine that will last a few years for negligible graphics gains.,-1,1732829726.0,2024-11-28 21:35:26
1h22pmd,BobRossmissingvictim,Unlike some I’m in a position where I don’t need to worry about finances.,2,1732829984.0,2024-11-28 21:39:44
1h22pmd,Pimpeto,All alt coins that are not compliant with iso 20022 will vanish in 2025. Plan accordingly.,-1,1732822351.0,2024-11-28 19:32:31
1h22pmd,reaper_6114,Bitcoin isn’t ISO compliant you think it’s going to disappear,2,1732828411.0,2024-11-28 21:13:31
1h22pmd,Independent_Slice_23,https://www.reddit.com/r/Pepecryptocurrency/s/8ZD6ijZ4u5,0,1732820547.0,2024-11-28 19:02:27
1h22pmd,Warminsandiego,Yes.  Burn yours now.,0,1732822360.0,2024-11-28 19:32:40
1h0geye,_Haverford_,"I have no delusions of grandeur, but I have a whopping 14 bucks in Shib. It's cheap gambling *shrug*.",42,1732640340.0,2024-11-26 16:59:00
1h0geye,SpaceXBeanz,I have 25 LOL I already made 30k on doge coin When it went into the 60 cents area I think.,12,1732644081.0,2024-11-26 18:01:21
1h0geye,_Haverford_,Jealous.,6,1732644530.0,2024-11-26 18:08:50
1h0geye,BostonFan50,how ?,3,1732647433.0,2024-11-26 18:57:13
1h0geye,PoomanJoo,It’s bluntly obvious - he bought early,9,1732665020.0,2024-11-26 23:50:20
1h0geye,SpaceXBeanz,I bought very very early yah and just immediately sold it when it went to its highest. I wish I bought more.,1,1733184710.0,2024-12-03 00:11:50
1h0geye,trashmangamer,He probably bought when it was like 5 cents or 10 cents during summertime.,1,1732894470.0,2024-11-29 15:34:30
1h0geye,Ok_Location7161,I bought 300 mil shib today.  Thank you for selling,34,1732648537.0,2024-11-26 19:15:37
1h0geye,YAS_1981,"![gif](emote|free_emotes_pack|dizzy_face) Altcoin season has not started yet. 🚀 Target: $0.0008  ""Weak hands are selling"" 🤪 Good Job Buddy",5,1732824483.0,2024-11-28 20:08:03
1h0geye,Future-Muffin-2088,People said the same about doge not reaching certain numbers,15,1732658292.0,2024-11-26 21:58:12
1h0geye,Future-Muffin-2088,This fool underneath my comment having a whole conversation with himself 🤭,8,1732659183.0,2024-11-26 22:13:03
1h0geye,ucb2222,Shib bag holder lulz,1,1733018319.0,2024-12-01 01:58:39
1h0geye,Active_Abalone_4584,There is no way Shiba wants to stay a shitcoin. They will up the halving process dramatically in the next 5 years. There’s no way they wouldn’t.,2,1732658881.0,2024-11-26 22:08:01
1h0geye,Active_Abalone_4584,It’s actually extremely surprising that Shiba has a value with how many coins it has. It’s very surprising. Goes to show that Shiba and Pepe will only change to your favor if you are already rich and invested or IF the developers  C H A N G E. S O M E T H I N G.    Don’t watch the lines and graphs. Watch the people and the news.,2,1732659037.0,2024-11-26 22:10:37
1h0geye,Basic_Excitement3190,Uh a penny is impossible.  Shib would have to be worth the whole market basically,1,1732674674.0,2024-11-27 02:31:14
1h0geye,Future-Muffin-2088,Crypto was impossible before 2009. But go off!,9,1732674949.0,2024-11-27 02:35:49
