post_id,author,body,score,created_utc,date
1hdm0ok,ChaotiQ78,"Buy the rumor sell the news, it probably goin to slope down. They gas it up sell high and let it sink to previous levels, until they gas it up again",10,1734126269.0,2024-12-13 21:44:29
1hdm0ok,Ok_Elevator_7352,Someone got rug pulled,2,1734139274.0,2024-12-14 01:21:14
1hdm0ok,robinwilliamlover911,That's legitimately what Shiba does. Or can you just not read the chart,1,1734139502.0,2024-12-14 01:25:02
1hdm0ok,Ok_Elevator_7352,I wasn’t talking to you,2,1734139525.0,2024-12-14 01:25:25
1hdm0ok,keepingitreal70,"Don’t worry with haters, they’re just a turd in the punch bowl",1,1734281988.0,2024-12-15 16:59:48
1hdm0ok,robinwilliamlover911,"*""I wAsNt TaLkInG tO yOu""*  lame ahh guy",0,1734139584.0,2024-12-14 01:26:24
1hdm0ok,Ok_Elevator_7352,👍 not my fault people don’t understand risk,1,1734139613.0,2024-12-14 01:26:53
1hdm0ok,SlashRModFail,The most low IQ comment.  Got given eyes to see but no brains to comprehend,2,1734141042.0,2024-12-14 01:50:42
1hdm0ok,No_Wolf_9028,Everyone has been saying this exact thing on every coin subreddit... every other week non-stop with the same graphs. No one knows anything. It's a tactic to get you to dump money into it so someone else can sell their bad investment along with their last shred of dignity.,5,1734219401.0,2024-12-14 23:36:41
1hdm0ok,keepingitreal70,"I’ve been at this game for quite a few years now and yes, you are exactly right",1,1734282038.0,2024-12-15 17:00:38
1hdm0ok,Exact_Put3658,Never,2,1734130252.0,2024-12-13 22:50:52
1hdm0ok,Dry_University_6030,If keep going down 😂,2,1734143442.0,2024-12-14 02:30:42
1hdm0ok,PoomanJoo,Here we go again 🙄,2,1734150763.0,2024-12-14 04:32:43
1hdm0ok,Simple-Cover-5844,I think you meant to crash lmfao,2,1734183888.0,2024-12-14 13:44:48
1hdm0ok,bsod88,Where Lamborghini? To the moon! HODL!!  Retards,2,1734212195.0,2024-12-14 21:36:35
1hdm0ok,undonedomm,almost every altcoin char looks like that,2,1734219881.0,2024-12-14 23:44:41
1hdm0ok,CWIuDT,Dignity and patience go together.,2,1734238454.0,2024-12-15 04:54:14
1hdm0ok,Green-Feature3810,"Don’t get me wrong I got shib, but no faith in it fr",2,1734271750.0,2024-12-15 14:09:10
1hdm0ok,DesignerSecure4078,I feel a lot of the SHIB hype is just pure delusion. I have some don’t get me wrong but idk why the hype is so hard for this coin,2,1734273862.0,2024-12-15 14:44:22
1hdm0ok,CurveUseful5427,"Every one Just reminder again:Dogecoin and Shiba Inu When down, we are not affected; there is no need to withdraw or sell for that huge amount of volume; it will bounce easily.There are 4 discounts; now what are we waiting for? Buy now; it’s just Christmas Day today or Black Friday. Everyone, FYI, I loaded a bunch of Dogecoin and Shiba today. I use both coins for daily expenses groceries and shopping 🛒 . You buy a car 🚘 using these coins, like Tesla, Toyota, Honda, Ford, Chevrolet, BMW, and Mercedes.",1,1734195316.0,2024-12-14 16:55:16
1hdm0ok,Specific_Magician748,None of those manufacturers accept shib or doge.,1,1734213844.0,2024-12-14 22:04:04
1hdm0ok,clee5989,Every chart for all cryptos looks primed but it keeps going down everyday,1,1734202846.0,2024-12-14 19:00:46
1hdm0ok,britanyya,What a load of chit,1,1734267164.0,2024-12-15 12:52:44
1hdm0ok,Outrageous-Fun7110,All the people in the altcoins subreddits who believe these coins are going nowhere is hilarious. Why even subscribe to the group?,1,1734303382.0,2024-12-15 22:56:22
1hdm0ok,MithrilHero,Launch downwards 🤣,1,1734376730.0,2024-12-16 19:18:50
1hdm0ok,Vocal_and_Visible24,Soon...our favorite word,1,1734406150.0,2024-12-17 03:29:10
1hdm0ok,CurveUseful5427,"Look at the volume of this first to see this huge volume all over the participating. One cent is possible? Easy. Now we that kindly everyone is going to happen without you, and everyone is listening; the wave will explode if everyone is right now. Embrace the timing to bring this shiba to the top. Are you with me? Let’s go.🔥🔥🔥🚀🚀🚀🚀",-1,1734135559.0,2024-12-14 00:19:19
1hdm0ok,98-civic-si,"Shiba will not reach 1 cent any time in the near future, it would need a market cap of 550 BILLION dollars,  which is simply not going to happen with a meme coin, it needs to burn about 500 trillion more before it'll even get close",2,1734194048.0,2024-12-14 16:34:08
1hdm0ok,[deleted],[deleted],0,1734194219.0,2024-12-14 16:36:59
1hdm0ok,98-civic-si,"Volume means nothing for what it costs. If there isn't 550 billion dollars in the coin it will not hit 1 cent. Either you're a 13 year old or a bot, I can't tell. Hopefully people ignore your bs 1 cent will not happen any time soon, maybe when we've died",1,1734194395.0,2024-12-14 16:39:55
1hdm0ok,CurveUseful5427,"I don’t care, dude. Duh, I use both dogecoin and Shiba Inu coins in my daily life: buy groceries, pay bills, buy houses and buy a car, just like an ATM card. Do you have a problem with that?",-1,1734194549.0,2024-12-14 16:42:29
1hdm0ok,98-civic-si,No I don't have a problem with that. Whay I have a problem with is you spouting nonsense telling people it's going to hit 1 cent when it's litterally not possible right now.,2,1734194750.0,2024-12-14 16:45:50
1hdm0ok,CurveUseful5427,You better silence; you are  not in position; give a suggestion on your level. Period ,0,1734195146.0,2024-12-14 16:52:26
1hdm0ok,98-civic-si,Oopsies! Made a bad assumption!  Only 7 digits? Rookie. I have 8. Confirmed bot at this point,1,1734197285.0,2024-12-14 17:28:05
1hdm0ok,CurveUseful5427,What ever dude stop spreading negativity here go somewhere else. People in the room nice and quiet,0,1734197566.0,2024-12-14 17:32:46
1hdm0ok,98-civic-si,"I'm not spreading negativity, shib can absolutely drop a 0 or two in the near future, however at its current state it is literally mathematically impossible for it to hit 1 cent, I'm not spreading negativity. I'm spreading the truth and trying to help others understand market cap and coin supply and the affect on the price",1,1734202204.0,2024-12-14 18:50:04
1hdm0ok,Specific_Magician748,Spreading realistic expectations isn't spreading negativity.,1,1734213727.0,2024-12-14 22:02:07
1hdm0ok,CurveUseful5427,"Who? You are funny; if you have a 7-digit profit, I will listen to your suggestion. You can’t see what I can see; you are on my level, dude. All of my investments, crypto and luxury investments,each of it are worth 7 digits.",-1,1734195004.0,2024-12-14 16:50:04
1hdydpr,ComplexWrangler1346,??,2,1734179840.0,2024-12-14 12:37:20
1hdydpr,Desperate-Ad-4308,Yes,1,1734549009.0,2024-12-18 19:10:09
1hdydpr,DeepInTheSheep,Yes,0,1734170727.0,2024-12-14 10:05:27
1hdydpr,HeavyBigdean,LFG!,0,1734228235.0,2024-12-15 02:03:55
1hdydpr,Sensitive-Monitor720,I can't calculate this for shit someone help,-1,1734164364.0,2024-12-14 08:19:24
1hdg7tb,cinesias,"This shit is real simple. The initial thousand fold increase over the course of weeks/months is over. This coin might be worth something years from now, so if you can afford to gamble a little bit of money now, you might turn it into decent profit later.   If you’re buying Shib as  your retirement account, you’re probably fucking up.",10,1734113862.0,2024-12-13 18:17:42
1hdg7tb,Icy-Maize-7281,The whole conversation of how Shiba will be worthless is useless cause they mine it every day and it went up to 0.73 this was the main reason I sold at the time and other ppl believed that it wouldn’t go anywhere,3,1734108057.0,2024-12-13 16:40:57
1hdg7tb,ComplexWrangler1346,"Is it going anywhere ?? Will it go up 1/100th of a penny in the next 10 years ?? Besides crypto enthusiasts and Shib loyalist , this coin isn’t ever going anywhere ….",2,1734109168.0,2024-12-13 16:59:28
1hdg7tb,Icy-Maize-7281,Based off what cause in 2020 same was said abt doge,4,1734110876.0,2024-12-13 17:27:56
1hdg7tb,ComplexWrangler1346,There are tons of stocks that are at one penny that you can do this to everyday . They will actually move in the next year,3,1734111303.0,2024-12-13 17:35:03
1hdg7tb,Icy-Maize-7281,Every crypto was a penny stock even Bitcoin crypto and stocks are different that fact you would even bring that is funny,2,1734111419.0,2024-12-13 17:36:59
1hdg7tb,ComplexWrangler1346,Why is it funny ?? Who is regulating the crypto prices ?? Why won’t shib go to say a $1 a coin right now ? Why is coins like AAVE at $370 a coin ? Or bitcoin cash at $595 a coin ? What makes those thousands of times more valuable than Shib ?,0,1734113884.0,2024-12-13 18:18:04
1hdg7tb,Icy-Maize-7281,Bitcoin cash hasn’t moved and followed Bitcoin in 2020-2021 so I believe we’ll have 175-250k per bitcoin in the coming months those profits pour into meme coins not like you would know,2,1734114524.0,2024-12-13 18:28:44
1hdg7tb,ComplexWrangler1346,"You don’t know anything ….you just want to believe this will happen …shib will never reach even close to a dollar dude……you ever invested in actual stocks before ?? People will put tons in it and if it never moves eventually people will pull out their profits or losses ……just like any other coin , if they don’t move up , in given time people will just liquidate. Then it really will drop",0,1734114648.0,2024-12-13 18:30:48
1hdg7tb,Icy-Maize-7281,You right I don’t know anything when I’ve know abt crypto since 2017 also bought 438k doge for a 2k investment but yes I don’t know anything right now,2,1734114723.0,2024-12-13 18:32:03
1hdg7tb,Icy-Maize-7281,The trends all align you can even look at the 10yr chart 2017/2020/2024,2,1734114760.0,2024-12-13 18:32:40
1hdg7tb,ComplexWrangler1346,Yeah ok …..let me know when it first hits half a penny …,0,1734114796.0,2024-12-13 18:33:16
1hdg7tb,ComplexWrangler1346,Ok dude …….,-1,1734111239.0,2024-12-13 17:33:59
1hdg7tb,Icy-Maize-7281,You can look at Reddit for doge 10yrs ago same stuff is being said now like Shiba,7,1734111308.0,2024-12-13 17:35:08
1hdg7tb,Nightan11,Doge has the richest man on earth hyping it and backing it...,2,1734133200.0,2024-12-13 23:40:00
1hdg7tb,Burning-Gundam,"You're wasting your breath. A lot of the people here are probably new to SHIB or don't understand that the massive circulating supply prevents it from moving up. They don't know that at the current burn rates, it would take hundreds, if not thousands, of years for SHIB to reach a penny.   If the devs can not come up with a way to erase trillions of SHIB, then this token will never reach a penny. Some people don't understand this. They just hold on to hopes and dreams, which is not bad, but being well informed is important.",0,1734112533.0,2024-12-13 17:55:33
1hdg7tb,ComplexWrangler1346,The only way you will make any money off shib is to put thousands of dollars in it and hope it goes up 2/100ths of a penny …..,1,1734113196.0,2024-12-13 18:06:36
1hdg7tb,s0urc3f0ur,"And yet I made 20k on  a $200 investment 🤷 it sounds like you're bitter and want to poop on people's party. Go somewhere else if you hate Shib so much, like why even bother?",3,1734136267.0,2024-12-14 00:31:07
1hdg7tb,Chronify,"So, Doge and Shiba are two separate coins",1,1734108640.0,2024-12-13 16:50:40
1hdg7tb,Icy-Maize-7281,"Doge is mined 10,000 per minute shib has a set supply with the ability to burn coins so you tell me",3,1734108885.0,2024-12-13 16:54:45
1hdg7tb,Icy-Maize-7281,How did you know,1,1734108669.0,2024-12-13 16:51:09
1hdg7tb,FaastEddy,"Shib was intentionally built so it would NEVER appreciate much. The constant supply increase is a dam that by design will always spring leaks. The real question is at what point will people realize this, lose faith and stop dropping dollahs into it. My personal take (not financial advice) there will be a peak sometime next year when Crypto has it's hayday, but Shib cannot follow ride up like Bitcoin or to a lesser extend Doge - too many coins in ever increasing supply.",1,1734386221.0,2024-12-16 21:57:01
1hdg7tb,Icy-Maize-7281,Shiba has a set circulation with the ability to to burn coins if your in it for the long term it’s worth it,1,1734108120.0,2024-12-13 16:42:00
1hdg7tb,itsalyfestyle,How many thousands years you in it for,0,1734109495.0,2024-12-13 17:04:55
1hdg7tb,Icy-Maize-7281,It not gonna take thousands of years the only thing that is thousands of years back is your mentality abt crypto,2,1734117665.0,2024-12-13 19:21:05
1hdg7tb,itsalyfestyle,You know how big of a number 598 trillion is right?,1,1734122227.0,2024-12-13 20:37:07
1heaok5,Signal-Fish8538,Why not have both 🤷🏽,26,1734205752.0,2024-12-14 19:49:12
1heaok5,Born_Manner5228,"I agree, only two crypto I own, have for a while, I throw like 50 in each each month of disposable income with the hope in a couple years, hopefully sooner that it will all turn into either wealth or more disposable income",5,1734206494.0,2024-12-14 20:01:34
1heaok5,Signal-Fish8538,I own about 5 Jasmy did me the best but I’m up on shib aswell,2,1734209392.0,2024-12-14 20:49:52
1heaok5,Creative-Support584,not a bad choice for sure 🫡 at the end of the day we need meme coins to the moon! 🌕,2,1734207495.0,2024-12-14 20:18:15
1heaok5,vegasbull27,To own only one coin would be the mistake. Do both,10,1734212302.0,2024-12-14 21:38:22
1heaok5,[deleted],Diversify diversify diversify. i have 24 million of each. My 24 million of PEP is worth around 25k and my 24 million of PEPE is worth around 500 bucks,4,1734213772.0,2024-12-14 22:02:52
1heaok5,FunHalf162,Shibe all the way homie!Keep ur peepe coin.,3,1734224852.0,2024-12-15 01:07:32
1heaok5,Actual_Attention9792,Stop shilling in desperation,3,1734237102.0,2024-12-15 04:31:42
1heaok5,CowboyBebopBang,You know what’s even better?  A rap battle… bring attention. Young and old money.,2,1734213419.0,2024-12-14 21:56:59
1heaok5,Mrobot_3,I wonder how much the whales pay the small shillers to do this 💩,2,1734219794.0,2024-12-14 23:43:14
1heaok5,freedom_fighting321,I got banned for shilling!  Why is this ok now?,2,1734231077.0,2024-12-15 02:51:17
1heaok5,FriendlyEyeFloater,Yes everybody please sell so we can go up again when it gets low enough,2,1734236018.0,2024-12-15 04:13:38
1heaok5,mcreech10,$PEP or $PEPE?,4,1734207167.0,2024-12-14 20:12:47
1heaok5,[deleted],[deleted],2,1734211982.0,2024-12-14 21:33:02
1heaok5,robograndpa,What sort of big things are you talking about?,1,1734237247.0,2024-12-15 04:34:07
1heaok5,Disastrous-Owl-3866,$PEP on Xeggex is the early bird.,1,1734209234.0,2024-12-14 20:47:14
1heaok5,ElRapidoEjaculatore,$PEP,0,1734210066.0,2024-12-14 21:01:06
1heaok5,Wonderful_Clothes156,PEP 100 %,1,1734231306.0,2024-12-15 02:55:06
1heaok5,Alarmed-Hold9830,Definitely $PEPE,-1,1734207523.0,2024-12-14 20:18:43
1heaok5,Creative-Support584,$PEPE 🫡,-3,1734207453.0,2024-12-14 20:17:33
1heaok5,mcreech10,"If you invest $1,000 into $PEP and it grows to same valuation that $PEPE is currently at, your investment will be worth $80,000",3,1734208194.0,2024-12-14 20:29:54
1heaok5,mcreech10,IMO I think $PEP is the better option. It’s an actual minable coin and from an investment standpoint it definitely has the much higher potential. Only a $100 million MC compared to $8 billion,3,1734207831.0,2024-12-14 20:23:51
1heaok5,Disastrous-Owl-3866,"$PEP is for the 10-100x gains, PEPE for +-50% gains",4,1734209202.0,2024-12-14 20:46:42
1heaok5,MRAnonymousSBA,"Both Pepe and shib have very little room to grow this cycle. Slightly more room for Pepe, but still massive downside for it.",3,1734207479.0,2024-12-14 20:17:59
1heaok5,mcreech10,$PEP has a ton of room to grow,2,1734207848.0,2024-12-14 20:24:08
1heaok5,MRAnonymousSBA,"More interested in finding the Pepe on the next big chain. I’m thinking XRPL, but dogechain and a few others have potential too.   Also- I’m generally scouring for the biggest narratives on all chains. Things like founders dogs, first memes on a given chain, etc.",0,1734209798.0,2024-12-14 20:56:38
1heaok5,throw-me-away-7878,Look into base chain boatloads of cash waiting to be made on it,0,1734224171.0,2024-12-15 00:56:11
1heaok5,MRAnonymousSBA,Base is trash,-1,1734225977.0,2024-12-15 01:26:17
1heaok5,throw-me-away-7878,Stay broke,-1,1734226334.0,2024-12-15 01:32:14
1heaok5,MRAnonymousSBA,"I bought both shib and Pepe on their first weeks of launch. I’m out of both fully. You can downvote and ignore- but it’s the truth. You may be able to snag a few x’s over the next few years on them- but the upside is very minimal compared to the downside, especially at this stage in the cycle. (Near highs).",0,1734207708.0,2024-12-14 20:21:48
1heaok5,TellMeMore_1111,"yup, i trimmed the top many times, but the pepe tree still grow really fast.",1,1734227542.0,2024-12-15 01:52:22
1heaok5,LeaderBrilliant3662,That’s why retailers always loose .,1,1734246354.0,2024-12-15 07:05:54
1heaok5,[deleted],Pepecoin is Inevitable !  $PEP is the Ticker ....   [pepecoin.org](http://pepecoin.org),1,1734251201.0,2024-12-15 08:26:41
1heaok5,AdRepresentative7370,Pepe will be the new dogecoin ….,1,1734218801.0,2024-12-14 23:26:41
1heaok5,Wonderful_Clothes156,PEP is fork of dogecoin. It will be the next,1,1734231478.0,2024-12-15 02:57:58
1heaok5,AdRepresentative7370,Hope so,1,1734261286.0,2024-12-15 11:14:46
1heaok5,Wonderful_Clothes156,Why not have PEP? Next dogecoin,1,1734231364.0,2024-12-15 02:56:04
1heaok5,Desperate_Ad1732,"$pep has way more potential, Pepe is internets longest lasting meme, and now it has its own pepe-chain. looks incredibly promising!",0,1734214300.0,2024-12-14 22:11:40
1heaok5,Reasonable-Channel20,Flip to PEP for all that is good DYOR,0,1734214249.0,2024-12-14 22:10:49
1heaok5,SlashRModFail,Fucking ugly and useless coin,0,1734216732.0,2024-12-14 22:52:12
1heaok5,mylifemyrulesfuckyou,$PEP is the one you want,0,1734230000.0,2024-12-15 02:33:20
1hdh091,CurveUseful5427,Shiba inu and Dogecoin will take off the moon Let’s go🔥🔥🔥🚀🚀🚀,1,1734111951.0,2024-12-13 17:45:51
1hd8ji0,External_Dimension18,If the entirety of the crypto market was Shiba market cap.  I bet we would be close to .01,5,1734098641.0,2024-12-13 14:04:01
1hd8ji0,Signal-Fish8538,To be honest I think if we crypto people put all our efforts into one cryptocurrency we would of made it far or choose a top 5 and focus on those and consolidate in those top 5 there is to much fighting and trying to go against each other.,5,1734101049.0,2024-12-13 14:44:09
1hd8ji0,ChaotiQ78,Look at what people did for GameStop and AMC. If enough people get together and hedge their money they would gain wealth. It takes money to make money.,5,1734102991.0,2024-12-13 15:16:31
1hd8ji0,Signal-Fish8538,Yeah exactly the hard part would be to get people to agree to the same coins.,2,1734103405.0,2024-12-13 15:23:25
1hd8ji0,ChaotiQ78,"It is possible. Right place right time, look at WallStreetBets, they became infamous!",3,1734106157.0,2024-12-13 16:09:17
1hd8ji0,Signal-Fish8538,Yeah it is and it has to be coins of utility mostly it will have to have a purpose,1,1734106784.0,2024-12-13 16:19:44
1hd8ji0,Cristirus06,It was once in top 10,1,1734110974.0,2024-12-13 17:29:34
1hd8ji0,Signal-Fish8538,I’m talking about forget all other crypto and just consolidate the market into a few either 5 or 10 if all the crypto money is in only a few coins then they would moon.,2,1734114091.0,2024-12-13 18:21:31
1hd8ji0,Cristirus06,I’ve had more then 40 different coins. Now I started to sell some.,1,1734116816.0,2024-12-13 19:06:56
1hd8ji0,Signal-Fish8538,Yeah I had a couple I transfer to other coins now I have like 5 consolidated,2,1734117037.0,2024-12-13 19:10:37
1hd8ji0,Kevosrockin,It wouldn’t even be close to that lmao,1,1734106445.0,2024-12-13 16:14:05
1hd8ji0,CryptoMoneyLand,Thanks for the info.  [https://justshib.blogspot.com/p/all-posts.html](https://justshib.blogspot.com/p/all-posts.html),1,1734098272.0,2024-12-13 13:57:52
1hdj5s6,TheGreatGameDini,"Oh cool, thanks for buying my bag - now I won't be stuck with it.",2,1734116752.0,2024-12-13 19:05:52
1hdj5s6,Icy-Maize-7281,I’ll gladly take it I’ve watched doge move 100% in one day when the profits poured in from bitcoin and eth and hit a 50billion market cap last cycle,0,1734117232.0,2024-12-13 19:13:52
1hdj5s6,[deleted],Doge and Shib supply is wildly different though and Shib doesn't have a Elon,2,1734123804.0,2024-12-13 21:03:24
1hdj5s6,Icy-Maize-7281,Shib reach 50b,-1,1734117246.0,2024-12-13 19:14:06
1hdj5s6,Icy-Maize-7281,I screen recorded it if you really want proof lol,0,1734117338.0,2024-12-13 19:15:38
1hdj5s6,TheGreatGameDini,"I don't. When the FED, Visa, and the rest of the financial institutions make their own ""coins"" most of these will go to zero. The only few I foresee remaining are BTC because it's a store, ETH because it's functional, and XMR because it's private - even those might not survive.",1,1734117552.0,2024-12-13 19:19:12
1hdj5s6,Icy-Maize-7281,With how much much in in the crypto market combined 3.5 trillion it’s almost impossible to collapse the only thing that will collapse is the usd before bitcoin does,0,1734117735.0,2024-12-13 19:22:15
1hdj5s6,TheGreatGameDini,Yeah you keep thinking that buddy. That's why you'll be left with the bag of tulips.,1,1734117789.0,2024-12-13 19:23:09
1hdj5s6,Icy-Maize-7281,The dude who said bitcoin is going to fucking 0 is 70years old lmaoo ofc he doesn’t believe in it,1,1734117838.0,2024-12-13 19:23:58
1hdj5s6,TheGreatGameDini,Yeah and he's rich as fuck while you're betting on monopoly money.,1,1734117990.0,2024-12-13 19:26:30
1hdj5s6,Icy-Maize-7281,He would of been richer if he put all his money into bitcoin with no work at all,0,1734118032.0,2024-12-13 19:27:12
1hdj5s6,Icy-Maize-7281,You can listen to the old heads like go to college it’s the only way to be successful when I worked with ppl who have degrees and still are in debt they can’t get out of or they don’t use the degree,0,1734118078.0,2024-12-13 19:27:58
1hdj5s6,Icy-Maize-7281,Old heads like that think they are right when they are not it’s now at 100k last thanksgiving it was at 32k the longer you wait the more priced out you will be loll,0,1734117885.0,2024-12-13 19:24:45
1hdj5s6,Icy-Maize-7281,It moves in cycles which ppl like you don’t understand 2017/2020/2024 look at the chart for the past 10 years,0,1734117990.0,2024-12-13 19:26:30
1hdj5s6,Twitchfresse,Nice way of loosing all your money,1,1734210709.0,2024-12-14 21:11:49
1hd2dzn,Grisuno123,If it could only get to 6 cents we could pay off the National Debt,12,1734058287.0,2024-12-13 02:51:27
1hd2dzn,Felixtaveras75,.0005,4,1734063998.0,2024-12-13 04:26:38
1hd2dzn,Vipin-1001,a huge parabolic move will happen soon,3,1734087150.0,2024-12-13 10:52:30
1hd2dzn,Felixtaveras75,![gif](emote|free_emotes_pack|upvote),1,1735415447.0,2024-12-28 19:50:47
1hd2dzn,unionmademan,I have heard the same rumor.,2,1734058789.0,2024-12-13 02:59:49
1hd2dzn,[deleted],[https://youtu.be/yNnm37_hSRY?si=DilXfmlVRZ_iACRa](https://youtu.be/yNnm37_hSRY?si=DilXfmlVRZ_iACRa),1,1734061064.0,2024-12-13 03:37:44
1hd2dzn,[deleted],He is pretty good. I followed him for a while already,0,1734061085.0,2024-12-13 03:38:05
1hd2dzn,313deezy,If the airbags didn't deploy and you can still drive it your good.,1,1734069447.0,2024-12-13 05:57:27
1hd2dzn,michaeljai24,Let’s go.,1,1734099405.0,2024-12-13 14:16:45
1hd2dzn,mikeoxwells2,This is the first prediction I’ve seen that seems possibly realistic. Still kicking myself in the ass over not selling at .00004,0,1734066042.0,2024-12-13 05:00:42
1hcszzv,Catcher235,Shib will be the universal currency for gas stations. You saw it here first. Embrace or Lose Out (EoLO),10,1734041330.0,2024-12-12 22:08:50
1hcszzv,sadelbrid,So what's Shib's utility?,6,1734036726.0,2024-12-12 20:52:06
1hcszzv,emoody247,Making money off meme of course lol,7,1734043636.0,2024-12-12 22:47:16
1hcszzv,Vipin-1001,SHIB will go 2x above its previous all time high,6,1734058995.0,2024-12-13 03:03:15
1hcszzv,Icy-Maize-7281,2x is low in a bull run😂😂,3,1734066788.0,2024-12-13 05:13:08
1hcszzv,Vipin-1001,i'm saying above its previous ATH. which will be more than 5x from current levels,3,1734067040.0,2024-12-13 05:17:20
1hcszzv,Icy-Maize-7281,I saw doge move 100% in one day so realistically anything is possible,3,1734067215.0,2024-12-13 05:20:15
1hcszzv,Vipin-1001,yes if doge is going above $1 then SHIB will 10x,1,1734067385.0,2024-12-13 05:23:05
1hcszzv,Icy-Maize-7281,It will def knock 0.001,1,1734067471.0,2024-12-13 05:24:31
1hcszzv,Icy-Maize-7281,Doge in 2020 0.004526 in December 2021 0.73,1,1734067510.0,2024-12-13 05:25:10
1hcszzv,Icy-Maize-7281,Doge will hit 1.50-3$ usd easy toward the end of,1,1734069784.0,2024-12-13 06:03:04
1hcszzv,escanner1,I can buy a pizza with bitcoin 😎. What can I buy with shib or doge?,2,1734139434.0,2024-12-14 01:23:54
1hcszzv,doge4life2276,Garlic sauce for the crust,0,1734277421.0,2024-12-15 15:43:41
1hcszzv,anaraine625,"Don’t worry, we will have some genius telling us otherwise soon",3,1734035844.0,2024-12-12 20:37:24
1hcszzv,MOASSisImminent,Hold on tight Shib Army. We bout to take flight any day now,1,1734373791.0,2024-12-16 18:29:51
1hcszzv,skawlz,"Crypto coins purpose has been realised. It has a fundamental use..by this stage it should be converted into a service or something. Doesn’t make sense to be inflating any of these coins with a dollar value.  Crypto network makes sense Inflating its value with dollars makes no sense  But oh well, enjoy making fool money off less savy fools all",1,1734416259.0,2024-12-17 06:17:39
1hcszzv,STL_TRPN,I missed my first chance at being a millionaire.  I'll at least get 10K off this SOB! 🤑,1,1734582600.0,2024-12-19 04:30:00
1hcszzv,Pristine_Pen_8248,Stop pumping these garbage coins,-1,1734061165.0,2024-12-13 03:39:25
