post_id,author,body,score,created_utc,date
1d32iz2,DatLuccaboy,"Meh, Im affected the same in pullbacks and pops, my strat is add when down and accumulate enough so that $0.0002 means something when we get there.",2,1716953431.0,2024-05-29 03:30:31
1d32iz2,SlashRModFail,"The consolidation period is matched with BTC dropping low to mid 60s.  The next big breakout move is looking likely around 0.00005 to 0.00007, we might consolidate for a while around a small bump up to 30s if BTC reverses it's downward trend in the next week.",1,1716997538.0,2024-05-29 15:45:38
1d2ukjn,Sendmedoge,I bought $200.  Sold it at 5k.  Watched to go to 50k.  Regret is rough.,10,1716933089.0,2024-05-28 21:51:29
1d2ukjn,iplaypokerforaliving,Lmao why didn’t you keep some in?,1,1716997681.0,2024-05-29 15:48:01
1d2ukjn,Sendmedoge,"Timing.  My son was finishing high school that week.  So I cashed out and I made him build his own PC good enough for the drafting he wants to learn.  And made him upgrade mine.  I lived a few thousand miles away and really wanted to give him that knowledge and was going to be there in a couple days.  If he is going to do drafting, building his own pc will save him a LOT over his life.  So regret.. but no regrets.",3,1717003585.0,2024-05-29 17:26:25
1d2ukjn,iplaypokerforaliving,Well. That’s amazing. Good dad!,2,1717007961.0,2024-05-29 18:39:21
1d2ukjn,Sendmedoge,"Ty, kindly.",2,1717008530.0,2024-05-29 18:48:50
1d2ukjn,External_Dimension18,Steady gains hold.  No more pump and dumps,6,1716931575.0,2024-05-28 21:26:15
1d2ukjn,[deleted],[deleted],5,1716930879.0,2024-05-28 21:14:39
1d2ukjn,Ecstatic-Study-7144,I got it a ath,3,1716931793.0,2024-05-28 21:29:53
1d2ukjn,HotCourt6842,20? u mean 300% ?,1,1716965522.0,2024-05-29 06:52:02
1d2ukjn,polkntheeye,I would l be crazy saying l see shib at or above .10 in 10 months...,3,1716932204.0,2024-05-28 21:36:44
1d2ukjn,redguy4545,Why do u see it that way?,1,1717002291.0,2024-05-29 17:04:51
1d2ukjn,soreeyed414,I’ll get excited when we see .00008 again.,2,1716934710.0,2024-05-28 22:18:30
1d2ukjn,NomadofReddit,Cause you bought in too high lol what is 6% for you was 25% for me today.   I cashed out - made 3K. Will buy back in again when it drops.,2,1716934717.0,2024-05-28 22:18:37
1d2ukjn,AmbitiousJump947,"Even is yall sold early some, still dirt cheap, but more and hold! The run ain't over yet. I think so. .. takes time guys",2,1716954729.0,2024-05-29 03:52:09
1d2ukjn,Individual_Ad_5780,"Also i did my share, bought another 41.6 million coins during the small downfall today",2,1717110066.0,2024-05-30 23:01:06
1d2ukjn,Loquat_Legal,No new money flooding crypto,1,1716980605.0,2024-05-29 11:03:25
1d2ukjn,psychedelicnomad111,This coin is dead. Whales own too much. They sell off whenever the price rises.( Crow with Knife.....20x),1,1716997413.0,2024-05-29 15:43:33
1d2ukjn,StarAny3150,"100% facts I'm seeing it more and more everyday. That's why sadly I think I'm going to be out once it crosses 30 again. I've been holding for a few years now, but circulating Supply is too high and too many whales control too much of the shib Market they're playing games with us.",1,1717250370.0,2024-06-01 13:59:30
1d2ukjn,psychedelicnomad111,"They're just making money, they don't care about anybody. If you want big gains look at the new coins with small market caps.... The whole shib army should sell and buy CROW WITH KNIFE!!!",1,1717252876.0,2024-06-01 14:41:16
1d2ukjn,Individual_Ad_5780,I'll take 6 percent everyday,1,1717110002.0,2024-05-30 23:00:02
1d2ukjn,ksuschmidt,this coin is down like 300% from the all time high.  It's not going anywhere but down,1,1717332298.0,2024-06-02 12:44:58
1d2ukjn,TheSagePhoenix,Shib is still cooling down. If you’re looking for the next Shib you should look into $BONK. I wouldn’t be surprised if they end up having close to the same market cap eventually.,-1,1716936197.0,2024-05-28 22:43:17
1d2ukjn,SlashRModFail,Fuck off this sub,2,1716974237.0,2024-05-29 09:17:17
1d2ukjn,StarAny3150,I'm starting to see the truth more and more everyday joining the team soon,1,1717250577.0,2024-06-01 14:02:57
1d2ukjn,Spiritual_Flow_501,stop with this meme coin elon bullshit just buy hold drs gme and stfu fucking regards,0,1716961978.0,2024-05-29 05:52:58
1d371wf,LordHardius,Erase a 0 would be nice,1,1717059179.0,2024-05-30 08:52:59
1d371wf,Few-Tax-4802,A real news agency would be great I have more followers then fxcry on x lol,1,1717271903.0,2024-06-01 19:58:23
1d3004w,Bivins_1117,Hope so,1,1717294618.0,2024-06-02 02:16:58
1d2vkyr,[deleted],$SHIB4Life,2,1716936519.0,2024-05-28 22:48:39
1d2vkyr,inthisplacemusic,Just bought 25 mill more,2,1717302955.0,2024-06-02 04:35:55
1d2vkyr,Realistic-Ad-8559,Lmfao,1,1717287374.0,2024-06-02 00:16:14
1d2vkyr,im_nobodyspecial,“Fat shib profits”    So if you have 7 million coins you’re gonna make about enough for a slurpee at the corner convenience store.   Better be careful with that kinda cheese in your pocket. You could get mugged.,1,1717347585.0,2024-06-02 16:59:45
1d2vkyr,liquidreach5150,"Well in the last week I’m able to buy about 6000 slurpee’s with profits , so I’m making a gang of cheddar 🧀🧀",1,1717559892.0,2024-06-05 03:58:12
1d2vkyr,im_nobodyspecial,Bullshit. It’s gone down 5% in the last week.,1,1717596086.0,2024-06-05 14:01:26
1d2vkyr,liquidreach5150,Yeah stocks and crypto go up and down u less you live fantasy land where you think things just go up and that’s it lol,1,1718221969.0,2024-06-12 19:52:49
1d2vkyr,im_nobodyspecial,Really?? Wow. Thanks. I’m just wondering how you PROFITED 6000 slurpees worth in the same week that it dropped 6%. Liar.,1,1718222103.0,2024-06-12 19:55:03
1d36sdf,inthisplacemusic,If it is not shib.io don't go to it,1,1717305781.0,2024-06-02 05:23:01
1d329bw,PositivePrimary8773,At some point.  Not anytime soon tho.  Maybe in 2025,1,1717100783.0,2024-05-30 20:26:23
1d2vp6d,Ok-Yogurtcloset-76,Go pepe 👏,1,1716956511.0,2024-05-29 04:21:51
1d2kl8c,PositivePrimary8773,No,1,1717123158.0,2024-05-31 02:39:18
1d2gp40,whoneedsajobsoon,Yesssss if you all post enough this worthless coin with no value or utility will sky rocket.,1,1716993216.0,2024-05-29 14:33:36
1d2gp40,Ancient-Eye3022,What does the ten percent drop mean?   10 dollars in 3 days?   These predictions are just absolutely absurd,1,1717139786.0,2024-05-31 07:16:26
1d243q2,Monsta327,"Seems like a scam, I’d contact police if possible. There stealing your identity sounds like.",12,1716851903.0,2024-05-27 23:18:23
1d243q2,ThereIsABubble,The clue was in the name,8,1716882592.0,2024-05-28 07:49:52
1d243q2,EvilActual009,"100% agree. I read the post all the way through &amp; thought to myself, "" sounds like a wallet designed to get one over on someone that's either virgin to crypto or is familiar with only the buzz words used in shill vids on the internet or thrown around by mainstream media since its being politicized currently.""",4,1716890873.0,2024-05-28 10:07:53
1d243q2,EvilActual009,"I'd say good luck with it &amp; that I hope it all wo4ks out in the end, but it's reading as though an outcome in your favor is just not in the cards. Which really sux. I'm curious, how did you find this wallet? Was it suggested to you by someone online or did you DYOR &amp; find it that way?",3,1716891114.0,2024-05-28 10:11:54
1d243q2,StaggeringBeerMan,What kind of person try’s out something with 30k you try new things with 100$ maybe 200$ I don’t believe this post. If you have 30k you got with something proven,3,1716896851.0,2024-05-28 11:47:31
1d243q2,ZeeNasty,"Scam unfortunately, free wallet will never release or re open your account because they know you will withdrawl it. Good luck OP.",2,1716854434.0,2024-05-28 00:00:34
1d243q2,[deleted],Sorry bro I don’t think you are getting it back 😭,2,1716862363.0,2024-05-28 02:12:43
1d243q2,[deleted],Keep trying tho,2,1716862372.0,2024-05-28 02:12:52
1d243q2,JustAnotherDay1994,"Never heard of Freewallet. I definitely suggest a more trusted wallet, such as Coinbase Wallet.",2,1716902684.0,2024-05-28 13:24:44
1d243q2,ThatDude461,"Ask them to open your account so you can deposit some more, as you believe your cryptos are going up. Then withdraw everything.",2,1716910799.0,2024-05-28 15:39:59
1d243q2,[deleted],Yes same scam that Beastock.com,1,1716898327.0,2024-05-28 12:12:07
1d243q2,obliterate_reality,Who coulda thunk it,1,1716910119.0,2024-05-28 15:28:39
1d243q2,ndisang67,Never heard of freewallet...,1,1716920714.0,2024-05-28 18:25:14
1d243q2,ndisang67,Are you saying you moved 30K into something called free? Really?,1,1716921103.0,2024-05-28 18:31:43
1d243q2,Thecajunchief,If it makes you feel any better Coinbase is currently doing the same thing to me…sucks.,1,1716940371.0,2024-05-28 23:52:51
1d243q2,Tpenny66,"Seriously?  Because it says Freewallet that's the best one to jump into!  All wallets are free to create!  Sadly, your ignorance created your own stress you complain about!  So many steps along the way to just stop and take a step back and question the validity, but nope!  It's Free, it says it in the name, you just have to sacrifice a lot of stress and time; that's not free my person!  You handcuffed yourself, I know you want pity but you deserve none!   30K too 🙈",0,1716867781.0,2024-05-28 03:43:01
1d243q2,Toraadoraa,Pig butcher scam.,0,1716862450.0,2024-05-28 02:14:10
1d243q2,galangga,Why you believe free wallet?,0,1716864429.0,2024-05-28 02:47:09
1d243q2,Pimp-No-Limp,You are being social engineered in some way by them. Either trying to pretend to be you or get a bit more information from you that they are missing.   Good luck hope it works out for you.,0,1716882015.0,2024-05-28 07:40:15
1d1oxe4,Fun-Cartoonist2595,"The Shiba Inu community is actively campaigning to get LEASH and BONE listed on Binance,",2,1716830206.0,2024-05-27 17:16:46
1d1oxe4,[deleted],Good cuz this project is finna get GAPPED by a fuking frog if they don’t do something soon…🥲,1,1716839819.0,2024-05-27 19:56:59
1d1nj2l,ksuschmidt,don't think so.  no burn mechanisms in place like coin holders were promised,1,1717071360.0,2024-05-30 12:16:00
