post_id,author,body,score,created_utc,date
1kdb0b6,trifle_hat,Smashed.  Are you in the telegram friend? I find it much easier for sharing links (the Reddit app doesn’t redirect to the x app well…),8,1746218527.0,2025-05-02 20:42:07
1kdb0b6,skillmattic,"🫡thanks  Yesssir, I post on there as well! I know what you mean, the Reddit redirect to X is a little weird. I think once I logged in it was better.",6,1746219732.0,2025-05-02 21:02:12
1kdarx6,trifle_hat,Great post.   Smash all!!,1,1746218546.0,2025-05-02 20:42:26
1kd9lzr,CHARLIEFORTHEBOYS,![gif](giphy|qjSxTWJxqH4YDuIrOs),16,1746214576.0,2025-05-02 19:36:16
1kd9lzr,trifle_hat,People who have been round the block many more times than me say patience will be rewarded. I’m listening to them,14,1746218625.0,2025-05-02 20:43:45
1kd9lzr,skillmattic,![gif](giphy|62HIkemjJZOD95NDlI)  Hold the line KenduArmy...WE WILL RISE ONCE AGAIN🫡,7,1746219869.0,2025-05-02 21:04:29
1kd9lzr,TheGDC33,Well said there is a lot to look forward to with plenty of liquidity waiting on the sidelines. We keep building and working and letting The people who get the mission and goal buy-in at these low prices,6,1746223310.0,2025-05-02 22:01:50
1kd7bi5,Lalph-Rauren,You KENDU it. 🤓,8,1746208517.0,2025-05-02 17:55:17
1kd7bi5,lorniko,"Love it!  I think the ""barracuda"" should start from 150m tokens 😁",7,1746208639.0,2025-05-02 17:57:19
1kd7bi5,stayseaart,Let’s gooooooh!!!  Love these recaps.,5,1746209197.0,2025-05-02 18:06:37
1kd7bi5,UrbanPKMonkey,You’re right. Data is correct but the heading wasn’t. Fixed for next time 👌🏻,3,1746222526.0,2025-05-02 21:48:46
1kczshl,RegardedQt314,just gotta crop out the last person on the left... 😆   WE KENDU IT,7,1746189762.0,2025-05-02 12:42:42
1kczshl,phi_curious,"Just like Richard Dawkins said:   When you plant a fertile meme in my mind you literally parasitize my brain, turning it into a vehicle for the meme's propagation in just the way that a virus may parasitize the genetic mechanism of a host cell.",1,1746206797.0,2025-05-02 17:26:37
1kczncv,A_true_gENTleman,I like the way Kendu is looking.,8,1746189125.0,2025-05-02 12:32:05
1kczncv,Vegas_42,18k holders incoming. I've got a feeling that May is going to be a good month.,7,1746194157.0,2025-05-02 13:55:57
1kczncv,RegardedQt314,activity has been great lately (not that it isn't always that way) and like you mentioned lots if new faces in the tg 🤝,6,1746189451.0,2025-05-02 12:37:31
1kczncv,bigboydesomo,Nice topped up my bag another xx mil,6,1746190862.0,2025-05-02 13:01:02
1kczncv,bigboydesomo,Mhmm love them,4,1746200187.0,2025-05-02 15:36:27
1kczncv,TheGDC33,Looking and feeling good,6,1746201109.0,2025-05-02 15:51:49
1kczncv,TheGDC33,I hope so and can't say on way or another cause I have become overly superstitious in an irrational way...but 😉🦊🪖,5,1746201146.0,2025-05-02 15:52:26
1kczncv,TheGDC33,"There is always something positive/bullish to include in the metrics posts. I don't always remember or my brain isn't awake enough to remember, but I try",3,1746201097.0,2025-05-02 15:51:37
1kczncv,TheGDC33,Get it homie! Love to hear it.,3,1746201029.0,2025-05-02 15:50:29
1kczncv,RegardedQt314,i really appreciate your content and consistency with these posts 🫶  these and the recaps that ian started posting give a good overall insight into what has been happening and it's easier for people to stay up to date and informed if they don't frequently use telegram.,2,1746208606.0,2025-05-02 17:56:46
1kczncv,TheGDC33,"Thanks for the kindness. To be fair, I would have stopped ages ago if I hadn't gotten such appreciation from people on Reddit and then on X saying how much they appreciated these posts.   Since we are being so appreciative. I have to thank you for all your Mod work over the course of this almost year (longer for you). I don't even know how you have done it for so long, but it is greatly appreciated and I recognize how much work it is and what otherworldy mental strength you must have",2,1746208921.0,2025-05-02 18:02:01
1kczncv,RegardedQt314,thank you gdc 🤝 we all du what we ken for the sake of kendu!,2,1746369945.0,2025-05-04 14:45:45
1kczncv,TheGDC33,🙏,2,1746375513.0,2025-05-04 16:18:33
1kcucbc,Vegas_42,"![gif](giphy|Zrxs6nl12WgmL3ZTHm)  Oh yeah, pump it right into my system😎",4,1746168825.0,2025-05-02 06:53:45
1kcucbc,squaredot1,Kendu is King,4,1746172072.0,2025-05-02 07:47:52
1kcucbc,RegardedQt314,i wouldn't exactly say number 3 is accurate but the rest are good selling points!,5,1746185325.0,2025-05-02 11:28:45
1kcucbc,Lalph-Rauren,$KENDU IS THE WAY.  LETS PUMP IT UP. 🚀,1,1746272289.0,2025-05-03 11:38:09
1kcucbc,NordicNirvana,"Would number 3 be a possibility in the future, you think 🤔 👍",4,1746194769.0,2025-05-02 14:06:09
1kcucbc,RegardedQt314,i dont know for sure but id imagine nothing is completely ruled out for future developments,2,1746208455.0,2025-05-02 17:54:15
1kckuc9,TheGDC33,The greater our individual output and onboarding new people the faster the next move happens,23,1746137108.0,2025-05-01 22:05:08
1kckuc9,SpeakerClassic4418,"Kendu community is building to last.  It's the one to buy and hold, to anyone who doesn't know our community, join up in the TG and start learning.",19,1746145418.0,2025-05-02 00:23:38
1kckuc9,KenduGNX,"Kendu stands out from the crowd. The all organic approach may not look as exciting when other coins seem to be pumping, but it’s the slow, steady building of a rock solid base that will propel this project to the multi-billions. Don’t sleep on Kendu.",17,1746145240.0,2025-05-02 00:20:40
1kckuc9,MFSkunk17,So close to breaking 18k holders! Trending on Dextools right now too,14,1746145476.0,2025-05-02 00:24:36
1kckuc9,Expert-Detective-525,"Slow burn is always better, the faster they grow the faster they fall",12,1746145518.0,2025-05-02 00:25:18
1kckuc9,EmptyCockroach7955,KENDU IS COMMUNITY,3,1746190727.0,2025-05-02 12:58:47
1kckuc9,CHARLIEFORTHEBOYS,Hard times for memes and community coins right now. Very few will make it. KENDU will!!!  https://preview.redd.it/zdwet7bs8fye1.jpeg?width=1236&format=pjpg&auto=webp&s=5f2fc6a484df328550084cb6c498f26b5fd80756,1,1746214684.0,2025-05-02 19:38:04
1kck24e,phi_curious,You kendu it,6,1746139411.0,2025-05-01 22:43:31
1kck24e,RegardedQt314,You kendu it,5,1746139839.0,2025-05-01 22:50:39
1kck24e,lennart1418,Yoi kendu it,3,1746157736.0,2025-05-02 03:48:56
1kcjx88,Doltnummer,BUY $KENDU NOW ON THIS CA BELOW      ETH: 0xaa95f26e30001251fb905d264Aa7b00eE9dF6C18  SOL: 2nnrviYJRLcf2bXAxpKTRXzccoDbwaP4vzuGUG75Jo45  BASE: 0xef73611F98DA6E57e0776317957af61B59E09Ed7,15,1746134287.0,2025-05-01 21:18:07
1kcjx88,howtotechsimplified,$KENDU WILL SENDU. 🤝,16,1746134328.0,2025-05-01 21:18:48
1kcjx88,BunchFinancial943,![gif](giphy|26BRED0APH6fRa1sk)  Hodl!!,9,1746134820.0,2025-05-01 21:27:00
1kcjx88,Medical-Employ-5069,eth isn't moving yet,6,1746142275.0,2025-05-01 23:31:15
1kcjx88,Enough_District2129,small bag holder here. been holding for almost a year. hoping we boom soon so we can all retire and rest.,4,1746169077.0,2025-05-02 06:57:57
1kcjx88,EmptyCockroach7955,KENDU WILL SENDU HARDDD,4,1746176838.0,2025-05-02 09:07:18
1kcjx88,Doltnummer,SENDU WILL $KENDU xD,12,1746134578.0,2025-05-01 21:22:58
1kcjx88,TheGDC33,https://preview.redd.it/p8cbi4lyu8ye1.jpeg?width=853&format=pjpg&auto=webp&s=1e11750da8bf63aba1ef571e30a862c392c919fc,9,1746137391.0,2025-05-01 22:09:51
