post_id,author,body,score,created_utc,date
1jz91k5,RegardedQt314,yes she's written two articles i believe so far   1st one:  https://x.com/clarissayorke/status/1844709909230707141  2nd one (the one you are referring to): https://x.com/clarissayorke/status/1904898153087631382,21,1744662481.0,2025-04-14 20:28:01
1jz91k5,BEA312,Hell of a good article. Well written and informative on both. Also both articles have well over 200k+ views. If half those took advantage and jumped in deet first that would be awesome. Plus maybe some of the people in Miami took notice. I'm in Florida but unable to make it to any of the events that have been going on. Get one in northern Florida and I would be there for sure,4,1744674665.0,2025-04-14 23:51:05
1jz91k5,NoArrival5732,Thanks!,12,1744665363.0,2025-04-14 21:16:03
1jz91k5,boathouse_floats,Got any festival ideas?,1,1744924127.0,2025-04-17 21:08:47
1jz91k5,RegardedQt314,no problemo,10,1744665663.0,2025-04-14 21:21:03
1jz66nq,Vegas_42,Many more people buying than selling?,19,1744655842.0,2025-04-14 18:37:22
1jz66nq,RegardedQt314,"hard to say what specific catalyst will spark a bull run or if it's just a culmination of favorable conditions.  there's plenty of speculation but nobody truly knows imo.    when it comes to ensuring that Kendu takes full advantage when a bull run does happen though, it's up to us as community members to make it so.  we have to continuously build new things for the project and spread awareness as far and as wide as we possibly can so when the general interest in memecoins spikes, Kendu will be the first project people think of.  that's why it's important that we keep our foot on the gas even as the market continues to chop sideways because you never really know when things can start to get crazy.",20,1744661136.0,2025-04-14 20:05:36
1jz66nq,Imbetow,Whales,10,1744655885.0,2025-04-14 18:38:05
1jz66nq,TheGDC33,Market sentiment and human psychological factors really co mingle to create the perfect storm! Kendu,7,1744668753.0,2025-04-14 22:12:33
1jz66nq,BEA312,"I was looking at all of the merchandise you can get. Saw several sites selling clothing, others the energy drink. I want a shirt that says Kendu made me a millionaire. Won't be true just yet but it should get some attention",5,1744674264.0,2025-04-14 23:44:24
1jz66nq,tokenKDN,"Regardless of that spark, Kendu is uniquely positioned to be a front runner in the upcoming wave",2,1744680160.0,2025-04-15 01:22:40
1jz66nq,TheGDC33,This Chad knows! Can't stop won't stop.,11,1744668718.0,2025-04-14 22:11:58
1jz66nq,tokenKDN,Better get one now before it happens later in the year and they are sold out,6,1744680206.0,2025-04-15 01:23:26
1jz66nq,BonesSB,"How is Kendu uniquely suited? How does it stand apart from other coins and projects? Why Kendu and not ADA? ADA is certainly uniquely suited due to the crypto reserve. (I’m not asking anyone to take a stance either way on the crypto reserve, I’m just mentioning its existence.)  I’m asking this as a firm believer and 100mm Kendu club. ",2,1745363428.0,2025-04-22 23:10:28
1jz66nq,RegardedQt314,![gif](giphy|xfR4J1y61nDnW),6,1744672528.0,2025-04-14 23:15:28
1jz66nq,tokenKDN,"An excellent and welcomed question. The answer is in the community, the IRL presence and the branding. During the tougher marker conditions an immense amount of work has been delivered by community members which have propelled Kendu off a screen and into the realms of an IRL brand, with countless products and initiatives being developed each week. This makes Kendu stand apart as it is becoming less of a ""meme"" and more of a brand (in my opinion). Which is why I believe decabills await.",1,1745467046.0,2025-04-24 03:57:26
1jz66nq,TheGDC33,♥️👊,6,1744676430.0,2025-04-15 00:20:30
1jz0eaa,RegardedQt314,done   https://preview.redd.it/2mfpc6rczuue1.png?width=706&format=png&auto=webp&s=abba0475d2594d230b4f1a684f171b253a6dc2e9,3,1744661833.0,2025-04-14 20:17:13
1jz0eaa,StayingInWindoge,Huge! Every vote counts!,2,1746553179.0,2025-05-06 17:39:39
1jz02g5,pepinho420,Kendu looks godly here,26,1744643592.0,2025-04-14 15:13:12
1jz02g5,Hot-Raspberry2758,"Well said. If you want a strong community-based project that's helping define the next generation of memecoins/crypto through their irl projects, then Kendu if for you. Strong support and even stronger  outlook for becoming the best play for this cycle ❤️  DYOR",22,1744644363.0,2025-04-14 15:26:03
1jz02g5,Ninos_9,Well said brother.. Kendu will dominate 💯🫡,20,1744656523.0,2025-04-14 18:48:43
1jz02g5,howtotechsimplified,"Awesome post Lorniko! 🔥  KENDU has a living community backing it, we will succeed.   $KENDU WILL SENDU. 🦊🪖",18,1744650762.0,2025-04-14 17:12:42
1jz02g5,HamsterDunce,Very well said!,17,1744652425.0,2025-04-14 17:40:25
1jz02g5,Tortich70,Perfect summary and very good arguments to believe in $Kendu. $Kendu has so many chances to become very successful ! Thank You for Your work !,15,1744654882.0,2025-04-14 18:21:22
1jz02g5,Swimming-Horse3325,I love kendu community work ethics,16,1744663812.0,2025-04-14 20:50:12
1jz02g5,L3nni8,"I urge each and one of you to really go out in the world, or even go in your contact list and tell every single one of them about kendu. If we were all to do this. Guess what, not even 1 month and we would be in the billions. If you are scared to do it... you will probably get pretty rich by doing it. why would you even care afterwards, youre rich now! This post gives you the exact blueprint on what to do and what not. What are you waiting for?",16,1744664079.0,2025-04-14 20:54:39
1jz02g5,Lalph-Rauren,The IRL presence of KENDU is unmatched. We can’t stop and won’t stop.  We are building up to a very very big breakout. Heads will turn. 🔥,15,1744663447.0,2025-04-14 20:44:07
1jz02g5,CryptoDinlo,What a write up 👏  What a Legend 💪  $KENDU is family  and together we KENDU anything  https://preview.redd.it/sbg1v3ib5vue1.jpeg?width=832&format=pjpg&auto=webp&s=c0817de3a41d63196157ae3edec96f052c6c9b15,14,1744663836.0,2025-04-14 20:50:36
1jz02g5,trifle_hat,Really great advice here. Thank you,12,1744664410.0,2025-04-14 21:00:10
1jz02g5,RegardedQt314,"really informative post lorniko!   honestly most people become interested in the potential that something like Kendu has pretty much right off the bat.  it really doesn't take too much convincing most of the time.    the most common trouble that i find is the actual nature of buying the coin.  my crowd is not exactly crypto centered so I usually have to help them buy in but once you're familiar with it, it really is no problem.  i also prefer it this way so i can explain the speculative nature of crypto and teach them about scams and other safety related things to keep in mind as holders!",10,1744664502.0,2025-04-14 21:01:42
1jz02g5,KenduGNX,"This is an epic post, Lorniko. People like you are one of the many reasons Kendu will dominate. Glad to be here with you all!",10,1744664872.0,2025-04-14 21:07:52
1jz02g5,Expert-Detective-525,"Great post Lorniko!!   I think you are spot on about community values. A community is what defines a memecoin, this has been proven time and time again. We need to bring trust back into crypto and Kendu does that, we operate in an entirely organic manner, so any success has been created by the community. With our catalogue of IRL alpha we really are doing more than the utility projects!!!  Kendu has such good distribution and with no ""team"", we are very well balanced and the risk is spread.  Unfortunately with trust being at an all time low, it is very good to see Kendu have IRL alpha to give some substance behind the project!!!",9,1744666338.0,2025-04-14 21:32:18
1jz02g5,GlitteringCaptain585,Very nice read and agree with you. Community is really strong and cohesive.,9,1744665784.0,2025-04-14 21:23:04
1jz02g5,Expert-Detective-525,"Just incase everyone doesn't know, we have a telegram group which has 10k members and is a lot busier than this. We recommend it to everyone, if however you don't like telegram for whatever reason, this is FINE as all news will be delivered here : )  Glad to have yous chads/chadettes  YOU KENDU IT",8,1744667823.0,2025-04-14 21:57:03
1jz02g5,JeWo84,"$KENDU is community, $KENDU is a cult, $KENDU is everywhere, $KENDU is overtaking DeFi, $KENDU is primed, $KENDU is going to Billions  study this!",3,1744715419.0,2025-04-15 11:10:19
1jz02g5,EmptyCockroach7955,KENDU SENDU🚀🚀🚀🚀,3,1744800944.0,2025-04-16 10:55:44
1jz02g5,EmptyCockroach7955,Ngl KENDU is unmatched,3,1744808116.0,2025-04-16 12:55:16
1jz02g5,EmptyCockroach7955,Ngl KENDU is unmatched,2,1744808099.0,2025-04-16 12:54:59
1jz02g5,EmptyCockroach7955,Ngl KENDU is unmatched,2,1744808104.0,2025-04-16 12:55:04
1jz02g5,Typical_Coconut5358,Crypto as a whole is a scam,2,1744668351.0,2025-04-14 22:05:51
1jz02g5,DopestSophist,Imaginary interlocutor: memecoins are scams and rug pulls!  OP: let me show you a coin that lost 96% of value.  Strong community!  Imaginary interlocutor: bruh.,1,1744940222.0,2025-04-18 01:37:02
1jz02g5,howtotechsimplified,"Ready to moon.  The wallet distribution is insane!! When we will shoot, we will shoot haaaard!!",19,1744663325.0,2025-04-14 20:42:05
1jz02g5,Expert-Detective-525,Its pretty insane tbh. I am very grateful for the recent prices. I KEEP STACKING,9,1744667424.0,2025-04-14 21:50:24
1jz02g5,Expert-Detective-525,"ALWAYS DYOR, thanks for mentioning that  I think we will set a new standard for which a meme should aim to hit. There hasn't been anyone like Kendu, EVER. Our IRL presence is unmatched and lets not forget our online strength!   We hit 50k certik upvotes, the only other coin to do that was Pepe",9,1744667739.0,2025-04-14 21:55:39
1jz02g5,Expert-Detective-525,No doubt in my mind chad!! How long you been in Kendu,11,1744667388.0,2025-04-14 21:49:48
1jz02g5,Lalph-Rauren,Yessir. 🤝  Let’s gooooo 🚀,16,1744663480.0,2025-04-14 20:44:40
1jz02g5,Expert-Detective-525,KENDU SENDUUUU,9,1744667596.0,2025-04-14 21:53:16
1jz02g5,Expert-Detective-525,"btw this chad has youtube videos on how to buy Kendu. So if you're not too tech savvy or new to this, check out howtotechsimplified",8,1744667629.0,2025-04-14 21:53:49
1jz02g5,Expert-Detective-525,I agree this is a great post by Lorniko. I hope to see more of them. Tomorrow it will be posted to other subreddits so make sure to stay tuned : ),7,1744667527.0,2025-04-14 21:52:07
1jz02g5,Expert-Detective-525,I think so too. How long have you been a holder?   I really think Kendu will get to the deca-billions!,6,1744667493.0,2025-04-14 21:51:33
1jz02g5,Expert-Detective-525,same chad. Never forget that community is everything,8,1744666461.0,2025-04-14 21:34:21
1jz02g5,Expert-Detective-525,Yep and your friends or family will get rich. This is a win-win scenario. It will be lonely at the top without friends and family so why not get them in. They will appreciate it and you can give a better life to the people you love,7,1744667334.0,2025-04-14 21:48:54
1jz02g5,Lurking_presence,That alone makes it special. I've never seen any other crypto project with merchandise like Kendu has. ,14,1744664115.0,2025-04-14 20:55:15
1jz02g5,Expert-Detective-525,"For sure, we are unfadeable and will only be faded for so long!",6,1744667457.0,2025-04-14 21:50:57
1jz02g5,Expert-Detective-525,KENDU\_IS\_COMMUNITY  I have never seen a community like this ever. We really are going to the top and can't be stopped. Chads/Chadettes working day and night grinding for Kendu!!  I am so proud to be apart of this community,7,1744666661.0,2025-04-14 21:37:41
1jz02g5,Expert-Detective-525,Very innovative post,6,1744666592.0,2025-04-14 21:36:32
1jz02g5,Expert-Detective-525,A lot of my mates aren't crypto people so unfortunately Kendu not being on Coinbase or whatever has been holding them back from buying. This obviously all will change but they won't get the same return potential,8,1744666574.0,2025-04-14 21:36:14
1jz02g5,Expert-Detective-525,Lorniko is a super chad. Very happy to be appear on his space earlier,9,1744666505.0,2025-04-14 21:35:05
1jz02g5,Expert-Detective-525,We are the best community in crypto at the moment. KOL coins are all hype and WILL NOT last,9,1744666484.0,2025-04-14 21:34:44
1jz02g5,Lurking_presence,I was reluctant to download and use Telegram at first but I can say that I'm glad that I did and that the Kendu group is so warm and welcoming. It is lively and busy but it is nice to feel like there's light and life there. ,8,1744669047.0,2025-04-14 22:17:27
1jz02g5,RegardedQt314,did you even read the post :p,4,1744672359.0,2025-04-14 23:12:39
1jz02g5,Expert-Detective-525,To where? Past ATH,10,1744667440.0,2025-04-14 21:50:40
1jz02g5,Ninos_9,Since June of last year (24).. holding strong till we get to billions in mc!,10,1744668025.0,2025-04-14 22:00:25
1jz02g5,Tortich70,I‘m in Kendu since the middle of last year.,7,1744671167.0,2025-04-14 22:52:47
1jz02g5,Expert-Detective-525,IRL alpha is unmatched and has never ever been seen before and I think it will make such a difference since trust is very low in crypto atm,7,1744667363.0,2025-04-14 21:49:23
1jz02g5,RegardedQt314,"definitely get that, i literally had to sit down with each person and explain the process to them lol. but its so worth it to get them in this early!",6,1744667380.0,2025-04-14 21:49:40
1jz02g5,Typical_Coconut5358,"Read enough to say it 100% scam including this post , even tho I got a bag of Kendu . It’s how the game is played",2,1744677629.0,2025-04-15 00:40:29
1jz02g5,Expert-Detective-525,Great to hear. I also joined June last year!!!,8,1744668749.0,2025-04-14 22:12:29
1jz02g5,Expert-Detective-525,"Class, I have been here since late June. Hope to see you at the 1 billion party in Dubai!",8,1744671392.0,2025-04-14 22:56:32
1jz02g5,Expert-Detective-525,for sure. I managed to get my Dad in and a mate in!,7,1744667877.0,2025-04-14 21:57:57
1jz02g5,RegardedQt314,"you are entitled to your own opinion even if it is misguided, but trying to frame your own investment as a scam is a little silly wouldn't you say?   if i were you i would just sit back and be thankful that the community is continuously building and working for the project and raising the value of not only their own investment but others as well, including yours.  it really won't be tolerated for long if this is all you plan to contribute.",3,1744679633.0,2025-04-15 01:13:53
1jz02g5,Tortich70,"Ooooh yeaaah, I definitely will be there!",8,1744671875.0,2025-04-14 23:04:35
1jz02g5,RegardedQt314,chad,6,1744672045.0,2025-04-14 23:07:25
1jz02g5,Typical_Coconut5358, I’m not framing or misguided. Apparently speaking the truth about the game as a whole  will not be tolerated.. I get it,1,1744738868.0,2025-04-15 17:41:08
1jz02g5,RegardedQt314,"the entire point of this post was to explain why not every memecoin is a scam.    correct me if im wrong, but you then went on to say this post is a 100% scam which implies you think Kendu is also a scam.  if saying that Kendu is a scam is the only thing you want to contribute to the project then obviously no your contributions are not really wanted. i figured that would be pretty self explanatory considering those words do nothing but hurt your own investment and everyone elses.",1,1744740068.0,2025-04-15 18:01:08
1jz02g5,Typical_Coconut5358,"Meant what I said . I’ll move along so your bag don’t get hurt , Personally it’s all fun and games for me",1,1744770193.0,2025-04-16 02:23:13
1jz02g5,RegardedQt314,we are both invested in this project ser.  we can have fun together 🫵🦊,2,1744773410.0,2025-04-16 03:16:50
1jyvr28,phi_curious,18k are edging us haha,4,1744627713.0,2025-04-14 10:48:33
1jyvr28,Vegas_42,We need to cut that Gordian knot by buying like hell and break through these 18k holders.,3,1744628695.0,2025-04-14 11:04:55
1jyvr28,TheGDC33,"Feels like forever, but it will come",1,1744646585.0,2025-04-14 16:03:05
1jyvr28,TheGDC33,Ahmen,1,1744646648.0,2025-04-14 16:04:08
1jyun2n,phi_curious,A little risky to hold that much ETH 😁,15,1744623294.0,2025-04-14 09:34:54
1jyun2n,Consistent-Bit-8445,I thought that was my wallet for a second! Kendu is the only coin I need aswell,5,1744640490.0,2025-04-14 14:21:30
1jyun2n,insegniah1,https://preview.redd.it/i7hthnr78zue1.jpeg?width=1170&format=pjpg&auto=webp&s=8321b06e75ab79fce2ebea42c32f4789af462864  Lol,2,1744713239.0,2025-04-15 10:33:59
