post_id,author,body,score,created_utc,date
1jan05c,Lalph-Rauren,Awesome work Ian!! Love the 24H recaps :),19,1741901475.0,2025-03-13 21:31:15
1jan05c,boathouse_floats,These are awesome now...I can't imagine what they will look like in 6 months too! Thank you for putting this together!     I am bullish on Kendu!,17,1741901884.0,2025-03-13 21:38:04
1jan05c,Hot-Raspberry2758,I lover reading these. Keeps the energy up!,15,1741902163.0,2025-03-13 21:42:43
1jan05c,phi_curious,"Ian any possibility you can make some sort of a “streak” not sure how it would work, but something that motivates people basically to be active more every day.",12,1741902784.0,2025-03-13 21:53:04
1jan05c,phi_curious,"Also should add, absolutely love the summaries 🧡",9,1741902809.0,2025-03-13 21:53:29
1jan05c,lazargwf,Those recaps are awesome. Great everyday read 🦊🪖,9,1741904601.0,2025-03-13 22:23:21
1jan05c,tokenKDN,Every day is just relentless energy and we grow our foundations even stronger for when we take off. With all this prep work we are all doing in this market not only we will fly to the moon but we will have the foundations to stay there - KEY factor which is sometimes overlooked.,7,1741912639.0,2025-03-14 00:37:19
1jan05c,ProgramLow8782,great post,8,1741913048.0,2025-03-14 00:44:08
1jan05c,insegniah1,Love this chad,2,1741940149.0,2025-03-14 08:15:49
1jan05c,UrbanPKMonkey,Thank you!! 🙏🏻,11,1741908303.0,2025-03-13 23:25:03
1jan05c,phi_curious,Just thinking how the energy was during the CTO. Damn this will look hot 🥵,14,1741902850.0,2025-03-13 21:54:10
1jan05c,UrbanPKMonkey,Going to look incredible I’m sure 🔥,8,1741908328.0,2025-03-13 23:25:28
1jan05c,UrbanPKMonkey,Always keeping up the vibes! 🤜🏻🤛🏻,10,1741908421.0,2025-03-13 23:27:01
1jan05c,UrbanPKMonkey,Damn! I can try bro!,7,1741908649.0,2025-03-13 23:30:49
1jan05c,UrbanPKMonkey,Hope to make them better over time. Glad you like them ❤️,7,1741908684.0,2025-03-13 23:31:24
1jan05c,phi_curious,"that is spot on, right now is the time to build up the things that will become essential later on. and that is exactly what we are doing.",4,1741939976.0,2025-03-14 08:12:56
1jan05c,phi_curious,second that,7,1741939984.0,2025-03-14 08:13:04
1jan05c,phi_curious,I double down on that. thank you for this awesome work,6,1741939929.0,2025-03-14 08:12:09
1jan05c,UrbanPKMonkey,You know I might pull some historic data out just to have a look 👀,7,1741908377.0,2025-03-13 23:26:17
1jan05c,phi_curious,what would you wanna improve?,4,1741939997.0,2025-03-14 08:13:17
1jan05c,phi_curious,That would be really interesting. And also could be motivational. Don’t know anything about how hard the data processing is. But do you think one could correlate the MC with activity? Because we all feel how the heat turns up when the charts get a bit of green. Would be cool to see.,8,1741908586.0,2025-03-13 23:29:46
1jan05c,UrbanPKMonkey,For now I want to improve the summaries to make sure it captures the conversations properly. There is a lot of GPT prompt work still to do,2,1741942022.0,2025-03-14 08:47:02
1jan05c,UrbanPKMonkey,Yeah DM me in the TG and we can try and work out a few dates I can try,6,1741908762.0,2025-03-13 23:32:42
1jan05c,phi_curious,That’s pretty cool! I was also curious how all of that works :) well hope you have fun doing all of that!,2,1741943614.0,2025-03-14 09:13:34
1jan05c,phi_curious,"Sounds good I’ll dm you some later :) is there any time restraint? Or can it go as far back as the creation of the TG? And sorry that I have been throwing so many different ideas towards you, you gotta filter what makes sense and what is absolutely rubbish haha",6,1741935976.0,2025-03-14 07:06:16
1ja9uyy,13557126,Steps in the right direction,6,1741879146.0,2025-03-13 15:19:06
1ja9uyy,bigboydesomo,LFG KENDU,6,1741879619.0,2025-03-13 15:26:59
1ja9uyy,tokenKDN,As each day passes the foundations get stronger - when we pump (and we will) we have such solid grounding to stay there.,3,1741914154.0,2025-03-14 01:02:34
1ja9uyy,Bobby_Beijing,We need a rise,3,1741939294.0,2025-03-14 08:01:34
1ja9uyy,New_Championship9772,"https://preview.redd.it/y3sxw7jbumoe1.png?width=1880&format=png&auto=webp&s=8a32bbe7c689df8b6c2f8273a1c5e5572b462c71  Why does my holder count look look significantly lower at 16,672?",2,1741948244.0,2025-03-14 10:30:44
1ja9uyy,TheGDC33,For sure. For now excited to see volume increase and holders keep going up consistently. Think the holder dip is over,2,1741917426.0,2025-03-14 01:57:06
1ja9uyy,TheGDC33,Check out my new one. Holders are growing consistently now I would say...see what the weekend brings,2,1741952316.0,2025-03-14 11:38:36
1ja9uyy,TheGDC33,https://preview.redd.it/342k9vv77noe1.png?width=704&format=png&auto=webp&s=5f3f4272994077295b9a739806a7bffec029417d  Above is your answer (I do holders for all three chains). Just be aware that for some reason I found DexScreener usually inflates the amount of holders which is confirmed on Etherscan often (best and most accurate numbers for ETH).  Love to see people checking this themselves and asking questions,2,1741952531.0,2025-03-14 11:42:11
1ja7g2w,Expert-Detective-525,Thanks for all your hard work!,8,1741855293.0,2025-03-13 08:41:33
