post_id,author,body,score,created_utc,date
1i7zf1z,[deleted],"Yeah, Im not great with images and computers.. 🤦‍♂️ didnt know if there was a already a simple image I could copy and paste and upload along with my comments",6,1737642102.0,2025-01-23 14:21:42
1i7zf1z,bigboydesomo,Ww are now cancer free and it s ony the beginning so ape in  now and cash out later.    Kendu is king,8,1737640760.0,2025-01-23 13:59:20
1i7zf1z,Scary-Bed-1235,The threads idea is actually really good.  Awesome write up 👍.,8,1737645495.0,2025-01-23 15:18:15
1i7zf1z,cridanka,I need major whales to sell off one last time for a sale,10,1737628687.0,2025-01-23 10:38:07
1i7zf1z,L3nni8,No you need to work,14,1737630236.0,2025-01-23 11:03:56
1i7zf1z,cridanka,I do work..but why would i not want cheaper kendu 🤓,11,1737630302.0,2025-01-23 11:05:02
1i7zf1z,phi_curious,"I feel you. On one hand it would be nice to dip in again at lower levels, on the other hand I don’t know if my heart could take another dip to 5ish million 😂😅 maybe consider to DCA into more Kendu?",10,1737634661.0,2025-01-23 12:17:41
1i7zf1z,[deleted],Buy now. The whales are coming back. Trust me. Whale activity up and it is going to catapult Kendu.,11,1737638357.0,2025-01-23 13:19:17
1i7zf1z,phi_curious,"I aped in at 7m. Just saying if someone isn’t sure, DCA is always a good strategy. I for sure would make a purchase today in any case.",10,1737638455.0,2025-01-23 13:20:55
1i7zf1z,[deleted],"I wanted to get in so badly back theb, but I didnt know if KM was going to linger. As soon as I knew he was gone gone, I got back in. 3-4x higher than that low, but Im still super confident.  Still jealous though. Nice timing. We're holding strong.  We got a some whales helping us out with some nice volume. Love seeing it :)",10,1737638790.0,2025-01-23 13:26:30
1i7zf1z,phi_curious,Volume looks indeed very sexy 😏,6,1737642877.0,2025-01-23 14:34:37
1i7zf1z,[deleted],[deleted],1,1737630420.0,2025-01-23 11:07:00
1i7zf1z,cridanka,Sir/miss some of us cant just spend money whenever we want to unfortunately even for kendu … sorry if thats not a common thought,4,1737630637.0,2025-01-23 11:10:37
1i7zf1z,[deleted],[deleted],1,1737630786.0,2025-01-23 11:13:06
1i7zf1z,cridanka,Bro no one is disagreeing with you saying its not good enough to buy. I just could not spend the money on monday as I needed it for something important. What are you not getting? I agree that its excellent to buy but I literally couldn’t spend it. No one said its going down forever all i said i would like another sale like that as a joke… what is your issue,2,1737631004.0,2025-01-23 11:16:44
1i7zf1z,insegniah1,"Absolutely!  Need to push this far and wide.  Utilise your unique networks, skills and interests to push Kendu in every single way possible.  How quickly Kendu becomes global is entirely dependent on all of us",4,1737668968.0,2025-01-23 21:49:28
1i83hsi,Typical_Coconut5358,Only you can make that’s decision. Do what’s needed,18,1737640163.0,2025-01-23 13:49:23
1i83hsi,SeeingTrends13,"Sell a few things online (FB marketplace for example). Since you’re in school, perhaps you can start tutoring a few people to earn some money? I know that is work, but it at least aligns with your education goals.",18,1737640309.0,2025-01-23 13:51:49
1i83hsi,Confident_Mix_6141,Appreciate this comment actually do have a few things lying around,17,1737640582.0,2025-01-23 13:56:22
1i83hsi,kingkongbananakong,This is what I did a few years ago when I didn’t have a job made 6k eventually in a year reselling video games. If you have a niche you have knowledge about you can do it too,7,1737643309.0,2025-01-23 14:41:49
1i83hsi,_brap_,"If it isn’t too much of a hassle, check fb marketplace for free items that you might be able to flip for a profit.   Or shovel some snowed in driveways for a quick buck.  Sell some old stuff you don’t need anymore.  Borrow some money",15,1737641035.0,2025-01-23 14:03:55
1i83hsi,[deleted],"Wait until Friday. Idk if you guys have the feeling, but I dont think Kendu is going back down to this level again. Its a strong feeling.",11,1737644277.0,2025-01-23 14:57:57
1i83hsi,BTCBette,I like this feeling,3,1737659479.0,2025-01-23 19:11:19
1i83hsi,SpeakerClassic4418,You need to explore all options available to you and decide what is best.   I know that's not an answer but it is the truth since none of us know the options or stress this is causing for you.    Best of luck!,9,1737640792.0,2025-01-23 13:59:52
1i83hsi,StarkReactor4,"If you have a reliable car, do gig work like Uber eats or door dash or insta cart, etc",10,1737643070.0,2025-01-23 14:37:50
1i83hsi,Dougdummy,"I wouldn’t sell. Selling at a loss seems silly considering the upside potential. Pretend your bag doesn’t exist and figure it out from there. Many of us have been exactly where you are, it makes men out of boys to discover our problem solving abilities.",10,1737643951.0,2025-01-23 14:52:31
1i83hsi,Equal-Character-8120,"If you have your own place, you could rent it to a fellow student. ",6,1737642018.0,2025-01-23 14:20:18
1i83hsi,HumblestofBears,"Hustlers never starve. School is very important, but if you have only $2 in the bank, school will still be there when you have more cash on hand. Work first. School try again later. Seriously. I cannot stress enough how unless you have family to lean on, having $2 in the bank is actually the greatest crisis you're going to face and school can wait until the crisis passes.",5,1737648765.0,2025-01-23 16:12:45
1i83hsi,Lalph-Rauren,"I don’t know where you are from, but try selling some unused clothes on Vinted! Works really well :)",3,1737654796.0,2025-01-23 17:53:16
1i83hsi,Neither_Shirt1606,I have been able to earn some money working on outlier.ai,2,1737654615.0,2025-01-23 17:50:15
1i83hsi,Honest-Dust9832,HODL,2,1737661469.0,2025-01-23 19:44:29
1i83hsi,Leafan1976,Take a 500 portion and try to flip that into more. Use a trading bot and 10x that,-4,1737643827.0,2025-01-23 14:50:27
1i83hsi,LiiQuiD0,We dont gamble bro we work,4,1737655051.0,2025-01-23 17:57:31
1i83sf1,Little_Musician_5060,Just post the link here and we gonna raid it,7,1737646410.0,2025-01-23 15:33:30
1i83sf1,Equal-Character-8120,https://www.reddit.com/r/CryptoMoonShots/comments/1i83olm/this_underdog_story_will_be_huge_in_crypto_this/,3,1737646832.0,2025-01-23 15:40:32
1i82p38,CryptoChrisVibe,Smash!,4,1737649023.0,2025-01-23 16:17:03
1i82p38,W-D-Goldbeard,Done 'nd done ✔️   Me Pirate votes be in 'nd comments left 🫡  Tis a great feeling to be back at work with me beloved $KENDU crew. To 💯 Billion we go!   🐶📈💰,3,1737668473.0,2025-01-23 21:41:13
1i82p38,fuccckoffffff1com2u,Kendu ARMY !,3,1737708746.0,2025-01-24 08:52:26
1i83drb,Equal-Character-8120,Well done. 🪖,6,1737645599.0,2025-01-23 15:19:59
1i83drb,insegniah1,"Awesome work, keep it up!",3,1737668857.0,2025-01-23 21:47:37
1i7xtq8,North-Town4883,We werk we build    Now that's got a nice ring to it    Guess I'm off to get THREADs 🤪 ,24,1737620065.0,2025-01-23 08:14:25
1i7xtq8,phi_curious,I’ll look into doing the same later today 😂,13,1737627108.0,2025-01-23 10:11:48
1i7xtq8,North-Town4883,I need a whole new $KENDU phone    Brother ,5,1737647395.0,2025-01-23 15:49:55
1i7xtq8,phi_curious,Feels relatable haha,6,1737647438.0,2025-01-23 15:50:38
1i7xtq8,Vegas_42,"Allright Josh, on it!",22,1737620654.0,2025-01-23 08:24:14
1i7xtq8,CoopVelociraptor,"Larger investors indexing were already out because of the projected pattern (there’s a reason I expected everything to be red this month). I’m grabbing lunch with a few people when I get home after the SuperBowl and hopefully I can get them on board with this now being a community-driven investment.  Been a while since I hit a bar and bought drinks for everyone holding Kendu… not really any good bars around here but I’ll get back onto that quest when I get home.  I’ll get amongst Threads, but my last glance said it was full of neck-bearded XRP dads 😂 Funny story, I was so popular in school that only this guy named Tom ever added me on MySpace. This scary alt girl made me add her on bebo tho… yeah actually ima go reconnect with her.  We’ve got work to do Chads, there’s no other group in history I’d rather be in the trenches with! 🫡",14,1737634480.0,2025-01-23 12:14:40
1i7xtq8,cryptosader,"xrp boomers are the best target audience imo , they got connections and being all in xrp they are not really in touch with memecoins or the crypto market in general so im confident they will be easily swayed into diversifying a bit , 1 blue chip coin (xrp) and a meme/moonshot coin (kendu) would be a cool strategy to them if the idea is sold correctly to them",5,1737636128.0,2025-01-23 12:42:08
1i7xtq8,CoopVelociraptor,"Maybe, my experience with them is they aren’t in-touch because they don’t usually take memecoins seriously at all though.   To your point, a strat can be well-explained. I personally find that sell more worthwhile to a legitimate investor, fellow crypto degen or stranger at a bar than my IRL uncle or a bunch of weirdly emotional guys on the internet 😂",8,1737637675.0,2025-01-23 13:07:55
1i7xtq8,cryptosader,"true but we need to try , even if we manage to get a just couple of them to join us its a W in my books lol",6,1737638458.0,2025-01-23 13:20:58
1i7xtq8,CoopVelociraptor,"Agreed, dubs are dubs 😮‍💨",5,1737639108.0,2025-01-23 13:31:48
1i7xtq8,bigboydesomo,Lets get on threads,10,1737630345.0,2025-01-23 11:05:45
1i7xtq8,phi_curious,"Thanks for the info champ. I’m a social media noob for the most part, since you mention threads, whatabout other platforms that gained significant traction recently?  I have no idea how crypto and in particular meme coins are perceived in those, so just throwing out names: bluesky, nostr, rednote/XHS?",13,1737626455.0,2025-01-23 10:00:55
1i7xtq8,cryptosader,"i don't think the userbase of bluesky is too fond of crypto in general tbh, rednote/xhs is a gold mine ready to get explored though because the chinese are notorious big pocketed whales , we need a chinese community asap(including weibo and other chinese socials) south koreans are also big crypto lovers/spenders to thats a good market to spread too",7,1737635942.0,2025-01-23 12:39:02
1i7xtq8,phi_curious,"That was my thought too about bluesky, without ever having been on the platform. Not sure if I know anybody in the chinese crypto space. But yes, agreed we need a strong presence in those other markets. Do you know if there is a chinese kendu inu telegram?",3,1737636111.0,2025-01-23 12:41:51
1i7xtq8,cryptosader,"no i dont know sorry , but the people don't necessarily need to be chinese at first just need to have good knowledge of chinese language so to help us spread into the chinese spaces and recruit as many people as possible",5,1737636480.0,2025-01-23 12:48:00
1i7xtq8,phi_curious,"That makes sense. I have one friend who is active in the chinese crypto space, but she is hardcore bitcoin maxi haha. I’ll talk to her anyways, maybe I can get some valuable insights.",3,1737637623.0,2025-01-23 13:07:03
1i7xtq8,cryptosader,wont hurt to try haha. hopefully you can convince her to at least help us to spread the word,3,1737638318.0,2025-01-23 13:18:38
1i7xtq8,phi_curious,"Yes, shooting our shots haha",3,1737638476.0,2025-01-23 13:21:16
1i7xtq8,Putrid_Scallion_5236,On the Threads thing!,4,1737636876.0,2025-01-23 12:54:36
1i7zglh,platniumperson,Good idea!  I’ll introduce a program like that for Kendu Gum: send USDT to the treasury. I think 5% would be the magic number.,13,1737623949.0,2025-01-23 09:19:09
1i7zglh,JeWo84,"the more, the better I just didn‘t want to ask for too much. 5% on a box of Kendu Energy would be €2,15 which might be too much for some",11,1737624075.0,2025-01-23 09:21:15
1i7zglh,platniumperson,I think it should be included in the price.,10,1737624112.0,2025-01-23 09:21:52
1i7zglh,JeWo84,"sure, can be included, but it should be clearly mentioned  like „5% of your purchase will go to the treasury / community wallet“",10,1737624322.0,2025-01-23 09:25:22
1i7zglh,platniumperson,Yes,8,1737624358.0,2025-01-23 09:25:58
1i7zglh,JeWo84,"on a lower priced item, like Kendu Gum 5% might make more sense though",7,1737624102.0,2025-01-23 09:21:42
1i7zglh,phi_curious,Love the idea as well! I have some distantly related idea about music. We could release all the songs that we have created (and will create) to spotify under one Kendu Inu artist. I have published songs before so it’s definitely feasible.  If we listen to those playlists hard our artist will get paid by spotify etc for every stream. This money will then be used to buy Kendu and go into community wallet.  Maybe someone will see this and have input? I’ll make a separate Reddit post later.,10,1737633559.0,2025-01-23 11:59:19
1i7zglh,JeWo84,nice idea as well!!,3,1737637401.0,2025-01-23 13:03:21
1i7zglh,phi_curious,"Thanks champ, I’ll make a separate post later.  A „workaround“ for your idea would be that people can „buy“ a discount code with Kendu/crypto, which is then directly sent to the community wallet. But obviously that’s in the hands of the people who make those branded products.",2,1737637797.0,2025-01-23 13:09:57
1i7zglh,Lalph-Rauren,Great idea 😎,6,1737633092.0,2025-01-23 11:51:32
1i7zglh,lazargwf,Great idea. Would love it! 🪖,4,1737634292.0,2025-01-23 12:11:32
1i7zglh,TheGDC33,Option b is my favorite,2,1737647504.0,2025-01-23 15:51:44
1i7zglh,tokenKDN,I agree - move it back into the community as the funds can be used for wider initiatives in future,1,1737682266.0,2025-01-24 01:31:06
1i7zglh,Hungry-Assistance-14,This is a fantastic idea!,1,1737702611.0,2025-01-24 07:10:11
1i7qzpx,cryptosader,"that 1800€ will turn into 200k€ before 2025 ends, trust.",50,1737593951.0,2025-01-23 00:59:11
1i7qzpx,ArmFine9867,"Might not be considered life-changing for most, but for me... thats a solid down-payment for a house. I am ready for it!",37,1737594233.0,2025-01-23 01:03:53
1i7qzpx,opsa01,I think that is life changing for most. Imagine getting debt free or reducing housing cost by half. That is so much breathing room for us. Hold strong friend.,25,1737599021.0,2025-01-23 02:23:41
1i7qzpx,dustinuniverse,"it's life changing for me, I could buy a decent house with that money (I live in 3rd world country)  My holding reached around that during ATH, but I've not even sold a single token cause I believe it could reach $1M+ this bull run.",11,1737615770.0,2025-01-23 07:02:50
1i7qzpx,PlentyF09,"You did the right thing by hodling, Chad. Your friends and family will be thanking you soon.",33,1737593911.0,2025-01-23 00:58:31
1i7qzpx,CHARLIEFORTHEBOYS,We had a very sticky situation with the dev who was scamming us and driving people and new money away  We have removed him and done a CTO  Vibes are the best they have been  HODL chad,54,1737593463.0,2025-01-23 00:51:03
1i7qzpx,ArmFine9867,"We shouldnt forget about the people that he brought in though - like myself. His Name was one of the green flags back when I did my DD. While I do see the benefits of him leaving, we should always remeber where we came from - at least thats my take on it.  I am just happy that the community is strong as ever and from here, sky is the Limit!  Helmets on Chads and Chadettes!",31,1737594090.0,2025-01-23 01:01:30
1i7qzpx,HumblestofBears,"His name was a total fabrication and bought for by bribing Shytoshi, allegedly…  You only lose if you sell.",3,1737657048.0,2025-01-23 18:30:48
1i7qzpx,[deleted],"Sometimes you get in at the wrong time and have to sit and wait. Sometimes, at that time, its money you can afford to lose and let sit. Then the time comes that you suddenly need it.  It happens. Hopefully youre able to sit and hold. It will come back. Kendu got delayed from glory for what felt like an eternity, but it will soon turn around.",38,1737593738.0,2025-01-23 00:55:38
1i7qzpx,[deleted],[deleted],0,1737611679.0,2025-01-23 05:54:39
1i7qzpx,[deleted],[deleted],1,1737617104.0,2025-01-23 07:25:04
1i7qzpx,[deleted],[deleted],1,1737617450.0,2025-01-23 07:30:50
1i7qzpx,[deleted],[deleted],0,1737618123.0,2025-01-23 07:42:03
1i7qzpx,[deleted],[deleted],1,1737618619.0,2025-01-23 07:50:19
1i7qzpx,ProfessionalNet5902,If you can DCA. Just buy some more for a lower market cap. It will drive your avarage price down and you will make profit way earlier. Let’s run it up!,15,1737612775.0,2025-01-23 06:12:55
1i7qzpx,TheGDC33,We keep working and there is nothing holding us back now and nothing that will sell massive amounts on green days and stifle progress. Yes people will take profits but it was pure chart suppression and felt impossible to beat and was damn near dperessing,26,1737593761.0,2025-01-23 00:56:01
1i7qzpx,[deleted],https://preview.redd.it/sr7yamv1lnee1.jpeg?width=1250&amp;format=pjpg&amp;auto=webp&amp;s=cada888932c056fd8aa6fd7b4d7b7363f2a36402  I believe in that little blip. That was where price suppression met its demise. The next few weeks are going to be very important. Kendu's CTO just has to prove itself to those who need to see it.  Im feeling optimistic!,16,1737598833.0,2025-01-23 02:20:33
1i7qzpx,TheGDC33,🪖,11,1737599381.0,2025-01-23 02:29:41
1i7qzpx,Manwithoutanyplan,"Lost? You haven't lost if you didn't sell. Our time will come, faster than you think.",11,1737623242.0,2025-01-23 09:07:22
1i7qzpx,LiiQuiD0,Conviction is key chad. Keep hodling,9,1737623108.0,2025-01-23 09:05:08
1i7qzpx,ShoutaDE,"Put in 600€ and lost 90% currently ~60€... so, yeah... No need to pull out now, but not a good feeling",4,1737624165.0,2025-01-23 09:22:45
1i7qzpx,BackgroundAd4640,I bought 17 milly Kendu for £3000 a good while ago. Then used 15 mill Kendu to mint 3 chads NFTs. Honestly I'm underwhelmed. Is there any update on what will happen with these NFTs?,3,1737631652.0,2025-01-23 11:27:32
1i7u2sk,Fit-Teaching9608,I can’t be the only one that read that in Cate Blanchette’s voice..,10,1737610310.0,2025-01-23 05:31:50
1i7u2sk,Vegas_42,No you're not.,8,1737613539.0,2025-01-23 06:25:39
1i7w8ir,zuken932,![gif](giphy|YYfEjWVqZ6NDG),6,1737610811.0,2025-01-23 05:40:11
1i7w8ir,W-D-Goldbeard,Me. Pirate vot be in 🫡🏴‍☠️,7,1737612910.0,2025-01-23 06:15:10
1i7w8ir,balatongadobo,Can we share this on tg community?,3,1737629148.0,2025-01-23 10:45:48
1i7w8ir,bigboydesomo,Sure,2,1737639056.0,2025-01-23 13:30:56
1i7w8ir,UrbanPKMonkey,Done on the daily! 🫡,2,1737620528.0,2025-01-23 08:22:08
1i7w8ir,Drainflowartist,Rock the vote!!,2,1737646754.0,2025-01-23 15:39:14
1i7w8ir,Vegas_42,Done,1,1737617521.0,2025-01-23 07:32:01
1i7w8ir,SeeingTrends13,🫡,1,1737637581.0,2025-01-23 13:06:21
1i7w8ir,Hot-Raspberry2758,5th place is 23 votes ahead!,1,1737785041.0,2025-01-25 06:04:01
1i7w8ir,Tryptamine_Mind,I’m sure the top ranked have found a way to cheat. They have a few dozen daily active users and hundreds of votes per day.  But i voted,1,1738007648.0,2025-01-27 19:54:08
1i7w66j,Potlimitcrypto,"You should know that you are and always will be ""the plan"". What you do, who you onboard and YOUR output are bigger than any CEX listings or events.  Those things are just tiny items in a token's journey.  We do not wait for the next thing in Kendu, we become it. There are tens of thousands of ways you can onboard people to Kendu, starting with the easiest, your network.  Instead of asking what the future holds, become the growth you want to see, and create the future you want to see. You have way more power and influence than you realise, all it takes is your activation.",1,1737619957.0,2025-01-23 08:12:37
1i7w66j,Vegas_42,"Welcome to KENDU! For the start, I recommend browsing the sub to get a first impression. Foremost, read the pinned posts. Then come back here, ask more questions and then join the telegram. This is not a passive investment, we all work for our bags. And regarding your question for a road map: it's not set in stone to avoid ""sell the news"" events. Last points were community spendings for Lbank and booster on different platforms in order to gain visibility. Does anyone has to add something?",15,1737617270.0,2025-01-23 07:27:50
1i7w66j,cerealOverdrive,Thanks for the reply! I’ll give the pointed posts and telegram a look 😊,11,1737617339.0,2025-01-23 07:28:59
1i7w66j,Vegas_42,You're welcome! And most important: have fun!,11,1737617501.0,2025-01-23 07:31:41
1i7w66j,Drainflowartist,Welcome aboard - we’re glad to have you!,8,1737646897.0,2025-01-23 15:41:37
1i7w66j,[deleted],"Welcome Chad. The future is heading in a great direction. The community is extremely active on telegram and X. Ensure you join the correct telegram and remember Kendu is on ETH and Sol. Double check all contract addresses. Helmets on and to the trenches, we still like crazy so we’d love for an extra hand.",6,1737657809.0,2025-01-23 18:43:29
1i7w66j,cridanka,1billion mc minimum,4,1737668277.0,2025-01-23 21:37:57
1i7u147,[deleted],Done 🪖,4,1737602327.0,2025-01-23 03:18:47
1i7u147,Vegas_42,Check,1,1737613471.0,2025-01-23 06:24:31
1i7r5l0,RegardedQt314,"love to see crypto OGs show love, make sure to smashhhh 🔥",24,1737593657.0,2025-01-23 00:54:17
1i7r5l0,phi_curious,"This guy went super viral a few years back with his videos doing rap in ubers etc!! Legend for that, and legend for being part of the Kendu community!!",21,1737594389.0,2025-01-23 01:06:29
1i7r5l0,[deleted],Love to see so much support the last 2 days.,15,1737596032.0,2025-01-23 01:33:52
