post_id,author,body,score,created_utc,date
1i5b231,TheGDC33,Great write up and agreed Trumpcoin was enough to do my head in Friday night and now we are where we are....too much,12,1737349923.0,2025-01-20 05:12:03
1i5b231,platniumperson,Great writeup chad. So much potential here.,19,1737338478.0,2025-01-20 02:01:18
1i5b231,PrestigiousAd9825,"**OBJECTIVE 2: NEVER LAND ON OUR BACK HEEL**   *Strategy 2a: Reinforce our floor*   Before we hit ATH, there were several instances where a whale would sell and it would cause a sharp drop in less than an hour (kind of like last night). What would normally be seen as a time to placate holders and stop the bleeding instead became a challenge to get people to double down on their investment - and within hours we would eat the dip so violently it created a butterfly effect where other chads who didn't initially buy in the trough would send more money in to keep the momentum moving and push the price up as quickly as possible. I'd like to recreate that by strategizing how we talk about buying Kendu. The massive benefit we have this time around is exchange access - even if we're still fighting to play with the big boys. If I were to see a chad worrying in the chat about whether it was ""too late"" to profit from a price recovery, I'd give them my honest advice - which is that it doesn't have to be.   Coins that can jump 40%+ in a day look attractive to jeets and uncommitted buyers, but if we start recommending during rallies for people to set aside what they would have thrown into the project and save it for a rainy day by leveraging limit trading, we can recreate this even more efficiently than we have in the past. Prices are cyclical in crypto - burnout from buying high and having to sell low isn't. I legit think we should start directing people who haven't done so already to get onto the exchanges and sink their cash into a grid of buys that makes it harder for those drops to get worse. Even if a whale comes back and tries a flash crash to sell all of their position, I can't imagine it'll be a bad thing when half the chat just boosted their position 20% without having to think or worry about the price because it's already recovered from that low.   This strat also gives us more bandwidth to regulate our growth - people who'd be tempted or may feel guilty taking profit on a 20-40% rally may feel better about doing so if they're not worried it'll be our last green candle. I bet a bunch of them would even do so only to recover a larger position - but they only will if they think Kendu is trending UP. This is critical if we want larger community participation while the new system of leadership takes shape.   *Strategy 2b: Create a plan around our ethos*   A huge part of the community spirit that has dwindled over the last few months is the enthusiasm around the main idea of the project - taking control of your future in crypto by creating a project that is designed to succeed because it's not designed to do anything else. This idea of not hiding behind ""use cases"" like Kendu Chads ""revolutionizing the NFT market"" and making the process of understanding how this project will earn money easy to learn is going to be massive to scale this thing up further.   That's no shade to Chads either - I own three of them myself. I just happen to think they look a lot more valuable to people who see them as a way to ladder up future profit instead of as the sole catalyst that will make us money in the long term. Whether it's Kendu Labs coins, the SOL projects, or anything touching NFTs, it makes our core offering a much tougher sell to new members and will not give people disaffected by crypto a reason to care about the narrative. Does it have to take a back seat? No. But it should at the very least be riding shotgun when we're making a first impression with skeptics and newcomers.   Also - this might be petty, but I'd love to start keeping receipts on negative CoinGecko and CMC comments. Imagine if you were just learning about Kendu and peeped the chart, only to see a comment calling the project ""dead"" followed by a response days later showing a full recovery + some growth with triple the likes on it. Feels like a missed opportunity to organize keeping this negativity in check.   *Strategy 2c: Use transparency to drive focus*   Speaking of which, the haters of this project have also picked up on the lack of transparency we currently have and are trying to beat us over the head with it. It's taken all of our latest accomplishments, like being the first project in the history of the blockchain to vote their way to a free Certik audit, and drowned them out in the noise of skepticism and FUD from complete strangers. We cannot arm these people with the tools to own our public spaces online.   Voting for 5-star ratings on CMC and Lewk is a great start, but there's nothing more valuable to our long-term optics than being able to sit in our truth and own that we truly are what we stand for. I think this means re-committing to the idea of being positive and aspirational - to get even people who think we're all crazy to start rooting for us because they see we're trying to do something, and aren't just playing an elaborate game of follow-the-leader with someone who hasn't delivered on the shots they've called.   People shouldn't care about us because they think they might be able to watch someone staple a sheet of paper to their forehead - they should care because they can understand what we're trying to do and see how collaborative the process of making something great can be. That's what wins us holder count, investment, and a fighting shot at these elusive T1 exchanges.",17,1737326371.0,2025-01-19 22:39:31
1i5b231,Hot-Raspberry2758,"This roadmap sounds great, and I look forward to the future of kendu",16,1737348634.0,2025-01-20 04:50:34
1i5b231,PrestigiousAd9825,"Yesterdays infodump thread/more elaborate descriptions of strategy:  **OBJECTIVE 1: BE INEVITABLE**  *Strategy 1a: Get space for Kendu IRL*  I know some folks were surprised to see how much presence coins like $HEGE and $POWSCHE were able to get with a smaller MC than ours, and how flash-in-the-pan projects like $CHILLGUY were able to spring up seemingly overnight - but it made complete sense to me considering those were the only projects I've ever seen in local, public spaces (think stickers on stop signs and the like).  We have something even more powerful with Kendu - a large team of creative minds who know how to build branded products and services. With a little investment and some tactical thinking, we could blow the lid wide open in where people can see, find, and ask about us and what we're up to.  Ex. The NFL's NFC Championship Game is happening next Sunday. Let's say Detroit wins this week and gets to host it at home. Why do we not have a group of Detroit-based chads yet who's job it is to hand out Kendu Energy drinks for free at the tailgate? We could develop a community fund to expense sending the drinks there, pay the chads involved a little bonus for their time/shilling work, and use the photos to promote on social media the way Red Bull has.  *Strategy 1b: Find our tribe where others aren't looking*  The most bullish aspect of this cycle for me has been hearing from people who aren't invested in crypto. I've met people who refuse to buy BTC because they think it's ""destroying the environment"" and others who have only even heard of meme coins because of that Hawk Tuah fiasco.  We need to find people who may not be curious themselves about the crypto space yet, but who are still a little curious about why others have gotten into it so much. The kind of people who feel a sense of FOMO because they weren't in on the in-crowd when $GME exploded and feel a sense of injustice around big money calling the shots with their retirement.  Seeing the massive influx of people leaving TikTok for an even more Chinese-based social media app out of spite against the Supreme Court showed me that this rebel streak is alive and well in everyday people - so if we can get a message out that says ""you don't have to bet your life savings to get enough money to pay for your life savings"", it'll build up our holder count, talent base, and general awareness/hype.  Ex. We should start posting memes in places that naturally attract people who would want to root for Kendu - think forums about getting off the grid, cybersecurity-related SM groups, and anywhere else people are worried they won't be able to pull their money out of their bank someday.  *Strategy 1c: A job for every Chad*  If there's a mistake I think this project has made so far, it's been pausing the development of groups/teams for specialized projects that play to their skillsets. We have artists, creatives, marketers, computer programmers, finance nerds, and PR specialists in this group that would be springing headfirst into the action if they didn't worry they'd be looked at as a control freak or rogue by suggesting anything new. This has to change if we want to take full advantage of the opportunity we have.  We should sit down and define our need state for this type of talent - thinking out any scenario we could need someone from the group to flex their skills on our behalf. Maybe there's a TG chat specifically for legal experts or people connected to them that can help us navigate the regulatory process. Maybe we have another just for writers/press specialists who focus on how we position the project in interviews and media quotes. Another for designers and graphic artists to create specific brand guidelines for how the Kendu brand looks in print and on your computer screen.  It shouldn't just be ""let's get to work"" - every chad should either have a space to collaborate with people of a similar professional background/interest, or at the very least, the freedom to eventually be trusted to build that out with leadership once the skill becomes needed and pressing.",14,1737326122.0,2025-01-19 22:35:22
1i5b231,Real_Crab_7396,"Good post, we need to focus on the future and running up kendu again. I am thinking about a way how we can make everyone on X know the sell pressure of last 6 months is gone with some hashtag or a phrase. Like We don't gamble, we work or Kendu is lord (which we don't use anymore) We need something we can make everyone use like #kenduCTO or #kenduTakeover, but i don't feel like these are the best for that.",10,1737364649.0,2025-01-20 09:17:29
1i5b231,PrestigiousAd9825,"So many possibilities… #kennesaince, #kendu2.0, #kendumerang - I’ll leave the final titles to whoever our writers will be but love this energy",6,1737383656.0,2025-01-20 14:34:16
1i5b231,SatoshiSiren88,We are all $kendu and the future looks bright for us! Thank you for your post ❤️,10,1737364787.0,2025-01-20 09:19:47
1i5b231,litecoiner,"IMHO we need digital marketing, even if we have to pay to create a project wallet  And raiding strategically to punch above our weight (which is still a heavy weight in terms of community but competition is fierce)",8,1737371768.0,2025-01-20 11:16:08
1i5b231,PrestigiousAd9825,"I feel like that’s why we have to have a team that specializes in digital marketing specifically to weed out the best opportunities for us to punch into - the more we can create pillars for experts to be trusted and empowered to execute, the better imo.",6,1737384101.0,2025-01-20 14:41:41
1i5b231,Gullible_Touch2735,"Awesone job, Chad! Like you said, the core values haven't and will never change. As long as we continue to run it up and stay away from useless bickering with the KM crew! Remember above all that nonsense",6,1737394960.0,2025-01-20 17:42:40
1i5b231,tokenKDN,This is excellent and is a clear and simple strategy to succeed. That lighthouse on the hill is looking ever brighter and I look forward to doing my part !!,2,1737465050.0,2025-01-21 13:10:50
1i54ak4,soFinished,KENDU IS SO FUCKING BACK,61,1737309261.0,2025-01-19 17:54:21
1i54ak4,lazargwf,That’s the spirit! We will never surrender 🪖,48,1737309355.0,2025-01-19 17:55:55
1i54ak4,Silly_Cybin3,Time for the true Kendu to rise!!!,45,1737309414.0,2025-01-19 17:56:54
1i54ak4,Familiar-Training-14,We KEN DU This!,44,1737309420.0,2025-01-19 17:57:00
1i54ak4,Agreeable_Compote_68,Like a phoenix rising from Arizona,42,1737309520.0,2025-01-19 17:58:40
1i54ak4,LiiQuiD0,This will be a great Comeback!,33,1737310588.0,2025-01-19 18:16:28
1i54ak4,ILoveMeatloaf,Old chads coming out of the woodwork to get involved again.,27,1737312449.0,2025-01-19 18:47:29
1i54ak4,Fit-Teaching9608,"I mean. I’m also very hopeful that this is the case, but Kendu is at an all time low… Wouldn’t say we are “so back” quite yet.",18,1737312653.0,2025-01-19 18:50:53
1i54ak4,BTCBette,The past several days have been hard for a lot of us. But $Kendu had to experience this extreme hardship in order to evolve and grow. The seeds have been planted. Now is the time to buckle down and build this into what we want it to be. Let's bring our passion and our collective vision to fruition! $Kendu will prevail.,12,1737322884.0,2025-01-19 21:41:24
1i54ak4,J0E_SpRaY,Price has almost hit rock bottom but yeah totally so back.,23,1737310538.0,2025-01-19 18:15:38
1i54ak4,TypicalRace1903,"KENDU is so undervalued! With the dawn of the President-elect’s inauguration and him endorsing meme coins, particularly on SOL, more retail-investors will be introduced into the space and liquidity will be crazy on these blockchains!  KENDU is now on SOL, already has been listed on a handful of exchanges and possibly even moreso in the future, and has one of the cultiest communities I have ever seen. With a low mc like this, I can see this do 1000x. Just my 2 cents. ",19,1737315337.0,2025-01-19 19:35:37
1i54ak4,litecoiner,"The action I'm seeing on socials is higher than I had seen in the last few months, Kendu is definitely alive and kicking",6,1737324885.0,2025-01-19 22:14:45
1i54ak4,Jonnymixinupmedicine,"This is why I haven’t sold. The community.  I said I’d get back to work if Miazaki “made it right,” and well he kind of did.   Time to put our helmets back on. Follow the TG raids, and spread some positivity about our project.",4,1737340358.0,2025-01-20 02:32:38
1i54ak4,dotworks_facial,"lol, glad i switched coins atm",7,1737310572.0,2025-01-19 18:16:12
1i54ak4,BTCBette,I get it. But save some for the $Kendu comeback too.,3,1737322923.0,2025-01-19 21:42:03
1i54ak4,skillmattic,"""Committed members"" is right, I'm not going anywhere. We are going to get through this and bounce back no doubt, LFG! The KENDU community never dies out, we are here to win🥇we are in the trenches now but hard work and believing in this community, and being committed to it will get us out! Hold the line, never give up on KENDU💯",2,1737342437.0,2025-01-20 03:07:17
1i54ak4,insegniah1,LEASGO,2,1737366312.0,2025-01-20 09:45:12
1i54ak4,Specific-Sundae5117,Has anyone heard about the migration? Do we need to migrate our Kendu tokens?,1,1737318646.0,2025-01-19 20:30:46
1i54ak4,BTCBette,No. That's a scam.,2,1737322263.0,2025-01-19 21:31:03
1i54ak4,skillmattic,I saw something about that yesterday and I immediately thought scam.,1,1737342148.0,2025-01-20 03:02:28
1i54ak4,Macgyver1300l,"How many people have been I project like this that produces so much hype IE: SafeMoon, PYE etc  I think personally this is another scam token even tho I hold tokens",0,1737343450.0,2025-01-20 03:24:10
1i54ak4,[deleted],[deleted],-4,1737314692.0,2025-01-19 19:24:52
1i54ak4,precipotado,The cuck is still dumping but will be out of tokens soon,8,1737315980.0,2025-01-19 19:46:20
1i54ak4,meesterbigjuan,-41%,1,1737337319.0,2025-01-20 01:41:59
1i54ak4,nastyrubber,Holder count is down. Don't spread false info,-9,1737317184.0,2025-01-19 20:06:24
