post_id,author,body,score,created_utc,date
1irvybj,TheGDC33,Ohh crap...I think I did it first on desktop and have since only used my phone😂  You are a smart Chad appreciate you,6,1739832193.0,2025-02-17 22:43:13
1irvybj,phi_curious,"Lmao troubleshooting is kind of my job 😂 try it out, can also be slow when many people work on the canvas at the same time. But working really well today so far :)",5,1739832284.0,2025-02-17 22:44:44
1irvybj,p0tatemoon,This right here is peak Kendu's work dedication. Hahah,5,1739836002.0,2025-02-17 23:46:42
1irvybj,TheGDC33,Curious do you use TG from your phone and computer (yes I know basethingy link was posted on Reddit) as I am curious if people do both.,2,1739840760.0,2025-02-18 01:06:00
1irvybj,phi_curious,"Yeah, i have tg running on my computer. Basically everything i need to shill kendu is open in one browser lol",3,1739859796.0,2025-02-18 06:23:16
1irvybj,RegardedQt314,it is forever lore 😂,5,1739831911.0,2025-02-17 22:38:31
1irvybj,p0tatemoon,Proud to be part of history ✊️🤣,5,1739836040.0,2025-02-17 23:47:20
1irvybj,ProgramLow8782,This would make perfect digital art on my wall.,6,1739839779.0,2025-02-18 00:49:39
1irvybj,bigboydesomo,Let's go so co9l,1,1739981258.0,2025-02-19 16:07:38
1irn6gl,CHARLIEFORTHEBOYS,Welcome to the crew baby chad,21,1739808506.0,2025-02-17 16:08:26
1irn6gl,Green_Candler,thanks alot,8,1739814074.0,2025-02-17 17:41:14
1irn6gl,PureClass247,welcome 🎉,14,1739808695.0,2025-02-17 16:11:35
1irn6gl,Green_Candler,thanks  a bunch,6,1739814091.0,2025-02-17 17:41:31
1irn6gl,Drainflowartist,"Glad to have you here, welcome",13,1739808940.0,2025-02-17 16:15:40
1irn6gl,Green_Candler,thsnks fam,5,1739814118.0,2025-02-17 17:41:58
1irn6gl,ShMaCo33,"Welcome, young Chad! Learn and grow!",10,1739810297.0,2025-02-17 16:38:17
1irn6gl,Green_Candler,thanks chad,7,1739814133.0,2025-02-17 17:42:13
1irn6gl,p0tatemoon,Welcome and glad to have you on board!  May your investments be blessed with green candles 🙏,11,1739810472.0,2025-02-17 16:41:12
1irn6gl,Green_Candler,glad to be here,5,1739814160.0,2025-02-17 17:42:40
1irn6gl,phi_curious,Welcome 🙏,10,1739811209.0,2025-02-17 16:53:29
1irn6gl,Green_Candler,thanks fam,5,1739814190.0,2025-02-17 17:43:10
1irn6gl,Vegas_42,Welcome to the party 🥳,10,1739811538.0,2025-02-17 16:58:58
1irn6gl,Green_Candler,we lambo soon,5,1739814206.0,2025-02-17 17:43:26
1irn6gl,Vegas_42,One color for each day of the week.,5,1739814550.0,2025-02-17 17:49:10
1irn6gl,UpsideDownKraken,"Welcome, chad!",7,1739813357.0,2025-02-17 17:29:17
1irn6gl,Green_Candler,thanks a lot,5,1739814215.0,2025-02-17 17:43:35
1irn6gl,insegniah1,Welcome fren  I am relatively young too and I must say I have learnt so much from being in this community. There is many experienced veterans here who have been around for cycles.  This is my first bullrun and perhaps yours too. Id say to try and embrace the experience like I did because I know I have learnt so much in the process :),5,1739831902.0,2025-02-17 22:38:22
1irn6gl,Green_Candler,Nice to meet you Young Chad... the Fam is getting bigger,2,1739960316.0,2025-02-19 10:18:36
1irn6gl,Zingultus,"Welcome Chad, so nice to see new people coming. Let's grow kendu fam 🫶",5,1739818731.0,2025-02-17 18:58:51
1irn6gl,skillmattic,Welcome...glad you joined the KenduArmy as we work and grind towards 100BILLION MC🫡🪖🦊,5,1739822082.0,2025-02-17 19:54:42
1irn6gl,Green_Candler,always nice to be a worker here,2,1739960333.0,2025-02-19 10:18:53
1irn6gl,skillmattic,Agreed...it's fun 😁,1,1739988123.0,2025-02-19 18:02:03
1irn6gl,ProgramLow8782,cute as,3,1739839863.0,2025-02-18 00:51:03
1irn6gl,Green_Candler,we are cute working chads,1,1739960366.0,2025-02-19 10:19:26
1irn6gl,bigboydesomo,Gm hope you are fine ?,1,1739981284.0,2025-02-19 16:08:04
1irmewx,phi_curious,Damn. Love those. Need to figure out the international shipping!,13,1739806253.0,2025-02-17 15:30:53
1irmewx,ShMaCo33,I will find a way!!!,10,1739808499.0,2025-02-17 16:08:19
1irmewx,ShMaCo33,"I can ship them anywhere using basic means. I'm looking into accepting international payments through Square, since that is where I currently sell them.",8,1739809203.0,2025-02-17 16:20:03
1irmewx,phi_curious,"Oh got it, that’s good to know. I’ll check if anyone else wants to do an order together to save shipping costs :))",7,1739810657.0,2025-02-17 16:44:17
1irmewx,ShMaCo33,"That would be amazing! Let me know your experience with Square, If you don't mind. I'd love to hear from a first-hand experience, just in case anyone in the future may have questions.",7,1739811331.0,2025-02-17 16:55:31
1irmewx,phi_curious,I’m pretty sure i used square in the past and it worked effortlessly. But maybe I misremember lol,6,1739813302.0,2025-02-17 17:28:22
1irmewx,ShMaCo33,Okay! I'll be ready for that order! 🤩,5,1739813880.0,2025-02-17 17:38:00
1irmewx,stayseaart,Looks sharp !!! Super awesome,10,1739807363.0,2025-02-17 15:49:23
1irmewx,insegniah1,Awesome!,6,1739831941.0,2025-02-17 22:39:01
1irmewx,ShMaCo33,"Thank you, Chad!",6,1739832489.0,2025-02-17 22:48:09
1irmewx,ProgramLow8782,This is cracking!,5,1739839895.0,2025-02-18 00:51:35
1irmewx,diablero_T,"This is so dope OP, nice work!! 🧡🧡🧡",3,1739846324.0,2025-02-18 02:38:44
1irmewx,bigboydesomo,Good work,2,1739981298.0,2025-02-19 16:08:18
1irkdp9,ShMaCo33,"Thank you for the Metrics+. You're very consistent, which is key to growth, in any aspect of life!",18,1739808391.0,2025-02-17 16:06:31
1irkdp9,Drainflowartist,Thanks for the info update ♥️,17,1739809125.0,2025-02-17 16:18:45
1irkdp9,p0tatemoon,"I also agree, projects that keeps building during the red market are the one we must keep an eye one  Memecoins are like fast fashion clothing. People jump on them for a short period of time and then wait for the next line of clothing. Kendu is much more and here to stay",15,1739810885.0,2025-02-17 16:48:05
1irkdp9,CHARLIEFORTHEBOYS,All eyes on KENDU right now,10,1739815684.0,2025-02-17 18:08:04
1irkdp9,phi_curious,Looking great. Thanks for the update!,11,1739815761.0,2025-02-17 18:09:21
1irkdp9,Zingultus,Well said Chad. Thanks for your daily metrics! Everyday a good read 💪👊,9,1739818615.0,2025-02-17 18:56:55
1irkdp9,TheGDC33,No thank you for your kindness,6,1739831709.0,2025-02-17 22:35:09
1irkdp9,bigboydesomo,Kendu shows his strengness,2,1739981325.0,2025-02-19 16:08:45
1irgpzb,SpeakerClassic4418,"The Kendu community just keeps working.  Love your list of what we have done very recently along with the few items we know are coming up.    We control our work and our team works all the time!    We also have a lot of fun in the TG.  Come and check us out, join in the fun!",18,1739787610.0,2025-02-17 10:20:10
1irgpzb,insegniah1,Completely forgot to add too - our new Kendu entertainment that is sponsoring a pickleball event in Kolkata!,16,1739787669.0,2025-02-17 10:21:09
1irgpzb,phi_curious,"Agreed. MC/price is really nothing to focus on rn, output and also community sentiment and vibes define the strength of a project in these market conditions. And I gotta say, I have a ton of fun!",15,1739788184.0,2025-02-17 10:29:44
1irgpzb,Jefkak,Could you share a link of the top rated Base post? Somehow I've missed this one it seems,13,1739788435.0,2025-02-17 10:33:55
1irgpzb,insegniah1,We actually have the top two now hahah  https://www.reddit.com/r/BASE/s/JuL4Qzj6U2  Just filter top all time on the sub :),12,1739788768.0,2025-02-17 10:39:28
1irgpzb,Vegas_42,"Thank you for the summary and keeping everyone up to date! It's motivating to read about our achievements every now and then. Keep on posting, my fellow chad!",13,1739791473.0,2025-02-17 11:24:33
1irgpzb,insegniah1,Agreed. Im grateful to be in Kendu and to be apart of this community,12,1739792003.0,2025-02-17 11:33:23
1irgpzb,Vegas_42,And we're happy to have you and all your posts! 👍,9,1739792448.0,2025-02-17 11:40:48
1irgpzb,p0tatemoon,"thanks for the write up, for some reason I completely forgot half of those things lol. excited to see the new website when it will be ready!  didn't know there will be a billboard in Amsterdam!",7,1739796849.0,2025-02-17 12:54:09
1irgpzb,skillmattic,"This is amazing progression, love to see it!  Full steam ahead! Our work and grind are what keep us growing. Can't stop, won't stop! No ceilings! We don't gamble, we work! LFG🫡🪖🦊#️⃣⬆️💎🙌🏾",4,1739822528.0,2025-02-17 20:02:08
1irgpzb,bigboydesomo,That's a great summary hope alot people will read it.  Honestly I always think how it would went if m doesn't made the fud. I mean it's long over and people still complaining a token that is the second one ever with a cerrik audit gained and tram verification.    Hence why not build something special together. Kendu has alot art. Don't let the fud come over you you will miss something special.    *,4,1739880090.0,2025-02-18 12:01:30
1irixdf,phi_curious,Great video Ruben!,13,1739799682.0,2025-02-17 13:41:22
1irixdf,insegniah1,Lovely work chad,4,1739831957.0,2025-02-17 22:39:17
1irixdf,tokenKDN,Excellent mate! Spread the word,3,1739852313.0,2025-02-18 04:18:33
1iriupm,Drainflowartist,"I  share a lot  on here through different Facebook crypto groups because Kendu is relatively unknown on the Facebook platform and some of the major groups. I also try to give awards to particular posts or comments on Reddit to boost visibility.  Whenever someone posts a poll on X, I vote for kendu or I show love or support in whatever way I can",19,1739796888.0,2025-02-17 12:54:48
1iriupm,extended_interface,Reddit definitely help surface good posts. Do you think those efforts have been making a noticeable impact on engagement?,15,1739798449.0,2025-02-17 13:20:49
1iriupm,phi_curious,"For sure! Reddit is one of the most important on boarding platforms for us! We emphasize that by writing articles in our sub and other subs, by organizing raids, by providing generally useful info for crypto new comers etc",13,1739799468.0,2025-02-17 13:37:48
1iriupm,p0tatemoon,ah ha! So you were the one giving out rewards haha. I recently notice all the awards popping up  Thank you for the support 🫡. I love how each members have a different way to contribute to Kendu,5,1739813560.0,2025-02-17 17:32:40
1iriupm,p0tatemoon,"It might not directly answer your question but I believe the strategy lies withing the community  You can have the best strategy to spread out the words about a project but without a community to take action, it will be difficult    Kendu strong point is how the community members all work together but also on their own. If someone like to play games, they can ad a Kendu tag to their name and that counts as work. We try to have real interaction/conversation whenever is possible   All those little work counts and adds up quickly  *We don't gamble, we work* that's the mentality when we decide to invest in Kendu. It's not like any other stock where we just put money and wait to see things go well for the company. We want to put a bit of our own effort. If Kendu succeed, it won't be because of one person but because of all of us",17,1739798687.0,2025-02-17 13:24:47
1iriupm,extended_interface,"Yeah, I get what you are saying. Do you guys do raids here? From what I know, those are pretty important to increase awareness, aren't they?",11,1739798872.0,2025-02-17 13:27:52
1iriupm,phi_curious,"You mean on reddit? Yes we raid here too sometimes. I feel like Reddit is a different kind of social media, people like to actually talk and have a real conversation :) so raiding is a bit different too imho",8,1739799387.0,2025-02-17 13:36:27
1iriupm,extended_interface,I guess I'm just used to snoofi. There are many raids in that subreddit.,5,1739800671.0,2025-02-17 13:57:51
1iriupm,phi_curious,"Don’t get me wrong we do raid, and honestly think we do better than most/any other community. At least from what I have seen.  Eg see here and sort by top comments:  https://www.reddit.com/r/memecoins/s/yh9iOzNDAX  I just don’t see the point of raiding on Reddit with one word comments, I prefer to raid with some conversation.   Not sure if that makes sense?",7,1739800913.0,2025-02-17 14:01:53
1iriupm,p0tatemoon,"100%, this is what I like about reddit, the opportunity to have a conversation and other people also see the ongoing conversation. It's great when the conversation also answer questions that others might have  On X it sometimes feels a bit ""lifeless"" when people only comment with one word",6,1739802344.0,2025-02-17 14:25:44
1iriupm,phi_curious,"Exactly what I meant. Thanks for finding the words I didn’t have haha…x indeed feels a bit lifeless, or maybe even mindless?   Also wanna make sure OP doesn’t misunderstand, I think that reddit is super important for onboarding. Just not randomly and with one word comments or one liners. People will rather quickly get tired of that imho.",6,1739802476.0,2025-02-17 14:27:56
1iriupm,p0tatemoon,"haha you're welcome but I have to say that you are way better than me at explaining and giving info  Yeah, on reddit you have an opportunity to give a positive first impression of a project  On X, my comments feel like a drop in the sea lol. I still like and comments though. With enough of them I think there is still a positive impact for Kendu",5,1739803663.0,2025-02-17 14:47:43
1iriupm,phi_curious,"Thanks, and yes I also smash x. Just feels different haha",4,1739805149.0,2025-02-17 15:12:29
1iriupm,p0tatemoon,We do recommend Kendu when there are post asking for a hiddengem/underdog memecoin  I think it helps getting the name out there. What's also important is answering questions when people are interested and give a positive vibe,5,1739799313.0,2025-02-17 13:35:13
1iriupm,extended_interface,true,5,1739800479.0,2025-02-17 13:54:39
1iriupm,Ok-King-1846,I know they are sponsoring some event in Miami in March.,3,1739824412.0,2025-02-17 20:33:32
1iriupm,phi_curious,"Welcome to the community!  There are always things that are being worked on, both online and in real life - which does take a larger part in Kendu than other projects:  * In march we will sponsor an art/culture festival in Miami  * also in march Kendu entertainment is organizing a sports event in India  As for online engagement. We already have pretty good engagement, on par or higher than pepe, wif, brett if you go by certik. And also here the community always does something:  * we have been really active on the billboard on base to make kendu art which has earned us a few shouts by the dev * we organize spaces on x regularly to talk about kendu and bring new people in * and we raid pretty much anyone we want, whether it’s a poll against UFD, PI and SPX, or to get a free article by clarissa yorke - our community shows up organically.  Hope this helps, let me know if you got any questions!",9,1739799321.0,2025-02-17 13:35:21
1iriupm,extended_interface,Thanks for the explanation. I agree with what you said. Which art/culture festival are you sponsoring?,9,1739800620.0,2025-02-17 13:57:00
1iriupm,phi_curious,You are welcome :)  Are you on x?  For Miami it’s this: https://x.com/kenduinu/status/1890422532333035907  For India this: https://x.com/kenduentertain/status/1891134976516931903,8,1739800708.0,2025-02-17 13:58:28
1iriupm,extended_interface,"Yes, I am. Thanks",7,1739801203.0,2025-02-17 14:06:43
1iriupm,extended_interface,I do have another question tho. How come this is on ETH and not SOL?,8,1739800741.0,2025-02-17 13:59:01
1iriupm,phi_curious,"It’s on ETH, SOL and Base. Same price on all chains, connected through a wormhole.  ETH is the king of altcoins, that’s why :) in the end it doesn’t matter though as you can buy it on all three chains, it’s just a preference. Just make sure to use the correct CA:  ETH: 0xaa95f26e30001251fb905d264Aa7b00eE9dF6C18  SOL: 2nnrviYJRLcf2bXAxpKTRXzccoDbwaP4vzuGUG75Jo45  Base: 0xef73611F98DA6E57e0776317957af61B59E09Ed7",9,1739801015.0,2025-02-17 14:03:35
1iriupm,SpeakerClassic4418,"That's a great question, and every Kendu community member has a different answer.    Some are making irl products using Kendu i.e. Kendu energy drinks, Kendu coffee. Etc  Some are passing out business cards and flyers.   Some are doing irl festivals, look out at the end of March for a huge festival with Kendu  Many are just nonstop engaging online.    Every member can decide to team up with other members and use their idea to promote, or try their very own twist.   P.s.  I only listed a small sample of ways above.    Best of Luck!",2,1739910208.0,2025-02-18 20:23:28
1iriupm,stewiebbb,Wait for a several more days. I will be dropping something that might answer your questions.,2,1740025762.0,2025-02-20 04:29:22
1irnr3n,CHARLIEFORTHEBOYS,No updates on any listings at the moment.,25,1739810227.0,2025-02-17 16:37:07
1irnr3n,PlentyF09,"Try going away for two months, then maybe there will be a T1 listing when you return. .😆",9,1739838090.0,2025-02-18 00:21:30
1irnr3n,bigboydesomo,We need more volume last weeks was not bad daily over 1m and some days 5m at this mc is inpressive,1,1739981376.0,2025-02-19 16:09:36
1irhkud,Potlimitcrypto,"Locking this thread because of the toxicity (deleted many messages). Please remember the rules here, we do not put ""Kendu"" and ""scam"" in the same sentence regardless of what your perceptions of the past are.  There are currently no plans for the Chads NFTs. They do not even display on popular marketplaces like Blur and Opensea, just a blank image, and even if the art did display it's low-quality and outdated. Even if we delivered an NFT marketplace, it would be dead on arrival. NFTs are not returning to their former 2021 glory, it will be old collections pumping on Blur and Opensea.   Let's try to focus on Kendu's token growth and brand awareness so that we can have a good old laugh about everything over some champagne. The best remedy to the mistakes of the past is Kendu's success.",1,1739801004.0,2025-02-17 14:03:24
1irhkud,kingkongbananakong,The NFT's are a venture from the old developer taht we CTO'd out. I also hold the NFT's but I wouldn't expect anything from them,8,1739791245.0,2025-02-17 11:20:45
1irhkud,Vegas_42,"For now we should take a step back and see the big picture. The time for taking care of the NFTs will come, but it's not now.  The big picture shows KENDU and the potential of our awesome community. At this point of the cycle we should all accumulate and work for our bags. We need to get in position for the moment the market sentiment turns positive. KENDU needs to be on everybody's mind. We need listings, irl shilling, irl products and each and everyone of us needs KENDU in our wallets to get rewarded when we are in the euphoria phase and everybody is greedy for KENDU.  Diaclaimer: I'm a top 50 holder of chad NFTs.",17,1739792079.0,2025-02-17 11:34:39
1irhkud,[deleted],[removed],6,1739795619.0,2025-02-17 12:33:39
1irhkud,OrionSt0rm,The only thing going on with them is that they are really cheap atm 😂,5,1739797222.0,2025-02-17 13:00:22
1irhkud,[deleted],[removed],1,1739796083.0,2025-02-17 12:41:23
1irhkud,[deleted],[removed],1,1739799003.0,2025-02-17 13:30:03
1irc9wu,Ok_Category9303,Are there any plans to burn tokens in the future? And ask how much the price will be in the future. I want to buy about 1k dollars,6,1739771188.0,2025-02-17 05:46:28
1irc9wu,platniumperson,"No plans for buyback and burns. Our price target is $100 billion MC this bull run and we have the army to achieve that. At that price, 1 Kendu = $0.10.",7,1739772779.0,2025-02-17 06:12:59
1irc9wu,Potlimitcrypto,Burns don't really have any significant impact on a project.,6,1739775314.0,2025-02-17 06:55:14
1irc9wu,p0tatemoon,"I don't think Kendu will burn tokens  Glad you have heard about us! Let us know if you have any questions!  As always, make sure to DYOR and see how Kendu compares to other memecoins. Just the fact that it's been audited by Certik + KYC verification is a big plus for a memecoin",2,1739797173.0,2025-02-17 12:59:33
1irc9wu,lazargwf,Amazing how Kendu is doing at the moment. Just imagine what Kendu is capable of during a alt season 🦊🪖,12,1739772076.0,2025-02-17 06:01:16
1irc9wu,Green_Candler,Well said... Long may it continue,3,1739808163.0,2025-02-17 16:02:43
1irc9wu,CommanderCronos,"It's 60% down in three months, (this is public info) what's amazing about that? Genuine question though.",10,1739772671.0,2025-02-17 06:11:11
1irc9wu,lazargwf,Have you seen the rest of the market? It’s pretty normal that in times like this everything is down. Always keep in mind what potential Kendu has. When we get into Euphoria those 60% won’t matter anymore.,12,1739772955.0,2025-02-17 06:15:55
1irc9wu,CommanderCronos,"I've seen the rest of the market. And I'm not saying kendu is doing anything wrong. You stated however that it was doing ""amazing"". Something that has lost 60% of its value is not amazing, right?",6,1739773129.0,2025-02-17 06:18:49
1irc9wu,insegniah1,"Yes I am the one that wrote it.  Price action is unimportant to me in the short term and also when the market is like this.  Also we have relatively been holding up very well in comparison to many other projects in the time frame you mentioned.  The “amazing” is the community  The developments and news / alpha we pump out consistently as a community is just incredible.  Recently: - certik audit rated us in top 5% with a mark higher then pepe in community - sponsoring a miami event that will have thousands and thousands of attendees. Sponsored with our energy drinks, merch, you name it - game being developed by a team and another hame that will end up on steam - comarketing from wormhole soon - base bridge and sol bridge - 50k otc to help with base - new website incoming - community members attending IRL crypto events to network for kendu - one person even going to an OKX event in dubai - growing every day during a market this bad - clarissa article to be released - free coindcx listing - and infinite much more. This is in the past 2-3 weeks only!  That is what amazing is to me  Bullrun ready.   When you gain holders consistently, grow this much this quickly with alpha, you know when the markets turn you will fly",8,1739785815.0,2025-02-17 09:50:15
1irc9wu,Potlimitcrypto,"Perhaps it refers to community energy, output, and social metrics, which is remaining high or growing. Many ways to evaluate a project. But yeah, the market is pretty dire right now, there's not really any liquidity or volume for Kendu to capture, so we need to just onboard who we can and work to prepare for the brighter days.",6,1739775470.0,2025-02-17 06:57:50
1irc9wu,lazargwf,"Well, I stand by my words. The feeling I have is „amazing“ because the community is working 24/7 and that working ethos is unmatched. I don’t care about now, I care about the future and that is looking bright for Kendu.",4,1739775836.0,2025-02-17 07:03:56
1irc9wu,p0tatemoon,"I think he meant about how the project is developing   While the market is red, the Telegram vibe is still positive and not gloomy. SOL and BASE wormhole were released, news about an event in Miami where Kendu will have a presence, pickleball event in India, etc   Lots of thing going on, usually a red market is slowing the activities of a project but Kendu is slowly building",1,1739797482.0,2025-02-17 13:04:42
1irc9wu,[deleted],The fact that it survived shows resilliency at minimum.,1,1739832087.0,2025-02-17 22:41:27
1irc9wu,Vegas_42,"https://preview.redd.it/8s3nx5ifanje1.png?width=1200&amp;format=png&amp;auto=webp&amp;s=0048533c8a7872b32a737d94fc6c47ffeb910ad9  It's on you to decide where we are now. I don't know exactly, but my guess is around disbelief after a run up following the depression phase. Maybe I'm right or maybe I'm wrong.  But I'm sure we're not even close to thrill and euphoria. When your barber tells you to buy Kendu, then you know we're close to the top. I'm buying KENDU since June '24 and I'm down like most of us. But I know what our goals are. And I see the signs: Activity, positivity, Certik audit, irl products, etc. Nothing to worry about. I just take advantage of those prizes.  I'm just a normal chad, but I was right buying BTC @$16k, SOL @$17, WIF @$0.12 and Moons @$0.08. I swapped all of it to KENDU. That's my strongest conviction ever. Never seen a community like this before. We will see billions! We don't gamble, we work!",8,1739774371.0,2025-02-17 06:39:31
1irc9wu,[deleted],![gif](giphy|l3q2SaisWTeZnV9wk),1,1739850298.0,2025-02-18 03:44:58
1irc9wu,Feisty-Rhubarb-6718,💪💪,5,1739789670.0,2025-02-17 10:54:30
1irc9wu,fuccckoffffff1com2u,This community really is amazing. 🖤 LFG Kendu 🚀💪,5,1739791054.0,2025-02-17 11:17:34
1irc9wu,ProgramLow8782,"The market is confused as to how trump will act tomorrow, give it a month or so, we'll probably have some more clarity. If conviction is strong (my opinion only) i'll keep accumulating at low prices.",1,1739775190.0,2025-02-17 06:53:10
1irc9wu,bigboydesomo,Yeah kendu is alays a day saver even if its bad in kendu tg the people are so kind and helpful,1,1739981461.0,2025-02-19 16:11:01
1irc9wu,[deleted],![gif](giphy|mb5j5LU0NyfgJGVMu3),0,1739846882.0,2025-02-18 02:48:02
