post_id,author,body,score,created_utc,date
1i77usl,Tortich70,"Josh, this is the second wonderful post You have written in this thread and I wanna say thank you!  I am very sensitive to people and their moods and intentions. While at KM all the alarm signals were red right from the start (I’ve been there since around July), for you and this community everything now lights up in a bright, bright green. In the last few weeks the situation has become more and more complicated and my concerns about it have become greater and greater. But now after this turnaround brought about by this great community, I am completely calm and full of excited anticipation for everything that may come next! I thank you for your way of communicating things openly, fairly, calmly and clearly and yet always with a dose of humor. It is exactly what it needs internally and externally. clear words that are followed by clear actions. Just reliability.  I’m no longer worried that with Kendu we’ll write the story we’ve always dreamed of.  However, we still have a bumpy road ahead of us and I know that you are a good guy, so I would like to say that in everything you do for the community and the project, take good care of yourself too!  with best wishes, we run it up !",17,1737556339.0,2025-01-22 14:32:19
1i77usl,patrick2408,"I don’t know what to say, but this answer, WOW. Thank you Josh. I really have no words. You wrote nothing deep, but it goes deep.   This spirit is actual in $KENDU and I’m sure you can hold this spirit.   $KENDU is in the right hands, $KENDU is in good hands.",10,1737565849.0,2025-01-22 17:10:49
1i77usl,trifle_hat,"I’ve been in Kendu since may, and consistently active since then. I can attest that Josh is does indeed put everything into the project, and has done day in day out.   Josh, you also firmly passes my tests of character. This isn’t true for many in the industry, and while I’ll give most people the benefit of the doubt, I much prefer a leader I don’t need to do that for.  In my personal life I’ve worked at a number of elite organisations, and know how hard it can be to find good people (even when paying very well) - having Josh here is a gift for Kendu. He has been a big factor in my staying over the tough times, and inspires others daily.  Thank you Josh",6,1737575708.0,2025-01-22 19:55:08
1i77usl,bigboydesomo,Thats ab fucking chad Roadmap :D   Community will run it up we are all kendu,5,1737574037.0,2025-01-22 19:27:17
1i77usl,phi_curious,Just wanted to say thank you for asking these really important questions. I think addressing these will be part of the healing process the Kendu community will have to do after the CTO.,6,1737574212.0,2025-01-22 19:30:12
1i77usl,GhoulZeez,legend,9,1737550943.0,2025-01-22 13:02:23
1i77usl,tokenKDN,"Kendu is stronger than ever before and with this community we are unstoppable, I can't wait to see how far this rabbit hole goes! Much love mate and much love Kendu fam! Kendu is community!",8,1737553120.0,2025-01-22 13:38:40
1i77usl,Lalph-Rauren,👏💎🚀🚀🚀🚀🚀,7,1737553360.0,2025-01-22 13:42:40
1i77usl,Larnit1,You better not be playing us as well just sayin.,8,1737562622.0,2025-01-22 16:17:02
1i77usl,RegardedQt314,trust will have to be earned back i agree,4,1737589938.0,2025-01-22 23:52:18
1i77usl,1Kendu,"""In hindsight, it needed to reach the vicious boiling point it did so that this positive change could happen.""     BIG FACTS",9,1737563712.0,2025-01-22 16:35:12
1i77usl,Spiral010,"Josh, you’re a great dude. All the best to you and the community.",8,1737564646.0,2025-01-22 16:50:46
1i77usl,Doc_Holiday_x,"I totally get it.  The mad king was in control and all anybody could do was follow the instructions of the king.  Until enough was enough and you all finally put your sword through his chest.  Bravo, you and the team have the respect and loyalty of us all.",15,1737549344.0,2025-01-22 12:35:44
1i77usl,Seanonethree,"Thank you sir! One step back, two steps forward. 🫡",7,1737566882.0,2025-01-22 17:28:02
1i77usl,lordanix,Thank you Josh! Good times ahead,8,1737568607.0,2025-01-22 17:56:47
1i77usl,they_call_me_mr_mac,Josh you did amazing. Keeping your cool in the shitstorm that happened.,7,1737570948.0,2025-01-22 18:35:48
1i77usl,SatoshiSiren88,"Kendu is community!! A respectful and inclusive community with amazing vibes!! We will take it to the moon, helmets on! 🚀🚀",7,1737576138.0,2025-01-22 20:02:18
1i77usl,Vegas_42,"Josh, from the bottom of my heart: thank you!",6,1737582779.0,2025-01-22 21:52:59
1i77usl,Due-Wrongdoer2887,"Legendary. We’re proud of you, Josh!  I feel like the community has evolved even further after recent events and is now more united than ever before. It must have been fate.  We will make the new chapter golden.",6,1737587411.0,2025-01-22 23:10:11
1i77usl,ElasticNet,"Ngl I wanted to dump this token long ago after seeing the behaviors of certain community members such as Mark, Zack, Al and Doop along with the cucklord Geoff. I had stopped shilling this to everyone. The ONLY thing that kept me holding it was Josh and Kevin. Kendu could not have been in better hands.",9,1737550597.0,2025-01-22 12:56:37
1i77usl,HamsterDunce,"Glad to see you’re feeling positive again, fren! I’ve been in a similar boat. It feels good to be proud to hold Kendu again.",8,1737554224.0,2025-01-22 13:57:04
1i77usl,CHARLIEFORTHEBOYS,I also apologize for muting and banning people for FUD. All my reasons are the same as Josh. I would do anything I can to help play a part in KENDU become a top meme coin community. I have learned my lesson and hope we can all move forward together and get this thing where it deserves to be.,10,1737556677.0,2025-01-22 14:37:57
1i77usl,SatoshiSiren88,"It has been a rough couple of days, but we are stronger than ever! We know what to do: WORK 💪 Kendu is community ❤️",8,1737576040.0,2025-01-22 20:00:40
1i77usl,Tortich70,"That’s life ! You always make decisions in the moment based on the information that you currently have available or that you believe in. Looking back, we are always smarter. When the moment came, everyone understood and acted correctly. That’s what counts and now the really good part begins. Let’s enjoy the trip!",6,1737572789.0,2025-01-22 19:06:29
1i77usl,[deleted],[removed],3,1737600259.0,2025-01-23 02:44:19
1i77usl,Potlimitcrypto,"Governance would kill Kendu at current levels. Even when you're big, like Shib, you'll find the voter turnout is low and dominated by greedy whales. All it takes is wealthy malicious actors, and there are many, to completely dominate governance towards decisions that favour them. I have lots of experience with DAOs and it's still unsolved. They have tried gamifying it and different approaches, but the truth is it's cumbersome and boring. Kendu needs to be agile and nimble, we need to be able to act fast. Everyone can be considered their own DAO and free to lead Kendu in the direction they want to see it go in, without governance required. I want Kendu to move away from onchain as much as possible and into the real world because I believe this is what will actually onboard people.",3,1737602561.0,2025-01-23 03:22:41
1i77usl,[deleted],[removed],3,1737608272.0,2025-01-23 04:57:52
1i77usl,Potlimitcrypto,"Indeed, touch wood, haha. Well, main wallet we'll switch to a multisig, socials/email I'll share the login details with a few people who have proven their trustworthyness, and the same for a few other mission critical items. I don't think I'll lose my mind or die, but of course, it isn't likely I'll be here in a decade. Everything will be shared with trustees as a failsafe.",2,1737614753.0,2025-01-23 06:45:53
1i7mv2a,akguitar,"Bless you goldbeard, you’re my hero!!!",6,1737582378.0,2025-01-22 21:46:18
1i7mv2a,W-D-Goldbeard,"Arrr, thank ye fer that honour matie 🫡🏴‍☠️",5,1737582494.0,2025-01-22 21:48:14
1i7mv2a,TheGDC33,You are a true legend. I hope you are well!,4,1737583072.0,2025-01-22 21:57:52
1i7mv2a,W-D-Goldbeard,"Aye matie all be well with this ol' Pirate, thank ye fer yer comsideration.  Happy to be doin' me part working towards a better $KENDU 🫡🏴‍☠️",3,1737584225.0,2025-01-22 22:17:05
1i7mv2a,tokenKDN,"Not just a master of the seven seas and a cutlass, but also master of the pen. Our cap'n be a man of many talents!",3,1737584873.0,2025-01-22 22:27:53
1i7mv2a,W-D-Goldbeard,Arrr thank ye fer yer kind words matie! This be me rough sketch so I hope ye can see the vision fer the final piece 🖼  Lets see if all me practice since the last one has payrd off 🤞🎨,1,1737655956.0,2025-01-23 18:12:36
1i7hnid,HyenaIsACat,"i think a game with microtransactions paid in kendu or whatever, that goes directly into community wallet, would benefit the Community more.   Like flappy bird with some nice Kendu skins or smth 😅",11,1737570002.0,2025-01-22 18:20:02
1i7hnid,HyenaIsACat,but no ptw,5,1737570032.0,2025-01-22 18:20:32
1i7hnid,bigboydesomo,Sounds awesome we must have some chads,7,1737570322.0,2025-01-22 18:25:22
1i7hnid,nakoost,"I'm making a game as we speak, Im a solo dev right now, maybe I can find a way to implement Kendu as a reward! This is a great idea!  Edit: maybe not microtransactions but a steep discount for the game if it's bought in Kendu? Just a thought.",10,1737570415.0,2025-01-22 18:26:55
1i7hnid,bigboydesomo,Are you kendu holder?,7,1737570481.0,2025-01-22 18:28:01
1i7hnid,nakoost,That I am. Love my Kendu!  My game is a world simulator RTS / grand strategy game I've been working on for about 2 years now! Looking to have a demo out in the next couple months and start to garner interest around then! I think using Kendu as a form of payment or a reward for buying the game would be a fantastic idea!,7,1737571882.0,2025-01-22 18:51:22
1i7hnid,bigboydesomo,Wow sounss great would love to contribute my part,5,1737572579.0,2025-01-22 19:02:59
1i7hnid,nakoost,As I get far enough in development for a demo I can keep the community clued in and workshop some ideas for how to get kendu involved!,4,1737577840.0,2025-01-22 20:30:40
1i7hnid,bigboydesomo,We would sure work out something good that we benefit both,5,1737570517.0,2025-01-22 18:28:37
1i7hnid,DopestSophist,"This needs to be thought out more. Where is the reward Kendu coming from? What is the cost to play - ie are you risking Kendu and lose it if you lose the game? Is this like a gambling game against the computer or a pvp competitive game? Is there a burn mechanism, and if not, how does the game benefit the community?",4,1737569770.0,2025-01-22 18:16:10
1i7hnid,bigboydesomo,That i would need a game Designer but would say in the Genre like tower defense or some good games for some fun daily to get kendu,5,1737570035.0,2025-01-22 18:20:35
1i7hnid,UrbanPKMonkey,"Tower defense game where you can add to the army with hoards of Geoffs trying to kill you. There are load of games out there like that, but no KENDU one.",4,1737572377.0,2025-01-22 18:59:37
1i7hnid,bigboydesomo,Yeah such game i had also in mind,3,1737572600.0,2025-01-22 19:03:20
1i7hnid,bigboydesomo,Against a computer that get harder   Or we can add pvp and the winner get his kendu he winned so a x2 for him,4,1737570109.0,2025-01-22 18:21:49
1i7hnid,bigboydesomo,I would pay for it at beginning maybe chads also spend a few  Also they doesnt get 100€ lets say 20 cent.    Or 2000 kendu etc,5,1737569973.0,2025-01-22 18:19:33
1i7hnid,bigboydesomo,Sry i wamt so badly make this   Or a site that record people wallets that wants kendu would too it ealey like a faucet,4,1737570156.0,2025-01-22 18:22:36
1i7hnid,ryanlak1234,What’s your idea? Website or app?,4,1737570548.0,2025-01-22 18:29:08
1i7hnid,bigboydesomo,App would be cool but Website is amiable for more people i think.    Best where both,3,1737572549.0,2025-01-22 19:02:29
1i7hnid,DTK666DTK555,If this happens I want to do the soundtrack,2,1737577735.0,2025-01-22 20:28:55
1i7hnid,King_K_24,Sounds fun. I have minimal skills but would be willing to help,2,1737580525.0,2025-01-22 21:15:25
1i7hnid,wr0ngdr01d,"Check out Replit. It can help make apps, sites or even games with an AI bot. It’s pretty powerful for prototyping. I had a flappy bird clone up on pygame in about ten minutes. JavaScript was wonkier but got a version of that up too. Can host it or share the repl if you’re interested.  I think if you got a good basis for a game, you could easily find someone who can help you Kendu-ify it. I’m a hobbyist game dev and programmer and I’ve done a bit with web3 and I’d be happy to invest some time, but getting a game all the way from conception to production with crypto integration is a big task. If there’s anyone skilled in web3 to split the work with, I’m up to get together and see if there’s something we could do. ",2,1737599017.0,2025-01-23 02:23:37
1i7hnid,CoopVelociraptor,"Short answer- yup.  Don’t take this the wrong way, but if I was working on a Kendu game (I’m not, atm) I wouldn’t share that publicly. My prior experience on very large ip projects is that gamers can be toxic af and to this day I wouldn’t reveal myself to those players even if I wasn’t under an NDA.   It’s not an indictment on the Kendu community, but if I eg. Pushed out something with adroll or micro transaction mechanics that fed revenue directly into the community wallet (and/or Chad nft holders) I’ve got no doubt y’all would love that but the normies would come for me for being yet another game dev that built this type of game. Even just putting together a straightforward game gets hate from someone for either being too hard or too easy lol.",1,1737586438.0,2025-01-22 22:53:58
1i7fe3z,RegardedQt314,nice write up chad,6,1737565706.0,2025-01-22 17:08:26
1i7fe3z,[deleted],[deleted],2,1737565667.0,2025-01-22 17:07:47
1i7fe3z,soFinished,It's rhetorical haha but yeah we are so back,3,1737565736.0,2025-01-22 17:08:56
1i7fe3z,3pomeraniandaddy,Dude kendu inu was never gone,1,1737645198.0,2025-01-23 15:13:18
1i78igi,lennart1418,"Great, love the transparacy 🚀",64,1737543288.0,2025-01-22 10:54:48
1i78igi,UsedButterscotch2102,Transparency is so sexy ,36,1737545540.0,2025-01-22 11:32:20
1i78igi,BTCBette,"We're so lucky to have you, Josh. What a breath of fresh air!",44,1737544211.0,2025-01-22 11:10:11
1i78igi,lazargwf,This is great! 🚀,23,1737545820.0,2025-01-22 11:37:00
1i78igi,CoopVelociraptor,"This is it g, this is that good shit that keeps building the trust and faith everyone can have in us 🫡",39,1737543661.0,2025-01-22 11:01:01
1i78igi,W-D-Goldbeard,These be some massive steps in the right direction. Well done matie 🫡🏴‍☠️,16,1737549570.0,2025-01-22 12:39:30
1i78igi,TheGDC33,Alright love this and can learn this process a bit now too!,16,1737549913.0,2025-01-22 12:45:13
1i78igi,Jonnymixinupmedicine,Now we’re cooking! I’m stoked like I was the first time I heard about the mysterious marketplace!   Josh seems like a genuine dude in the TG too. He knows how to put on a good corporate face. I think we’re on the way to bigger and new investors.,13,1737551529.0,2025-01-22 13:12:09
1i78igi,tokenKDN,In Josh We Trust!,14,1737553224.0,2025-01-22 13:40:24
1i78igi,CHARLIEFORTHEBOYS,This is how you du BUSINESS,13,1737557326.0,2025-01-22 14:48:46
1i78igi,Neat-Big5837,"Absolutely love the transparency. The vibes are so much better and happy to see the money being well spent. I don’t know how high we will go this cycle but one thing is certain, it’ll be higher than whatever we could’ve achieved without the CTO. Glad that Josh took this path. I know it wasn’t easy.",13,1737553440.0,2025-01-22 13:44:00
1i78igi,phi_curious,"I have a very good feeling about all of this. Community vibes are high, new DEV is transparent, well spoken and intelligent, MC is moving upwards and sell pressure is gone. What’s more to wish for?",41,1737543461.0,2025-01-22 10:57:41
1i78igi,Consistent-Bit-8445,100% agree . I’ve been in since June last year and never felt so much conviction. Josh is the goat,32,1737543629.0,2025-01-22 11:00:29
1i78igi,phi_curious,![gif](giphy|eS6Dgv1mdwmkLMgJnI)  From the selfie folder of Josh the goat,27,1737543705.0,2025-01-22 11:01:45
1i78igi,boathouse_floats,HAHAHAHA,3,1737572118.0,2025-01-22 18:55:18
1i78igi,phi_curious,It’s confirmed. You can ask him 😏,2,1737572661.0,2025-01-22 19:04:21
1i78igi,petros798,"Hey there, anyone know how we can contribute to the crowdfund wallet?",25,1737543701.0,2025-01-22 11:01:41
1i78igi,insegniah1,"Hello, anyone is welcome to contribute.  If you feel the need to help out that is the wallet! Appreciate you :)  0xD22849fcB4C83389E65a1c40748a9b67157638A3",29,1737543879.0,2025-01-22 11:04:39
1i78igi,petros798,"Thanks for the info.  Also yeah i think adding it to main post is gonna help, cuz i lose a lot of messages from tg due to work and other stuff and i guess i am not the only one.",23,1737544160.0,2025-01-22 11:09:20
1i78igi,YouKhanSeeMe,"Insigegniah has given the correct wallet address.   As a general rule of thumb, always verify it in the TG so that you can’t be miseld by anyone with bad intentions (again this doesn’t apply to Insigniah in this instance).",20,1737544534.0,2025-01-22 11:15:34
1i78igi,petros798,Thanks for the advice! Will do from now on,14,1737544672.0,2025-01-22 11:17:52
1i78igi,girasoles_de_fuego,Finally a dev with some sense,10,1737564659.0,2025-01-22 16:50:59
1i78igi,BlazedLurker,Same CA and everything?  What's going to happen with the kendu Chad's I own? Thanks.,10,1737552399.0,2025-01-22 13:26:39
1i78igi,phi_curious,"CA is the same, also on SOL now. No decision yet how to handle the kendu chad situation afaik   ETH: 0xaa95f26e30001251fb905d264Aa7b00eE9dF6C18  SOL: 2nnrviYJRLcf2bXAxpKTRXzccoDbwaP4vzuGUG75Jo45",4,1737572076.0,2025-01-22 18:54:36
1i78igi,Seanonethree,Thank you!,9,1737566634.0,2025-01-22 17:23:54
1i78igi,SpoonyLoveee69,This is what we have been begging for! Love to see it.,19,1737544287.0,2025-01-22 11:11:27
1i78igi,TrainingReward4308,![gif](giphy|amg2hcfGDkKt4Q3DpF),8,1737568212.0,2025-01-22 17:50:12
1i78igi,Lanky-Clue-2719,We win together and we Kendu it. LFG.,9,1737569823.0,2025-01-22 18:17:03
1i78igi,bigboydesomo,Lets gooooo,16,1737545225.0,2025-01-22 11:27:05
1i78igi,MikeMartianDJ303,Sorry for a question that’s probably been asked a lot.  Been outta the loop about the Kenduchads.  Is it not going to happen or eventually will?,7,1737571505.0,2025-01-22 18:45:05
1i78igi,phi_curious,"I don’t think there has been a decision yet how the situation is going to be handled. Some people suggest a refund with what is left from that wallet (even though a lot has already been sold by KM), others talked about a CTO for the chads, or to hope that they will become valuable as NFTs once the MC of Kendu explodes (as part of interesting lore).",8,1737572017.0,2025-01-22 18:53:37
1i78igi,Therzie,Turns out that was just a cheap scam by Miazaki to load up his Kendu bag. Decision has been made to not continue with it and focus on getting Kendu Inu to billions and beyond. The whole NFT scheme was bearish and really just a cheap OpenSea market ripoff.,5,1737574644.0,2025-01-22 19:37:24
1i78igi,[deleted],This community is amazing. Thank you Josh.,4,1737579327.0,2025-01-22 20:55:27
1i78igi,DonDengue,"If the chads wallet was returned , and the CTO cancelled out Chad market place why is there no discussion of returning chads money to chads holders",3,1737597254.0,2025-01-23 01:54:14
1i78igi,insegniah1,"Miazaki went through about 70% of the funds so it wouldnt work.   The CTO also did not cancel out chads marketplace. That was miazakis project which he didnt deliver, entirely on him.",2,1737666850.0,2025-01-23 21:14:10
1i78igi,DonDengue,"They came back as “ chads “ funds and should be vested till Kendu recovers.   Kendu Sugar is having people pursue legal action.  In any other fraud these returned funds would be put in trust till the dust settles  Anything that Kendu needs can be crowd funded.  I guy that bought last week, never bought a chad should not be involved with Chad money   Ask a lawyer",1,1737680625.0,2025-01-24 01:03:45
1i79t1z,phi_curious,A lot of positive changes for Kendu since the CTO. Welcome back!,31,1737548395.0,2025-01-22 12:19:55
1i79t1z,JaegerRey,Lets Gooo chad!!  There is so much bullish stuff in KENDU that im excited for the future of KENDU  Now that you Join the TG lets run it up together,19,1737549387.0,2025-01-22 12:36:27
1i79t1z,Little_Musician_5060,Sure thing mate 🙏,15,1737550776.0,2025-01-22 12:59:36
1i79t1z,Aggressive-Virus4046,"Be careful, spread positivity only",16,1737550774.0,2025-01-22 12:59:34
1i79t1z,Little_Musician_5060,The negativity left the project so.. Easy task  :),15,1737550903.0,2025-01-22 13:01:43
1i79t1z,BTCBette,That's the thing. There's nothing left holding us back. Welcome back to $Kendu! Let's run it up! 💪🪖🚀,8,1737566951.0,2025-01-22 17:29:11
1i79t1z,[deleted],Welcome back!,11,1737551857.0,2025-01-22 13:17:37
1i79t1z,Doc_Holiday_x,Welcome back Chad!  Exciting times ahead,12,1737552581.0,2025-01-22 13:29:41
1i79t1z,ShMaCo33,"Welcome back, Chad!",10,1737554279.0,2025-01-22 13:57:59
1i79t1z,CHARLIEFORTHEBOYS,Glad to have you back. The family is all coming home!,10,1737558409.0,2025-01-22 15:06:49
1i79t1z,BTCBette,It's really heartwarming!,6,1737566977.0,2025-01-22 17:29:37
1i79t1z,diablero_T,Welcome back!!,9,1737553588.0,2025-01-22 13:46:28
1i79t1z,Dramatic_Weakness693,WELCOME BACK!!!!! Happy to have all the Chads returning!!!,10,1737556248.0,2025-01-22 14:30:48
1i79t1z,bigboydesomo,Welcome back chad,9,1737560511.0,2025-01-22 15:41:51
1i79t1z,HamsterDunce,We Kendu it! Love the energy let’s send this puppy to its rightful place at the top,9,1737560839.0,2025-01-22 15:47:19
1i79t1z,Due-Wrongdoer2887,"Welcome back, chad!",7,1737563651.0,2025-01-22 16:34:11
1i79t1z,SpoonyLoveee69,Welcome back bud! Now let's run it up,5,1737569371.0,2025-01-22 18:09:31
1i79t1z,ChipFrostman,I had absolutely no clue there were so many people banned by old dev and his cohort. Great to have you all back! Let's bring this to billions.,4,1737571143.0,2025-01-22 18:39:03
1i79t1z,Little_Musician_5060,This community is still the greatest... by far,5,1737571866.0,2025-01-22 18:51:06
1i79t1z,diablero_T,"100%, there is nothing in existence in the crypto world that is even comparable to the $KENDU Army, and I say that as a crypto vet.   Murad said it himself, the future is all about strong communities.",3,1737601438.0,2025-01-23 03:03:58
1i79t1z,[deleted],Welcome back Chad,1,1737605101.0,2025-01-23 04:05:01
1i7chvb,UpsideDownKraken,Which subreddits?,12,1737557819.0,2025-01-22 14:56:59
1i7chvb,phi_curious,Maybe a good idea to compile a list of subreddits to raid.,10,1737558567.0,2025-01-22 15:09:27
1i7chvb,BTCBette,https://preview.redd.it/hkt19lb91lee1.jpeg?width=591&amp;format=pjpg&amp;auto=webp&amp;s=affacd253742b045dac2f23852371d428638cf3f  Here's a start...,11,1737567832.0,2025-01-22 17:43:52
1i7chvb,phi_curious,"Thanks, is this shared somewhere so people can copy paste?",6,1737567908.0,2025-01-22 17:45:08
1i7chvb,BTCBette,Try this: https://docs.google.com/spreadsheets/d/1_di8Cn65_lCZTcnheX5ZjMDoc999hX5ky_d2zRe7DwA/edit?usp=sharing,4,1737568727.0,2025-01-22 17:58:47
1i7chvb,phi_curious,Oh looks like we commented at the same time to each other haha. Thanks!,3,1737568773.0,2025-01-22 17:59:33
1i7chvb,[deleted],[deleted],2,1737568287.0,2025-01-22 17:51:27
1i7chvb,phi_curious,Link doesn’t work for me. I tried to compile all from your pic above. Maybe we can add more and then pin it somewhere?  https://www.reddit.com/r/AllCryptoBets/  https://www.reddit.com/r/AltStreetBets/  https://www.reddit.com/r/CryptoCurrencyl  https://www.reddit.com/r/CryptoMars/  https://www.reddit.com/r/CryptoMarsShots/  https://www.reddit.com/r/CryptoMoon/  https://www.reddit.com/r/cryptomooncum/  https://www.reddit.com/r/CryptoMoonShots/  https://www.reddit.com/r/Memecoinhub/  https://www.reddit.com/r/memecoinmoonshots/  https://www.reddit.com/r/memecoins/  https://www.reddit.com/r/SatoshiStreetBets/  https://www.reddit.com/r/shitcoinmoonshots/  https://www.reddit.com/r/ShytoshiWorld/  https://www.reddit.com/r/TokenWallStreet/  https://www.reddit.com/r/WallStreetBetsCryptol,5,1737568731.0,2025-01-22 17:58:51
1i7chvb,BTCBette,"Ok, I added some to the list. These are all worth checking out, tho some of them may not be very receptive to memecoin posts but maybe worth a soft shill here and there  https://www.reddit.com/r/AllCryptoBets/  https://www.reddit.com/r/AltStreetBets/  https://www.reddit.com/r/CryptoCurrency/  https://www.reddit.com/r/CryptoMars/  https://www.reddit.com/r/CryptoMarsShots/  https://www.reddit.com/r/CryptoMoon/  https://www.reddit.com/r/cryptomooncum/  https://www.reddit.com/r/CryptoMoonShots/  https://www.reddit.com/r/Memecoinhub/  https://www.reddit.com/r/memecoinmoonshots/  https://www.reddit.com/r/memecoins/  https://www.reddit.com/r/SatoshiStreetBets/  https://www.reddit.com/r/shitcoinmoonshots/  https://www.reddit.com/r/ShytoshiWorld/  https://www.reddit.com/r/TokenWallStreet/  https://www.reddit.com/r/WallStreetBetsCrypto/  https://www.reddit.com/r/altcoins/  https://www.reddit.com/r/cryptoapeing/  https://www.reddit.com/r/crypto_general/  https://www.reddit.com/r/cryptocurrencies/  https://www.reddit.com/r/cryptomarkets/  https://www.reddit.com/r/cryptopeople/  https://www.reddit.com/r/memecoinjunkies/  https://www.reddit.com/r/moonshotcoins/  https://www.reddit.com/r/solanamemecoins/  https://www.reddit.com/r/solcoins/  https://www.reddit.com/r/thecryptoshots/  https://www.reddit.com/r/crytpoindia/  https://www.reddit.com/r/cryptocurrencyclassic/",7,1737570350.0,2025-01-22 18:25:50
1i7chvb,1Kendu,Awesome - appreciate the lsit,3,1737570406.0,2025-01-22 18:26:46
