post_id,author,body,score,created_utc,date
1iwc8r2,UpsideDownKraken,🚀🚀🚀,6,1740328767.0,2025-02-23 16:39:27
1iwc8r2,Vegas_42,"Amen, brother!",6,1740330005.0,2025-02-23 17:00:05
1iwc8r2,Charming-Hurry6649,???,1,1740338967.0,2025-02-23 19:29:27
1iwavvd,Bobbyvolinski,Comment,1,1740693548.0,2025-02-27 21:59:08
1iw1ofi,TheGDC33,Are you talking about the KENDU to TG? That channel has been dead for a couple weeks or so. Back in the OG TG. What is your name and I can check and get you in if you were banned or muted previously,8,1740285540.0,2025-02-23 04:39:00
1iw1ofi,platniumperson,Not CTO chat. I’m in OG chat but can’t send messages. Another mod tried to fix it but couldn’t. Wondering who else is in the same situation.,6,1740286936.0,2025-02-23 05:02:16
1iw1ofi,RegardedQt314,"if you can actively see the chat and a moderator can't unmute you, it means you've been in tg jail unfortunately.  it happened to me in the past and it's just something that you have to wait out.",6,1740287651.0,2025-02-23 05:14:11
1iw1ofi,platniumperson,Sucks.,6,1740289706.0,2025-02-23 05:48:26
1iw1ofi,Potlimitcrypto,It does indeed suck! You can overcome it by buying Telegram premium. It's pretty cheap.,7,1740291559.0,2025-02-23 06:19:19
1iw1ofi,platniumperson,Is that 100% guarantee that I'll be out of TG jail when I buy premium?,2,1740358107.0,2025-02-24 00:48:27
1iw1ofi,Barnickal,Has worked for me twice.,3,1740358437.0,2025-02-24 00:53:57
1iw1ofi,TheGDC33,Sorry I get no notifications sign in app anymore and have to check the damn spot myself. I forget a lot still. Glad others gave you an answer even if it does suck. Hopefully you are free soon,3,1740354631.0,2025-02-23 23:50:31
1iw1ofi,p0tatemoon,"Sorry I'm not very familiar with how the telegram works, what is a Telegram jail and how can someone end up in there?",4,1740324933.0,2025-02-23 15:35:33
1iw1ofi,Potlimitcrypto,At this point I'm fairly certain Telegram uses it as an aggressive method to get people to buy premium. It seems completely random.,3,1740362820.0,2025-02-24 02:07:00
1iw1ofi,p0tatemoon,"interesting, that's a really weird approach from their end",1,1740409833.0,2025-02-24 15:10:33
1iv5opd,RaskoSmash,Where did u get the stickers?,9,1740192938.0,2025-02-22 02:55:38
1iv5opd,A_true_gENTleman,"I ordered them through StickerYou. They're a little more expensive but I wanted permanent stickers that were higher quality.  When I get some free time, I'll upload the file",10,1740195759.0,2025-02-22 03:42:39
1iv5opd,phi_curious,Way to go champ!!,9,1740206664.0,2025-02-22 06:44:24
1iv5opd,tokenKDN,"We are all responsible for our own success, love the reminder that we are the keepers of our own destiny!",8,1740198289.0,2025-02-22 04:24:49
1iv5opd,wishnyouwerehere,"Spent most of the day reading and researching. It ain't much, but it's honest work.jpeg  https://preview.redd.it/4omna60mmmke1.jpeg?width=495&amp;format=pjpg&amp;auto=webp&amp;s=7bf23656078e0d560d80d2738ca925b37a3552cd",9,1740202208.0,2025-02-22 05:30:08
1iv5opd,cringyusername_123,Amazing entry friend! Wish I bought my first Kendu at this MC,6,1740249262.0,2025-02-22 18:34:22
1iv5opd,lazargwf,Love the stickers! Would love to have those files to get me some stickers too 🦊🪖,6,1740209533.0,2025-02-22 07:32:13
