post_id,author,body,score,created_utc,date
1i7chvb,phi_curious,This is perfect. Thanks for adding more!,3,1737571090.0,2025-01-22 18:38:10
1i7chvb,BTCBette,Awesome. Thx for doing that. I also just posted a link to a Google doc,3,1737568777.0,2025-01-22 17:59:37
1i7chvb,phi_curious,I just saw that. Not sure why the formatting is fucked up in my comment with the links. Can fix it later,2,1737568845.0,2025-01-22 18:00:45
1i7chvb,BTCBette,Looks good on my end 🤷🏻‍♀️,2,1737568866.0,2025-01-22 18:01:06
1i7chvb,phi_curious,"Maybe it’s my phone, maybe it’s maybelline",2,1737568938.0,2025-01-22 18:02:18
1i7chvb,BTCBette,"Also, make sure to leave comments on comments. That's how the post gains traction / achieves higher placement in the sub. And circle back a few times to posts you've already commented on, to respond to new comments and further bump the post up. Together, we can spread the good word of $Kendu!",7,1737567955.0,2025-01-22 17:45:55
1i7chvb,phi_curious,Great point about circling back. Also feel like reddit is so much more about having a proper conversation. So let’s embrace that.,3,1737568403.0,2025-01-22 17:53:23
1i7chvb,BTCBette,💯,2,1737568660.0,2025-01-22 17:57:40
1i7chvb,[deleted],Its better to subtly mention than raid imo. Every other coins raids. Find a good way to mention kendu amongst ofher investors now that g0ff is gone.,3,1737564814.0,2025-01-22 16:53:34
1i7chvb,Lalph-Rauren,"Yeah good thing! Attention is key, especially since the CTO! Everything together is just very bullish for KENDU 🚀",5,1737568448.0,2025-01-22 17:54:08
1i7ey0o,CHARLIEFORTHEBOYS,"[https://t.me/KenduInu\_CTO](https://t.me/KenduInu_CTO)    This is the CTO one, which is the active chat right now with the community. Come in here.     We may eventually go back to the old one at some point, not 100% on that yet though.",14,1737563289.0,2025-01-22 16:28:09
1i7ey0o,Sliderx7X,Thought that might be the case given the activity.,5,1737564617.0,2025-01-22 16:50:17
1i7ey0o,phi_curious,Welcome legend!,4,1737564757.0,2025-01-22 16:52:37
1i7ey0o,BlazedLurker,Same CA?,4,1737567737.0,2025-01-22 17:42:17
1i7ey0o,CHARLIEFORTHEBOYS,yes     ETH: 0xaa95f26e30001251fb905d264Aa7b00eE9dF6C18    SOL: 2nnrviYJRLcf2bXAxpKTRXzccoDbwaP4vzuGUG75Jo45,2,1737568127.0,2025-01-22 17:48:47
1i7ey0o,Honos11,CTO is the new and current one.,10,1737563483.0,2025-01-22 16:31:23
1i7ey0o,Brilliant_Park_3770,https://t.me/KenduInu_CTO,8,1737563075.0,2025-01-22 16:24:35
1i7ey0o,[deleted],Praise kendu in both and you shall become a true 🥷 master.,3,1737564952.0,2025-01-22 16:55:52
1i7ey0o,Mammoth-Lychee3538,Mine is not active.. joined the new group🥹,2,1737568802.0,2025-01-22 18:00:02
1i7ey0o,Lalph-Rauren,The CTO one is the one which is active!  The CA remain the exact same :)  ETH: 0xaa95f26e30001251fb905d264Aa7b00eE9dF6C18  SOL: 2nnrviYJRLcf2bXAxpKTRXzccoDbwaP4vzuGUG75Jo45,2,1737569120.0,2025-01-22 18:05:20
1i7fxvd,StarkReactor4,Chad 💪,2,1737576403.0,2025-01-22 20:06:43
1i7fxvd,TheGDC33,Only three active users in our TG🤣. (Just in case anyone doesn't get it....Lewk is connected to our read only old TG not the hyper active CTO Telegram,2,1737601159.0,2025-01-23 02:59:19
1i7qc25,RegardedQt314,"we're not going to take a stance either way because it has nothing to do with this subreddit.  we're not focused on world politics, we're focused on Kendu.",29,1737591480.0,2025-01-23 00:18:00
1i7qc25,Equal-Character-8120,👍,3,1737631376.0,2025-01-23 11:22:56
1i7qc25,Therzie,"We're not a political movement, Kendu is a global brand.",9,1737613009.0,2025-01-23 06:16:49
1i7qc25,[deleted],"The bigger problem is that people post links to news stories on X... into subreddits.. and people who dont use X cant view them. They clog up heavy traffic subreddits. Its been an issue for a a while.   People dont really post a ton of links to X on this subreddit. A lot of sharing of links to X is in the TG and most people in the TG have X, so they arent links to no where.   I dont think its a problem as far as usability goes, so I dont think anything needs to be done to solve it.",6,1737594589.0,2025-01-23 01:09:49
1i7qc25,Vegas_42,There is always time to be anti-fascist!,8,1737593222.0,2025-01-23 00:47:02
1i7qc25,litecoiner,"That term was co-opted by the communists, in fact they invented it in 1932 (IIRC), the German communist party, while it was under Stalin's rule. Maybe say pro-democracy, unless you truly are a communist, because otherwise many won't get behind it. Sorry for the historic note",1,1737629784.0,2025-01-23 10:56:24
1i7qc25,Vegas_42,"You're right from a historical point of view. The social discourse over the last 90 years adapted this expression in today's language as something against nazis, faschism of all kind and discrimination in general. It's not associated with being a communist today. From a sociological pov it's fine to use ""anti-fascist"" in a context of opposition to nazis without the conotation of being a communist. Sorry for the sociological note.  Sometimes anti-social, always anti-fascist!😎",1,1737631520.0,2025-01-23 11:25:20
1i7qc25,Dyrankun,I wouldn't expect this sub to ban x links as they rely on them quite heavily.  But I sure as fuck have permanently deleted my own x account.  Fuck that guy.,1,1737640233.0,2025-01-23 13:50:33
1i77bcr,zeus109,"I am with you on that one, it's not like we getting money from heaven just to invest in anything and everything. Most of us have really put some blood, tears and sweat into this. Even got people we care so much about into this. To see that guy change dramatically with nonsense talk wich did not make any sense or contribute to anything really pissed me off. I think we are at the perfect time before the bull run really takes off and I hope we will all gonna make it.",14,1737539824.0,2025-01-22 09:57:04
1i77bcr,Jonnymixinupmedicine,"Hell yeah man. It bothers me that I fell for the Miazaki hype, but tbh I’ve been unhappy with the direction since he created Bueno. I think we’re still early. The bull run hasn’t quite gone crazy, but I am worried enough people will get burned with the Trump coin to go back into crypto. Worse, unneeded regulation that may follow.",12,1737540197.0,2025-01-22 10:03:17
1i77bcr,[deleted],"Im in construction too and when I look back at how much money I lost in Kendu, I get flashbacks of all those days that I was out in the hot sun climbing sand dunes building beach stairs. All that money I earned in 2023 completely gone in 2024.  But, theres always more opportunities ahead. Glad youre here.",9,1737550345.0,2025-01-22 12:52:25
1i77bcr,Jonnymixinupmedicine,"I’ve been here since early may. I very unfortunate had to self half my bag to pay for bills right before the run up. It sucks, but it is what it is.   We move on, we continue to build, and I don’t think there is anything stopping us on this point.  It would be pretty funny if some of us job site guys gave Geoff a visit so he can see what real Chad’s look like. Those of us that held, voted, shilled IRL, did TG raids. Anybody who knows a hard days work is a  Chad to me, and there some unchad like guys in construction too, but I can confidently say I don’t look like 5 pounds of shit shoved into a 1 pound bag like our past developer.",7,1737551179.0,2025-01-22 13:06:19
1i77bcr,[deleted],Hahahaha dude Im laughing at that last line.   Same thing happened to me. Had my taxes on extension and the time finally came where I had to pay the big bill... paid it and then all I had left was Kendu to my name and Kendu cant pay the rent.  Im glad to be back in at this low of a price. I remember my first buy was like 10x this price.  We got new ATH's to achieve!,7,1737551422.0,2025-01-22 13:10:22
1i77bcr,Jonnymixinupmedicine,"Yeah, we are at a good DCA level too IMO.",7,1737551659.0,2025-01-22 13:14:19
1i77bcr,UpsideDownKraken,🚀🚀🚀,7,1737538711.0,2025-01-22 09:38:31
1i77ak0,insegniah1,Chad,13,1737538611.0,2025-01-22 09:36:51
1i77ak0,CoopVelociraptor,Chad!,10,1737538944.0,2025-01-22 09:42:24
1i77ak0,lazargwf,Chad!,7,1737540873.0,2025-01-22 10:14:33
1i77ak0,BigRedBruh,And LEWK vote https://lewk.com/vote/0xaa95f26e30001251fb905d264Aa7b00eE9dF6C18,5,1737560379.0,2025-01-22 15:39:39
1i77ak0,bigboydesomo,https://preview.redd.it/mrulhqxvmkee1.jpeg?width=986&amp;format=pjpg&amp;auto=webp&amp;s=3af74f14bcf340a6118967900a516ec151b5a60f,4,1737562998.0,2025-01-22 16:23:18
1i77ak0,bigboydesomo,https://preview.redd.it/410wwuwwmkee1.jpeg?width=1080&amp;format=pjpg&amp;auto=webp&amp;s=28ebe9fa16acbe2ef353b56995f28efc4403bb22,4,1737563007.0,2025-01-22 16:23:27
1i77ak0,patrick2408,Everyday since I’m in.,3,1737568312.0,2025-01-22 17:51:52
1i79h35,Vegas_42,Thanks for the heads up. https://www.inyourowntime.zone/2025-01-22_14.30_Europe.London,8,1737547770.0,2025-01-22 12:09:30
1i7838t,Real_Crab_7396,We support every kendu brand. Expanding our reach is so bullish!,19,1737542667.0,2025-01-22 10:44:27
1i7838t,platniumperson,Will be working on Kendu Gum's own marketing. People need to see Kendu is everything.,16,1737543009.0,2025-01-22 10:50:09
1i7838t,UrbanPKMonkey,"Posts like this are defo ""Barking up the right tree"". Great to see IRL products out there!!",17,1737542821.0,2025-01-22 10:47:01
1i7838t,platniumperson,Thanks chad. Support the community.,16,1737542957.0,2025-01-22 10:49:17
1i7838t,phi_curious,Damn didn’t even know that there are also Kendu gums! Amazing 🤩,15,1737542981.0,2025-01-22 10:49:41
1i7838t,platniumperson,"Yeah man, made a post about it a month ago, but now it is time for everyone to know about it.",16,1737543065.0,2025-01-22 10:51:05
1i7838t,phi_curious,Must have missed it. Such an amazing community!,14,1737543241.0,2025-01-22 10:54:01
1i7838t,petros798,"Well i am from Greece, all I have to say is that Chios gum is very unique and has some medicinal properties too!  Also, since I am from Greece, let me know if I can be of any help",7,1737549902.0,2025-01-22 12:45:02
1i7838t,[deleted],Awesome. Chad Gum 🚀🚀🚀 love to see it,1,1737658656.0,2025-01-23 18:57:36
