post_id,author,body,score,created_utc,date
1i88rzp,RegardedQt314,https://preview.redd.it/kl1fh4wv3see1.jpeg?width=1125&amp;format=pjpg&amp;auto=webp&amp;s=ea4758ec8cc45c7dc44159c41f86800b1b461169  \-Josh,52,1737653482.0,2025-01-23 17:31:22
1i88rzp,phi_curious,"And 10k of those 12k are actually twitter ads you get, right?",27,1737653694.0,2025-01-23 17:34:54
1i88rzp,RegardedQt314,"From what i've been seeing in the tg chat yes, but i also don't know how to verify that claim lol",22,1737653752.0,2025-01-23 17:35:52
1i88rzp,phi_curious,"I tried to google it, don’t know how much advertisement credit we get, but we definitely get some haha",19,1737653947.0,2025-01-23 17:39:07
1i88rzp,RegardedQt314,"im sure you get some kind of ad revenue, hopefully we'll get more clarity on that though.",16,1737654215.0,2025-01-23 17:43:35
1i88rzp,phi_curious,Josh will know for sure.,15,1737654244.0,2025-01-23 17:44:04
1i88rzp,Real_Crab_7396,idk either lol just heard it,6,1737665253.0,2025-01-23 20:47:33
1i88rzp,Lalph-Rauren,"Lets go chads!!!!! 😎  The CTO in full effect right here 🚀  Josh, you are a true legend! ❤️",36,1737653537.0,2025-01-23 17:32:17
1i88rzp,CHARLIEFORTHEBOYS,thank god,37,1737653842.0,2025-01-23 17:37:22
1i88rzp,Jonnymixinupmedicine,"For fucking real.   I’m stoked again! With nothing to weigh us down, the sky is the limit. The community is the ONLY reason this coin is still alive, and I’m glad you’re still here.",24,1737654043.0,2025-01-23 17:40:43
1i88rzp,TheGDC33,The relief is real! Is website already secured and ours fully?,24,1737654939.0,2025-01-23 17:55:39
1i88rzp,insegniah1,"I believe so yes, domain has been handed over",8,1737667615.0,2025-01-23 21:26:55
1i88rzp,TheGDC33,"Nice. I kinda figured since Keito basically designed it, but want to make sure",6,1737668085.0,2025-01-23 21:34:45
1i88rzp,insegniah1,"Think we still had all that regardless which was nice, but now we also in process of redesigning too to put the past in the past",3,1737687147.0,2025-01-24 02:52:27
1i88rzp,TheGDC33,♥️,3,1737689130.0,2025-01-24 03:25:30
1i88rzp,Head_Standard_2878,JOOOOOOOOOOOOOOOOOOOOOOOOOOOOOOOOOOOOOOOOOOOOSH,27,1737653739.0,2025-01-23 17:35:39
1i88rzp,KenduGNX,Everything finally falling into place for Kendu. Just in time for the memecoin supercycle.,29,1737654005.0,2025-01-23 17:40:05
1i88rzp,HamsterDunce,Nice,20,1737654353.0,2025-01-23 17:45:53
1i88rzp,lazargwf,Very good news!! 🚀,14,1737655694.0,2025-01-23 18:08:14
1i88rzp,ResonanceCascade1998,Not sure if anyone doubts it but I've seen many things that shows Josh's good will towards this community. I'm not always right but he's a good guy from what I can tell.,14,1737658416.0,2025-01-23 18:53:36
1i88rzp,boathouse_floats,Bullish AF!,28,1737653419.0,2025-01-23 17:30:19
1i88rzp,1Kendu,Incredible!  This CTO is so bullish - clear skies ahead!,31,1737653427.0,2025-01-23 17:30:27
1i88rzp,Equal-Character-8120,"Even if he exaggerated a little, the matter is very transparent...Well Done.",13,1737656207.0,2025-01-23 18:16:47
1i88rzp,Real_Crab_7396,good way to get our subreddit viral too. 2k views already. They say doge got big because their own subreddit was so viral it came in a lot of random redditors their FYP.,10,1737665322.0,2025-01-23 20:48:42
1i88rzp,tokenKDN,Excellent news - and full trust in the team following the CTO! Huge milestones ahead!,5,1737670253.0,2025-01-23 22:10:53
1i88rzp,tokenKDN,Another huge milestone after the CTO - progress is thick and fast now - to the moon we go!,2,1737689502.0,2025-01-24 03:31:42
1i88rzp,J0E_SpRaY,So glad this sub has decided supporting a Nazi sympathizer is worth it if there’s a minuscule chance you can get rich.,-2,1737675229.0,2025-01-23 23:33:49
1i88rzp,Real_Crab_7396,wtf are you talking about?,2,1737710332.0,2025-01-24 09:18:52
1i88rzp,phi_curious,I guess they are mad that we paid for twitter because Musk is currently labeled as a Neonazi.,3,1737718669.0,2025-01-24 11:37:49
1i88rzp,Real_Crab_7396,yeah but we also use telegram which is full of pedos and we also use the blockchain which is full of criminals Does that mean we support them?,2,1737733477.0,2025-01-24 15:44:37
1i88rzp,phi_curious,"Of course not, just trying to explain the comment. I don’t agree with it.",1,1737733524.0,2025-01-24 15:45:24
1i88rzp,Real_Crab_7396,"yeah ik, just shows how stupid the statement is",3,1737733677.0,2025-01-24 15:47:57
1i8d73j,Flipflops365,Welcome to the 200m club!,12,1737668120.0,2025-01-23 21:35:20
1i8d73j,insegniah1,Good job legend!,10,1737667550.0,2025-01-23 21:25:50
1i8d73j,bigboydesomo,🥰,8,1737667775.0,2025-01-23 21:29:35
1i8d73j,phi_curious,Welcome to the club 🔥🔥🔥,10,1737668646.0,2025-01-23 21:44:06
1i8d73j,cryptosader,GIGA CHAD,9,1737669319.0,2025-01-23 21:55:19
1i8d73j,Hungry-Assistance-14,Congrats!!,5,1737669837.0,2025-01-23 22:03:57
1i8d73j,No-Confection3699,Chad! Thats gonna retire you man,3,1737670205.0,2025-01-23 22:10:05
1i8d73j,tokenKDN,Excellent work mate!,3,1737674104.0,2025-01-23 23:15:04
1i8d73j,yourwillbdone,Will 50m do it….? Asking for a friend 🤷🏽‍♂️😂,1,1737799090.0,2025-01-25 09:58:10
1i8d73j,Tryptamine_Mind,I reached 100m the last week 😁😁,1,1737924774.0,2025-01-26 20:52:54
1i8d73j,p0tatemoon,congrats! That's a swole bag for sure 🦾,1,1737952727.0,2025-01-27 04:38:47
1i8c6xh,1Kendu,Massive chad sees the power of the Kendu Army - soon the world,19,1737661831.0,2025-01-23 19:50:31
1i8c6xh,phi_curious,Yes guys smash that post  ![gif](giphy|ieR5Ssk8EG23e|downsized),19,1737661813.0,2025-01-23 19:50:13
1i8c6xh,SeparateDonkey8843,100%,14,1737662165.0,2025-01-23 19:56:05
1i8c6xh,W-D-Goldbeard,Me Pirate vote be in 🫡🏴‍☠️,16,1737662391.0,2025-01-23 19:59:51
1i8c6xh,bigboydesomo,NiCe,7,1737664353.0,2025-01-23 20:32:33
1i8c6xh,[deleted],Smashed 🫡🪖,3,1737669710.0,2025-01-23 22:01:50
1i8dn8p,RegardedQt314,did you see the KenduStats bot has a holderchart now??,5,1737685501.0,2025-01-24 02:25:01
1i8dn8p,RegardedQt314,https://preview.redd.it/mg3im648ruee1.jpeg?width=640&amp;format=pjpg&amp;auto=webp&amp;s=9428c35ec0fbf112fe04decde0493154be58abc5,7,1737685528.0,2025-01-24 02:25:28
1i8dn8p,TheGDC33,Ohh shit no! Great news. Is there a reason post was not approved?,3,1737689091.0,2025-01-24 03:24:51
1i8dn8p,RegardedQt314,honestly i didn't see that the post was removed anywhere until you sent me the direct link to it 😵‍💫,3,1737692825.0,2025-01-24 04:27:05
1i8dn8p,TheGDC33,"No I know that. I was wondering even after sending the direct link it is still not approved. Is there a reason (or is it just broken....I guess that is my fear that Reddit is finding new ways to silence me😂) at least that is how it is showing up on my profile (red trash symbol)  Edit: phew it is up and probably has been for sometime. Weird, guess I am just nervous of a stronger shadow ban🤣",2,1737721740.0,2025-01-24 12:29:00
1i8dn8p,RegardedQt314,"oh it just took me a bit to approve it because i ended up taking a nap when you sent it 😅  yeah idk why reddit hates your account so much, feel free to dm me on telegram or here if you need a post approval in the future 🤝",1,1737722803.0,2025-01-24 12:46:43
1i8dn8p,TheGDC33,Thanks man sorry to be a pain. Now my metric post from today seemed to go up and stay up with no issues. No idea anymore and appreciate you as always,1,1737758273.0,2025-01-24 22:37:53
1i8dn8p,RegardedQt314,no worries! appreciate you too chad 🤝,1,1737763608.0,2025-01-25 00:06:48
1i8dn8p,[deleted],20k incoming,3,1737751480.0,2025-01-24 20:44:40
1i8dn8p,TheGDC33,"For real, steady growth is great",3,1737759588.0,2025-01-24 22:59:48
1i8dn8p,problematic_ash,Whole lot of people selling for pennies on the dollar.,2,1737784694.0,2025-01-25 05:58:14
1i8e2c0,phi_curious,Smashed it earlier today!,8,1737666624.0,2025-01-23 21:10:24
1i8e2c0,bigboydesomo,Thx chad,7,1737666982.0,2025-01-23 21:16:22
1i8e2c0,W-D-Goldbeard,"Thank ye fer the reminder, tis great work 🪖  Me Pirate vote already be in fer the day 🫡🏴‍☠️     Together we $KENDU it! 🤝  🐶📈💰",6,1737667746.0,2025-01-23 21:29:06
1i8e2c0,[deleted],Smashed earlier today 🔥💯🪖,3,1737669690.0,2025-01-23 22:01:30
1i8e2c0,balatongadobo,Is this allowed in TG? I think I've been banned from sharing this link😐,1,1737682394.0,2025-01-24 01:33:14
1i87zlz,Medevil_Coconut,RUN IT UP FOLKS,15,1737651523.0,2025-01-23 16:58:43
1i87zlz,RegardedQt314, nice job compiling this!   everything has been smashed 👊,8,1737655643.0,2025-01-23 18:07:23
1i87zlz,[deleted],Running it up 🚀🚀,7,1737655710.0,2025-01-23 18:08:30
1i87zlz,Due-Wrongdoer2887,Thanks for update 🫶,3,1737656371.0,2025-01-23 18:19:31
1i87zlz,TheGDC33,"All of them smashed, thanks this is super helpful during the week!",3,1737660941.0,2025-01-23 19:35:41
1i87zlz,tokenKDN,Smashed the lot - and LOVE the sponsor event - CTO killin the shillin rn!!,1,1737676528.0,2025-01-23 23:55:28
1i82ev2,Visual_Ad_6630,Repost this on different subreddits related to crypto,27,1737636350.0,2025-01-23 12:45:50
1i82ev2,StarkReactor4,Great idea!,13,1737643087.0,2025-01-23 14:38:07
1i82ev2,[deleted],I see Waldo!,13,1737636712.0,2025-01-23 12:51:52
1i82ev2,UpsideDownKraken,🚀🚀🚀,12,1737643442.0,2025-01-23 14:44:02
1i82ev2,Putrid_Scallion_5236,Sucks to be them,13,1737636766.0,2025-01-23 12:52:46
1i82ev2,TheGDC33,Well I wouldn't say we had it very easy or great overall especially if you got any Kendu Chads NFTs. But we are working and inspired again and the TG is electric,15,1737647568.0,2025-01-23 15:52:48
1i82ev2,BTCBette,The vibes in the TG are incredible. And the community's output is inspiring. The MC will soon reflect all of that. 🚀,3,1737668400.0,2025-01-23 21:40:00
1i82ev2,W-D-Goldbeard,Reposting to X now 🫡🏴‍☠️,5,1737660693.0,2025-01-23 19:31:33
1i82ev2,bdora48445,Can’t relate been doing good with Kendu,2,1737667484.0,2025-01-23 21:24:44
1i82ev2,misterweatherbee,What app/site is this that can generate these graphics?,2,1737674847.0,2025-01-23 23:27:27
1i82ev2,tokenKDN,Shining light in the sea of red! We better get used to this at it will be happening a hell of a lot more!,2,1737676699.0,2025-01-23 23:58:19
1i82ev2,phi_curious,A green tropical island paradise in a sea of red,2,1737816849.0,2025-01-25 14:54:09
1i811ko,phi_curious,This. Been on threads too. We need to coordinate our efforts. I think there will be a VC about that soon.,47,1737631087.0,2025-01-23 11:18:07
1i811ko,platniumperson,Yes join TG if you haven’t already. Lots of news come there first.,30,1737631128.0,2025-01-23 11:18:48
1i811ko,phi_curious,This one for anyone interested: https://t.me/KenduInu_CTO,9,1737631155.0,2025-01-23 11:19:15
1i811ko,KenduGNX,Threads has been a great platform for finding new Chads. Everybody should sign up for the Threads Kendu takeover!  I made an alt Kendu Instagram account to link to threads in case anyone else is concerned about doxxing themselves.   Let’s get it!,32,1737631106.0,2025-01-23 11:18:26
1i811ko,platniumperson,"We will own Threads. Good idea to create an alt account, it takes 2 minutes max. Make sure to follow everyone who is also doing the same thing as us.",24,1737631289.0,2025-01-23 11:21:29
1i811ko,L3nni8,This man gets it. If you do one thing... then work while its so easy there!,34,1737631061.0,2025-01-23 11:17:41
1i811ko,platniumperson,"Yes, no competition at Threads.",27,1737631148.0,2025-01-23 11:19:08
1i811ko,CoopVelociraptor,"Shit ok, but if any mf asks me what brand satchel I wear or complains to me about parking spots being too small for minivans…",16,1737634785.0,2025-01-23 12:19:45
1i811ko,JaegerRey,Ah great idea chad  Im gonna start shilling there too  Lets keep dominating the socials 💪🪖,15,1737635129.0,2025-01-23 12:25:29
1i811ko,Putrid_Scallion_5236,"Ok sick, threads isnt my go to, so didnt know about it. But ill check it out",13,1737635179.0,2025-01-23 12:26:19
1i811ko,ofad-,I've been shilling there too and it's almost like shilling by dm. It's not saturated as X and people actually get to see your comments.,12,1737636143.0,2025-01-23 12:42:23
1i811ko,Seanonethree,First off… $85 XRP! Wow! Lol! Dreamers dream I guess   Second… never looked into Threads but had heard about it. Guess I’ll have to check it out. I don’t really need more social media in my life but I’m interested nonetheless.,5,1737656882.0,2025-01-23 18:28:02
1i811ko,bigboydesomo,Yeag you can make an indtagram list and it shares them  to threads too,2,1737667691.0,2025-01-23 21:28:11
1i811ko,Brilliant_Park_3770,Let's share the addresses with them in detail   ETH: 0xaa95f26e30001251fb905d264Aa7b00eE9dF6C18  SOL: 2nnrviYJRLcf2bXAxpKTRXzccoDbwaP4vzuGUG75Jo45,2,1737677815.0,2025-01-24 00:16:55
1i84ynb,phi_curious,I want a strategic kendu reserve. Or a kendu etf. If doge gets one we should too!!,21,1737643790.0,2025-01-23 14:49:50
1i84ynb,kingkongbananakong,Definitely not impossible but no doubt we need to grow a whole lot first,15,1737644132.0,2025-01-23 14:55:32
1i84ynb,phi_curious,Lets aim for next cycle with the ETFs ;),10,1737645443.0,2025-01-23 15:17:23
1i84ynb,cryptosader,Kendu ETF by late 2026 - early 2027. I Believe!,13,1737645396.0,2025-01-23 15:16:36
1i84ynb,phi_curious,At some point it will happen!,11,1737645461.0,2025-01-23 15:17:41
1i84ynb,cryptosader,Absolutely!,7,1737645600.0,2025-01-23 15:20:00
1i84ynb,Drainflowartist,If only we could get a shout out by Elon…. That would put us and keep us in front of a lot of eyeballs.,9,1737645196.0,2025-01-23 15:13:16
1i84ynb,cryptosader,It's improbable since Elon has only acknowledged shib (apart from doge &amp; btc ofc) and he only did that because shib was stealing doge's spotlight but shilling kendu in his comment section as soon as he posts and raiding those comments are a good way to rack up views / visibility and maybe attract new people,8,1737645580.0,2025-01-23 15:19:40
1i84ynb,DonDengue,And get your account suspended.  Raiding Elon you are asking for trouble,1,1737684043.0,2025-01-24 02:00:43
1i84ynb,cryptosader,lol you don't get your account suspended because you comment to a kendu related tweet and like it just because its on an Elon post,1,1737727729.0,2025-01-24 14:08:49
1i84ynb,DonDengue,Hey tried to help. You do. I’ve been in Kendu since early April.  Many have had it suspended I for one. Speaking from experience   Go spam the shit out of Elon. Was trying to be helpful,1,1737727838.0,2025-01-24 14:10:38
1i84ynb,cryptosader,"i've been commenting under elon since i've opened my account never had a problem , if you got suspended the reason was another one and not just because of elon...",2,1737728115.0,2025-01-24 14:15:15
1i84ynb,DonDengue,Just go into the TG and ask “ is it ok to spam Elon”  I’m out. Take care,1,1737740160.0,2025-01-24 17:36:00
1i84ynb,hazzaon,I doubt we'd have a chance tbh not until 500 million mc minimum,6,1737645436.0,2025-01-23 15:17:16
1i84ynb,W-D-Goldbeard,"The be the right kinda news! Let's make $KENDU a highly organised crypto legend. So far I've seen suggestion fer a game, voting, a BTC reserve, and ""squad"" meet ups.   If we can get these functional 'nd incorporated into $KENDU,  we will stand tall above the other memecoins!  Together we $KENDU it! 🤝  Because we don't gamble, we WORK 🪖🐶",6,1737655856.0,2025-01-23 18:10:56
1i84ynb,--Tom-,Where did you hear that?,5,1737648961.0,2025-01-23 16:16:01
1i84ynb,cryptosader,"Lummis got chosen as head of digital assets committee , she mentioned that sbr is top priority, trump just talked live about how usa will become the capital of crypto , trump will also talk with el salvadors president and will order an executive order in less than 3 hours, everything points at SBR",5,1737651585.0,2025-01-23 16:59:45
1i84ynb,[deleted],"Trumps speaking live at world economic forum as I type this. No mention of crypto so far. I dont see him using this platform for it. I think he'd announce it to the us rather than the world. My guess, Idk really.",2,1737650413.0,2025-01-23 16:40:13
1i84drq,Equal-Character-8120,"With all the rugs and manipulations in almost every coin, $KENDU looks like morning dew...clean and full of hope. Les Goh 🪖",11,1737642580.0,2025-01-23 14:29:40
1i84drq,[deleted],Everyone loves an underdog story!!,8,1737648356.0,2025-01-23 16:05:56
1i84drq,Pedrc0,"Im here since the very first pumps and finnaly Im seeing people getting excited again, in the same way when I first got in.   I didn't sold my bag, but almost lost complete  interest in the last few months. Now, with that chapter over, Im once again looking foward for the future of Kendu",6,1737650061.0,2025-01-23 16:34:21
1i84drq,problematic_ash,So we all hope. My investment in this BS is down &gt;75%,3,1737784640.0,2025-01-25 05:57:20
1i89ty8,SpoonyLoveee69,"Yes, that entire telegram is a scam",39,1737656003.0,2025-01-23 18:13:23
1i89ty8,kendu_kenner,Come to the real one at www.t.me/kenduinu_cto,21,1737657646.0,2025-01-23 18:40:46
1i89ty8,DonDengue,Scam,22,1737656085.0,2025-01-23 18:14:45
1i89ty8,TheGDC33,🤛♥️,4,1737660674.0,2025-01-23 19:31:14
1i89ty8,Vegas_42,Scam💯,18,1737656215.0,2025-01-23 18:16:55
1i89ty8,Ok-King-1846,Am I not on the correct telegram thread?,15,1737656122.0,2025-01-23 18:15:22
1i89ty8,jbraden,https://t.me/KenduInu_CTO  The Real Kendu Inu.,17,1737657568.0,2025-01-23 18:39:28
1i89ty8,phi_curious,No. The new TG after the CTO is this one https://t.me/KenduInu_CTO,13,1737657321.0,2025-01-23 18:35:21
1i89ty8,Ok-King-1846,"Dude, how scary! It looks entirely legitimate and has many people replying to it and saying that they got their tokens migrate successfully. A lot of people are gonna be taking advantage of through that thread. Is there no way to have it taken down?",16,1737656337.0,2025-01-23 18:18:57
1i89ty8,RegardedQt314,"they utilize bots heavily to trick people. like the other comments have said, we had to create a new telegram after the CTO so i would advise moving there.  i think it is still undecided if we are going to move back to the old telegram or not at this point but make sure to join the new one for official updates.   https://t.me/KenduInu_CTO",11,1737658086.0,2025-01-23 18:48:06
1i89ty8,A_N3rdy_Guy,Anytime someone is urging to do something quick your brain should immediately say stop and think.,14,1737657810.0,2025-01-23 18:43:30
1i89ty8,bagelwcheesee,yes!,11,1737656262.0,2025-01-23 18:17:42
1i89ty8,Equal-Character-8120,Scam. 🪝,9,1737656355.0,2025-01-23 18:19:15
1i89ty8,Ok-King-1846,Thank you everybody for your reply. Does anybody know the correct TG thread that I need to join?,5,1737656401.0,2025-01-23 18:20:01
1i89ty8,cryptosader,[https://t.me/kenduinu\_cto](https://t.me/kenduinu_cto),6,1737657904.0,2025-01-23 18:45:04
1i89ty8,Ok-King-1846,"I have to admit, I'm 56 and new to cryptocurrency and telegram but when I search on telegram not much comes up except the thread above. In previous chats, does TG not stand for telegram and if it does then how will I find the correct Kendu community on it?",6,1737657131.0,2025-01-23 18:32:11
1i89ty8,phi_curious,The one you were in tried to mimic our old TG channel. Basically it was made to look exactly like the legit one.  But we have a new one now: https://t.me/KenduInu_CTO,5,1737657387.0,2025-01-23 18:36:27
1i89ty8,Ok-King-1846,Thank you,4,1737658952.0,2025-01-23 19:02:32
1i89ty8,phi_curious,You are welcome. Make sure to say hi in the Telegram :)),3,1737658978.0,2025-01-23 19:02:58
1i89ty8,CHARLIEFORTHEBOYS,scam,6,1737658904.0,2025-01-23 19:01:44
1i89ty8,W-D-Goldbeard,Be careful matie 'nd check thing here on Reddit often 🫡🏴‍☠️,6,1737660632.0,2025-01-23 19:30:32
1i89ty8,warmwhale,"scam, stay away from fake channels      the current kendu telegram is [www.t.me/kenduinu\_cto](http://www.t.me/kenduinu_cto)",5,1737659637.0,2025-01-23 19:13:57
1i89ty8,Doc_Holiday_x,Is there anyway we could post a pinned message warning people about this?,4,1737659258.0,2025-01-23 19:07:38
1i8d7p9,Real_Crab_7396,not me lol,2,1737665471.0,2025-01-23 20:51:11
1i8d7p9,Synthexlive,Here melodic hitech freshly baked by me  https://on.soundcloud.com/3wxnkYbffM1hzcHw5,1,1737838320.0,2025-01-25 20:52:00
1i7zf1z,No-Confection3699,"Finally Kendu CTO'ed and got rid of cartman.   Kendu has proven to have established one of the (if not the!) must powerful communities in defi.   Im glad to see where this can go without a shady dev dumping on the chart.   Looks like the market has responded well to the CTO, and tbh i dont think there are any limits to where Kendu can go.   I reentered, tg vibes are back and im seeing a lot of big profiles re entering.   Well done Kendu!",50,1737623742.0,2025-01-23 09:15:42
1i7zf1z,phi_curious,"The CTO was soooo necessary. Super happy for all the loyal supporters of Kendu. I always held a small bag, but was staying on the sidelines due to the former dev. He rubbed me the wrong way. Now with the CTO Kendu has become my high conviction token. Super excited for what’s coming :))",24,1737627608.0,2025-01-23 10:20:08
1i7zf1z,Green_Candler,Finally,16,1737632765.0,2025-01-23 11:46:05
1i7zf1z,phi_curious,I know right 😭,12,1737634514.0,2025-01-23 12:15:14
1i7zf1z,cringyusername_123,Dude Cartman is so accurate 😭,9,1737640977.0,2025-01-23 14:02:57
1i7zf1z,lordanix,Cartman? Lol,2,1737758125.0,2025-01-24 22:35:25
1i7zf1z,Kendu_highpriestess,We need a Kendu Chad chasing Cartman away meme immediately.,1,1737829350.0,2025-01-25 18:22:30
1i7zf1z,platniumperson,"Remember the ethos: “we don’t gamble, we work”.  That’s what makes us stand out from the rest of the memecoin space. Much larger coins slack off, we will overtake them if our output is greater.  Wen lambo? When you work.",33,1737623765.0,2025-01-23 09:16:05
1i7zf1z,phi_curious,"That’s how I found you. You guys were raiding so hard with such high energy that I first thought you were all bots 😂😂 but when I realized that it’s all real people in a high energy and passionate community I secured some bag of Kendu. Now with the CTO I properly joined the community, I feel like now I can promote with good conscience.",25,1737627707.0,2025-01-23 10:21:47
1i7zf1z,MFSkunk17,Same! Kendu community is insane!,22,1737627835.0,2025-01-23 10:23:55
1i7zf1z,phi_curious,"I know, unreal. The Telegram is absolutely nuts too. None of my other groups is so active and busy working.",20,1737628100.0,2025-01-23 10:28:20
1i7zf1z,platniumperson,Hahah well if the dev was honest we would be so much higher. Now we can do that without dead weight.,17,1737627810.0,2025-01-23 10:23:30
1i7zf1z,phi_curious,Exactly. At the moment there is sort of a „mismatch“ between community strength and market cap. If you’d go by the community Kendu imho should have hit the billions already. It’s the most logical investment in crypto at this point of the cycle.,20,1737628206.0,2025-01-23 10:30:06
1i7zf1z,platniumperson,Undervalued. We have more active tg chats than large caps like SPX and Giga which are in the billion mc zone. No reason not to be there. Now we work.,19,1737628353.0,2025-01-23 10:32:33
1i7zf1z,phi_curious,Exactly this. This community works hard.,8,1737634552.0,2025-01-23 12:15:52
1i7zf1z,Green_Candler,We Continue to Work,14,1737632961.0,2025-01-23 11:49:21
1i7zf1z,bigboydesomo,Kendu is s true gem,19,1737628783.0,2025-01-23 10:39:43
1i7zf1z,Green_Candler,true... we Buy and HODL,15,1737632995.0,2025-01-23 11:49:55
1i7zf1z,CoopVelociraptor,"Ok but, tell me why we ain’t sending into Kendu-Tok and Insta? Our vibes are perfect and we’ve got so many in our community capable of pushing out 🔥 short-form content and memes. Our raids could really work magic on the algorithm to help us gain mass audiences. Just a thought.  Otherwise agree with locking in g. We gotta run this bitch up!",12,1737635156.0,2025-01-23 12:25:56
1i7zf1z,TheGDC33,Everyone has to raid wherever they can and we need to push into new socials,11,1737636018.0,2025-01-23 12:40:18
1i7zf1z,CoopVelociraptor,"Heard! That’s kinda what ima saying, Threads is just re-treading what we do on Twitter. We haven’t really pushed those other platforms and that’s where our best content would truly shine 🫡",10,1737636915.0,2025-01-23 12:55:15
1i7zf1z,[deleted],"I agree. I have seen a lot less posts about Kendu on Reddit, my go to platform. Starting chiming in on your guys's posts. I have a doxxed Reddit account and am going to start leaving posts everywhere like a little Kendu business card.  Do we have something small and too the point with sone metrics on it? Like holder count and the solana and eth addresses?  Be nice to just creep around and leave comnents to be seen by other people in the cryptosphere.",10,1737638198.0,2025-01-23 13:16:38
1i7zf1z,Reasonable-Glass5381,"""Do we have something small and too the point with sone metrics on it? Like holder count and the solana and eth addresses?""  Jump into the TG. We have filters for holders and ca. Many people also track other metrics that could be useful  Holders atm i write this:  There are **17,344** on-chain holders  ETH: 16,584  SOL: 760  Contract addresses (Remember to always verify)   ETH: 0xaa95f26e30001251fb905d264Aa7b00eE9dF6C18  SOL: 2nnrviYJRLcf2bXAxpKTRXzccoDbwaP4vzuGUG75Jo45",8,1737641235.0,2025-01-23 14:07:15
1i7zf1z,[deleted],I know how to access this info. :) Im looking for an image guys. Like that looks like a business card. Maybe this afternoon i can go on vista print and design one and save the image.  Im just brainstorming an idea where I can put a sharp looking image up similiar to like when you get handed a nicely done business card.,8,1737642989.0,2025-01-23 14:36:29
1i7zf1z,bigboydesomo,"There are 17,344 on-chain holders ETH: 16,584 SOL: 760   There you go bro",7,1737640892.0,2025-01-23 14:01:32
