post_id,author,body,score,created_utc,date
1i7noa5,tokenKDN,"Very honest and humble - one commitment in the CTO is that we all move on and forget the life under the old regime. Emotions were understandably high and I think it is fair to say that most in the community, particularly the longer term holders, were under huge stress. It also shows the strength of the community with the DM you received offering warmth and reconciliation over retaliation, thats what Kendu is all about!  The line in the sand has been drawn and we move forward together!  See you on the moon Chad!",37,1737584653.0,2025-01-22 22:24:13
1i7noa5,TheGDC33,Yup I think I have been here long enough to really feel it and this is probably my final step.,12,1737593821.0,2025-01-23 00:57:01
1i7noa5,Green_Candler,Well said  Appreciated honesty🙏,27,1737584731.0,2025-01-22 22:25:31
1i7noa5,PureClass247,To the Moon with Honesty,27,1737584867.0,2025-01-22 22:27:47
1i7noa5,[deleted],🤝 Lets go!,19,1737587398.0,2025-01-22 23:09:58
1i7noa5,flyflex1985,"Everyone comes to the truth at different times, what’s important is that you arrived! Welcome home",18,1737588735.0,2025-01-22 23:32:15
1i7noa5,RegardedQt314,"there is no need to be harsh on yourself, a lot of us drank the koolaid at some point during this project's life. some wisened up faster/sooner than others but at the end of the day we all realized the truth eventually.    i don't believe that rubbing it in is the way forward for those who knew things were not right before the rest of us, but i also don't blame them for wanting some kind of carthartic moment especially if they were mistreated because of their opinion.  like you said im willing to take it on the chin, but i hope we can all move past it ultimately.   this probably will be one of, if not, the biggest learning experience for all of us when it comes to our own individual futures in crypto.  sometimes you just unfortunately have to experience these things firsthand to really learn from them.",17,1737588843.0,2025-01-22 23:34:03
1i7noa5,TheGDC33,Always appreciate you. Just part of the process.,13,1737593912.0,2025-01-23 00:58:32
1i7noa5,[deleted],Agreed. Im glad to be here with you guys and not on the sidelines creeping on the subreddit unable to post anything! This last weeks been crazy!,13,1737599325.0,2025-01-23 02:28:45
1i7noa5,TheGDC33,Glad you are back 🥰,12,1737599410.0,2025-01-23 02:30:10
1i7noa5,Omegacarlos1,You deserve to be celebrated. Your type are rear.,18,1737585162.0,2025-01-22 22:32:42
1i7noa5,TheGDC33,Thanks,11,1737593894.0,2025-01-23 00:58:14
1i7noa5,North-Town4883,Nice post    Passion can be blinding    Now go hunt bots ❤️,7,1737620319.0,2025-01-23 08:18:39
1i7noa5,TheGDC33,🤣thanks I will,3,1737635868.0,2025-01-23 12:37:48
1i7noa5,insegniah1,"Utmost respect for you chad.  I think many of us feel similar in hindsight. It was a difficult position to be in and I think many of us were doing the best jobs we could at the time, with the knowledge we had.  This is something we will back on in the next few months, when Kendu is sat in the billions, with a laugh and a smile on our faces.",3,1737702372.0,2025-01-24 07:06:12
1i7noa5,TheGDC33,I reckon that is not only the goal but the likely outcome.,2,1737721866.0,2025-01-24 12:31:06
1i7noa5,According_Smell_5688,Don’t be so hard on yourself. Acknowledging your actions and taking responsibility is more than most people can muster. I entered the old TG a few months ago planning to “save” the community that I knew was still below the surface. I couldn’t believe the comments still backing miazaki despite the performance of the coin.   I felt that the community were sheep waiting to be fed on more by the wolf. I should have respected everyone’s perspective independent of my own. I was muted rather quickly as Kevin F. told me to just stop. He didn’t tell me I was out of line or that I was being aggressive. Just stop. I should have. I should have had more faith in all of you. I’m sure we’ve lost some for good but that’s ok.   Onward and upward my friends. I’m happy to see the community that I saw for the first time in May of last year. NOW it’s time for monogram bathrobes and martinis. Cheers.,2,1737724785.0,2025-01-24 13:19:45
1i7noa5,TheGDC33,I like the bathroom robe visual,1,1737758350.0,2025-01-24 22:39:10
1i7noa5,bigboydesomo,Transparent pur now kendu cto  Money goes up and up and up  https://preview.redd.it/mt19ingf5qee1.jpeg?width=1280&amp;format=pjpg&amp;auto=webp&amp;s=3d402b49d873deef5655331a328237080f4e6020,1,1737629769.0,2025-01-23 10:56:09
1i7unjp,W-D-Goldbeard,Done matie 🫡🏴‍☠️,2,1737672012.0,2025-01-23 22:40:12
1i7unjp,skillmattic,😎 🪖🫡🏴‍☠️,2,1737679388.0,2025-01-24 00:43:08
1i7n0qw,PureClass247,Lets Go Chads,7,1737583188.0,2025-01-22 21:59:48
1i7n0qw,Green_Candler,We work,7,1737583413.0,2025-01-22 22:03:33
1i7n0qw,PureClass247,Never Lazy,7,1737583516.0,2025-01-22 22:05:16
1i7n0qw,BTCBette,Hardest working bunch of chads/ettes that I know!,5,1737584132.0,2025-01-22 22:15:32
1i7n0qw,PureClass247,Spot on!!! LFG Chadette🚀,6,1737584428.0,2025-01-22 22:20:28
1i7n0qw,tokenKDN,They are one - we are one unstoppable force!,6,1737584707.0,2025-01-22 22:25:07
1i7n0qw,PureClass247,unstoppable force! for sure,3,1737584955.0,2025-01-22 22:29:15
1i7n0qw,bigboydesomo,We are kendu   You are kendu   We kendu it,3,1737630724.0,2025-01-23 11:12:04
1i7n0qw,PureClass247,Kendu Spirit all through,2,1737632539.0,2025-01-23 11:42:19
1i7kki3,_brap_,Real recognise real. We’ve been through a lot as a community. It’s nice to see a new chad on board,34,1737576543.0,2025-01-22 20:09:03
1i7kki3,phi_curious,This. Legends recognize legends.,12,1737579754.0,2025-01-22 21:02:34
1i7kki3,RegardedQt314,"gave them a follow and a reply 🤝  lots of big eyes will start to focus on Kendu now because of what has happened.  old management soured opinions of the project, but we're able to change those opinions for the better thanks to recent decisions.",22,1737576761.0,2025-01-22 20:12:41
1i7kki3,BTCBette,"Anyone who comes into the TG will immediately see just how real $Kendu is. And how undervalued too. Smart play, HiRez!",15,1737578698.0,2025-01-22 20:44:58
1i7kki3,AdventOfWonder,The tone has completely changed this past week. Kendu is a born again god-tier project. I’m buying more,13,1737579135.0,2025-01-22 20:52:15
1i7kki3,ProfessionalNet5902,$kendu is the best community out there. Time to fly to new heights!,11,1737579175.0,2025-01-22 20:52:55
1i7kki3,Therzie,Bring the Kendu vibes!! This is huge!!,9,1737579151.0,2025-01-22 20:52:31
1i7l15q,BTCBette,It's the dawn of a new era for $Kendu. Now we are poised to become the memecoin leader we were always destined to be!,13,1737578887.0,2025-01-22 20:48:07
1i7l15q,Equal-Character-8120,We are gaining again...don't stop now.🪖,11,1737577989.0,2025-01-22 20:33:09
1i7l15q,PureClass247,LFG,5,1737582108.0,2025-01-22 21:41:48
1i7l15q,Significant-Sleep498,We fucking back. 🔥,10,1737579084.0,2025-01-22 20:51:24
1i7l15q,PureClass247,yeah chad,7,1737582162.0,2025-01-22 21:42:42
1i7l15q,UpsideDownKraken,🚀🚀🚀,8,1737580975.0,2025-01-22 21:22:55
1i7l15q,W-D-Goldbeard,We weathered the storm 'nd stand together strong 🫡🐶🏴‍☠️,7,1737582408.0,2025-01-22 21:46:48
1i7l15q,TheGDC33,🏴‍☠️🪖,6,1737583037.0,2025-01-22 21:57:17
1i7idl2,UpsideDownKraken,LFG!,15,1737571456.0,2025-01-22 18:44:16
1i7idl2,PureClass247,🚀🐕🚀,5,1737582273.0,2025-01-22 21:44:33
1i7idl2,Cvalle811,![gif](giphy|BjHIjM2YFC3rEUaMrw),12,1737571837.0,2025-01-22 18:50:37
1i7idl2,phi_curious,![gif](giphy|wi8Ez1mwRcKGI),10,1737574718.0,2025-01-22 19:38:38
1i7idl2,Agreeable_Compote_68,![gif](giphy|l0MYMiMPgXO3u6UZa),12,1737573481.0,2025-01-22 19:18:01
1i7idl2,phi_curious,![gif](giphy|Mk18FvOvzEIvOjY4qv|downsized)  I always double dip,8,1737574648.0,2025-01-22 19:37:28
1i7idl2,StarkReactor4,And don’t forget to vote on Lewk!,8,1737576387.0,2025-01-22 20:06:27
1i7idl2,PureClass247,yeah...,3,1737582324.0,2025-01-22 21:45:24
1i7idl2,bigboydesomo,Nammy  whale dips,3,1737610193.0,2025-01-23 05:29:53
1i7p5m4,diablero_T,"Let’s let the SOL degens hear it, Chads!!  🔥🔥🔥",6,1737589354.0,2025-01-22 23:42:34
1i7p5m4,Vegas_42,Done,7,1737593134.0,2025-01-23 00:45:34
1i7p5m4,diablero_T,"Hell yea, thanks brother!! I feel like all the SOL cats need to be reminded that they can ape in, tryin to keep it in front of their eyes 🧡🖤",4,1737593546.0,2025-01-23 00:52:26
1i7p5m4,[deleted],Done 🚀🚀,3,1737596155.0,2025-01-23 01:35:55
1i7p5m4,diablero_T,Let’s go Chad!!,3,1737596961.0,2025-01-23 01:49:21
1i7lw3w,Due-Wrongdoer2887,"Smashed ✅  Let’s do this again every day, chads and chadettes!",5,1737582445.0,2025-01-22 21:47:25
1i7kl34,UpsideDownKraken,HODL!,6,1737576708.0,2025-01-22 20:11:48
1i7kl34,PureClass247,HODL with a diamond Hand💎🐕,2,1737582223.0,2025-01-22 21:43:43
1i77usl,UrbanPKMonkey,"You are doing an outstanding job, and thank you for taking the lead. The issue wasn't with the community, it was with Geoff! Now he has stepped aside we can get on with work without manipulation.",103,1737540542.0,2025-01-22 10:09:02
1i77usl,PureClass247,Well said,46,1737546626.0,2025-01-22 11:50:26
1i77usl,lazargwf,"You are a legend! Thank you for everything you do for this community, Josh! ❤️🪖",85,1737540481.0,2025-01-22 10:08:01
1i77usl,Reasonable-Glass5381,Fresh start with clear blue skies. Upwards and onwards.   Let the phoenix arc begin!,76,1737540614.0,2025-01-22 10:10:14
1i77usl,PureClass247,Time to go UP,35,1737546651.0,2025-01-22 11:50:51
1i77usl,phi_curious,"I said it elsewhere: I was looking at Kendu from the sidelines for a long time. The community has always been passionate, crazy active and energetic.  But for me something felt wrong with the former lead DEV/founder. So I only held a small bag and I could not justify it with my conscience to advertise the project to other people.  Now with the CTO takeover I am convinced that the power of the Kendu community will make this project a massive success. And I am now committed financially and can advocate for the project in good faith.",75,1737541464.0,2025-01-22 10:24:24
1i77usl,PureClass247,felt that way abit b4... Upwards we Move !!!,34,1737546753.0,2025-01-22 11:52:33
1i77usl,phi_curious,Thanks for your reply. i think it’s important people speak up and share those sentiments.,30,1737547004.0,2025-01-22 11:56:44
1i77usl,HamsterDunce,"Yeah to that point I think there is no shame in admitting we all messed up. I’m not privy to all the details and the timeline, but it does feel like this move should have been made earlier. Maybe it needed to be sprung at the exact right moment and with all the details in place, though.  I know the last few months I have felt a little dirty shilling Kendu. I don’t feel that way anymore.",17,1737553887.0,2025-01-22 13:51:27
1i77usl,phi_curious,"I have definitely seen many people sharing a similar sentiment. To me self-reflection is such an important part of the process of implementing a larger change (whether in personal life, professional, etc). I think it’s also important for „outsiders“ to see that the community isn’t only blaming the former DEV but also takes some accountability (obvs only for things within their own control).",17,1737554257.0,2025-01-22 13:57:37
1i77usl,HamsterDunce,"Exactly. We need to rebuild our image across DeFi as a whole. Show to people that we can take accountability for our mistakes, learn from them, and do better. Way better. A lot of people are going to be saying “told ya so” and we need to graciously take those on the chin and prove our character through our actions.",19,1737554617.0,2025-01-22 14:03:37
1i77usl,phi_curious,"Very well said. Got to accept those takes gracefully, ask what the community has to do to make up for it, and then do the work…if one community in crypto can do it, it is this one. I have a lot of faith in the kendu fam.",15,1737554797.0,2025-01-22 14:06:37
1i77usl,Therzie,"Thank you for your inspiring words, Josh!  Forever grateful to everyone who stood up in our darkest of days, in the face of tyranny.   Now come the days of the community!  May they be blessed and green!  Long live Kendu, long love the community!  Les goooooooooooooooooo!!!",71,1737540636.0,2025-01-22 10:10:36
1i77usl,Ok_Cake3477,"You are a legend Josh, that what makes a leader, owning up to your mistakes! Which Geoff never once did. You’ve been holding this community together for a long time and are one of the major reasons we survived this crisis. Let’s run it back up to Glory",65,1737540797.0,2025-01-22 10:13:17
1i77usl,BTCBette,"I'm so thankful that you're here, Josh. I appreciate you for taking a stand and ushering in this bright new era for $Kendu. I appreciate your unwavering commitment to the community and to the project. And I appreciate all that you will do, as you continue to work alongside the $Kendu army to drive $Kendu forward. Let's run it up! 💪🪖🚀",48,1737541150.0,2025-01-22 10:19:10
1i77usl,ResonanceCascade1998,I've seen you do good outside of Kendu. Can't speak for other mods but you were always really chill from what I remember,44,1737541623.0,2025-01-22 10:27:03
1i77usl,exeliam,"An apt analogy. It was truly a climatic battle where good triumphed over greed and evil.   There are no ill feelings, Josh. I have explained to many the rationale behind your actions, and such a choice could not have been easy.  You will be a wonderful leader for Kendu to bring us to the promised land. Onwards!",42,1737541638.0,2025-01-22 10:27:18
1i77usl,Xilaren,"I will rejoin to the Kendu community and get some Kendu back,nice to be back!",44,1737542452.0,2025-01-22 10:40:52
1i77usl,BTCBette,Glad to have you back!,19,1737548268.0,2025-01-22 12:17:48
1i77usl,HamsterDunce,"Welcome back, legend!",12,1737553911.0,2025-01-22 13:51:51
1i77usl,boathouse_floats,Glad to have you back!,7,1737589385.0,2025-01-22 23:43:05
1i77usl,Equal-Character-8120,Hello Josh.,30,1737541458.0,2025-01-22 10:24:18
1i77usl,Strange-Relative9837,Kendu josh,31,1737542057.0,2025-01-22 10:34:17
1i77usl,armenian86,Josh what you and the team did over the weekend was impressive. Yesterday was a true testament of what the community can achieve. We are unchained now. Let’s send it together as a team.,34,1737542193.0,2025-01-22 10:36:33
1i77usl,Real_Crab_7396,To the billions. I trust josh completely. This will be a big step to decentralisatio ,33,1737542266.0,2025-01-22 10:37:46
1i77usl,CoopVelociraptor,"Heard! I already said my piece yesterday, I think the important part is it’s sorted now.  Adelante hacia arriba! 🫡",31,1737542289.0,2025-01-22 10:38:09
1i77usl,SpoonyLoveee69,"This is exactly what we needed, when we needed it. Josh has always been the dev we turned to before he officially had the title. It's fitting in everyway. Love you brother.",33,1737542370.0,2025-01-22 10:39:30
1i77usl,Mammoth-Lychee3538,"With you on the board, I feel safe! Thank you så much for the good work you have put in. The top is only the start! We are going beyond 🚀🚀",34,1737542631.0,2025-01-22 10:43:51
1i77usl,Fuzzy1003,Thanks josh for all the work you put in. Of course also thank you to all the other people involved.,29,1737542789.0,2025-01-22 10:46:29
1i77usl,macfflei,Josh your a legend and so is the whole community.,27,1737544912.0,2025-01-22 11:21:52
1i77usl,cringyusername_123,We love you Josh,27,1737545482.0,2025-01-22 11:31:22
1i77usl,cringyusername_123,Thank you for not giving up and fighting back! Without you we couldn't have done. And everybody would've been rekt,25,1737545578.0,2025-01-22 11:32:58
1i77usl,JaegerRey,Beautiful write up Josh   Thank you for all you been doing for KENDU for the past months  Now KENDU name is clear and we start fresh  Its time for us to take that crown back!!  Because the secret recipe is simple  Its Constant Work 🫡  Les Goh,21,1737545970.0,2025-01-22 11:39:30
1i77usl,DoughnutBusy5981,"Josh, as everyone else here, I am very fond of you taking the seat and I am looking positive on the impact you will bring to the strategic orientation and the general future of this project.   Please keep in mind that you are human as well and have natural physical and mental limits. Please watch out for yourself, we are caring for you on a personal level too - your role was and is a huge load. I am aware that you know all of this, but this community has your back and we try to be just as good as a catching net for you as you are our lead that gives us stability.     As for your original post: Water under the bridge for me. Thanks for opening up about this. It was a moral dilemma; but we are looking to the future now.",21,1737547375.0,2025-01-22 12:02:55
1i77usl,No-Confection3699,Just gonna leave this one here  https://preview.redd.it/quazse5s3jee1.jpeg?width=1078&amp;format=pjpg&amp;auto=webp&amp;s=da09ef87e0877d8e706b435cfcf1ca601ba249a0  Maah name eee jeeeef. Bye bye cartman,20,1737544500.0,2025-01-22 11:15:00
1i77usl,boathouse_floats,AHAHAHAHAHA,5,1737589448.0,2025-01-22 23:44:08
1i77usl,Deep-Plant5252,Thank you !!,16,1737545946.0,2025-01-22 11:39:06
1i77usl,jktrelos,Thank you! thank you!,17,1737546878.0,2025-01-22 11:54:38
1i77usl,wadaphunk,"No more FUD for me then.   Back to work.  Until next time, though!",16,1737548539.0,2025-01-22 12:22:19
1i77usl,flyflex1985,"Winter, labelled as a fudder and wrongfully persecuted. I’m back now and going to bring the fud with more passion than ever before!! (Joking don’t ban me, again lol)",16,1737550193.0,2025-01-22 12:49:53
1i77usl,Neat-Big5837,"I sank over 75k usd in kendu and the other one (I’ve sold it and put in kendu after cto) and I used to think that the money has sunk. I was infuriated, annoyed and felt helpless. Miazaki never won me over. It was you guys, the community, that got me to invest my savings in the project. I wanted this take over for a long time and I had almost written it off as being impossible. I am so glad that Kendu is now free and more accepting. I see people now asking questions on future plan, wallets and marketing and everything is being answered.",15,1737554203.0,2025-01-22 13:56:43
1i77usl,boathouse_floats,"I am so glad you are still here and sorry you felt this way. It has been obviously rough for everyone, but we now control our destiny! Finally!  Kendu will strive to do the best we Kendu.",5,1737589560.0,2025-01-22 23:46:00
1i77usl,[deleted],"Ive engaged with you a few times. Its all water under the fridge now.  What I do recollect, is that you were the hardest person to get to break character and lose your composure. I knew what I was doing. I felt like it had to be done and I hope you and everyone else in the community understands at this point.  I tried more than once and was met with grace and respect, even as I spread FUD. My target was meant to be KM, not anyone else, for anyone reading this.  This is gonna be a moment you can all look back on and pat yourself on the back for. Standing up against whats wrong isnt easy. But, you all did it. With your bags on the line with an uncertain future.  Integrity is something not found frequently in the memecoin world. Lets face it, memecoins can be a fucking cesspool. That doesnt mean that you, I, we... shall I say us (I rejoined this week. Hi everyone, missed you guys) have to just live with it.  Have your voice heard. Dont be afraid to speak up. I think Kendu community is stronger than its ever been.   The strongest steel is forged in the hottest fire.   You guys are amazing and literally deserve greatness. This is quite an awesome story and we're not near the end.",24,1737546623.0,2025-01-22 11:50:23
1i77usl,Potlimitcrypto,Thanks buddy. ❤️  Let's get Kendu to where it deserves to be.,19,1737547076.0,2025-01-22 11:57:56
1i77usl,skillmattic,Thank you Josh! Keep up the good work! Onward and upward to the top! Let's goooooooooo! KENDU STRONG! KENDU FOREVER! WE KENDU IT!,10,1737550237.0,2025-01-22 12:50:37
1i77usl,ValharMaGhoolys,In Josh we trust 🫡,9,1737550640.0,2025-01-22 12:57:20
1i77usl,ofad-,I feel much confident now with Josh on the head of $KENDU.  I'm happy to be here and I'll support Kendu until the end!,9,1737550744.0,2025-01-22 12:59:04
1i77usl,DopestSophist,"Thanks, Josh. We appreciate you taking the helm.",9,1737550799.0,2025-01-22 12:59:59
1i77usl,Crypto_Okapi,"Josh I am 150 Mil+ owner I really appreciate what your doing and Thank you for doing this , holding till the moon and beyond !",8,1737557623.0,2025-01-22 14:53:43
1i77usl,McVad3r,Thank you to everyone who helped make this happen. I fell in love with the community on day 1.   Been here since the very early days and I’m glad I didn’t let any of the drama push me away.   I couldn’t be more proud of what the community has collectively achieved.   This is historic.  So proud of kendu.,10,1737558259.0,2025-01-22 15:04:19
1i77usl,Familiar-Training-14,You are doing one helluva job getting the pieces back together. Mad respect. Even madder respect for LOTR reference!  Kendu wil lead to many breakfastses!,9,1737559702.0,2025-01-22 15:28:22
1i77usl,SatoshiSiren88,And elevenses!! 😁,6,1737575806.0,2025-01-22 19:56:46
1i77usl,Familiar-Training-14,yesssssss,6,1737576571.0,2025-01-22 20:09:31
1i77usl,NotA56YearOldPervert,I respect that. I trust.,9,1737561488.0,2025-01-22 15:58:08
1i77usl,Neither_Shirt1606,"If this is gonna work there needs to be accountability. Who is in the team you’re quoting? What’s their experience in leading a crypto project? And what actions specifically is the team taking to implement a change from what we have seen in the past 6 months?   I know these are hard questions, but if you can’t face scrutiny you can’t expect people to trust you with their money.  These are all investors, investors need to see a plan, a timeline, concrete milestones and to some extent, reassurance.",15,1737544052.0,2025-01-22 11:07:32
1i77usl,Potlimitcrypto,"Roadmaps are the death of memecoins, they only exist to create sell the news events. There will never be a Kendu roadmap, everyone will be working autonomously on hundreds of things all the time. However, I am writing a whitepaper of sorts that will go into vision of the future/culture for growth and success/opportunity of Kendu.  The team are the Loyalists, most of whom have worked tirelessly on the project for six months or more. The team is also you, the community, and your continuous efforts. The change we needed was Miazaki leaving, if you've had your ear to the ground you would have witnessed the complete insanity that led to a lack of faith/selloff in the project.  I have ran projects and built communities, my role has been business development and community management, in fact, some of the active mods we have like Mike (Kendu Energy) and Kojak (Community updates) have followed me from a previous project. I've raised VC capital in the harshest of market conditions and negotiated significant deals. I've been headhunted by large Arrington Capital-backed Polkadot ecosystem projects and my work has been noticed by people at Yearn Finance and Sushi swap.   There are no skeletons in my closet and I've never launched a memecoin. While I've never single-handedly taken a project to multi-billions from nothing, we must remember too that before Shib, Shytoshi was just a holder begging for a toadswap airdrop, and I believe I'm coming from a far better position than that with much more experience under my belt.   I have proven myself over the last 11 months, and how much I care about the community. I've showed up every single day without a single day off... But most importantly, I'm a good person who cares about the lives of people around him.   Now that I'm in the driver's seat you can rest assured that there will be no other token launches, drunken hateful speeches, bad product launches, egregious dumping on the chart, blatant incompetency, and so on that will harm and scare away investment.  My vision for Kendu will be available in the whitepaper.",60,1737545348.0,2025-01-22 11:29:08
1i77usl,Neither_Shirt1606,"The fact that you gave an answer, this answer, as opposed to me being banned or the comment deleted is already very telling in a very positive way.  I’ll be honest I had pretty much written off this project as another meme coin that went to zero, and I say that holding what I think is a substantial amount of Kendu.  You have changed that.  The crazy energy of the community is what got me  to buy Kendu and I really hope you and your team can re-kindle that fire. While nobody can guarantee anything or predict the future, I feel that the intentions at the top align with the community. The rest is hard work.",31,1737549316.0,2025-01-22 12:35:16
1i77usl,Real_Crab_7396,We're going to the billions this cycle and nobody is gonna stop us 😎,9,1737574058.0,2025-01-22 19:27:38
1i77usl,Spiritual-Cat-8037,"&lt;3 great guy, and he really worked 24/7 for the project.",24,1737546766.0,2025-01-22 11:52:46
