post_id,author,body,score,created_utc,date
1i5yk59,theysii,🚀💯🤩💎,10,1737401508.0,2025-01-20 19:31:48
1i5yk59,W-D-Goldbeard,Yer conviction to the $KENDU cause be commendable matie! 🫡🏴‍☠️,5,1737406239.0,2025-01-20 20:50:39
1i5yk59,Vegas_42,🫡🪖,5,1737402863.0,2025-01-20 19:54:23
1i5yk59,strider1919,Chad 💪,3,1737403481.0,2025-01-20 20:04:41
1i5yk59,Jalisco82,$20 worth,2,1737411017.0,2025-01-20 22:10:17
1i5yk59,No-Confection3699,Chad!,1,1737635422.0,2025-01-23 12:30:22
1i5yk59,Bandage79,When it adds another 0 over next couple of days and then levels out we can buy 100B for like$500 or less.,1,1737405837.0,2025-01-20 20:43:57
1i60i3q,W-D-Goldbeard,Hoist the $KENDU colours! 🐶🏴‍☠️  Our Grand Adventure to 💯  Billion continues! ⛵️,8,1737406165.0,2025-01-20 20:49:25
1i60i3q,Specific-Gazelle-743,How I will find the New telegram group?,4,1737406419.0,2025-01-20 20:53:39
1i60i3q,LiiQuiD0,https://preview.redd.it/b1opmu9xq7ee1.jpeg?width=1080&amp;format=pjpg&amp;auto=webp&amp;s=f1470e0669eb32cf3e41ba67b73c3e5ab12caf30  t.me/KenduInu\_CTO,4,1737406967.0,2025-01-20 21:02:47
1i60i3q,DelBigs,"Lets make this the best CTO ever, we deserve it guys",4,1737407092.0,2025-01-20 21:04:52
1i63eu0,Aggressive-Virus4046,Made some profits with trump and converted some to kendu inu,6,1737414362.0,2025-01-20 23:06:02
1i63eu0,PureClass247,Nice move Fam...,4,1737414448.0,2025-01-20 23:07:28
1i63eu0,Green_Candler,I hope so guys  LFG,4,1737413247.0,2025-01-20 22:47:27
1i63eu0,PureClass247,To the Moon Guys🚀,3,1737413002.0,2025-01-20 22:43:22
1i63eu0,J0E_SpRaY,Jfc this sub is delusional.,-1,1737416592.0,2025-01-20 23:43:12
1i63eu0,diablero_T,Lol. Never seen you here before. Sorry you don’t get it. Feel free to bounce anytime!,2,1737418247.0,2025-01-21 00:10:47
1i63eu0,J0E_SpRaY,"A week ago we were told it’s all good cause we got Miazaki, now it’s that we’re better off without him.   And even worse, y’all apparently think the president having his own crypto to solicit influence through is a good thing.   So yeah, delusional. It’s gonna be GameStop all over again. Thankful I’ll only lose $50.",0,1737418830.0,2025-01-21 00:20:30
1i63eu0,OnedaythatIbecomeyou,"+1, don't hate the community but I certainly hate the overwhelming lack of intelligence. ""Trump creating wealth for many people"" fuck me",2,1737425422.0,2025-01-21 02:10:22
1i61huq,SurpriseMedium1794,"Miazaki himself, he’s going through a phase right now. Bro is actually going crazy on his live right now LOL",23,1737408429.0,2025-01-20 21:27:09
1i61huq,Dougdummy,"I’ve never heard a more un likeable person than just now (Miazaki) in his space on X. First time I ever tuned into one, and wow, his level of delusion is astounding. The blind followers “thanking him for unfucking them” was pathetic and weak. You know…. I bought into Kendu at ATH, DCA’d a bit on the way down, and then just started observing overtime, observing and witnessing this whole thing…. And what a weird world this is. A lot of unwell, sick, weak people exist here.  I want the best for everyone, but to define personality on crypto is beyond my level of comprehension. And I pray for the best for everyone. Miazaki has actually convinced people he is something other than a joke and I have money tied up in it. It’s a really good thing I don’t care at all about losing it.",34,1737409208.0,2025-01-20 21:40:08
1i61huq,Apprehensive_Sort281,Agreed I’m done investing. He’s never gonna completely hand it to the community and this will continue to be a slow rug,13,1737409442.0,2025-01-20 21:44:02
1i61huq,[deleted],"He's down to 1.5% of total supply, so he has nothing left to rug. If Kendu takes off now he'll be PISSED! Just sayin",10,1737422589.0,2025-01-21 01:23:09
1i61huq,preskooo9720,"&gt;He's down to 1.5% of total supply,  Prob has much more in other wallets",4,1737428107.0,2025-01-21 02:55:07
1i61huq,Real_Crab_7396,He sent it to Josh his wallet for crowdfunding. We've finally won.,2,1737465948.0,2025-01-21 13:25:48
1i61huq,SurpriseMedium1794,Miazaki is acting like hitler in his final days when he knew the walls were closing in.  Funnily enough he made a post on X with him next to hitler,11,1737409475.0,2025-01-20 21:44:35
1i61huq,[deleted],Good riddance.  In Josh we trust 🙏 $KENDU LFG!!,7,1737422622.0,2025-01-21 01:23:42
1i61huq,maximum4Potential,"I’ve been saying this since August. I tuned into two really valuable spaces where Miazaki had important guests on (other big crypto influencers) and both of them were a shit show.  One of them he was obviously drunk which is just crazy.   But most importantly he just genuinely sucks at Public speaking. He dodges important questions and brushes it off as trying to “fend of the jeets”.   He often has no plan on what to say and many times it was just straight up painful to listen to him answer questions. It sounded as if a middle schooler was taking a Public speaking class for the first time. Just straight gibberish.  I can go on about how he failed marketing and supporting this coin. He really had something good going on and half assed it. I’m glad I got out awhile ago, but I really do feel bad for those that blindly still follow him.",5,1737416655.0,2025-01-20 23:44:15
1i61huq,Ok_Cake3477,It’s miazaki cuck maxxing,12,1737408559.0,2025-01-20 21:29:19
1i61huq,Doc_Holiday_x,"I’m not selling, honestly I wouldn’t suggest anybody do.  At this point what’s the point?  There are 16,000 holders..market cap won’t go much lower.  Honestly I plan on buying more",13,1737411102.0,2025-01-20 22:11:42
1i61huq,Fakuneda,The community takeover seems to be a possibility. Josh one of the guys in charge is so real and nice. It's nice to hear him able to relax a little bit not having to make up for a megalomanic. I hope miazaki drops all his bags soon. And we can take this even further. I'm happy to be unmanned from the chat,6,1737429647.0,2025-01-21 03:20:47
1i61huq,LoanThen2508,I got in early enough I'm still in the green. I'm not selling either. I took my original investment out long time ago.,4,1737428171.0,2025-01-21 02:56:11
1i61huq,imfee,I sold. Had billions of tokens,0,1737426184.0,2025-01-21 02:23:04
1i61huq,Doc_Holiday_x,"Ouch, can’t imagine the loss you took by doing that.  I get it, things are crazy right now and gonna take some time for the dust to settle.  I still believe Kendu is going to rise up…the community has accomplished to much for it to fail.  I admit the thought to bail has crossed my mind..but day late dollar short.  Gonna let it run its course and see where it goes",2,1737426462.0,2025-01-21 02:27:42
1i61huq,New_Breakfast8396,He’s manipulating the charts to rug it again… 🤣,9,1737409435.0,2025-01-20 21:43:55
1i61huq,HumblestofBears,Geoff will run out of steam because he has too many other things to do with too many other places and if we just kind of move on and let him do whatever he wants away from the community that actually did all the things he tries to take credit for… every coin has whales and bots selling against volume. So one of them is him? So what? He will move through his stages of grief and hopefully get the help he needs on his journey to sobriety.,3,1737421918.0,2025-01-21 01:11:58
1i61huq,jbraden,"We've started our own CTO TG and I highly recommend unfollowng Miazaki on X. The less followers he has, the more he'll see that he doesn't have control of Kendu. He's down to the 6Ks in followers and there are almost 17K Kendu holders. Drop his ass down to 1000 followers.  https://t.me/kenduinu_cto",4,1737410081.0,2025-01-20 21:54:41
1i61huq,Honos11,What is the new TG?,1,1737411495.0,2025-01-20 22:18:15
1i61huq,jbraden,https://t.me/kenduinu_cto,1,1737414555.0,2025-01-20 23:09:15
1i61huq,SatoshiSiren88,https://t.me/kenduinu_cto,1,1737416234.0,2025-01-20 23:37:14
1i61huq,Yeayouright67,"Reppin, no lie, I still believe in this community. Once bitten, twice shy, the Snake didn’t bite you. It’s a really good time to make some money and buy back in. May do so again.",2,1737433395.0,2025-01-21 04:23:15
1i61huq,[deleted],[removed],1,1737428278.0,2025-01-21 02:57:58
1i61huq,ReppingTheADC,SSSSSuck on my dangalang,2,1737431024.0,2025-01-21 03:43:44
1i61huq,Yeayouright67,SSSSSeriously good reply!,1,1737431270.0,2025-01-21 03:47:50
1i61huq,[deleted],[removed],1,1737415178.0,2025-01-20 23:19:38
1i61huq,SatoshiSiren88,The community will bring it back up! The moral is high and we still got 17k holders. This is not the end! 💪,5,1737416329.0,2025-01-20 23:38:49
1i61huq,MountainIcy8084,"Man be realistic, most of these holders are only looking for a decent price to dump their kendu too",1,1737453606.0,2025-01-21 10:00:06
1i61huq,SemenSlayer9000,Me too brother😉,2,1737419438.0,2025-01-21 00:30:38
1i61huq,MountainIcy8084,Bro you’re here too? 😂,1,1737453623.0,2025-01-21 10:00:23
1i61huq,SemenSlayer9000,"Yes the certik audit and real life products caught my attention, still got rugged😂. This is why we buy $pep",2,1737478027.0,2025-01-21 16:47:07
1i61huq,MountainIcy8084,"Lol i joined when I saw that kendu had a strong and active community, which was why I joined it. But now idc, I’ve put it into PEP",1,1737497872.0,2025-01-21 22:17:52
1i61huq,TheGDC33,I have no idea what is going to happen anymore. Having your money in a safe place is great. Congrats. I think it was like four spaces in a day🤷‍♂️,1,1737425658.0,2025-01-21 02:14:18
1i61huq,MountainIcy8084,Four spaces?,1,1737453652.0,2025-01-21 10:00:52
1i61huq,TheGDC33,X Spaces,1,1737458985.0,2025-01-21 11:29:45
1i61huq,MountainIcy8084,I still have no idea what you’re on about 😅,1,1737497810.0,2025-01-21 22:16:50
1i61huq,Apprehensive_Sort281,Do we all sell? It can’t be going much further than this anytime soon lol,-2,1737408769.0,2025-01-20 21:32:49
1i61huq,Unfinishedbusiness86,DEV pumped and dumped,-2,1737410800.0,2025-01-20 22:06:40
1i61huq,W-D-Goldbeard,Trump....? 👀,-3,1737408271.0,2025-01-20 21:24:31
1i61huq,ReppingTheADC,"Yeah, you think the orange guy is spiking a random memecoin that is in turmoil?   Makes sense   Maybe we change our name to Mialania Inu…",5,1737408509.0,2025-01-20 21:28:29
1i61huq,W-D-Goldbeard,Arrr maybe I be wrong. I missed a lot o' $KENDU news today 'nd only just be catchin' up with things 😅,0,1737409634.0,2025-01-20 21:47:14
1i61huq,Agreeable_Compote_68,"Guys don’t worry, he’s bringing Kendu back….",-3,1737411356.0,2025-01-20 22:15:56
1i61huq,News-Principal-160,"some say its Miazaki, Hope its not what am thinking",-1,1737412967.0,2025-01-20 22:42:47
1i5zbtg,nixxie1108,Hard when he’s calling us all retards and saying he isn’t leaving Kendu. On the tg now saying he’s coming back,7,1737406071.0,2025-01-20 20:47:51
1i5zbtg,Putrid_Scallion_5236,"Its absolutely not over, that bitch is going to prison",3,1737431746.0,2025-01-21 03:55:46
1i5zbtg,ReppingTheADC,We keep talking about him because he is still rugging his bag.  He should burn what’s left of what he owns and be done with it.,5,1737405312.0,2025-01-20 20:35:12
1i5zbtg,precipotado,"He won't burn anything, he's a greedy thief",6,1737412728.0,2025-01-20 22:38:48
1i5zbtg,Less_Ad_9631,"Let him sell, many people happy to buy it up.",3,1737405838.0,2025-01-20 20:43:58
1i5zbtg,halflistic_,"Nah, fuck him.   And also keep working",1,1737416868.0,2025-01-20 23:47:48
1i5zbtg,precipotado,Join the new TG,1,1737412691.0,2025-01-20 22:38:11
1i5soxa,PlentyF09,"Sounds like the parting was less than amicable, but I know that's the impression you got from it and I respect it.",16,1737390190.0,2025-01-20 16:23:10
1i5soxa,HumblestofBears,We are all grown ups. This is a normal thing,10,1737390464.0,2025-01-20 16:27:44
1i5soxa,[deleted],[removed],1,1737412232.0,2025-01-20 22:30:32
1i5soxa,HumblestofBears,"True. We are not all, apparently, grown ups. I hope this runs its course soon.",1,1737420407.0,2025-01-21 00:46:47
1i5soxa,bigboydesomo,We run it up without him    He has sold most of his token and the chads are buying them so fast soon we will see an uptrend.    Join now you have no fud anymore but an lifechange amount of money. And alot of friends will be made kendu is one of a kind.,27,1737387144.0,2025-01-20 15:32:24
1i5soxa,News-Principal-160,"this is my favorite part ""Miazaki has said he will continue to work on Kendu Chads and deliver the platform this year. """,8,1737388738.0,2025-01-20 15:58:58
1i5soxa,HumblestofBears,I’m just stating what’s been said. Let’s say I took some time to edit that one to something neutral because I have some healthy skepticism.,7,1737389145.0,2025-01-20 16:05:45
1i5soxa,Dramatic_Weakness693,Yeah I’m confused about the kendu chads. If there’s no market place then are we just fucked?,8,1737387498.0,2025-01-20 15:38:18
1i5soxa,HumblestofBears,"Again, the previous dev has committed to finishing the marketplace project this year and he holds a lot of Chads so there is a financial benefit to doing so.",14,1737387681.0,2025-01-20 15:41:21
1i5soxa,Scuttlefuzz,"Kendu the token will not be fucked. We will run this bitch up no matter what. Kendu Chad nfts unfortunately all ride on Miazaki, who is not a man of his word and has a very questionable work ethic among other things...  It's in his best interest to launch Chad's, he likes to do what's in his best interest, so there is a chance.   He's also a drug addict so I wouldn't count on it.",5,1737388887.0,2025-01-20 16:01:27
1i5soxa,Unique_Opposite2026,"While I get your frustration, let’s keep it civil. It is what it is… now we make lemonade.",8,1737390659.0,2025-01-20 16:30:59
1i5soxa,HumblestofBears,I think skepticism is healthy but character assassination is not.,10,1737389319.0,2025-01-20 16:08:39
1i5soxa,Ok-King-1846,What are Chads?,1,1737401162.0,2025-01-20 19:26:02
1i5soxa,Scuttlefuzz,"Nfts that are supposed to generate a yield from sales on the kenduchads platform. The platform is not live yet though, 50/50 on if it ever happens",1,1737405934.0,2025-01-20 20:45:34
1i5soxa,Ok-King-1846,Thank you scutt,1,1737406067.0,2025-01-20 20:47:47
1i5soxa,ReppingTheADC,Does Miazaki still have all the Kendu Chads wallet $?  I feel like that was promised to further the project…  I don’t really understand how someone can Dox themselves and then just take $5m worth of coins. Like there is definitely someone out of the 15k+ holders who is holding a grudge. How does Miazaki not worry about that?,7,1737387375.0,2025-01-20 15:36:15
1i5soxa,HumblestofBears,"He says he will complete the Chads Marketplace. So, presumably, yes? But Josh has the keys to the community wallets, and is taking over the telegram in under a week or so.   I don’t have time or energy for bad blood. You don’t turn a project around by turning backwards. There are good reasons why this change was necessary and once the emotions clear out a bit we will all be in a better place because of this change.",13,1737387542.0,2025-01-20 15:39:02
1i5soxa,RariCalamari,Josh doesnt have access to the Chads wallet or any other wallet if I'm not mistaken,8,1737388266.0,2025-01-20 15:51:06
1i5soxa,North-Town4883,Agree    I also know till everything is handed over  That shackle is holding us down    I'm super positive for the project when this is confirmed    I start buying again ,4,1737392461.0,2025-01-20 17:01:01
1i5soxa,ReppingTheADC,"I completely agree with moving forward.  But that doesn’t negate the fact that there are 50 billion coins, 5% of the whole project, that are now just a ticking time bomb to be dropped by the creator.   Dude acted in real bad faith on this one.",6,1737387794.0,2025-01-20 15:43:14
1i5soxa,RariCalamari,"Its about 16B, or 2% left in the Chads wallet, which is still quite a lot.  Ofcourse there can be other wallets that we dont know of",6,1737388378.0,2025-01-20 15:52:58
1i5soxa,Less_Ad_9631,Its 12B left now of this moment,8,1737389849.0,2025-01-20 16:17:29
1i5soxa,litecoiner,"I hope he spends it all on cocaine and quick, so he's totally gone from the project",1,1737392551.0,2025-01-20 17:02:31
1i5soxa,North-Town4883,Will need funds for his new project ,2,1737392617.0,2025-01-20 17:03:37
1i5soxa,Schlitzbomber,Do you have the address for the Chad wallet?  Just want to follow along with what’s goin on 👍,1,1737405552.0,2025-01-20 20:39:12
1i5soxa,Scuttlefuzz,He's been selling them for a long time now. He doesn't have 50 billion coins to sell. It's closer to 10-15 billion. And at these prices it wouldn't take that much sidelined money to take them off his dirty hands.,4,1737388780.0,2025-01-20 15:59:40
1i5soxa,HumblestofBears,"This was, I believe, part of the reason he was asked to step aside.",6,1737389220.0,2025-01-20 16:07:00
1i5soxa,HumblestofBears,Most of those are already dumped.,5,1737387846.0,2025-01-20 15:44:06
1i5soxa,ReppingTheADC,Just seems crazy to me. This guy dozed himself and then effectively stole from 15k people… just don’t understand how you do that and not look over your shoulder the rest of your life.  Like why even dox yourself if you were going to do that?,7,1737388035.0,2025-01-20 15:47:15
1i5soxa,HumblestofBears,"I disagree with your assessment that he doxxed himself. The Certik audit did not clear his KYC, and he wasn’t going to do it. Josh will.   We shall see if the promised product is delivered, as well. It doesn’t matter. I’m not going to do anything to the man, nor should anyone else. He is always welcome to come back and work for his bags like anyone else.",4,1737389479.0,2025-01-20 16:11:19
1i5soxa,HumblestofBears,"And let’s not bash anyone, here. People can come to their own conclusions regarding his sells and whether they wish to get involved in his future tokens for themselves without us wasting time venting about things that led to the change in direction.",3,1737387944.0,2025-01-20 15:45:44
1i5soxa,Bird-Holiday,"Miazaki is not going to hand anything over, made it pretty clear in his latest spaces. He feels betrayed and basically wants to punish Kendu rn. Best thing team can do is make a new tg and x, and build a big enough following where we can update socials with new links.",2,1737400143.0,2025-01-20 19:09:03
1i5soxa,HumblestofBears,"I’m not sure if that’s true or not, and let’s just say we wait and see.",1,1737401199.0,2025-01-20 19:26:39
1i5soxa,Middle-Brief-517,Do you have proof that he took $50 million worth of coins? Sounds like an unrealistically high amount. I don't think the Chads wallets was ever worth more than $3 million,3,1737388815.0,2025-01-20 16:00:15
1i5soxa,North-Town4883,High amounts talked about will be attached to the ath      He has been selling all the way down most between the 30 50 mc range    A friend told me ,2,1737392825.0,2025-01-20 17:07:05
1i5soxa,HumblestofBears,"I don’t think it matters, as long as he finishes offloading then quickly and cleanly and then we can all move on.",2,1737389195.0,2025-01-20 16:06:35
1i5soxa,mwardell142,"Not $50 million WORTH of coins, 50 million coins. 50 million kendu was never close to 50 million dollars",1,1737392024.0,2025-01-20 16:53:44
1i5soxa,HumblestofBears,And I think they meant 5% of supply? I.e. 50 billion kendu. Not 50 billion dollars.,0,1737389245.0,2025-01-20 16:07:25
1i5soxa,Middle-Brief-517,"He said $50m, then edited it to $5m after I posted. Still sounds high tbh",3,1737389394.0,2025-01-20 16:09:54
1i5soxa,ReppingTheADC,"Yeah my bad, meant 50B coins. 10k chads x 5M coins per Chad. Was worth around $5m at that time",2,1737393289.0,2025-01-20 17:14:49
1i5soxa,[deleted],"If he actually does finish the marketplace, would any of us be stupid enough to trust it? As someone with a considerable amount of Chads, I'm not holding my breath for them",3,1737391169.0,2025-01-20 16:39:29
1i5soxa,HumblestofBears,Let’s cool off. It’s still early in the breakup and too early to tell if he will deliver.,4,1737391446.0,2025-01-20 16:44:06
1i5soxa,ResonanceCascade1998,"Legit the only reason it got this low is because of Miazaki's decisions. I'd like to put some blame on the community too for putting him up on a pedestal and making it that type of cult. From the very beginning he said the project wasn't meant to be dependent on him. That doesn't excuse his decisions knowing people put him on that pedestal but I think it puts things into a better perspective. Not to mention I've had some pretty shady stuff leaked to me about some of the team and Miazaki. From what I can tell the community was absolutely farmed and that needs to be known going forward.   Is recovery possible? I don't see why not, to this day very few if any communities compare to what Kendu had and still has. If the community can come together with some new leads I think the sky is the limit really. I've said this before but Miazaki was definitely right saying Kendu was a master class in marketing. I've seen Kendu inspired tokens reach millions. If those are just inspired tokens without direct connection imagine the potential this community still has.   I can't stand the guy but providing a platform for him to get better and do better might really open a lot of eyes. I've seen people come back from far worse than where Miazaki is at now. The trust won't be there for me but I would love to see a ""redemption arc"" for the guy. This would also work to Miazaki's favor. I want to make it clear this next bit is NOT a threat but stuff I've witnessed floating around. Miazaki has enemies and as much as I don't like him I don't want to see anyone's life in danger or etc. Coming back purely as a community member to help pump the project in good faith would look great on his end. This was about the community from the start anyways. I haven't talked directly to Miazaki since before the summer so if someone could forward this to him that'd be super rad.   Tldr:I am absolutely a Miazaki hater but the catch is I don't really don't hate anyone on this planet and want to see everyone doing better. If this CTO makes it to ATH and everyone is happy that'd again, be super rad and say loads about the community itself. Many OG's are sitting on the sidelines waiting for just the right moment to scoop up some more.",3,1737398954.0,2025-01-20 18:49:14
1i5soxa,Unfinishedbusiness86,DEV is the most liked scammer I have ever seen .. he scammed us all .,7,1737390935.0,2025-01-20 16:35:35
1i5soxa,HumblestofBears,"To be fair, I personally lived very well following him around to new tokens over and over again last year once I figured out his game. I don’t hate the man. I think the Kendu community is special, though, and capable of being so much more.",0,1737391392.0,2025-01-20 16:43:12
1i5soxa,TenacityJack,"Such a defining moment. Buy, hold, or sell. For myself, I still believe there is a foundation here, that has value. I also believe there is a very diverse and compelling global community that has rallied around this coin. I am not ready to write this off as foolish misadventure. I believe I will add to my holdings and stand with the fearless ones.",2,1737394464.0,2025-01-20 17:34:24
1i5soxa,Calm-Plantain-59,Do we know Mia's wallet address?,2,1737396700.0,2025-01-20 18:11:40
1i5soxa,Unfinishedbusiness86,Seems like a slow rug pull .. at this point I’m just holding my giant bag after losing thousands.,2,1737390908.0,2025-01-20 16:35:08
1i5soxa,HumblestofBears,"So many of the greatest and most successful people and tokens in defi have this same moment, and holding and letting the community take over is really the best thing. This is not a new thing, or a weird thing.",6,1737391319.0,2025-01-20 16:41:59
1i5soxa,Unfinishedbusiness86,"At this point I’m holding, but I’m not expecting this to go up anymore .. looks like it is heading your way 1 million market cap",0,1737391428.0,2025-01-20 16:43:48
1i5soxa,HumblestofBears,"Don’t judge a project after a massive dev dump in the single craziest weekend in the history of crypto. The community was always stronger than the dev, and will rise.",7,1737391527.0,2025-01-20 16:45:27
1i5soxa,Unfinishedbusiness86,I sure hope so . He did scam all of us,1,1737391925.0,2025-01-20 16:52:05
1i5soxa,HumblestofBears,I hope you are feeling more optimistic today. ;),2,1737487542.0,2025-01-21 19:25:42
1i5soxa,Unfinishedbusiness86,I’m very happy I hold my bag !!! Thanks! I will continue buying more now,1,1737498770.0,2025-01-21 22:32:50
1i5soxa,dcp0002,Not honoring the contest winnings tsk tsk I did all those push ups for nothing!,1,1737400266.0,2025-01-20 19:11:06
1i5soxa,Educational-Hunt-865,I think he is a conman(or kid) and hopefully there is passed a law for this people to face the consequences.,1,1737392160.0,2025-01-20 16:56:00
1i5soxa,HumblestofBears,We do not know more than we know. Be patient.,1,1737401612.0,2025-01-20 19:33:32
1i5soxa,problematic_ash,We’re cooked.,1,1737402546.0,2025-01-20 19:49:06
1i5soxa,HumblestofBears,"Too early to tell. Geoff Mackey is getting outed for his true self, so there’s that. The token continues even if he nukes it with his buddies Frankly, the sooner the better.",2,1737403801.0,2025-01-20 20:10:01
1i5soxa,Livid_Affect_392,Been cooked,1,1737420143.0,2025-01-21 00:42:23
1i5soxa,HumblestofBears,Looks fine today?,1,1737487575.0,2025-01-21 19:26:15
1i5soxa,HumblestofBears,Seems no.,1,1737487567.0,2025-01-21 19:26:07
1i60shh,insegniah1,Make sure everyone leaves old one too and report the old one,3,1737409310.0,2025-01-20 21:41:50
1i61eqk,W-D-Goldbeard,"Arrr matie, the market cap be low 'nd spirits high, this may be a great entry but who knows. Crypto seas are mysterious 'nd unpredictable. Where the be oppertunity there also be hazards.   I pray fer the brave souls who dare uptake the challenge 🫡🏴‍☠️",17,1737408239.0,2025-01-20 21:23:59
1i61eqk,akguitar,Goldbeard should be the boss of Kendu imo ,4,1737427244.0,2025-01-21 02:40:44
