post_id,author,body,score,created_utc,date
1i61eqk,W-D-Goldbeard,"Haharrr, wouldn't that be nice! I definitely would have made a few different decisiin vut we can only dream 😄  There still be some hope left fer $KENDU but we are in one mighty storm right now!  Pray things turn around soon by some crypto miracle 🙏 🏴‍☠️",3,1737441738.0,2025-01-21 06:42:18
1i61eqk,Scuttlefuzz,"We could go to 1B tomorrow and no narrative would credit it to Miazaki. His reputation is shot and the guy can't help but dig himself deeper each day.   I'm buying though, sub 10m is just a steal no matter how you cut it.",16,1737409908.0,2025-01-20 21:51:48
1i61eqk,Green_Candler,Well said,4,1737413371.0,2025-01-20 22:49:31
1i61eqk,Dunmaglass2,Except he clearly does have connections. It was all fucked but that’s just true. Instead you’d rather do this larp split up crybaby nonsense.,1,1737437117.0,2025-01-21 05:25:17
1i61eqk,Scuttlefuzz,"His connections were weak. I don't doubt he was in shib, but he sold before he should have. He was able to get these people on board because he paid them.",1,1737467389.0,2025-01-21 13:49:49
1i61eqk,Familiar-Training-14,Listen to this Kendu army!,13,1737409138.0,2025-01-20 21:38:58
1i61eqk,RegardedQt314,"i would advise everyone to just relax a bit, this will take a bit to weather the storm but we'll make it through it.    i don't know the validity of the claims in your post, but tbf buying at these levels and holding long term is still extremely valuable.  short term traders on the otherhand might want to let this play out for a bit longer before deciding.",12,1737408285.0,2025-01-20 21:24:45
1i61eqk,halflistic_,"Green? I’ll believe it when I see it. I’m out - Bye Miazaki, get rekt",2,1737416808.0,2025-01-20 23:46:48
1i61eqk,SatoshiSiren88,Make sure to join the new tg!  https://t.me/kenduinu_cto,1,1737416741.0,2025-01-20 23:45:41
1i61eqk,Real_Crab_7396,take down this post when you see it because miazaki has surrendered.,2,1737467258.0,2025-01-21 13:47:38
1i5x1fn,TheGDC33,We have barely lost any holders. There is still time for KENDU to reach multi billions,6,1737401133.0,2025-01-20 19:25:33
1i5x1fn,lazargwf," Beautiful story, Chad! Kendu brings all people together 🚀",4,1737402068.0,2025-01-20 19:41:08
1i5x1fn,dekcampani,"Sou brasileiro, coloquei 250 dolares em 170m de market cap e hoje perdi tudo :)",3,1737407768.0,2025-01-20 21:16:08
1i5x1fn,Inevitable_Horror_76,"Essa comunidade é diferente de qualquer outra, você deve ter percebido isso. Acho que vale a pena segurar.",2,1737417920.0,2025-01-21 00:05:20
1i5x1fn,dekcampani,"Segurar oq mano, meus 5 dolares que preciso pagar 10 dolares pra vender? Tu ja viu a bagunça q ta esse CTO? O tal do miazaki é um psicopata nascisista de merda",2,1737418175.0,2025-01-21 00:09:35
1i5x1fn,tokenKDN,Outside of things like MC and volumes - this is another real power of Kendu - bringing people together to help each other!  Please do spread the word and bring others into this awesome community so we have more stories like this one.,1,1737502699.0,2025-01-21 23:38:19
1i5zjhp,W-D-Goldbeard,CHADs together be strong 💪   🐶📈💰,3,1737405380.0,2025-01-20 20:36:20
1i5zjhp,minibuddy0,Now and Forever.,4,1737406203.0,2025-01-20 20:50:03
1i5zjhp,W-D-Goldbeard,I pray we soon get this ship back in shape 🙏  The Crew be far from defeated 'nd this ol' Pirate be ready to get back to work like with Certic.   Together we $KENDU it!   🐶📈💰,5,1737407754.0,2025-01-20 21:15:54
1i5zjhp,minibuddy0,This guy gets it.,3,1737441505.0,2025-01-21 06:38:25
1i5zjhp,W-D-Goldbeard,I been sailin' with this fine crew fer a while now 'nd have seen first hand what can be accomplished!    The spirit o' $KENDU be larger than even the former Dev now 'nd the grimd to 💯  Billion comtinues 🙏,2,1737483404.0,2025-01-21 18:16:44
1i5rqzv,North-Town4883,Never stop you are the metrics man ,19,1737385020.0,2025-01-20 14:57:00
1i5rqzv,TheGDC33,Thanks had to pick myself back up today,12,1737388160.0,2025-01-20 15:49:20
1i5rqzv,North-Town4883,Understood few us  absolutely with ya    The only thing is to have another crack at this    Foundation are there 10mc at a time    Appreciate you ,6,1737389979.0,2025-01-20 16:19:39
1i5rqzv,TheGDC33,Thanks and I appreciate you too. We still have plenty of time (at least if we get any where in the range of previous cycles),6,1737392865.0,2025-01-20 17:07:45
1i5rqzv,Green_Candler,well said... We Keep up the momentum,6,1737392591.0,2025-01-20 17:03:11
1i5rqzv,BigRedBruh,We got this Kendu team,18,1737385127.0,2025-01-20 14:58:47
1i5rqzv,AdEnvironmental7608,Pretty awesome to see holders holding!!!,10,1737386628.0,2025-01-20 15:23:48
1i5rqzv,TheGDC33,Yeah it is a real positive. That and the community output is only going to increase!,4,1737388806.0,2025-01-20 16:00:06
1i5rqzv,DJCatfoodFace,I know a lot of people say do your own research and such but when I see this I feel I am looking at the Matrix.  Where does one go to even begin to educate themselves?  Any links or resources are appreciated.  I like to think of myself as a quick learner and would like to know more about what all these charts and graphs that get thrown around really mean lol!,9,1737386245.0,2025-01-20 15:17:25
1i5rqzv,TheGDC33,Check out DexScreener and Etherscan has everything. Public blockchain means everything can be verified on chain. Probably find some videos to teach you as well.,6,1737388769.0,2025-01-20 15:59:29
1i5rqzv,TenacityJack,We are digging in and will prevail. What a time to add to our share.,3,1737395253.0,2025-01-20 17:47:33
1i608x7,kingkongbananakong,The telegram is gone miazaki was in a fit of rage. We will get a new one don’t worry about that and then we finally have one where he has no power,5,1737405610.0,2025-01-20 20:40:10
1i608x7,Fuzzy1003,Does he have control over the reddit sub? I hope not lol,3,1737406012.0,2025-01-20 20:46:52
1i608x7,Putrid_Scallion_5236,fortunately not,1,1737432459.0,2025-01-21 04:07:39
1i608x7,Fuzzy1003,Miazaki doesn't give two shits about the outcome of that vote sadly,3,1737405286.0,2025-01-20 20:34:46
1i608x7,Green_Candler,he should...,1,1737413423.0,2025-01-20 22:50:23
1i5niam,HumblestofBears,"There are already 14 major cex listings, and in a black swan event timed right at the transition, our holder count remained within 5 % of all time high, and our volume to marketcap ration in 24 hours is about 7%.   (Compare that to Pepe, for example, where volume to marketcap was over 50% for the weekend with the crazy amount of rotations from the black swan event. )  Ergo: a battlehardened community with major cex’s already just went at a huge discount with a new, more professional leadership team ready to run the show?  Looks solid from here.",33,1737370709.0,2025-01-20 10:58:29
1i5niam,Real_Crab_7396,"Exactly, the whales on the sidelines are waiting for miazaki to get completely out, get the last jeets out and see some bullish momentum. I don't believe in 100x's for people not in cabal, but Kendu doing a 100x of this point is 1B mc, that's pretty realistic imo.",19,1737370875.0,2025-01-20 11:01:15
1i5niam,HumblestofBears,"I don’t think whales are waiting in the wings to save the kendu community. We are entering a crazy crypto cycle, and no one really knows what happens, next. I do know battle-hardened communities with major CEX listings that resisted rotating during both a major leadership shift and a huge black swan event seems like the kind of project that can make billion dollar valuations happen.  It was the community that succeeded the Certik audit and the day-drinking serial coin starter dev that did not complete the KYC that is key to success, there, never seemed to line up in work ethic and values.",14,1737375772.0,2025-01-20 12:22:52
1i5niam,bigboydesomo,Lfg up up up kendu style,21,1737370026.0,2025-01-20 10:47:06
1i5niam,Amazing_Bonus3456,Kendu is ready for up only season. Solid entry price rn,21,1737370108.0,2025-01-20 10:48:28
1i5niam,Real_Crab_7396,generational entry fr,18,1737370242.0,2025-01-20 10:50:42
1i5niam,zeus109,I wish my salary can come quicker so I can have good entry for this beautiful chance 😳😭,21,1737370652.0,2025-01-20 10:57:32
1i5niam,stewiebbb,Me too 😭😭😭,17,1737370798.0,2025-01-20 10:59:58
1i5niam,cryptosader,in 2021 shib was way below the mcap we are right now(and less than a tenth of our holders) after a big pump retrace and community drama happened in 2020.  Shib started pumping late january retraced again and took off late feb to never look back again.  As long as we keep our head down and never stop working and believing money will flow again and new ath's will be made.   Fun is just getting started as long as we work hard we won't miss.  Remember Together We KENDU the Impossible!,23,1737373601.0,2025-01-20 11:46:41
1i5niam,Real_Crab_7396,"Exactly, i understand how believe is low with a lot of people right now, but we're more bullish than ever tbh. We did what had to happen and the distribution is actually insane",17,1737373718.0,2025-01-20 11:48:38
1i5niam,Unique_Opposite2026,I love the „we KENDU the impossible”!,8,1737379765.0,2025-01-20 13:29:25
1i5niam,North-Town4883,Said I'd never share my bag size and I won't    But I've some 100s of millions    Not selling    Fair the community gets a second crack at this    I'll buy to    ✌️ $KENDU fam ,18,1737374087.0,2025-01-20 11:54:47
1i5niam,Remedynn,The good vibes are returning!,17,1737372354.0,2025-01-20 11:25:54
1i5niam,WhichViolinist1914,"people I feel soooo stupid being in this coin for the last months, down more than 90%, invested totaly too much in it😭 now the only way is up, I’m holding until billions or zero. but anyway, I wish everything the worst to Miazaki, hope his miserable life is and will be full of pain and sorrow",7,1737385666.0,2025-01-20 15:07:46
1i5niam,nastyrubber,"So Miazaki really WAS a scammer all this time, huh? Anybody that pointed this out got banned from both tg and Reddit. This is the importance of free speech",2,1737398143.0,2025-01-20 18:35:43
1i5niam,Real_Crab_7396,"yes, but it's obvious you can't let this get by without muting or banning. I know they turned out to be right but to get people to sell off and doubt won't help in the long term of the project either",1,1737404867.0,2025-01-20 20:27:47
1i5niam,[deleted],"It can’t go down much further, so yeah, seems like up is the only option.",2,1737413713.0,2025-01-20 22:55:13
1i5niam,Real_Crab_7396,"It can go down way further, but it likely won't.",1,1737448145.0,2025-01-21 08:29:05
1i5niam,armenian86,I’m with you Chad. Just hit Orca level.,1,1737480600.0,2025-01-21 17:30:00
1i6264y,New_Breakfast8396,First we need him to sell everything he has left,0,1737410072.0,2025-01-20 21:54:32
1i6264y,Fit-Teaching9608,He should burn them instead,1,1737411779.0,2025-01-20 22:22:59
1i6264y,JChristo420,So facilitate mass sell to drive him out?,-1,1737410114.0,2025-01-20 21:55:14
1i6264y,[deleted],Just hang in there and let things shake out. He's not going to be able to keep it together. Meltdown rants incoming...,3,1737412450.0,2025-01-20 22:34:10
1i6264y,bmitchell7798,It is going to be to be an epic meltdown!,4,1737414816.0,2025-01-20 23:13:36
1i5t3cv,A_true_gENTleman,I personally love the randomness of #KenduIsBjörn,5,1737388362.0,2025-01-20 15:52:42
1i5t3cv,Green_Candler,lol... Chads agree,3,1737392522.0,2025-01-20 17:02:02
1i5t3cv,hijustjenny,"How about KenduIsKing  Personally, we should drop all the old quotes like  Let’s run it up (like what does this really mean, I get PnD vibes on this one) Martini in hand Helmets on (this one is ok lol) Chads (meh)",2,1737396796.0,2025-01-20 18:13:16
1i5me08,Equal-Character-8120,Beaconsfield Victoria....,6,1737373093.0,2025-01-20 11:38:13
1i5me08,Drainflowartist,Keep the fight up - helmets on!,4,1737376663.0,2025-01-20 12:37:43
1i5n7p5,Real_Crab_7396,"ggs, we're going to the moon",16,1737369436.0,2025-01-20 10:37:16
1i5n7p5,Green_Candler,Keep up the good work CHAD,13,1737369711.0,2025-01-20 10:41:51
1i5n7p5,kingkongbananakong,I’m just waiting to get home to do the same,11,1737374116.0,2025-01-20 11:55:16
1i5n7p5,North-Town4883,Going to keep saying it    Breath become the whales 🐋 ,9,1737374234.0,2025-01-20 11:57:14
1i5n7p5,ALVV78,Yeah bought my other 13 mill a bit early.  Got no money to spare at the moment but great for those getting in now.,3,1737381266.0,2025-01-20 13:54:26
1i5mtjf,Green_Candler,thanks for the heads up,9,1737369759.0,2025-01-20 10:42:39
1i5irhb,skillmattic,"Let's get it, we dropped to 5th behind lil ol'Peanut head...VOTE VOTE VOTE",9,1737353537.0,2025-01-20 06:12:17
1i5irhb,North-Town4883,4820 a piece as of now ,6,1737358664.0,2025-01-20 07:37:44
1i5irhb,strider1919,Done 🫡,8,1737353852.0,2025-01-20 06:17:32
1i5irhb,Green_Candler,Done,2,1737369825.0,2025-01-20 10:43:45
1i5irhb,Aggressive-Virus4046,We sure won't,5,1737361204.0,2025-01-20 08:20:04
1i5irhb,LiiQuiD0,Done 🫡,2,1737366516.0,2025-01-20 09:48:36
1i5irhb,CoopVelociraptor,Bro I didn’t short tf outta that squirrel for it to beat us here.  Get tf in there and vote!!!!,2,1737367134.0,2025-01-20 09:58:54
1i5irhb,ZonkyZebra,"Idk about giga but I know hege is paying people to vote that's why they got so high so quick, I'm going to assume chill guy does it too because they randomly started getting heavy voting as well.",1,1737369574.0,2025-01-20 10:39:34
1i5irhb,CoopVelociraptor,Most projects pay for Certik audits too.  We are Kendu. We all we got - we all we need! 😤,1,1737371123.0,2025-01-20 11:05:23
1i58g8y,[deleted],[deleted],37,1737320438.0,2025-01-19 21:00:38
1i58g8y,lemond4455,"&gt;What repos are you looking at for this?  So the project I mentioned in the OP that allows voting for tokenholders is [Snapshot.org](http://Snapshot.org), which is the most common way to implement this sort of thing:  [https://github.com/snapshot-labs/snapshot-v1](https://github.com/snapshot-labs/snapshot-v1)  It's fairly easy to set up some basic governance, but requires a bit more effort when automating the outcome of voting through smart contracts.",14,1737321689.0,2025-01-19 21:21:29
1i58g8y,[deleted],[deleted],10,1737324115.0,2025-01-19 22:01:55
1i58g8y,lemond4455,We can just go with the hosted option. A lot of other major projects have done so.,14,1737324435.0,2025-01-19 22:07:15
1i58g8y,Medevil_Coconut,Happy cake day Lemon.,3,1737338228.0,2025-01-20 01:57:08
1i58g8y,lazargwf,Maybe you can talk to Josh about this?,39,1737320548.0,2025-01-19 21:02:28
1i58g8y,DoughnutBusy5981,"In the open-mic telegram voice chat yesterday, Josh explicitly asked for anyone with a vision for this project to come up to him to discuss possibilties.",8,1737369033.0,2025-01-20 10:30:33
1i58g8y,Real_Crab_7396,"A lot of people are very bullish and loved that this finally happened for the best of kendu, but we've been buying the dip for so long we can't hold the floor. I think things have to settle for some time for buyers to have confidence again. Today there was a q&amp;a with the new community lead, josh. There were 200+ people in the telegram VC. So there's a lot of interest still in kendu. We're going to billions",44,1737319623.0,2025-01-19 20:47:03
1i58g8y,kendu_kenner,"Theres a few early people getting rid of their dwindling supply, the lower the price goes, the faster these wallets run out. Literally nobody in the community is concerned about it at the moment, they're buying up as much as possible. Im aggressively DCAing. I could not be more bullish.",13,1737332697.0,2025-01-20 00:24:57
1i58g8y,Real_Crab_7396,"exactly, our distribution was already insane but these sells now makes it possible imo to get a 100x in a couple months time, as everyone who sells now can't sell anymore during the uptrend and only very strong hands stay, they'll likely even fomo back in at one point.",7,1737364752.0,2025-01-20 09:19:12
1i58g8y,PrestigiousAd9825,"Thank you again for sharing this with me - I agree with the feedback below that whatever we agree on and draft up should face Josh for his POV, but it's so important that we give him something to react to instead of just an endless onslaught of open-ended questions that are tough/impossible to answer in the short-term.   Drafting a sandbox post now to show what consolidated feedback I've heard so far with the idea we open up a bunch of sub-threads to discuss smaller strategy points or priorities to aim at next. Looking forward to seeing what comes next!",19,1737323020.0,2025-01-19 21:43:40
1i58g8y,BTT991,You are the biggest chad ive ever seen,16,1737322677.0,2025-01-19 21:37:57
1i58g8y,Visual_Ad_6630,Your help is honestly needed. As well as very much appreciated. True G shit!,11,1737326130.0,2025-01-19 22:35:30
1i58g8y,ImpressiveRestaurant,What's the best way to discuss with people like you if you are not on tg ? Do you have any pref ?,10,1737328646.0,2025-01-19 23:17:26
1i58g8y,lemond4455,"Here in the thread is good, but I'm also open to DM/chat",9,1737329369.0,2025-01-19 23:29:29
1i58g8y,News-Principal-160,this is good idea,10,1737328299.0,2025-01-19 23:11:39
1i58g8y,SpoonyLoveee69,Love to see this! We need all the help from top-tier Chads like you in Kendu! You should get in touch with Josh in TG. He'd love the help.,9,1737332750.0,2025-01-20 00:25:50
1i58g8y,Dramatic_Weakness693,That’s a great idea! Thanks for stepping up Chad!!!! This is exactly what we need to do! Bring our individual skills to the community!,7,1737330482.0,2025-01-19 23:48:02
1i58g8y,Deep-Plant5252,Would be Great 🫡,6,1737332369.0,2025-01-20 00:19:29
1i58g8y,wr0ngdr01d,"I’ve had similar thoughts and have done some web3 development, but I turned into a product manager. Would love to help if there’s any way I can. ",7,1737332442.0,2025-01-20 00:20:42
1i58g8y,[deleted],[removed],13,1737320585.0,2025-01-19 21:03:05
1i58g8y,lemond4455,"See my other comment regarding implementation of governance. The other thing we can do is have routine community calls at fixed intervals, where we come together to see where we are at with things and what to do next.",13,1737322669.0,2025-01-19 21:37:49
1i58g8y,MobiusGalaxy99,Same I had no clue who Miazaki was as well before discovering Kendu,10,1737321699.0,2025-01-19 21:21:39
1i58g8y,RariCalamari,Hope your skills can be put to a good use. Marketplace seems to be done so somewhere else maybe,6,1737322176.0,2025-01-19 21:29:36
1i58g8y,MobiusGalaxy99,What are you trying to communicate,8,1737322303.0,2025-01-19 21:31:43
1i58g8y,RariCalamari,Sorry meant to be a response to the main post,6,1737322400.0,2025-01-19 21:33:20
1i58g8y,MobiusGalaxy99,All good lol,4,1737322580.0,2025-01-19 21:36:20
1i58g8y,DoughnutBusy5981,Glad to have you here!   In Scrum it's a good practice to measure key metrics in defined intervals to measure and visualize the project performance over time. Is snapshot offering similar features? I'd be down to help with working out these governance processes.,3,1737369339.0,2025-01-20 10:35:39
1i58g8y,W-D-Goldbeard,Matie please do this 'nd give a voice to the crew 🙏   The organisation o' the CHADs be soundin' like a very powerful prospect. Ye have me full support with this idea 🫡🏴‍☠️,2,1737407987.0,2025-01-20 21:19:47
1i58g8y,Equal-Character-8120,Beaconsfield Victoria...,1,1737373133.0,2025-01-20 11:38:53
1i58g8y,skillmattic,"We need a savior at this point 😱 its currently down like 43% today...that's some scary shit!   Thank you for your help though, hopefully, we can get back up and running and be bigger and stronger than ever. I still believe in KENDU and want us to never die out🙏🏾🫡🪖",1,1737341976.0,2025-01-20 02:59:36
1i58g8y,DoughnutBusy5981,"We all can be saviors. Some with strategy, other with tool development, but also just by spreading the positive vibes across the socials. So you are also doing you part right now chad. 🪖👊",4,1737369188.0,2025-01-20 10:33:08
1i58g8y,skillmattic,You're right...we will recover🫡,3,1737392751.0,2025-01-20 17:05:51
1i58g8y,DoughnutBusy5981,That's the spirit &lt;3,2,1737452509.0,2025-01-21 09:41:49
1i5iaed,CompetitiveGarbage1,For real man,7,1737350733.0,2025-01-20 05:25:33
1i5iaed,Aggressive-Virus4046,Yeah I'm waiting for a payment too,6,1737361251.0,2025-01-20 08:20:51
1i5iaed,Equal-Character-8120,"Don't worry, it goes down to zero!",3,1737384880.0,2025-01-20 14:54:40
1i5iaed,preskooo9720,Yea the way uts going 0 isnt far down,2,1737385480.0,2025-01-20 15:04:40
1i5iaed,jimjamj14,"Straight up, I’m taking out a personal loan this week to ape the fuck in. Buying at this price is an insane opportunity.",3,1737358237.0,2025-01-20 07:30:37
1i5iaed,J0E_SpRaY,For your own sake I hope you’re just peacocking.,3,1737383247.0,2025-01-20 14:27:27
1i5iaed,Doc_Holiday_x,"I’m absolutely 100% buying.  Almost 17k members, 90% of them diamond hands at a 8 million dollar market cap.  Once this dust settles, Kendu will be massive",1,1737430161.0,2025-01-21 03:29:21
1i5b231,DuschgelVonAxe,What a post. This little development roadmap idea already makes our goals sound like theyre inevitable,26,1737330795.0,2025-01-19 23:53:15
1i5b231,PrestigiousAd9825,The gap between potential and reality is only as wide as your perspective is narrow - we’ve got WAY too much of a head start on this idea to not be able to attract the best and brightest ppl to join us and really build this thing,16,1737342041.0,2025-01-20 03:00:41
1i5b231,PrestigiousAd9825,"**OBJECTIVE 3: MAKE FOMO OUR FUEL**  *Strategy 3a: Commit to mass appeal/adoption*  We used to be SO, SO good about creating an environment that could appeal to anybody who got involved. I know several people personally who I was soft-launching Kendu to when we were near ATH who wouldn't touch Kendu with a 20-foot pole today: not because of the price or the leadership struggles, but because they'd dip out the second they saw a meme that got too political or unfocused to make us look serious and not like some niche bro-coin that could be rugged at any moment. We've GOT to get back there to ignite the rocket.  As we redevelop a community ethos and think of ways to make Kendu look appealing to the next generation of chads who will help us grow further, we have to reinforce the idea that the group will inevitably take the shape of what we make it to be. If there's any kind of content, political or otherwise, that alienates people into thinking they won't get a piece of the pie or credit for what they contribute, that kind of unwelcoming energy creates a poison that artificially limits our potential and exposes us to an unfathomable opportunity cost. A proper set of communication guidelines or even just a team that can regularly go outside and control the narrative of what we stand for and what we want to do feels like an easy way to insulate ourselves from this cost.  *Strategy 3b: Use our stats to tell a story*  Right now, we have over 16,000 holders who have each bought into what we're doing. We pumped up the price 10x higher than this with fewer than half that holder count just half a year ago. The potential of what's possible with our philosophy is the best tool in our arsenal to succeed - and if we organize building a formal narrative and series of talking points to explain in plain, simple terms why this potential exists, we have the chance to get that price ratio back.  I don't think there's any harm in speculating about what Kendu could be worth someday, or even what it should be worth if we do everything right from this point forward - but if we can visualize what we've been able to accomplish already using our past as the proof, it opens the right kind of doors to get people to genuinely buy in. No more of this ""trying to get the attention of then beefing with whatever crypto influencer is fading us"" shit - what we're doing should make sense to a new buyer without a third-party opinion from any ""expert"" validating what we're saying. Positive attention is great and negative attention is news, but if the narrative is a return to community control, we have to be able to prove it without having to be at the mercy of external influence to permit our success. ""Attract, don't chase"" and all that jazz.  *Strategy 3c: Get back into the conversation*  Memecoin development isn't a game of speed - it's a game of acceleration. If we build tactics around organizing the community to invest at pre-determined periods of time, we could re-enter the top trending charts on all of those platforms we used to take for granted. Maybe we just have a day where we boost the trade volume like crazy by telling everyone to trade on a few key focus exchanges. Maybe we have a day where everyone buys $5 worth of Kendu at a pre-determined time regardless of what the price is to throw a match into the metaphorical gas tank.  If we build organization and infrastructure that allows us to make big waves, and follow that up with a dedicated team of informed leadership that can make a great impression when we're asked about those waves, it would put us in league with what every billion dollar project has had to have by necessity.  We can believe in 10x, 50x, 100x+ growth all we want... but the people who will inevitably be responsible for finding the chads who will finance that are going to need a good reason why. We cannot afford to put the cart before the horse on this and prioritizing our public relations/optics beyond a comment section raid or like spamming exercise will prove critical to do that.",19,1737326417.0,2025-01-19 22:40:17
1i5b231,News-Principal-160,"wow this is a whole lot, but impressive",21,1737328042.0,2025-01-19 23:07:22
1i5b231,PrestigiousAd9825,"Thank you thank you - this weird Trumpcoin news, USDT wonkiness, and LBank straight up freezing has had me a bit neurotic today lol",20,1737328343.0,2025-01-19 23:12:23
