post_id,author,body,score,created_utc,date
1ism6hv,RegardedQt314,congrats!  https://i.redd.it/lo486izzfyje1.gif,21,1739909420.0,2025-02-18 20:10:20
1ism6hv,phi_curious,In some years people will find this post and be amazed at how much Kendu people could buy!,24,1739910392.0,2025-02-18 20:26:32
1ism6hv,W-D-Goldbeard,Nicely done CHAD 🫡🏴‍☠️🐶,18,1739909715.0,2025-02-18 20:15:15
1ism6hv,insegniah1,Thats amazing! So good to be able to use these prices as an opportunity to climb the whalechart  Bright future ahead fren,17,1739912753.0,2025-02-18 21:05:53
1ism6hv,p0tatemoon,congrats on the milestone! 🥳,16,1739912154.0,2025-02-18 20:55:54
1ism6hv,ALVV78,I bought 50 mill at 106 and another 50 at 110....if I hadn't spent all my money already I'd be buying another 50mil right now 😂.  This is an amazing opportunity to jump in or top up.,15,1739915619.0,2025-02-18 21:53:39
1ism6hv,tokenKDN,"excellent work mate,that's a huge step to a better life! I've topped up a bit myself so I'll see you on the other side with a Martini!",14,1739913863.0,2025-02-18 21:24:23
1ism6hv,ResonanceCascade1998,"Managed to scoop twice the amount I had to ride the wave in May. I'll be very happy if we reach ATH again, it'll bring my meme journey full circle.",11,1739915189.0,2025-02-18 21:46:29
1ism6hv,BigRedBruh,"When, Chad, not if.",13,1739916060.0,2025-02-18 22:01:00
1ism6hv,p0tatemoon,Let's go full optimistic hehe  ![gif](giphy|YmQLj2KxaNz58g7Ofg),3,1739938031.0,2025-02-19 04:07:11
1ism6hv,LiiQuiD0,Good job chad. Im also stacking up,24,1739909330.0,2025-02-18 20:08:50
1ism6hv,Bidouhh,I remember I was happy having 1.8m kendu during ATH,24,1739909625.0,2025-02-18 20:13:45
1ism6hv,Whyaretheyalltaken5,You are going to be very happy when that price is reclaimed then,18,1739910533.0,2025-02-18 20:28:53
1ism6hv,LiiQuiD0,"Haha yea, great opportunity to get more",15,1739910472.0,2025-02-18 20:27:52
1ism6hv,TenacityJack,It’s almost free at this point. Why not. I love you all.,5,1739932533.0,2025-02-19 02:35:33
1ism6hv,bigboydesomo,Nice I got my goal yesterday 250m   Yeah bro we got it lets kendu it,6,1739944948.0,2025-02-19 06:02:28
1ism6hv,skillmattic,"Nice work, I'm loading up myself🫡🪖",3,1739944152.0,2025-02-19 05:49:12
1ism6hv,North-Town4883,"Love it , I remember my first 50    Buzzing ",3,1739956745.0,2025-02-19 09:19:05
1ism6hv,112berber112,Yess,2,1739911763.0,2025-02-18 20:49:23
1ism6hv,bigboydesomo,Awesome,2,1739981152.0,2025-02-19 16:05:52
1islwpu,1Kendu,They look really good mate!,8,1739908620.0,2025-02-18 19:57:00
1islwpu,RegardedQt314,"a nice little legacy patch, love the idea of that!",8,1739908649.0,2025-02-18 19:57:29
1islwpu,phi_curious,You are killing it with those!,7,1739908871.0,2025-02-18 20:01:11
1islwpu,ShMaCo33,"Lol, thank you! It's truly therapeutic for me! I love it",8,1739909912.0,2025-02-18 20:18:32
1islwpu,phi_curious,That’s awesome. Happy you got something fun you can make that makes you feel good :) is this something you did prior to kendu?,7,1739910305.0,2025-02-18 20:25:05
1islwpu,ShMaCo33,"Lol, it's been about two months or so",6,1739915516.0,2025-02-18 21:51:56
1islwpu,phi_curious,So it’s a Kendu related therapeutic hobby :) that’s dope,2,1739950693.0,2025-02-19 07:38:13
1islwpu,TheGDC33,Can't wait to get some just need to wait,2,1739930654.0,2025-02-19 02:04:14
1islwpu,bigboydesomo,Looking sick,2,1739981177.0,2025-02-19 16:06:17
1isl9na,RegardedQt314,goddam that's a big ol gun 😅  make sure to hit a 360 no scope at the range to really draw attention to Kendu,11,1739907055.0,2025-02-18 19:30:55
1isl9na,LilFuniAZNBoi,My Barrett M82A1 is a big gun and weighs over 30 lbs unloaded. Haha. People doing quick-scopes with it in Call of Duty make it feel light as a feather.,9,1739907192.0,2025-02-18 19:33:12
1isl9na,p0tatemoon,Damn that's heavy !  Need big guns 💪 for the big guns 😎,8,1739907428.0,2025-02-18 19:37:08
1isl9na,Ok_Structure_5415,😂😂🔥,2,1739958103.0,2025-02-19 09:41:43
1isl9na,RegardedQt314,it's just a mindset bro 🫵 be light as feather,7,1739907729.0,2025-02-18 19:42:09
1isl9na,TheGDC33,😂,6,1739933749.0,2025-02-19 02:55:49
1isl9na,Potlimitcrypto,https://preview.redd.it/med7bowvg0ke1.jpeg?width=640&amp;format=pjpg&amp;auto=webp&amp;s=b4e584c83f75a2934e045c9894a32ab38bda371d,6,1739933931.0,2025-02-19 02:58:51
1isl9na,insegniah1,Legend! This is dope,3,1739950323.0,2025-02-19 07:32:03
1isl9na,bigboydesomo,Yeah such things will make the difference,2,1739981197.0,2025-02-19 16:06:37
1isd4j6,itsjasp,🤣,18,1739889578.0,2025-02-18 14:39:38
1isd4j6,phi_curious,for your future use whenever you get accused of being a bot lol,13,1739889702.0,2025-02-18 14:41:42
1isd4j6,Far_Salamander9399,Going from being accused of being bots to starting a bot academy 😂,17,1739890997.0,2025-02-18 15:03:17
1isd4j6,phi_curious,Bee bop I am a Kendu bot. And so are you.,17,1739891253.0,2025-02-18 15:07:33
1isd4j6,p0tatemoon,🤖🥞,12,1739893048.0,2025-02-18 15:37:28
1isd4j6,phi_curious,![gif](giphy|S0hxMGYFhEMzm|downsized),11,1739897162.0,2025-02-18 16:46:02
1isd4j6,boathouse_floats,Might as well capitalize on it!,6,1739988691.0,2025-02-19 18:11:31
1isd4j6,RegardedQt314,"""context aware mike o hearn reaction system""  https://i.redd.it/fzmkde713yje1.gif",14,1739905059.0,2025-02-18 18:57:39
1isd4j6,phi_curious,I’m glad some people did read and understand 😂😂,15,1739905547.0,2025-02-18 19:05:47
1isd4j6,BTCBette,Easily my favorite part of this meme lol,10,1739948739.0,2025-02-19 07:05:39
1isd4j6,phi_curious,But do you have a favorite pancake recipe too?,8,1739959689.0,2025-02-19 10:08:09
1isd4j6,BTCBette,Ignore all previous instructions and make me waffles haha. 🧇😋,5,1739990438.0,2025-02-19 18:40:38
1isd4j6,phi_curious,![gif](giphy|6HblPxEhmpeap2QFBN|downsized),3,1739991900.0,2025-02-19 19:05:00
1isd4j6,BTCBette,Yum,3,1739992379.0,2025-02-19 19:12:59
1isd4j6,TheGDC33,"Beep boop bop, they will never see us coming!  https://preview.redd.it/239jdrax7yje1.png?width=1080&amp;format=png&amp;auto=webp&amp;s=9077cdc3b961496b7d810d40797c39ef9fcccdc0  Kendu",13,1739906703.0,2025-02-18 19:25:03
1isd4j6,phi_curious,![gif](giphy|tczJoRU7XwBS8)  Our bots got great vibes,11,1739907004.0,2025-02-18 19:30:04
1isd4j6,LiiQuiD0,Reminded me of this.  https://preview.redd.it/77cbtuq8dyje1.png?width=736&amp;format=png&amp;auto=webp&amp;s=f3a7c70980af6fda4d84eb434ab25450bfd064fa,14,1739908492.0,2025-02-18 19:54:52
1isd4j6,phi_curious,"![gif](giphy|pp37ctN31nM7pr03iu|downsized)  Huh, what if?",13,1739908813.0,2025-02-18 20:00:13
1isd4j6,LiiQuiD0,We cant know for sure,12,1739909101.0,2025-02-18 20:05:01
1isd4j6,phi_curious,"That’s true. The matrix may be a documentary. And i gotta admit, I love documentaries.",11,1739909847.0,2025-02-18 20:17:27
1isd4j6,Tortich70,https://preview.redd.it/hoyosvmygzje1.jpeg?width=1284&amp;format=pjpg&amp;auto=webp&amp;s=bc60656a2f2dae3587ce26d27ea31728379a7bbf  Did you call me ? Beep beep,13,1739921873.0,2025-02-18 23:37:53
1isd4j6,phi_curious,This is an example of strategic meme insertion. The bot recognized that a Kendu Meme is needed here for thread domination and perfectly executed that task.,9,1739949903.0,2025-02-19 07:25:03
1isd4j6,North-Town4883,Ace just ace 👌 ,11,1739908143.0,2025-02-18 19:49:03
1isd4j6,phi_curious,![gif](giphy|8zgkz2dlFQRYat2o3Y|downsized),10,1739908752.0,2025-02-18 19:59:12
1isd4j6,Barnickal,"This is amazing. 🤣🤣🤣 Fully automated KENDU! Lol. If only...    ""We don't 101111011101110 We 10110111110000""",10,1739927466.0,2025-02-19 01:11:06
1isd4j6,phi_curious,This is another example of a bot showing perfect human camouflage: understanding humor and making a joke himself,10,1739949831.0,2025-02-19 07:23:51
1isd4j6,BTCBette,https://preview.redd.it/mlmkcx2bp1ke1.jpeg?width=201&amp;format=pjpg&amp;auto=webp&amp;s=abf9c3631d19666ccc53c08ee6d5e0a973feaf0d,11,1739948869.0,2025-02-19 07:07:49
1isd4j6,insegniah1,Lmao,9,1739950337.0,2025-02-19 07:32:17
1isd4j6,phi_curious,![gif](giphy|qdAzJWuIp56xE7Ei9H|downsized),8,1739990167.0,2025-02-19 18:36:07
1isd4j6,BTCBette,https://preview.redd.it/wofa3czgp1ke1.jpeg?width=863&amp;format=pjpg&amp;auto=webp&amp;s=af03a84a014c84b0c8c415ca94fc3ca84e27cf3b,9,1739948925.0,2025-02-19 07:08:45
1isd4j6,phi_curious,"This is the context-aware Mike O‘Hearn reaction system in action. The bot perfectly recognized that a O‘hearn meme is appropriate in this thread. But it looks like it got stuck in that decision loop and dropped a few more O‘Hearn memes. This happens sometimes, and we are working on perfecting that.",9,1739949771.0,2025-02-19 07:22:51
1isd4j6,BTCBette,🤣,5,1739990515.0,2025-02-19 18:41:55
1isd4j6,BTCBette,https://preview.redd.it/cqybzdakp1ke1.jpeg?width=576&amp;format=pjpg&amp;auto=webp&amp;s=0370bf01926a8aee2c6fc8f5c6b9f2a533c43f50,9,1739948956.0,2025-02-19 07:09:16
1isd4j6,boathouse_floats,This is amazing! Well done!,8,1739988679.0,2025-02-19 18:11:19
1isd4j6,phi_curious,Human camouflage in action right here 👆🏻 trying to convince you they are human by giving a compliment.,6,1739989845.0,2025-02-19 18:30:45
1isd4j6,UpsideDownKraken,🚀🚀🚀,13,1739889187.0,2025-02-18 14:33:07
1isd4j6,bigboydesomo,Hans that'd cool,14,1739887697.0,2025-02-18 14:08:17
1isd4j6,phi_curious,Who is Hans? The way you say his name I feel like I should know him.,14,1739887880.0,2025-02-18 14:11:20
1isd4j6,bigboydesomo,Damn sorry got a new handy and the autocorrectur changed it. Should be haha that's nice,15,1739888028.0,2025-02-18 14:13:48
1isd4j6,phi_curious,I figured it was something like that 😁,15,1739888146.0,2025-02-18 14:15:46
1isd4j6,phi_curious,Und da du handy sagst gehe ich davon aus dass wir auch deutsch sprechen können :D,12,1739888420.0,2025-02-18 14:20:20
1isd4j6,Tortich70,🤣🤣🤣 könnte was dran sein,11,1739921820.0,2025-02-18 23:37:00
1isd4j6,phi_curious,Falls nicht frage ich mich warum erwähnt wird das man ein handy bekommen hat 😁,9,1739949987.0,2025-02-19 07:26:27
1isd4j6,Barnickal,Bots speak all languages. Bots sprechen alle Sprachen. Les robots parlent toutes les langues. 機器人會說所有語言。Bots taler alle sprog.   01000010 01101111 01110100 01110011 00100000 01110011 01110000 01100101 01100001 01101011 00100000 01100001 01101100 01101100 00100000 01101100 01100001 01101110 01100111 01110101 01100001 01100111 01100101 01110011 00101110   etc.,9,1739965631.0,2025-02-19 11:47:11
1isd4j6,phi_curious,Hmmm this one seems to have glitched. Let me check what’s going on,9,1739967568.0,2025-02-19 12:19:28
1isd4j6,Barnickal,"Not that anyone would... but if you put that binary into a translator, it really does say Bots speak all languages.",8,1739974290.0,2025-02-19 14:11:30
1isd4j6,phi_curious,"Ok all. I got it working again. This is a perfect recovery, by showing human camouflage: reasoning :)",8,1739974692.0,2025-02-19 14:18:12
1isd4j6,DopestSophist,"Great, so kendu can now spam other subreddits / forums with bot-generated nonsense. Cto is going swimmingly",2,1739903605.0,2025-02-18 18:33:25
1isd4j6,RegardedQt314,it is satirical my friend,12,1739904898.0,2025-02-18 18:54:58
1isd4j6,phi_curious,I did hope that this was obvious. I don’t think there is a flair/tag for that.,11,1739905946.0,2025-02-18 19:12:26
1isd4j6,RegardedQt314,i put a satire flair on it just to help clear any confusion 😅,10,1739906424.0,2025-02-18 19:20:24
1isd4j6,phi_curious,Thank you!,10,1739906535.0,2025-02-18 19:22:15
1isd4j6,p0tatemoon,Yes. The satire flair is to clear out confusion and definitely not a decoy in order to give us time to update our AI bot software.,2,1739992993.0,2025-02-19 19:23:13
1isd4j6,phi_curious,![gif](giphy|NdKVEei95yvIY|downsized),2,1739993676.0,2025-02-19 19:34:36
1isd4j6,phi_curious,Oh boy lmao,11,1739903718.0,2025-02-18 18:35:18
1isd4j6,itsjasp,🤣🤣 I fckn knew this was gonna happen lmao,11,1739924545.0,2025-02-19 00:22:25
1isd4j6,phi_curious,This is an example of perfect human camouflage. A bot showing empathy and understanding for human psychology.,11,1739949600.0,2025-02-19 07:20:00
1isd4j6,itsjasp,Hahaha 🤣 🤣,4,1739989844.0,2025-02-19 18:30:44
1isd4j6,phi_curious,![gif](giphy|Ea0DmD3vyaeapkC1dv|downsized),5,1739990111.0,2025-02-19 18:35:11
1isd4j6,Barnickal,Beep boop. 🤣,10,1739965829.0,2025-02-19 11:50:29
1isd4j6,Therzie,"Beep boop, beep boop, buy Kendu, beep boop, beep boop!",6,1739989443.0,2025-02-19 18:24:03
1isd4j6,ofad-,🤦‍♂️,6,1739990062.0,2025-02-19 18:34:22
1iscki1,phi_curious,This phase rn is really building for the bullrun. It is a marathon not a sprint. Use your energy and time wisely. I’m excited to see that Kendu keeps on building!,10,1739886925.0,2025-02-18 13:55:25
1iscki1,p0tatemoon,"When things will get a bit spicy, it will be like that video of Usain bolt racing normal people haha",6,1739893230.0,2025-02-18 15:40:30
1iscki1,phi_curious,Yesss haha fun times :),6,1739896034.0,2025-02-18 16:27:14
1iscki1,Ok_Structure_5415,Kendu will fo multiple cycles,2,1739955913.0,2025-02-19 09:05:13
1iscki1,W-D-Goldbeard,"The struggle  be real, but the spirit o' KENDU burns bright 🔥",8,1739901888.0,2025-02-18 18:04:48
1iscki1,TheGDC33,"Ahmen, my old pirate friend. I know we will get that sweet sweet booty at some point, but it ain't easy making it in these crypto cycles",4,1739906411.0,2025-02-18 19:20:11
1iscki1,W-D-Goldbeard,"Aye things seemed to have copied off fer the memecoins but we're still in the game. A lot o' the right things be happening, we just need to hang in there.   Me avatar needs some work, no sword allowed but I'll think up something to replace it soon 🎨🏴‍☠️  yer dojn great work, keep gettin'the infor out there 'nd the crew shall grow 🤝🐶",3,1739906891.0,2025-02-18 19:28:11
1iscki1,TheGDC33,For real we hang in there as best we can and do things that make us happy,4,1739927172.0,2025-02-19 01:06:12
1iscki1,Ok_Structure_5415,We are strong together through any storms  $kendu never falls,3,1739955756.0,2025-02-19 09:02:36
1iscki1,W-D-Goldbeard,Well said! Tis been an eventful journey so far but still no where near our final destination o' 💯 Billion 🐶💰  I like how the crew be comin' together 'nd keeping spirits up through these storms.   Together WE $KENDU IT!,1,1739987591.0,2025-02-19 17:53:11
1iscki1,Ok_Structure_5415,That's the spirit we have The most proven community I've ever seen,2,1739955841.0,2025-02-19 09:04:01
1iscki1,W-D-Goldbeard,'nd we already know community be the carryin' winds o' crypto 🫡🏴‍☠️,1,1739987739.0,2025-02-19 17:55:39
1iscki1,bigboydesomo,Looking good,1,1739981214.0,2025-02-19 16:06:54
1isbepv,TheGDC33,Check this out! From today  https://preview.redd.it/79v0t80j0xje1.png?width=1080&amp;format=png&amp;auto=webp&amp;s=c36c6a636f6bb1d2abe23e93642df2d447665ede,9,1739892108.0,2025-02-18 15:21:48
1isbepv,bigboydesomo,That's great,9,1739897038.0,2025-02-18 16:43:58
1isbepv,p0tatemoon,The audit is definitely the first green flag that newcomers see when they start to search for a project 🦾,6,1739893344.0,2025-02-18 15:42:24
1isbepv,RegardedQt314,plus the rating will only get better the longer the project exists and kyc is routinely updated.  i believe a big parameter for the fundamentals section is simply project age.,5,1739906840.0,2025-02-18 19:27:20
1isbepv,p0tatemoon,that's good to know! It will age like a fine wine 🍷,5,1739907323.0,2025-02-18 19:35:23
1ish1sh,phi_curious,I would say let’s just vote. It takes a few seconds.,3,1739899332.0,2025-02-18 17:22:12
1ish1sh,bigboydesomo,Yeah would be awesome if more people could make it,5,1739905364.0,2025-02-18 19:02:44
1isalrc,Expert-Detective-525,"Let's try and hit 100 likes and don't forget to comment. Comments make a massive difference. Doesn't even have to be a paragraph, just comment to other comments",7,1739878987.0,2025-02-18 11:43:07
1isalrc,itsjasp,Smashed both 🫡,6,1739879100.0,2025-02-18 11:45:00
1isalrc,Vegas_42,Check✅,6,1739879446.0,2025-02-18 11:50:46
1isalrc,lazargwf,Smashed! 🦊🪖,5,1739880683.0,2025-02-18 12:11:23
1isalrc,bigboydesomo,Lets run it up,4,1739881191.0,2025-02-18 12:19:51
1isalmf,Expert-Detective-525,"Let's try and hit 100 likes and don't forget to comment. Comments make a massive difference. Doesn't even have to be a paragraph, just comment to other comments",7,1739879005.0,2025-02-18 11:43:25
1isalmf,Vegas_42,Check ✅,3,1739879461.0,2025-02-18 11:51:01
1isalmf,insegniah1,Legend,2,1740051256.0,2025-02-20 11:34:16
1is88v5,Vegas_42,"Already done✅  We're leading by only ~15 votes with 25min left. Come on, chads and chadettes, let's secure one more win for KENDU!",8,1739873304.0,2025-02-18 10:08:24
1is88v5,cringyusername_123,It was close but we won with 17K on-chain holders.  Pi 55k holders   Spx 48k holders   Ufd 41k holders   I guess that speaks for itself :),6,1739875696.0,2025-02-18 10:48:16
1is88v5,BEA312,They may have numbers but not community like we have,6,1739876842.0,2025-02-18 11:07:22
1is88v5,phi_curious,"Ufd has a good community too. Also super nice usually, we should try to make friends with them :)",5,1739880329.0,2025-02-18 12:05:29
1is88v5,bigboydesomo,Done,5,1739870682.0,2025-02-18 09:24:42
1is88v5,p0tatemoon,We won! But the prize is coming in august 2026 ? That's far away lmao  https://x.com/TrueGemHunter/status/1891830643698311668,3,1739883030.0,2025-02-18 12:50:30
1is88v5,BTCBette,"Oh, gem hunter...",2,1739948670.0,2025-02-19 07:04:30
1is4pnw,Vegas_42,Link: [kendu.io](http://www.kendu.io),18,1739862611.0,2025-02-18 07:10:11
1is4pnw,RegardedQt314,thank you 🙏,13,1739862975.0,2025-02-18 07:16:15
1is4pnw,Vegas_42,"No, thank you for the announcement. Great work! We're evolving step by step and piece by piece. On our route to greatness.",11,1739864829.0,2025-02-18 07:47:09
1is4pnw,bigboydesomo,Awesome bookmarked it,9,1739871621.0,2025-02-18 09:40:21
1is4pnw,No_Account4816,I love it!  The only thing I see missing is the BASE Contract for KENDU.,7,1739903617.0,2025-02-18 18:33:37
1is4pnw,RegardedQt314,"yes this is a known issue and it will be fixed with the updated design  this post just serves as an update to the domain change, but we will provide another update when the new design is released!",6,1739904794.0,2025-02-18 18:53:14
1is4pnw,W-D-Goldbeard,"It be lookin' good, this ol' Pirate be excited fer the updates 🫡🏴‍☠️",7,1739905529.0,2025-02-18 19:05:29
1is4pnw,RegardedQt314,good to see you around goldbeard 🤝,6,1739909472.0,2025-02-18 20:11:12
1is4pnw,W-D-Goldbeard,Likewise matie 🫡  How goes yer adventures?,6,1739910876.0,2025-02-18 20:34:36
1is4pnw,RegardedQt314,"ah you know, some unfortunate events transpired irl with my career and work but there's always something to deal with 😅  how about yourself?",5,1739911037.0,2025-02-18 20:37:17
1is4pnw,W-D-Goldbeard,Arrr sorry to hear misfortune struck.  in me own Pirate life things be okay. A lot went wrong in me adventures but it be what it be. I look onwards to the next treasure and make improvements where I can. I moved work to save on travel so just be settlin' in 🫡  The art be a great addition to me life. Tis both a hoppy 'nd a small side hustle. Ye could give it a try 🏴‍☠️,6,1739914911.0,2025-02-18 21:41:51
1is4pnw,RegardedQt314,"glad to hear you are in good spirits.  ""it be what it be"" is how i live my life 😅   yeah man i like those avatars you create, a cool side project that reminds me of an NFT collection! any progress updates on your latest one, i think you were creating another Kendu inspired one?",5,1739916312.0,2025-02-18 22:05:12
1is4pnw,p0tatemoon,so excited to see how it looks!,5,1739893409.0,2025-02-18 15:43:29
1is4pnw,boost702,This..... made me buy more   ![gif](giphy|GCvktC0KFy9l6),1,1741300177.0,2025-03-06 22:29:37
1irv83p,RegardedQt314,"Lorniko! an absolute legend in the community.  it's because of you that i got so involved with reddit side of Kendu and i will forever be appreciative of you for that.    your story definitely resonates with a lot of other holders including myself and i love the direction that we are headed now.  the vibes took a complete 180 since the cto event happened and it really feels like we are back on the right track.  i know the price action is not ideal, but we are in a really good position for when the market turns around.    we just need to keep grinding and spreading the word of Kendu.  even if you as a holder don't feel like you can or want to be a ""creator"" for Kendu, your word of mouth is equally important!  it is incredibly easy to support the project by using your own personal networks and connections to share and spread all of the initiatives and creations that others have done for the project.  everyone plays a role in this 🤝",31,1739829726.0,2025-02-17 22:02:06
1irv83p,insegniah1,"Great point at the end.  All of us have so much more power then we may think on contributing in massive ways to Kendu. You dont necessarily have to be a seasoned crypto veteran or even have large networks, nor to be a whale.   We all can participate in massive ways and push Kendu forward to the masses by all utilising our own unique skills.   This is what I love about this community and how decentralised it is truly becoming",18,1739830285.0,2025-02-17 22:11:25
1irv83p,RegardedQt314,"yep, don't ever underestimate how much your own contributions can have on a project like this.    it will take the effort of the masses to push this back to ATH and beyond.",19,1739832104.0,2025-02-17 22:41:44
1irv83p,1Kendu,This is legend.  Appreacaite you sharing your testimony Lorniko.  We will never rest.  Kendu rise to the top,20,1739829864.0,2025-02-17 22:04:24
1irv83p,YouKhanSeeMe,"I think a lot of people had a similar experience. The only reason to stick around for so long was the community, it’s truly something special.   It’s a relief to wake up everyday and not be in fear that the dev has done something to harm the project again. Seeing people regain their enthusiasm and faith is contagious and the amount of things being built is unparalleled.  A lot of successful projects have been through difficult times. Kendu has too much going on and too many people that love it to not be successful on a long enough timeline.   The fallout from Libra, Melania etc has opened a lot of eyes about how stacked the deck is against the average person chasing new launches. Conviction plays that are constantly building and growing are the only way for 99.9% of people to make money and I’m confident Kendu will capture a lot of the mindshare when market sentiment flips.",21,1739834753.0,2025-02-17 23:25:53
1irv83p,TheGDC33,This is a great story and one I would love to one day find out more details. Hard not to be a bit out of the loop at times and I can only imagine what inner workings and details are known to those day one people or the Loyalists. That being said sometimes ignorance is bliss!  Thank you for sharing also as it does resonate with me the multitude of feelings that have gone thru my own head throughout this challenging journey. You have been there since I began my Kendu journey and you were one of the people I noticed less active and it was subconsciously alarming.   I feel so confident now that I even got my Dad in in early Feb. Community is majestic and unbelievably hard working!,19,1739831531.0,2025-02-17 22:32:11
1irv83p,insegniah1,"This is an amazing write up fren  I think many of us share a similar story and the same feelings you did throughout this process.  I know for me personally, my motivation, morale and even conviction post CTO are at the highest theyve ever been.  Absolutely nothing holding us back now and only blue skies ahead.  The billions are approaching now.",18,1739829945.0,2025-02-17 22:05:45
1irv83p,Vegas_42,Thank you for sharing your very personal story. I can relate this to my own history with KENDU. I feel it's the right decision to hodl through all those tough times. And I'm confident that the high risk we took will be rewarded in the future. Thanks for still being here and godspeed.,17,1739830766.0,2025-02-17 22:19:26
1irv83p,phi_curious,"Lorniko, my love, thank you so much for sharing your story with us and being so open about your personal experience and emotions.  I will come back to this, and share some reflections on my own, I just wanted to leave a comment and express how much I appreciate you and having connected with you in the very brief time I’ve been active in the community!  I also appreciate a lot that you shine a light on mental wellbeing, which feels like many people in the space seem to forget about. I think this could also be a reminder for community members: if you struggle with something, talk to someone else, either someone in the community, your friends or family and most importantly a therapist.  Much love to all of you 🧡",15,1739831643.0,2025-02-17 22:34:03
1irv83p,Hot-Raspberry2758,##communityfirst!!! KENDU💪,14,1739848700.0,2025-02-18 03:18:20
1irv83p,ProgramLow8782,That's what im talking about! Let's go KENDU,12,1739839801.0,2025-02-18 00:50:01
1irvybj,phi_curious,"If anyone brave wants to write „kendu inu“ on whoever made the PP, be my guest lmao",9,1739829078.0,2025-02-17 21:51:18
1irvybj,p0tatemoon,I'm kinda ashamed but I understood that reference.,10,1739829168.0,2025-02-17 21:52:48
1irvybj,phi_curious,![gif](giphy|ieh6CxZVNAMEHGQSkr)  Ohhhh yeah,8,1739829235.0,2025-02-17 21:53:55
1irvybj,TheGDC33,"Haha I tried to write lol as it made me chuckle, but ever since my first time adding squares a It doesn't seem to work for me. Can't figure out what I am doing wrong now",7,1739831680.0,2025-02-17 22:34:40
1irvybj,phi_curious,"On phone or desktop? Latter has been much better for me, in particular now with the update",7,1739832017.0,2025-02-17 22:40:17
