post_id,author,body,score,created_utc,date
1ixspvp,Expert-Detective-525,Come on let's get 5 comments each. We need to keep working,11,1740483399.0,2025-02-25 11:36:39
1ixspvp,insegniah1,Absolutely!,6,1740484924.0,2025-02-25 12:02:04
1ixspvp,kendu_kenner,Never stop working. There's a reason in this latest market dip. Kendu added holders while everything else dropped huge holder numbers,3,1740600484.0,2025-02-26 20:08:04
1ixspvp,insegniah1,Exactly,1,1740607903.0,2025-02-26 22:11:43
1ixspvp,Vegas_42,Commented✅  Edit: and all other comments upvoted✅,6,1740489158.0,2025-02-25 13:12:38
1ixq5jg,phi_curious,Raiiiid raid raid,9,1740473255.0,2025-02-25 08:47:35
1ixq5jg,Vegas_42,Done✅,8,1740473863.0,2025-02-25 08:57:43
1ixq5jg,skillmattic,Done🫡🪖LFG,3,1740486244.0,2025-02-25 12:24:04
1ixq5jg,SeeingTrends13,Raided!,3,1740493004.0,2025-02-25 14:16:44
1ixezyz,SpeakerClassic4418,"The kendu community.  Join the TG.  Work with us.  The more you work, the more you get to know the team, the more you joke and have fun, just everything energizes you.     There is a constant rotation of people from around the world participating.  When I'm in the TG in the morning, it has different people then my afternoon or night, etc.    We motivate each other.  It's infectious.",37,1740437038.0,2025-02-24 22:43:58
1ixezyz,BroskiNatanyahu,This is a good way to feel the energy    Thank you,29,1740438669.0,2025-02-24 23:11:09
1ixezyz,p0tatemoon,"to be honest, I see it like a workout. I make a daily/weekly plan and I follow through. I can miss a day put I try not to miss 2 days in a row  For example, an easy one would be a morning routine :  Designated 10-15min morning routine to Kendu while having my coffee   * Upvote : Kendu on coingecko, coinmarketcap, certik, lewk, etc... * Check new post/repost on X by main account : like and leave a comment * Check kendu reddit : like all post and comments, leave comments  Then you can add extra stuffs like going on TG, smash all pin post, search for $KENDU on X and smash, print business card/ stickers and leave them around town, shilling in real life, etc...be creative!  I would recommend going super easy, just 5min a day but everyday. Consistency is key and the hardest hurdle  Like working out, I don't really rely on motivation. I just do it. If you need a goal, try to do it for the whole year because that's when we are expecting the crypto bull cycle to run. Afterwards, you can reassess if you want to continue or not",30,1740437737.0,2025-02-24 22:55:37
1ixezyz,BroskiNatanyahu,"Nice move but quite long for me, probably will take some main things from your method and start doing",24,1740438744.0,2025-02-24 23:12:24
1ixezyz,TheGDC33,"That is what matters, start somewhere that works well for you and build from that if you feel the urge and desire. It is your investment after all, so easy motivation",23,1740438975.0,2025-02-24 23:16:15
1ixezyz,p0tatemoon,"No worries! I forgot to also mentionned that any type of work is still work. If you only want to upvote on certik or coinmarketcap that's 100% work  Just like the other member responded, at the end of the day, it is your investment. You can give anything you want : no work at all, 5sec, 5 min, 5 hours, etc  To be honest with you, I was invested in Kendu for a couple of months but did zero work. When I saw the CTO happening and saw how the community got together, I wanted to be part of what makes Kendu so special : ""We don't gamble, we work"". I started with upvotes here and there. Noticed that I could do a bit more so I put a few minutes more  Just having you write here is great, glad to have you among us!",21,1740440766.0,2025-02-24 23:46:06
1ixezyz,MFSkunk17,"What keeps me going is the holder growth. Market conditions suck, tons of reputable (and non-reputable) memecoins are bleeding mc and holders. Their cores are losing conviction.   Kendu is the only one really holding strong. The tg is full of hundreds of chads and chadettes who believe in the cause for a slew of reasons too long to list here. Kendu holds strong because it's always been more than just hype and conviction. There's real passion and connection there you won't see anywhere else. Kendu won't rest until they are in the billions. You really feel that.",24,1740440468.0,2025-02-24 23:41:08
1ixezyz,tokenKDN,"I personally get the zeal when I wake up each day and see literally thousands of TG messages of ideas, real life action and energy, which inspires me to do the same. I have never seen, or been a part of, such a relentless community which is a true asset which sets Kendu apart",19,1740440378.0,2025-02-24 23:39:38
1ixezyz,p0tatemoon,haha this 100%. When I haven't been on TG for a few days and see 5k+ messages. I'm like : this community is just not stopping at all,20,1740440926.0,2025-02-24 23:48:46
1ixezyz,A_true_gENTleman,https://preview.redd.it/jcu62ctfk6le1.jpeg?width=3000&amp;format=pjpg&amp;auto=webp&amp;s=6af4b2af56a32fb66740dd02d8d1601b1dee84ce  Who else works like Kendu? No one,21,1740443618.0,2025-02-25 00:33:38
1ixezyz,Libzors,The Kendu community feeds me positivity. Then I feed positivity to others in the community. It’s a self sustaining buffet of positiveness,16,1740450797.0,2025-02-25 02:33:17
1ixezyz,insegniah1,"For me its the community still showing up every day, working and sticking to our goal.  Of course what is happening now is out of our control in terms of the market absolutely nuking.  During this I am seeing, Kendu has held up at the top of my memes watchlist on cmc almost daily.  Also, I have just browsed other communities subs out of curiousity, and the difference in vibes is day and night. Many communities are feeling the despair yet in Kendu the vibes are positive and energetic 24/7  Thats why I know this community is special  I myself am DCAing today :)",17,1740451095.0,2025-02-25 02:38:15
1ixezyz,bigboydesomo,Lfg kendu 🔥,12,1740461543.0,2025-02-25 05:32:23
1ixezyz,mrtareq778,Buy buy,5,1740479378.0,2025-02-25 10:29:38
1ixezyz,comebackkidz13,The price is so low this should be considered robbery,8,1740455671.0,2025-02-25 03:54:31
1ixezyz,karthus25,"I'm only here because my $100 turned into $18 lol.  Scratch that, $12.50ish now.",0,1740454747.0,2025-02-25 03:39:07
1ixgjvy,TheGDC33,This message is not a bot. In fact it is a real Chad! Hope you are well fren🪖,19,1740440912.0,2025-02-24 23:48:32
1ixgjvy,Ok_Structure_5415,Kendu will go to billions  Nothing can break this community   And no one can compare,8,1740462503.0,2025-02-25 05:48:23
1ixgjvy,North-Town4883,100% organic my fren    Surfing the other socials spreading the Gospel of $KENDU    Seen the engagement here has been amazing  from the ogs and newer chads    So stepped back a little to share my shilling powers to the world past reddit    To billions we werk 🫡,7,1740466063.0,2025-02-25 06:47:43
1ixgjvy,TheGDC33,Great werk! And smart too,6,1740483011.0,2025-02-25 11:30:11
1ixgjvy,TrainingReward4308,Hopefully my new wife will like KENDU more.,16,1740440979.0,2025-02-24 23:49:39
1ixgjvy,Hot-Raspberry2758, 😆,10,1740457541.0,2025-02-25 04:25:41
1ixgjvy,insegniah1,Im DCAing today 🤩  Price is so irresistible,10,1740451156.0,2025-02-25 02:39:16
1ixgjvy,Ok_Structure_5415,"It really is   Everyone loves kendu, and everyone loves the kendu community  Never fade kendu inu It will rise",7,1740462708.0,2025-02-25 05:51:48
1ixgjvy,bigboydesomo,When im at home I will buy some too,8,1740461777.0,2025-02-25 05:36:17
1ixgjvy,HumblestofBears,"I bought the dip. No date night money for Friday, now, but women will like me more when I’m rich.",5,1740505497.0,2025-02-25 17:44:57
1ixgjvy,North-Town4883,Short term pain for long term gain    ;),2,1740520711.0,2025-02-25 21:58:31
1ixf8g6,TheGDC33,"I didn't have the heart to say this as a comment in the video and I kept it positive, but that video had a lot of words yet nothing specific was said about what is being done. Talked about marketing and real world stuff and hype for investors with not even 1 concrete example. He had all the setup and gave no metrics or data or specifics",3,1740446838.0,2025-02-25 01:27:18
1ixarzr,p0tatemoon,"In term of marketing, the last few days have been wild lmao  ![gif](giphy|ukGm72ZLZvYfS)",10,1740428434.0,2025-02-24 20:20:34
1ixarzr,phi_curious,It’s a weird timeline. North Korea. Gta artist wtf 😭😂,11,1740428472.0,2025-02-24 20:21:12
1ixarzr,p0tatemoon,"while other communities are brainstorming for the next 4D chess move to pump their coin, some Kendu's members are thinking outside of the box and are bringing Jumanji moves to a chess game 😂",10,1740429009.0,2025-02-24 20:30:09
1ixarzr,phi_curious,pretty much feels like that🤣🤣,8,1740430982.0,2025-02-24 21:03:02
1ixarzr,cringyusername_123,That's freakin awesome,7,1740427849.0,2025-02-24 20:10:49
1ixarzr,[deleted],Yeah $LOOBY with Stephen Bliss has crazy potential,4,1740436149.0,2025-02-24 22:29:09
1ix3q83,SpoonyLoveee69,Legend. Let's go,19,1740408880.0,2025-02-24 14:54:40
1ix3q83,ShMaCo33,"A big move for you is a big move for us! Welcome to the greatest community in crypto! You've made a wise decision by grabbing a bag! Remember, we don't gamble, we work! Love, Chad",25,1740408893.0,2025-02-24 14:54:53
1ix3q83,strider1919,"💯 this is the Mindset… our progress will be slow, then sudden. Welcome Chad!",11,1740421098.0,2025-02-24 18:18:18
1ix3q83,p0tatemoon,welcome on board! 🫡,19,1740409414.0,2025-02-24 15:03:34
1ix3q83,skillmattic,"Nice move chad, welcome aboard, let's go!🫡🪖",15,1740409601.0,2025-02-24 15:06:41
1ix3q83,Vegas_42,"Welcome, fellow chad/chadette!",16,1740409809.0,2025-02-24 15:10:09
1ix3q83,Zingultus,Welcome Chad. Good choice 🤛,15,1740410061.0,2025-02-24 15:14:21
1ix3q83,TheGDC33,Love to see it and congrats. Hope you join the TG where the bulk of the communication and infectious desire to spread this to all you know happens,13,1740414438.0,2025-02-24 16:27:18
1ix3q83,UpsideDownKraken,💰💰💰,13,1740411044.0,2025-02-24 15:30:44
1ix3q83,Less_Ad_9631,Welcome great bag!,13,1740412505.0,2025-02-24 15:55:05
1ix3q83,lazargwf,"Welcome, heavy Chad 😎🦊🪖",10,1740415903.0,2025-02-24 16:51:43
1ix3q83,Unique_Opposite2026,"Waiting till Friday for my salary and will join you then! I mean I will add to my bag, already have one.",9,1740422102.0,2025-02-24 18:35:02
1ix3q83,Potlimitcrypto,Opa! Welcome chad!,8,1740422614.0,2025-02-24 18:43:34
1ix3q83,DelayMost1815,Got 7 mil more than me Chad! Congrats,6,1740426517.0,2025-02-24 19:48:37
1ix3q83,wishnyouwerehere,Hell yeah! Just joined in last week myself.,4,1740429425.0,2025-02-24 20:37:05
1ix3q83,tokenKDN,"Excellent decision, welcome to the most elite community in crypto! Lives will change",6,1740429430.0,2025-02-24 20:37:10
1ix3q83,BMX_BASTARD,Great move  !,3,1740440790.0,2025-02-24 23:46:30
1ix3q83,RazzmatazzInner,"Amazing 🤩, I first read 154 k 😂",3,1740474009.0,2025-02-25 09:00:09
1ix3q83,boost702,![gif](giphy|3ohhweiVB36rAlqVCE|downsized),1,1740504585.0,2025-02-25 17:29:45
1ix3q83,IcarusTactical,TO THE MOON!,1,1740585208.0,2025-02-26 15:53:28
1ix5yml,Kenduonly,Where can I get one,13,1740414385.0,2025-02-24 16:26:25
1ix5yml,they_call_me_mr_mac,Ordered them at vista print. Hereare the templates  https://preview.redd.it/69t6m2jw54le1.png?width=1920&amp;format=png&amp;auto=webp&amp;s=ee089858ff6611540b2b2941e38e5df9674f450e,17,1740414513.0,2025-02-24 16:28:33
1ix5yml,they_call_me_mr_mac,https://preview.redd.it/xx240xmz54le1.png?width=1315&amp;format=png&amp;auto=webp&amp;s=db5be9da71f3471331c393f36fe191bfb3e697f1,15,1740414542.0,2025-02-24 16:29:02
1ix5yml,phi_curious,"This is the update QR code, to Kendu.io, correct?",8,1740416092.0,2025-02-24 16:54:52
1ix5yml,they_call_me_mr_mac,"Yeah, but kinda made an expensive mistake. Its a dynamic QR that needed to be paid for monthly. So took on a  subscription. Should work till 22 Februari 2026.",10,1740417843.0,2025-02-24 17:24:03
1ix5yml,p0tatemoon,"lmao I think we did the same mistake   I went for a free trial for the QR code because I could put the logo in the QR code but after printing the cards, I got an email saying my code will expire at the end of the trial  That's when I realized my mistake (the dynamic QR code) and also paid for the subscription since I already got a bunch of cards...  It was also a blessing because the Kendu website changed so we will be able to make the modifications for our QR code link",6,1740420854.0,2025-02-24 18:14:14
1ix5yml,they_call_me_mr_mac,Hahaha yep same  had a similar mail. Then realized my mistake  ah well never to old to learn.,5,1740421365.0,2025-02-24 18:22:45
1ix5yml,phi_curious,Oh wow. So that means that in theory you could change the link it directs too? Or what’s dynamic in this context?,3,1740417942.0,2025-02-24 17:25:42
1ix5yml,they_call_me_mr_mac,🤔 maybe. I guess in theory yeah.. Havent looked into it yet. Just payed up cause i allready shared it online.,4,1740418319.0,2025-02-24 17:31:59
1ix5yml,phi_curious,"God it, thanks. Happy shilling!",4,1740422279.0,2025-02-24 18:37:59
1ix5yml,they_call_me_mr_mac,You to bud.💪🪖🦊,3,1740426512.0,2025-02-24 19:48:32
1ix5yml,phi_curious,Thanks! Motivates me to have more walks 🧡,3,1740426553.0,2025-02-24 19:49:13
1ix5yml,Hot-Raspberry2758,Lol,2,1740492080.0,2025-02-25 14:01:20
1ix5yml,p0tatemoon,Hell yeah 🦾  Now I know for sure that Vistaprint workers must have their eyes on Kendu 👀 hahah,11,1740414458.0,2025-02-24 16:27:38
1ix5yml,they_call_me_mr_mac,🤣🤣 yeah  allready had a couple orders with Kendu stickers before,10,1740414608.0,2025-02-24 16:30:08
1ix5yml,phi_curious,We need to spam them with orders 😂,7,1740416062.0,2025-02-24 16:54:22
1ix5yml,they_call_me_mr_mac,🤣,4,1740417878.0,2025-02-24 17:24:38
1ix5yml,phi_curious,Hahahhaha yes! It’s been at least three of us 😁😁,8,1740416038.0,2025-02-24 16:53:58
1ix5yml,phi_curious,👀,6,1740416017.0,2025-02-24 16:53:37
1ix8on6,phi_curious,Let’s smash it hard. We need every vote.,13,1740421388.0,2025-02-24 18:23:08
1ix8on6,Sempre1908,Smashed!,10,1740421948.0,2025-02-24 18:32:28
1ix8on6,Scriptor87,Done…,7,1740426039.0,2025-02-24 19:40:39
1ix8on6,cringyusername_123,Smashed! Cmon peopleee,5,1740427932.0,2025-02-24 20:12:12
1ix8on6,strider1919,Done 🫡,5,1740428365.0,2025-02-24 20:19:25
1ix8on6,MetaStableZone,Done!,6,1740424704.0,2025-02-24 19:18:24
1ix8on6,SeeingTrends13,Smashed!,1,1740438737.0,2025-02-24 23:12:17
1ix4wme,NoArrival5732,"Done, great write up!",6,1740422289.0,2025-02-24 18:38:09
1ix4wme,phi_curious,Appreciate you! I’ll be back to that post later to reply on replies 😁,3,1740422357.0,2025-02-24 18:39:17
1ix4wme,BroskiNatanyahu,done smashing,6,1740435513.0,2025-02-24 22:18:33
1ix4wme,phi_curious,🙏🙏🙏,3,1740435540.0,2025-02-24 22:19:00
1ix4wme,insegniah1,Nice job chad,3,1740451592.0,2025-02-25 02:46:32
1ix4wme,phi_curious,Thank you! And thank you for smashing and commenting :),3,1740472328.0,2025-02-25 08:32:08
1ix05dt,phi_curious,thank you stat master 🫡🪖,8,1740398298.0,2025-02-24 11:58:18
1ix05dt,Agreeable_Compote_68,"I hope so, markets lookin’ nasty but I’m holding on",4,1740403458.0,2025-02-24 13:24:18
1ix05dt,TheGDC33,For real...,3,1740407096.0,2025-02-24 14:24:56
1iwxgky,insegniah1,"The answer to me is in our output.  During my time in Kendu I have watched countless communities and coins pop up and quickly after fade in to obscurity.  Yet here I stand, having celebrated our 1 year anniversary a few days ago, with a community that is growing day on and day out.  I can reflect on our past and achievements and see that what we have done here is truly special.  I am sat comfortably in this position I now hold knowing that I am positioned well for the bull run.  I cant deny that this sideways markets is agitating, but I know that the future is sweet.",14,1740386995.0,2025-02-24 08:49:55
1iwxgky,phi_curious,"Thanks for sharing your perspective :) As I tried to argue above, I think that the output is a logical consequence of the Kendu meme. It attracts personalities who are hard working and energetic, and those help propagate the meme.",9,1740387203.0,2025-02-24 08:53:23
1iwxgky,Libzors,All I understand is that Kendu is the best,10,1740388701.0,2025-02-24 09:18:21
1iwxgky,phi_curious,"![gif](giphy|glvyCVWYJ21fq|downsized)  Let’s be real, that’s all you gotta know 😁",9,1740389013.0,2025-02-24 09:23:33
1iwxgky,lennart1418,![gif](giphy|3o85xGrC7nPVbA2y3K)  Lets get the jeet genes out and the conviction genes in,9,1740386701.0,2025-02-24 08:45:01
1iwxgky,phi_curious,Haha that’s a good one 😁,8,1740388113.0,2025-02-24 09:08:33
1iwxgky,SatoshiSiren88,"Haha yes! Everytime I read something about what makes a coin succesful, it always makes me think of Kendu. We tick all the boxes!",6,1740404116.0,2025-02-24 13:35:16
1iwxgky,phi_curious,That’s kind of how I got the idea to write this article. I was curious why Kendu is so persistent in my mind. Glad you enjoyed!,4,1740410022.0,2025-02-24 15:13:42
1iwxgky,UrbanPKMonkey,Great write up! The community is like no other and killing it on a daily basis. KENDU is so undervalued right now… best load up some more,4,1740420241.0,2025-02-24 18:04:01
1iwxgky,phi_curious,Thank you legend!,1,1740524504.0,2025-02-25 23:01:44
1iwxgky,Liminal_Dogess,This is a quality post. Thank you. ,2,1740514384.0,2025-02-25 20:13:04
1iwxgky,phi_curious,Thank you for that 🧡 appreciate to know that someone enjoyed the read :),2,1740518440.0,2025-02-25 21:20:40
1iwxwnw,Expert-Detective-525,"Great posts these take a lot of time. We are aiming for 3 comments each(helps algorithm) We done 134 last time. It takes 5 mins max.  Remember Weak Separate, together STRONG",4,1740397514.0,2025-02-24 11:45:14
1iwxwnw,boathouse_floats,"Who The Fuk is building 2 games?!     ""2 games being developed, one of which will end up on Steam""",2,1740456371.0,2025-02-25 04:06:11
1iwxwnw,insegniah1,Yep.  Baba is producing a infinite runner game  And apparently we have a game crew of about 10 chads cooking an rpg like game,1,1740471648.0,2025-02-25 08:20:48
1iwxwxc,Expert-Detective-525,"Great posts these take a lot of time. We are aiming for 3 comments each(helps algorithm) We done 134 last time. It takes 5 mins max.   Remember Weak Separate, together STRONG",5,1740397458.0,2025-02-24 11:44:18
1iwxwxc,insegniah1,We shall outwork this horrible market,3,1740451585.0,2025-02-25 02:46:25
1iwx3xl,phi_curious,Come and join and help us build it up :)),6,1740384976.0,2025-02-24 08:16:16
1iwq7na,A_true_gENTleman,"""Forgot"" more like doesn't have a bag and only wants to shill his bags, and not give legitimacy to kendu.  But it's cool, we know. And we put in the work and help others learn!",26,1740361131.0,2025-02-24 01:38:51
1iwq7na,platniumperson,Murad has a large following so a lot of the holder growth is coming from him and his coins are VC backed. We've only got ourselves so all the growth is directly coming from our efforts. No KOLs/VCs coming to save us at Kendu.,16,1740361929.0,2025-02-24 01:52:09
1iwq7na,platniumperson,Deleted previous post because my maths was incorrect. Kendu is doing well in a sideways market. Shows how important onboarding IRLs is doing times of dead on-chain activity.,18,1740360646.0,2025-02-24 01:30:46
1iwq7na,TheGDC33,Their subreddit sometimes shows articles and I saw that and almost commented...would have been a quick van but worth it. Couldn't get the holder chart to work for me ironically,11,1740362034.0,2025-02-24 01:53:54
1iwq7na,bigboydesomo,Murad is only after the money he selled his soul already,8,1740374753.0,2025-02-24 05:25:53
1iwq7na,UrbanPKMonkey,KENDU doesn’t fit his narrative unfortunately.,2,1740400807.0,2025-02-24 12:40:07
1iwq7na,SatoshiSiren88,Kendu just keeps growing. Amazing! Keep up the good work Chads and Chadettes 😁,3,1740403832.0,2025-02-24 13:30:32
1iwulci,phi_curious,"how did the vote look when you posted it here, do you remember?",1,1740385140.0,2025-02-24 08:19:00
1iwm8ff,phi_curious,Vote vote vote,14,1740349221.0,2025-02-23 22:20:21
1iwm8ff,Expert-Detective-525,We need more Votes  ![gif](giphy|HFe8qjKRQNlLQkbjXM),11,1740349254.0,2025-02-23 22:20:54
1iwm8ff,DuschgelVonAxe,Done,11,1740349311.0,2025-02-23 22:21:51
1iwm8ff,Expert-Detective-525,Thank you !!!!  It is a massive help :),8,1740349352.0,2025-02-23 22:22:32
1iwm8ff,phi_curious,https://x.com/eacgrowth/status/1893636195822793000,10,1740349291.0,2025-02-23 22:21:31
1iwm8ff,phi_curious,"Scrap that, it works haha. L I’ll just leave the link anyways. More comments on your post.",10,1740349322.0,2025-02-23 22:22:02
1iwm8ff,Expert-Detective-525,Ok thanks for the help:),10,1740349388.0,2025-02-23 22:23:08
1iwm8ff,phi_curious,Looks like we are smashing it hard lol…let’s keep reminding people to vote. I’ll sleep soon and pick up tomorrow 🫡🫡,9,1740349704.0,2025-02-23 22:28:24
1iwm8ff,Expert-Detective-525,"Thanks, yeah I will be sleeping soon too. Thanks for the solid work Axl you always smash my stuff:)",9,1740349762.0,2025-02-23 22:29:22
1iwm8ff,phi_curious,"Yo thanks for that, trying my part to push this baby up up up 😁 and yeah, I do like to smash your stuff 😏😏",7,1740350881.0,2025-02-23 22:48:01
1iwm8ff,Expert-Detective-525,😏,2,1740381298.0,2025-02-24 07:14:58
1iwm8ff,strider1919,Done ✅,6,1740353191.0,2025-02-23 23:26:31
1iwm8ff,tokenKDN,Done - another W incoming for Kendu!,5,1740356612.0,2025-02-24 00:23:32
1iwm8ff,Barnickal,Let's FOOKING GOHHH!,5,1740358737.0,2025-02-24 00:58:57
1iwm8ff,p0tatemoon,+1 vote from meee,4,1740362778.0,2025-02-24 02:06:18
1iwm8ff,skillmattic,"✅️ however the link wasn't working...not sure if this one⬇️is, but done.  https://x.com/Eacgrowth/status/1893636195822793000?s=19",4,1740366288.0,2025-02-24 03:04:48
1iwm8ff,Vegas_42,Done✅,5,1740371352.0,2025-02-24 04:29:12
1iwgbwg,lennart1418,This is amazing. Glad someone posted this official holiday. Read about it recently but it wasnt on any social.,18,1740334665.0,2025-02-23 18:17:45
1iwgbwg,phi_curious,"if you can you should try to go next year. the songs were beautiful, ""*My Wife Left Me for a Fiat Maxi""* was quite remarkable as a story.",18,1740335298.0,2025-02-23 18:28:18
1iwgbwg,TheGDC33,This is just beautiful. I feel like I was there celebrating,16,1740334830.0,2025-02-23 18:20:30
1iwgbwg,phi_curious,The energy was unlike anything I have ever seen before. Everybody was so happy and proud that their country finally had some Kendu.,16,1740335341.0,2025-02-23 18:29:01
1iwgbwg,TheGDC33,🎊🥰🥳,8,1740354858.0,2025-02-23 23:54:18
1iwgbwg,they_call_me_mr_mac,🤣🤣🤣 love this.,14,1740335953.0,2025-02-23 18:39:13
1iwgbwg,phi_curious,"i appreciate that, hope you can zoom in on the pics and read the captions. for some reason it doesnt work on my phone, only on desktop.",11,1740336217.0,2025-02-23 18:43:37
1iwgbwg,they_call_me_mr_mac,Works fine on my phone.  Love the write up Phi. Guess next year Februari i'm travelling to North Korea for the festivities.😁,8,1740336433.0,2025-02-23 18:47:13
1iwgbwg,phi_curious,"perfect, thanks for the technical feed back too.   and yes, i would love to go again. but I am not sure if I am going to be welcomed again after reporting from this holiday so openly. sometimes they are a bit private.",9,1740337512.0,2025-02-23 19:05:12
1iwgbwg,they_call_me_mr_mac,"No worries,  sure Kim will welcome a Kendu hero like yourself with open arms.",8,1740337884.0,2025-02-23 19:11:24
1iwgbwg,phi_curious,"I will make him some Swiss food, like he remembers from his childhood here lmao",5,1740338062.0,2025-02-23 19:14:22
1iwgbwg,they_call_me_mr_mac,🤣🤣👌,7,1740339118.0,2025-02-23 19:31:58
1iwgbwg,phi_curious,looks like on mobile not all pic load. let me add them here with caption.  https://preview.redd.it/o5xbpth4kxke1.png?width=1071&amp;format=png&amp;auto=webp&amp;s=1d099cce9c859b73f12b90c06ec49a8fb27dc53d  A mother takes her daughter on a celebratory bike ride on Kendu Friendship Day.,10,1740334556.0,2025-02-23 18:15:56
1iwgbwg,phi_curious,"https://preview.redd.it/31zwi46ckxke1.png?width=4214&amp;format=png&amp;auto=webp&amp;s=48814c687fb6dabfffeed985ebda6579ec5fd423  Left: A North Korean woman, most likely, fantasizing about cooking breakfast bacon on Mike O’Hearn’s sizzling abs. Right: An ordinary North Korean family engaged in intercontinental ballistic missile spotting. Traditionally, missile launches on Kendu Friendship Day are accompanied by celebratory green smoke (patent pending) for good luck.",8,1740334649.0,2025-02-23 18:17:29
1iwgbwg,phi_curious,"https://preview.redd.it/1l2axo3gkxke1.png?width=742&amp;format=png&amp;auto=webp&amp;s=45a4a12691c9f475c038f42f22da2afbed46a5cc  A performance of the popular tune ""Wen Lambo?"" at the East Pyongyang Grand Theatre.",7,1740334666.0,2025-02-23 18:17:46
1iwgbwg,Zingultus,"Haha, hilarious. Such a great story.",9,1740338854.0,2025-02-23 19:27:34
1iwgbwg,phi_curious,It was touching. Usually the locals are shy and stick to themselves. But on Kendu Friendship Day they invited me to their homes and a few even took me to their favorite locations for ballistic missile spotting.,9,1740340872.0,2025-02-23 20:01:12
1iwgbwg,insegniah1,This is the best thing ive ever read lmao,6,1740350539.0,2025-02-23 22:42:19
1iwgbwg,phi_curious,Thank you! Happy you enjoyed  :) Took me a while to make all these pics. The woman cycling with all the propaganda pics was maybe a bit too much lol,6,1740350942.0,2025-02-23 22:49:02
1iwgbwg,SatoshiSiren88,Hahahaha love this!! 🤣🤣 Lets have our second anniversary in North Korea! 🥳,2,1740404231.0,2025-02-24 13:37:11
1iwgbwg,phi_curious,"You better learn the lyrics to ""My wife left me for a fiat maxi"" - I know the topic is a bit outdated, but it is still a very touching story.",1,1740408043.0,2025-02-24 14:40:43
